index,url,valid,domain,title,description,image,published,archive,content,quote,language,keyword
https://www.n-tv.de/leute/Robert-De-Niro-erschuettert-ueber-Tod-seines-Enkels-article24235159.html,https://www.n-tv.de/leute/Robert-De-Niro-erschuettert-ueber-Tod-seines-Enkels-article24235159.html,0,www.n-tv.de,Starb 19-Jähriger an Überdosis?: Robert De Niro erschüttert über Tod seines Enkels,"Hollywood-Star Robert De Niro zeigt sich nach dem Tod seines Enkelsohnes Leandro erschüttert und bittet darum, die Privatsphäre der Familie zu achten. Die Ermittler halten eine Überdosis als Todesursache des 19-Jährigen für möglich.",https://bilder3.n-tv.de/img/incoming/crop24235166/2381326440-cImg_16_9-w1200/imago0082775046h.jpg,2023-07-04T02:16:41Z,https://web.archive.org/web/20230704024835/https://www.n-tv.de/leute/Robert-De-Niro-erschuettert-ueber-Tod-seines-Enkels-article24235159.html,"Hollywood-Star Robert De Niro zeigt sich nach dem Tod seines Enkelsohnes Leandro erschüttert und bittet darum, die Privatsphäre der Familie zu achten. Die Ermittler halten eine Überdosis als Todesurs… [+2512 chars]",,de,'Tiffany Chen'
https://www.focus.de/kultur/kino_tv/robert-de-niro-aeussert-sich-erstmals-zum-tod-seines-enkels_id_198166233.html,https://www.focus.de/kultur/kino_tv/robert-de-niro-aeussert-sich-erstmals-zum-tod-seines-enkels_id_198166233.html,0,www.focus.de,„Ich bin tief betroffen“ - Robert De Niro äußert sich erstmals zum Tod seines Enkels,Robert De Niro trauert um seinen Enkel Leandro De Niro-Rodriguez. Nun hat sich der Hollywood-Star auch öffentlich zu dem zum plötzlichen Tod des 19-Jährigen geäußert.,https://p6.focus.de/img/kultur/kino_tv/id_198166227/nach-dem-tragischen-tod-seines-enkelsohns-leandro-hat-sich-nun-auch-robert-de-niro-bild-geaeussert..jpg?im=Crop%3D%280%2C0%2C1360%2C680%29%3BResize%3D%281200%2C627%29&impolicy=perceptual&quality=mediumHigh&hash=eaeac77f703eaaeba1a61668163143eed4b244b3de4add7b37b43c69f824463d,2023-07-04T07:10:07Z,https://web.archive.org/web/20230714062609/https://www.focus.de/kultur/kino_tv/robert-de-niro-aeussert-sich-erstmals-zum-tod-seines-enkels_id_198166233.html,Nach dem tragischen Tod seines 19-jährigen Enkels Leandro De Niro-Rodriguez hat sich nun auch Hollywoodstar Robert De Niro zu Wort gemeldet. Ich bin tief betroffen über den Tod meines geliebten Enkel… [+1374 chars],,de,'Tiffany Chen'
https://www.focus.de/finanzen/kommentar-sorry-frau-von-der-leyen-aber-die-200-milliarden-gehoeren-immer-noch-russland_id_198167294.html,https://www.focus.de/finanzen/kommentar-sorry-frau-von-der-leyen-aber-die-200-milliarden-gehoeren-immer-noch-russland_id_198167294.html,0,www.focus.de,"Kommentar - Sorry, Frau von der Leyen, aber die 200 Milliarden Euro gehören immer noch Russland","EU-Kommissionspräsidentin Ursula von der Leyen will mit russischem Geld, das die EU vorläufig beschlagnahmt hat, den Wiederaufbau der Ukraine finanzieren. Damit tritt sie aus moralischem Übereifer das Recht mit Füßen.Von Autor Oliver Stock",https://p6.focus.de/img/fotos/id_198167298/leyen.jpg?im=Crop%3D%280%2C0%2C3463%2C1732%29%3BResize%3D%281200%2C627%29&impolicy=perceptual&quality=mediumHigh&hash=bc7c0ca40b33b8af4f2174c401aab9a908df9994906f6277ee266340ed7f9198,2023-07-04T08:18:57Z,https://web.archive.org/web/20230704110954/https://www.focus.de/finanzen/kommentar-sorry-frau-von-der-leyen-aber-die-200-milliarden-gehoeren-immer-noch-russland_id_198167294.html,"EU-Kommissionspräsidentin Ursula von der Leyen will mit russischem Geld, das die EU vorläufig beschlagnahmt hat, den Wiederaufbau der Ukraine finanzieren. Damit tritt sie aus moralischem Übereifer da… [+2547 chars]",,de,'Ursula von der Leyen'
https://www.welt.de/politik/ausland/article246210262/Nato-Generalsekretaer-Jens-Stoltenberg-bleibt-bis-Oktober-2024-im-Amt.html,https://www.welt.de/politik/ausland/article246210262/Nato-Generalsekretaer-Jens-Stoltenberg-bleibt-bis-Oktober-2024-im-Amt.html,0,www.welt.de,Nato-Generalsekretär Stoltenberg bleibt bis Oktober 2024 im Amt,"Der 64-jährige Norweger Jens Stoltenberg ist mittlerweile seit fast neun Jahren Generalsekretär der Nato. Am Dienstag entschied das Bündnis, das sich auf keinen anderen Kandidaten einigen konnte, seine Amtszeit bis Anfang Oktober 2024 zu verlängern.",https://img.welt.de/img/politik/ausland/mobile246210280/7101359157-ci16x9-w1200/NATO-Chef-Stoltenberg-bei-EU-Gipfel-in-Bruessel.jpg,2023-07-04T10:03:45Z,,"Jens Stoltenberg soll ein weiteres Jahr Generalsekretär der Nato bleiben. Die Mitgliedstaaten hätten vereinbart, das Mandat des Norwegers bis zum 1. Oktober 2024 zu verlängern, teilte das Verteidigun… [+2475 chars]",,de,'Jens Stoltenberg'
https://www.n-tv.de/politik/Stoltenberg-bleibt-ein-weiteres-Jahr-NATO-Generalsekretaer-article24236282.html,https://www.n-tv.de/politik/Stoltenberg-bleibt-ein-weiteres-Jahr-NATO-Generalsekretaer-article24236282.html,0,www.n-tv.de,Verlängerung wider Willen: Stoltenberg bleibt ein weiteres Jahr NATO-Generalsekretär,"Eigentlich zieht es Jens Stoltenberg wieder zurück in seine Heimat, für den NATO-Vorsitz gibt es mehrere Kandidaten. Doch das Gremium kann sich auf niemanden einigen, sodass der Norweger noch ein Jahr dranhängt.",https://bilder1.n-tv.de/img/incoming/crop24236284/9681322755-cImg_16_9-w1200/415134526.jpg,2023-07-04T10:11:23Z,,"Eigentlich zieht es Jens Stoltenberg wieder zurück in seine Heimat, für den NATO-Vorsitz gibt es mehrere Kandidaten. Doch das Gremium kann sich auf niemanden einigen, sodass der Norweger noch ein Jah… [+2737 chars]",,de,'Pedro Sánchez'
https://www.bild.de/politik/inland/politik-inland/gefahr-ins-totalitaere-abzurutschen-palmer-keilt-gegen-luisa-neubauer-84569070.bild.html,https://www.bild.de/politik/inland/politik-inland/gefahr-ins-totalitaere-abzurutschen-palmer-keilt-gegen-luisa-neubauer-84569070.bild.html,0,www.bild.de,"„Gefahr, ins Totalitäre abzurutschen“ - Palmer keilt gegen Luisa Neubauer",Tübingens OB Boris Palmer geht in einem Brief auf Klimaaktivistin Neubauer los. Foto: Bernd Weißbrod/dpa,"https://images.bild.de/64a4893b2c07717882af795c/6d8c4706610950cfff5af36737bfdae6,5b6c6bd2?w=1280",2023-07-04T21:38:37Z,https://web.archive.org/web/20230704234933/https://www.bild.de/politik/inland/politik-inland/gefahr-ins-totalitaere-abzurutschen-palmer-keilt-gegen-luisa-neubauer-84569070.bild.html,"Eigentlich wollte es Tübingens Oberbürgermeister Boris Palmer (51) ruhiger angehen lassen, nach einer Auszeit allzu scharfe Kontroversen vermeiden. 
Doch das hat er offenbar nicht lange durchhalten.… [+2927 chars]",,de,'Boris Palmer'
https://www.focus.de/kultur/vermischtes/nadja-abd-el-farrag-sie-gibt-einblicke-in-zusammenarbeit-mit-patricia-blanco-ex_id_198235792.html,https://www.focus.de/kultur/vermischtes/nadja-abd-el-farrag-sie-gibt-einblicke-in-zusammenarbeit-mit-patricia-blanco-ex_id_198235792.html,0,www.focus.de,„Verliebt in die Liebe“ - Nadja Abd el Farrag gibt Einblicke in Zusammenarbeit mit Patricia Blancos Ex,"Nadja Abd el Farrag will sich als Sängerin versuchen und wird dabei von dem Ex von Patricia Blanco, Millionär Andreas Ellermann unterstützt. Nun hat sie einen Einblick in diese Zusammenarbeit gewährt.",https://p6.focus.de/img/regional/hamburg/id_11468222/compressed-9e6151b4-f3c9-4c6d-9f1c-b22fbce996e8.jpg?im=Crop%3D%280%2C0%2C1024%2C512%29%3BResize%3D%281200%2C627%29&impolicy=perceptual&quality=mediumHigh&hash=c4a9f6a6932e1f0250b7c29f043a63ab20641eb168a3514a8768ef627de945e8,2023-07-05T04:30:54Z,,"Nadja Abd el Farrag will sich als Sängerin versuchen und wird dabei von dem Ex von Patricia Blanco, Millionär Andreas Ellermann unterstützt. Nun hat sie einen Einblick in diese Zusammenarbeit gewährt… [+2233 chars]",,de,'Patricia Blanco'
https://www.bild.de/regional/hamburg/hamburg-aktuell/weil-sie-sich-weigert-auszuziehen-millionaer-ellermann-verkauft-villa-mit-blanco-84557844.bild.html,https://www.bild.de/regional/hamburg/hamburg-aktuell/weil-sie-sich-weigert-auszuziehen-millionaer-ellermann-verkauft-villa-mit-blanco-84557844.bild.html,0,www.bild.de,"Weil sie sich weigert, auszuziehen - Mit Blanco drin! Millionär verkauft Villa",Hamburg – Jetzt verscheuert Millionär Ellermann seine Villa. Um Patricia  Blanco loszuwerden. Nach der Trennung weigert sie sich aus seinem Haus auszuziehen.,"https://images.bild.de/64a3ca0be713d378fba707bb/41e2fa4b129d78f748fc77884fa2ee45,b027b99c?w=1280",2023-07-05T07:50:18Z,https://web.archive.org/web/20230705175413/https://www.bild.de/regional/hamburg/hamburg-aktuell/weil-sie-sich-weigert-auszuziehen-millionaer-ellermann-verkauft-villa-mit-blanco-84557844.bild.html,"Hamburg Jetzt verscheuert er seine Villa. Und die Blanco gleich mit ...
Multimillionär und Entertainer Andreas Ellermann (57) hat sich nach vier Jahren Beziehung von seiner Verlobten getrennt Realit… [+2646 chars]",,de,'Patricia Blanco'
https://www.kino.de/film/killers-of-the-flower-moon-2022/news/allein-der-neue-trailer-zum-200-millionen-dollar-western-mit-leonardo-dicaprio-ist-ein-meisterwerk/,https://www.kino.de/film/killers-of-the-flower-moon-2022/news/allein-der-neue-trailer-zum-200-millionen-dollar-western-mit-leonardo-dicaprio-ist-ein-meisterwerk/,0,www.kino.de,Allein der neue Trailer zum 200-Millionen-Dollar-Western mit Leonardo DiCaprio ist ein Meisterwerk,Apple hat einen neuen Trailer zum kommenden starbesetzten Westerndrama „Killers of the Flower Moon“ von Meisterregisseur Martin Scorsese veröffentlicht.,https://crops.giga.de/08/08/77/c7fe6cb7c1fec2d61a703c6c72_YyAyOTg3eDE2ODArNysyMTgCcmUgMTkyMCAxMDgwAzA4Y2ViMWM2N2M3.jpg,2023-07-05T14:34:13Z,,"Apple hat einen neuen Trailer zum kommenden starbesetzten Westerndrama „Killers of the Flower Moon“ von Meisterregisseur Martin Scorsese veröffentlicht.
Aktuell kursiert ein Zitat von Filmemacher Ma… [+4330 chars]",,de,'Steven Spielberg'
https://www.focus.de/kultur/stars/prominente-hausbesetzerin-muss-raus-ellermann-verkauft-villa-und-patricia-blanco-gleich-mit_id_198303358.html,https://www.focus.de/kultur/stars/prominente-hausbesetzerin-muss-raus-ellermann-verkauft-villa-und-patricia-blanco-gleich-mit_id_198303358.html,0,www.focus.de,Prominente „Hausbesetzerin“ - Andreas Ellermann verkauft Villa – und Patricia Blanco gleich mit,Patricia Blanco und Andreas Ellermann gehen wieder getrennte Wege. In Sachen Wohnungssuche haben beide allerdings andere Ansichten.,https://p6.focus.de/img/fotos/id_194498432/patricia-blanco-und-andreas-ellermann.png?im=Crop%3D%280%2C0%2C3464%2C1732%29%3BResize%3D%281200%2C627%29&impolicy=perceptual&quality=mediumHigh&hash=5b7cf27db38f63c014f1f6662e9026a8d1a24e61601f23163f829966cad27b79,2023-07-05T19:39:30Z,,Sie macht ihrem Ex angeblich das Leben schwer: Millionär Andreas Ellermann (58) verließ gerade entgültig seine nun Ex Patricia Blanco (56) und schon wartet das nächste Problem. Der Reality-Star will … [+1966 chars],,de,'Patricia Blanco'
https://www.stern.de/lifestyle/leute/robert-de-niro--daran-ist-sein-enkel-gestorben-33625808.html,https://www.stern.de/lifestyle/leute/robert-de-niro--daran-ist-sein-enkel-gestorben-33625808.html,0,www.stern.de,Robert De Niro: Daran ist sein Enkel gestorben,"Die Tochter von Robert De Niro hat enthüllt, woran ihr 19-jähriger Sohn gestorben ist. Demnach hatten ihm Dealer gepanschte Pillen verkauft.",https://image.stern.de/33625812/t/ro/v1/w1440/r1.7778/-/06--daran-ist-sein-enkel-gestorben---16-9---spoton-article-1048103.jpg,2023-07-06T11:23:00Z,https://web.archive.org/web/20230714062527/https://www.stern.de/lifestyle/leute/robert-de-niro--daran-ist-sein-enkel-gestorben-33625808.html,"Die Tochter von Robert De Niro hat enthüllt, woran ihr 19-jähriger Sohn gestorben ist. Demnach hatten ihm Dealer gepanschte Pillen verkauft.
Der Enkel von Hollywoodstar Robert De Niro (79) ist offen… [+2114 chars]",,de,'Robert De Niro'
https://www.brigitte.de/aktuell/robert-de-niro--todesursache-seines-enkels-enthuellt-13553180.html,https://www.brigitte.de/aktuell/robert-de-niro--todesursache-seines-enkels-enthuellt-13553180.html,0,www.brigitte.de,Robert De Niro: Todesursache seines Enkels enthüllt,"Die Tochter von Robert De Niro hat enthüllt, woran ihr 19-jähriger Sohn gestorben ist. Demnach hatten ihm Dealer gepanschte Pillen verkauft.",https://image.brigitte.de/13553182/t/fX/v1/w1440/r1.7778/-/06--todesursache-seines-enkels-enthuellt---1-1---spoton-article-1048103.jpg,2023-07-06T11:28:00Z,https://web.archive.org/web/20230714062442/https://www.brigitte.de/aktuell/robert-de-niro--todesursache-seines-enkels-enthuellt-13553180.html,"Die Tochter von Robert De Niro hat enthüllt, woran ihr 19-jähriger Sohn gestorben ist. Demnach hatten ihm Dealer gepanschte Pillen verkauft.
Der Enkel von Hollywoodstar Robert De Niro (79) ist offen… [+2114 chars]",,de,'Robert de Niro'
https://www.stern.de/lifestyle/leute/robert-de-niro--daran-ist-sein-enkel-leandro-gestorben-33625808.html,https://www.stern.de/lifestyle/leute/robert-de-niro--daran-ist-sein-enkel-leandro-gestorben-33625808.html,0,www.stern.de,Hollywoodstar: Robert De Niro: Daran ist sein Enkel Leandro gestorben,Mit nur 19 Jahren ist der Enkel von Schauspieler Robert De Niro gestorben. Die Mutter des Jungen hat sich nun auf Instagram zur Todesursache geäußert.,https://image.stern.de/33625812/t/Jz/v2/w1440/r1.7778/-/06--daran-ist-sein-enkel-gestorben---16-9---spoton-article-1048103.jpg,2023-07-06T13:15:00Z,https://web.archive.org/web/20230714062317/https://www.stern.de/lifestyle/leute/robert-de-niro--daran-ist-sein-enkel-leandro-gestorben-33625808.html,"Mit nur 19 Jahren ist der Enkel von Schauspieler Robert De Niro gestorben. Die Mutter des Jungen hat sich nun auf Instagram zur Todesursache geäußert.
Schauspieler Robert De Niro trauert um seinen E… [+1981 chars]",,de,'Robert De Niro'
https://www.n-tv.de/leute/Robert-De-Niros-Enkel-starb-an-Tabletten-article24243094.html,https://www.n-tv.de/leute/Robert-De-Niros-Enkel-starb-an-Tabletten-article24243094.html,0,www.n-tv.de,Mit Fentanyl gepanscht: Robert De Niros Enkel starb an Tabletten,"Leandro, Sohn von Robert De Niros Adoptivtochter Drena, wurde nur 19 Jahre alt. Nun gibt die Mutter bekannt, woran er gestorben sein soll. Dem Nachwuchsschauspieler wurden demnach verunreinigte Tabletten zum Verhängnis.",https://bilder2.n-tv.de/img/incoming/crop24243121/2731328815-cImg_16_9-w1200/imago0257253826h.jpg,2023-07-06T17:42:50Z,https://web.archive.org/web/20230714062157/https://www.n-tv.de/leute/Robert-De-Niros-Enkel-starb-an-Tabletten-article24243094.html,"Leandro, Sohn von Robert De Niros Adoptivtochter Drena, wurde nur 19 Jahre alt. Nun gibt die Mutter bekannt, woran er gestorben sein soll. Dem Nachwuchsschauspieler wurden demnach verunreinigte Table… [+2967 chars]",,de,'Robert de Niro'
https://www.focus.de/panorama/welt/oceangate-stellt-nach-titan-tragoedie-saemtliche-touren-und-aktivitaeten-ein_id_198387612.html,https://www.focus.de/panorama/welt/oceangate-stellt-nach-titan-tragoedie-saemtliche-touren-und-aktivitaeten-ein_id_198387612.html,0,www.focus.de,Titanic-Tauchgänge - OceanGate stellt nach Titan-Tragödie sämtliche Touren und Aktivitäten ein,"Das Unternehmen „OceanGate“ hat angekündigt, sämtliche Erkundungstouren und kommerzielle Aktivitäten einzustellen. Im Juni sind fünf Menschen, darunter CEO Stockton Rush, bei einem tragischen Unfall des Tauchbootes „Titan“ auf dem Weg zum Schiffswrack der „Ti…",https://p6.focus.de/img/fotos/id_197162974/5fadac00d7a74527.jpg?im=Crop%3D%280%2C281%2C3000%2C1500%29%3BResize%3D%281200%2C627%29&impolicy=perceptual&quality=mediumHigh&hash=533e8a1ba9125bb8c549c9e07f8de2339cdfd26813630d986c31bb6aafc52bbf,2023-07-06T18:06:06Z,,"<ul><li>
Kommentare</li><li>
E-Mail</li><li>
Teilen</li><li>
Mehr</li><li>
Twitter</li><li>
Drucken</li><li>
Feedback</li><li>
Fehler meldenSie haben einen Fehler gefunden?
Bitte markieren S… [+1748 chars]",,de,'Stockton Rush'
https://www.stern.de/politik/ausland/joe-biden--sein-skandalsohn-hunter-und-das-kokain-im-weissen-haus-33627088.html,https://www.stern.de/politik/ausland/joe-biden--sein-skandalsohn-hunter-und-das-kokain-im-weissen-haus-33627088.html,0,www.stern.de,"US-Wahlkampf: Joe Biden, sein Skandalsohn Hunter und das Kokain im Weißen Haus",Donald Trump will seinen Amtsnachfolger und dessen Sohn persönlich für den Drogenfund im Westflügel verantwortlich machen. Dahinter steckt eine Wahlkampfstrategie des Republikaners – für Joe Biden könnte das ungemütlich werden.,https://image.stern.de/33627112/t/Hz/v2/w1440/r1.7778/-/joe-und-hunter-biden.jpg,2023-07-07T04:13:00Z,,Von wem stammte das Kokain? Wer hatte Zugang zum Westflügel im Weißen Haus? Wo waren der Präsident und seine Familie als die Drogen gefunden wurden? Das Team von Joe Biden muss in diesen Tagen viele … [+292 chars],,de,'Hunter Biden'
https://www.stern.de/lifestyle/leute/christian-lindner-und-franca-lehfeldt--das-paar-feiert-ersten-hochzeitstag-33627882.html,https://www.stern.de/lifestyle/leute/christian-lindner-und-franca-lehfeldt--das-paar-feiert-ersten-hochzeitstag-33627882.html,0,www.stern.de,Christian Lindner und Franca Lehfeldt: Das Paar feiert ersten Hochzeitstag,Vor einem Jahr gaben sich Christian Lindner und Franca Lehfeldt auf Sylt das Jawort und sorgten damit für jede Menge Medienrummel.,https://image.stern.de/33627886/t/6M/v1/w1440/r1.7778/-/07--das-paar-feiert-ersten-hochzeitstag---16-9---spoton-article-1047521.jpg,2023-07-07T06:02:00Z,,"Vor einem Jahr gaben sich Christian Lindner und Franca Lehfeldt auf Sylt das Jawort und sorgten damit für jede Menge Medienrummel.
Was macht eigentlich die Ehe von Christian Lindner (44)? Der Bundes… [+4651 chars]",,de,'Edmund Stoiber'
https://www.focus.de/kultur/vermischtes/jawort-auf-sylt-christian-lindner-und-franca-lehfeldt-feiern-ihren-ersten-hochzeitstag_id_198432617.html,https://www.focus.de/kultur/vermischtes/jawort-auf-sylt-christian-lindner-und-franca-lehfeldt-feiern-ihren-ersten-hochzeitstag_id_198432617.html,0,www.focus.de,Große Hochzeit auf Sylt - Christian Lindner und Franca Lehfeldt sind bereits seit einem Jahr verheiratet,Vor genau einem Jahr sorgten Christian Lindner und Franca Lehfeldt für etliche Schlagzeilen. Damals gaben sie sich auf Sylt das Jawort.,https://p6.focus.de/img/kultur/vermischtes/id_198432589/christian-lindner-und-franca-lehfeldt-strahlen-bei-der-bertelsmann-party-2023-im-juni-in-die-kamera..jpg?im=Crop%3D%280%2C125%2C1000%2C500%29%3BResize%3D%281200%2C627%29&impolicy=perceptual&quality=mediumHigh&hash=4a7900de1703f471327664ec73c5a7f72bf8f7730e88f7dcea8679547df4d5c7,2023-07-07T06:05:04Z,,Was macht eigentlich die Ehe von Christian Lindner (44)? Der Bundesfinanzminister sowie FDP-Chef und die Journalistin Franca Lehfeldt (33) haben am 7. Juli 2022 auf der Nordseeinsel Sylt geheiratet. … [+4602 chars],,de,'Edmund Stoiber'
https://www.brigitte.de/aktuell/christian-lindner-und-franca-lehfeldt--vor-einem-jahr-gab-sich-das-paar-das-jawort-13553726.html,https://www.brigitte.de/aktuell/christian-lindner-und-franca-lehfeldt--vor-einem-jahr-gab-sich-das-paar-das-jawort-13553726.html,0,www.brigitte.de,Christian Lindner und Franca Lehfeldt: Vor einem Jahr gab sich das Paar das Jawort,Vor einem Jahr gaben sich Christian Lindner und Franca Lehfeldt auf Sylt das Jawort und sorgten damit für jede Menge Medienrummel.,https://image.brigitte.de/13553728/t/n8/v1/w1440/r1.7778/-/07--vor-einem-jahr-gab-sich-das-paar-das-jawort---1-1---spoton-article-1047521.jpg,2023-07-07T06:06:00Z,,"Vor einem Jahr gaben sich Christian Lindner und Franca Lehfeldt auf Sylt das Jawort und sorgten damit für jede Menge Medienrummel.
Was macht eigentlich die Ehe von Christian Lindner (44)? Der Bundes… [+4651 chars]",,de,'Edmund Stoiber'
https://www.zeit.de/campus/2023-07/bafoeg-kuerzung-bundesbildungsministerin-bettina-stark-watzinger,https://www.zeit.de/campus/2023-07/bafoeg-kuerzung-bundesbildungsministerin-bettina-stark-watzinger,0,www.zeit.de,Bundeshaushalt 2024: Bettina Stark-Watzinger widerspricht Berichten über Bafög-Kürzung,"Weil im Bundeshaushalt weniger Mittel für das Bafög vorgesehen sind, entsteht der Eindruck, die Leistung werde gekürzt. Die Bundesbildungsministerin klärt auf.",,2023-07-07T12:37:05Z,http://archive.md/20230707131442/https://www.zeit.de/campus/2023-07/bafoeg-kuerzung-bundesbildungsministerin-bettina-stark-watzinger,"When browsing with ads:
We collect personal data and also transmit it to third-party providers
 that help us improve and finance our digital content. Some of the information stored on your device, … [+821 chars]",,de,'Bettina Stark-Watzinger'
https://www.n-tv.de/leute/Christian-Lindner-feiert-Hochzeitstag-article24245104.html,https://www.n-tv.de/leute/Christian-Lindner-feiert-Hochzeitstag-article24245104.html,0,www.n-tv.de,"""Liebe steht an erster Stelle"": Christian Lindner feiert Hochzeitstag",Als Bundesfinanzminister in der Ampel-Koalition hat Christian Lindner derzeit sicher ausreichend zu tun. Dennoch dürfte er sich nun mal ein paar Stunden Zeit abseits vom politischen Geschäft nehmen. Schließlich feiert er mit seiner Frau Franca Lehfeldt ersten…,https://bilder2.n-tv.de/img/incoming/crop24245105/7321327813-cImg_16_9-w1200/imago0260204783h.jpg,2023-07-07T13:20:13Z,,Als Bundesfinanzminister in der Ampel-Koalition hat Christian Lindner derzeit sicher ausreichend zu tun. Dennoch dürfte er sich nun mal ein paar Stunden Zeit abseits vom politischen Geschäft nehmen. … [+4183 chars],,de,'Christian Lindner'
https://www.stern.de/lifestyle/leute/nadja-abd-el-farrag--naddel-plant-ihr-comeback-beim-schlagermove-33628270.html,https://www.stern.de/lifestyle/leute/nadja-abd-el-farrag--naddel-plant-ihr-comeback-beim-schlagermove-33628270.html,0,www.stern.de,Hamburg: Hossa! Naddel plant ihr Comeback auf dem Schlagermove,Zuletzt war es still geworden um Nadja Abd el Farrag. Doch am Wochenende feiert Naddel ein fulminantes Comeback: Zusammen mit Andreas Ellermann wird sie auf dem Schlagermove auftreten - und einen Rex-Gildo-Klassiker zum Besten geben.,https://image.stern.de/33628814/t/AI/v3/w1440/r1.7778/-/naddel-andreas-ellermann.jpg,2023-07-07T13:50:00Z,,Zuletzt war es still geworden um Nadja Abd el Farrag. Doch am Wochenende feiert Naddel ein fulminantes Comeback: Zusammen mit Andreas Ellermann wird sie auf dem Schlagermove auftreten - und einen Rex… [+2011 chars],,de,'Nadja Abd el Farrag'
https://www.tagesspiegel.de/berlin/pride-weeks-in-berlin-kai-wegner-hisst-regenbogenflagge-vor-dem-rotem-rathaus-10121245.html,https://www.tagesspiegel.de/berlin/pride-weeks-in-berlin-kai-wegner-hisst-regenbogenflagge-vor-dem-rotem-rathaus-10121245.html,0,www.tagesspiegel.de,Pride Weeks in Berlin: Kai Wegner hisst Regenbogenflagge vor dem Rotem Rathaus,In knapp zwei Wochen steht die große Christopher-Street-Day-Parade in Berlin an. Anlässlich der Pride Weeks wurde nun vor dem Roten Rathaus wieder die Regenbogenflagge gehisst.,https://www.tagesspiegel.de/images/beginn-der-pride-weeks-in-berlin/alternates/BASE_16_9_W1400/beginn-der-pride-weeks-in-berlin.jpeg,2023-07-10T11:54:14Z,https://web.archive.org/web/20230716074320/https://www.tagesspiegel.de/berlin/pride-weeks-in-berlin-kai-wegner-hisst-regenbogenflagge-vor-dem-rotem-rathaus-10121245.html,Die Regenbogenflagge weht wieder vor dem Roten Rathaus in Berlin: Aus Anlass der Pride Weeks hat Berlins Regierender Bürgermeister Kai Wegner (CDU) die Flagge am Montagmorgen gehisst. Berlin ist die … [+1925 chars],,de,'Axel Springer'
https://www.welt.de/politik/ausland/article246324122/Nato-Gipfel-Praesident-Duda-erwartet-keine-formelle-Einladung-an-die-Ukraine.html,https://www.welt.de/politik/ausland/article246324122/Nato-Gipfel-Praesident-Duda-erwartet-keine-formelle-Einladung-an-die-Ukraine.html,0,www.welt.de,Duda erwartet bei Nato-Gipfel keine formelle Einladung an Kiew,Polens Präsident Andrzej Duda hofft langfristig auf eine Nato-Mitgliedschaft der Ukraine. Vom Gipfel des Bündnisses in Vilnius erwartet er aber kein Signal für die Aufnahme. Stattdessen könnte sich Kiew mit einem formellen Schritt zufriedengeben müssen.,https://img.welt.de/img/bildergalerien/mobile246324120/7231355727-ci16x9-w1200/Ukraine-s-President-Zelenskiy-and-Polish-President-Duda-attend-a.jpg,2023-07-10T17:30:35Z,,Auf dem Nato-Gipfel am Dienstag in Vilnius werden der Beitrittswunsch der Ukraine und mögliche Sicherheitsgarantien das bestimmende Thema sein. Nach Einschätzung des polnischen Präsidenten Andrzej Du… [+2630 chars],,de,'Axel Springer'
https://www.kino.de/film/killers-of-the-flower-moon-2022/news/schon-der-trailer-ein-meisterwerk-200-millionen-western-mit-leonardo-dicaprio-ist-kinopflicht/,https://www.kino.de/film/killers-of-the-flower-moon-2022/news/schon-der-trailer-ein-meisterwerk-200-millionen-western-mit-leonardo-dicaprio-ist-kinopflicht/,0,www.kino.de,Schon der Trailer ein Meisterwerk: 200-Millionen-Western mit Leonardo DiCaprio ist Kinopflicht,Apple hat einen neuen Trailer zum kommenden starbesetzten Westerndrama „Killers of the Flower Moon“ von Meisterregisseur Martin Scorsese veröffentlicht.,https://crops.giga.de/08/08/77/c7fe6cb7c1fec2d61a703c6c72_YyAyOTg3eDE2ODArNysyMTgCcmUgMTkyMCAxMDgwAzA4Y2ViMWM2N2M3.jpg,2023-07-11T14:34:13Z,,"Apple hat einen neuen Trailer zum kommenden starbesetzten Westerndrama „Killers of the Flower Moon“ von Meisterregisseur Martin Scorsese veröffentlicht.
Aktuell kursiert ein Zitat von Filmemacher Ma… [+4330 chars]",,de,'Leonardo DiCaprio'
