index,url,valid,domain,title,description,image,published,archive,content,quote,language,keyword
https://www.brigitte.de/aktuell/-the-substance--star-margaret-qualley--deshalb-musste-ihr-gesicht-weggeschnitten-werden-13932082.html,https://www.brigitte.de/aktuell/-the-substance--star-margaret-qualley--deshalb-musste-ihr-gesicht-weggeschnitten-werden-13932082.html,0,www.brigitte.de,"""The Substance""-Star Margaret Qualley: Deshalb musste ihr Gesicht weggeschnitten werden","Mit starker Akne hatte Schauspielerin Margaret Qualley nach dem Dreh von ""The Substance"" zu kämpfen, wie sie nun verriet.",https://image.brigitte.de/13932084/t/zJ/v1/w1440/r1.7778/-/15--deshalb-musste-ihr-gesicht-weggeschnitten-werden---1-1---spoton-article-1084255.jpg,2025-01-15T07:24:00Z,,"Mit starker Akne hatte Schauspielerin Margaret Qualley nach dem Dreh von ""The Substance"" zu kämpfen, wie sie nun verriet.
Dass man als Schauspielerin auch Opfer bringen muss, hat ""The Substance""-Sta… [+1790 chars]",,de,'Margaret Qualley'
https://www.stern.de/lifestyle/leute/taylor-swift--sie-plant-anbau-fuer-villa-in-rhode-island-35382174.html,https://www.stern.de/lifestyle/leute/taylor-swift--sie-plant-anbau-fuer-villa-in-rhode-island-35382174.html,0,www.stern.de,Taylor Swift: Sie plant Anbau für Villa in Rhode Island,Taylor Swift schmeißt auf ihrem Luxus-Anwesen in Rhode Island gerne Partys mit vielen Promi-Freunden. Dafür benötigt sie wohl mehr Platz.,https://image.stern.de/35382178/t/8O/v1/w1440/r1.7778/-/15--sie-plant-anbau-fuer-villa-in-rhode-island---16-9---spoton-article-1084263.jpg,2025-01-15T09:16:00Z,,"Kopiere den aktuellen Link
Taylor Swift schmeißt auf ihrem Luxus-Anwesen in Rhode Island gerne Partys mit vielen Promi-Freunden. Dafür benötigt sie wohl mehr Platz.
Taylor Swift (35) soll sich nach… [+1905 chars]",,de,'Travis Kelce'
https://www.focus.de/kultur/kino_tv/kaulitz-brueder-fordern-kurz-vor-start-vom-dschungelcamp-rtl-ruft-uns-an_9a0d77fd-1dda-43ec-8353-2a230ab53d0a.html,https://www.focus.de/kultur/kino_tv/kaulitz-brueder-fordern-kurz-vor-start-vom-dschungelcamp-rtl-ruft-uns-an_9a0d77fd-1dda-43ec-8353-2a230ab53d0a.html,0,www.focus.de,"""Schlechtes Casting gemacht"" - Kurz vor Dschungelcamp-Start fordern die Kaulitz-Brüder: ""RTL, ruft uns an!""",Im gemeinsamen Podcast wenden sich der Tokio-Hotel-Sänger Bill und sein Bruder Tom Kaulitz an RTL – und bringen sich selbst fürs Dschungelcamp ins Spiel.,https://quadro.burda-forward.de/ctf/c4ff0db1-c6c2-4646-a8af-56ad65521365.069b0892-6228-43f2-b5ae-31288542340d.jpeg?im=RegionOfInterestCrop%3D%281200%2C630%29%2CregionOfInterest%3D%281218%2C493%29&hash=679df12f1789164389fcc5c3562e0393d3413bccc723703c03c1c1e2ba4f99bb,2025-01-15T09:26:00Z,https://web.archive.org/web/20250115172636/https://www.focus.de/kultur/kino_tv/kaulitz-brueder-fordern-kurz-vor-start-vom-dschungelcamp-rtl-ruft-uns-an_9a0d77fd-1dda-43ec-8353-2a230ab53d0a.html,"Zum Jahresanfang will sich Bill Kaulitz in Dankbarkeit üben - mit einer Ausnahme. ""Worüber ich gar nicht dankbar bin, sind die Dschungelcamp-Kandidaten"", meckert der Sänger in der aktuellen Folge des… [+2264 chars]",,de,'Heidi Klum'
https://www.n-tv.de/leute/Taylor-Swift-vergroessert-ihr-Anwesen-article25489807.html,https://www.n-tv.de/leute/Taylor-Swift-vergroessert-ihr-Anwesen-article25489807.html,0,www.n-tv.de,Acht Schlafzimmer reichen nicht: Taylor Swift vergrößert ihr Anwesen,"Man gönnt sich ja sonst nichts: Taylor Swift soll sich eine Genehmigung geholt haben, um ihr Luxusanwesen auf Rhode Island noch einmal ordentlich zu pimpen. Anscheinend braucht sie noch mehr Platz in ihrer Villa. Die Umbaukosten in Millionenhöhe dürften sie d…",https://bilder4.n-tv.de/img/incoming/crop25489827/6401321614-cImg_16_9-w1200/496838831.jpg,2025-01-15T10:10:09Z,,"Man gönnt sich ja sonst nichts: Taylor Swift soll sich eine Genehmigung geholt haben, um ihr Luxusanwesen auf Rhode Island noch einmal ordentlich zu pimpen. Anscheinend braucht sie noch mehr Platz in… [+2213 chars]",,de,'Travis Kelce'
https://www.stern.de/gesellschaft/regional/berlin-brandenburg/landwirtschaft--oezdemir-setzt-auf-weitere-seuchen-eindaemmung-35382550.html,https://www.stern.de/gesellschaft/regional/berlin-brandenburg/landwirtschaft--oezdemir-setzt-auf-weitere-seuchen-eindaemmung-35382550.html,0,www.stern.de,Landwirtschaft: Özdemir setzt auf weitere Seuchen-Eindämmung,Berlin - Bundesagrarminister Cem Özdemir setzt auf eine weitere strikte Eindämmung der Maul- und Klauenseuche in Deutschland und will die Folgen für die,https://image.stern.de/35382552/t/vu/v1/w1440/r1.7778/-/15--ywc2qlzpmkv4axs2048jpeg---03010268685d6baa.jpg,2025-01-15T10:15:37Z,,"Kopiere den aktuellen Link
Für die deutsche Tierhaltung gilt der Krisenmodus: Nach dem Ausbruch der Maul- und Klauenseuche lautet das Ziel, Schäden zu minimieren.
Bundesagrarminister Cem Özdemir se… [+2572 chars]",,de,'Cem Özdemir'
https://www.dw.com/de/kuba-k%C3%BCndigt-freilassung-von-553-gefangenen-an/a-71298672,https://www.dw.com/de/kuba-k%C3%BCndigt-freilassung-von-553-gefangenen-an/a-71298672,0,www.dw.com,Kuba kündigt Freilassung von 553 Gefangenen an,Im Hintergrund hatte der Vatikan als Vermittler gewirkt: Schon 2023 war Papst Franziskus mit dem kubanischen Präsidenten zusammengetroffen. Zuletzt waren die USA am Zug.,https://static.dw.com/image/71299319_6.jpg,2025-01-15T11:59:00Z,,"Kuba hat die Freilassung von 553 Häftlingen angekündigt, nachdem die USA in Aussicht gestellt hatten, den kommunistischen Karibikstaat von der US-Terrorliste zu streichen. Außenminister Bruno Rodrígu… [+3313 chars]",,de,'Papst Franziskus'
https://www1.wdr.de/nachrichten/ursula-von-der-leyen-bekommt-den-aachener-karlspreis-100.html,https://www1.wdr.de/nachrichten/ursula-von-der-leyen-bekommt-den-aachener-karlspreis-100.html,0,www1.wdr.de,EU-Kommissionspräsidentin von der Leyen erhält Aachener Karlspreis,<strong>Die Präsidentin der Europäischen Kommission - Ursula von der Leyen - wird in diesem Jahr mit dem Internationalen Karlspreis zu Aachen ausgezeichnet. Das hat das Karlspreis-Direktorium am Mittag bekannt gegeben.</strong>,https://images.tagesschau.de/image/d3325510-1148-4a76-b072-f56c9cb9f99c/AAABlGnV26o/AAABkZLhkrw/16x9-1280/wdr-ursula-von-der-leyen-erhaelt-den-internationalen-karlspreis-100.jpg,2025-01-15T12:30:04Z,https://web.archive.org/web/20250115135513/https://www1.wdr.de/nachrichten/ursula-von-der-leyen-bekommt-den-aachener-karlspreis-100.html,"Stand: 15.01.2025 13:30 Uhr
Die Präsidentin der Europäischen Kommission - Ursula von der Leyen - wird in diesem Jahr mit dem Internationalen Karlspreis zu Aachen ausgezeichnet. Das hat das Karlsprei… [+3885 chars]",,de,'Helmut Kohl'
https://www.zeit.de/2025/03/hilfe-ukraine-militaer-gruene-spd-streit,https://www.zeit.de/2025/03/hilfe-ukraine-militaer-gruene-spd-streit,0,www.zeit.de,Hilfe für die Ukraine: Suche nach drei Milliarden,"Die Grünen wollen mehr Geld für die Ukraine ausgeben, Olaf Scholz stellt sich quer. Was steckt hinter dem Streit um die Ausweitung der militärischen Unterstützung?",https://img.zeit.de/2025/03/suche-nach-3-milliarden-bild-2/wide__1300x731,2025-01-15T13:12:26Z,http://archive.md/20250115131611/https://www.zeit.de/2025/03/hilfe-ukraine-militaer-gruene-spd-streit,"Bekommt die Ukraine aus Deutschland die Unterstützung, die sie dringend braucht? Und: Kann oder will der Bundeskanzler sie überhaupt leisten? Darüber ist in der verbliebenen Koalition aus SPD und Grü… [+767 chars]",,de,'Olaf Scholz'
https://www.bild.de/unterhaltung/stars-und-leute/taylor-swifts-luxus-villa-sie-baut-an-etwa-ein-kinderzimmer-67878493e1c7ef2d914ca4ff,https://www.bild.de/unterhaltung/stars-und-leute/taylor-swifts-luxus-villa-sie-baut-an-etwa-ein-kinderzimmer-67878493e1c7ef2d914ca4ff,0,www.bild.de,Luxus-Villa zu klein - Taylor Swift baut sich neuntes Schlafzimmer,"Die Sängerin plant einen weiteren Flügel für ihre Luxus-Villa in Rhode Island, wo sie legendäre Partys mit Hollywood-Stars schmeißt.","https://images.bild.de/67878493e1c7ef2d914ca4ff/2196dfea2e75c13532367b4b55782bba,ff6a7984?w=1280",2025-01-15T20:53:29Z,,"Taylor Swift machte sich mit ihrer Eras-Tour letztes Jahr zur Milliardärin und investiert einen Teil der Kohle in ihr Feriendomizil!
Im US-Bundesstaat Rhode Island steht das Party-Haus der Pop-Sänge… [+3563 chars]",,de,'Travis Kelce'
https://www.stern.de/news/trump-will-bau-neuer-windraeder-in-den-usa-unterbinden-35384726.html,https://www.stern.de/news/trump-will-bau-neuer-windraeder-in-den-usa-unterbinden-35384726.html,0,www.stern.de,Trump will Bau neuer Windräder in den USA unterbinden,"Der designierte US-Präsident Donald Trump will nach eigenen Worten während seiner neuen Amtszeit den Bau neuer Windräder in den Vereinigten Staaten komplett unterbinden. Windturbinen seien ein ""ökonomisches und ökologisches Desaster"", schrieb Trump am Mittwoc…",https://image.stern.de/35384728/t/JF/v1/w1440/r1.7778/-/15--windraeder-im--usbundesstaat-iowa---673d52b431a79e5e.jpg,2025-01-15T21:05:02Z,https://web.archive.org/web/20250117124248/https://www.stern.de/news/trump-will-bau-neuer-windraeder-in-den-usa-unterbinden-35384726.html,"Kopiere den aktuellen Link
Der designierte US-Präsident Donald Trump will nach eigenen Worten während seiner neuen Amtszeit den Bau neuer Windräder in den Vereinigten Staaten komplett unterbinden. W… [+2801 chars]",,de,'Chris Wright'
https://www.bild.de/unterhaltung/stars-und-leute/feuer-in-los-angeles-leonardo-dicaprio-spendet-eine-million-dollar-6788a36cc2567f3a04ccb3cf,https://www.bild.de/unterhaltung/stars-und-leute/feuer-in-los-angeles-leonardo-dicaprio-spendet-eine-million-dollar-6788a36cc2567f3a04ccb3cf,0,www.bild.de,Feuerhölle Los Angeles - Leonardo DiCaprio spendet eine Million Dollar,Oscar-Preisträger Leonardo DiCaprio unterstützt seine Heimatstadt Los Angeles mit einer Million US-Dollar für die Opfer der verheerenden Waldbrände.,"https://images.bild.de/6788a36cc2567f3a04ccb3cf/4c21c6964e34d5f01785cea40df05d80,492fc578?w=1280",2025-01-16T09:02:07Z,https://web.archive.org/web/20250116103759/https://www.bild.de/unterhaltung/stars-und-leute/feuer-in-los-angeles-leonardo-dicaprio-spendet-eine-million-dollar-6788a36cc2567f3a04ccb3cf,In der schlimmsten Krise ist er für seine Heimat da! Oscar-Preisträger Leonardo DiCaprio (Titanic) spendet eine Million US-Dollar (rund 972.000 Euro) für die Opfer der Feuerkatastrophe von Los Angele… [+2099 chars],,de,'Leonardo DiCaprio'
https://www.focus.de/politik/briefing/toxische-kost-aus-der-wahlkampfkueche-robert-habecks-angriff-auf-die-sparer_id_260640312.html,https://www.focus.de/politik/briefing/toxische-kost-aus-der-wahlkampfkueche-robert-habecks-angriff-auf-die-sparer_id_260640312.html,0,www.focus.de,FOCUS-Chefredakteur Georg Meck - Toxische Kost aus der Wahlkampfküche: Robert Habecks Angriff auf die Sparer,"Die Küche mag der gemütlichste Ort für Partys sein, bisweilen entweicht aus ihr freilich auch toxische Kost. Sie ahnen es, die Rede ist vom wuscheligen Küchenchef Robert Habeck und seinem jüngsten Angriff auf unsere Spargroschen. Ob dabei echte Profiköche am …",https://p6.focus.de/img/finanzen/news/id_260639337/im-grossen-sparer-schlamassel-versucht-habeck-es-jetzt-mit-einem-fragwuerdigen-ausweg.jpg?im=Crop%3D%280%2C20%2C640%2C320%29%3BResize%3D%281200%2C627%29&impolicy=perceptual&quality=mediumHigh&hash=3a4bd8109f9c4609d1e2aabd8bc6aed9b79808844dc0250549e74a621d3321d5,2025-01-16T10:54:35Z,,"Die Küche mag der gemütlichste Ort für Partys sein, bisweilen entweicht aus ihr freilich auch toxische Kost. Sie ahnen es, die Rede ist vom wuscheligen Küchenchef Robert Habeck und seinem jüngsten An… [+2918 chars]",,de,'Robert Habeck'
https://www.stern.de/news/habeck-vor-u-ausschuss--energiesicherheit-war-richtschnur-meines-handelns-35385868.html,https://www.stern.de/news/habeck-vor-u-ausschuss--energiesicherheit-war-richtschnur-meines-handelns-35385868.html,0,www.stern.de,Habeck vor U-Ausschuss: Energiesicherheit war Richtschnur meines Handelns,Mit der Anhörung von Bundeswirtschaftsminister Robert Habeck (Grüne) hat der Untersuchungsausschuss des Bundestages zum Atomausstieg am Donnerstag seine Beratungen fortgesetzt. Habeck begann seine Ausführungen mit der Darstellung der Ausgangslage bei seinem A…,https://image.stern.de/35385870/t/xk/v1/w1440/r1.7778/-/16--habeck-im-untersuchungsausschuss---2fd4703741bc3b3f.jpg,2025-01-16T10:55:40Z,,"Kopiere den aktuellen Link
Mit der Anhörung von Bundeswirtschaftsminister Robert Habeck (Grüne) hat der Untersuchungsausschuss des Bundestages zum Atomausstieg am Donnerstag seine Beratungen fortges… [+1621 chars]",,de,'Robert Habeck'
https://www.stern.de/lifestyle/mode/birkenstock-in-bildern--ein-buch-erzaehlt-vom-siegeszug-der-oekoschlappe-35379110.html,https://www.stern.de/lifestyle/mode/birkenstock-in-bildern--ein-buch-erzaehlt-vom-siegeszug-der-oekoschlappe-35379110.html,0,www.stern.de,Made in Germany: 250 Jahre Birkenstock: Ein Buch erzählt vom Siegeszug der Ökoschlappe,"Heidi Klum, Leonardo di Caprio, Kate Moss: Viele Stars tragen Birkenstock-Sandalen. Dabei galten sie lange als muffige Öko-Treter. Eine Erfolgsgeschichte in Bildern.",https://image.stern.de/35384436/t/NP/v5/w1440/r1.7778/-/birkenstock-teaser1.jpg,2025-01-16T11:11:00Z,,"Kopiere den aktuellen Link
Heidi Klum, Leonardo di Caprio, Kate Moss: Viele Stars tragen Birkenstock-Sandalen. Dabei galten sie lange als muffige Öko-Treter. Eine Erfolgsgeschichte in Bildern.
Sie … [+1689 chars]",,de,'Bernard Arnault'
https://www.zeit.de/politik/deutschland/2025-01/untersuchungsausschuss-atomausstieg-gruene-habeck-robert-vorwurf-union,https://www.zeit.de/politik/deutschland/2025-01/untersuchungsausschuss-atomausstieg-gruene-habeck-robert-vorwurf-union,0,www.zeit.de,Untersuchungsausschuss des Bundestags: Robert Habeck weist Ideologievorwurf zu Atomausstieg zurück,"Die Union warf dem Wirtschaftsminister vor, den Atomausstieg aus ideologischen Gründen beschlossen zu haben. Die Grünen betonen, die Versorgung sei gewährleistet gewesen.",https://img.zeit.de/politik/deutschland/2025-01/habeck-weist-taeuschungsvorwurf-beim-atomausstieg-zurueck-bild/wide__1300x731,2025-01-16T11:24:12Z,http://archive.md/20250116114426/https://www.zeit.de/politik/deutschland/2025-01/untersuchungsausschuss-atomausstieg-gruene-habeck-robert-vorwurf-union,"Im Untersuchungsausschuss des Bundestags zum Atomausstieg 2023 hat Bundeswirtschaftsminister Robert Habeck 
(Grüne) die Vorwürfe gegen seine Partei zurückgewiesen. Ein Weiterbetrieb der verbliebenen… [+2560 chars]",,de,'Robert Habeck'
https://taz.de/Klimapolitik-in-Kanada/!6062707/,https://taz.de/Klimapolitik-in-Kanada/!6062707/,0,taz.de,Klimapolitik in Kanada: Erfolgsbilanz mit Abstrichen,"Der scheidende Regierungschef Justin Trudeau hat klimapolitisch einiges erreicht. Was davon nach den Neuwahlen übrig bleiben wird, ist unklar.",https://taz.de/picture/7470275/1200/37433043-1.jpeg,2025-01-16T12:10:00Z,,"Der scheidende Regierungschef Justin Trudeau hat klimapolitisch einiges erreicht. Was davon nach den Neuwahlen übrig bleiben wird, ist unklar. mehr...",,de,'Justin Trudeau'
https://www.stern.de/news/habeck-vor-u-ausschuss--laengere-akw-laufzeit--ergebnisoffen-und-ohne-tabus--geprueft-35385868.html,https://www.stern.de/news/habeck-vor-u-ausschuss--laengere-akw-laufzeit--ergebnisoffen-und-ohne-tabus--geprueft-35385868.html,0,www.stern.de,"Habeck vor U-Ausschuss: Längere Akw-Laufzeit ""ergebnisoffen und ohne Tabus"" geprüft","Bundeswirtschaftsminister Robert Habeck (Grüne) hat erneut versichert, eine mögliche Laufzeitverlängerung deutscher Atomkraftwerke sei von ihm 2022 ""ergebnisoffen und ohne Tabus"" geprüft worden. Habeck äußerte sich am Donnerstag in einer Anhörung des Atom-Unt…",https://image.stern.de/35386238/t/uk/v1/w1440/r1.7778/-/16--habeck-im-untersuchungsausschuss---d17c93511ddd4919.jpg,2025-01-16T12:40:07Z,,"Kopiere den aktuellen Link
Bundeswirtschaftsminister Robert Habeck (Grüne) hat erneut versichert, eine mögliche Laufzeitverlängerung deutscher Atomkraftwerke sei von ihm 2022 ""ergebnisoffen und ohne… [+4159 chars]",,de,'Robert Habeck'
https://www.n-tv.de/wirtschaft/Wichtiger-Krypto-Player-pumpt-Millionen-in-deutschen-Wahlkampf-article25492876.html,https://www.n-tv.de/wirtschaft/Wichtiger-Krypto-Player-pumpt-Millionen-in-deutschen-Wahlkampf-article25492876.html,0,www.n-tv.de,Rekordspende an vier Parteien: Wichtiger Krypto-Player pumpt Millionen in deutschen Wahlkampf,"Die Kryptoindustrie hat den neuen US-Präsidenten Donald Trump im Wahlkampf mit großen Summen unterstützt, um ihre Interessen durchzusetzen. Dieser Trend setzt sich offenbar in Deutschland fort. Bitpanda-Gründer Eric Demuth verteilt knapp zwei Millionen Euro.",https://bilder2.n-tv.de/img/incoming/crop25492945/6681325817-cImg_16_9-w1200/473161468.jpg,2025-01-16T13:00:55Z,http://archive.md/20250116145258/https://www.n-tv.de/wirtschaft/Wichtiger-Krypto-Player-pumpt-Millionen-in-deutschen-Wahlkampf-article25492876.html,"Die Kryptoindustrie hat den neuen US-Präsidenten Donald Trump im Wahlkampf mit großen Summen unterstützt, um ihre Interessen durchzusetzen. Dieser Trend setzt sich offenbar in Deutschland fort. Bitpa… [+4754 chars]",,de,'Eric Trump'
https://www.faz.net/aktuell/feuilleton/buecher/den-bach-rauf-robert-habeck-und-micky-beisenherz-110235002.html,https://www.faz.net/aktuell/feuilleton/buecher/den-bach-rauf-robert-habeck-und-micky-beisenherz-110235002.html,0,www.faz.net,Jetzt mal im Ernst: Die Buchpremiere von Robert Habeck in Berlin,"Und jetzt bitte lachen: Bei der Premiere seines Buchs „Den Bach rauf“ trat Robert Habeck in Berlin mit dem Moderator Micky Beisenherz zusammen auf. Es sollte nicht nur, es musste launig werden.",https://media1.faz.net/ppmedia/aktuell/politik/2732228891/1.10235037/facebook_teaser/robert-habeck-bei-seiner.jpg,2025-01-16T13:10:48Z,http://archive.md/20250116134923/https://www.faz.net/aktuell/feuilleton/buecher/den-bach-rauf-robert-habeck-und-micky-beisenherz-110235002.html,"In langen Schlangen standen die Menschen am Mittwochabend vor dem Delphi-Kino in Berlin an, um Robert Habeck mit Micky Beisenherz auftreten zu sehen. Oder Micky Beisenherz mit Robert Habeck. So siche… [+2318 chars]",,de,'Robert Habeck'
https://www.freitag.de/autoren/ulrike-baureithel/robert-habecks-vorstoss-zu-sozialbeitraegen-wollen-die-gruenen-an-unser-erpartes,https://www.freitag.de/autoren/ulrike-baureithel/robert-habecks-vorstoss-zu-sozialbeitraegen-wollen-die-gruenen-an-unser-erpartes,0,www.freitag.de,Robert Habecks Vorstoß zu Sozialbeiträgen: Wollen die Grünen an unser Erspartes?,"Der grüne Kanzlerkandidat will, dass auch Bezieher von Kapitaleinkünften in die gesetzliche Krankenversicherung einzahlen. CDU und FDP warnen: Kleinsparer in Gefahr! Interessanter ist, sich linke Ideen zur Rettung der Sozialkassen anzusehen Wer von Zinsen leb…",https://www.freitag.de/autoren/ulrike-baureithel/robert-habecks-vorstoss-zu-sozialbeitraegen-wollen-die-gruenen-an-unser-erpartes/@@images/image/great,2025-01-16T13:20:00Z,,"Wer von Zinsen lebt, soll löhnen. Rein in die Gesetzliche Kranken- und Rentenkasse! Warum soll nur Arbeit die Sozialkassen füllen, während sich das Kapital aus der Verantwortung stiehlt, weil es für … [+513 chars]",,de,'Robert Habeck'
https://www.stern.de/lifestyle/leute/travis-kelce--dank-taylor-swift-kein-karriereende-in-sicht-35386692.html,https://www.stern.de/lifestyle/leute/travis-kelce--dank-taylor-swift-kein-karriereende-in-sicht-35386692.html,0,www.stern.de,Travis Kelce: Dank Taylor Swift kein Karriereende in Sicht,"Immer wieder hieß es, dass Travis Kelce wohl seine Karriere beenden möchte. Nun setzt der Sportler selbst den Schlagzeilen ein Ende.",https://image.stern.de/35386696/t/qF/v1/w1440/r1.7778/-/16--dank-taylor-swift-kein-karriereende-in-sicht---16-9---spoton-article-1084399.jpg,2025-01-16T14:33:00Z,,"Kopiere den aktuellen Link
Immer wieder hieß es, dass Travis Kelce wohl seine Karriere beenden möchte. Nun setzt der Sportler selbst den Schlagzeilen ein Ende.
Zuletzt hatten Schlagzeilen die Runde… [+1709 chars]",,de,'Pat McAfee'
https://www.brigitte.de/aktuell/travis-kelce--taylor-swift-ermutigt-ihn--seine-karriere-fortzusetzen-13933098.html,https://www.brigitte.de/aktuell/travis-kelce--taylor-swift-ermutigt-ihn--seine-karriere-fortzusetzen-13933098.html,0,www.brigitte.de,"Travis Kelce: Taylor Swift ermutigt ihn, seine Karriere fortzusetzen","Immer wieder hieß es, dass Travis Kelce wohl seine Karriere beenden möchte. Nun setzt der Sportler selbst den Schlagzeilen ein Ende.",https://image.brigitte.de/13933100/t/iK/v1/w1440/r1.7778/-/16--taylor-swift-ermutigt-ihn--seine-karriere-fortzusetzen---1-1---spoton-article-1084399.jpg,2025-01-16T14:34:00Z,,"Immer wieder hieß es, dass Travis Kelce wohl seine Karriere beenden möchte. Nun setzt der Sportler selbst den Schlagzeilen ein Ende.
Zuletzt hatten Schlagzeilen die Runde gemacht, dass Travis Kelce … [+1683 chars]",,de,'Taylor Swift'
https://taz.de/Robert-Habeck-im-Untersuchungsausschuss/!6058854/,https://taz.de/Robert-Habeck-im-Untersuchungsausschuss/!6058854/,0,taz.de,Robert Habeck im Untersuchungsausschuss: Atomausstieg ohne Denkverbote,Wirtschaftsminister Habeck verteidigt die letzten AKW-Abschaltungen im Untersuchungsausschuss. Diese seien „ergebnisoffen und ohne Tabus“ geprüft worden.,https://taz.de/picture/7471658/1200/37432691-1.jpeg,2025-01-16T14:55:00Z,,Wirtschaftsminister Habeck verteidigt die letzten AKW-Abschaltungen im Untersuchungsausschuss. Diese seien „ergebnisoffen und ohne Tabus“ geprüft worden. mehr...,,de,'Robert Habeck'
https://www.tagesspiegel.de/politik/untersuchungsausschuss-zum-atomausstieg-die-union-bringt-habeck-nicht-in-bedrangnis-13031677.html,https://www.tagesspiegel.de/politik/untersuchungsausschuss-zum-atomausstieg-die-union-bringt-habeck-nicht-in-bedrangnis-13031677.html,0,www.tagesspiegel.de,Untersuchungsausschuss zum Atomausstieg: Die Union bringt Habeck nicht in Bedrängnis,Mitten im Wahlkampf wird Wirtschaftsminister Robert Habeck zu den Hintergründen des Atomausstiegs befragt. Ideologie-Vorwürfe der Union pariert er mühelos.,https://www.tagesspiegel.de/images/13031212/alternates/BASE_16_9_W1400/1737037263000/untersuchungsausschuss-zum-atomausstieg.jpeg,2025-01-16T15:02:46Z,http://archive.md/20250116203158/https://www.tagesspiegel.de/politik/untersuchungsausschuss-zum-atomausstieg-die-union-bringt-habeck-nicht-in-bedrangnis-13031677.html,"Am Donnerstagmorgen um 10:52 Uhr hat die Union Robert Habeck endlich da, wo sie ihn seit Monaten haben möchte. Durch die wartende Menge an Journalisten, Interessierten und Abgeordneten schiebt sich d… [+5768 chars]",,de,'Robert Habeck'
https://www.zeit.de/kultur/2025-01/robert-habeck-den-bach-rauf-buch-wahlkampf,https://www.zeit.de/kultur/2025-01/robert-habeck-den-bach-rauf-buch-wahlkampf,0,www.zeit.de,Robert Habeck: Träum weiter,"In seinem neuen Buch tut Robert Habeck so, als hätte er die letzten Jahre gar nicht regiert. Das liest sich, als rette er sich gedanklich in seine eigene Präsidenten-Ära.",https://img.zeit.de/kultur/2025-01/robert-habeck-den-bach-rauf-buch/wide__1300x731,2025-01-16T15:11:37Z,http://archive.md/20250116152137/https://www.zeit.de/kultur/2025-01/robert-habeck-den-bach-rauf-buch-wahlkampf,"Schließen
Artikelzusammenfassung
Robert Habecks neues Buch ""Den Bach rauf Eine Kursbestimmung"" sorgt mit markigen Anweisungen und gewohntem Pathos für Diskussionen. Der Vizekanzler reflektiert über… [+487 chars]",,de,'Robert Habeck'
https://www.n-tv.de/politik/Klima-Labor-mit-Boris-Palmer-Gesellschaft-haelt-gruene-Werte-bei-Migration-und-Sicherheit-nicht-aus-article25489506.html,https://www.n-tv.de/politik/Klima-Labor-mit-Boris-Palmer-Gesellschaft-haelt-gruene-Werte-bei-Migration-und-Sicherheit-nicht-aus-article25489506.html,0,www.n-tv.de,"Boris Palmer vermisst alte Grüne: ""Gesellschaft hält grüne Werte bei Migration und Sicherheit nicht aus""","Für Boris Palmer und die Grünen gibt es anscheinend kein Happy End. ""Ich kann nicht mehr bei den Grünen sein"", stellt der Oberbürgermeister von Tübingen im ""Klima-Labor"" von ntv klar. Auch eine Wahlempfehlung mag Palmer seiner alten Partei nicht ausstellen.",https://bilder3.n-tv.de/img/incoming/crop25490574/1071329787-cImg_16_9-w1200/496028297.jpg,2025-01-16T15:12:30Z,https://web.archive.org/web/20250116233028/https://www.n-tv.de/politik/Klima-Labor-mit-Boris-Palmer-Gesellschaft-haelt-gruene-Werte-bei-Migration-und-Sicherheit-nicht-aus-article25489506.html,"Für Boris Palmer und die Grünen gibt es anscheinend kein Happy End. ""Ich kann nicht mehr bei den Grünen sein"", stellt der Oberbürgermeister von Tübingen im ""Klima-Labor""
 von ntv klar. Auch eine Wah… [+14245 chars]",,de,'Boris Palmer'
https://www.sueddeutsche.de/politik/atomausstieg-untersuchungsausschuss-habeck-li.3182083,https://www.sueddeutsche.de/politik/atomausstieg-untersuchungsausschuss-habeck-li.3182083,0,www.sueddeutsche.de,Atomausstieg: Die drei mit der Kernspaltung,"Partner von einst: Vor dem Untersuchungsausschuss zum Atomausstieg müssen die drei Ampelmänner Olaf Scholz, Robert Habeck und Christian Lindner aussagen. Das führt zu wenig neuen Erkenntnissen – aber zu ein paar Kabbeleien.",https://www.sueddeutsche.de/2025/01/16/4e24a9f0-0a5d-4ce3-98b4-95e2bcb6046e.jpeg?q=60&fm=webp&width=1200&rect=19%2C0%2C3422%2C1925,2025-01-16T15:45:56Z,,"Es läuft das Finale das zweiten Parlamentarischen Untersuchungsausschusses, sein Thema: Die Debatte um längere Atom-Laufzeiten im Jahr 2022, als die Energiekrise ihren Lauf nahm. Hatte die Koalition … [+5222 chars]",,de,'Robert Habeck'
