index,url,valid,domain,title,description,image,published,archive,content,quote,language,keyword
https://www.stern.de/lifestyle/leute/britney-spears-verprasst-ihr-geld-fuer-privatjets-und-luxusurlaube-34675578.html,https://www.stern.de/lifestyle/leute/britney-spears-verprasst-ihr-geld-fuer-privatjets-und-luxusurlaube-34675578.html,0,www.stern.de,Musikerin: Privatjets und Luxushotels: Britney Spears verprasst ihr Geld – und in ihrem Umfeld schrillen die Alarmglocken,Britney Spears ist eine freie Frau und darf seit dem Ende ihrer Vormundschaft eigenhändig über ihr Millionenvermögen verfügen. Aktuell gibt die Musikerin ihr Geld wohl für Luxusurlaube aus. In ihrem Umfeld soll das misstrauisch beäugt werden.,https://image.stern.de/34675700/t/Ix/v2/w1440/r1.7778/-/britney-spears--1-.jpg,2024-05-01T07:33:00Z,https://web.archive.org/web/20240501104626/https://www.stern.de/lifestyle/leute/britney-spears-verprasst-ihr-geld-fuer-privatjets-und-luxusurlaube-34675578.html,Britney Spears ist eine freie Frau und darf seit dem Ende ihrer Vormundschaft eigenhändig über ihr Millionenvermögen verfügen. Aktuell gibt die Musikerin ihr Geld wohl für Luxusurlaube aus. In ihrem … [+2579 chars],,de,'Jamie Spears'
https://www.stern.de/lifestyle/leute/popstar--britney-spears-und-sam-asghari--scheidung-ist-fast-durch-34680076.html,https://www.stern.de/lifestyle/leute/popstar--britney-spears-und-sam-asghari--scheidung-ist-fast-durch-34680076.html,0,www.stern.de,Popstar: Britney Spears und Sam Asghari: Scheidung ist fast durch,"Im vorigen August wurde bekannt, dass Schluss ist zwischen Britney Spears und dem Fitnesstrainer Sam Asghari. Er reichte die Scheidung ein. Nun sollen sie sich in Scheidungsfragen geeinigt haben.",https://image.stern.de/34680078/t/xr/v1/w1440/r1.7778/-/02--urnnewsmldpacom2009010124050299894848v3w800h600l446t26r1918b1396jpeg---d7c3d542ca2b98ea.jpg,2024-05-02T19:55:51Z,https://web.archive.org/web/20240502200545/https://www.stern.de/lifestyle/leute/popstar--britney-spears-und-sam-asghari--scheidung-ist-fast-durch-34680076.html,"Im vorigen August wurde bekannt, dass Schluss ist zwischen Britney Spears und dem Fitnesstrainer Sam Asghari. Er reichte die Scheidung ein. Nun sollen sie sich in Scheidungsfragen geeinigt haben.
Br… [+1577 chars]",,de,'Jamie Spears'
https://www.n-tv.de/politik/Mitgeschnittenes-Telefonat-bringt-Trump-in-Bredouille-article24918063.html,https://www.n-tv.de/politik/Mitgeschnittenes-Telefonat-bringt-Trump-in-Bredouille-article24918063.html,0,www.n-tv.de,"Zahlung an ""Playboy""-Model: Mitgeschnittenes Telefonat bringt Trump in Bredouille",Wie sehr war Donald Trump in die Vereinbarung von Schweigegeld-Zahlungen involviert und wurde dabei etwas vertuscht? Mit dieser und anderen Fragen beschäftigt sich ein Gericht in New York. Bei der Verhandlung am Donnerstag spielt ein heimlich mitgeschnittenes…,https://bilder2.n-tv.de/img/incoming/crop24918137/4411327095-cImg_16_9-w1200/7e22f7b551e17eb31ab61a57ace734b6.jpg,2024-05-03T09:13:16Z,https://web.archive.org/web/20240503092418/https://www.n-tv.de/politik/Mitgeschnittenes-Telefonat-bringt-Trump-in-Bredouille-article24918063.html,Wie sehr war Donald Trump in die Vereinbarung von Schweigegeld-Zahlungen involviert und wurde dabei etwas vertuscht? Mit dieser und anderen Fragen beschäftigt sich ein Gericht in New York. Bei der Ve… [+3940 chars],,de,'Michael Cohen'
https://www.stern.de/kultur/ein-jahr-nach-der-kroenung-von-charles-iii---das-macht--major-augenschmaus--heute-34682140.html,https://www.stern.de/kultur/ein-jahr-nach-der-kroenung-von-charles-iii---das-macht--major-augenschmaus--heute-34682140.html,0,www.stern.de,"Ein Jahr nach der Krönung von Charles III.: Das macht ""Major Augenschmaus"" heute",Bei der Krönung von Charles wurde sein Auftritt im Netz gefeiert. Der Trubel wurde Major Johnny Thompson aber offenbar zu viel.,https://image.stern.de/34682144/t/rz/v1/w1440/r1.7778/-/03--das-macht--major-augenschmaus--heute---16-9---spoton-article-1065209.jpg,2024-05-03T11:56:00Z,,"Bei der Krönung von Charles wurde sein Auftritt im Netz gefeiert. Der Trubel wurde Major Johnny Thompson aber offenbar zu viel.
Beim Ostergottesdienst der Royals sorgte Ende März nicht nur das Ersch… [+4125 chars]",,de,'Charles III'
https://www.stern.de/kultur/koenig-charles-iii---bestens-gelaunt-ueberrascht-er-bei-pferde-show-34682496.html,https://www.stern.de/kultur/koenig-charles-iii---bestens-gelaunt-ueberrascht-er-bei-pferde-show-34682496.html,0,www.stern.de,König Charles III.: Bestens gelaunt überrascht er bei Pferde-Show,König Charles III. taucht überraschend bei der Royal Windsor Horse Show auf. Ehefrau Camilla ist ausnahmsweise nicht an seiner Seite.,https://image.stern.de/34682500/t/mu/v1/w1440/r1.7778/-/03--bestens-gelaunt-ueberrascht-er-bei-pferde-show---16-9---spoton-article-1066167.jpg,2024-05-03T13:49:00Z,,"König Charles III. taucht überraschend bei der Royal Windsor Horse Show auf. Ehefrau Camilla ist ausnahmsweise nicht an seiner Seite.
Überraschungsbesuch von König Charles III. (75) am dritten Tag d… [+1770 chars]",,de,'Charles III'
https://www.welt.de/politik/ausland/article251360282/Ex-US-Praesident-Trump-Beraterin-verraet-Strategie-im-Schweigegeld-Prozess-leugnen-leugnen-leugnen.html,https://www.welt.de/politik/ausland/article251360282/Ex-US-Praesident-Trump-Beraterin-verraet-Strategie-im-Schweigegeld-Prozess-leugnen-leugnen-leugnen.html,0,www.welt.de,"Trump-Beraterin verrät Strategie im Schweigegeld-Prozess – „leugnen, leugnen, leugnen“","Der Schweigegeld-Prozess an eine Pornodarstellerin gegen Donald Trump ist in vollem Gang. Jetzt sagte die Ex-Vertraute des Ex-Präsidenten aus – und wurde emotional. Mehrfach brach Hope Hicks in Tränen aus. Trump droht eine mehrjährige Haftstrafe, sollte er fü…",https://img.welt.de/img/politik/ausland/mobile251360288/5151352497-ci16x9-w1200/FILES-US-VOTE-JUSTICE-TRUMP.jpg,2024-05-04T06:56:36Z,https://web.archive.org/web/20240504070156/https://www.welt.de/politik/ausland/article251360282/Ex-US-Praesident-Trump-Beraterin-verraet-Strategie-im-Schweigegeld-Prozess-leugnen-leugnen-leugnen.html,Im Prozess gegen Donald Trump im Zusammenhang mit Schweigegeldzahlungen an eine Pornodarstellerin hat eine Ex-Vertraute des früheren US-Präsidenten ihre Sicht auf den Skandal rund um das Access Holly… [+2060 chars],,de,'Michael Cohen'
https://www.bild.de/unterhaltung/royals-adel/koenig-charles-koeniglich-amuesiert-humor-ist-wenn-man-trotzdem-lacht-66360fa3f0fbc5473c08e8b9,https://www.bild.de/unterhaltung/royals-adel/koenig-charles-koeniglich-amuesiert-humor-ist-wenn-man-trotzdem-lacht-66360fa3f0fbc5473c08e8b9,0,www.bild.de,"Königlich amüsiert - Humor ist, wenn Charles trotzdem lacht",Lachen ist die beste Medizin. So war der fröhliche Auftritt von König Charles III. bei der Royal Windsor Horse Show ein wichtiges Zeichen für die Briten.,"https://images.bild.de/66360fa3f0fbc5473c08e8b9/02d1760171e55d20555ac2686a6c3dbe,9c8d414f?w=1280",2024-05-04T13:06:25Z,,"Lachen ist bekanntlich die beste Medizin. Und so war der fröhliche Auftritt von König Charles III. (75), gut für sein Gemüt und Balsam für das besorgte britische Volk. Ihr König kann wieder strahlen.… [+2751 chars]",,de,'Charles III'
https://www.stern.de/kultur/koenig-charles-iii---schirmherrschaften-der-royals-neu-organisiert-34684620.html,https://www.stern.de/kultur/koenig-charles-iii---schirmherrschaften-der-royals-neu-organisiert-34684620.html,0,www.stern.de,König Charles III.: Schirmherrschaften der Royals neu organisiert,Der Buckingham Palast hat mehr als 1.000 Schirmherrschaften der britischen Royals überprüft und einige Neuerungen angekündigt.,https://image.stern.de/34684624/t/Fy/v1/w1440/r1.7778/-/04--schirmherrschaften-der-royals-neu-organisiert---16-9---spoton-article-1066203.jpg,2024-05-04T13:19:00Z,,"Der Buckingham Palast hat mehr als 1.000 Schirmherrschaften der britischen Royals überprüft und einige Neuerungen angekündigt.
Nach der Thronbesteigung von König Charles III. (75) wird weiter an der… [+3671 chars]",,de,'Queen Elizabeth II'
https://www.brigitte.de/aktuell/prinz-andrew--durch-die-royal-lodge-ein-neuer-streit-mit-charles--13810804.html,https://www.brigitte.de/aktuell/prinz-andrew--durch-die-royal-lodge-ein-neuer-streit-mit-charles--13810804.html,0,www.brigitte.de,Prinz Andrew: Durch die Royal Lodge ein neuer Streit mit Charles?,Neuer Streit zwischen Andrew und Charles? Der in Ungnade gefallene Prinz soll vereinbarten Reparaturen an der Royal Lodge nicht nachkommen.,https://image.brigitte.de/13810806/t/Eb/v1/w1440/r1.7778/-/05--durch-die-royal-lodge-ein-neuer-streit-mit-charles----1-1---spoton-article-1066243.jpg,2024-05-05T11:41:00Z,,"Neuer Streit zwischen Andrew und Charles? Der in Ungnade gefallene Prinz soll vereinbarten Reparaturen an der Royal Lodge nicht nachkommen.
Flammt der Streit um die Royal Lodge wieder auf? Prinz And… [+2837 chars]",,de,'Queen Elizabeth II'
https://www.stern.de/kultur/prinz-andrew--royal-lodge-braucht-dringende-reparaturen-34686268.html,https://www.stern.de/kultur/prinz-andrew--royal-lodge-braucht-dringende-reparaturen-34686268.html,0,www.stern.de,Prinz Andrew: Royal Lodge braucht dringende Reparaturen,Neuer Streit zwischen Andrew und Charles? Der in Ungnade gefallene Prinz soll vereinbarten Reparaturen an der Royal Lodge nicht nachkommen.,https://image.stern.de/34686272/t/ZO/v1/w1440/r1.7778/-/05--royal-lodge-braucht-dringende-reparaturen---16-9---spoton-article-1066243.jpg,2024-05-05T11:44:00Z,,"Neuer Streit zwischen Andrew und Charles? Der in Ungnade gefallene Prinz soll vereinbarten Reparaturen an der Royal Lodge nicht nachkommen.
Flammt der Streit um die Royal Lodge wieder auf? Prinz And… [+2796 chars]",,de,'Prinz Andrew'
https://www.telepolis.de/features/Wie-der-Stellvertreterkrieg-in-der-Ukraine-eskaliert-ist-9708651.html,https://www.telepolis.de/features/Wie-der-Stellvertreterkrieg-in-der-Ukraine-eskaliert-ist-9708651.html,0,www.telepolis.de,Wie der Stellvertreterkrieg in der Ukraine eskaliert ist,Washington rief nach 2014 zur Zurückhaltung auf. Doch hinter den Kulissen wurde ein anderer Plan verfolgt. Zentral dabei: CIA-Chef Brennan. (Teil 2),https://heise.cloudimg.io/bound/1200x1200/q85.png-lossy-85.webp-lossy-85.foil1/_www-heise-de_/imgs/18/4/5/8/5/0/3/5/shutterstock_1335251672-bb24c938ed69b61d.jpeg,2024-05-05T12:00:00Z,http://archive.md/20240506080845/https://www.telepolis.de/features/Wie-der-Stellvertreterkrieg-in-der-Ukraine-eskaliert-ist-9708651.html,"Ukrainische Soldaten bewachen den Eingang zum Gelände des Militärstützpunkts, März 2013. Bild: Alexander Gafarro, Shutterstock.com
Washington rief nach 2014 zur Zurückhaltung auf. Doch hinter den Ku… [+15846 chars]",,de,'nan nan'
https://www.tagesspiegel.de/internationales/peking-will-das-transatlantische-verhaltnis-storen-diese-ziele-verfolgt-xi-jinping-in-europa-11618219.html,https://www.tagesspiegel.de/internationales/peking-will-das-transatlantische-verhaltnis-storen-diese-ziele-verfolgt-xi-jinping-in-europa-11618219.html,0,www.tagesspiegel.de,„Peking will das transatlantische Verhältnis stören“: Diese Ziele verfolgt Xi Jinping in Europa,"Der chinesische Staatspräsident besucht ab Sonntag Frankreich, Serbien und Ungarn. Was es mit diesen Reisezielen auf sich hat und welche Agenda China damit verfolgt, erklärt Experte Noah Barkin im Interview.",https://www.tagesspiegel.de/images/chinese-president-xi-jinping-visits-france/alternates/BASE_16_9_W1400/chinese-president-xi-jinping-visits-france.jpeg,2024-05-05T15:41:57Z,http://archive.md/20240506084504/https://www.tagesspiegel.de/internationales/peking-will-das-transatlantische-verhaltnis-storen-diese-ziele-verfolgt-xi-jinping-in-europa-11618219.html,"Herr Barkin, am Sonntag hat der chinesische Staatspräsident Xi Jinping seine Europa-Reise in Frankreich begonnen. Danach wird er noch Serbien und Ungarn besuchen. Warum gerade diese drei Länder?In ei… [+7812 chars]",,de,'Angela Merkel'
https://www.sueddeutsche.de/politik/merz-cdu-bpt-wahl-parteitag-union-1.6948641,https://www.sueddeutsche.de/politik/merz-cdu-bpt-wahl-parteitag-union-1.6948641,0,www.sueddeutsche.de,CDU: 1001 Stimmen,"Wie viel Zustimmung braucht Friedrich Merz bei seiner Wiederwahl, um einen Erfolg zu verbuchen? Und wer werden seine fünf Vizes? Der Ablauf des CDU-Bundesparteitags.",https://www.sueddeutsche.de/2024/05/05/7808718c-2e81-4fea-b7e1-d2c5cab26fc6.jpeg?width=1200&height=675&fit=crop&fm=webp&q=60,2024-05-05T15:48:31Z,http://archive.md/20240506032906/https://www.sueddeutsche.de/politik/merz-cdu-bpt-wahl-parteitag-union-1.6948641,"Doch am Morgen fahren die Christdemokraten erst einmal in die St.-Johannes-Basilika, um 8.30 Uhr beginnt dort ein ökumenischer Gottesdienst. Dann geht es mit Shuttles ins Estrel-Hotel nach Neukölln, … [+4845 chars]",,de,'Friedrich Merz'
https://www.n-tv.de/politik/Warum-sich-Merkel-laut-Laschet-bei-der-CDU-rar-macht-article24922303.html,https://www.n-tv.de/politik/Warum-sich-Merkel-laut-Laschet-bei-der-CDU-rar-macht-article24922303.html,0,www.n-tv.de,Es hat mit ihrem Projekt zu tun: Warum sich Merkel laut Laschet bei der CDU rar macht,Ex-Kanzlerin Angela Merkel wählt ihre Termine derzeit offenbar sorgfältig aus. An bevorstehenden CDU-Parteitag nimmt sie nicht teil - dafür aber einige Tage später an der Verabschiedung des Grünen-Politikers Jürgen Trittin. Gründe dafür liefert Armin Laschet …,https://bilder3.n-tv.de/img/incoming/crop24922302/5681325393-cImg_16_9-w1200/258072005.jpg,2024-05-05T19:17:30Z,,Ex-Kanzlerin Angela Merkel wählt ihre Termine derzeit offenbar sorgfältig aus. An bevorstehenden CDU-Parteitag nimmt sie nicht teil - dafür aber einige Tage später an der Verabschiedung des Grünen-Po… [+1890 chars],,de,'Angela Merkel'
https://www.tagesspiegel.de/politik/cdu-chef-reagiert-auf-schwarz-grun-ausserung-merz-weist-spekulationen-uber-mogliche-koalitionen-zuruck-11620289.html,https://www.tagesspiegel.de/politik/cdu-chef-reagiert-auf-schwarz-grun-ausserung-merz-weist-spekulationen-uber-mogliche-koalitionen-zuruck-11620289.html,0,www.tagesspiegel.de,CDU-Chef reagiert auf Schwarz-Grün-Äußerung: Merz weist Spekulationen über mögliche Koalitionen zurück,Eine Koalition der Union mit den Grünen? Schleswig-Holsteins Ministerpräsidenten Daniel Günther hat die Debatte neu entfacht. CDU-Chef Friedrich Merz erteilt Spekulationen vor dem Parteitag eine Absage.,https://www.tagesspiegel.de/images/germany-politics-parties/alternates/BASE_16_9_W1400/germany-politics-parties.jpeg,2024-05-05T19:30:53Z,,"CDU-Parteichef Friedrich Merz hat Spekulationen über mögliche Koalitionen entschieden zurückgewiesen. Wir führen keine Koalitionsdebatten, nicht in der Partei und auch nicht in der Öffentlichkeit, so… [+1985 chars]",,de,'Angela Merkel'
https://www.zeit.de/politik/deutschland/2024-05/cdu-parteitag-berlin-programm-merz,https://www.zeit.de/politik/deutschland/2024-05/cdu-parteitag-berlin-programm-merz,0,www.zeit.de,CDU-Parteitag: Dreitägiger CDU-Bundesparteitag beginnt in Berlin,"Im Zentrum des CDU-Parteitags steht die Wiederwahl von Parteichef Friedrich Merz. Der Programmentwurf plädiert für ""weltoffenen Patriotismus"" und deutsche ""Leitkultur"".",https://img.zeit.de/politik/deutschland/2024-05/cdu-parteitag-berlin-programm-parteispitze-merz-wuest-bild/wide__1300x731,2024-05-05T23:52:19Z,,An diesem Montag beginnt der dreitägige CDU-Bundesparteitag in Berlin. Die 1.001 Delegierten wollen dabei gleich am ersten Tag die Parteispitze neu wählen und am Dienstag das neue Grundsatzprogramm d… [+4185 chars],,de,'Angela Merkel'
https://www.bild.de/politik/inland/schicksalsparteitag-der-cdu-jetzt-kaempft-merz-um-alles-66377b26d38a083e3983a966,https://www.bild.de/politik/inland/schicksalsparteitag-der-cdu-jetzt-kaempft-merz-um-alles-66377b26d38a083e3983a966,0,www.bild.de,Schicksalsparteitag der CDU - Jetzt kämpft Merz um ALLES,"Das politische Schicksal von CDU-Chef Friedrich Merz liegt ab Montag in den Händen von 1001 Delegierten. Worüber jetzt gestritten wird, worauf es ankommt.","https://images.bild.de/66377b26d38a083e3983a966/ee564e2a367ad7b3442d3bb90cd52b96,b23be6c7?w=1280",2024-05-06T02:32:49Z,,"Schicksals-Parteitag für CDU-Chef Friedrich Merz (68)!
Am Montag kommen ins Berliner Estrel-Hotel 1001 Delegierte aus ganz Deutschland, um den Bundesvorstand komplett neu zu wählen und der Partei ei… [+4028 chars]",,de,'Friedrich Merz'
https://www.stern.de/gesellschaft/regional/hessen/kohl-enkel--volkmann-plaediert-fuer-differenzierten-blick-auf-aera-merkel-34687192.html,https://www.stern.de/gesellschaft/regional/hessen/kohl-enkel--volkmann-plaediert-fuer-differenzierten-blick-auf-aera-merkel-34687192.html,0,www.stern.de,Kohl-Enkel: Volkmann plädiert für differenzierten Blick auf Ära Merkel,Johannes Volkmann hat einen berühmten Opa. Sechs Jahrzehnte nach dem Altkanzler will der 27-Jährige in den CDU-Bundesvorstand gewählt werden. Was er erreichen will und wie er über Helmut Kohl denkt.,https://image.stern.de/34687194/t/wd/v1/w1440/r1.7778/-/06--urnnewsmldpacom2009010124050699927593v3w800h600l640t425r1920b1278jpeg---611be5dce0a485d2.jpg,2024-05-06T03:30:53Z,,Johannes Volkmann hat einen berühmten Opa. Sechs Jahrzehnte nach dem Altkanzler will der 27-Jährige in den CDU-Bundesvorstand gewählt werden. Was er erreichen will und wie er über Helmut Kohl denkt.,,,
https://www.n-tv.de/politik/Ich-teile-viele-politische-Werte-meines-Grossvaters-article24915743.html,https://www.n-tv.de/politik/Ich-teile-viele-politische-Werte-meines-Grossvaters-article24915743.html,0,www.n-tv.de,"Kohl-Enkel im Interview: ""Ich teile viele politische Werte meines Großvaters""","Beim CDU-Parteitag am Montag könnten die Delegierten den 27-jährigen Johannes Volkmann zum jüngsten Mitglied des Bundesvorstandes wählen. Sein Großvater, Altkanzler Helmut Kohl, schaffte es 1966 erst im Alter von 36 Jahren in den Bundesvorstand. Im Interview …",https://bilder2.n-tv.de/img/incoming/crop24918685/5251326618-cImg_16_9-w1200/Pressefoto.jpg,2024-05-06T05:04:45Z,,"Beim CDU-Bundesparteitag am 6. Mai 2024 könnten die Delegierten den 27-jährigen Johannes Volkmann zum jüngsten Mitglied des Bundesvorstandes wählen. Sein Großvater, Altkanzler Helmut Kohl, schaffte e… [+9686 chars]",,de,'Helmut Kohl'
https://www.focus.de/politik/meinung/gastbeitrag-von-gabor-steingart-auf-diese-5-trojanischen-pferde-muss-cdu-chef-merz-jetzt-aufpassen_id_259917571.html,https://www.focus.de/politik/meinung/gastbeitrag-von-gabor-steingart-auf-diese-5-trojanischen-pferde-muss-cdu-chef-merz-jetzt-aufpassen_id_259917571.html,0,www.focus.de,Gastbeitrag von Gabor Steingart - Auf diese 5 trojanischen Pferde muss CDU-Chef Merz jetzt aufpassen,"Mit der Kraft der Vernunft tritt Friedrich Merz auf dem CDU-Parteitag an, um die Mächte der Finsternis zu vertreiben. Doch die Herausforderungen sind vielfältiger, als man vermuten würde. Warum das Nervenkostüm des Parteichefs noch einiges aushalten muss.Von …",https://p6.focus.de/img/fotos/id_259917592/friedrich-merz-cdu-bundesvorsitzender.jpg?im=Crop%3D%280%2C253%2C3464%2C1732%29%3BResize%3D%281200%2C627%29&impolicy=perceptual&quality=mediumHigh&hash=2253f4e368e4ae927bb9b8ae885ae342cbbd03be7131ac13a666c0ce29c33aa2,2024-05-06T06:19:29Z,,"Mit der Kraft der Vernunft tritt Friedrich Merz auf dem CDU-Parteitag an, um die Mächte der Finsternis zu vertreiben. Doch die Herausforderungen sind vielfältiger, als man vermuten würde. Warum das N… [+7692 chars]",,de,'Gabor Steingart'
https://www.diepresse.com/18436845/kohl-enkel-volkmann-sollten-differenzierten-blick-auf-16-jahre-angela-merkel-haben,https://www.diepresse.com/18436845/kohl-enkel-volkmann-sollten-differenzierten-blick-auf-16-jahre-angela-merkel-haben,0,www.diepresse.com,Kohl-Enkel Volkmann: „Sollten differenzierten Blick auf 16 Jahre Angela Merkel haben“,"Der CDU-Jungpolitiker ortet im Rückblick Fehler vor allem im Bereich der Migrations-, Energie- oder Rentenpolitik. Volkmann will beim Parteitag der deutschen Konservativen in den CDU-Bundesvorstand gewählt werden.",https://img.diepresse.com/public/incoming/gjyqfy-imago-images-0472319473/alternates/DPR_SOCIAL_NACHRICHTEN/imago%20images%200472319473,2024-05-06T07:06:06Z,,"Der CDU-Jungpolitiker ortet im Rückblick Fehler vor allem im Bereich der Migrations-, Energie- oder Rentenpolitik. Volkmann will beim Parteitag der deutschen Konservativen in den CDU-Bundesvorstand g… [+5361 chars]",,de,'Angela Merkel'
https://www.focus.de/kultur/royals/seit-einem-jahr-koenig-erstes-thronjubilaeum-von-charles-palast-startet-aufruf-an-royal-fans_id_259919071.html,https://www.focus.de/kultur/royals/seit-einem-jahr-koenig-erstes-thronjubilaeum-von-charles-palast-startet-aufruf-an-royal-fans_id_259919071.html,0,www.focus.de,Seit einem Jahr König - Erstes Thronjubiläum von Charles: Palast startet Aufruf an Royal-Fans,"Zum ersten Thronjubiläum von König Charles III. hat der Palast ein Video geteilt, in dem viele Szenen vom 6. und 7. Mai 2023 noch einmal gezeigt werden. Dazu werden auch die Royal-Fans aufgerufen, sich an die schönsten Momente des Krönungswochenendes zu erinn…",https://p6.focus.de/img/fotos/id_259914781/charles-winkt.jpg?im=Crop%3D%28944%2C118%2C1118%2C559%29%3BResize%3D%281200%2C627%29&impolicy=perceptual&quality=mediumHigh&hash=cb909a9b76dac5c547fcda49181121212e6cb80aa321953b4d4d47d14f11d997,2024-05-06T11:45:07Z,,"Zum ersten Thronjubiläum von König Charles III. hat der Palast ein Video geteilt, in dem viele Szenen vom 6. und 7. Mai 2023 noch einmal gezeigt werden. Dazu werden auch die Royal-Fans aufgerufen, si… [+3384 chars]",,de,'Charles III'
https://www.stern.de/kultur/erstes-thronjubilaeum-von-koenig-charles-iii---palast-veroeffentlicht-erinnerungsvideo-34688624.html,https://www.stern.de/kultur/erstes-thronjubilaeum-von-koenig-charles-iii---palast-veroeffentlicht-erinnerungsvideo-34688624.html,0,www.stern.de,Erstes Thronjubiläum von König Charles III.: Palast veröffentlicht Erinnerungsvideo,Von der Kutschfahrt über die Krönung bis zum Konzert: Der Palast hat mit einem Video an das erste Thronjubiläum von König Charles erinnert.,https://image.stern.de/34688628/t/Aw/v1/w1440/r1.7778/-/06--palast-veroeffentlicht-erinnerungsvideo---16-9---spoton-article-1066289.jpg,2024-05-06T11:46:00Z,,"Von der Kutschfahrt über die Krönung bis zum Konzert: Der Palast hat mit einem Video an das erste Thronjubiläum von König Charles erinnert.
Vor einem Jahr sind Charles III. (75) und seine Frau Camil… [+3119 chars]",,de,'König Charles III'
https://orf.at/stories/3356558/,https://orf.at/stories/3356558/,0,orf.at,„Olympischer Frieden“ als gemeinsames Ziel,"Frankreichs Präsident Emmanuel Macron hat die Unterstützung Chinas für das Vorhaben eines „olympischen Friedens“ während der Pariser Sommerspiele begrüßt. „Ich danke Ihnen, sich dafür zu engagieren, alle beteiligten Parteien zu einem olympischen Frieden aufzu…",https://ibs.orf.at/news?image=https%3A%2F%2Fassets.orf.at%2Fmims%2F2024%2F19%2F30%2Fcrops%2Fw%3D1200%2Ch%3D630%2Cq%3D75%2F2197640_master_833330_xi_europareise_macron_moab_neu_im.jpg%3Fs%3D227ad6125577d96f1183ea00a51de4708b3fbe49,2024-05-06T18:40:35Z,,"Beide Seiten seien sich einig, dass ein olympischer Friede für alle Kriegsschauplätze eine Gelegenheit sein könne, für einen dauerhaften Frieden unter Respekt des internationalen Rechts zu arbeiten, … [+6315 chars]",,de,'président de la République'
https://www.telepolis.de/features/Die-Ukraine-gegen-Donald-Trump-9710562.html,https://www.telepolis.de/features/Die-Ukraine-gegen-Donald-Trump-9710562.html,0,www.telepolis.de,Die Ukraine gegen Donald Trump,US-Wahlkampf im Jahr 2016 von Streit um Einflussnahme überschattet. Die Ukraine spielte bei diesen Vorwürfen eine zentrale Rolle. Mitten dabei. Ein späterer Whistleblower. (Teil 3),https://heise.cloudimg.io/bound/1200x1200/q85.png-lossy-85.webp-lossy-85.foil1/_www-heise-de_/imgs/18/4/5/8/6/0/5/0/shutterstock_566768119-6fd83d361a1dd377.jpeg,2024-05-07T10:00:00Z,http://archive.md/20240507144421/https://www.telepolis.de/features/Die-Ukraine-gegen-Donald-Trump-9710562.html,"Bild: Savvapanf Photo, Shutterstock.com
US-Wahlkampf in 2016 von Streit um Einflussnahme überschattet. Ukraine spielte zentrale Rolle. Mitten dabei: ein späterer Whistleblower. (Teil 3)
Während der… [+16600 chars]",,de,'Donald Trump'
https://www.jungewelt.de/artikel/474959.problembär-des-tages-commander.html,https://www.jungewelt.de/artikel/474959.problembär-des-tages-commander.html,0,www.jungewelt.de,Porträt: Problembär des Tages: Commander,"Kristi Noem, mögliche Running Mate für Donald Trump, hat vorgeschlagen, Bidens Hund Commander zu erschießen. Amerika tobt. Commander schweigt.",https://www.jungewelt.de/img/1100/194672.jpg,2024-05-07T17:41:49Z,,"Jill und Joe leben in einem beschaulichen Haus an der Pennsylvania Avenue, inmitten von Washington. Allein nicht, doch einsam. Problemkind Hunter hält die Welt auf Trab, Problemhund Commander musste … [+1584 chars]",,de,'Hunter Biden'
