index,url,valid,domain,title,description,image,published,archive,content,quote,language,keyword
https://www.welt.de/politik/deutschland/plus247747030/Olaf-Scholz-Auf-dem-Weg-zum-neuen-Fluechtlingskanzler.html,https://www.welt.de/politik/deutschland/plus247747030/Olaf-Scholz-Auf-dem-Weg-zum-neuen-Fluechtlingskanzler.html,0,www.welt.de,Auf dem Weg zum neuen Flüchtlingskanzler,"Bundeskanzler Olaf Scholz (SPD) hat die Migrationskrise von 2015 miterlebt – aber aus einer anderen Sicht als seine Vorgängerin Angela Merkel (CDU). Aufgrund seiner Einsichten als früherer Hamburger Bürgermeister fühlt er sich nun besonders berufen, dem Land …",https://img.welt.de/img/politik/deutschland/mobile240768601/0361353077-ci16x9-w1200-fnov-fpotl-fpi157750653/DWO-Teaser-Bootsfluechtlinge-jb-jpg.jpg,2023-10-01T04:57:25Z,,"Die WELT als ePaper: Die vollständige Ausgabe steht Ihnen bereits am Vorabend zur Verfügung so sind Sie immer hochaktuell informiert. Weitere Informationen: http://epaper.welt.de 
 Der Kurz-Link die… [+49 chars]",,de,'Olaf Scholz'
https://www.dwdl.de/rundfunkrat/94914/dwdlrundfunkrat_schinkenstrasse_feiertag_und_nackte_haut/,https://www.dwdl.de/rundfunkrat/94914/dwdlrundfunkrat_schinkenstrasse_feiertag_und_nackte_haut/,0,www.dwdl.de,"DWDL-Rundfunkrat: Schinkenstraße, Feiertag und nackte Haut","Prime Video nimmt den ""Last Exit Schinkenstraße"", im ZDF startet die letzte ""Fritzie""-Staffel und bei Discovery+ feiert ""Naked Attraction"" sein Comeback. Außerdem: Die frühere Bundeskanzlerin Angela Merkel meldet sich zu Wort.",https://www.dwdl.de/images/1696003275_naked-attraction.jpg,2023-10-01T11:00:00Z,,"""Last Exit Schinkenstraße""ab Freitag, Prime VideoHeinz Strunk spielt einen Saxofonisten namens Peter, der genau wie Trompeter Torben (Marc Hosemann, bekannt von ""Die Discounter"") von einem Tag auf de… [+2875 chars]",,de,'Angela Merkel'
https://www.sueddeutsche.de/medien/merkel-interview-tag-der-deutschen-einheit-1.6266311,https://www.sueddeutsche.de/medien/merkel-interview-tag-der-deutschen-einheit-1.6266311,0,www.sueddeutsche.de,Angela Merkel im ZDF-Interview: Schlag in die Magengrube,Was sie zu Ostdeutschland und Migration noch sagen wollte: Angela Merkel gibt im ZDF das erste Interview nach ihrer Amtszeit als Kanzlerin.,https://www.sueddeutsche.de/image/sz.1.6266312/1200x675?v=1696173140,2023-10-01T14:56:07Z,,"Das ""Thema als solches"" interessiere sie eben, sagt Angela Merkel auf die geradezu verdutzte Frage des ZDF-Mannes Mitri Sirin, warum sie ausgerechnet jetzt das erste Interview seit dem Ende ihrer Amt… [+3086 chars]",,de,'Angela Merkel'
https://www.diepresse.com/17712423/ich-werde-ueberleben-erzkonservative-wollen-mccarthy-stuerzen,https://www.diepresse.com/17712423/ich-werde-ueberleben-erzkonservative-wollen-mccarthy-stuerzen,0,www.diepresse.com,„Ich werde überleben“: Erzkonservative wollen McCarthy stürzen,"Muss Kevin McCarthy um sein Spitzenamt fürchten? Hardliner wollen jedenfalls ihren eigenen „Speaker“ stürzen, weil er im Budget-Streit auf die Demokraten zugegangen war.",https://img.diepresse.com/public/incoming/pp93l8-2C21721B-1EC9-4118-BE6C-72FFE977D14C.jpg/alternates/DPR_SOCIAL_NACHRICHTEN/2C21721B-1EC9-4118-BE6C-72FFE977D14C.jpg,2023-10-02T04:42:51Z,,"Muss Kevin McCarthy um sein Spitzenamt fürchten? Hardliner wollen jedenfalls ihren eigenen Speaker stürzen, weil er im Budget-Streit auf die Demokraten zugegangen war. 
Der Republikaner Kevin McCart… [+5351 chars]",,de,'Matt Gaetz'
https://www.brigitte.de/aktuell/prinz-harry-und-herzogin-meghan--intime-momentaufnahmen-bei-den-invictus-games-in-deutschland-13597096.html,https://www.brigitte.de/aktuell/prinz-harry-und-herzogin-meghan--intime-momentaufnahmen-bei-den-invictus-games-in-deutschland-13597096.html,0,www.brigitte.de,Prinz Harry und Herzogin Meghan: Intime Momentaufnahmen bei den Invictus Games in Deutschland,"Von Prinz Harry und Herzogin Meghan sind neue Fotos aufgetaucht, die das Paar hinter den Kulissen der Invictus Games in Düsseldorf zeigen.",https://image.brigitte.de/13597098/t/iV/v1/w1440/r1.7778/-/02--intime-momentaufnahmen-bei-den-invictus-games-in-deutschland---1-1---spoton-article-1053434.jpg,2023-10-02T09:17:00Z,,"Von Prinz Harry und Herzogin Meghan sind neue Fotos aufgetaucht, die das Paar hinter den Kulissen der Invictus Games in Düsseldorf zeigen.
Von Prinz Harry (39) und Herzogin Meghan (42) sind neue Fot… [+1984 chars]",,de,'Prinz Harry'
https://www.stern.de/kultur/prinz-harry-und-herzogin-meghan--intime-momentaufnahmen-bei-den-invictus-games-33877378.html,https://www.stern.de/kultur/prinz-harry-und-herzogin-meghan--intime-momentaufnahmen-bei-den-invictus-games-33877378.html,0,www.stern.de,Prinz Harry und Herzogin Meghan: Intime Momentaufnahmen bei den Invictus Games,"Von Prinz Harry und Herzogin Meghan sind neue Fotos aufgetaucht, die das Paar hinter den Kulissen der Invictus Games in Düsseldorf zeigen.",https://image.stern.de/33877382/t/Q-/v1/w1440/r1.7778/-/02--intime-momentaufnahmen-bei-den-invictus-games---16-9---spoton-article-1053434.jpg,2023-10-02T09:24:00Z,,"Von Prinz Harry und Herzogin Meghan sind neue Fotos aufgetaucht, die das Paar hinter den Kulissen der Invictus Games in Düsseldorf zeigen.
Von Prinz Harry (39) und Herzogin Meghan (42) sind neue Fot… [+1942 chars]",,de,'Prinz Harry'
https://www.stern.de/lifestyle/mode/sarah-burton--designerin-von-kates-hochzeitskleid-verlaesst-mcqueen-33874850.html,https://www.stern.de/lifestyle/mode/sarah-burton--designerin-von-kates-hochzeitskleid-verlaesst-mcqueen-33874850.html,0,www.stern.de,Pariser Modewoche: Sie entwarf Kates Hochzeitskleid. Jetzt verlässt Designerin Sarah Burton die Marke Alexander McQueen,"Im Dienst der Krone: Sarah Burton schneiderte einst das Hochzeitskleid von Herzogin Kate. Nun verlässt sie die Marke Alexander McQueen. Was sollen Fans wie Lady Gaga, Cate Blanchett und die royale Kundschaft nun tragen?",https://image.stern.de/33874860/t/lV/v3/w1440/r1.7778/-/sarah-burton-kleid.jpg,2023-10-02T10:56:00Z,,"02.10.2023, 12:56
 3 Min.
Im Dienst der Krone: Sarah Burton schneiderte einst das Hochzeitskleid von Herzogin Kate. Nun verlässt sie die Marke Alexander McQueen. Was sollen Fans wie Lady Gaga, Cate… [+4946 chars]",,de,'Lady Gaga'
https://www.brigitte.de/aktuell/-germany-s-next-topmodel---dreharbeiten-zur-19--staffel-haben-begonnen-13597312.html,https://www.brigitte.de/aktuell/-germany-s-next-topmodel---dreharbeiten-zur-19--staffel-haben-begonnen-13597312.html,0,www.brigitte.de,"""Germany's next Topmodel"": Dreharbeiten zur 19. Staffel haben begonnen","Heidi Klum meldet sich aus Berlin bei ihren Fans: Die Dreharbeiten zur 19. Staffel von ""Germany's next Topmodel"" haben begonnen.",https://image.brigitte.de/13597314/t/UY/v1/w1440/r1.7778/-/02--dreharbeiten-zur-19--staffel-haben-begonnen---1-1---spoton-article-1053450.jpg,2023-10-02T12:04:00Z,,"Heidi Klum meldet sich aus Berlin bei ihren Fans: Die Dreharbeiten zur 19. Staffel von ""Germany's next Topmodel"" haben begonnen.
Heidi Klum (50) und ihre Nachwuchsmodels sind zurück. Die Dreharbeite… [+1017 chars]",,de,'Heidi Klum'
https://www.tagesschau.de/inland/innenpolitik/boris-rhein-hessenwahl-100.html,https://www.tagesschau.de/inland/innenpolitik/boris-rhein-hessenwahl-100.html,0,www.tagesschau.de,Boris Rhein vor Hessenwahl: Der Achterbahnfahrer,"Ministerpräsident ist er schon, aber nun muss sich Boris Rhein erstmals einer Landtagswahl stellen und sein Amt verteidigen. Für den CDU-Politiker ging es in seiner Karriere nicht immer aufwärts. Von Ute Wellstein.",https://images.tagesschau.de/image/dc3578ab-ffe1-4285-9811-ffe8fbfec0a8/AAABivBlRGs/AAABibBxqrQ/16x9-1280/boris-rhein-110.jpg,2023-10-02T12:30:55Z,,"Stand: 02.10.2023 14:30 Uhr
Ministerpräsident ist er schon, aber nun muss sich Boris Rhein erstmals einer Landtagswahl stellen und sein Amt verteidigen. Für den CDU-Politiker ging es in seiner Karri… [+5195 chars]",,de,'Boris Rhein'
https://www.focus.de/politik/machtkampf-bei-den-us-republikanern-trump-naher-republikaner-will-mccarthy-absetzen_id_217391249.html,https://www.focus.de/politik/machtkampf-bei-den-us-republikanern-trump-naher-republikaner-will-mccarthy-absetzen_id_217391249.html,0,www.focus.de,Machtkampf bei den US-Republikanern - Trump-naher Republikaner will McCarthy absetzen,Nur durch einen Kompromiss mit den Demokraten konnte Kevin McCarthy die US-Haushaltssperre abwenden. Die rechten Hardliner seiner Partei wollen den Republikaner deshalb loswerden - und greifen zu einem seltenen Mittel.,https://p6.focus.de/img/politik/ausland/id_217384109/kevin-mccarthy-galt-von-anfang-an-als-politisch-geschwaecht..jpg?im=Crop%3D%280%2C211%2C2048%2C1024%29%3BResize%3D%281200%2C627%29&impolicy=perceptual&quality=mediumHigh&hash=db0a1356f7c3fd0c1264743df714c5d64604e86c052a834bbeaef0bbbb18e93b,2023-10-03T00:46:45Z,,Nur durch einen Kompromiss mit den Demokraten konnte Kevin McCarthy die US-Haushaltssperre abwenden. Die rechten Hardliner seiner Partei wollen den Republikaner deshalb loswerden - und greifen zu ein… [+2478 chars],,de,'Kevin McCarthy'
https://www.faz.net/aktuell/politik/ausland/repraesentantenhauys-matt-gaetz-will-mccarthy-absetzen-19216548.html,https://www.faz.net/aktuell/politik/ausland/repraesentantenhauys-matt-gaetz-will-mccarthy-absetzen-19216548.html,0,www.faz.net,Machtkampf der US-Republikaner: Matt Gaetz will Speaker McCarthy wegputschen,"Als Vorsitzender des US-Repräsentantenhauses musste Kevin McCarthy im Haushaltsstreit Entscheidungen treffen, die radikaleren Parteikollegen nicht passten. Ein Abgeordneter aus Florida ruft nun zur Revolte auf.",https://media0.faz.net/ppmedia/aktuell/2493282633/1.9216556/facebook_teaser/matt-gaetz-spricht-mit.jpg,2023-10-03T01:56:02Z,,"Es ist ein äußerst ungewöhnlicher und in der Geschichte der USA sehr seltener Schritt: Ein republikanischer Abgeordneter hat einen Antrag auf Absetzung des Vorsitzenden des US-Repräsentantenhauses, K… [+2433 chars]",,de,'Matt Gaetz'
https://www.nzz.ch/international/mccarthy-kaempft-um-sein-ueberleben-ld.1758974,https://www.nzz.ch/international/mccarthy-kaempft-um-sein-ueberleben-ld.1758974,0,www.nzz.ch,Nach dem Showdown ist vor dem Showdown: McCarthy kämpft um sein politisches Überleben – retten ihn die Demokraten?,"Der Shutdown in den USA ist aufgeschoben, aber der Machtkampf im Kongress eskaliert nun erst recht. Der republikanische Speaker Kevin McCarthy wird womöglich nur mithilfe der Demokraten überleben. Vor allem, wenn er neue Milliarden für die Ukraine zur Abstimm…","https://img.nzz.ch/2023/10/02/d42bf807-aff9-47ff-931e-f825fd1fc2cc.jpeg?width=1200&height=675&fit=bound&quality=75&auto=webp&crop=4320,2430,x0,y0&wmark=nzz",2023-10-03T03:30:00Z,,"Der Speaker McCarthy steht nach seiner spektakulären Kehrtwende mit dem Rücken zur Wand. 
Der Showdown zum drohenden Shutdown am vergangenen Sonntag war nur eine Ouvertüre für ein noch unerbittliche… [+5190 chars]",,de,'Matt Gaetz'
https://www.diepresse.com/17714705/republikanischer-hardliner-beantragte-absetzung-von-mccarthy,https://www.diepresse.com/17714705/republikanischer-hardliner-beantragte-absetzung-von-mccarthy,0,www.diepresse.com,Republikanischer Hardliner beantragte Absetzung von McCarthy,"Der Abgeordnete Matt Gaetz stellte den Antrag, das Amt des Vorsitzenden des US-Repräsentantenhauses für vakant zu erklären. McCarthy hatte sich zuvor mit den Demokraten geeinigt.",https://img.diepresse.com/public/incoming/odyfc8-USA-CONGRESSMCCARTHY/alternates/DPR_SOCIAL_NACHRICHTEN/USA-CONGRESSMCCARTHY,2023-10-03T03:35:15Z,,"Der Abgeordnete Matt Gaetz stellte den Antrag, das Amt des Vorsitzenden des US-Repräsentantenhauses für vakant zu erklären. McCarthy hatte sich zuvor mit den Demokraten geeinigt.
Der rechte Hardline… [+2575 chars]",,de,'Matt Gaetz'
https://www.stern.de/lifestyle/leute/mark-zuckerberg-zeigt-sich-mit-kampfverletzungen-im-gesicht-3205306.html,https://www.stern.de/lifestyle/leute/mark-zuckerberg-zeigt-sich-mit-kampfverletzungen-im-gesicht-3205306.html,0,www.stern.de,Leute von heute: Blaue Flecken und eine Wunde: Mark Zuckerberg schockiert Fans mit Gesichtsverletzungen,Auf Instagram zeigt Facebook-Gründer Mark Zuckerberg ein verstörendes Bild von sich: Sein Gesicht weist mehrere Verletzungen auf. Diese und weitere Promi-Meldungen in den VIP-News.,https://image.stern.de/33879726/t/J3/v8/w1440/r1.7778/-/lvh-3-10--mark-zuckerberg-blaues-auge.jpg,2023-10-03T09:36:00Z,,"Von ""A"" wie Angelina Jolie oder Amal Clooney über ""H"" wie Heidi Klum und Helene Fischer bis ""Z"" wie Zac Efron und Zara Tindall: In der Welt der Promis ist immer etwas los. Ob sich nun neue Paare find… [+494 chars]",,de,'Heidi Klum'
https://www.tagesspiegel.de/internationales/nach-wahl-in-spanien-konig-felipe-gibt-pedro-sanchez-den-auftrag-zur-regierungsbildung-10564720.html,https://www.tagesspiegel.de/internationales/nach-wahl-in-spanien-konig-felipe-gibt-pedro-sanchez-den-auftrag-zur-regierungsbildung-10564720.html,0,www.tagesspiegel.de,Nach Pleite des Wahlsiegers: Spaniens König gibt Pedro Sánchez den Auftrag zur Regierungsbildung,"Sozialist Sánchez muss nun versuchen, eine Mehrheit für seine Wahl zum Regierungschef zu schaffen. Daran war der konservative Wahlsieger Alberto Núñez Feijóo gescheitert.",https://www.tagesspiegel.de/images/spain-politics-government1/alternates/BASE_16_9_W1400/spain-politics-government.jpeg,2023-10-03T12:40:45Z,,"Spaniens König Felipe VI. hat den bisherigen Regierungschef Pedro Sánchez mit der Regierungsbildung betraut. Das gab die Präsidentin des Parlaments, Francina Armengol, am Dienstag in Madrid bekannt. … [+199 chars]",,de,'Pedro Sánchez'
https://www.morgenpost.de/politik/article239721503/usa-republikaner-matt-gaetz-donald-trump-keven-mccarthy.html,https://www.morgenpost.de/politik/article239721503/usa-republikaner-matt-gaetz-donald-trump-keven-mccarthy.html,0,www.morgenpost.de,Politik-Fehde in den USA: „Trumps Terrier“: Wer ist der US-Republikaner Matt Gaetz?,Er gehört zu den Rechtesten der US-Republikaner: Matt Gaetz. Nun will Trumps Terrier „Königsmörder” werden und die Nr. 3 im Staate stürzen.,https://img.morgenpost.de/img/politik/crop239721501/5412607585-w820-cv16_9-q85/ee278734-61dc-11ee-b7ae-1529444f74d7.jpg,2023-10-03T12:47:48Z,,"Washington.  Manche Parteifreunde nennen ihn hinter vorgehaltener Hand den Bombenwerfer vom Dienst, andere den Verrücktesten unter den Trump-Verrückten in der extrem rechten Ecke der Republikaner im … [+6016 chars]",,de,'Matt Gaetz'
https://www.morgenpost.de/politik/ausland/article239721751/Pedro-Sanchez-mit-Regierungsbildung-beauftragt.html,https://www.morgenpost.de/politik/ausland/article239721751/Pedro-Sanchez-mit-Regierungsbildung-beauftragt.html,0,www.morgenpost.de,Wahlen: Pedro Sánchez mit Regierungsbildung beauftragt,Die Parlamentswahl in Spanien fand bereits am 23. Juli statt. Doch einen neuen Ministerpräsidenten hat das Land noch nicht. Nun darf Pedro Sánchez Mehrheiten suchen.,https://img.morgenpost.de/img/ausland/crop239721749/6762602956-w820-cv16_9-q85/Pedro-Sanchez.jpg,2023-10-03T12:57:30Z,,Madrid. König Felipe VI. hat in Spanien den geschäftsführenden Ministerpräsidenten Pedro Sánchez mit der Bildung einer neuen Regierung beauftragt. Das habe das Staatsoberhaupt nach einer neuen zweitä… [+894 chars],,de,'Pedro Sánchez'
https://www.sueddeutsche.de/meinung/us-kongress-speaker-kevin-mccarthy-trump-us-politik-demokraten-republikaner-kommentar-1.6269711,https://www.sueddeutsche.de/meinung/us-kongress-speaker-kevin-mccarthy-trump-us-politik-demokraten-republikaner-kommentar-1.6269711,0,www.sueddeutsche.de,USA: Der Feind meines Feindes ...,"Den Demokraten bleibt wenig anderes übrig: Sie müssen den republikanischen Speaker Kevin McCarthy vor den radikalen Trumpisten schützen. Es geht darum, noch viel größeren Schaden abzuwenden.",https://www.sueddeutsche.de/image/sz.1.6269712/1200x675?v=1696344337,2023-10-03T15:24:40Z,,"Den Demokraten bleibt wenig anderes übrig: Sie müssen den republikanischen Speaker Kevin McCarthy vor den radikalen Trumpisten schützen. Es geht darum, noch viel größeren Schaden abzuwenden. Verfahre… [+550 chars]",,de,'Matt Gaetz'
https://www.stern.de/news/spaniens-koenig-beauftragt-bisherigen-regierungschef-s%C3%A1nchez-mit-regierungsbildung-33880622.html,https://www.stern.de/news/spaniens-koenig-beauftragt-bisherigen-regierungschef-s%C3%A1nchez-mit-regierungsbildung-33880622.html,0,www.stern.de,Spaniens König beauftragt bisherigen Regierungschef Sánchez mit Regierungsbildung,"Spaniens König Felipe VI. hat den bisherigen Regierungschef Pedro Sánchez mit der Regierungsbildung betraut. Die Verhandlungen mit anderen Parteien zur Bildung einer Regierungsmehrheit würden ""schwierig"", er habe aber ""Vertrauen"", dass es gelingen könne, sagt…",https://image.stern.de/33880624/t/q_/v1/w1440/r1.7778/-/03--pedro-s%C3%A1nchez-am-dienstag-in-madrid---f9e9ba3d18a73384.jpg,2023-10-03T16:09:15Z,,"Spaniens König Felipe VI. hat den bisherigen Regierungschef Pedro Sánchez mit der Regierungsbildung betraut. Die Verhandlungen mit anderen Parteien zur Bildung einer Regierungsmehrheit würden ""schwie… [+2826 chars]",,de,'Pedro Sánchez'
https://www.tagesschau.de/ausland/amerika/ukraine-hilfen-usa-selenskyj-frontbesuch-100.html,https://www.tagesschau.de/ausland/amerika/ukraine-hilfen-usa-selenskyj-frontbesuch-100.html,0,www.tagesschau.de,US-Haushaltsstreit: Biden will der Ukraine helfen - nur wie?,"US-Präsident Biden hat mit Verbündeten über die Ukraine-Hilfe beraten. Denn durch den US-Haushaltsstreit wird das Geld knapp. An der Front in der Ukraine begutachtete Präsident Selenskyj deutsche ""Leopard""-Panzer.",https://images.tagesschau.de/image/a5abdf3d-b295-4753-a607-3ac8aa9e8c6e/AAABivbqOwY/AAABibBxqrQ/16x9-1280/biden-732.jpg,2023-10-03T19:01:00Z,,"Stand: 03.10.2023 21:01 Uhr
US-Präsident Biden hat mit Verbündeten über die Ukraine-Hilfe beraten. Denn durch den US-Haushaltsstreit wird das Geld knapp. An der Front in der Ukraine begutachtete Prä… [+3375 chars]",,de,'Charles Michel'
https://www.n-tv.de/politik/US-Republikaner-stuerzen-Vorsitzenden-des-Repraesentantenhauses-article24439138.html,https://www.n-tv.de/politik/US-Republikaner-stuerzen-Vorsitzenden-des-Repraesentantenhauses-article24439138.html,0,www.n-tv.de,Historisches Votum: US-Republikaner stürzen Vorsitzenden des Repräsentantenhauses,"Die Arbeit von Kevin McCarthy als Vorsitzender des US-Repräsentantenhauses steht von Anfang an unter keinem guten Stern. Radikale Parteikollegen treiben ihn seit Anbeginn vor sicher her. Nun sorgen sie dafür, dass er auf bittere Weise Geschichte schreibt.",https://bilder3.n-tv.de/img/incoming/crop24439142/5191328991-cImg_16_9-w1200/7140aa092333d5896e6de7a118ad7990.jpg,2023-10-03T20:49:46Z,,Die Arbeit von Kevin McCarthy als Vorsitzender des US-Repräsentantenhauses steht von Anfang an unter keinem guten Stern. Radikale Parteikollegen treiben ihn seit Anbeginn vor sicher her. Nun sorgen s… [+4044 chars],,de,'Kevin McCarthy'
https://www.dw.com/de/us-repr%C3%A4sentantenhaus-setzt-vorsitzenden-mccarthy-ab/a-64742958,https://www.dw.com/de/us-repr%C3%A4sentantenhaus-setzt-vorsitzenden-mccarthy-ab/a-64742958,0,www.dw.com,US-Repräsentantenhaus setzt Vorsitzenden McCarthy ab,"Die US-Republikaner im Repräsentantenhaus haben ihren eigenen Vorsitzenden gestürzt. Sie stimmten gegen den Präsidenten der Kongresskammer Kevin McCarthy. Hintergrund war dessen Entscheidung, trotz der Warnungen einer Gruppe von etwa zwei Dutzend Hardlinern a…",https://static.dw.com/image/66989217_6.jpg,2023-10-03T20:51:00Z,,Die Arbeit von Kevin McCarthy als Vorsitzender des US-Repräsentantenhauses stand von Anfang an unter keinem guten Stern. Radikale Parteikollegen trieben ihn seit Anbeginn vor sicher her. Nun sorgten … [+5202 chars],,de,'Matt Gaetz'
https://www.nzz.ch/international/ld.1759217,https://www.nzz.ch/international/ld.1759217,0,www.nzz.ch,Kevin McCarthy ist als Vorsitzender des US-Repräsentantenhauses abgewählt worden,Historische Schlappe für den Republikaner: Erstmals in der 250-jährigen Geschichte der USA hat ein Vorsitzender des Repräsentantenhauses eine Vertrauensabstimmung verloren.,"https://img.nzz.ch/2023/10/03/35ae4947-cdfb-4002-a0c3-f128ce8e9781.jpeg?width=1200&height=675&fit=bound&quality=75&auto=webp&crop=4000,2250,x0,y209&wmark=nzz",2023-10-03T20:52:16Z,,"(dpa) / vof. Der Vorsitzende des Repräsentantenhauses, Kevin McCarthy hat eine Vertrauensabstimmung im US-Parlament verloren. Damit wird der Republikaner abgesetzt. 
Der radikale republikanische Abg… [+1097 chars]",,de,'Kevin McCarthy'
https://www.focus.de/politik/ausland/historisches-votum-mccarthy-verliert-vorsitz-im-us-repraesentantenhaus_id_217925053.html,https://www.focus.de/politik/ausland/historisches-votum-mccarthy-verliert-vorsitz-im-us-repraesentantenhaus_id_217925053.html,0,www.focus.de,Historisches Votum - McCarthy verliert Vorsitz im US-Repräsentantenhaus,"Zum ersten Mal in der US-Geschichte ist ein Vorsitzender des Repräsentantenhauses durch ein Parlamentsvotum von seinem mächtigen Posten abgesetzt worden. Eine Mehrheit der Parlamentskammer stimmte am Dienstag dafür, den republikanischen Vorsitzenden, Kevin Mc…",https://p6.focus.de/img/fotos/id_217924082/kevin-mccarthy.jpg?im=Crop%3D%280%2C166%2C3464%2C1732%29%3BResize%3D%281200%2C627%29&impolicy=perceptual&quality=mediumHigh&hash=9c10fdff6eaf0b8fffb61bd541a326789efeaf0ec382448360ccceeae2823c81,2023-10-03T21:00:58Z,,Zum ersten Mal in der US-Geschichte ist ein Vorsitzender des Repräsentantenhauses durch ein Parlamentsvotum von seinem mächtigen Posten abgesetzt worden. Eine Mehrheit der Parlamentskammer stimmte am… [+3795 chars],,de,'Kevin McCarthy'
https://www.morgenpost.de/politik/article239721503/usa-republikaner-matt-gaetz-donald-trump-kevin-mccarthy.html,https://www.morgenpost.de/politik/article239721503/usa-republikaner-matt-gaetz-donald-trump-kevin-mccarthy.html,0,www.morgenpost.de,Politik-Fehde in den USA: „Trumps Terrier“: Matt Gaetz beißt Kevin McCarthy weg,"Er gehört zu den Rechtesten der US-Republikaner: Matt Gaetz. Nun hat er die Nr. 3 im Staate gestürzt, den mächtigsten Parteifreund.",https://img.morgenpost.de/img/politik/crop239721501/5412607585-w820-cv16_9-q85/ee278734-61dc-11ee-b7ae-1529444f74d7.jpg,2023-10-03T21:03:00Z,,"Washington. Manche Parteifreunde nennen ihn hinter vorgehaltener Hand den Bombenwerfer vom Dienst, andere den Verrücktesten unter den Trump-Verrückten in der extrem rechten Ecke der Republikaner im K… [+5724 chars]",,de,'Matt Gaetz'
https://orf.at/stories/3333413/,https://orf.at/stories/3333413/,0,orf.at,McCarthy von eigenen Leuten abgesetzt,"Das US-Repräsentantenhaus hat in einer namentlichen Abstimmung für die Absetzung des Vorsitzenden, Kevin McCarthy, gestimmt. Es ist das erste Mal in der US-Geschichte, dass der „Speaker“ per Votum der Abgeordneten des Amtes enthoben wird. Es ist umso bizarrer…",https://ibs.orf.at/news?image=https%3A%2F%2Fassets.orf.at%2Fmims%2F2023%2F40%2F45%2Fcrops%2Fw%3D1200%2Ch%3D630%2Cq%3D75%2F1960981_master_737845_usa_kongress_mccarthy_absetzung_im.jpg%3Fs%3Dc9be5cc1748fbca6d2238eecfe81c89f7e4e65c1,2023-10-03T21:06:45Z,,"Damit hatte die Revolte der rechtsradikalen und trumptreuen Fraktion der Republikaner Erfolg. 216 Abgeordnete stimmten für die Amtsenthebung, 210 dagegen. Die Demokraten, soweit anwesend, stimmten ge… [+1578 chars]",,de,'Kevin McCarthy'
https://www.diepresse.com/17716338/historisches-votum-republikaner-setzen-eigenen-repraesentantenhaus-vorsitzenden-ab,https://www.diepresse.com/17716338/historisches-votum-republikaner-setzen-eigenen-repraesentantenhaus-vorsitzenden-ab,0,www.diepresse.com,Historisches Votum: Republikaner setzen eigenen Repräsentantenhaus-Vorsitzenden ab,"Eine parteiinterne Revolte bei den Republikanern sorgt dafür, dass Kevin McCarthy seinen Posten verliert.",https://img.diepresse.com/public/incoming/1m0cxz-USA-CONGRESSMCCARTHY/alternates/DPR_SOCIAL_NACHRICHTEN/USA-CONGRESSMCCARTHY,2023-10-03T21:14:41Z,,"Eine parteiinterne Revolte bei den Republikanern sorgt dafür, dass Kevin McCarthy seinen Posten verliert.
Zum ersten Mal in der US-Geschichte ist ein Vorsitzender des Repräsentantenhauses durch ein … [+1258 chars]",,de,'Matt Gaetz'
https://www.n-tv.de/politik/Michel-Ukraine-kann-2030-zur-EU-gehoeren-article24439174.html,https://www.n-tv.de/politik/Michel-Ukraine-kann-2030-zur-EU-gehoeren-article24439174.html,0,www.n-tv.de,"EU-Ratspräsident für Beitritt: Michel: ""Ukraine kann 2030 zur EU gehören""","Die Ukraine will Mitglied der Europäischen Union werden. Zuspruch kommt nicht nur aus Deutschland, sondern auch vom EU-Ratspräsidenten Charles Michel - sofern die Ukraine ""ihre Hausaufgaben"" mache, betont er.",https://bilder4.n-tv.de/img/incoming/crop24439179/4181324339-cImg_16_9-w1200/a9eace3b39bf223572ac67fc9c41fdc3.jpg,2023-10-04T01:13:09Z,,"Die Ukraine will Mitglied der Europäischen Union werden. Zuspruch kommt nicht nur aus Deutschland, sondern auch vom EU-Ratspräsidenten Charles Michel - sofern die Ukraine ""ihre Hausaufgaben"" mache, b… [+1740 chars]",,de,'Charles Michel'
