index,url,valid,domain,title,description,image,published,archive,content,quote,language,keyword
https://www.morgenpost.de/kultur/tv/article232083657/markus-lanz-heute-gaeste-zdf-talkshow-4-mai-mittwoch-politik-tv.html,https://www.morgenpost.de/kultur/tv/article232083657/markus-lanz-heute-gaeste-zdf-talkshow-4-mai-mittwoch-politik-tv.html,0,www.morgenpost.de,"ZDF-Sendung: ""Markus Lanz"" am Mittwoch: Diese Gäste sind heute im TV","Dreimal wöchentlich spricht Markus Lanz mit seinen Gästen über aktuelle Themen. Lesen Sie hier, wer am 4. Mai in der Sendung dabei ist.",https://img.morgenpost.de/img/Import/crop237158833/898260803-w820-cv16_9-q85/Markus-Lanz.jpg,2023-05-04T16:10:00Z,,"Berlin. <ul><li>Markus Lanz moderiert eine der erfolgreichsten Talkshows im deutschen TV</li><li>Der Moderator begrüßt dreimal wöchentlich Politikerinnen, Prominente, Journalistinnen und Experten im … [+1358 chars]",,de,'Markus Lanz'
https://www.jungewelt.de/artikel/450283.putin-freund-kein-geld-für-schröder-übrig.html,https://www.jungewelt.de/artikel/450283.putin-freund-kein-geld-für-schröder-übrig.html,0,www.jungewelt.de,»Putin-Freund«: Kein Geld für Schröder übrig,Berlin: Verwaltungsgericht schmettert Klage von Exkanzler wegen Entzug von Büro und Mitarbeitern ab. Gang zur nächsten Instanz wahrscheinlich • Foto: Kay Nietfeld/dpa,https://www.jungewelt.de/img/1100/180469.jpg,2023-05-04T17:40:43Z,,"Der ehemalige Bundeskanzler Gerhard Schröder konnte zuletzt zwar seinen Rauswurf aus der SPD verhindern, wird vorerst aber nicht wieder als vollwertiges Mitglied des deutschen politischen Betriebes z… [+4634 chars]",,de,'Joachim Gauck'
https://www.nzz.ch/international/selenski-zu-besuch-beim-icc-und-in-den-niederlanden-ld.1736504,https://www.nzz.ch/international/selenski-zu-besuch-beim-icc-und-in-den-niederlanden-ld.1736504,0,www.nzz.ch,Selenski fordert ein Sondertribunal gegen Putin nach dem Vorbild der Nürnberger Prozesse,"Die Niederlande sind Gastland des Internationalen Strafgerichtshofs und ein wichtiger militärischer Verbündeter Kiews. Der ukrainische Präsident Selenski reiste nach Den Haag, um sich Kampfflugzeuge und ein neues Kriegsgericht zu wünschen. Letzteres könnte ba…","https://img.nzz.ch/2023/05/04/31de06aa-7927-40d6-9a20-7ff5d6668f60.jpeg?width=1200&height=675&fit=bound&quality=75&auto=webp&crop=4250,2391,x0,y188&wmark=nzz",2023-05-04T18:09:26Z,https://web.archive.org/web/20230504212316/https://www.nzz.ch/international/selenski-zu-besuch-beim-icc-und-in-den-niederlanden-ld.1736504,"Der ukrainische Präsident Wolodimir Selenski auf den Stufen des niederländischen Königspalastes in Den Haag
Vorbei ist die Zeit, in der sich Wolodimir Selenski nur per Video in die europäischen Parl… [+3698 chars]",,de,'Wolodimir Selenski'
https://consent.google.com/ml?continue=https://news.google.com/rss/articles/CBMirwFodHRwczovL3d3dy5ldXJvc3BvcnQuZGUvZnVzc2JhbGwvbGlndWUtMS8yMDIxLTIwMjIvcGFyaXMtc2FpbnQtZ2VybWFpbi1pbS1jaGFvcy1saW9uZWwtbWVzc2ktdW5kLW5leW1hci1zb3JnZW4tZnVyLWZhbi1wcm90ZXN0ZS12ZXJlaW4tc3RlaHQtdm9yLXdpY2h0aV9zdG85NTkwMjU2L3N0b3J5LnNodG1s0gEA?oc%3D5&gl=FR&hl=en-US&cm=2&pc=n&src=1,https://consent.google.com/ml?continue=https://news.google.com/rss/articles/CBMirwFodHRwczovL3d3dy5ldXJvc3BvcnQuZGUvZnVzc2JhbGwvbGlndWUtMS8yMDIxLTIwMjIvcGFyaXMtc2FpbnQtZ2VybWFpbi1pbS1jaGFvcy1saW9uZWwtbWVzc2ktdW5kLW5leW1hci1zb3JnZW4tZnVyLWZhbi1wcm90ZXN0ZS12ZXJlaW4tc3RlaHQtdm9yLXdpY2h0aV9zdG85NTkwMjU2L3N0b3J5LnNodG1s0gEA?oc%3D5&gl=FR&hl=en-US&cm=2&pc=n&src=1,0,consent.google.com,Paris Saint-Germain im Chaos: Lionel Messi und Neymar sorgen für Fan-Proteste - Verein steht vor wichtigen Entschlüssen - Eurosport DE,"<ol><li>Paris Saint-Germain im Chaos: Lionel Messi und Neymar sorgen für Fan-Proteste - Verein steht vor wichtigen Entschlüssen  Eurosport DE
</li><li>PSG: Fans gehen auf Messi los – und wüten vor Neymar-Villa – totales Chaos in Paris! | Sport  BILD
</li><l…",,2023-05-04T20:16:00Z,,"We use cookies and data to<ul><li>Deliver and maintain Google services</li><li>Track outages and protect against spam, fraud, and abuse</li><li>Measure audience engagement and site statistics to unde… [+1131 chars]",,de,'Lionel Messi'
https://www.stern.de/lifestyle/leute/adel--kroenungsblumen--von-der-isle-of-skye-bis-cornwall-33438522.html,https://www.stern.de/lifestyle/leute/adel--kroenungsblumen--von-der-isle-of-skye-bis-cornwall-33438522.html,0,www.stern.de,Adel: Krönungsblumen: Von der Isle of Skye bis Cornwall,"Die sorgfältig ausgewählten Blumen und Pflanzen, mit denen die Westminster Abbey zur Krönungszeremonie von König Charles III. geschmückt werden, haben eine ganz besondere Bedeutung.",https://image.stern.de/33438524/t/Hm/v1/w1440/r1.7778/-/05--urnnewsmldpacom2009010123050599566554v3w800h600l535t438r1815b1291jpeg---81de55b321075036.jpg,2023-05-05T01:58:23Z,https://web.archive.org/web/20230505071011/https://www.stern.de/lifestyle/leute/adel--kroenungsblumen--von-der-isle-of-skye-bis-cornwall-33438522.html,"Die sorgfältig ausgewählten Blumen und Pflanzen, mit denen die Westminster Abbey zur Krönungszeremonie von König Charles III. geschmückt werden, haben eine ganz besondere Bedeutung.
Nieswurz, Tulpen… [+1552 chars]",,de,'König Charles III'
https://www.stern.de/gesellschaft/regional/bayern/bundesliga--spd-chef-klingbeil-ueber-fc-bayern--erst-titel--dann-analyse-33438656.html,https://www.stern.de/gesellschaft/regional/bayern/bundesliga--spd-chef-klingbeil-ueber-fc-bayern--erst-titel--dann-analyse-33438656.html,0,www.stern.de,"Bundesliga: SPD-Chef Klingbeil über FC Bayern: Erst Titel, dann Analyse","SPD-Chef Lars Klingbeil freut sich, dass der FC Bayern München das Saisonfinale in der Fußball-Bundesliga als Spitzenreiter angeht. ""Das ist auch der richtige Anspruch. Jetzt liegt es an uns"", sagte Klingbeil, der auch dem Verwaltungsbeirat des deutschen Fußb…",https://image.stern.de/33438658/t/oh/v1/w1440/r1.7778/-/05--urnnewsmldpacom2009010123050599566929v3w800h600l471t392r1661b1183jpeg---40ef456825a436c0.jpg,2023-05-05T03:18:29Z,https://web.archive.org/web/20230505151607/https://www.stern.de/gesellschaft/regional/bayern/bundesliga--spd-chef-klingbeil-ueber-fc-bayern--erst-titel--dann-analyse-33438656.html,"SPD-Chef Lars Klingbeil freut sich, dass der FC Bayern München das Saisonfinale in der Fußball-Bundesliga als Spitzenreiter angeht. ""Das ist auch der richtige Anspruch. Jetzt liegt es an uns"", sagte … [+1470 chars]",,de,'Lars Klingbeil'
https://www.faz.net/aktuell/politik/ausland/die-lage-in-der-ukraine-kiew-russische-lazarette-ueberfuellt-18870300.html,https://www.faz.net/aktuell/politik/ausland/die-lage-in-der-ukraine-kiew-russische-lazarette-ueberfuellt-18870300.html,0,www.faz.net,Die Nacht in der Ukraine: Russische Lazarette im Osten laut Kiew überfüllt,"Um Bachmut herum wird weiter schwer gekämpft. Die USA sehen geringe Chancen, dass Moskau bei Verhandlungen Zugeständnisse machen könnte. Der ukrainische Präsident Selenskyj will Putin vor dem Strafgerichtshof in Den Haag sehen. Der Überblick.",https://media1.faz.net/ppmedia/aktuell/politik/3085451885/1.8870321/facebook_teaser/ukrainische-soldaten-laufen.jpg,2023-05-05T03:22:50Z,https://web.archive.org/web/20230505055821/http://www.faz.net/aktuell/politik/ausland/die-lage-in-der-ukraine-kiew-russische-lazarette-ueberfuellt-18870300.html,"Die russischen Streitkräfte setzten ihre Angriffe in der Ostukraine fort. Einmal mehr sei die Stadt Bachmut im Brennpunkt des Geschehens gewesen, berichtete der ukrainische Generalstab am Abend in se… [+3957 chars]",,de,'Wladimir Putin'
https://www.nzz.ch/international/charles-iii-britische-republikaner-wollen-monarchie-abschaffen-ld.1735675,https://www.nzz.ch/international/charles-iii-britische-republikaner-wollen-monarchie-abschaffen-ld.1735675,0,www.nzz.ch,«Die Monarchie hat ihre Starspielerin verloren» – britische Republikaner wittern vor der Krönung von König Charles III. Morgenluft,"Die Monarchie löst in der britischen Bevölkerung weniger Begeisterung aus als früher, und Charles III. ist weniger beliebt als Elizabeth II.. Republikaner sehen daher in der Krönung von Charles eine historische Chance zur Abschaffung der Monarchie.","https://img.nzz.ch/2023/05/04/5d11d73e-1413-4f1d-b64e-f7da7dc15366.jpeg?width=1200&height=674&fit=bound&quality=75&auto=webp&crop=5849,3286,x0,y448&wmark=nzz",2023-05-05T03:30:00Z,https://web.archive.org/web/20230505074643/https://www.nzz.ch/international/charles-iii-britische-republikaner-wollen-monarchie-abschaffen-ld.1735675,"Gegner der britischen Monarchie empfangen König Charles mit Plakaten mit der Aufschrift «Nicht mein König» bei einem Auftritt in Milton Keynes.
Wenn König Charles III. und Königin Camilla am Samstag… [+5139 chars]",,de,'Prinz Harry'
https://www.handelsblatt.com/politik/international/ukraine-die-lage-am-morgen-russland-hochwasser-gefaehrdet-sicherheit-von-atomkraftwerk/28144208.html,https://www.handelsblatt.com/politik/international/ukraine-die-lage-am-morgen-russland-hochwasser-gefaehrdet-sicherheit-von-atomkraftwerk/28144208.html,0,www.handelsblatt.com,Ukraine – Die Lage am Morgen: Russland: Hochwasser gefährdet Sicherheit von Atomkraftwerk – Ukrainisches Militär: Schwere Kämpfe in Bachmut dauern an,"Die USA sehen geringe Chancen, dass Moskau bei Verhandlungen aktuell Zugeständnisse macht. Selenski will derweil seinen Kontrahenten Putin vor dem Strafgerichtshof in Den Haag sehen.",https://www.handelsblatt.com/images/akw-saporischja/29133968/2-format2003.jpg,2023-05-05T04:50:32Z,,"AKW SaporischjaUkrainische Behörden hatten dagegen Ende März davor gewarnt, dass es im Sommer zu wenig Wasser zur Kühlung der Reaktoren des Atomkraftwerks geben werde.
(Foto: imago images / Ukrinfor… [+5572 chars]",,de,'Putin'
https://www.bild.de/unterhaltung/royals/royals/kroenung-von-charles-iii-camilla-die-gaesteliste-und-wer-zu-hause-bleibt-83794020.bild.html,https://www.bild.de/unterhaltung/royals/royals/kroenung-von-charles-iii-camilla-die-gaesteliste-und-wer-zu-hause-bleibt-83794020.bild.html,0,www.bild.de,BILD kennt die Gästeliste - Wer zur Krönung von Charles III. kommt,"Am Samstag werden König Charles III. (74) und seine Frau Camilla (75) in London gekrönt. BILD verrät, wer dabei sein darf und wer zu Hause bleiben muss. Foto: danapress","https://images.bild.de/64537970b9324a698ef0e1c8/b3a0540eca509afede6ecdce10e76450,2facf1e0?w=1280",2023-05-05T04:59:22Z,https://web.archive.org/web/20230505050946/https://www.bild.de/unterhaltung/royals/royals/kroenung-von-charles-iii-camilla-die-gaesteliste-und-wer-zu-hause-bleibt-83794020.bild.html,"Es ist ein Jahrhundert-Ereignis.
Am Samstag werden König Charles III. (74) und seine Frau Camilla (75) in der Londoner Westminster Abbey gekrönt. Rund 2200 Gäste wurden zu diesem historischen Ereign… [+7822 chars]",,de,'König Charles III'
https://www.focus.de/kultur/kino_tv/ich-spreche-von-folter-schulleiterin-schildert-bei-markus-lanz-horrorszenen-an-schulen_id_192942883.html,https://www.focus.de/kultur/kino_tv/ich-spreche-von-folter-schulleiterin-schildert-bei-markus-lanz-horrorszenen-an-schulen_id_192942883.html,0,www.focus.de,„Ich spreche von Folter“ - Schulleiterin schildert bei „Markus Lanz“ Horrorszenen an Schulen,"„Wir sind in einer absoluten Bildungsnotstands-Katastrophe angekommen“: Schulleiterin Silke Müller zeichnete bei „Markus Lanz“ ein verstörendes Bild über Gewalt, Verrohung und Mobbing an deutschen Schulen. Die Lösungsansätze von CDU-Vorstandvize Karin Prien b…",https://p6.focus.de/img/kultur/kino_tv/id_192942881/markus-lanz-mit-seinen-gaesten-am-4.-mai-zum-thema-schulen.jpg?im=Crop%3D%280%2C85%2C1360%2C680%29%3BResize%3D%281200%2C627%29&hash=5f62fd8cf941a246d792959178862f0dd60de10bede6a12d05d272e61493f078,2023-05-05T05:05:13Z,https://web.archive.org/web/20230505075525/https://www.focus.de/kultur/kino_tv/ich-spreche-von-folter-schulleiterin-schildert-bei-markus-lanz-horrorszenen-an-schulen_id_192942883.html,"<ul><li>
Kommentare</li><li>
E-Mail</li><li>
Teilen</li><li>
Mehr</li><li>
Twitter</li><li>
Drucken</li><li>
Feedback</li><li>
Fehler meldenSie haben einen Fehler gefunden?
Bitte markieren S… [+5821 chars]",,de,'Markus Lanz'
https://www.focus.de/kultur/kino_tv/csu-chef-in-angriffsstimmung-soeder-poltert-gegen-markus-lanz-sie-haben-ja-sonst-auch-keine-ahnung_id_192760565.html,https://www.focus.de/kultur/kino_tv/csu-chef-in-angriffsstimmung-soeder-poltert-gegen-markus-lanz-sie-haben-ja-sonst-auch-keine-ahnung_id_192760565.html,0,www.focus.de,CSU-Chef in Angriffsstimmung - Söder poltert gegen Lanz: „Sie haben ja sonst auch keine Ahnung“,Was bedeutet die Abschaltung der letzten drei AKW für den Industriestandort Deutschland? Söder plädiert bei „Markus Lanz“ für den Weiterbetrieb in der Krise. Ökonom Marcel Fratzscher sieht Söders Pläne hingegen kritisch. Er warnt vor Deindustrialisierung und …,https://p6.focus.de/img/kultur/kino_tv/id_192760562/markus-soeder-poltert-bei-markus-lanz-sie-haben-ja-sonst-auch-keine-ahnung-.jpg?im=Crop%3D%280%2C0%2C1360%2C680%29%3BResize%3D%281200%2C627%29&hash=a5a583f52bd7d2a3906f0e7bbb2b1c3bdc244c84e81ab44d817404d49c5df3fb,2023-05-05T05:16:33Z,https://web.archive.org/web/20230505131818/https://www.focus.de/kultur/kino_tv/csu-chef-in-angriffsstimmung-soeder-poltert-gegen-markus-lanz-sie-haben-ja-sonst-auch-keine-ahnung_id_192760565.html,"Explodierende Energiepreise und die Angst vor Blackouts haben die Debatte um einen Weiterbetrieb der letzten deutschen Atomkraftwerke neu entfacht. Markus Söder will einen bayerischen Sonderweg, den … [+3694 chars]",,de,'Markus Lanz'
https://www.focus.de/kultur/kino_tv/markus-lanz-als-journalistin-ueber-analogistan-klagt-wird-heil-fuchsig_id_192850817.html,https://www.focus.de/kultur/kino_tv/markus-lanz-als-journalistin-ueber-analogistan-klagt-wird-heil-fuchsig_id_192850817.html,0,www.focus.de,"Bei Markus Lanz - Als Journalistin über „Analogistan“ klagt, wird Heil fuchsig","Mindestlohn, KI, 4-Tage-Woche - wie wird die Arbeitswelt von morgen funktionieren? Digitalexperte Sascha Lobo sah bei „Markus Lanz“ eine „Religion der Festanstellung“. Journalistin Sonja Álvarez kritisierte: „Wir leben in Analogistan.“ Und Hubertus Heil setzt…",https://p6.focus.de/img/kultur/kino_tv/id_192850815/dramatischer-rueckstand-bei-ki-journalistin-verortet-deutschland-bei-lanz-in-analogistan-.jpg?im=Crop%3D%280%2C142%2C1360%2C680%29%3BResize%3D%281200%2C627%29&hash=26616780c42ee6ba69d035e743b7242f517225d5e79661e2992a4086e5b2f3c3,2023-05-05T05:55:03Z,https://web.archive.org/web/20230505220643/https://www.focus.de/kultur/kino_tv/markus-lanz-als-journalistin-ueber-analogistan-klagt-wird-heil-fuchsig_id_192850817.html,"Mindestlohn, KI, 4-Tage-Woche - wie wird die Arbeitswelt von morgen funktionieren? Digitalexperte Sascha Lobo sah bei Markus Lanz eine Religion der Festanstellung. Journalistin Sonja Álvarez kritisie… [+3598 chars]",,de,'Markus Lanz'
https://www.wiwo.de/unternehmen/handel/sportartikelhersteller-adidas-mit-verlust-yeezy-drueckt-ergebnis/29134066.html,https://www.wiwo.de/unternehmen/handel/sportartikelhersteller-adidas-mit-verlust-yeezy-drueckt-ergebnis/29134066.html,0,www.wiwo.de,Sportartikelhersteller: Adidas mit Verlust – „Yeezy“ drückt Ergebnis,Adidas hat das erste Quartal mit roten Zahlen beendet. Vor allem das Ende der Zusammenarbeit mit Skandal-Rapper Kanye West belastet das Ergebnis.,https://www.wiwo.de/images/october-25-2022-jerusalem-usa-adidas-retail-store-in-mamilla-mall-in-jerusalem-israel-on-tuesday-october-25-2022/29134074/2-format11240.jpg,2023-05-05T06:15:00Z,,Für Nachrichtenseiten wie WirtschaftsWoche Online sind Anzeigen eine wichtige Einnahmequelle. Mit den Werbeerlösen können wir die Arbeit unserer Redaktion bezahlen und Qualitätsartikel kostenfrei ver… [+173 chars],,de,'Kanye West'
https://www.wiwo.de/unternehmen/handel/adidas-mit-verlust-ein-holpriges-jahr/29134066.html,https://www.wiwo.de/unternehmen/handel/adidas-mit-verlust-ein-holpriges-jahr/29134066.html,0,www.wiwo.de,Adidas mit Verlust: „Ein holpriges Jahr“,Der Sportartikelhersteller Adidas hat das erste Quartal mit roten Zahlen beendet. Das Ende der Zusammenarbeit mit Skandal-Rapper Kanye West belastet das Ergebnis. Adidas-Chef Björn Gulden sieht Licht am Ende des Tunnels.,https://www.wiwo.de/images/october-25-2022-jerusalem-usa-adidas-retail-store-in-mamilla-mall-in-jerusalem-israel-on-tuesday-october-25-2022/29134074/2-format11240.jpg,2023-05-05T06:49:38Z,https://web.archive.org/web/20230505125121/http://www.wiwo.de/unternehmen/handel/adidas-mit-verlust-ein-holpriges-jahr/29134066.html,"In den ersten drei Monaten des Jahres sei ein Verlust aus dem fortgeführten Geschäft von 24 Millionen Euro entstanden, teilte der fränkische Sportartikelkonzern am Freitag in Herzogenaurach mit. Vor … [+4511 chars]",,de,'Kanye West'
https://www.perlentaucher.de/9punkt/2023-05-05.html,https://www.perlentaucher.de/9punkt/2023-05-05.html,0,www.perlentaucher.de,"9PUNKT - DIE DEBATTENRUNDSCHAU: Ein laut und deutlich gesprochenes ""Stopp!""","Morgen ist Krönung. Den Medien ist teils feierlich zumute, teils gar nicht. Golem.de empfiehlt: Charles III. sollte sich nicht von den Pixies wecken lassen. Die Welt erzählt, wie Barack Obama gegen ein üppiges Honorar peinliche Fragen umgeht. Anhänger der Can…",https://www.perlentaucher.de/static/img/perlentaucher-logo-512x.png,2023-05-05T07:00:00Z,,"Atomwaffen seien nicht seine größte Sorge, vielmehr sorgt ihn, dass Russland die ukrainischen Atomkraftanlagen Tschernobyl und Saporischschja eingenommen hat, sagt der ukrainische Historiker Serhii P… [+5651 chars]",,de,'Barack Obama'
https://www.wiwo.de/politik/ausland/kroenung-von-koenig-charles-iii-was-kostet-grossbritanniens-monarchie-/28679844.html,https://www.wiwo.de/politik/ausland/kroenung-von-koenig-charles-iii-was-kostet-grossbritanniens-monarchie-/28679844.html,0,www.wiwo.de,Krönung von König Charles III.: Was kostet Großbritanniens Monarchie?,Am Samstag wird König Charles III. gekrönt. Die Royals als Personen stehen im Fokus der Öffentlichkeit. Die privaten Vermögensverhältnisse werden vor der Öffentlichkeit verborgen. Anders ist es bei dem Besitz der Krone.,https://www.wiwo.de/images/vor-der-kroenung-von-koenig-charles-iii-/29133090/2-format11240.jpg,2023-05-05T07:27:21Z,https://web.archive.org/web/20230505095253/https://www.wiwo.de/politik/ausland/kroenung-von-koenig-charles-iii-was-kostet-grossbritanniens-monarchie-/28679844.html,Die Krönung von König Charles III. und Queen Consort Camilla am Samstag ist eigentlich nur eine Formsache. Mit dem Tod von Königin Elisabeth II. im vergangenen September hat Charles den Thron bereits… [+4076 chars],,de,'König Charles III'
https://fm4.orf.at/stories/3033326/,https://fm4.orf.at/stories/3033326/,0,fm4.orf.at,Das ESC-Entweder-Oder mit Jan Böhmermann und Olli Schulz,"Entweder Österreich oder Deutschland, entweder Publikums-Voting oder Experten-Jury, entweder guter Song oder gute Message? FM4-Eurovision Kommentatoren Jan Böhmermann und Olli Schulz müssen sich entscheiden.",https://tubestatic.orf.at/static/images/site/tube/20230518/unbenannt-2.5996352.gif,2023-05-05T07:31:00Z,https://web.archive.org/web/20230506073555/https://fm4.orf.at/stories/3033326/,"Entweder Österreich oder Deutschland, entweder Publikums-Voting oder Experten-Jury, entweder guter Song oder gute Message? FM4-Eurovision Kommentatoren Jan Böhmermann und Olli Schulz müssen sich ents… [+4836 chars]",,de,'Jan Böhmermann'
https://www.titanic-magazin.de/news/viel-laerm-um-nichts-13537/,https://www.titanic-magazin.de/news/viel-laerm-um-nichts-13537/,0,www.titanic-magazin.de,Viel Lärm um nichts,Nach einer geheimnisvollen Explosion über dem Kreml wirft Russland der Ukraine ein versuchtes Drohnenattentat auf Präsident Putin vor. Quatsch! Laut TITANIC-Informationen gibt es für den harmlosen Zwischenfall eine ganze Reihe von völlig...,https://www.titanic-magazin.de/fileadmin/core/images/social_media_icons/titaniclogo.png,2023-05-05T08:03:51Z,,"»Jetzt erlebt Amerika eine Premiere«, schreiben Sie in die Wochenendausgabe Ihrer Zeitung, denn: »Einen früheren US-Präsidenten unter Anklage gab es ja noch nie. Und erst recht keinen früheren US-Prä… [+766 chars]",,de,'Putin'
https://www.zeit.de/wirtschaft/unternehmen/2023-05/adidas-kanye-west-verlust-geschaeft-sportschuhe-yeezy,https://www.zeit.de/wirtschaft/unternehmen/2023-05/adidas-kanye-west-verlust-geschaeft-sportschuhe-yeezy,0,www.zeit.de,Adidas: Bruch mit US-Rapper Kanye West belastet Geschäft von Adidas,Adidas hat im ersten Quartal einen Verlust von 24 Millionen Euro verzeichnet. Grund ist die Einstellung der Schuhreihe von Kanye West wegen antisemitischer Äußerungen.,,2023-05-05T08:23:08Z,https://web.archive.org/web/20230505093202/https://www.zeit.de/wirtschaft/unternehmen/2023-05/adidas-kanye-west-verlust-geschaeft-sportschuhe-yeezy,"When browsing with ads:
We collect personal data and also transmit it to third-party providers
 that help us improve and finance our digital content. Some of the information stored on your device, … [+732 chars]",,de,'Kanye West'
https://www.bild.de/unterhaltung/royals/royals/kroenung-von-koenig-charles-iii-was-passiert-wann-wo-alle-infos-alle-uhrzeiten-83682348.bild.html,https://www.bild.de/unterhaltung/royals/royals/kroenung-von-koenig-charles-iii-was-passiert-wann-wo-alle-infos-alle-uhrzeiten-83682348.bild.html,0,www.bild.de,Was passiert morgen wann wo? Alle Infos! - Um 13 Uhr schaut die ganze Welt auf König Charles,Ausnahmezustand in Großbritannien! Am 6. Mai wird King Charles III. offiziell gekrönt – und ein ganzes Land feiert mit. Alle Infos zum historischen Tag.,"https://images.bild.de/644797064863461dc9125887/f4723c3a95ed0e7b3242614beaa20160,a426b53e?w=1280",2023-05-05T08:28:34Z,https://web.archive.org/web/20230505110310/https://www.bild.de/unterhaltung/royals/royals/kroenung-von-koenig-charles-iii-was-passiert-wann-wo-alle-infos-alle-uhrzeiten-83682348.bild.html,"Ausnahmezustand in Großbritannien! Am Samstag wird King Charles III. (74) offiziell gekrönt und ein ganzes Land feiert mit.
Charles ist seit dem Tod von 
Queen Elizabeth (96) im vergangenen Septemb… [+11140 chars]",,de,'König Charles III'
https://consent.google.com/ml?continue=https://news.google.com/rss/articles/CBMiY2h0dHBzOi8vd3d3Lm4tdHYuZGUvd2lydHNjaGFmdC9BZGlkYXMtdmVyendlaWZlbHQtYW0tdGV1cmVuLUthbnllLVdlc3QtQmVzdGFuZC1hcnRpY2xlMjQxMDA5MTguaHRtbNIBY2h0dHBzOi8vYW1wLm4tdHYuZGUvd2lydHNjaGFmdC9BZGlkYXMtdmVyendlaWZlbHQtYW0tdGV1cmVuLUthbnllLVdlc3QtQmVzdGFuZC1hcnRpY2xlMjQxMDA5MTguaHRtbA?oc%3D5&gl=FR&hl=en-US&cm=2&pc=n&src=1,https://consent.google.com/ml?continue=https://news.google.com/rss/articles/CBMiY2h0dHBzOi8vd3d3Lm4tdHYuZGUvd2lydHNjaGFmdC9BZGlkYXMtdmVyendlaWZlbHQtYW0tdGV1cmVuLUthbnllLVdlc3QtQmVzdGFuZC1hcnRpY2xlMjQxMDA5MTguaHRtbNIBY2h0dHBzOi8vYW1wLm4tdHYuZGUvd2lydHNjaGFmdC9BZGlkYXMtdmVyendlaWZlbHQtYW0tdGV1cmVuLUthbnllLVdlc3QtQmVzdGFuZC1hcnRpY2xlMjQxMDA5MTguaHRtbA?oc%3D5&gl=FR&hl=en-US&cm=2&pc=n&src=1,0,consent.google.com,Schuhe und viel Geld wegwerfen?: Adidas verzweifelt am teuren Kanye-West-Bestand - n-tv NACHRICHTEN,"<ol><li>Schuhe und viel Geld wegwerfen?: Adidas verzweifelt am teuren Kanye-West-Bestand  n-tv NACHRICHTEN
</li><li>adidas-Aktie deutlich höher: adidas verzeichnet im ersten Quartal Nettoverlust - Ziele bestätigt  finanzen.net
</li><li>Adidas: Oh Ye…  DER A…",,2023-05-05T08:29:00Z,,"We use cookies and data to<ul><li>Deliver and maintain Google services</li><li>Track outages and protect against spam, fraud, and abuse</li><li>Measure audience engagement and site statistics to unde… [+1131 chars]",,de,'Kanye West'
https://www.n-tv.de/wirtschaft/Adidas-verzweifelt-am-teuren-Kanye-West-Bestand-article24100918.html,https://www.n-tv.de/wirtschaft/Adidas-verzweifelt-am-teuren-Kanye-West-Bestand-article24100918.html,0,www.n-tv.de,Schuhe und viel Geld wegwerfen?: Adidas verzweifelt am teuren Kanye-West-Bestand,"Adidas verliert in China bedeutende Marktanteile an die Konkurrenz. Das kostet den Sportartikelriesen viel Geld, ist aber nur die zweite Baustelle des neuen Chefs Björn Gulden. Das größere Dilemma: Was macht das Unternehmen mit den bereits hergestellten Schuh…",https://bilder2.n-tv.de/img/incoming/crop24100921/7681321725-cImg_16_9-w1200/381660908.jpg,2023-05-05T08:29:17Z,https://web.archive.org/web/20230505084848/https://www.n-tv.de/wirtschaft/Adidas-verzweifelt-am-teuren-Kanye-West-Bestand-article24100918.html,"Adidas verliert in China bedeutende Marktanteile an die Konkurrenz. Das kostet den Sportartikelriesen viel Geld, ist aber nur die zweite Baustelle des neuen Chefs Björn Gulden. Das größere Dilemma: W… [+4359 chars]",,de,'Kanye West'
https://www.welt.de/vermischtes/article245165838/Markus-Lanz-Schulleiterin-schildert-verstoerende-Handynutzung-von-Kindern.html,https://www.welt.de/vermischtes/article245165838/Markus-Lanz-Schulleiterin-schildert-verstoerende-Handynutzung-von-Kindern.html,0,www.welt.de,„Ich spreche von Folter“ – Schulleiterin schildert Handynutzung von Kindern,"Bei Markus Lanz spricht eine Schulleiterin über Kinder und Jugendliche, die durch das Internet „verroht“ seien. Videos von Folterszenen würden von Handy zu Handy geschickt. Die Gesellschaft habe an vielen Stellen „katastrophal versagt“.",https://img.welt.de/img/vermischtes/mobile245165336/8291352487-ci16x9-w1200/Markus-Lanz-2023.jpg,2023-05-05T09:17:57Z,http://archive.md/20230505102146/https://www.welt.de/vermischtes/article245165838/Markus-Lanz-Schulleiterin-schildert-verstoerende-Handynutzung-von-Kindern.html,"Man müsse sich, sagt Silke Müller, eine Szene vorstellen. Ein Schulbus voller Kinder, von denen viele ein iPhone hätten und damit auch die Funktion, Bilder oder Videos per Airdrop an andere Geräte zu… [+3502 chars]",,de,'Markus Lanz'
