index,url,valid,domain,title,description,image,published,archive,content,quote,language,keyword
https://www.n-tv.de/politik/Spanien-will-EU-Beitritt-der-Ukraine-vorantreiben-article24231640.html,https://www.n-tv.de/politik/Spanien-will-EU-Beitritt-der-Ukraine-vorantreiben-article24231640.html,0,www.n-tv.de,Sánchez zu Besuch in Kiew: Spanien will EU-Beitritt der Ukraine vorantreiben,"Zum Auftakt der EU-Ratspräsidentschaft seines Landes reist der spanische Premier Sánchez nach Kiew, um der Ukraine seine Unterstützung zu bekunden. Er verspricht auch weitere finanzielle Hilfen. Der ukrainische Präsident Selenskyj spricht von einem ""symbolträ…",https://bilder1.n-tv.de/img/incoming/crop24231644/1041321933-cImg_16_9-w1200/2023-07-01T123218Z-1458721379-RC2BU1A7XLZH-RTRMADP-3-UKRAINE-CRISIS-SPAIN.jpg,2023-07-01T15:15:46Z,https://web.archive.org/web/20230701155106/https://www.n-tv.de/politik/Spanien-will-EU-Beitritt-der-Ukraine-vorantreiben-article24231640.html,"Zum Auftakt der EU-Ratspräsidentschaft seines Landes reist der spanische Premier Sánchez nach Kiew, um der Ukraine seine Unterstützung zu bekunden. Er verspricht auch weitere finanzielle Hilfen. Der … [+2727 chars]",,de,'Selenskyj'
https://taz.de/-Nachrichten-im-Ukraine-Krieg-/!5944462/,https://taz.de/-Nachrichten-im-Ukraine-Krieg-/!5944462/,0,taz.de,+++ Nachrichten im Ukraine-Krieg +++: Sánchez unterstützt Ukraine,Spaniens Ministerpräsident Pedro Sánchez macht der Ukraine Hoffnung auf einen Beitritt zur EU. Selenski bezeichnet das AKW Saporischschja als „bedroht“.,https://taz.de/picture/6363531/948/imago0262192053h-1.jpeg,2023-07-01T16:00:00Z,https://web.archive.org/web/20230701175406/https://taz.de/-Nachrichten-im-Ukraine-Krieg-/!5944462/,"Spaniens Ministerpräsident Pedro Sánchez macht der Ukraine Hoffnung auf einen Beitritt zur EU. Selenski bezeichnet das AKW Saporischschja als bedroht.
Spaniens Ministerpräsident Pedro Sánchez verspr… [+6649 chars]",,de,'Pedro Sánchez'
https://www.zeit.de/politik/ausland/2023-07/ukraine-ueberblick-sanchez-kiew-brueckenkopf-dnipro,https://www.zeit.de/politik/ausland/2023-07/ukraine-ueberblick-sanchez-kiew-brueckenkopf-dnipro,0,www.zeit.de,"Ukraine-Überblick: Kampf um Brückenkopf am Dnipro, Sánchez sagt Hilfe bei EU-Beitritt zu",Ministerpräsident Pedro Sánchez hat zum Auftakt der spanischen EU-Ratspräsidentschaft Kiew besucht. Die ukrainische Armee baut ihren Brückenkopf am Dnipro aus. Der Tag,,2023-07-01T17:23:18Z,http://archive.md/20230701185119/https://www.zeit.de/politik/ausland/2023-07/ukraine-ueberblick-sanchez-kiew-brueckenkopf-dnipro,"When browsing with ads:
We collect personal data and also transmit it to third-party providers
 that help us improve and finance our digital content. Some of the information stored on your device, … [+821 chars]",,de,'Pedro Sánchez'
https://www.stern.de/news/spaniens-regierungschef-s%C3%A1nchez-bekraeftigt-in-kiew-unterstuetzung-der-eu-33610852.html,https://www.stern.de/news/spaniens-regierungschef-s%C3%A1nchez-bekraeftigt-in-kiew-unterstuetzung-der-eu-33610852.html,0,www.stern.de,Spaniens Regierungschef Sánchez bekräftigt in Kiew Unterstützung der EU,"Am ersten Tag der spanischen EU-Ratspräsidentschaft hat Spaniens Regierungschef Pedro Sánchez der Ukraine die ""unmissverständliche"" Unterstützung der Europäischen Union zugesichert. Spanien unterstütze zudem eine ""Stärkung der Nato-Partnerschaft mit der Ukrai…",https://image.stern.de/33611636/t/qV/v1/w1440/r1.7778/-/01--s%C3%A1nchez-links-und-selenskyj-in-kiew---27e480f40a65d056.jpg,2023-07-01T17:38:44Z,https://web.archive.org/web/20230701182024/https://www.stern.de/news/spaniens-regierungschef-s%C3%A1nchez-bekraeftigt-in-kiew-unterstuetzung-der-eu-33610852.html,"Am ersten Tag der spanischen EU-Ratspräsidentschaft hat Spaniens Regierungschef Pedro Sánchez der Ukraine die ""unmissverständliche"" Unterstützung der Europäischen Union zugesichert. Spanien unterstüt… [+3490 chars]",,de,'Pedro Sánchez'
https://www.dw.com/de/ukraine-aktuell-selenskyj-setzt-auf-europa/a-66091362,https://www.dw.com/de/ukraine-aktuell-selenskyj-setzt-auf-europa/a-66091362,0,www.dw.com,Ukraine Aktuell: Selenskyj setzt auf Europa,"Ohne die Ukraine kann es kein gemeinsames Europa geben, so der ukrainische Präsident, der gleichzeitig der EU für ihre Hilfe dankte. EU-Ratspräsident Sánchez will das Land weiter unterstützen. Der Überblick. Das Wichtigste in Kürze: 


Selenskyj betont Stelle…",https://static.dw.com/image/66089663_6.jpg,2023-07-01T23:58:00Z,https://web.archive.org/web/20230702070610/https://www.dw.com/de/ukraine-aktuell-selenskyj-setzt-auf-europa/a-66091362,"Das Wichtigste in Kürze: 
<ul><li>Selenskyj betont Stellenwert seines Landes für die EU</li><li>Sánchez sichert ""unmissverständliche Unterstützung zu</li><li>Lambsdorf sieht Stunde der Diplomatie no… [+5053 chars]",,de,'Selenskyj'
https://www.morgenpost.de/politik/ausland/article238837041/Krieg-gegen-die-Ukraine-So-ist-die-Lage.html,https://www.morgenpost.de/politik/ausland/article238837041/Krieg-gegen-die-Ukraine-So-ist-die-Lage.html,0,www.morgenpost.de,Russische Invasion: Krieg gegen die Ukraine: So ist die Lage,Nach dem Kiew-Besuch von Spaniens Regierungschef Pedro Sánchez sieht Selenskyj gute Europa-Perspektiven für die Ukraine. Die Entwicklungen im Überblick.,https://img.morgenpost.de/img/ausland/crop238837039/8492605802-w820-cv16_9-q85/Sanchez-in-der-Ukraine.jpg,2023-07-02T03:06:46Z,,"Kiew. Der ukrainische Präsident Wolodymyr Selenskyj hat sich zuversichtlich zur europäischen Zukunft seines Landes geäußert. Es sei schon immer unmöglich gewesen, sich ein gemeinsames Haus Europa ohn… [+3883 chars]",,de,'Pedro Sánchez'
https://www.focus.de/politik/deutschland/gruene-bundesvorsitzende-im-focus-interview-ricarda-lang-mit-waermewende-schuetzen-wir-die-menschen_id_197827927.html,https://www.focus.de/politik/deutschland/gruene-bundesvorsitzende-im-focus-interview-ricarda-lang-mit-waermewende-schuetzen-wir-die-menschen_id_197827927.html,0,www.focus.de,Grüne-Bundesvorsitzende im FOCUS-Interview - Grünen-Chefin Lang: „Mit Wärmewende schützen wir die Menschen“,"Seit anderthalb Jahren sind die Grünen in der Ampel. Der Druck auf die Klimapartei wächst, die Umfragen sinken. Doch Parteichefin Ricarda Lang macht nicht den Eindruck, als sei sie verzagt. Im Gegenteil...",https://p6.focus.de/img/regional/sachsen/id_189170304/ricarda-lang-bundesvorsitzende-von-buendnis-90-die-gruenen..jpg?im=Crop%3D%280%2C169%2C2048%2C1024%29%3BResize%3D%281200%2C627%29&impolicy=perceptual&quality=mediumHigh&hash=2a54e8b129cd146a602aae801c959ccdc276827b52f2f0a8362d941af3d95ab4,2023-07-02T04:00:00Z,http://archive.md/20230703011547/https://www.focus.de/politik/deutschland/gruene-bundesvorsitzende-im-focus-interview-ricarda-lang-mit-waermewende-schuetzen-wir-die-menschen_id_197827927.html,"Seit anderthalb Jahren sind die Grünen in der Ampel. Der Druck auf die Klimapartei wächst, die Umfragen sinken. Doch Parteichefin Ricarda Lang macht nicht den Eindruck, als sei sie verzagt. Im Gegent… [+22017 chars]",,de,'Kevin Kühnert'
https://www.handelsblatt.com/politik/international/ukraine-krieg-lage-am-morgen-minenfelder-und-lufthoheit-der-russen-groesste-probleme-der-ukraine/29235566.html,https://www.handelsblatt.com/politik/international/ukraine-krieg-lage-am-morgen-minenfelder-und-lufthoheit-der-russen-groesste-probleme-der-ukraine/29235566.html,0,www.handelsblatt.com,Ukraine-Krieg – Lage am Morgen: Minenfelder und Lufthoheit der Russen größte Probleme der Ukraine – Selenski sieht Land auf dem Weg nach Europa,"Mit Kampfhubschraubern und Kampfjets sei es den Russen gelungen, „unsere Gegenoffensivkräfte zu treffen“, sagt Außenminister Kuleba. Sein Präsident beklagt Verzögerungen bei der Pilotenausbildung.",https://www.handelsblatt.com/images/russischer-hubschrauberpilot-im-einsatz/29235050/2-format2003.jpg,2023-07-02T06:43:19Z,,"Russischer Hubschrauberpilot im EinsatzDie Luftüberlegenheit Moskaus bereitet den Ukrainern Probleme.
(Foto: IMAGO/SNA)
Kiew Der ukrainische Präsident Wolodimir Selenski hat sich zuversichtlich zur… [+4225 chars]",,de,'Wolodimir Selenski'
https://www.dw.com/de/ukraine-aktuell-kiew-wieder-ziel-russischer-angriffe/a-66091362,https://www.dw.com/de/ukraine-aktuell-kiew-wieder-ziel-russischer-angriffe/a-66091362,0,www.dw.com,Ukraine aktuell: Kiew wieder Ziel russischer Angriffe,"Fast zwei Wochen herrschte Ruhe: Nun wurde die ukrainische Hauptstadt aus der Luft attackiert. Präsident Selenskyj setzt weiter auf Europa. EU-Ratspräsident Sánchez will die Ukraine weiter unterstützen. Der Überblick. Das Wichtigste in Kürze: 




Kiew wieder…",https://static.dw.com/image/66092923_6.jpg,2023-07-02T08:40:00Z,,"Das Wichtigste in Kürze: 
<ul><li>Kiew wieder Ziel russischer Angriffe</li><li>Selenskyj betont Stellenwert seines Landes für die EU</li><li>Sánchez sichert ""unmissverständliche Unterstützung zu</li… [+7234 chars]",,de,'Pedro Sánchez'
https://www.welt.de/sport/fussball/article246175152/Transferticker-Liverpool-zahlt-Rekordabloese-an-RB-Leipzig.html,https://www.welt.de/sport/fussball/article246175152/Transferticker-Liverpool-zahlt-Rekordabloese-an-RB-Leipzig.html,0,www.welt.de,Rekordablösesumme – Liverpool verpflichtet Leipzigs Leistungsträger,"RB Leipzig kann sich über den höchsten Transfererlös der Klubgeschichte freuen, verliert aber einen weiteren Topstar. Und: Nach Lionel Messi und Sergio Busquets sollen auch Sergio Ramos und Jordi Alba zu Inter Miami wechseln. Alle Transfernews gibt es hier Ti…",https://img.welt.de/img/sport/fussball/mobile246183446/6801355887-ci16x9-w1200/FILE-PHOTO-DFB-Cup-Final-RB-Leipzig-v-Eintracht-Frankfurt.jpg,2023-07-02T13:15:00Z,https://web.archive.org/web/20230705083916/https://www.welt.de/sport/fussball/article246175152/Transferticker-Liverpool-zahlt-Rekordabloese-an-RB-Leipzig.html,"Dominik Szoboszlai verlässt DFB-Pokalsieger RB Leipzig und wechselt zum FC Liverpool. Am Sonntag meldeten beide Clubs den Transfer offiziell, nachdem der Ungar am Samstag den Medizincheck in England … [+7302 chars]",,de,'Lionel Messi'
https://www.bild.de/politik/ausland/politik-ausland/hunter-biden-praesidenten-sohn-machte-schnappschuss-bei-276-km-h-84543962.bild.html,https://www.bild.de/politik/ausland/politik-ausland/hunter-biden-praesidenten-sohn-machte-schnappschuss-bei-276-km-h-84543962.bild.html,0,www.bild.de,Auf dem Weg zur Party mit Prostituierten - Biden-Sohn machte Schnappschuss bei 276 km/h,"Hunter Biden, der Sohn von US-Präsident Joe Biden, holte am Steuer das Handy raus – bei 276 km/h (172 mp/h. Foto: marcopolousa.org","https://images.bild.de/64a1e744358fca06e5b5e64a/4a3d7ab4046e8dfdf858eabc7e68f5bf,e8b93171?w=1280",2023-07-03T01:57:20Z,http://archive.md/20230703154524/https://www.bild.de/politik/ausland/politik-ausland/hunter-biden-praesidenten-sohn-machte-schnappschuss-bei-276-km-h-84543962.bild.html,"Ein Leben auf der Überholspur.
Illegaler Waffenbesitz, Steuervergehen, Drogen und Prostituierte: Hunter Biden (53) gilt schon seit dem US-Wahlkampf 2020 als das schwarze Schaf der Familie des US-Prä… [+2535 chars]",,de,'Hunter Biden'
https://www.focus.de/politik/deutschland/gruene-vorsitzende-im-focus-interview-ricarda-lang-mit-waermewende-schuetzen-wir-die-menschen_id_197827927.html,https://www.focus.de/politik/deutschland/gruene-vorsitzende-im-focus-interview-ricarda-lang-mit-waermewende-schuetzen-wir-die-menschen_id_197827927.html,0,www.focus.de,Grüne-Bundesvorsitzende im FOCUS-Interview - In Gender-Debatte keilt Grünen-Chefin Lang jetzt gegen Merz,"Seit anderthalb Jahren sind die Grünen in der Ampel. Der Druck auf die Klimapartei wächst, die Umfragewerte sinken. Doch Parteichefin Ricarda Lang macht nicht den Eindruck, als sei sie verzagt. Im Gegenteil...",https://p6.focus.de/img/regional/sachsen/id_189170304/ricarda-lang-bundesvorsitzende-von-buendnis-90-die-gruenen..jpg?im=Crop%3D%280%2C169%2C2048%2C1024%29%3BResize%3D%281200%2C627%29&impolicy=perceptual&quality=mediumHigh&hash=2a54e8b129cd146a602aae801c959ccdc276827b52f2f0a8362d941af3d95ab4,2023-07-03T05:25:49Z,,"Seit anderthalb Jahren sind die Grünen in der Ampel. Der Druck auf die Klimapartei wächst, die Umfragewerte sinken. Doch Parteichefin Ricarda Lang macht nicht den Eindruck, als sei sie verzagt. Im Ge… [+22088 chars]",,de,'Ricarda Lang'
https://www.faz.net/aktuell/politik/ausland/wie-prigoschin-sich-sein-geschaeftsimperium-aufgebaut-hat-19002271.html,https://www.faz.net/aktuell/politik/ausland/wie-prigoschin-sich-sein-geschaeftsimperium-aufgebaut-hat-19002271.html,0,www.faz.net,Fleisch vom Fleische Putins: So baute sich Prigoschin sein Geschäftsimperium auf,"Viele Jahre war Jewgenij Prigoschin gut darin, Wladimir Putins Wünsche zu erahnen und zu bedienen – erst mit Restaurants, dann mit regimefreundlichen Medienunternehmen und einer Miliz. Eine Rekonstruktion.",https://media0.faz.net/ppmedia/aktuell/1846125246/1.9002260/facebook_teaser/gesegnete-mahlzeit-chef-putin.jpg,2023-07-03T06:11:47Z,http://archive.md/20230703083703/https://www.faz.net/aktuell/politik/ausland/wie-prigoschin-sich-sein-geschaeftsimperium-aufgebaut-hat-19002271.html,"Womöglich sagen alte Fotos, die Wladimir ­Putin mit dem Milizenführer Jewgenij Prigoschin zeigen, am meisten über die Beziehung zwischen dem russischen Präsidenten und dem Mann, der ihn gerade vor di… [+3071 chars]",,de,'Wladimir Putin'
https://www.stern.de/news/kuehnert-rechnet-fest-mit-verabschiedung-von-heizungsgesetz-in-dieser-woche-33613906.html,https://www.stern.de/news/kuehnert-rechnet-fest-mit-verabschiedung-von-heizungsgesetz-in-dieser-woche-33613906.html,0,www.stern.de,Kühnert rechnet fest mit Verabschiedung von Heizungsgesetz in dieser Woche,"SPD-Generalsekretär Kevin Kühnert rechnet fest mit einer Verabschiedung des neuen Heizungsgesetzes Ende der Woche. ""Ich halte das mit an Sicherheit grenzender Wahrscheinlichkeit für klar, dass das diese Woche ins Verfahren kommt und dann auch beschlossen wird…",https://image.stern.de/33613908/t/Q4/v1/w1440/r1.7778/-/03--der-reichstag-sitz-des-bundestags---a2d18f653d4acf1c.jpg,2023-07-03T07:00:30Z,,"SPD-Generalsekretär Kevin Kühnert rechnet fest mit einer Verabschiedung des neuen Heizungsgesetzes Ende der Woche. ""Ich halte das mit an Sicherheit grenzender Wahrscheinlichkeit für klar, dass das di… [+1481 chars]",,de,'Kevin Kühnert'
https://www.brigitte.de/aktuell/robert-de-niro--hollywoodstar-trauert-um-seinen-enkelsohn-leandro-13551152.html,https://www.brigitte.de/aktuell/robert-de-niro--hollywoodstar-trauert-um-seinen-enkelsohn-leandro-13551152.html,0,www.brigitte.de,Robert De Niro: Hollywoodstar trauert um seinen Enkelsohn Leandro,"Drama in der Familie von Robert De Niro: Leandro, der Enkel des Stars, ist gestorben. Das hat dessen Mutter auf Instagram bekannt gegeben.",https://image.brigitte.de/13551154/t/_l/v1/w1440/r1.7778/-/03--hollywoodstar-trauert-um-seinen-enkelsohn-leandro---1-1---spoton-article-1047845.jpg,2023-07-03T08:41:00Z,https://web.archive.org/web/20230703130834/https://www.brigitte.de/aktuell/robert-de-niro--hollywoodstar-trauert-um-seinen-enkelsohn-leandro-13551152.html,"Drama in der Familie von Robert De Niro: Leandro, der Enkel des Stars, ist gestorben. Das hat dessen Mutter auf Instagram bekannt gegeben.
Die Familie von Hollywood-Star Robert De Niro (79) muss mit… [+2226 chars]",,de,'Robert De Niro'
https://www.stern.de/lifestyle/leute/robert-de-niro--schauspieler-trauert-um-enkelsohn-leandro-33614332.html,https://www.stern.de/lifestyle/leute/robert-de-niro--schauspieler-trauert-um-enkelsohn-leandro-33614332.html,0,www.stern.de,Robert De Niro: Schauspieler trauert um Enkelsohn Leandro,"Drama in der Familie von Robert De Niro: Leandro, der Enkel des Stars, ist gestorben. Das hat dessen Mutter auf Instagram bekannt gegeben.",https://image.stern.de/33614336/t/MW/v1/w1440/r1.7778/-/03--schauspieler-trauert-um-enkelsohn-leandro---16-9---spoton-article-1047845.jpg,2023-07-03T08:51:00Z,https://web.archive.org/web/20230703092216/https://www.stern.de/lifestyle/leute/robert-de-niro--schauspieler-trauert-um-enkelsohn-leandro-33614332.html,"Drama in der Familie von Robert De Niro: Leandro, der Enkel des Stars, ist gestorben. Das hat dessen Mutter auf Instagram bekannt gegeben.
Die Familie von Hollywood-Star Robert De Niro (79) muss mit… [+2226 chars]",,de,'Tiffany Chen'
https://www.stern.de/gesellschaft/regional/thueringen/wahlen--afd-landrat-sesselmann-tritt-amt-in-sonneberg-an-33614434.html,https://www.stern.de/gesellschaft/regional/thueringen/wahlen--afd-landrat-sesselmann-tritt-amt-in-sonneberg-an-33614434.html,0,www.stern.de,Wahlen: AfD-Landrat Sesselmann tritt Amt in Sonneberg an,"Der AfD-Politiker Robert Sesselmann hat am Montag sein Amt als Landrat im Kreis Sonneberg angetreten. Zuvor hatte er am Sonntag schriftlich die Wahl zum Landrat angenommen, wie das Sonneberger Landratsamt am Montag mitteilte.",https://image.stern.de/33614436/t/RW/v1/w1440/r1.7778/-/03--urnnewsmldpacom2009010123070399267122v3w800h600l555t89r1835b942jpeg---38dab7de348f66fb.jpg,2023-07-03T09:13:47Z,,"Der AfD-Politiker Robert Sesselmann hat am Montag sein Amt als Landrat im Kreis Sonneberg angetreten. Zuvor hatte er am Sonntag schriftlich die Wahl zum Landrat angenommen, wie das Sonneberger Landra… [+1195 chars]",,de,'Robert Sesselmann'
https://www.n-tv.de/leute/Robert-De-Niro-verliert-einen-Enkel-article24234272.html,https://www.n-tv.de/leute/Robert-De-Niro-verliert-einen-Enkel-article24234272.html,0,www.n-tv.de,Ungeklärter Tod mit 19 Jahren: Robert De Niro verliert einen Enkel,Schauspieler Robert De Niro hat eine echte Patchwork-Großfamilie. Neben sieben Kindern von mehreren (Ex-)Frauen zählten dazu bis dato auch vier Enkel. Nun jedoch muss der Schauspieler den Verlust eines Enkelsohns verkraften: Leandro De Niro Rodriguez ist mit …,https://bilder3.n-tv.de/img/incoming/crop24234286/500132116-cImg_16_9-w1200/409735804.jpg,2023-07-03T13:41:01Z,https://web.archive.org/web/20230703140827/https://www.n-tv.de/leute/Robert-De-Niro-verliert-einen-Enkel-article24234272.html,Schauspieler Robert De Niro hat eine echte Patchwork-Großfamilie. Neben sieben Kindern von mehreren (Ex-)Frauen zählten dazu bis dato auch vier Enkel. Nun jedoch muss der Schauspieler den Verlust ein… [+2751 chars],,de,'Tiffany Chen'
https://www.focus.de/panorama/welt/zeitung-veroeffentlicht-fotos-biden-sohn-rast-mit-crack-pfeife-und-276-km-h-durch-wohnviertel_id_198086271.html,https://www.focus.de/panorama/welt/zeitung-veroeffentlicht-fotos-biden-sohn-rast-mit-crack-pfeife-und-276-km-h-durch-wohnviertel_id_198086271.html,0,www.focus.de,Zeitung veröffentlicht Fotos - Biden-Sohn rast mit Crack-Pfeife und 276 km/h durch Wohnviertel,"Vom Sohn des US-Präsidenten, Hunter Biden, sind Bilder aufgetaucht, die ihn in kompromittierenden Situationen zeigen. So soll er mit 276 km/h durch ein Wohngebiet gerast sein und Crack geraucht haben. Auch von einer Party mit Prostituierten ist die Rede.",https://p6.focus.de/img/politik/ausland/id_196963661/die-staatsanwaltschaft-im-us-bundesstaat-delaware-legt-hunter-biden-steuerdelikte-sowie-einen-verstoss-gegen-waffenrechtliche-vorgaben-zur-last..jpg?im=Crop%3D%280%2C170%2C2048%2C1024%29%3BResize%3D%281200%2C627%29&impolicy=perceptual&quality=mediumHigh&hash=c31f62cd65b86d4a0ce6b93791b6ad87417c96b637e27ade4a4ee17319e6a778,2023-07-03T14:09:25Z,,"Vom Sohn des US-Präsidenten, Hunter Biden, sind Bilder aufgetaucht, die ihn in kompromittierenden Situationen zeigen. So soll er mit 276 km/h durch ein Wohngebiet gerast sein und Crack geraucht haben… [+1166 chars]",,de,'Hunter Biden'
https://www.tagesspiegel.de/wissen/halbe-milliarde-weniger-fur-bildung-und-forschung-vor-allem-beim-bafog-wird-gekurzt-10088419.html,https://www.tagesspiegel.de/wissen/halbe-milliarde-weniger-fur-bildung-und-forschung-vor-allem-beim-bafog-wird-gekurzt-10088419.html,0,www.tagesspiegel.de,Halbe Milliarde weniger für Bildung und Forschung: Vor allem beim Bafög wird gekürzt,Dem Tagesspiegel liegt der Entwurf für den Haushalt des Forschungsministeriums vor. Vor allem das Budget für die Förderung Studierender wird kleiner. Ist das trotzdem ein Verhandlungserfolg für Bettina Stark-Watzinger?,https://www.tagesspiegel.de/images/bundesfinanzminister-christian-lindner-bundesbildungsministerin-bettina-stark-watzinger-bundesfinanzminister-christian/alternates/BASE_16_9_W1400/bundesfinanzminister-christian-lindner-bundesbildungsministerin-bettina-stark-watzinger-bundesfinanzminister-christian.jpeg,2023-07-03T16:16:41Z,https://web.archive.org/web/20230703163943/https://www.tagesspiegel.de/wissen/halbe-milliarde-weniger-fur-bildung-und-forschung-vor-allem-beim-bafog-wird-gekurzt-10088419.html,Erst am Mittwoch soll der Haushaltsentwurf der Bundesregierung ins Bundeskabinett gehen. Doch dem Tagesspiegel liegt das Papier bereits vor. Demnach sind für das Bundesministerium für Bildung und For… [+158 chars],,de,'Bettina Stark-Watzinger'
https://www.tagesspiegel.de/internationales/tschechischer-aussenminister-lipavsky-warnt-sind-wir-in-gefahr-ist-deutschland-es-auch-10084510.html,https://www.tagesspiegel.de/internationales/tschechischer-aussenminister-lipavsky-warnt-sind-wir-in-gefahr-ist-deutschland-es-auch-10084510.html,0,www.tagesspiegel.de,"Tschechischer Außenminister Lipavský warnt: „Sind wir in Gefahr, ist Deutschland es auch“","Russland werde auf Jahrzehnte eine Gefahr für den europäischen Kontinent darstellen. Unsere Bedrohung ist keine Einbildung, sagt Tschechiens Außenminister Jan Lipavský im Interview.",https://www.tagesspiegel.de/images/foreign-minister-jan-lipavsky-pirates-pictured-with-his-romanian-counterpart-bohdan-aurescu-speak-during-the-press-co/alternates/BASE_16_9_W1400/foreign-minister-jan-lipavsky-pirates-pictured-with-his-romanian-counterpart-bohdan-aurescu-speak-during-the-press-co.jpeg,2023-07-03T16:23:19Z,,"Herr Lipavský, Tschechien hat früh und umfangreich Waffen an die Ukraine geliefert. Unterstützt Europa die Ukraine ausreichend?Wir tun so viel wir können und suchen jeden Tag nach neuen Möglichkeiten… [+8230 chars]",,de,'Jan Lipavský'
https://www.stern.de/lifestyle/leute/robert-de-niro---zutiefst-erschuettert--ueber-tod-seines-enkels-33616044.html,https://www.stern.de/lifestyle/leute/robert-de-niro---zutiefst-erschuettert--ueber-tod-seines-enkels-33616044.html,0,www.stern.de,"Robert De Niro: ""Zutiefst erschüttert"" über Tod seines Enkels","Robert De Niro zeigt sich nach dem Tod seines Enkelsohnes Leandro erschüttert. Dessen Mutter spricht von einem ""unermesslichen Schock""",https://image.stern.de/33616048/t/PM/v1/w1440/r1.7778/-/03---zutiefst-erschuettert--ueber-tod-seines-enkels---16-9---spoton-article-1047903.jpg,2023-07-03T18:47:00Z,https://web.archive.org/web/20230703192314/https://www.stern.de/lifestyle/leute/robert-de-niro---zutiefst-erschuettert--ueber-tod-seines-enkels-33616044.html,"Robert De Niro zeigt sich nach dem Tod seines Enkelsohnes Leandro erschüttert. Dessen Mutter spricht von einem ""unermesslichen Schock""
Robert De Niros (79) Familie trauert um Leandro De Niro Rodrigu… [+1690 chars]",,de,'Robert de Niro'
https://www.brigitte.de/aktuell/robert-de-niro--er-ist--zutiefst-erschuettert--ueber-tod-seines-enkels-13551496.html,https://www.brigitte.de/aktuell/robert-de-niro--er-ist--zutiefst-erschuettert--ueber-tod-seines-enkels-13551496.html,0,www.brigitte.de,"Robert De Niro: Er ist ""zutiefst erschüttert"" über Tod seines Enkels","Robert De Niro zeigt sich nach dem Tod seines Enkelsohnes Leandro erschüttert. Dessen Mutter spricht von einem ""unermesslichen Schock""",https://image.brigitte.de/13551498/t/xr/v1/w1440/r1.7778/-/03--er-ist--zutiefst-erschuettert--ueber-tod-seines-enkels---1-1---spoton-article-1047903.jpg,2023-07-03T18:48:00Z,https://web.archive.org/web/20230703193939/https://www.brigitte.de/aktuell/robert-de-niro--er-ist--zutiefst-erschuettert--ueber-tod-seines-enkels-13551496.html,"Robert De Niro zeigt sich nach dem Tod seines Enkelsohnes Leandro erschüttert. Dessen Mutter spricht von einem ""unermesslichen Schock""
Robert De Niros (79) Familie trauert um Leandro De Niro Rodrigu… [+1690 chars]",,de,'Robert de Niro'
https://www.faz.net/aktuell/gesellschaft/menschen/robert-de-niro-enkelsohn-leandro-mit-19-jahren-verstorben-19008573.html,https://www.faz.net/aktuell/gesellschaft/menschen/robert-de-niro-enkelsohn-leandro-mit-19-jahren-verstorben-19008573.html,0,www.faz.net,Todesursache ungeklärt: Robert De Niro trauert um Enkelsohn,"Er sei „zutiefst betrübt“ über den Tod seines „geliebten Enkels Leo“, teilte der Schauspieler am Montag über seinen Sprecher mit. Der Sohn seiner ältesten Tochter wurde 19 Jahre alt.",https://media1.faz.net/ppmedia/aktuell/feuilleton/3264894565/1.9008579/facebook_teaser/schauspieler-robert-de-niro.jpg,2023-07-03T21:18:39Z,https://web.archive.org/web/20230703220639/https://www.faz.net/aktuell/gesellschaft/menschen/robert-de-niro-enkelsohn-leandro-mit-19-jahren-verstorben-19008573.html,"Oscar-Preisträger Robert De Niro (79) trauert um seinen mit 19 Jahren gestorbenen Enkel. Er sei zutiefst betrübt über den Tod seines geliebten Enkels Leo, teilte der Schauspieler am Montag über seine… [+1071 chars]",,de,'Tiffany Chen'
