index,url,valid,domain,title,description,image,published,archive,content,quote,language,keyword
https://www.focus.de/kultur/mode/look-spaltet-modewelt-golden-globes-heidi-klums-kleiderwahl-sorgt-fuer-geteilte-meinungen_id_260610284.html,https://www.focus.de/kultur/mode/look-spaltet-modewelt-golden-globes-heidi-klums-kleiderwahl-sorgt-fuer-geteilte-meinungen_id_260610284.html,0,www.focus.de,Look spaltet Modewelt - Golden Globes: Heidi Klums Kleiderwahl sorgt für geteilte Meinungen,Als langjähriger Stammgast der Golden Globe Awards sorgt Heidi Klum auch 2025 für Gesprächsstoff. Bei der Preisverleihung in Los Angeles präsentierte sich das Model in einem grünen Designerkleid. Die britische Presse ordnete den Look in die Kategorie der modi…,https://p6.focus.de/img/kultur/mode/id_260610283/golden-globes-heidi-klums-kleiderwahl-sorgt-fuer-geteilte-meinungen.jpg?im=Crop%3D%280%2C125%2C1000%2C500%29%3BResize%3D%281200%2C627%29&impolicy=perceptual&quality=mediumHigh&hash=621038af190ef3aef9d61af19949214360fc67c4dac6aa0f3abc97057a90f40b,2025-01-06T07:20:04Z,,Die Golden Globe Awards zählen zu den prestigeträchtigsten Veranstaltungen Hollywoods - und Heidi Klum (51) gehört seit Jahren zum festen Inventar der Preisverleihung in Los Angeles. Nach einem ausla… [+1397 chars],,de,'Heidi Klum'
https://www.welt.de/kultur/kino/article255042662/Golden-Globes-Nikki-Glaser-rechnet-mit-Hollywood-ab-Sexuell-aufgeladener-als-Diddys-Kreditkarte.html,https://www.welt.de/kultur/kino/article255042662/Golden-Globes-Nikki-Glaser-rechnet-mit-Hollywood-ab-Sexuell-aufgeladener-als-Diddys-Kreditkarte.html,0,www.welt.de,Moderatorin rechnet mit Hollywood-Elite ab – „Sexuell aufgeladener als Diddys Kreditkarte“,"Große Sieger der Golden-Globes-Preisverleihung waren die Filme „Emilia Pérez“ und „Der Brutalist“. Deutschland ging leer aus. Und während Kino-Veteranin Demi Moore unisono bejubelt wurde, erinnerte die Moderatorin – Komikerin Nikki Glaser – auch an den Missbr…",https://img.welt.de/img/kultur/kino/mobile255046556/8157937547-ci16x9-w1200/Nikki-Glaser-arrives-at-the-82nd-Go.jpg,2025-01-06T07:48:31Z,,"Große Sieger der Golden-Globes-Preisverleihung waren die Filme Emilia Pérez und Der Brutalist. Deutschland ging leer aus. Und während Kino-Veteranin Demi Moore unisono bejubelt wurde, erinnerte die M… [+6339 chars]",,de,'Nikki Glaser'
https://www.stern.de/lifestyle/filmtrophaeen--die-golden-globes-feiern-das-durchhalten-35356872.html,https://www.stern.de/lifestyle/filmtrophaeen--die-golden-globes-feiern-das-durchhalten-35356872.html,0,www.stern.de,Filmtrophäen: Die Golden Globes feiern das Durchhalten,"Ein Siegesdrama, für das der Regisseur sieben Jahre brauchte, zwei fulminante Comebacks und viele Reden, die zur Hoffnung in schweren Zeiten mahnten: Die Golden Globes riefen auf, niemals aufzugeben.",https://image.stern.de/35356874/t/4C/v1/w1440/r1.7778/-/06--g7brjn6zxxv3axs2048jpeg---5db7b7b2ae88c2cb.jpg,2025-01-06T07:49:53Z,,"Kopiere den aktuellen Link
Ein Siegesdrama, für das der Regisseur sieben Jahre brauchte, zwei fulminante Comebacks und viele Reden, die zur Hoffnung in schweren Zeiten mahnten: Die Golden Globes rie… [+6361 chars]",,de,'Angelina Jolie'
https://www.tagesspiegel.de/gesellschaft/filmtrophaen-die-golden-globes-feiern-das-durchhalten-12964942.html,https://www.tagesspiegel.de/gesellschaft/filmtrophaen-die-golden-globes-feiern-das-durchhalten-12964942.html,0,www.tagesspiegel.de,Filmtrophäen: Die Golden Globes feiern das Durchhalten,"Ein Siegesdrama, für das der Regisseur sieben Jahre brauchte, zwei fulminante Comebacks und viele Reden, die zur Hoffnung in schweren Zeiten mahnten: Die Golden Globes riefen auf, niemals aufzugeben.",https://www.tagesspiegel.de/images/12964939/alternates/BASE_16_9_W1400/1736149867000/82-golden-globes.jpeg,2025-01-06T07:51:07Z,,"Die Golden Globes haben wie selten zuvor die Bandbreite menschlicher Biografien gewürdigt. Zu den großen Siegern zählten Filme über Auswanderer, Trans-Personen und eine TV-Produktion über die japanis… [+8154 chars]",,de,'nan Si'
https://www.brigitte.de/aktuell/angelina-jolie--glitzer-auftritt-mit-tochter-zahara-bei-den-golden-globes-13928058.html,https://www.brigitte.de/aktuell/angelina-jolie--glitzer-auftritt-mit-tochter-zahara-bei-den-golden-globes-13928058.html,0,www.brigitte.de,Angelina Jolie: Glitzer-Auftritt mit Tochter Zahara bei den Golden Globes,"Einen Preis konnte sie diesmal nicht gewinnen, doch das tat der guten Laune von Angelina Jolie bei den Golden Globe Awards keinen Abbruch.",https://image.brigitte.de/13928060/t/Po/v1/w1440/r1.7778/-/06--glitzer-auftritt-mit-tochter-zahara-bei-den-golden-globes---1-1---spoton-article-1083601.jpg,2025-01-06T07:54:00Z,,"Einen Preis konnte sie diesmal nicht gewinnen, doch das tat der guten Laune von Angelina Jolie bei den Golden Globe Awards keinen Abbruch.
Nachdem sie vor wenigen Tagen endlich ihre Scheidung von Br… [+1692 chars]",,de,'Angelina Jolie'
https://www.stern.de/lifestyle/leute/angelina-jolie--glitzer-auftritt-bei-den-golden-globes-35356928.html,https://www.stern.de/lifestyle/leute/angelina-jolie--glitzer-auftritt-bei-den-golden-globes-35356928.html,0,www.stern.de,Angelina Jolie: Glitzer-Auftritt bei den Golden Globes,"Einen Preis konnte sie diesmal nicht gewinnen, doch das tat der guten Laune von Angelina Jolie bei den Golden Globe Awards keinen Abbruch.",https://image.stern.de/35356932/t/Uh/v1/w1440/r1.7778/-/06--glitzer-auftritt-bei-den-golden-globes---16-9---spoton-article-1083601.jpg,2025-01-06T07:57:00Z,,"Kopiere den aktuellen Link
Einen Preis konnte sie diesmal nicht gewinnen, doch das tat der guten Laune von Angelina Jolie bei den Golden Globe Awards keinen Abbruch.
Nachdem sie vor wenigen Tagen e… [+1717 chars]",,de,'Angelina Jolie'
https://www.stern.de/lifestyle/leute/leute--angelina-jolie-stellt-sich-ihren-aengsten-35356918.html,https://www.stern.de/lifestyle/leute/leute--angelina-jolie-stellt-sich-ihren-aengsten-35356918.html,0,www.stern.de,Leute: Angelina Jolie stellt sich ihren Ängsten,"Singen auf einer Opernbühne oder Szenen in einer anderen Sprache - Oscar-Preisträgerin Angelina Jolie erzählt, dass sie mit ihren Projekten derzeit ihr ""Herz zum Schlagen bringen"" möchte.",https://image.stern.de/35356920/t/ZU/v1/w1440/r1.7778/-/06--mvjwiid2omv16axs2048jpeg---7d47e6eb44c377e2.jpg,2025-01-06T07:58:12Z,,"Kopiere den aktuellen Link
Singen auf einer Opernbühne oder Szenen in einer anderen Sprache - Oscar-Preisträgerin Angelina Jolie erzählt, dass sie mit ihren Projekten derzeit ihr ""Herz zum Schlagen … [+666 chars]",,de,'Angelina Jolie'
https://www.tagesspiegel.de/gesellschaft/leute-angelina-jolie-stellt-sich-ihren-angsten-12964990.html,https://www.tagesspiegel.de/gesellschaft/leute-angelina-jolie-stellt-sich-ihren-angsten-12964990.html,0,www.tagesspiegel.de,Leute: Angelina Jolie stellt sich ihren Ängsten,"Singen auf einer Opernbühne oder Szenen in einer anderen Sprache - Oscar-Preisträgerin Angelina Jolie erzählt, dass sie mit ihren Projekten derzeit ihr „Herz zum Schlagen bringen“ möchte.",https://www.tagesspiegel.de/images/12964987/alternates/BASE_16_9_W1400/1736150403000/angelina-jolie.jpeg,2025-01-06T08:00:03Z,,"Hollywood-Star Angelina Jolie stellt sich eigenen Angaben zufolge derzeit bewusst ihren Ängsten. Dies sei ihr Jahrzehnt, welches sie unter dem Motto Tu, was dir Angst macht lebe, erzählte die 49-Jähr… [+1201 chars]",,de,'Angelina Jolie'
https://www.stern.de/capital/elon-musks-abstieg--wie-aus-dem-tesla-chef-ein-troll-wurde-35354616.html,https://www.stern.de/capital/elon-musks-abstieg--wie-aus-dem-tesla-chef-ein-troll-wurde-35354616.html,0,www.stern.de,Tesla-Chef: Elons Abstieg: Wie aus Musk der reichste Troll der Welt wurde,Elon Musks Kampagnen für Rechtsextreme stehen am Ende einer langen Entwicklung. Wie sich der Milliardär von einem Star-Unternehmer zu einem Anhänger von Verschwörungstheorien entwickelt hat,https://image.stern.de/35354614/t/MB/v4/w1440/r1.7778/-/musk-springt.jpg,2025-01-06T08:37:00Z,https://web.archive.org/web/20250106194027/https://www.stern.de/capital/elon-musks-abstieg--wie-aus-dem-tesla-chef-ein-troll-wurde-35354616.html,"Kopiere den aktuellen Link
Elon Musks Kampagnen für Rechtsextreme stehen am Ende einer langen Entwicklung. Wie sich der Milliardär von einem Star-Unternehmer zu einem Anhänger von Verschwörungstheor… [+7816 chars]",,de,'LeBron James'
https://www.morgenpost.de/kultur/article408021384/the-brutalist-gewinnt-bei-den-golden-globes.html,https://www.morgenpost.de/kultur/article408021384/the-brutalist-gewinnt-bei-den-golden-globes.html,0,www.morgenpost.de,„The Brutalist“ gewinnt bei den Golden Globes,"Ein Siegesdrama, das sieben Jahre brauchte, zwei fulminante Comebacks und viele Reden, nicht aufzugeben: Das waren die Golden Globes.",https://img.sparknews.funkemedien.de/408020751/408020751_1736155785_v16_9_1600.jpeg,2025-01-06T09:29:46Z,,"Los Angeles. Ein Siegesdrama, das sieben Jahre brauchte, zwei fulminante Comebacks und viele Reden, nicht aufzugeben: Das waren die Golden Globes.
Die Golden Globes haben wie selten zuvor die Bandbr… [+6581 chars]",,de,'nan nan'
https://www.pcgames.de/Kino-Thema-130800/News/Was-war-wirklich-im-Karton-Raetsel-des-Brad-Pitt-Meisterwerks-Sieben-nach-30-Jahren-geloest-david-fincher-1462941/,https://www.pcgames.de/Kino-Thema-130800/News/Was-war-wirklich-im-Karton-Raetsel-des-Brad-Pitt-Meisterwerks-Sieben-nach-30-Jahren-geloest-david-fincher-1462941/,0,www.pcgames.de,Was war wirklich im Karton? Rätsel des Brad Pitt-Meisterwerks Sieben nach 30 Jahren gelöst,Mehr als 30 Jahre nach dem ursprünglichen Kino-Release ist das Rätsel rund um den mysteriösen Karton in Sieben endlich gelöst - und aufgeklärt hat es ausgerechnet Meister-Regisseur David Fincher höchstselbst.,https://www.pcgames.de/screenshots/original/2025/01/gwyneth-paltrow-contagion-pc-games_artwork.jpg,2025-01-06T10:29:00Z,,"Seit der Kino-Veröffentlichung von Sieben im Jahr 1995 sind mittlerweile knapp 30 Jahre vergangen. Und während die Stars aus dem Film heute zur Spitze von Hollywood gehören, blieb das Rätsel rund um … [+3068 chars]",,de,'Brad Pitt'
https://www.brigitte.de/aktuell/herzogin-meghan--freundin-mindy-kaling-schwaermt-von-ihren-kochkuensten-13928162.html,https://www.brigitte.de/aktuell/herzogin-meghan--freundin-mindy-kaling-schwaermt-von-ihren-kochkuensten-13928162.html,0,www.brigitte.de,Herzogin Meghan: Freundin Mindy Kaling schwärmt von ihren Kochkünsten,"Im Trailer zur Netflix-Serie ""With Love, Meghan"" ist auch Schauspielerin Mindy Kaling zu sehen. Was sie bei den Dreharbeiten umhaute...",https://image.brigitte.de/13928164/t/IP/v1/w1440/r1.7778/-/06--freundin-mindy-kaling-schwaermt-von-ihren-kochkuensten---1-1---spoton-article-1083606.jpg,2025-01-06T11:12:00Z,https://web.archive.org/web/20250109132808/https://www.brigitte.de/aktuell/herzogin-meghan--freundin-mindy-kaling-schwaermt-von-ihren-kochkuensten-13928162.html,"Im Trailer zur Netflix-Serie ""With Love, Meghan"" ist auch Schauspielerin Mindy Kaling zu sehen. Was sie bei den Dreharbeiten umhaute...
""The Office""-Star Mindy Kaling (45) ist nicht nur Schauspieler… [+2710 chars]",,de,'Mindy Kaling'
https://www.brigitte.de/beauty/haare/emma-stone--sie-ueberrascht-mit-dramatischem-kurzhaarschnitt-11037198.html,https://www.brigitte.de/beauty/haare/emma-stone--sie-ueberrascht-mit-dramatischem-kurzhaarschnitt-11037198.html,0,www.brigitte.de,Vorher-Nachher: Sie überrascht mit dramatischem Kurzhaarschnitt,Promis wie Heidi Klum probieren sich regelmäßig an neuen Looks. Die Stars wagen völlig neue Frisuren-Stylings und wir zeigen sie euch!,https://image.brigitte.de/13928136/t/bP/v2/w1440/r1.7778/-/emma-stone-haare.jpg,2025-01-06T11:24:00Z,,"Hey, bitte melde dich an, um weiterzulesen
Dieser Inhalt ist Teil von unserem neuen BRIGITTE-Angebot mit spannenden Artikeln, Persönlichkeitstests und Coaching-Videos.
Kostenlos und ohne Abo verspr… [+72 chars]",,de,'Heidi Klum'
https://www.diepresse.com/19228634/bei-den-golden-globes-siegte-der-mut,https://www.diepresse.com/19228634/bei-den-golden-globes-siegte-der-mut,0,www.diepresse.com,Bei den Golden Globes siegte der Mut,"Filmpreise. Gelungenes Comeback für den „kleinen Bruder der Oscars“: Demi Moore erhielt den ersten Darstellerpreis ihrer Karriere. Der große Sieger des Abends war das Musical „Emilia Pérez“ über einen Drogenboss, der zur Frau wird.",https://img.diepresse.com/public/incoming/5ere5b-AWARDS-GOLDENGLOBES/alternates/DPR_SOCIAL_MAGAZIN/AWARDS-GOLDENGLOBES,2025-01-06T11:38:33Z,,"Gelungenes Comeback für den kleinen Bruder der Oscars: Demi Moore erhielt den ersten Darstellerpreis ihrer Karriere. Der große Sieger des Abends war das Musical Emilia Pérez über einen Drogenboss, de… [+6230 chars]",,de,'Demi Moore'
https://www.bild.de/unterhaltung/stars-und-leute/taylor-swift-schnappschuesse-von-eras-tour-pause-677ba31e0195b908c189b66a,https://www.bild.de/unterhaltung/stars-und-leute/taylor-swift-schnappschuesse-von-eras-tour-pause-677ba31e0195b908c189b66a,0,www.bild.de,Mädels-Auszeit im Bikini - Taylor Swift sonnt sich im Erfolg,Taylor Swifts Backgroundsängerin Jeslyn Gorman teilt auf Instagram seltene Einblicke in die gemeinsamen Erholungspausen während der „The Eras Tour“.,"https://images.bild.de/677ba31e0195b908c189b66a/051fabf3a2da3420c6819df654b1d348,675fcf7e?w=1280",2025-01-06T13:09:55Z,http://archive.md/20250106163147/http://www.bild.de/unterhaltung/stars-und-leute/taylor-swift-schnappschuesse-von-eras-tour-pause-677ba31e0195b908c189b66a,"Mit ihrer The Eras Tour knackte Pop-Queen Taylor Swift im vergangenen Jahr sämtliche Rekorde. Wie sie AUF der Bühne Vollgas gab, sahen Millionen Fans. Jetzt gibt es einen Einblick hinter die Kulissen… [+1755 chars]",,de,'Travis Kelce'
https://www.bild.de/sport/mehr-sport/taylor-swift-traum-hochzeit-mit-nfl-star-kelce-brisante-geruechte-677bcb3f37e71f1aec28b3a1,https://www.bild.de/sport/mehr-sport/taylor-swift-traum-hochzeit-mit-nfl-star-kelce-brisante-geruechte-677bcb3f37e71f1aec28b3a1,0,www.bild.de,Kelce-Freund heizt Gerüchte an - Traum-Hochzeit bei Taylor Swift?,Läuten bald die Hochzeitsglocken? Spannende Aussagen zum Liebesleben von Taylor Swift und Travis Kelce.,"https://images.bild.de/677bcb3f37e71f1aec28b3a1/58afd741eeec83a99337aec835ecc4fe,3c006cec?w=1280",2025-01-06T13:13:31Z,,"Läuten bald die Hochzeitsglocken?
Seitdem sie sich im Herbst 2023 erstmals in der Öffentlichkeit gezeigt haben, sind Sängerin Taylor Swift (35) und NFL-Profi Travis Kelce (35) DAS Promi-Traumpaar. B… [+1966 chars]",,de,'Travis Kelce'
https://www.sueddeutsche.de/panorama/promi-news-angelina-jolie-angst-melania-trump-andrew-garfield-li.3176257,https://www.sueddeutsche.de/panorama/promi-news-angelina-jolie-angst-melania-trump-andrew-garfield-li.3176257,0,www.sueddeutsche.de,"Leute: Herzen, die zum Glück noch schlagen","Hollywood-Star Angelina Jolie hat einen festen Plan für die kommenden Jahre, Melania Trump produziert sich selbst, und „Spider-Man“ Andrew Garfield zelebriert seine Schüchternheit.",https://www.sueddeutsche.de/2025/01/06/a1c65acd-1f54-4fc7-ba97-05e411c8fe03.jpeg?q=60&fm=webp&width=1200&rect=0%2C36%2C3500%2C1969,2025-01-06T13:31:59Z,https://web.archive.org/web/20250110000751/https://www.sueddeutsche.de/panorama/promi-news-angelina-jolie-angst-melania-trump-andrew-garfield-li.3176257,"Angelina Jolie, 49, Schauspielerin, stellt sich ganz bewusst ihren Ängsten. Dies sei ihr Jahrzehnt, welches sie unter dem Motto Tu, was dir Angst macht lebe, erzählte die 49-Jährige dem Branchenporta… [+2412 chars]",,de,'Melania Trump'
https://www.sueddeutsche.de/politik/glosse-das-streiflicht-li.3177504,https://www.sueddeutsche.de/politik/glosse-das-streiflicht-li.3177504,0,www.sueddeutsche.de,Glosse: Das Streiflicht,"Angelina Jolie hat sich mit ihrer Methode, mit Angst umzugehen, gerade als Bundeskanzlerin beworben.",https://www.sueddeutsche.de/szde-assets/img/szde-article-sharing-image-no-teaser-image-fallback.png,2025-01-06T16:36:26Z,https://web.archive.org/web/20250121090004/https://www.sueddeutsche.de/politik/glosse-das-streiflicht-li.3177504,"Angelina Jolie hat sich mit ihrer Methode, mit Angst umzugehen, gerade als Bundeskanzlerin beworben.(SZ) Die vergangenen Wochen waren stürmisch. Seemänner beißen dann auf die Zähne. Die Deutschen kau… [+983 chars]",,de,'Angelina Jolie'
https://www.stern.de/kultur/demi-moore--eine-vorkaempferin-und-ihr-spaeter-triumph-35357042.html,https://www.stern.de/kultur/demi-moore--eine-vorkaempferin-und-ihr-spaeter-triumph-35357042.html,0,www.stern.de,Golden Globes: Demi Moore: Der späte Triumph einer Vorkämpferin,"Lange fand Demi Moore nur noch in Klatschspalten statt, jetzt tritt sie zurück auf die Bühne und hat endlich einen Preis bekommen. Doch eine mutige Pionierin ist sie schon lange.",https://image.stern.de/35357432/t/P5/v7/w1440/r1.7778/-/demi-moore-4.jpg,2025-01-06T17:09:00Z,,"Kopiere den aktuellen Link
Lange fand Demi Moore nur noch in Klatschspalten statt, jetzt tritt sie zurück auf die Bühne und hat endlich einen Preis bekommen. Doch eine mutige Pionierin ist sie schon… [+539 chars]",,de,'Demi Moore'
https://www.brigitte.de/aktuell/fuenf-jahre-nach-dem-megxit--das-sind-die-engsten-vertrauten-von-harry-und-meghan-13928724.html,https://www.brigitte.de/aktuell/fuenf-jahre-nach-dem-megxit--das-sind-die-engsten-vertrauten-von-harry-und-meghan-13928724.html,0,www.brigitte.de,Fünf Jahre nach dem Megxit: Das sind die engsten Vertrauten von Harry und Meghan,Mit ihren Attacken gegen die Royal Family haben sich Prinz Harry und Meghan bei vielen ins Aus geschossen. Wer jetzt noch zu ihnen hält.,https://image.brigitte.de/13928726/t/MQ/v1/w1440/r1.7778/-/07--das-sind-die-engsten-vertrauten-von-harry-und-meghan---1-1---spoton-article-1083677.jpg,2025-01-07T13:23:00Z,,"Mit ihren Attacken gegen die Royal Family haben sich Prinz Harry und Meghan bei vielen ins Aus geschossen. Wer jetzt noch zu ihnen hält.
Am 8. Januar 2020 sorgten Prinz Harry (40) und Herzogin Megha… [+5848 chars]",,de,'Prinz Harry'
https://www.stern.de/lifestyle/leute/fuenf-jahre-nach-dem-megxit--die-engsten-vertrauten-von-harry-und-meghan-35360980.html,https://www.stern.de/lifestyle/leute/fuenf-jahre-nach-dem-megxit--die-engsten-vertrauten-von-harry-und-meghan-35360980.html,0,www.stern.de,Fünf Jahre nach dem Megxit: Die engsten Vertrauten von Harry und Meghan,Mit ihren Attacken gegen die Royal Family haben sich Prinz Harry und Meghan bei vielen ins Aus geschossen. Wer jetzt noch zu ihnen hält.,https://image.stern.de/35360984/t/RH/v1/w1440/r1.7778/-/07--die-engsten-vertrauten-von-harry-und-meghan---16-9---spoton-article-1083677.jpg,2025-01-07T13:27:00Z,,"Kopiere den aktuellen Link
Mit ihren Attacken gegen die Royal Family haben sich Prinz Harry und Meghan bei vielen ins Aus geschossen. Wer jetzt noch zu ihnen hält.
Am 8. Januar 2020 sorgten Prinz H… [+5759 chars]",,de,'Prinzessin Diana'
https://www.faz.net/aktuell/wirtschaft/unternehmen/wie-meta-chef-mark-zuckerberg-donald-trump-umschmeichelt-110216270.html,https://www.faz.net/aktuell/wirtschaft/unternehmen/wie-meta-chef-mark-zuckerberg-donald-trump-umschmeichelt-110216270.html,0,www.faz.net,Meta-Chef: Wie Mark Zuckerberg Trump umschmeichelt,Der Meta-Chef feuert Fakten-Checker und holt mit Dana White einen Trump-Gefährten in den Verwaltungsrat. Auch sonst zeigt er sich generös.,https://media0.faz.net/ppmedia/aktuell/politik/1146027370/1.10216136/facebook_teaser/dana-white-mitte-ist-ein.jpg,2025-01-07T13:57:10Z,http://archive.md/20250107141331/http://www.faz.net/aktuell/wirtschaft/unternehmen/wie-meta-chef-mark-zuckerberg-donald-trump-umschmeichelt-110216270.html,"Wir werden Faktenprüfer abschaffen und sie durch Community Notes ersetzen, ähnlich wie X, beginnend in den USA, teilte der Zuckerberg mit. Die Faktenprüfungen waren Trump stets ein Dorn im Auge gewes… [+2874 chars]",,de,'Hunter Biden'
https://www.bild.de/sport/mehr-sport/hier-stimmt-fast-alles-lebron-klon-verbluefft-basketball-fans-677d27990195b908c189c676,https://www.bild.de/sport/mehr-sport/hier-stimmt-fast-alles-lebron-klon-verbluefft-basketball-fans-677d27990195b908c189c676,0,www.bild.de,Hier stimmt „fast“ alles! - LeBron-Klon verblüfft Basketball-Fans,"LeBron James und Steph Curry gehen auch außerhalb der NBA auf Korbjagd, zumindest sehen diese beiden Typen den NBA-Legenden sehr ähnlich.","https://images.bild.de/677d27990195b908c189c676/0853ace4cbafa63567896b9d632543c9-landscape,f632feb1?w=1280",2025-01-07T14:34:52Z,https://web.archive.org/web/20250108195156/https://www.bild.de/sport/mehr-sport/hier-stimmt-fast-alles-lebron-klon-verbluefft-basketball-fans-677d27990195b908c189c676,"Mehr zum Video anzeigen 
LeBron James und Steph Curry gehen auch außerhalb der NBA auf Korbjagd, zumindest sehen diese beiden Typen den NBA-Legenden sehr ähnlich.
Quelle: BILD / Instagram@kratosmbo… [+22 chars]",,de,'LeBron James'
https://www.focus.de/politik/meinung/analyse-von-ulrich-reitz-scholz-hieb-gegen-habeck-zeigt-die-schamlose-arroganz-dieses-kanzlers_id_260614932.html,https://www.focus.de/politik/meinung/analyse-von-ulrich-reitz-scholz-hieb-gegen-habeck-zeigt-die-schamlose-arroganz-dieses-kanzlers_id_260614932.html,0,www.focus.de,Analyse von Ulrich Reitz - Scholz-Hieb gegen Habeck zeigt die schamlose Arroganz dieses Kanzlers,Kaum jemand vertraut dem Kanzler. Weshalb sollte man ihn also wiederwählen? Die Antworten von Olaf Scholz auf diese Frage bleiben luftig.Von FOCUS-online-Korrespondent Ulrich Reitz,https://p6.focus.de/img/fotos/id_260566903/olaf-scholz-r-grinst-als-bundestagspraesidentin-baerbel-bas-dem-bundeskanzler-das-vertrauen-entzieht.jpg?im=Crop%3D%280%2C0%2C3463%2C1733%29%3BResize%3D%281200%2C627%29&impolicy=perceptual&quality=mediumHigh&hash=310595fff9d719e8c7827d43a552a1a1b79fff662a095b18de5677b40dbd1b78,2025-01-07T15:08:26Z,https://web.archive.org/web/20250108191635/https://www.focus.de/politik/meinung/analyse-von-ulrich-reitz-scholz-hieb-gegen-habeck-zeigt-die-schamlose-arroganz-dieses-kanzlers_id_260614932.html,Kaum jemand vertraut dem Kanzler. Weshalb sollte man ihn also wiederwählen? Die Antworten von Olaf Scholz auf diese Frage bleiben luftig. Kein Bundeskanzler genießt so wenig Vertrauen in der Bevölker… [+7358 chars],,de,'Olaf Scholz'
https://www.brigitte.de/mode/trends/prinzessin-diana--11-unvergessliche-looks--die-wir-auch-heute-noch-tragen-12219722.html,https://www.brigitte.de/mode/trends/prinzessin-diana--11-unvergessliche-looks--die-wir-auch-heute-noch-tragen-12219722.html,0,www.brigitte.de,"Prinzessin Diana: 11 unvergessliche Looks von Prinzessin Diana, die zum Nachstylen inspirieren","Prinzessin Diana würde ihren 63. Geburtstag feiern – bis heute gehört sie zu den größten Stil-Ikonen des 20. Jahrhundert und ist verantwortlich für so einige Looks, die bis heute gerne kopiert werden.",https://image.brigitte.de/12219444/t/ZC/v6/w1440/r1.7778/-/gettyimages-52117839.jpg,2025-01-07T15:34:00Z,,"Bevor Prinzessin Diana 1997 bei einem tragischen Autounfall in Paris mit nur 37 Jahren plötzlich aus dem Leben gerissen wurde, wurde sie bereits für ihren Stil gefeiert. Und bis heute, über 26 Jahre … [+1966 chars]",,de,'Prinzessin Diana'
https://www.n-tv.de/leute/Fuenf-Jahre-Megxit-wer-hat-gewonnen-article25474492.html,https://www.n-tv.de/leute/Fuenf-Jahre-Megxit-wer-hat-gewonnen-article25474492.html,0,www.n-tv.de,"Royale Zukunft auf der Kippe: Fünf Jahre ""Megxit"" - wer hat gewonnen?","Vor fünf Jahren verlassen Prinz Harry und Herzogin Meghan die britische Königsfamilie. Seitdem ist das Verhältnis zu den Royals zerrüttet, die Wahrnehmung der Monarchie leidet. Doch auch das Leben in den USA ist nicht so, wie es sich das Paar vorgestellt hat.",https://bilder1.n-tv.de/img/incoming/crop25474544/3911325318-cImg_16_9-w1200/imago0168526966h.jpg,2025-01-08T10:24:01Z,,"Vor fünf Jahren verlassen Prinz Harry und Herzogin Meghan die britische Königsfamilie. Seitdem ist das Verhältnis zu den Royals zerrüttet, die Wahrnehmung der Monarchie leidet. Doch auch das Leben in… [+7513 chars]",,de,'Prinzessin Diana'
https://www.tagesspiegel.de/internationales/anschluss-kanadas-an-die-usa-trump-erwagt-okonomischen-zwang-musk-bezeichnet-trudeau-als-madchen-12979939.html,https://www.tagesspiegel.de/internationales/anschluss-kanadas-an-die-usa-trump-erwagt-okonomischen-zwang-musk-bezeichnet-trudeau-als-madchen-12979939.html,0,www.tagesspiegel.de,"Anschluss Kanadas an die USA?: Trump erwägt „ökonomischen Zwang“, Musk bezeichnet Trudeau als „Mädchen“","Während in Ottawa nach dem angekündigten Rücktritt des Premiers ein Machtvakuum herrscht, verschärft der künftige US-Präsident seine Attacken auf das Nachbarland. Und Elon Musk verunglimpft Trudeau.",https://www.tagesspiegel.de/images/12973645/alternates/BASE_16_9_W1400/1736334937000/file-photo-canadian-prime-minister-justin-trudeau.jpeg,2025-01-08T12:40:36Z,,"Zunächst schien es ein Witz von Donald Trump zu sein: Kanada soll 51. Bundesstaat der USA werden. Aber wenige Tage vor seinem Amtsantritt spricht Trump nun von wirtschaftlicher Macht, die er anwenden… [+10872 chars]",,de,'Elon Musk'
