index,url,valid,domain,title,description,image,published,archive,content,quote,language,keyword
https://www.dw.com/de/sind-die-wahlen-in-ruanda-nur-eine-show/a-69478669,https://www.dw.com/de/sind-die-wahlen-in-ruanda-nur-eine-show/a-69478669,0,www.dw.com,Sind die Wahlen in Ruanda nur eine Show?,Mitte Juli werden die Menschen in Ruanda zwischen drei Präsidentschaftskandidaten die Wahl haben. Kaum jemand zweifelt am Sieg des amtierenden Präsidenten Paul Kagame. Sind die Wahlen nur eine Farce?,https://static.dw.com/image/69485500_6.jpg,2024-07-01T06:45:00Z,,"Für Charles Ndushabandi, der in der Hauptstadt Kigali lebt, hat die bevorstehende Präsidentenwahl in Ruanda wenig Bedeutung. ""Ich glaube nicht, dass sich viel ändern wird. Die Wahlen sind bloß ein Ri… [+6477 chars]",,de,'Paul Kagame'
https://www.dw.com/de/sind-die-bevorstehenden-wahlen-in-ruanda-nur-eine-show/a-69478669,https://www.dw.com/de/sind-die-bevorstehenden-wahlen-in-ruanda-nur-eine-show/a-69478669,0,www.dw.com,Sind die bevorstehenden Wahlen in Ruanda nur eine Show?,Mitte Juli werden die Ruander zwischen drei Präsidentschaftskandidaten die Wahl haben. Kaum Jemand zweifelt am Sieg des amtierenden Präsidenten Paul Kagame. Sind die Wahlen nur eine Farce?,https://static.dw.com/image/69485500_6.jpg,2024-07-01T06:45:00Z,,"Für Charles Ndushabandi, der in der Hauptstadt Kigali lebt, hat die bevorstehende Präsidentenwahl in Ruanda wenig Bedeutung. ""Ich glaube nicht, dass sich viel ändern wird. Die Wahlen sind bloß ein Ri… [+6408 chars]",,de,'Paul Kagame'
https://orf.at/stories/3362312/,https://orf.at/stories/3362312/,0,orf.at,Immunität für Amtshandlungen zuerkannt,"Am Montag hat das US-Höchstgericht verkündet, worauf mitten im Wahlkampf alle gewartet haben: das Urteil, ob Ex-Präsident Donald Trump strafrechtlich verfolgt werden kann oder nicht. Das Urteil lautet: jein. Ein ehemaliger US-Präsident dürfe gerichtlich veran…",https://ibs.orf.at/news?image=https%3A%2F%2Fassets.orf.at%2Fmims%2F2024%2F27%2F93%2Fcrops%2Fw%3D1200%2Ch%3D630%2Cq%3D75%2F2264239_master_860893_usa_trump_immunitaet_hoechstgericht_im.jpg%3Fs%3D2cf3ab44de2803a2ef91e1082ab91395e872a7ca,2024-07-01T15:02:18Z,,"Trump hatte beantragt, als ehemaliger US-Präsident absolut immun gegen strafrechtliche Verfolgung zu sein. Der Antrag bezieht sich auf die vor einem Washingtoner Bundesgericht gegen ihn erhobene stra… [+3640 chars]",,de,'Donald Trump'
https://www.stern.de/lifestyle/leute/donald-trump--oberstes-gericht-bestaetigt-teil-immunitaet-34844476.html,https://www.stern.de/lifestyle/leute/donald-trump--oberstes-gericht-bestaetigt-teil-immunitaet-34844476.html,0,www.stern.de,Donald Trump: Oberstes Gericht bestätigt Teil-Immunität,Donald Trump hat vor dem Obersten Gericht der USA einen Teilsieg errungen. Zumindest bei Handlungen als Präsident genieße er Immunität.,https://image.stern.de/34844480/t/1M/v1/w1440/r1.7778/-/01--oberstes-gericht-bestaetigt-teil-immunitaet---16-9---spoton-article-1069767.jpg,2024-07-01T16:48:00Z,,"Donald Trump hat vor dem Obersten Gericht der USA einen Teilsieg errungen. Zumindest bei Handlungen als Präsident genieße er Immunität.
Der ehemalige US-Präsident Donald Trump (78) hat vor dem Supre… [+2087 chars]",,de,'Stormy Daniels'
https://www.brigitte.de/aktuell/donald-trump--teils-immun--aber-er--steht-nicht-ueber-dem-gesetz--13838520.html,https://www.brigitte.de/aktuell/donald-trump--teils-immun--aber-er--steht-nicht-ueber-dem-gesetz--13838520.html,0,www.brigitte.de,"Donald Trump: Teils immun, aber er ""steht nicht über dem Gesetz""",Donald Trump hat vor dem Obersten Gericht der USA einen Teilsieg errungen. Zumindest bei Handlungen als Präsident genieße er Immunität.,https://image.brigitte.de/13838522/t/DE/v1/w1440/r1.7778/-/01--teils-immun--aber-er--steht-nicht-ueber-dem-gesetz----1-1---spoton-article-1069767.jpg,2024-07-01T16:51:00Z,,"Donald Trump hat vor dem Obersten Gericht der USA einen Teilsieg errungen. Zumindest bei Handlungen als Präsident genieße er Immunität.
Der ehemalige US-Präsident Donald Trump (78) hat vor dem Supre… [+2089 chars]",,de,'Donald Trump'
https://orf.at/stories/3362337/,https://orf.at/stories/3362337/,0,orf.at,Richterin fürchtet „König über dem Gesetz“,"Das US-Höchstgericht hat am Montag entschieden, dass US-Präsident Donald Trump für Amtshandlungen rechtliche Immunität genießt. Für Trump stellt das Urteil einen „großen Sieg für Verfassung und Demokratie“ dar. Die Richterschaft am Supreme Court ist mehrheitl…",https://ibs.orf.at/news?image=https%3A%2F%2Fassets.orf.at%2Fmims%2F2024%2F27%2F43%2Fcrops%2Fw%3D1200%2Ch%3D630%2Cq%3D75%2F2264589_master_861043_trump_immunitaet_hoechstgericht_reax_afp.jpg%3Fs%3D0ed1ba5953693f6a3803a9053faf4475a3f4f09f,2024-07-01T21:51:55Z,,"Ein großer Sieg für unsere Verfassung und Demokratie. Stolz, ein Amerikaner zu sein, begrüßte Trump am Montag das mit Spannung erwartete Urteil des Supreme Court. Zuvor hatte das Höchstgericht seinen… [+4300 chars]",,de,'Donald Trump'
https://www.zeit.de/politik/ausland/2024-07/donald-trump-anwaelte-immunitaetsurteil-schweigegeldprozess,https://www.zeit.de/politik/ausland/2024-07/donald-trump-anwaelte-immunitaetsurteil-schweigegeldprozess,0,www.zeit.de,Immunitätsurteil: Trump-Anwälte fordern Aufhebung des Urteils in Schweigegeldprozess,Kommende Woche soll das Strafmaß gegen Donald Trump in der Schweigegeldaffäre verkündet werden. Seine Anwälte bemühen sich um eine Verzögerung.,https://img.zeit.de/politik/ausland/2024-07/donald-trump-anwaelte-schweigegeldprozess-immunitaet-bild/wide__1300x731,2024-07-02T01:56:12Z,,Nach dem Urteil des Supreme Court zur weitreichenden Immunität von Ex-US-Präsidenten bemühen sich die Anwälte von Donald Trump um eine Verzögerung der Strafmaßverkündung im New Yorker Schweigegeldpro… [+2984 chars],,de,'Donald Trump'
https://www.stern.de/news/biden-kritisiert-urteil-von-oberstem-us-gericht-zu-teil-immunitaet-fuer-trump-scharf-34844250.html,https://www.stern.de/news/biden-kritisiert-urteil-von-oberstem-us-gericht-zu-teil-immunitaet-fuer-trump-scharf-34844250.html,0,www.stern.de,Biden kritisiert Urteil von oberstem US-Gericht zu Teil-Immunität für Trump scharf,"US-Präsident Joe Biden hat die Entscheidung des obersten Gerichts der USA, Donald Trump eine Teil-Immunität zu gewähren, scharf kritisiert. Biden sprach am Montag (Ortszeit) von einem ""gefährlichen Präzedenzfall"". Vier Monate vor der Präsidentschaftswahl hatt…",https://image.stern.de/34845042/t/Pu/v1/w1440/r1.7778/-/02--protest-gegen-trump-am-montag-vor-dem-supreme-court---e6eb8395d9b9935a.jpg,2024-07-02T04:50:31Z,,"US-Präsident Joe Biden hat die Entscheidung des obersten Gerichts der USA, Donald Trump eine Teil-Immunität zu gewähren, scharf kritisiert. Biden sprach am Montag (Ortszeit) von einem ""gefährlichen P… [+3946 chars]",,de,'Stormy Daniels'
https://www.stern.de/politik/ausland/biden-nennt-trumps-teil-immunitaet-einen--gefaehrlichen-praezedenzfall--34845048.html,https://www.stern.de/politik/ausland/biden-nennt-trumps-teil-immunitaet-einen--gefaehrlichen-praezedenzfall--34845048.html,0,www.stern.de,"Urteil des Supreme Court: Biden nennt Trumps Teil-Immunität einen ""gefährlichen Präzedenzfall""","Der Supreme Court hat entschieden: Donald Trump ist teilweise vor Strafverfolgung geschützt – zumindest für die Zeit, als er Präsident war. Das könnte Tür und Tor für Amtsmissbrauch öffnen. So sieht es zumindest Joe Biden.",https://image.stern.de/34845064/t/IL/v2/w1440/r1.7778/-/biden.jpg,2024-07-02T05:26:00Z,,"Der Supreme Court hat entschieden: Donald Trump ist teilweise vor Strafverfolgung geschützt zumindest für die Zeit, als er Präsident war. Das könnte Tür und Tor für Amtsmissbrauch öffnen. So sieht es… [+4287 chars]",,de,'Joe Biden'
https://www.tagesschau.de/ausland/amerika/trump-immunitaet-112.html,https://www.tagesschau.de/ausland/amerika/trump-immunitaet-112.html,0,www.tagesschau.de,Trump geht nach Urteil zu Teil-Immunität in die Offensive,Donald Trump hat vor dem Obersten US-Gericht einen Teilerfolg errungen - und geht nun in die Offensive. Im Visier: seine weiteren Strafverfahren. Dabei spielt das Trump-Lager auch auf Zeit. Scharfe Worte kommen von US-Präsident Biden.,https://images.tagesschau.de/image/1ade5439-6835-4736-b910-51110a177040/AAABkHI9OMY/AAABjwnlFvA/16x9-1280/trump-3466.jpg,2024-07-02T07:10:14Z,,"Stand: 02.07.2024 09:10 Uhr
Donald Trump hat vor dem Obersten US-Gericht einen Teilerfolg errungen - und geht nun in die Offensive. Im Visier: seine weiteren Strafverfahren. Dabei spielt das Trump-L… [+6850 chars]",,de,'Stormy Daniels'
https://www.stern.de/kultur/dua-lipa--die-saengerin-kuendigt-ihr-groesstes-konzert-an-34845316.html,https://www.stern.de/kultur/dua-lipa--die-saengerin-kuendigt-ihr-groesstes-konzert-an-34845316.html,0,www.stern.de,Dua Lipa: Die Sängerin kündigt ihr größtes Konzert an,Noch beflügelt von ihrem Auftritt auf dem Glastonbury-Festival kündigt Dua Lipa ihr größtes Konzert an: 2025 spielt sie im Wembley-Stadion.,https://image.stern.de/34845320/t/95/v1/w1440/r1.7778/-/02--die-saengerin-kuendigt-ihr-groesstes-konzert-an---16-9---spoton-article-1069784.jpg,2024-07-02T07:18:00Z,,"Noch beflügelt von ihrem Auftritt auf dem Glastonbury-Festival kündigt Dua Lipa ihr größtes Konzert an: 2025 spielt sie im Wembley-Stadion.
Nach ihrem Auftritt beim Glastonbury-Festival am Freitagab… [+1501 chars]",,de,'Dua Lipa'
https://www.brigitte.de/aktuell/dua-lipa--die-saengerin-kuendigt-konzert-im-wembley-stadion-an-13838646.html,https://www.brigitte.de/aktuell/dua-lipa--die-saengerin-kuendigt-konzert-im-wembley-stadion-an-13838646.html,0,www.brigitte.de,Dua Lipa: Die Sängerin kündigt Konzert im Wembley-Stadion an,Noch beflügelt von ihrem Auftritt auf dem Glastonbury-Festival kündigt Dua Lipa ihr größtes Konzert an: 2025 spielt sie im Wembley-Stadion.,https://image.brigitte.de/13838648/t/qJ/v1/w1440/r1.7778/-/02--die-saengerin-kuendigt-konzert-im-wembley-stadion-an---1-1---spoton-article-1069784.jpg,2024-07-02T07:24:00Z,,"Noch beflügelt von ihrem Auftritt auf dem Glastonbury-Festival kündigt Dua Lipa ihr größtes Konzert an: 2025 spielt sie im Wembley-Stadion.
Nach ihrem Auftritt beim Glastonbury-Festival am Freitagab… [+1504 chars]",,de,'Dua Lipa'
https://www.nzz.ch/international/orban-in-kiew-coup-zu-beginn-von-ungarns-ratspraesidentschaft-ld.1837684,https://www.nzz.ch/international/orban-in-kiew-coup-zu-beginn-von-ungarns-ratspraesidentschaft-ld.1837684,0,www.nzz.ch,Ein Überraschungsbesuch in Kiew: Orban und Selenski haben sich viel zu sagen,Zum Auftakt der EU-Rats-Präsidentschaft seines Landes hat der ungarische Regierungschef erstmals seit Kriegsbeginn die Ukraine besucht. Bisher war Orban vor allem durch Obstruktionspolitik aufgefallen – wird er nun plötzlich konstruktiv?,"https://img.nzz.ch/2024/07/02/8e8e70e5-7410-487a-9e80-407c4be3cc69.jpeg?width=1200&height=674&fit=bounds&quality=75&auto=webp&crop=3000,1687,x0,y128&wmark=nzz",2024-07-02T14:51:49Z,,"Das Verhältnis zwischen Viktor Orban (links) und Wolodimir Selenski war nach dem russischen Grossangriff ausgesprochen frostig.
Ungarns EU-Rats-Präsidentschaft beginnt mit einem Coup. Nur einen Tag … [+6226 chars]",,de,'Selenski'
https://www.faz.net/aktuell/politik/us-wahl/liveticker-us-wahl-2024-erster-abgeordneter-der-demokraten-fordert-rueckzug-bidens-faz-19444916.html,https://www.faz.net/aktuell/politik/us-wahl/liveticker-us-wahl-2024-erster-abgeordneter-der-demokraten-fordert-rueckzug-bidens-faz-19444916.html,0,www.faz.net,Liveticker zur US-Wahl 2024: Erster Abgeordneter der Demokraten fordert Rückzug Bidens,Strafmaßverkündung in Schweigegeld-Prozess verzögert sich wohl +++ Donald Trump feiert Entscheidung des Supreme Courts +++ Oberstes Gericht spricht Präsidenten erstmals begrenzte Immunität zu +++ Alle Neuigkeiten im Liveblog,https://media1.faz.net/ppmedia/aktuell/feuilleton/1399405123/1.9828963/facebook_teaser/fordert-einen-rueckzug-bidens.jpg,2024-07-02T15:32:01Z,,"Nach dem historischen Urteil des Obersten Gerichts über Immunität für amerikanische Präsidenten versucht Donald Trump, seine Verurteilung im New Yorker Schweigegeld-Prozess aufheben zu lassen. Mehrer… [+1758 chars]",,de,'Donald Trump'
https://www.nzz.ch/international/donald-trump-gerichtsprozesse-beeinflussen-2024-kandidatur-ld.1627342,https://www.nzz.ch/international/donald-trump-gerichtsprozesse-beeinflussen-2024-kandidatur-ld.1627342,0,www.nzz.ch,DIE NEUSTEN ENTWICKLUNGEN - Donald Trump: Ex-Anwalt Giuliani verliert New Yorker Anwaltslizenz,"Trotz seiner Wahlniederlage 2020 und der Anstiftung eines Umsturzversuchs hat der frühere Präsident Donald Trump gute Chancen, wieder ins Weisse Haus zu ziehen. Doch vier Gerichtsprozesse belasten seine Kandidatur. Ein Überblick.","https://img.nzz.ch/2024/05/21/f7343611-413e-4213-8930-a7107bb02730.jpeg?width=1200&height=674&fit=bounds&quality=75&auto=webp&crop=7853,4417,x0,y353&wmark=nzz",2024-07-02T15:42:15Z,,"Der ehemalige Präsident Donald Trump steht unter anderem in New York vor Gericht.
Die neusten Entwicklungen
<ul><li>Der ehemalige New Yorker Bürgermeister und Trump-Anwalt Rudy Giuliani hat am Dien… [+26251 chars]",,de,'Donald Trump'
https://www.welt.de/politik/ausland/article252317092/Donald-Trump-gewinnt-durch-Urteil-des-Supreme-Court-Zeit-im-Schweigegeld-Prozess.html,https://www.welt.de/politik/ausland/article252317092/Donald-Trump-gewinnt-durch-Urteil-des-Supreme-Court-Zeit-im-Schweigegeld-Prozess.html,0,www.welt.de,Trump gewinnt durch Urteil des Supreme Court Zeit im Schweigegeld-Prozess,Eigentlich sollte am 11. Juli ein Gericht in New York das Strafmaß für Donald Trump im Prozess um Schweigegeldzahlungen an Stormy Daniels verkünden. Doch nach dem Urteil des Supreme Court zur Immunität des Ex-Präsidenten zeigt sich die Staatsanwaltschaft offe…,https://img.welt.de/img/bildergalerien/mobile252317144/1891352897-ci16x9-w1200/Trump-Hush-Money.jpg,2024-07-02T16:41:29Z,,Nach einem Grundsatzurteil des Supreme Courts der Vereinigten Staaten zur Immunität von US-Präsidenten gibt es Hinweise auf eine Verzögerung der Strafmaßverkündung gegen Donald Trump in seinem New Yo… [+1892 chars],,de,'Donald Trump'
https://www.stern.de/news/verkuendung-von-strafmass-gegen-trump-wird-auf-18--september-verschoben-34848124.html,https://www.stern.de/news/verkuendung-von-strafmass-gegen-trump-wird-auf-18--september-verschoben-34848124.html,0,www.stern.de,Verkündung von Strafmaß gegen Trump wird auf 18. September verschoben,"Im New Yorker Schweigegeldprozess gegen Donald Trump wird die Verkündung des Strafmaßes auf den 18. September verschoben. Die Verkündung werde auf den 18. September um 10.00 Uhr Ortszeit verschoben, ""falls dies noch erforderlich ist"", heißt es in einem am Die…",https://image.stern.de/34848126/t/hp/v1/w1440/r1.7778/-/02--trump-am-gericht-in-new-york---6027070ec9eaa515.jpg,2024-07-02T19:35:20Z,,"Im New Yorker Schweigegeldprozess gegen Donald Trump wird die Verkündung des Strafmaßes auf den 18. September verschoben. Die Verkündung werde auf den 18. September um 10.00 Uhr Ortszeit verschoben, … [+2574 chars]",,de,'Donald Trump'
https://www.faz.net/aktuell/politik/us-wahl/verschoben-wegen-supreme-court-entscheidung-strafmass-gegen-trump-wird-am-18-september-verkuendet-19829066.html,https://www.faz.net/aktuell/politik/us-wahl/verschoben-wegen-supreme-court-entscheidung-strafmass-gegen-trump-wird-am-18-september-verkuendet-19829066.html,0,www.faz.net,Verschoben wegen Supreme Court: Strafmaß gegen Trump wird am 18. September verkündet,Eigentlich ist Donald Trump in allen Anklagepunkten im Schweigegeld-Prozess für schuldig befunden worden. Doch nach dem Immunitäts-Urteil durch das oberste Gericht kann der Republikaner auf eine Annullierung des Schuldspruchs hoffen.,https://media1.faz.net/ppmedia/aktuell/feuilleton/1051814357/1.9829073/facebook_teaser/ex-us-praesident-donald-trump.jpg,2024-07-02T20:07:07Z,,Somit soll das Strafmaß gegen Trump sieben Wochen vor der US-Präsidentschaftswahl am 5. November verkündet werden. Trump war in dem Verfahren am 30. Mai von den Geschworenen in allen 34 Anklagepunkte… [+2120 chars],,de,'Donald Trump'
https://www.n-tv.de/politik/Verkuendung-von-Strafmass-gegen-Trump-wird-auf-18-September-verschoben-article25058788.html,https://www.n-tv.de/politik/Verkuendung-von-Strafmass-gegen-Trump-wird-auf-18-September-verschoben-article25058788.html,0,www.n-tv.de,"""Wenn es noch erforderlich ist"": Trumps Strafe wird erst kurz vor US-Wahl verkündet","Ende Mai wird Donald Trump für schuldig befunden, eine Schweigegeldzahlung an die Pornodarstellerin Stormy Daniels vertuscht zu haben. Das Strafmaß sollte eigentlich am 11. Juli verkündet werden. Doch nun wird der Termin verschoben. Ein Urteil des Supreme Cou…",https://bilder2.n-tv.de/img/incoming/crop25058789/9061323740-cImg_16_9-w1200/470259217.jpg,2024-07-02T20:15:23Z,,"Ende Mai wird Donald Trump für schuldig befunden, eine Schweigegeldzahlung an die Pornodarstellerin Stormy Daniels vertuscht zu haben. Das Strafmaß sollte eigentlich am 11. Juli verkündet werden. Doc… [+2886 chars]",,de,'Stormy Daniels'
https://www.dw.com/de/strafma%C3%9F-gegen-trump-wird-erst-im-september-verk%C3%BCndet/a-69544073,https://www.dw.com/de/strafma%C3%9F-gegen-trump-wird-erst-im-september-verk%C3%BCndet/a-69544073,0,www.dw.com,Strafmaß gegen Trump wird erst im September verkündet,Ex US-Präsident Donald Trump wurde erst vor kurzem im Prozess um Schweigegeldzahlungen schuldig gesprochen. Doch jetzt entschied das Gericht in New York: Die Strafmaß-Verkündung wird um Monate verschoben.,https://static.dw.com/image/69227883_6.jpg,2024-07-03T10:01:00Z,,Im Schweigegeldprozess gegen den ehemaligen US-Präsidenten Donald Trump ist die Verhängung des Strafmaßes um mehrere Monate verschoben worden. Der im New Yorker Verfahren zuständige Richter Juan Merc… [+2265 chars],,de,'Donald Trump'
https://www.stern.de/news/folge-von-immunitaetsbeschluss-fuer-trump--strafmassverkuendung-verschoben-34850056.html,https://www.stern.de/news/folge-von-immunitaetsbeschluss-fuer-trump--strafmassverkuendung-verschoben-34850056.html,0,www.stern.de,Folge von Immunitätsbeschluss für Trump: Strafmaßverkündung verschoben,Die Entscheidung des Obersten Gerichts der USA zugunsten einer Teil-Immunität für Präsidenten hat erste Folgen für die juristischen Streitigkeiten von Ex-Staatschef Donald Trump: Im New Yorker Schweigegeldprozess gegen den Rechtspopulisten verschob die Justiz…,https://image.stern.de/34850058/t/Zq/v1/w1440/r1.7778/-/03--trump-nach-seiner-verurteilung-in-new-york---2d9151c8a226ec9a.jpg,2024-07-03T11:27:23Z,,Die Entscheidung des Obersten Gerichts der USA zugunsten einer Teil-Immunität für Präsidenten hat erste Folgen für die juristischen Streitigkeiten von Ex-Staatschef Donald Trump: Im New Yorker Schwei… [+4402 chars],,de,'Stormy Daniels'
https://www.stern.de/gesellschaft/regional/bayern/noch-keine-entscheidung--jagdverband-und-kreisgruppe-streiten-vor-zivilgericht-34851004.html,https://www.stern.de/gesellschaft/regional/bayern/noch-keine-entscheidung--jagdverband-und-kreisgruppe-streiten-vor-zivilgericht-34851004.html,0,www.stern.de,Noch keine Entscheidung: Jagdverband und Kreisgruppe streiten vor Zivilgericht,"Mitte Mai hatte Minister Aiwanger den Jagdverband zum Friedensgipfel geladen, um interne Streits auszuräumen. Wenige Wochen später gibt es erneut eine gerichtliche Auseinandersetzung.",https://image.stern.de/34851006/t/C-/v1/w1440/r1.7778/-/03--htnbezktoxv14axw800h600jpeg---8ce69189edd3f302.jpg,2024-07-03T14:37:45Z,,"Mitte Mai hatte Minister Aiwanger den Jagdverband zum Friedensgipfel geladen, um interne Streits auszuräumen. Wenige Wochen später gibt es erneut eine gerichtliche Auseinandersetzung.
Der Friede hat… [+1876 chars]",,de,'Hubert Aiwanger'
https://www.tagesspiegel.de/internationales/wer-jetzt-noch-zu-joe-biden-halt--und-wer-nicht-11949428.html,https://www.tagesspiegel.de/internationales/wer-jetzt-noch-zu-joe-biden-halt--und-wer-nicht-11949428.html,0,www.tagesspiegel.de,Ist er noch der geeignete Kandidat?: Wer jetzt noch zu Joe Biden hält – und wer nicht,"Das Weiße Haus weist Berichte zurück, wonach Biden Zweifel an seiner Kandidatur geäußert hat. Führende Gouverneure stellen sich nun hinter ihn. Andere wenden sich ab. Ein Überblick.",https://www.tagesspiegel.de/images/july-3-2024-washington-district-of-columbia-usa-united-states-president-joe-biden-departs-after-a-medal-of-honor-ce/alternates/BASE_16_9_W1400/july-3-2024-washington-district-of-columbia-usa-united-states-president-joe-biden-departs-after-a-medal-of-honor-ce.jpeg,2024-07-03T15:30:34Z,,"Der Druck auf Joe Biden, bei der US-Wahl am 5. November nicht zu kandidieren, zeigt offenbar Wirkung. Wie die New York Times berichtet, hat der US-Präsident gegenüber einem engen Verbündeten Zweifel … [+13083 chars]",,de,'Tim Scott'
https://www.stern.de/news/netanjahu-will-delegation-fuer-weitere-verhandlungen-ueber-geiselfreilassung-entsenden-34854616.html,https://www.stern.de/news/netanjahu-will-delegation-fuer-weitere-verhandlungen-ueber-geiselfreilassung-entsenden-34854616.html,0,www.stern.de,Netanjahu will Delegation für weitere Verhandlungen über Geiselfreilassung entsenden,Der israelische Ministerpräsident Benjamin Netanjahu hat die Entsendung einer Delegation zu Verhandlungen über die israelischen Geiseln im Gazastreifen beschlossen. Nach einem Telefonat des Regierungschefs mit US-Präsident Joe Biden erklärte Netanjahus Büro a…,https://image.stern.de/34854618/t/Mr/v1/w1440/r1.7778/-/04--israels-ministerpraesident-benjamin-netanjahu---5a66afd5c85dd341.jpg,2024-07-04T17:23:03Z,,Der israelische Ministerpräsident Benjamin Netanjahu hat die Entsendung einer Delegation zu Verhandlungen über die israelischen Geiseln im Gazastreifen beschlossen. Nach einem Telefonat des Regierung… [+2541 chars],,de,'Benjamin Netanjahu'
https://www.n-tv.de/politik/Ubernaechtigte-Ampel-Spitzen-ueberzeugt-von-Haushaltsergebnis-Schlaf-wird-ueberschaetzt-article25065424.html,https://www.n-tv.de/politik/Ubernaechtigte-Ampel-Spitzen-ueberzeugt-von-Haushaltsergebnis-Schlaf-wird-ueberschaetzt-article25065424.html,0,www.n-tv.de,"""Schlaf wird überschätzt"": Übernächtigte Ampel-Spitzen überzeugt von Haushaltsergebnis","In einer Nachtsitzung einigt sich die Ampel auf den Entwurf für den Haushalt 2025. Die Schuldenbremse steht, der Wehretat wächst weniger stark, das Kindergeld steigt. Kanzler Scholz will zudem die Wirtschaft milliardenschwer entlasten. Indes plant Finanzminis…",https://bilder2.n-tv.de/img/incoming/crop25066057/5011327680-cImg_16_9-w1200/82a084b16debc4ec5be52b204bd84881.jpg,2024-07-05T08:57:54Z,,"In einer Nachtsitzung einigt sich die Ampel auf den Entwurf für den Haushalt 2025. Die Schuldenbremse steht, der Wehretat wächst weniger stark, das Kindergeld steigt. Kanzler Scholz will zudem die Wi… [+5935 chars]",,de,'Robert Kraft'
https://taz.de/Deutschland-gegen-Spanien/!6018315/,https://taz.de/Deutschland-gegen-Spanien/!6018315/,0,taz.de,Deutschland gegen Spanien: Neue Leichtigkeit des Seins,"Das DFB-Team hat erreicht, was vor wenigen Monaten unvorstellbar schien. Mit Kroos und Rodri treffen die größten Mittelfeldstrategen der EM aufeinander.",https://taz.de/picture/7101176/948/Kroos-Andrich-em-deutschland-spanien-1.jpeg,2024-07-05T10:16:00Z,,"Das DFB-Team hat erreicht, was vor wenigen Monaten unvorstellbar schien. Mit Kroos und Rodri treffen die größten Mittelfeldstrategen der EM aufeinander.
So schlimm sieht's doch gar nicht aus: Toni K… [+4222 chars]",,de,'Robert Kraft'
https://www.stern.de/kultur/schauspielerin-margaret-qualley---ich-bin-anders---34845986.html,https://www.stern.de/kultur/schauspielerin-margaret-qualley---ich-bin-anders---34845986.html,0,www.stern.de,"Film ""Kinds of Kindness"": Margaret Qualley ist mutig – und manchmal ziemlich verstörend","Sie spielt spezielle Rollen – wie in Yorgos Lanthimos' neuem Film ""Kinds of Kindness"". Margaret Qualley geht einen ähnlichen und doch ganz anderen Weg als ihre berühmte Mutter Andie MacDowell.",https://image.stern.de/34845984/t/t7/v2/w1440/r1.7778/-/margaret-qualley.jpg,2024-07-05T15:02:00Z,,"Margaret Qualley hat schlechte Laune. Kein Handschlag zur Begrüßung, knappe Antworten. Statt sich zu setzen, tigert sie ruhelos und barfuß durchs Zimmer. Ihr Chanel-Jäckchen ist nachlässig geknöpft, … [+963 chars]",,de,'Demi Moore'
https://www.n-tv.de/politik/Trumps-Anwaelte-wollen-Dokumenten-Verfahren-aussetzen-lassen-article25067664.html,https://www.n-tv.de/politik/Trumps-Anwaelte-wollen-Dokumenten-Verfahren-aussetzen-lassen-article25067664.html,0,www.n-tv.de,Nach Immunitäts-Urteil: Trumps Anwälte wollen Dokumenten-Verfahren aussetzen lassen,"Donald Trumps Anwälte leiten nach dem Supreme-Court-Urteil zur Immunität die nächsten Schritte ein, um dem Präsidentschaftsbewerber weitere Prozesse zu ersparen. Das Verfahren um die Mitnahme von Geheimdokumenten soll teilweise auf Eis gelegt werden.",https://bilder4.n-tv.de/img/incoming/crop25067675/8861325186-cImg_16_9-w1200/4efa82d0c0ab96d1cfbf51320f0fcc29.jpg,2024-07-06T02:28:09Z,,"Donald Trumps Anwälte leiten nach dem Supreme-Court-Urteil zur Immunität die nächsten Schritte ein, um dem Präsidentschaftsbewerber weitere Prozesse zu ersparen. Das Verfahren um die Mitnahme von Geh… [+2077 chars]",,de,'Donald Trump'
