index,url,valid,domain,title,description,image,published,archive,content,quote,language,keyword
https://www.tagesspiegel.de/internationales/anklage-wegen-wahlbetrugs-ex-trump-anwalt-muss-vor-gericht-erscheinen-11685473.html,https://www.tagesspiegel.de/internationales/anklage-wegen-wahlbetrugs-ex-trump-anwalt-muss-vor-gericht-erscheinen-11685473.html,0,www.tagesspiegel.de,Anklage wegen Wahlbetrugs: Ex-Trump-Anwalt muss vor Gericht erscheinen,"Wochenlang hatten die Behörden vergebens versucht, Rudy Giuliani das förmliche Anklagedokument zuzustellen. Sie haben ihn schließlich beim Verlassen seiner eigenen Geburtstagsfeier erwischt.",https://www.tagesspiegel.de/internationales/images/file-photo-former-new-york-mayor-rudy-giuliani-departs-defamation-lawsuit-at-the-district-courthouse-in-washington/alternates/BASE_16_9_W1400/file-photo-former-new-york-mayor-rudy-giuliani-departs-defamation-lawsuit-at-the-district-courthouse-in-washington.jpeg,2024-05-19T12:34:50Z,,"Ausgerechnet beim Verlassen einer Feier zu seinem 80. Geburtstag ist dem früheren Anwalt von Ex-Präsident Donald Trump, Rudy Giuliani, die förmliche Benachrichtigung über seine Anklage im Verfahren u… [+3057 chars]",,de,'Mark Meadows'
https://www.brigitte.de/aktuell/brooklyn-beckham--ruehrende-erinnerung-an-seine-verstorbene-schwieger-oma-13817590.html,https://www.brigitte.de/aktuell/brooklyn-beckham--ruehrende-erinnerung-an-seine-verstorbene-schwieger-oma-13817590.html,0,www.brigitte.de,Brooklyn Beckham: Rührende Erinnerung an seine verstorbene Schwieger-Oma,"Nach dem Tod von Brooklyn Beckhams Schwieger-Oma hat David Beckhams Sohn mit bewegenden Worten seiner verstorbenen ""Naunni"" gedacht.",https://image.brigitte.de/13817592/t/Lg/v1/w1440/r1.7778/-/19--ruehrende-erinnerung-an-seine-verstorbene-schwieger-oma---1-1---spoton-article-1067132.jpg,2024-05-19T13:30:00Z,,"Nach dem Tod von Brooklyn Beckhams Schwieger-Oma hat David Beckhams Sohn mit bewegenden Worten seiner verstorbenen ""Naunni"" gedacht.
Victoria (50) und David Beckhams (49) Sohn Brooklyn Beckham (25) … [+2060 chars]",,de,'David Beckham'
https://www.stern.de/lifestyle/leute/brooklyn-beckham--bewegende-erinnerung-an-seine-schwieger-oma-34724782.html,https://www.stern.de/lifestyle/leute/brooklyn-beckham--bewegende-erinnerung-an-seine-schwieger-oma-34724782.html,0,www.stern.de,Brooklyn Beckham: Bewegende Erinnerung an seine Schwieger-Oma,"Nach dem Tod von Brooklyn Beckhams Schwieger-Oma hat David Beckhams Sohn mit bewegenden Worten seiner verstorbenen ""Naunni"" gedacht.",https://image.stern.de/34724786/t/NX/v1/w1440/r1.7778/-/19--bewegende-erinnerung-an-seine-schwieger-oma---16-9---spoton-article-1067132.jpg,2024-05-19T13:33:00Z,,"Nach dem Tod von Brooklyn Beckhams Schwieger-Oma hat David Beckhams Sohn mit bewegenden Worten seiner verstorbenen ""Naunni"" gedacht.
Victoria (50) und David Beckhams (49) Sohn Brooklyn Beckham (25) … [+2058 chars]",,de,'David Beckham'
https://www.stern.de/kultur/film/cannes---saltburn--darsteller-praesentieren-ihre-neuen-filme-34724950.html,https://www.stern.de/kultur/film/cannes---saltburn--darsteller-praesentieren-ihre-neuen-filme-34724950.html,0,www.stern.de,"Filmfestspiele in Cannes: ""Saltburn""-Darsteller präsentieren ihre neuen Filme – einer wird von Richard Gere gelobt","Seit ""Saltburn"" himmelt sie die halbe Welt an. In Cannes zeigen Barry Keoghan und Jacob Elordi aus Irland und Australien, dass sie auch in reifen Rollen glänzen können. Als prolliger Vater und als Kriegsdienstverweigerer, der seine Familie im Stich lässt.",https://image.stern.de/34724988/t/fv/v2/w1440/r1.7778/-/cannes.jpg,2024-05-19T16:22:00Z,,"Vielleicht war es ganz gut, dass es Jacob Elordi nicht persönlich geschafft hat zu seiner eigenen Weltpremiere. Der Herzensbrecher aus Australien, im Juni wird er gerade mal 26 Jahre alt, ist nach se… [+293 chars]",,de,'Barry Keoghan'
https://www.stern.de/news/biden-sichert-studenten-unterstuetzung-fuer--gewaltfreien--nahost-protest-zu-34725102.html,https://www.stern.de/news/biden-sichert-studenten-unterstuetzung-fuer--gewaltfreien--nahost-protest-zu-34725102.html,0,www.stern.de,"Biden sichert Studenten Unterstützung für ""gewaltfreien"" Nahost-Protest zu","US-Präsident Joe Biden hat den pro-palästinensischen Studenten in den USA am Sonntag seine Unterstützung für ""gewaltfreien Protest"" im Zusammenhang mit dem Gazakrieg zugesagt. ""Ich unterstütze friedlichen, gewaltfreien Protest. Eure Stimmen sollten gehört wer…",https://image.stern.de/34725104/t/tH/v1/w1440/r1.7778/-/19--biden-spricht-am-morehouse-college-in-atlanta---99c22c291d175680.jpg,2024-05-19T17:11:57Z,,"US-Präsident Joe Biden hat den pro-palästinensischen Studenten in den USA am Sonntag seine Unterstützung für ""gewaltfreien Protest"" im Zusammenhang mit dem Gazakrieg zugesagt. ""Ich unterstütze friedl… [+2037 chars]",,de,'Martin Luther King'
https://www.n-tv.de/leute/Brooklyn-Beckham-trauert-um-Schwieger-Oma-article24953249.html,https://www.n-tv.de/leute/Brooklyn-Beckham-trauert-um-Schwieger-Oma-article24953249.html,0,www.n-tv.de,Emotionaler Instagram-Beitrag: Brooklyn Beckham trauert um Schwieger-Oma,"Nach dem Tod von Brooklyn Beckhams angeheirateter Großmutter hat der Sohn von Fußball-Legende David Beckham mit bewegenden Worten seiner verstorbenen ""Naunni"" gedacht. Seine Follower sind gerührt, besonders von den Fotos, die er zeigt.",https://bilder2.n-tv.de/img/incoming/crop24953253/316132120-cImg_16_9-w1200/imago0472961957h.jpg,2024-05-19T21:29:01Z,,"Nach dem Tod von Brooklyn Beckhams angeheirateter Großmutter hat der Sohn von Fußball-Legende David Beckham mit bewegenden Worten seiner verstorbenen ""Naunni"" gedacht. Seine Follower sind gerührt, be… [+2038 chars]",,de,'David Beckham'
https://www.zeit.de/video/2024-05/6353226189112/boxen-olexander-ussyk-ist-unumstrittener-champion-im-schwergewichtsboxen,https://www.zeit.de/video/2024-05/6353226189112/boxen-olexander-ussyk-ist-unumstrittener-champion-im-schwergewichtsboxen,0,www.zeit.de,Boxen: Olexander Ussyk ist unumstrittener Champion im Schwergewichtsboxen,Der ukrainische Profiboxer Oleksandr Usyk hat alle bedeutenden WM-Titel im Schwergewicht gewonnen. In Riad siegte er gegen den Briten Tyson Fury nach zwölf Runden.,https://img.zeit.de/video/2024-05/6353226189112-still/wide__1300x731,2024-05-19T21:45:44Z,,"Schließen
Hier können Sie interessante Artikel speichern, um sie später zu lesen und wiederzufinden.
Sie haben bereits ein Konto?
 Hier anmelden.",,de,'Oleksandr Usyk'
https://www.diepresse.com/18471866/lebron-curry-durant-die-letzten-wuerfe-der-legenden,https://www.diepresse.com/18471866/lebron-curry-durant-die-letzten-wuerfe-der-legenden,0,www.diepresse.com,"LeBron, Curry, Durant: Die letzten Würfe der Legenden [premium]","LeBron James, Stephen Curry und Kevin Durant sind die Gesichter des Basketballs, auf und abseits des Courts. Doch ihre denkwürdige Ära geht zu Ende, eine neue Garde reißt das Spiel an sich. Dem All-Star-Trio bleibt noch ein letzter goldener Tanz.",https://img.diepresse.com/public/incoming/2glxxf-OLY-BASK-BKMBBLBKM400101/alternates/DPR_SOCIAL_MAGAZIN_PAID/OLY-BASK-BKMBBLBKM400101,2024-05-20T08:10:35Z,,"LeBron James, Stephen Curry und Kevin Durant sind die Gesichter des Basketballs, auf und abseits des Courts. Doch ihre denkwürdige Ära geht zu Ende, eine neue Garde reißt das Spiel an sich. Dem All-S… [+1043 chars]",,de,'LeBron James'
https://www.nzz.ch/international/donald-trump-stormy-daniels-beschreibt-im-schweigegeld-prozess-den-sex-mit-trump-ld.1627342,https://www.nzz.ch/international/donald-trump-stormy-daniels-beschreibt-im-schweigegeld-prozess-den-sex-mit-trump-ld.1627342,0,www.nzz.ch,"DIE NEUSTEN ENTWICKLUNGEN - Donald Trump: Ex-Trump-Anwalt Cohen gibt vor Gericht zu, von der Trump Organization gestohlen zu haben +++ Richter lässt Saal räumen","Trotz seiner Wahlniederlage 2020 und der Anstiftung eines Umsturzversuchs hat der frühere Präsident Donald Trump gute Chancen, wieder ins Weisse Haus zu ziehen. Doch vier Gerichtsprozesse belasten seine Kandidatur. Ein Überblick.","https://img.nzz.ch/2023/11/06/8a50fcdf-cda8-4731-be2f-31a96c207120.jpeg?width=1200&height=675&fit=bound&quality=75&auto=webp&crop=8161,4591,x0,y427&wmark=nzz",2024-05-21T05:00:12Z,,"Der ehemalige Präsident Donald Trump steht unter anderem in New York vor Gericht. 
Die neusten Entwicklungen
<ul><li>Der ehemalige Anwalt des früheren US-Präsidenten Donald Trump, Michael Cohen, ha… [+26593 chars]",,de,'Stormy Daniels'
https://www.welt.de/iconist/fitness/article251599524/Marjorie-Taylor-Greene-Bizeps-Looks-bei-Frauen-oft-ein-zweischneidiges-Statussymbol.html,https://www.welt.de/iconist/fitness/article251599524/Marjorie-Taylor-Greene-Bizeps-Looks-bei-Frauen-oft-ein-zweischneidiges-Statussymbol.html,0,www.welt.de,Bizeps bei Frauen? Leider oft ein zweischneidiges Statussymbol,"Frauen mit durchtrainierten und definierten Oberarmen sieht man selten. Michelle Obama etwa flößte damit manchem Angst ein, bei der republikanischen Kongressabgeordneten Marjorie Taylor Greene sind sie definitiv eine Kampfansage. Warum eigentlich?",https://img.welt.de/img/iconist/fitness/mobile251605606/2231352797-ci16x9-w1200/House-GOP-Members-Meet-For-Their-Weekly-Caucus-Meeting-And-Hold-P.jpg,2024-05-21T07:44:59Z,,"Als Präsident Joe Biden im März dieses Jahres durch den Plenarsaal des Repräsentantenhauses schritt, um seine State-of-the-Union-Rede zu halten, sah er rot. Die Republikanerin Marjorie Taylor Greene … [+5410 chars]",,de,'Marjorie Taylor Greene'
"https://www.gamestar.de/artikel/fluch-der-karibik-6-johnny-depp-jack-sparrow,3413545.html","https://www.gamestar.de/artikel/fluch-der-karibik-6-johnny-depp-jack-sparrow,3413545.html",0,www.gamestar.de,Fluch der Karibik 6 - Ist Johnny Depp doch an Bord? Auf einmal keimt Hoffnung für die Rückkehr von Jack Sparrow auf,"Ja, Fluch der Karibik 6 wird ein Reboot. Trotzdem könnte Johnny Depp jetzt doch als Jack Sparrow nochmal zurückkehren - worauf zumindest Produzent Jerry Bruckheimer hofft.",https://images.cgames.de/images/gamestar/4/fluch-der-karibik_6279861.jpg,2024-05-21T08:57:00Z,,"Obwohl Fluch der Karibik 6 ein Reboot wird, könnte doch noch Johnny Depp dafür zurückkehren. Bildquelle: Disney
Haben wir Johnny Depp doch nicht zum letzten Mal in der Rolle von Captain Jack Sparrow… [+2920 chars]",,de,'Johnny Depp'
https://www.welt.de/politik/ausland/article251620730/Schweigegeld-Prozess-Trump-sagt-nicht-als-Zeuge-ueber-Stormy-Daniels-aus.html,https://www.welt.de/politik/ausland/article251620730/Schweigegeld-Prozess-Trump-sagt-nicht-als-Zeuge-ueber-Stormy-Daniels-aus.html,0,www.welt.de,Trump sagt nicht als Zeuge über Stormy Daniels aus,"Im historischen ersten Strafprozess gegen einen US-Präsidenten wird Donald Trump nicht als Zeuge aussagen. Damit können bereits bald die Schlussplädoyers starten – und danach „hoffentlich“ die Beratungen der Geschworenen, sagt der Richter.",https://img.welt.de/img/politik/ausland/mobile251620840/6921354977-ci16x9-w1200/Former-U-S-President-Trump-s-criminal-trial-on-charges-of-falsifying-business-records-continues-in-New-York.jpg,2024-05-21T15:14:01Z,,"Im Schweigegeld-Prozess gegen Donald Trump sagt der frühere US-Präsident nicht selbst als Zeuge aus. Trumps Anwälte beendeten am Dienstag die Zeugenbefragung, ohne Trump in den Zeugenstand zu rufen. … [+1149 chars]",,de,'Stormy Daniels'
https://www.pcgames.de/Kino-Thema-130800/News/Erstes-Bild-Dwayne-The-Rock-Johnson-voellig-am-Ende-So-anders-sieht-er-als-Charakterdarsteller-aus-1447952/,https://www.pcgames.de/Kino-Thema-130800/News/Erstes-Bild-Dwayne-The-Rock-Johnson-voellig-am-Ende-So-anders-sieht-er-als-Charakterdarsteller-aus-1447952/,0,www.pcgames.de,"Erstes Bild: Dwayne ""The Rock"" Johnson völlig am Ende? So anders sieht er als Charakterdarsteller aus","Vom Action-Star zum ernsthaften Schauspieler? Bekommt Dwayne ""The Rock"" Johnson doch noch die Kurve?",https://www.pcgames.de/screenshots/original/2023/07/040f417ed99d5fe08d59e19ecb_YyAxODE0eDEwMjErNzQxKzcCcmUgMTY4MCA5NDQDYzIwZjc5NTA1MWM--pc-games_artwork2.jpg,2024-05-21T18:12:00Z,,"Selbst als größter Action-Star Hollywoods hat man nur eine begrenzte Halbwertszeit. Das gilt sicherlich auch für Dwayne ""The Rock"" Johnson. Der 52-Jähriger ist zwar sicherlich fitter als 99,9 Prozent… [+3222 chars]",,de,'Dwayne Johnson'
https://www.kino.de/film/der-schwarze-diamant-2019/news/actionstar-dwayne-johnson-nicht-mehr-wiederzuerkennen-im-ersten-bild-zum-mma-biopic/,https://www.kino.de/film/der-schwarze-diamant-2019/news/actionstar-dwayne-johnson-nicht-mehr-wiederzuerkennen-im-ersten-bild-zum-mma-biopic/,0,www.kino.de,Actionstar Dwayne Johnson nicht mehr wiederzuerkennen im ersten Bild zum MMA-Biopic,Das Independent-Studio A24 hat das erste offizielle Bild zum MMA-Biopic mit Dwayne Johnson enthüllt. Und darauf ist der Actionstar nicht mehr wiederzuerkennen.,https://crops.giga.de/08/c0/06/2b4ec20a4172a4bb18bfe42095_YyAzMTE4eDE3NTQrMTArMTc1AnJlIDE5MjAgMTA4MAMwMDJlMDFhYmI0OQ==.jpg,2024-05-21T22:00:32Z,,"Das Independent-Studio A24 hat das erste offizielle Bild zum MMA-Biopic mit Dwayne Johnson enthüllt. Und darauf ist der Actionstar nicht mehr wiederzuerkennen.
Zuletzt gab es eher weniger gute Meldu… [+4157 chars]",,de,'Dwayne Johnson'
https://www.zeit.de/politik/ausland/2024-05/donald-trump-gericht-prozess-new-york-us-wahlen,https://www.zeit.de/politik/ausland/2024-05/donald-trump-gericht-prozess-new-york-us-wahlen,0,www.zeit.de,"Donald Trump: Was, wenn er schuldig gesprochen wird?",Der Prozess gegen den ehemaligen US-Präsidenten ist fast vorbei. Wie immer sich die Geschworenen entscheiden: Ihr Urteil wird auch politisch gravierende Folgen haben.,https://img.zeit.de/politik/ausland/2024-05/donald-trump-hush-money-prozess-bild/wide__1300x731,2024-05-22T03:34:26Z,,"Der Angeklagte schweigt. Donald Trump hätte aussagen können in diesem Verfahren, dem ersten gegen einen ehemaligen US-Präsidenten. Aber er ließ es bleiben. Und es ist nachvollziehbar, dass seine Vert… [+972 chars]",,de,'Stormy Daniels'
https://www.sueddeutsche.de/kultur/film-anya-taylor-joy-portraet-1.7253311,https://www.sueddeutsche.de/kultur/film-anya-taylor-joy-portraet-1.7253311,0,www.sueddeutsche.de,Kino: Wenn jeder Tropfen Benzin zählt,"Die amerikanische Schauspielerin Anya Taylor-Joy spielt die Titelheldin Furiosa im neuen Teil der ""Mad Max""-Saga - und kennt sich aus mit Einsamkeit, Ballettunterricht, Kampfeswillen.",https://www.sueddeutsche.de/2024/05/21/ae9c11f6-9a62-4a57-be4a-81c08c3b98eb.jpeg?width=1200&height=675&fit=crop&fm=webp&q=60,2024-05-22T08:12:20Z,,"Die amerikanische Schauspielerin Anya Taylor-Joy spielt die Titelheldin Furiosa im neuen Teil der ""Mad Max""-Saga - und kennt sich aus mit Einsamkeit, Ballettunterricht, Kampfeswillen.Es sind die Auge… [+447 chars]",,de,'Anya Taylor-Joy'
https://www.stern.de/news/vorwuerfe-der-wahlmanipulation--trumps-ex-anwalt-giuliani-plaediert-auf-unschuldig-34731868.html,https://www.stern.de/news/vorwuerfe-der-wahlmanipulation--trumps-ex-anwalt-giuliani-plaediert-auf-unschuldig-34731868.html,0,www.stern.de,Vorwürfe der Wahlmanipulation: Trumps Ex-Anwalt Giuliani plädiert auf unschuldig,"Der frühere Privatanwalt von Ex-US-Präsident Donald Trump, Rudy Giuliani, hat vor einem Gericht des Bundesstaats Arizona Vorwürfe der versuchten Manipulation der Präsidentschaftswahl von 2020 zurückgewiesen. Giuliani gab seine kurze Erklärung am Dienstag per …",https://image.stern.de/34731870/t/9w/v1/w1440/r1.7778/-/22--rudy-giuliani-appeared-virtually-to-enter-not-guilty-pleas-to-arizona-charges-that-he-tried-to-subvert-the-2020-presidential-election---14e8d99442a5c0f9.jpg,2024-05-22T10:07:14Z,,"Der frühere Privatanwalt von Ex-US-Präsident Donald Trump, Rudy Giuliani, hat vor einem Gericht des Bundesstaats Arizona Vorwürfe der versuchten Manipulation der Präsidentschaftswahl von 2020 zurückg… [+2479 chars]",,de,'Mark Meadows'
https://www.dw.com/de/modetrend-brazilcore-die-%C3%A4sthetik-der-favelas-ist-kunst/a-69140276,https://www.dw.com/de/modetrend-brazilcore-die-%C3%A4sthetik-der-favelas-ist-kunst/a-69140276,0,www.dw.com,Modetrend Brazilcore: “Die Ästhetik der Favelas ist Kunst”,Die brasilianische Flagge ist während der Amtszeit von Ex-Präsident Jair Bolsonaro zum Symbol seiner Anhängerschaft geworden. Doch viele Brasilianer sind mit der politischen Vereinnahmung nicht einverstanden.,https://static.dw.com/image/69142568_6.jpg,2024-05-22T11:32:00Z,,"""Wer hat gesagt, dass die Flagge uns nicht gehört?"", schreibt Abacaxi unter einem seiner Fotos auf Instagram. Auf dem Bild sind Models in Brasilien-Shirts, -Röcken und -Bikinis zu sehen, sie schwenke… [+5833 chars]",,de,'Lady Gaga'
https://www.focus.de/kultur/stars/gluecklich-mit-ex-spice-girl-victoria-david-beckham-auch-nach-25-jahren-ehe-noch-gluecklich_id_259945374.html,https://www.focus.de/kultur/stars/gluecklich-mit-ex-spice-girl-victoria-david-beckham-auch-nach-25-jahren-ehe-noch-gluecklich_id_259945374.html,0,www.focus.de,Glücklich mit Ex-Spice-Girl Victoria - David Beckham gesteht „Überlebenskunst“ in 25 Ehejahren,"David Beckham und Victoria Beckham sind seit 27 Jahren zusammen und fast 25 Jahre davon bereits verheiratet. David witzelte: „Ich weiß nicht, wie wir die letzten 27 Jahre überstanden haben.""",https://p6.focus.de/img/fotos/id_259945365/david-beckham-gesteht-ueberlebenskunst-in-27-ehejahren.jpg?im=Crop%3D%280%2C0%2C1024%2C512%29%3BResize%3D%281200%2C627%29&impolicy=perceptual&quality=mediumHigh&hash=c8d4bbd9aa156a5c48b285157e00b1cd7e5df72403786f5b07222316cbc5f8eb,2024-05-22T12:15:35Z,,"David Beckham und Victoria Beckham sind seit 27 Jahren zusammen und fast 25 Jahre davon bereits verheiratet. David witzelte: Ich weiß nicht, wie wir die letzten 27 Jahre überstanden haben."" Der frühe… [+2695 chars]",,de,'David Beckham'
https://www.stern.de/kultur/sci-fi-saga--weniger-action--mehr-handlung--der-neue--mad-max--34733322.html,https://www.stern.de/kultur/sci-fi-saga--weniger-action--mehr-handlung--der-neue--mad-max--34733322.html,0,www.stern.de,"Sci-Fi-Saga: Weniger Action, mehr Handlung: Der neue ""Mad Max""","Der Blockbuster ""Furiosa: A Mad Max Saga"" hat Hollywood-Glanz nach Cannes gebracht. Anya Taylor-Joy und Chris Hemsworth überzeugen mit starken Auftritten.",https://image.stern.de/34725912/t/sN/v3/w1440/r1.7778/-/22--urnnewsmldpacom200901012405199989608v3w800h600l439t5r1835b962jpeg---bf274e213a4703f7.jpg,2024-05-22T15:27:04Z,,"Der Blockbuster ""Furiosa: A Mad Max Saga"" hat Hollywood-Glanz nach Cannes gebracht. Anya Taylor-Joy und Chris Hemsworth überzeugen mit starken Auftritten.
""Mad Max"" ist der beste Beweis dafür, dass … [+4611 chars]",,de,'Anya Taylor-Joy'
https://www.kino.de/film/extraction-2-2023/news/marvel-klassentreffen-fuer-haertesten-amazon-actionthriller-a-la-heat-trifft-sicario/,https://www.kino.de/film/extraction-2-2023/news/marvel-klassentreffen-fuer-haertesten-amazon-actionthriller-a-la-heat-trifft-sicario/,0,www.kino.de,Marvel-Klassentreffen für härtesten Amazon-Actionthriller à la „Heat“ trifft „Sicario“,Die Marvel-Alumni Chris Hemsworth und Mark Ruffalo könnten wieder gemeinsam vor der Kamera stehen – für einen ungleich härteren Actionthriller von Amazon.,https://crops.giga.de/b5/5d/86/05e3e5491e7ae7b7abddbb7dd6_YyAyOTgweDE2NzYrMTArOAJyZSAxOTIwIDEwODADYmQwMzRlZTdkYmQ=.jpg,2024-05-22T18:44:08Z,,"Die Marvel-Alumni Chris Hemsworth und Mark Ruffalo könnten wieder gemeinsam vor der Kamera stehen – für einen ungleich härteren Actionthriller von Amazon.
Denis Villeneuves „Sicario“ und Michael Man… [+4121 chars]",,de,'Anya Taylor-Joy'
https://oe3.orf.at/stories/3041388/,https://oe3.orf.at/stories/3041388/,0,oe3.orf.at,„Furiosa - A Mad Max Saga“ - Zornige Frau liefert benzingetränkte Action,"Der fünfte Mad Max Film muss ohne Max auskommen. Es ist keine Fortsetzung sondern ein Mix aus Prequel und Spin-Off. Erzählt wird die Geschichte von Furiosa, die in Mad Max 4 von Charlize Theron gespielt wurde und jetzt von Anya Taylor-Joy an der Seite von Chr…",https://tubestatic.orf.at/static/images/site/tube/20240521/unbenannt_24.6013331.png,2024-05-23T04:59:00Z,,"Der fünfte Mad Max Film muss ohne Max auskommen. Es ist keine Fortsetzung sondern ein Mix aus Prequel und Spin-Off. Erzählt wird die Geschichte von Furiosa, die in Mad Max 4 von Charlize Theron gespi… [+1655 chars]",,de,'Anya Taylor-Joy'
https://www.focus.de/politik/ausland/us-wahl/us-wahlen-im-ticker-haley-will-im-november-fuer-ihren-frueheren-rivalen-trump-stimmen_id_259600688.html,https://www.focus.de/politik/ausland/us-wahl/us-wahlen-im-ticker-haley-will-im-november-fuer-ihren-frueheren-rivalen-trump-stimmen_id_259600688.html,0,www.focus.de,Wahlen in den USA - Trumps Ex-Anwalt Rudy Giuliani plädiert auf unschuldig,"Trumps ehemaliger Anwalt Rudy Guiliani plädiert auf unschuldig. Die Staatsanwaltschaft wirft ihm vor, an einem Komplott zur illegitimen Wiedereinsetzung Trumps nach dessen Wahlniederlage beteiligt gewesen zu sein. Haley will im November für ihren früheren Riv…",https://p6.focus.de/img/fotos/id_259964282/der-ehemalige-us-amerikanische-praesident-donald-trump-l.-neben-seinem-anwalt-todd-blanche.jpg?im=Crop%3D%280%2C0%2C3463%2C1732%29%3BResize%3D%281200%2C627%29&impolicy=perceptual&quality=mediumHigh&hash=17aa1f07e58d66af9880c943e023290e4c5566cdc2a6ae0c07f9c029d5fd08a4,2024-05-23T05:08:39Z,,"Trumps ehemaliger Anwalt Rudy Guiliani plädiert auf unschuldig. Die Staatsanwaltschaft wirft ihm vor, an einem Komplott zur illegitimen Wiedereinsetzung Trumps nach dessen Wahlniederlage beteiligt ge… [+9913 chars]",,de,'Rudy Giuliani'
https://www.bild.de/leben-wissen/beauty-kosmetik/langlebigkeit-die-irren-longevity-methoden-der-stars-66310422014b590da79434fd,https://www.bild.de/leben-wissen/beauty-kosmetik/langlebigkeit-die-irren-longevity-methoden-der-stars-66310422014b590da79434fd,0,www.bild.de,"Infrarot, keine Erdbeeren - Die irren Methoden der Stars für ein langes Leben","Gwyneth Paltrow starrt ins Leere, Kim Kardashian guckt aus der Röhre: Promis greifen für ein langes Leben und Gesundheit bis ins hohe Alter tief in die Tasche.","https://images.bild.de/66310422014b590da79434fd/ab1a70ddf4acc84842f89d57ea8c4ec3,e1e7d17f?w=1280",2024-05-23T07:06:30Z,,"Jeder Mensch macht sich Gedanken übers Älterwerden, das liegt in seiner Natur. 
Doch Promis stehen ständig unter Beobachtung und damit auch ihr Alterungsprozess. Kein Wunder, dass manche von ihnen e… [+149 chars]",,de,'Kim Kardashian'
https://www.n-tv.de/politik/Zerstoert-der-Prozessausgang-Trumps-Chance-aufs-Weisse-Haus-article24960946.html,https://www.n-tv.de/politik/Zerstoert-der-Prozessausgang-Trumps-Chance-aufs-Weisse-Haus-article24960946.html,0,www.n-tv.de,Was bei welchem Urteil droht: Zerstört der Prozessausgang Trumps Chance aufs Weiße Haus?,"Donald Trump will im November zum zweiten Mal US-Präsident werden. Derzeit stehen seine Chancen in Umfragen gut. Ob das so bleibt, hängt auch vom Gerichtsurteil im Schweigegeldprozess ab. Welche Folgen hätte ein Schuldspruch, ein Freispruch und welche ein gep…",https://bilder2.n-tv.de/img/incoming/crop24961033/4031329391-cImg_16_9-w1200/463289536.jpg,2024-05-23T08:10:48Z,,"Donald Trump will im November zum zweiten Mal US-Präsident werden. Derzeit stehen seine Chancen in Umfragen gut. Ob das so bleibt, hängt auch vom Gerichtsurteil im Schweigegeldprozess ab. Welche Folg… [+5777 chars]",,de,'Donald Trump'
https://www.tagesspiegel.de/kultur/sadistischer-chris-hemsworth-und-verkorkste-eltern-das-sind-die-kinostarts-der-woche-11700527.html,https://www.tagesspiegel.de/kultur/sadistischer-chris-hemsworth-und-verkorkste-eltern-das-sind-die-kinostarts-der-woche-11700527.html,0,www.tagesspiegel.de,Sadistischer Chris Hemsworth und verkorkste Eltern: Das sind die Kinostarts der Woche,"Nach neun Jahren bekommt mit „Furiosa: A Mad Max Saga“ das Franchise um die blechapokalyptische Autoverehrung endlich ein Prequel. Warum sich die anderen Filme diese Woche davon nicht einschüchtern lassen sollten, lesen Sie hier.",https://www.tagesspiegel.de/images/kinostart-furiosa-a-mad-max-saga1/alternates/BASE_16_9_W1400/kinostart-furiosa-a-mad-max-saga.jpeg,2024-05-23T09:01:45Z,,"1 Furiosa: A Mad Max Saga 
Empfohlener redaktioneller Inhalt
 An dieser Stelle finden Sie einen von unseren Redakteuren ausgewählten, externen Inhalt, der den Artikel für Sie mit zusätzlichen Infor… [+10543 chars]",,de,'Chris Hemsworth'
https://www.sueddeutsche.de/panorama/promis-jennifer-lopez-ben-affleck-madonna-frida-kahlo-elton-john-lux.PcZnYenQ7HNjScu7gPWHLA,https://www.sueddeutsche.de/panorama/promis-jennifer-lopez-ben-affleck-madonna-frida-kahlo-elton-john-lux.PcZnYenQ7HNjScu7gPWHLA,0,www.sueddeutsche.de,"Leute: Hauptsache, nebulös","Jennifer Lopez äußert sich zu Trennungsgerüchten, Madonna verkleidet sich als Frida Kahlo, und Elton John arbeitet heimlich an einem neuen Album.",https://www.sueddeutsche.de/2024/05/23/0da932fb-120e-4ffb-8fa5-fa26f485743c.jpeg?width=1200&height=675&fit=crop&fm=webp&q=60,2024-05-23T09:53:54Z,,"Jennifer Lopez, 54, Sängerin und Schauspielerin, spricht in Rätseln. Als sie bei einer Pressekonferenz zu ihrem neuen Film Atlas von einem Reporter auf Gerüchte angesprochen wurde, dass ihre Ehe mit … [+3856 chars]",,de,'Jennifer Lopez'
