index,url,valid,domain,title,description,image,published,archive,content,quote,language,keyword
https://www.tagesschau.de/ausland/grammy-swift-100.html,https://www.tagesschau.de/ausland/grammy-swift-100.html,0,www.tagesschau.de,Taylor Swift holt Rekord bei den Grammys 2024,Pop-Superstar Taylor Swift hat zum vierten Mal den Grammy für das Album des Jahres gewonnen und damit einen Rekord aufgestellt. Für einen besonderen Moment sorgte Folk-Legende Joni Mitchell. Von Katharina Wilhelm.,https://images.tagesschau.de/image/6ca3ae6c-92e7-46f4-bd4c-d21c22a086f0/AAABjXfarF0/AAABibBxqrQ/16x9-1280/swift-124.jpg,2024-02-05T06:48:48Z,,"Stand: 05.02.2024 07:48 Uhr
Pop-Superstar Taylor Swift hat zum vierten Mal den Grammy für das Album des Jahres gewonnen und damit einen Rekord aufgestellt. Für einen besonderen Moment sorgte Folk-Le… [+2898 chars]",,de,'Taylor Swift'
https://www.stern.de/kultur/musik/grammy-awards--ein-rekord--ueberraschungsgaeste-und-ein-rueckkehrer-34429046.html,https://www.stern.de/kultur/musik/grammy-awards--ein-rekord--ueberraschungsgaeste-und-ein-rueckkehrer-34429046.html,0,www.stern.de,"Musik-Auszeichnungen: Ein Rückkehrer, eine Überraschung und ein Rekord: Das waren die Grammys 2024","Es war - mal wieder - der Abend der Taylor Swift. Der US-Popgigant stellte bei den Grammy-Awards einen neuen Rekord auf. Doch nicht nur Swift stand im Fokus, auch andere Musiker:innen sorgten für Begeisterungsstürme.",https://image.stern.de/34428970/t/TV/v2/w1440/r1.7778/-/g--7-.jpg,2024-02-05T07:23:39Z,,"Mit Preisen für Stars wie Taylor Swift, Billie Eilish und SZA hat in Los Angeles die Grammy-Verleihung begonnen. Eilish erhielt den US-Musikpreis für den besten Song des Jahres am Sonntagabend für ""W… [+1595 chars]",,de,'Billie Eilish'
https://www.sueddeutsche.de/kultur/grammys-2024-gewinner-taylor-swift-sieger-miley-cyrus-los-angeles-verleihung-1.6343264,https://www.sueddeutsche.de/kultur/grammys-2024-gewinner-taylor-swift-sieger-miley-cyrus-los-angeles-verleihung-1.6343264,0,www.sueddeutsche.de,66. Verleihung: Die wichtigsten Grammy-Sieger im Überblick,"Die Grammys gehören zu den wichtigsten Preisen der Musikindustrie. Welche Bands, Künstlerinnen und Künstler triumphierten und was Taylor Swift besonderes schaffte.",https://www.sueddeutsche.de/image/sz.1.6343952/1200x675?v=1707118764,2024-02-05T07:39:25Z,https://web.archive.org/web/20240205181857/https://www.sueddeutsche.de/kultur/grammys-2024-gewinner-taylor-swift-sieger-miley-cyrus-los-angeles-verleihung-1.6343264,"Die Grammys gehören zu den wichtigsten Preisen der Musikindustrie. Welche Bands, Künstlerinnen und Künstler triumphierten und was Taylor Swift besonderes schaffte.Bei der 66. Verleihung hat Taylor Sw… [+13746 chars]",,de,'Taylor Swift'
https://www.welt.de/kultur/video249912382/Los-Angeles-Grammys-waren-eine-Nacht-der-Frauen-Taylor-Swift-und-Billie-Eilish-raeumen-ab.html,https://www.welt.de/kultur/video249912382/Los-Angeles-Grammys-waren-eine-Nacht-der-Frauen-Taylor-Swift-und-Billie-Eilish-raeumen-ab.html,0,www.welt.de,„Grammys waren eine Nacht der Frauen“ – Taylor Swift und Billie Eilish räumen ab,Taylor Swift stellt mit dem Grammy für „Midnights“ einen neuen Rekord auf. Als erste Künstlerin gewann sie vier Grammys in der Kategorie „Album des Jahres“. Billy Eilish erhielt den Musikpreis für den besten Song. Bei WELT TV zeigt Redakteurin Alina Quast die…,https://img.welt.de/img/incoming/mobile249912154/3471357937-ci16x9-w1200/alina-jpg.jpg,2024-02-05T08:00:00Z,,"Die WELT als ePaper: Die vollständige Ausgabe steht Ihnen bereits am Vorabend zur Verfügung so sind Sie immer hochaktuell informiert. Weitere Informationen: http://epaper.welt.de 
 Der Kurz-Link die… [+49 chars]",,de,'Billie Eilish'
https://www.welt.de/sport/article249911682/Grosser-Aerger-nach-Messi-Spiel-in-Hongkong-Auch-die-Regierung-ist-aeusserst-enttaeuscht.html,https://www.welt.de/sport/article249911682/Grosser-Aerger-nach-Messi-Spiel-in-Hongkong-Auch-die-Regierung-ist-aeusserst-enttaeuscht.html,0,www.welt.de,„Die Regierung ist äußerst enttäuscht“ – Großer Ärger nach Messi-Spiel in Hongkong,"Lionel Messi befindet sich mit Inter Miami auf Welttournee. Für das Gastspiel in Hongkong zahlten Fans mehrere Hundert Euro Eintritt, doch der Superstar blieb auf der Bank. Nicht nur die Zuschauer machten ihrem Unmut Luft. Auch die Regierung zeigt sich verärg…",https://img.welt.de/img/sport/mobile249911972/4001351737-ci16x9-w1200/Hong-Kong-Soccer-Inter-Miami.jpg,2024-02-05T09:03:57Z,,Frustrierte Fußballfans und die Regierung Hongkongs haben ihrem Ärger über die Abwesenheit von Superstar Lionel Messi beim Gastspiel zwischen dem US-Club Inter Miami und Hongkong XI Luft gemacht. Vie… [+1716 chars],,de,'Al Nassr'
https://www.stern.de/lifestyle/musikpreis--taylor-swift-schreibt-mit-viertem-album-grammy-geschichte-34428700.html,https://www.stern.de/lifestyle/musikpreis--taylor-swift-schreibt-mit-viertem-album-grammy-geschichte-34428700.html,0,www.stern.de,Musikpreis: Taylor Swift schreibt mit viertem Album-Grammy Geschichte,Frauen dominierten die Charts 2023 in den USA - und nun auch die prestigeträchtigen Grammy-Auszeichnungen. Ein männlicher Grammophon-Gewinner dagegen wurde festgenommen und abgeführt.,https://image.stern.de/34429368/t/4-/v1/w1440/r1.7778/-/05--urnnewsmldpacom2009010124020599874711v3w800h600l115t535r1395b1388jpeg---01c98c41474ce660.jpg,2024-02-05T09:16:28Z,https://web.archive.org/web/20240205093909/https://www.stern.de/lifestyle/musikpreis--taylor-swift-schreibt-mit-viertem-album-grammy-geschichte-34428700.html,"Frauen dominierten die Charts 2023 in den USA - und nun auch die prestigeträchtigen Grammy-Auszeichnungen. Ein männlicher Grammophon-Gewinner dagegen wurde festgenommen und abgeführt.
Pop-Superstar … [+4729 chars]",,de,'Jon Batiste'
https://www.faz.net/aktuell/gesellschaft/menschen/grammy-verleihung-2024-taylor-swift-raeumt-ab-und-kuendigt-neues-album-an-19497501.html,https://www.faz.net/aktuell/gesellschaft/menschen/grammy-verleihung-2024-taylor-swift-raeumt-ab-und-kuendigt-neues-album-an-19497501.html,0,www.faz.net,"Grammy-Verleihung 2024: „Es haut mich um, dass das Album die Leute so glücklich macht“","Aufregung bei den Grammys: Ein Rapper bekam Handschellen angelegt, Jay-Z wütete, Miley Cyrus freute sich mehr über die Überbringerin ihres ersten Grammys als über den Preis selbst und Taylor Swift räumte nicht nur ab, sie kündigte auch ein neues Album an.",https://media1.faz.net/ppmedia/aktuell/feuilleton/3667259091/1.9497507/facebook_teaser/grammophongewinnerinnen-taylor.jpg,2024-02-05T09:17:00Z,,"Ein Rapper in Handschellen, Jay-Z auf Kriegspfad und Taylor Swift, die nicht nur Geschichte schrieb, sondern zu Freudenschreien aus dem Publikum auch ein neues Album ankündigte selten ging es bei den… [+4901 chars]",,de,'Miley Cyrus'
https://www.morgenpost.de/vermischtes/article241583048/Taylor-Swift-widmet-Moment-ihres-Triumphs-nicht-Travis-Kelce.html,https://www.morgenpost.de/vermischtes/article241583048/Taylor-Swift-widmet-Moment-ihres-Triumphs-nicht-Travis-Kelce.html,0,www.morgenpost.de,Taylor Swift widmet Moment ihres Triumphs nicht Travis Kelce,Taylor Swift schrieb bei den Grammys 2024 Geschichte. Ihren großen Augenblick widmete sie allerdings nicht ihrem Freund Travis Kelce.,https://img.sparknews.funkemedien.de/241583046/241583046_1707126495_v4_3_800.jpeg,2024-02-05T09:48:16Z,,"Los Angeles/Berlin. Taylor Swift schrieb bei den Grammys 2024 Geschichte. Ihren großen Augenblick widmete sie allerdings nicht ihrem Freund Travis Kelce.
Die diesjährige Verleihung der Grammy-Awards… [+3636 chars]",,de,'Travis Kelce'
https://www.n-tv.de/leute/Jennifer-Lopez-erlebt-Panne-bei-Liveshow-article24712361.html,https://www.n-tv.de/leute/Jennifer-Lopez-erlebt-Panne-bei-Liveshow-article24712361.html,0,www.n-tv.de,Ciao Extensions!: Jennifer Lopez erlebt Panne bei Liveshow,"Am Wochenende ist Jennifer Lopez im US-amerikanischen Fernsehen zu Gast. Doch ihr Auftritt bei ""Saturday Night Live"" läuft nicht ganz nach Plan. Mitten in ihrer Performance verabschieden sich ihre Extensions. Für den Vollprofi kein Problem.",https://bilder1.n-tv.de/img/incoming/crop24712372/4121326860-cImg_16_9-w1200/imago0395952357h.jpg,2024-02-05T09:51:08Z,,"Am Wochenende ist Jennifer Lopez im US-amerikanischen Fernsehen zu Gast. Doch ihr Auftritt bei ""Saturday Night Live"" läuft nicht ganz nach Plan. Mitten in ihrer Performance verabschieden sich ihre Ex… [+1942 chars]",,de,'Ayo Edebiri'
https://taz.de/Grammy-Verleihung/!5990039/,https://taz.de/Grammy-Verleihung/!5990039/,0,taz.de,Grammy-Verleihung: Ein neues Album und eine Festnahme,Bei den Grammys in Los Angeles kündigt Taylor Swift ihr elftes Album an. Ein anderer Gewinner wurde Berichten zufolge während der Veranstaltung festgenommen.,https://taz.de/picture/6806934/948/34591716-1.jpeg,2024-02-05T10:00:00Z,,"Bei den Grammys in Los Angeles kündigt Taylor Swift ihr elftes Album an. Ein anderer Gewinner wurde Berichten zufolge während der Veranstaltung festgenommen.
Mit Midnights gewann die 34-Jährige am S… [+4726 chars]",,de,'Taylor Swift'
https://www.welt.de/kultur/article249875466/Taylor-Swift-singt-hier-nicht-mehr.html,https://www.welt.de/kultur/article249875466/Taylor-Swift-singt-hier-nicht-mehr.html,0,www.welt.de,Taylor Swift singt hier nicht mehr,"Nein, TikTok ist nicht kaputt. Taylor Swift, Billie Eilish und Eminem sind nur mal kurz in die Pause gegangen. Denn zwischen dem Musikgiganten Universal und der Videoplattform läuft ein Kräftemessen über den Wert von Musik. Eine Analyse.",https://img.welt.de/img/kultur/medien/mobile249905442/2201355767-ci16x9-w1200/FILES-US-singer-songwriter-Taylor-2.jpg,2024-02-05T10:09:10Z,,"Am Ende geht es hier um die Frage, wer mächtiger ist. Die chinesische Videoplattform TikTok, die in den vergangenen Jahren zu einem der wichtigsten Verbreitungskanäle für aktuelle Musik geworden ist … [+6489 chars]",,de,'Billie Eilish'
https://www.welt.de/kultur/article249875466/TikTok-gegen-Universal-Music-Taylor-Swift-singt-hier-nicht-mehr.html,https://www.welt.de/kultur/article249875466/TikTok-gegen-Universal-Music-Taylor-Swift-singt-hier-nicht-mehr.html,0,www.welt.de,Das große Armdrücken um die Zukunft der Musikindustrie,"Nein, TikTok ist nicht kaputt. Taylor Swift, Billie Eilish und Eminem sind nur mal kurz in die Pause gegangen. Denn zwischen dem Musikgiganten Universal und der Videoplattform läuft ein Kräftemessen über den Wert von Musik. Eine Analyse.",https://img.welt.de/img/kultur/medien/mobile249905442/2201355767-ci16x9-w1200/FILES-US-singer-songwriter-Taylor-2.jpg,2024-02-05T10:09:10Z,,"Am Ende geht es hier um die Frage, wer mächtiger ist. Die chinesische Videoplattform TikTok, die in den vergangenen Jahren zu einem der wichtigsten Verbreitungskanäle für aktuelle Musik geworden ist … [+6489 chars]",,de,'Taylor Swift'
https://www.welt.de/politik/ausland/video249916620/Sexuelle-Gewalt-Frauen-kaempfen-fuer-Verfolgung-der-Hamas-Graeueltaten.html,https://www.welt.de/politik/ausland/video249916620/Sexuelle-Gewalt-Frauen-kaempfen-fuer-Verfolgung-der-Hamas-Graeueltaten.html,0,www.welt.de,"„Man sah, dass sie furchtbare Schmerzen hatten, als sie starben“","Im Axel-Springer-Journalistenclub traf WELT-Chefredakteurin Jennifer Wilton Frauen, die sich für die strafrechtliche Verfolgung der Hamas-Sexualverbrechen einzusetzen. Shari Mendes, die nach dem 7. Oktober bei der Identifizierung weiblicher Opfer in Israel ha…",https://img.welt.de/img/politik/ausland/mobile249916658/8401359717-ci16x9-w1200/Dinner-Sandberg-1-16744-jpg.jpg,2024-02-05T10:51:40Z,,"Die WELT als ePaper: Die vollständige Ausgabe steht Ihnen bereits am Vorabend zur Verfügung so sind Sie immer hochaktuell informiert. Weitere Informationen: http://epaper.welt.de 
 Der Kurz-Link die… [+49 chars]",,de,'Axel Springer'
https://www.nzz.ch/feuilleton/die-grammys-2024-ld.1777427,https://www.nzz.ch/feuilleton/die-grammys-2024-ld.1777427,0,www.nzz.ch,"Grammy-Vergabe 2024: Künstlerinnen, wohin Ohr und Auge reichen",Taylor Swift sorgt an der 66. Vergabe der wichtigsten amerikanischen Musikpreise für einen neuen Rekord. Als erste Pop-Musikerin erhält sie zum vierten Mal einen Grammy für das beste Album.,"https://img.nzz.ch/2024/02/05/fa8197e2-6afe-4a1f-b44b-551e349573bb.jpeg?width=1200&height=675&fit=bound&quality=75&auto=webp&crop=4001,2251,x0,y1875&wmark=nzz",2024-02-05T11:07:14Z,https://web.archive.org/web/20240205121749/https://www.nzz.ch/feuilleton/die-grammys-2024-ld.1777427,"Victoria Monét hat gleich drei Grammys gewonnen darunter auch den Award als «Best New Artist». 
Die 66. Grammy-Vergabe hat keinen neuen König hervorgebracht und keine neue Königin. Es gibt niemanden… [+4016 chars]",,de,'Jon Batiste'
https://www.diepresse.com/18068043/viele-grammy-heldinnen-und-eine-derbe-botschaft-an-den-feind,https://www.diepresse.com/18068043/viele-grammy-heldinnen-und-eine-derbe-botschaft-an-den-feind,0,www.diepresse.com,Viele Grammy-Heldinnen und eine derbe Botschaft an den Feind,"Die 66. Ausgabe der Grammys stand ganz im Zeichen der Damen. Superstar Taylor Swift, die nun bei 13 Trophäen hält, überstrahlte alles. Legende Joni Mitchell debütierte bei der Gala 80-jährig live. Und Phoebe Bridgers bekam vier Grammys und sorgte für einen kl…",https://img.diepresse.com/public/incoming/fzftsv-US-ENTERTAINMENT-MUSIC-GRAMMYS-AWARD-PRE-SHOW/alternates/DPR_SOCIAL_NACHRICHTEN/US-ENTERTAINMENT-MUSIC-GRAMMYS-AWARD-PRE-SHOW,2024-02-05T11:22:46Z,,"Die 66. Ausgabe der Grammys stand ganz im Zeichen der Damen. Superstar Taylor Swift, die nun bei 13 Trophäen hält, überstrahlte alles. Legende Joni Mitchell debütierte bei der Gala 80-jährig live. Un… [+4358 chars]",,de,'Phoebe Bridgers'
https://www.welt.de/kultur/pop/article249912152/Taylor-Swift-Joni-Mitchell-Co-Die-geheime-Botschaft-der-Grammys.html,https://www.welt.de/kultur/pop/article249912152/Taylor-Swift-Joni-Mitchell-Co-Die-geheime-Botschaft-der-Grammys.html,0,www.welt.de,Die geheime Botschaft der Grammys,"Taylor Swift wird als Königin der 66. Grammys gefeiert. Dabei bekam sie nicht einmal die meisten Preise – und den Thron von Los Angeles bestieg Joni Mitchell, mit 80 Jahren: Allein ihr Auftritt enthüllte, dass es längst nicht mehr darum geht, wer wie viel gew…",https://img.welt.de/img/kultur/pop/mobile249918272/2971353137-ci16x9-w1200/66th-GRAMMY-Awards-Backstage-3.jpg,2024-02-05T11:38:03Z,,Der magische Moment der Grammynacht war keineswegs der Preissegen für Taylor Swift mit dem Verkünden ihres neuen Albums im April. Es war der Auftritt einer 80-Jährigen mit blonden Zöpfen. Joni Mitche… [+3662 chars],,de,'Billie Eilish'
https://www.stern.de/digital/online/lsd-mit-dem-tesla-ceo--musks-aufsichtsraete-fuehlen-druck--mit-ihm-drogen-zu-nehmen-34429958.html,https://www.stern.de/digital/online/lsd-mit-dem-tesla-ceo--musks-aufsichtsraete-fuehlen-druck--mit-ihm-drogen-zu-nehmen-34429958.html,0,www.stern.de,"Tesla, Space X und Co.: LSD mit dem CEO: Musks Aufsichtsräte fühlen sich unter Druck, mit ihm Drogen zu nehmen","Immer wieder macht Elon Musks Drogenkonsum Schlagzeilen. Die Aufsichtsräte seiner sechs Firmen halten sich mit Kritik bisher zurück. Statt Widerstand gibt es intern offenbar eher den Druck, selbst mitzumachen.",https://image.stern.de/34430790/t/L_/v3/w1440/r1.7778/-/elon-musk-teaserbild.jpg,2024-02-05T11:43:18Z,,"Dass Elon Musk ein Getriebener ist, kann man kaum übersehen. Immer wieder sorgt er mit Aussagen für Aufmerksamkeit, die zwischen Vision und Übermut schwanken. Schon länger gibt es Berichte, dass dabe… [+5339 chars]",,de,'Elon Musk'
https://www.faz.net/aktuell/sport/fussball/lionel-messi-in-hongkong-nur-auf-der-bank-fans-und-regierung-sind-sauer-19497636.html,https://www.faz.net/aktuell/sport/fussball/lionel-messi-in-hongkong-nur-auf-der-bank-fans-und-regierung-sind-sauer-19497636.html,0,www.faz.net,Fan-Wut auf Fußballstar: Weiter Ärger nach Messi-Desaster,"Bei einem PR-Spiel in Hongkong sitzt Lionel Messi nur auf der Ersatzbank. Nicht nur die Fans schäumen vor Wut, auch die Regierung ist sauer. Für die Finanzmetropole ist die Messi-Posse ein Rückschlag.",https://media0.faz.net/ppmedia/aktuell/sport/466732464/1.9497816/facebook_teaser/aerger-in-hongkong-viele-messi.jpg,2024-02-05T11:49:23Z,,"Die Posse um den Reservisten Lionel Messi geht in die nächste Runde. Wie Hongkongs Sportminister Kevin Yeung erklärte, sei Argentiniens Weltmeisterkapitän eigentlich vertraglich dazu verpflichtet gew… [+2876 chars]",,de,'Lionel Messi'
https://www.stern.de/news/frankreichs-premierminister-attal-uebersteht-vor-berlin-besuch-vertrauensabstimmung-34430152.html,https://www.stern.de/news/frankreichs-premierminister-attal-uebersteht-vor-berlin-besuch-vertrauensabstimmung-34430152.html,0,www.stern.de,Frankreichs Premierminister Attal übersteht vor Berlin-Besuch Vertrauensabstimmung,Kurz vor seinem Antrittsbesuch bei Bundeskanzler Olaf Scholz (SPD) hat Frankreichs Premierminister Gabriel Attal seine erste Vertrauensabstimmung überstanden. Da der Antrag der linkspopulistischen Opposition vom rechten und rechtspopulistischen Lager nicht un…,https://image.stern.de/34430154/t/5o/v1/w1440/r1.7778/-/05--gabriel-attal---3c812edfb733fad9.jpg,2024-02-05T12:30:09Z,,Kurz vor seinem Antrittsbesuch bei Bundeskanzler Olaf Scholz (SPD) hat Frankreichs Premierminister Gabriel Attal seine erste Vertrauensabstimmung überstanden. Da der Antrag der linkspopulistischen Op… [+2476 chars],,de,'Gabriel Attal'
https://www.stern.de/news/frauenpower-bei-den-grammys---taylor-swift-mit-neuem-rekord-34428744.html,https://www.stern.de/news/frauenpower-bei-den-grammys---taylor-swift-mit-neuem-rekord-34428744.html,0,www.stern.de,Frauenpower bei den Grammys - Taylor Swift mit neuem Rekord,"Sie hat schon viele Rekorde gebrochen, nun ist Taylor Swift auch unbestrittene Grammy-Königin. Die 34-Jährige siegte bei der Verleihung der wichtigsten Musikpreise der Welt mit ihrer Platte ""Midnights"" zum vierten Mal in der Kategorie Album des Jahres - so of…",https://image.stern.de/34430250/t/Fv/v1/w1440/r1.7778/-/05--taylor-swift-bei-dankesrede-fuer-grammy---bcf9041d51928d1c.jpg,2024-02-05T12:46:23Z,,"Sie hat schon viele Rekorde gebrochen, nun ist Taylor Swift auch unbestrittene Grammy-Königin. Die 34-Jährige siegte bei der Verleihung der wichtigsten Musikpreise der Welt mit ihrer Platte ""Midnight… [+3358 chars]",,de,'Dua Lipa'
https://orf.at/stories/3347779/,https://orf.at/stories/3347779/,0,orf.at,Frauenpower dominiert Grammy-Awards,"Bei den Grammys hat heuer nicht nur Taylor Swift mit dem Grammy für das beste Album Geschichte geschrieben – rekordverdächtig war auch die Dominanz der Frauen bei den Nominierungen und auch den vergebenen Preisen. Auftritte von Joni Mitchell, Miley Cyrus und …",https://ibs.orf.at/news?image=https%3A%2F%2Fassets.orf.at%2Fmims%2F2024%2F06%2F28%2Fcrops%2Fw%3D1200%2Ch%3D630%2Cq%3D75%2F2096640_master_792128_grammys_frauen_dominanz_gruppenbild_r.jpg%3Fs%3Dc606b3cf9e5da560badf895d0ef10a6185cdcf4c,2024-02-05T12:50:22Z,,"Moderator Trevor Noah eröffnete die Gala Sonntagabend (Ortszeit) mit einer Hommage an die vielen weiblichen Nominierten. Können wir für eine Sekunde die Tatsache genießen, dass Frauen dieses Jahr die… [+6832 chars]",,de,'Taylor Swift'
https://feed.laut.de/News/Grammy-Awards-Taylor-Swift-schreibt-Geschichte-05-02-2024-20212,https://feed.laut.de/News/Grammy-Awards-Taylor-Swift-schreibt-Geschichte-05-02-2024-20212,0,feed.laut.de,Grammy Awards: Taylor Swift schreibt Geschichte,"Die US-Sängerin gewann zum vierten Mal den Preis für das Album des Jahres. Außerdem kündigt sie mit ""The Tortured Poets Department"" ein neues Album an.",https://www.laut.de/News/Grammy-Awards-Taylor-Swift-schreibt-Geschichte-05-02-2024-20212/grammy-awards-taylor-swift-schreibt-geschichte-232473.jpg,2024-02-05T13:36:46Z,,"Die US-Sängerin gewann zum vierten Mal den Preis für das Album des Jahres. Außerdem kündigt sie mit ""The Tortured Poets Department"" ein neues Album an.
Los Angeles (elv) - Taylor Swift hat am Sonnta… [+1282 chars]",,de,'Taylor Swift'
https://t3n.de/news/witziger-gta-6-trailer-ki-sylt-1605443/,https://t3n.de/news/witziger-gta-6-trailer-ki-sylt-1605443/,0,t3n.de,Witziger KI-Trailer zeigt wie GTA 6 auf Sylt aussehen würde – inklusive Christian Lindner,"Ach, wie lustig wäre doch ein Grand-Theft-Auto-Teil, der in Deutschland spielen würde. Ein KI-Trailer zeigt nun, wie das Spiel auf Sylt aussehen könnte.
weiterlesen auf t3n.de",https://t3n.de/news/wp-content/uploads/2024/02/gta-6-sylt-1.jpg,2024-02-05T13:50:00Z,,"Eine Kolonne aus Mercedes-G-Klassen fährt durch den Sand. Eine Frau versteckt sich im Schilf mit einer Waffe. Luxus, schöne Menschen und fette Knarren der Trailer von Grand Theft Auto 6 Sylt Luxury h… [+2804 chars]",,de,'Franca Lehfeldt'
https://www.nzz.ch/schweiz/jean-daniel-ruch-sollte-die-nummer-zwei-viola-amherds-vbs-werden-nun-tritt-er-mit-putin-verstehern-auf-ld.1777432,https://www.nzz.ch/schweiz/jean-daniel-ruch-sollte-die-nummer-zwei-viola-amherds-vbs-werden-nun-tritt-er-mit-putin-verstehern-auf-ld.1777432,0,www.nzz.ch,Beinahe wurde Jean-Daniel Ruch oberster Sicherheitsberater von Viola Amherd – nun tritt er mit Putin-Verstehern auf,Der Anlass findet im März in Kloten statt und wird im Internet bereits als hochkarätige «Debatte des Anti-Mainstreams» beworben.,"https://img.nzz.ch/2023/09/15/55026a11-252b-43a1-b5f3-9f06c87a6a8c.jpeg?width=1200&height=674&fit=bound&quality=75&auto=webp&crop=7158,4021,x0,y2&wmark=nzz",2024-02-05T16:00:00Z,,"Jean-Daniel Ruch bei der Pressekonferenz zu seiner Wahl als Sepos-Chef.
Seit 1. Januar sollte der frühere Diplomat Jean-Daniel Ruch eine der wichtigsten Funktionen im Verteidigungsdepartement (VBS) … [+4851 chars]",,de,'Sucharit Bhakdi'
https://www.welt.de/regionales/hamburg/article249931178/Streit-um-Ruine-Liberale-Juedische-Gemeinde-fordert-neue-Synagoge.html,https://www.welt.de/regionales/hamburg/article249931178/Streit-um-Ruine-Liberale-Juedische-Gemeinde-fordert-neue-Synagoge.html,0,www.welt.de,Liberale Jüdische Gemeinde fordert neue Synagoge,"Die liberale Jüdische Gemeinde in Hamburg vergleicht Senatspläne mit „Unrecht der Nazi-Zeit“, kritisiert Bürgermeister Peter Tschentscher und Finanzsenator Andreas Dressel (beide SPD) scharf und fordert den Wiederaufbau der Synagoge in der Poolstraße.",https://img.welt.de/img/bildergalerien/mobile249932106/6991351027-ci16x9-w1200/Ruine-des-ehemaligen-israelitischen-Tempels-in-der-Poolstrasse.jpg,2024-02-05T16:47:22Z,,Die liberale jüdische Gemeinde in Hamburg kritisiert den Hamburger Senat in scharfen Worten und fordert einen Wiederaufbau des im Zweiten Weltkrieg zerstörten Neuen Israelitischen Tempels in der Neus… [+5289 chars],,de,'nan nan'
https://www.faz.net/aktuell/gesellschaft/britischer-koenig-charles-iii-mit-krebs-diagnostiziert-worden-19499210.html,https://www.faz.net/aktuell/gesellschaft/britischer-koenig-charles-iii-mit-krebs-diagnostiziert-worden-19499210.html,0,www.faz.net,Palast: Britischer König Charles III. hat Krebs,Der britische König Charles III. ist laut Angaben des Buckingham-Palastes an Krebs erkrankt. Die Erkrankung sei bei seinem letzten Krankenhausaufenhtalt festgestellt worden.,https://media0.faz.net/ppmedia/aktuell/gesellschaft/2040010046/1.9499212/facebook_teaser/koenig-charles-iii.jpg,2024-02-05T18:14:25Z,,"Beim britischen König Charles III. ist Krebs diagnostiziert worden. Während seiner jüngsten Behandlung im Krankenhaus wegen einer gutartigen Prostatavergrößerung sei ein weiteres Problem aufgefallen,… [+727 chars]",,de,'Charles III'
https://www.faz.net/aktuell/britischer-koenig-charles-iii-mit-krebs-diagnostiziert-worden-19499210.html,https://www.faz.net/aktuell/britischer-koenig-charles-iii-mit-krebs-diagnostiziert-worden-19499210.html,0,www.faz.net,Palast: Britischer König Charles III. hat Krebs,Beim britischen König Charles III. ist Krebs diagnostiziert worden. Das teilte der Buckingham-Palast am Montagabend mit.,https://media0.faz.net/ppmedia/aktuell/gesellschaft/2040010046/1.9499212/facebook_teaser/koenig-charles-iii.jpg,2024-02-05T18:14:25Z,,"Palast: Britischer König Charles III. hat Krebs
Eine Form von Krebs
Palast: Britischer König Charles III. hat Krebs
Von Beim britischen König Charles III. ist Krebs diagnostiziert worden. Das teil… [+109 chars]",,de,'König Charles III'
https://www.stern.de/gesellschaft/regional/thueringen/landtag--ramelow-bietet-eisenachs-stadtchefin-wolf-ministerposten-an-34431364.html,https://www.stern.de/gesellschaft/regional/thueringen/landtag--ramelow-bietet-eisenachs-stadtchefin-wolf-ministerposten-an-34431364.html,0,www.stern.de,Landtag: Ramelow bietet Eisenachs Stadtchefin Wolf Ministerposten an,"Katja Wolfs Ankündigung, von der Linken zum Bündnis Sahra Wagenknecht zu wechseln, überraschte viele in ihrer bisherigen Partei. Auch Bodo Ramelow reagierte emotional. Nun machte er ihr ein Angebot.",https://image.stern.de/34431366/t/Vp/v1/w1440/r1.7778/-/05--urnnewsmldpacom2009010124020599881594v3w800h600l230t38r1950b1272jpeg---7a323404fc9ec812.jpg,2024-02-05T18:18:14Z,,"Katja Wolfs Ankündigung, von der Linken zum Bündnis Sahra Wagenknecht zu wechseln, überraschte viele in ihrer bisherigen Partei. Auch Bodo Ramelow reagierte emotional. Nun machte er ihr ein Angebot.… [+1319 chars]",,de,'Bodo Ramelow'
