index,url,valid,domain,title,description,image,published,archive,content,quote,language,keyword
https://www.sueddeutsche.de/medien/maybrit-illner-ampel-tv-kritik-lux.8XZKDiZeSS7ZN53F3qs9C2,https://www.sueddeutsche.de/medien/maybrit-illner-ampel-tv-kritik-lux.8XZKDiZeSS7ZN53F3qs9C2,0,www.sueddeutsche.de,"„Maybrit Illner“: Reden darüber, dass nun wirklich weniger geredet werden muss",Illner lädt zum nächsten Ampel-Gipfel in dieser Woche – und bleibt erstaunlich nah am Untersuchungsgegenstand. Vielleicht bleibt die Debatte deswegen so ergebnislos.,https://www.sueddeutsche.de/2024/11/01/718892c6-747e-4055-9636-759c3f47eaf3.jpeg?q=60&fm=webp&width=1200&rect=0%2C342%2C4000%2C2249,2024-11-01T00:53:11Z,http://archive.md/20241101104004/https://www.sueddeutsche.de/medien/maybrit-illner-ampel-tv-kritik-lux.8XZKDiZeSS7ZN53F3qs9C2,Illner lädt zum nächsten Ampel-Gipfel in dieser Woche und bleibt erstaunlich nah am Untersuchungsgegenstand. Vielleicht bleibt die Debatte deswegen so ergebnislos.Bevor man Illner am Donnerstagabend … [+447 chars],,de,'Maybrit Illner'
https://www.welt.de/politik/deutschland/article254296428/Maybrit-Illner-Das-eine-ist-eine-Veranstaltung-der-Regierung-stichelt-Esken-gegen-die-FDP.html,https://www.welt.de/politik/deutschland/article254296428/Maybrit-Illner-Das-eine-ist-eine-Veranstaltung-der-Regierung-stichelt-Esken-gegen-die-FDP.html,0,www.welt.de,"„Das eine ist eine Veranstaltung der Regierung“, stichelt Esken gegen die FDP","Nach den beiden Wirtschaftsgipfeln von Christian Lindner und Olaf Scholz ging es bei Maybrit Illner um die Frage, wie sehr die zerstrittene Ampel-Regierung der deutschen Wirtschaft schadet. Am deutlichsten wurde ein Mann, der fernab von Berlin politische Vera…",https://img.welt.de/img/politik/deutschland/mobile254296436/7747937977-ci16x9-w1200/241031-037.jpg,2024-11-01T00:59:54Z,http://archive.md/20241101050401/https://www.welt.de/politik/deutschland/article254296428/Maybrit-Illner-Das-eine-ist-eine-Veranstaltung-der-Regierung-stichelt-Esken-gegen-die-FDP.html,"Nach den beiden Wirtschaftsgipfeln von Christian Lindner und Olaf Scholz ging es bei Maybrit Illner um die Frage, wie sehr die zerstrittene Ampel-Regierung der deutschen Wirtschaft schadet. Am deutli… [+5463 chars]",,de,'Christian Lindner'
https://www.n-tv.de/politik/Duerr-Lasst-uns-Regeln-abschaffen-article25329961.html,https://www.n-tv.de/politik/Duerr-Lasst-uns-Regeln-abschaffen-article25329961.html,0,www.n-tv.de,"Ampel vor Richtungsentscheidung: Dürr: ""Lasst uns Regeln abschaffen""","Der November wird zum Monat der Entscheidungen für die Ampelkoalition. An der Wirtschaftskrise könnte sie zerbrechen. Wie die deutsche Wirtschaft zu retten ist, darüber diskutieren die Gäste bei Maybrit Illner.",https://bilder4.n-tv.de/img/incoming/crop25329963/7691325520-cImg_16_9-w1200/490366883.jpg,2024-11-01T04:32:27Z,,"Der November wird zum Monat der Entscheidungen für die Ampelkoalition. An der Wirtschaftskrise könnte sie zerbrechen. Wie die deutsche Wirtschaft zu retten ist, darüber diskutieren die Gäste bei Mayb… [+6448 chars]",,de,'Maybrit Illner'
https://www.focus.de/kultur/kino_tv/gipfel-talk-bei-maybrit-illner-liefert-den-real-grusel-zu-halloween-wir-werden-alle-sterben_id_260443799.html,https://www.focus.de/kultur/kino_tv/gipfel-talk-bei-maybrit-illner-liefert-den-real-grusel-zu-halloween-wir-werden-alle-sterben_id_260443799.html,0,www.focus.de,"TV-Kolumne - Wie gruselig es um die Ampel wirklich steht, zeigt ein Geständnis von Esken im ZDF","Deutschland wird durchgeschüttelt vom Dreifach-Wumms: drei Regierungsparteien – und keine gemeinsame Richtung, in die sie regieren wollen. Deutschland bräuchte Zuversicht, bekommt aber nur Gipfel. Sogar SPD-Vorsitzende Saskia Esken muss da zugeben: „Vielleich…",https://p6.focus.de/img/fotos/id_260443838/illner-esken.jpg?im=Crop%3D%280%2C62%2C2000%2C1000%29%3BResize%3D%281200%2C627%29&impolicy=perceptual&quality=mediumHigh&hash=0333bc41db782e3a1d60c482fe57aabd2d614ad3d12646b9bce99c05d2fbf659,2024-11-01T08:19:09Z,,"Deutschland wird durchgeschüttelt vom Dreifach-Wumms: drei Regierungsparteien und keine gemeinsame Richtung, in die sie regieren wollen. Deutschland bräuchte Zuversicht, bekommt aber nur Gipfel. Soga… [+3642 chars]",,de,'Maybrit Illner'
https://www.n-tv.de/politik/US-wahl-2024/Kiew-hofft-auf-Trumps-Niederlage-und-Harris-Unterstuetzung-article25331387.html,https://www.n-tv.de/politik/US-wahl-2024/Kiew-hofft-auf-Trumps-Niederlage-und-Harris-Unterstuetzung-article25331387.html,0,www.n-tv.de,Bangen um Ausgang der US-Wahl: Kiew hofft auf Trumps Niederlage - und Harris' Unterstützung,"Regierungsvertreter in Kiew verlieren darüber offiziell kein Wort, aber insgeheim hoffen die Ukrainer, dass Kamala Harris ins Weiße Haus einzieht. Doch auch hinter einer möglichen Präsidentschaft der Demokratin stehen viele Fragezeichen.",https://bilder4.n-tv.de/img/incoming/crop25331439/6331324214-cImg_16_9-w1200/2024-11-01T135244Z-95658724-RC22Y9AU9L3R-RTRMADP-3-USA-ELECTION-IRAN.jpg,2024-11-01T15:10:29Z,,"Regierungsvertreter in Kiew verlieren darüber offiziell kein Wort, aber insgeheim hoffen die Ukrainer, dass Kamala Harris ins Weiße Haus einzieht. Doch auch hinter einer möglichen Präsidentschaft der… [+6019 chars]",,de,'Barack Obama'
https://www.brigitte.de/aktuell/johnny-depps-anwaeltin-beteuert--es-gab-nie-eine-romanze-zwischen-ihnen-13899556.html,https://www.brigitte.de/aktuell/johnny-depps-anwaeltin-beteuert--es-gab-nie-eine-romanze-zwischen-ihnen-13899556.html,0,www.brigitte.de,Johnny Depps Anwältin beteuert: Es gab nie eine Romanze zwischen ihnen,Der Prozess zwischen Johnny Depp und Amber Heard machte seine Anwältin Camille Vasquez berühmt. Zum Liebespaar machte er sie aber nicht.,https://image.brigitte.de/13899558/t/E-/v1/w1440/r1.7778/-/02--es-gab-nie-eine-romanze-zwischen-ihnen---1-1---spoton-article-1078897.jpg,2024-11-02T13:56:00Z,,"Der Prozess zwischen Johnny Depp und Amber Heard machte seine Anwältin Camille Vasquez berühmt. Zum Liebespaar machte er sie aber nicht.
Es ist einer der aufsehenerregendsten Promi-Prozesse der verg… [+1905 chars]",,de,'Amber Heard'
https://www.stern.de/lifestyle/leute/johnny-depps-anwaeltin-beteuert--romanzen-geruechte-waren-frei-erfunden-35194158.html,https://www.stern.de/lifestyle/leute/johnny-depps-anwaeltin-beteuert--romanzen-geruechte-waren-frei-erfunden-35194158.html,0,www.stern.de,Johnny Depps Anwältin beteuert: Romanzen-Gerüchte waren frei erfunden,Der Prozess zwischen Johnny Depp und Amber Heard machte seine Anwältin Camille Vasquez berühmt. Zum Liebespaar machte er sie aber nicht.,https://image.stern.de/35194162/t/Qq/v1/w1440/r1.7778/-/02--romanzen-geruechte-waren-frei-erfunden---16-9---spoton-article-1078897.jpg,2024-11-02T14:02:00Z,,"Kopiere den aktuellen Link
Der Prozess zwischen Johnny Depp und Amber Heard machte seine Anwältin Camille Vasquez berühmt. Zum Liebespaar machte er sie aber nicht.
Es ist einer der aufsehenerregend… [+1929 chars]",,de,'Amber Heard'
https://www.diepresse.com/19030507/neuer-achtteiler-ueber-den-fall-amanda-knox,https://www.diepresse.com/19030507/neuer-achtteiler-ueber-den-fall-amanda-knox,0,www.diepresse.com,Neuer Achtteiler über den Fall Amanda Knox,"Die Serie wird von Knox selbst, der Schauspielerin Margaret Qualley und Monica Lewinsky produziert. Die Serie spielt an verschiedenen Orten im historischen Zentrum Perugias in Italien.",https://img.diepresse.com/public/incoming/dssea9-2015-03-28T120000Z_486241457_GF10000041246_RTRMADP_3_ITALY-KNOX-USA.JPG/alternates/DPR_SOCIAL_NACHRICHTEN/2015-03-28T120000Z_486241457_GF10000041246_RTRMADP_3_ITALY-KNOX-USA.JPG,2024-11-03T08:41:50Z,,"Die Serie wird von Knox selbst, der Schauspielerin Margaret Qualley und Monica Lewinsky produziert. Die Serie spielt an verschiedenen Orten im historischen Zentrum Perugias in Italien.
Die Mordvorwü… [+1812 chars]",,de,'Margaret Qualley'
https://www.morgenpost.de/politik/article405063004/politik-news-aktuell-nachrichten-news-deutschland-linder-provoziert-ampel-partner.html,https://www.morgenpost.de/politik/article405063004/politik-news-aktuell-nachrichten-news-deutschland-linder-provoziert-ampel-partner.html,0,www.morgenpost.de,Kubicki: Ampel muss diese Woche Entscheidungen treffen,Der FDP-Vizevorsitzende Wolfgang Kubicki hat die Ampel-Partner zu raschen Entscheidungen gedrängt. Die Politik-News im Blog.,https://img.sparknews.funkemedien.de/407599139/407599139_1730631572_v16_9_1600.jpeg,2024-11-03T10:30:00Z,,"Berlin. Der FDP-Vizevorsitzende Wolfgang Kubicki hat die Ampel-Partner zu raschen Entscheidungen gedrängt. Die Politik-News im Blog.
<ul><li>Kubicki: Ampel muss diese Woche Entscheidungen treffen</l… [+14516 chars]",,de,'Wolfgang Kubicki'
https://www.telepolis.de/features/Vor-der-US-Wahl-Die-grosse-Mehrheit-der-Amerikaner-sind-rationale-vernuenftige-Menschen-mit-gutem-10002553.html,https://www.telepolis.de/features/Vor-der-US-Wahl-Die-grosse-Mehrheit-der-Amerikaner-sind-rationale-vernuenftige-Menschen-mit-gutem-10002553.html,0,www.telepolis.de,"Vor der US-Wahl: ""Die große Mehrheit der Amerikaner sind rationale, vernünftige Menschen mit gutem Willen""","Was spricht für, was spricht gegen einen Sieg von Donald Trump? Lügen, Statistiken, Schätzungen und Prognosen. Ein Streifzug durch die Medien.",https://heise.cloudimg.io/bound/1200x1200/q85.png-lossy-85.webp-lossy-85.foil1/_www-heise-de_/imgs/18/4/7/0/0/3/7/6/Master_Ruediger_Suchsland-dccbbeb47ef0cf2a.jpeg,2024-11-03T13:00:00Z,,"Wahlkampf in Emprio Texas, Januar 2024. Mitarbeiter und Einwohner bei einem Rathaustreffen in einem BBQ-Restaurant. Bild: Mark Reinstein/Shutterstock.com
Was spricht für, was spricht gegen einen Sie… [+10506 chars]",,de,'George Bush'
https://www.stern.de/lifestyle/leute/koenig-charles-streicht-prinz-andrew-die-finanzielle-unterstuetzung-35195908.html,https://www.stern.de/lifestyle/leute/koenig-charles-streicht-prinz-andrew-die-finanzielle-unterstuetzung-35195908.html,0,www.stern.de,Britisches Königshaus: Aus die Maus! König Charles streicht Prinz Andrew die finanzielle Unterstützung,König Charles soll durchgegriffen und seinem Bruder die Zuschüsse gestrichen haben. Prinz Andrew soll dem Königshaus nun nicht mehr auf der Tasche liegen.,https://image.stern.de/35195914/t/a6/v3/w1440/r1.7778/-/koenig-charles-geld-prinz-andrew.jpg,2024-11-03T18:37:00Z,,"Kopiere den aktuellen Link
König Charles soll durchgegriffen und seinem Bruder die Zuschüsse gestrichen haben. Prinz Andrew soll dem Königshaus nun nicht mehr auf der Tasche liegen.
Des Öfteren kam… [+2242 chars]",,de,'nan nan'
https://www.brigitte.de/aktuell/prinz-andrew--die-royal-lodge-scheint-zu-verfallen-13899810.html,https://www.brigitte.de/aktuell/prinz-andrew--die-royal-lodge-scheint-zu-verfallen-13899810.html,0,www.brigitte.de,Prinz Andrew: Die Royal Lodge scheint zu verfallen,"Prinz Andrew lebt in der Royal Lodge, die er als Pächter instand halten muss. Doch genau das scheint nicht der Fall zu sein.",https://image.brigitte.de/13899812/t/Zp/v1/w1440/r1.7778/-/04--die-royal-lodge-scheint-zu-verfallen---1-1---spoton-article-1078963.jpg,2024-11-04T08:16:00Z,,"Prinz Andrew lebt in der Royal Lodge, die er als Pächter instand halten muss. Doch genau das scheint nicht der Fall zu sein.
Abgeblätterte Fassade und Risse in den Außenwänden: In Großbritannien sor… [+2479 chars]",,de,'Jeffrey Epstein'
https://www.stern.de/kultur/prinz-andrew--seine-royal-lodge-hat-sanierungsbedarf-35196736.html,https://www.stern.de/kultur/prinz-andrew--seine-royal-lodge-hat-sanierungsbedarf-35196736.html,0,www.stern.de,Prinz Andrew: Seine Royal Lodge hat Sanierungsbedarf,"Prinz Andrew lebt in der Royal Lodge, die er als Pächter instand halten muss. Doch genau das scheint nicht der Fall zu sein.",https://image.stern.de/35196740/t/hH/v1/w1440/r1.7778/-/04--seine-royal-lodge-hat-sanierungsbedarf---16-9---spoton-article-1078963.jpg,2024-11-04T08:20:00Z,,"Kopiere den aktuellen Link
Prinz Andrew lebt in der Royal Lodge, die er als Pächter instand halten muss. Doch genau das scheint nicht der Fall zu sein.
Abgeblätterte Fassade und Risse in den Außenw… [+2412 chars]",,de,'Prinz Andrew'
https://www.transfermarkt.de/ohne-teure-neuzugange-ajax-unter-farioli-auf-dem-vormarsch-hat-alle-uberrascht-quot-/view/news/445784,https://www.transfermarkt.de/ohne-teure-neuzugange-ajax-unter-farioli-auf-dem-vormarsch-hat-alle-uberrascht-quot-/view/news/445784,0,www.transfermarkt.de,Ajax unter Francesco Farioli auf Vormarsch: „Hat alle überrascht“,Von einer „perfekten Woche“ sprach Trainer Francesco Farioli am Samstagabend. Kurz vorher hatte Ajax Amsterdam den niederländischen Titelverteidiger PSV mit 3:2 niedergerungen und...,https://tmssl.akamaized.net/images/foto/big/francesco-farioli-ajax-2024-25-1730708863-153240.jpg?lm=1730708881,2024-11-04T09:27:29Z,,"Feyenoord und PSV geschlagen 
Von einer „perfekten Woche“ sprach Trainer Francesco Farioli am Samstagabend. Kurz vorher hatte Ajax Amsterdam den niederländischen Titelverteidiger PSV mit 3:2 niederg… [+5830 chars]",,de,'Sam H'
https://de.catholicnewsagency.com/news/17517/vier-bischofe-die-nicht-am-synodalen-ausschuss-teilnehmen-dankbar-fur-weltsynode,https://de.catholicnewsagency.com/news/17517/vier-bischofe-die-nicht-am-synodalen-ausschuss-teilnehmen-dankbar-fur-weltsynode,0,de.catholicnewsagency.com,"Vier Bischöfe, die nicht am Synodalen Ausschuss teilnehmen, dankbar für Weltsynode","Die vier Bischöfe, die nicht am Synodalen Ausschuss teilnehmen, der den deutschen Synodalen Weg verstetigen soll, haben sich dankbar für die von Papst Franziskus lancierte und im Oktober zu Ende gegangene Weltsynode zur Synodalität gezeigt. Unklar bleibt, ob …",https://de.catholicnewsagency.com/image/synodalerweg_1730714737.jpg?w=1150&jpg,2024-11-04T10:15:00Z,,"Redaktion -
 Montag, 4. November 2024, 11:15 Uhr.
Die vier Bischöfe, die nicht am Synodalen Ausschuss teilnehmen, der den deutschen Synodalen Weg verstetigen soll, haben sich dankbar für die von Pa… [+5420 chars]",,de,'Rainer Maria Woelki'
https://www.focus.de/kultur/royals/fotos-zeigen-risse-und-schimmel-prinz-andrews-36-millionen-euro-anwesen-verwahrlost-zum-rumpel-haus_id_260448992.html,https://www.focus.de/kultur/royals/fotos-zeigen-risse-und-schimmel-prinz-andrews-36-millionen-euro-anwesen-verwahrlost-zum-rumpel-haus_id_260448992.html,0,www.focus.de,Risse und Schimmel - Prinz Andrews 36 Millionen-Euro-Anwesen verwahrlost zum Rumpel-Haus,"König Charles' geschasster Bruder Prinz Andrew lebt in der Royal Lodge, um die er sich nicht zu kümmern scheint. Aktuelle Aufnahmen dokumentieren einen desolaten Zustands daes wertwollen Anwesens.",https://p6.focus.de/img/fotos/id_260449769/imago116755968.jpg?im=Crop%3D%280%2C332%2C3466%2C1730%29%3BResize%3D%281200%2C627%29&impolicy=perceptual&quality=mediumHigh&hash=23a72d9ae7b51c94461e1b48ea769df74419ec54bba770dbfb866e169607c87d,2024-11-04T11:19:12Z,,"<ul><li>
Kommentare</li><li>
E-Mail</li><li>
Teilen</li><li>
Mehr</li><li>
Twitter</li><li>
Drucken</li><li>
Feedback</li><li>
Fehler meldenSie haben einen Fehler gefunden?
Bitte markieren S… [+3031 chars]",,de,'Jeffrey Epstein'
https://www.n-tv.de/leute/Laesst-Prinz-Andrew-die-Royal-Lodge-verfallen-article25335260.html,https://www.n-tv.de/leute/Laesst-Prinz-Andrew-die-Royal-Lodge-verfallen-article25335260.html,0,www.n-tv.de,Fotos von Rissen und Schimmel: Lässt Prinz Andrew die Royal Lodge verfallen?,"Die Royal Lodge ist immer wieder Streitthema zwischen König Charles III. und seinem Bruder Andrew. Der in Ungnade gefallene Prinz müsste das Anwesen als Pächter eigentlich instand halten. Doch dazu ist er offenbar finanziell nicht in der Lage, wie neue Bilder…",https://bilder1.n-tv.de/img/incoming/crop24642716/8251321133-cImg_16_9-w1200/420358828.jpg,2024-11-04T12:39:33Z,,Die Royal Lodge ist immer wieder Streitthema zwischen König Charles III. und seinem Bruder Andrew. Der in Ungnade gefallene Prinz müsste das Anwesen als Pächter eigentlich instand halten. Doch dazu i… [+2857 chars],,de,'Charles III'
https://www.welt.de/politik/ausland/article254352936/Baerbock-sagt-Ukraine-zusaetzliche-Winterhilfe-in-Hoehe-von-200-Millionen-Euro-zu.html,https://www.welt.de/politik/ausland/article254352936/Baerbock-sagt-Ukraine-zusaetzliche-Winterhilfe-in-Hoehe-von-200-Millionen-Euro-zu.html,0,www.welt.de,Baerbock sagt der Ukraine zusätzliche Winterhilfe in Höhe von 200 Millionen Euro zu,Die humanitäre Soforthilfe an die Ukraine wird mit zusätzlichen 200 Millionen Euro aufgestockt. Das erklärte Außenministerin Annalena Baerbock bei ihrem achten Solidaritätsbesuch seit Beginn des russischen Angriffskrieges im Februar 2022 – bei dem sie sich au…,https://img.welt.de/img/politik/ausland/mobile254353194/3497938657-ci16x9-w1200/Minister-of-Foreign-Affairs-Of-Germany-Annalena-Baerbock-Visits-U.jpg,2024-11-04T17:37:12Z,http://archive.md/20241104184211/https://www.welt.de/politik/ausland/article254352936/Baerbock-sagt-Ukraine-zusaetzliche-Winterhilfe-in-Hoehe-von-200-Millionen-Euro-zu.html,Die humanitäre Soforthilfe an die Ukraine wird mit zusätzlichen 200 Millionen Euro aufgestockt. Das erklärte Außenministerin Annalena Baerbock bei ihrem achten Solidaritätsbesuch seit Beginn des russ… [+4745 chars],,de,'Maybrit Illner'
https://www.nzz.ch/international/ich-will-nicht-dass-ein-mann-ueber-ihre-koerper-bestimmen-kann-diese-frauen-koennten-kamala-harris-zum-sieg-fuehren-ld.1855777,https://www.nzz.ch/international/ich-will-nicht-dass-ein-mann-ueber-ihre-koerper-bestimmen-kann-diese-frauen-koennten-kamala-harris-zum-sieg-fuehren-ld.1855777,0,www.nzz.ch,Philadelphias Frauen könnten Kamala Harris zum Sieg führen – eine Reportage vom letzten Wahlkampftag aus Pennsylvania,Die wohlhabenden Vororte von Philadelphia sind über Jahrzehnte nach links gerückt. Donald Trump hat den Prozess bloss noch beschleunigt. Vor allem bei den Wählerinnen rennen Demokraten offene Türen ein.,"https://img.nzz.ch/2024/11/04/45462ce8-c7b3-43e7-9121-86459a4ec81d.jpeg?width=1200&height=675&fit=bounds&quality=75&auto=webp&crop=3600,2025,x0,y0&wmark=nzz",2024-11-05T04:28:00Z,http://archive.md/20241105114501/https://www.nzz.ch/international/ich-will-nicht-dass-ein-mann-ueber-ihre-koerper-bestimmen-kann-diese-frauen-koennten-kamala-harris-zum-sieg-fuehren-ld.1855777,"Noch nie waren sich amerikanische Frauen und Männer derart uneinig darüber wie heute, wer ins Weisse Haus einziehen soll.
Der amerikanische Traum lebt. Vielleicht nicht überall in den Vereinigten St… [+8887 chars]",,de,'Donald Trump'
https://www.focus.de/politik/ausland/us-wahl/die-wahlkampf-analyse-von-thomas-jaeger-trump-lieferte-meisterleistung-doch-seine-groesste-schwachstelle-ist-nun-klar_id_260451197.html,https://www.focus.de/politik/ausland/us-wahl/die-wahlkampf-analyse-von-thomas-jaeger-trump-lieferte-meisterleistung-doch-seine-groesste-schwachstelle-ist-nun-klar_id_260451197.html,0,www.focus.de,Die Wahlkampf-Analyse von Thomas Jäger - Trump lieferte eine Meisterleistung – doch seine größte Schwachstelle ist nun klar,Donald Trump hatte im US-Wahlkampf drei zentrale Aufgaben vor sich. Ihm gelang dabei eine Meisterleistung des politischen Marketings. Doch so geschickt Trump durch den Wahlkampf gesurft ist - seine größte Schwachstelle ist jetzt unübersehbar.Von FOCUS-online-…,https://p6.focus.de/img/fotos/id_260451362/jaeger-trump.png?im=Crop%3D%280%2C1%2C1039%2C519%29%3BResize%3D%281200%2C627%29&impolicy=perceptual&quality=mediumHigh&hash=7f0a4debaeb4daba844b9397ffbd55f54e1a0014085031fa62da6d119eca65ad,2024-11-05T06:33:43Z,http://archive.md/20241105111643/https://www.focus.de/politik/ausland/us-wahl/die-wahlkampf-analyse-von-thomas-jaeger-trump-lieferte-meisterleistung-doch-seine-groesste-schwachstelle-ist-nun-klar_id_260451197.html,"<ul><li>
Kommentare</li><li>
E-Mail</li><li>
Teilen</li><li>
Mehr</li><li>
Twitter</li><li>
Drucken</li><li>
Feedback</li><li>
Fehler meldenSie haben einen Fehler gefunden?
Bitte markieren S… [+11664 chars]",,de,'Donald Trump'
https://www.focus.de/kultur/royals/fotos-zeigen-risse-und-schimmel-prinz-andrew-laesst-36-millionen-euro-anwesen-verwahrlosen_id_260448992.html,https://www.focus.de/kultur/royals/fotos-zeigen-risse-und-schimmel-prinz-andrew-laesst-36-millionen-euro-anwesen-verwahrlosen_id_260448992.html,0,www.focus.de,Risse und Schimmel - Prinz Andrews 36 Millionen-Euro-Anwesen verwahrlost zum Rumpel-Haus,"König Charles' geschasster Bruder Prinz Andrew wohnt in der Royal Lodge, doch drum kümmern will er sich scheinbar nicht. Aktuelle Aufnahmen dokumentieren einen desolaten Zustand des wertwollen Anwesens.",https://p6.focus.de/img/fotos/id_260449769/imago116755968.jpg?im=Crop%3D%280%2C332%2C3466%2C1730%29%3BResize%3D%281200%2C627%29&impolicy=perceptual&quality=mediumHigh&hash=23a72d9ae7b51c94461e1b48ea769df74419ec54bba770dbfb866e169607c87d,2024-11-05T07:06:00Z,,"<ul><li>
Kommentare</li><li>
E-Mail</li><li>
Teilen</li><li>
Mehr</li><li>
Twitter</li><li>
Drucken</li><li>
Feedback</li><li>
Fehler meldenSie haben einen Fehler gefunden?
Bitte markieren S… [+3040 chars]",,de,'Jeffrey Epstein'
https://www.n-tv.de/politik/politik_person_der_woche/Lindner-macht-den-Lambsdorff-mit-einem-Trumpf-im-Armel-article25336576.html,https://www.n-tv.de/politik/politik_person_der_woche/Lindner-macht-den-Lambsdorff-mit-einem-Trumpf-im-Armel-article25336576.html,0,www.n-tv.de,"Person der Woche: Lindner: Wird der FDP-Chef zu ""Graf Christian Lindnersdorff""?","Der FDP-Chef macht Ernst. Lindner hat nicht nur ein Scheidungspapier vorgelegt, sondern auch einen Macht-Plan in der Hinterhand. Wenn die Ampel-Koalition ihm im November nicht folgt, zieht er den entscheidenden Trumpf. Dann könnte in vier Monaten neu gewählt …",https://bilder3.n-tv.de/img/incoming/crop25336578/0881322763-cImg_16_9-w1200/489425501.jpg,2024-11-05T09:09:37Z,,"Der FDP-Chef macht Ernst. Lindner hat nicht nur ein Scheidungspapier vorgelegt, sondern auch einen Macht-Plan in der Hinterhand. Wenn die Ampel-Koalition ihm im November nicht folgt, zieht er den ent… [+5473 chars]",,de,'Christian Lindner'
https://www.tagesspiegel.de/gesellschaft/konigshaus-geschenk-von-charlotte-prinz-william-tragt-papa-armband-12651854.html,https://www.tagesspiegel.de/gesellschaft/konigshaus-geschenk-von-charlotte-prinz-william-tragt-papa-armband-12651854.html,0,www.tagesspiegel.de,Königshaus: Geschenk von Charlotte: Prinz William trägt „Papa“-Armband,"Großbritanniens Thronfolger besucht Südafrika, um einen Umweltpreis zu verleihen. Am Handgelenk trägt er ein persönliches Erinnerungsstück.",https://www.tagesspiegel.de/images/12651851/alternates/BASE_16_9_W1400/1730827041000/prinz-william-in-kapstadt.jpeg,2024-11-05T17:17:21Z,,Prinz William (42) hat bei einem Besuch in Südafrika ein besonderes Erinnerungsstück an zu Hause getragen. Der britische Thronfolger hatte ein Freundschaftsarmbändchen mit dem Schriftzug Papa am Hand… [+1219 chars],,de,'Prinz William'
https://www.welt.de/politik/deutschland/article254336420/Bundesregierung-Habeck-schliesst-Einigung-auf-Basis-des-Lindner-Papiers-aus.html,https://www.welt.de/politik/deutschland/article254336420/Bundesregierung-Habeck-schliesst-Einigung-auf-Basis-des-Lindner-Papiers-aus.html,0,www.welt.de,Habeck schließt Einigung auf Basis des Lindner-Papiers aus,"FDP-Vize Wolfgang Kubicki stellt ein mögliches Ende der Koalition mit Worten in Aussicht, die an gescheiterte Jamaika-Verhandlungen erinnern. Kanzler Scholz hält eine Einigung noch für möglich. Für Habeck ist das Lindner-Papier keine Lösung. Alle Entwicklunge…",https://img.welt.de/img/politik/deutschland/mobile254371522/4427938227-ci16x9-w1200/Habeck-und-Lindner.jpg,2024-11-05T21:45:00Z,http://archive.md/20241106083257/https://www.welt.de/politik/deutschland/article254336420/Bundesregierung-Habeck-schliesst-Einigung-auf-Basis-des-Lindner-Papiers-aus.html,"FDP-Vize Wolfgang Kubicki stellt ein mögliches Ende der Koalition mit Worten in Aussicht, die an gescheiterte Jamaika-Verhandlungen erinnern. Kanzler Scholz hält eine Einigung noch für möglich. Für H… [+20302 chars]",,de,'Wolfgang Kubicki'
https://www.stern.de/lifestyle/leute/prinz-william-traegt--papa--armband-von-seiner-tochter-35201966.html,https://www.stern.de/lifestyle/leute/prinz-william-traegt--papa--armband-von-seiner-tochter-35201966.html,0,www.stern.de,Royals: Prinz William überrascht mit besonderem Schmuckstück,"Großbritanniens Thronfolger Prinz William besucht Südafrika, um einen Umweltpreis zu verleihen. Am Handgelenk trägt er ein persönliches Erinnerungsstück.",https://image.stern.de/35201968/t/1i/v2/w1440/r1.7778/-/prinz-william.jpg,2024-11-06T08:15:00Z,,"Kopiere den aktuellen Link
Großbritanniens Thronfolger Prinz William besucht Südafrika, um einen Umweltpreis zu verleihen. Am Handgelenk trägt er ein persönliches Erinnerungsstück.
Prinz William ha… [+1282 chars]",,de,'Prinz William'
https://www.bild.de/unterhaltung/royals-adel/prinz-william-auf-dienstreise-seine-armband-botschaft-ist-bezaubernd-672b0f3555c3fe1e8fbe6ab9,https://www.bild.de/unterhaltung/royals-adel/prinz-william-auf-dienstreise-seine-armband-botschaft-ist-bezaubernd-672b0f3555c3fe1e8fbe6ab9,0,www.bild.de,Prinz William auf Dienstreise - Seine Armband-Botschaft ist bezaubernd,Prinz William trägt ein von Tochter Charlotte gebasteltes Armband als süße Erinnerung an seine Familie während seiner Reise nach Südafrika.,"https://images.bild.de/672b0f3555c3fe1e8fbe6ab9/302da27e404a03765ff83874754c2880,21165bd3?w=1280",2024-11-06T08:33:58Z,,"Hier Papa, das ist für dich - ein selbst gebasteltes Armband von der Tochter, eine kleine Geste, die jedes Papa-Herz zum Schmelzen bringt. Auch Prinz William hatte einen Glücksbringer im Gepäck, als … [+2415 chars]",,de,'Prinz Louis'
