index,url,valid,domain,title,description,image,published,archive,content,quote,language,keyword
https://www.nzz.ch/wissenschaft/viele-tiernamen-seien-rassistisch-sagen-einige-wissenschafter-und-fordern-arten-gar-nicht-mehr-nach-menschen-zu-benennen-ld.1759331,https://www.nzz.ch/wissenschaft/viele-tiernamen-seien-rassistisch-sagen-einige-wissenschafter-und-fordern-arten-gar-nicht-mehr-nach-menschen-zu-benennen-ld.1759331,0,www.nzz.ch,"Viele Tiernamen seien rassistisch, sagen einige Wissenschafter und fordern, Arten gar nicht mehr nach Menschen zu benennen","Neu beschriebene Arten werden häufig nach ihren Entdeckern oder anderen Persönlichkeiten benannt. Nun tobt unter Biologen ein Streit: Manche Forscher fordern, zeitgenössische Moral in die Benennungspraxis einfliessen zu lassen. Fachleute widersprechen vehemen…","https://img.nzz.ch/2023/10/05/32676478-b2fc-40a7-922f-63b8348063df.jpeg?width=1200&height=675&fit=bound&quality=75&auto=webp&crop=1440,810,x0,y154&wmark=nzz",2023-10-09T03:30:00Z,,"Die Motte Neopalpa donaldtrumpi ist Trägerin einer blonden Kopfbedeckung und besonders kleiner Genitalien.
Was haben Jackie Chan, Taylor Swift, Adolf Hitler und Donald Trump gemeinsam? Ihnen zu Ehre… [+7529 chars]",,de,'nan nan'
https://www.faz.net/podcasts/f-a-z-podcast-fruehdenker/faz-fruehdenker-krieg-in-israel-und-wahlen-in-bayern-und-hessen-19229937.html,https://www.faz.net/podcasts/f-a-z-podcast-fruehdenker/faz-fruehdenker-krieg-in-israel-und-wahlen-in-bayern-und-hessen-19229937.html,0,www.faz.net,F.A.Z. Frühdenker: Wie schwer wiegt Faesers Wahl-Debakel für die Ampel?,Israel befindet sich im Kriegszustand. In Bayern kann Markus Söder Ministerpräsident bleiben – und in Hessen Boris Rhein. Der F.A.Z.-Newsletter.,https://media1.faz.net/ppmedia/aktuell/2892365062/1.9229805/facebook_teaser_fplus/schwerer-gang-guter-stand.jpg,2023-10-09T04:12:00Z,,"Das Wichtigste für Sie an diesem Montag:
1. Israel erwartet langen und schweren Krieg2. Deutsche Palästinenser-Hilfe gestoppt3. Rhein kann sich in Hessen Partner aussuchen4. Söder will weiter mit Fr… [+790 chars]",,de,'Boris Rhein'
https://www.zeit.de/video/2023-10/6338692889112/landtagswahl-in-hessen-cdu-ist-deutlicher-sieger-afd-zweitstaerkste-kraft,https://www.zeit.de/video/2023-10/6338692889112/landtagswahl-in-hessen-cdu-ist-deutlicher-sieger-afd-zweitstaerkste-kraft,0,www.zeit.de,"Landtagswahl in Hessen: CDU ist deutlicher Sieger, AfD zweitstärkste Kraft","Laut dem vorläufigen Endergebnis ist die CDU von Boris Rhein mit 34,6 Prozent der deutliche Sieger in Hessen. Zweitstärkste Kraft im Landtag ist die AfD mit 18,4 Prozent.",,2023-10-09T07:59:02Z,,"When browsing with ads:
We collect personal data and also transmit it to third-party providers
 that help us improve and finance our digital content. Some of the information stored on your device, … [+821 chars]",,de,'Boris Rhein'
https://www.stern.de/lifestyle/leute/vip-news--mit-kindheitsbildern-gratuliert-heidi-klum-ihrer-tochter-zum-geburtstag-3205306.html,https://www.stern.de/lifestyle/leute/vip-news--mit-kindheitsbildern-gratuliert-heidi-klum-ihrer-tochter-zum-geburtstag-3205306.html,0,www.stern.de,Leute von heute: Heidi Klum: Mit süßen Kindheitsbildern gratuliert sie Tochter Lou zum Geburtstag,Zum 14. Geburtstag ihrer Tochter Lou hat Heidi Klum gleich mehrere gemeinsame Kindheitsbilder veröffentlicht. Diese und weitere Promi-Meldungen in den VIP-News.,https://image.stern.de/33895742/t/BP/v2/w1440/r1.7778/-/heidi-klum-teaser.jpg,2023-10-09T09:10:00Z,,"Von ""A"" wie Angelina Jolie oder Amal Clooney über ""H"" wie Heidi Klum und Helene Fischer bis ""Z"" wie Zac Efron und Zara Tindall: In der Welt der Promis ist immer etwas los. Ob sich nun neue Paare find… [+494 chars]",,de,'Heidi Klum'
https://www.diepresse.com/17728173/schrieb-ein-ghostwriter-fuer-krimiautorin-camilla-laeckberg,https://www.diepresse.com/17728173/schrieb-ein-ghostwriter-fuer-krimiautorin-camilla-laeckberg,0,www.diepresse.com,Schrieb ein Ghostwriter für Krimiautorin Camilla Läckberg?,"Camilla Läckberg wird gern als Königin des Nordic Noir bezeichnet. Derzeit bekommt ihr Thron allerdings (neue) Risse: Sie soll heimlich einen Ghostwriter eingesetzt haben, wie eine Datenanalyse ergab. Ihren Lektor.",https://img.diepresse.com/public/incoming/owvjwh-STOCKHOLM-20230220-Camilla-L%C3%A4ckberg-vid-pressdag-f%C3%B6r-nya-tv-serien-Strandhotellet-.-STOCKHOLM-SVERIGE-x10090x-STOCKH/alternates/DPR_SOCIAL_MAGAZIN/STOCKHOLM%2020230220%20Camilla%20L%C3%A4ckberg%20vid%20pressdag%20f%C3%B6r%20nya%20tv-serien%20Strandhotellet%20.%20STOCKHOLM%20SVERIGE%20x10090x%20%2a%2a%2a%20STOCKH,2023-10-09T11:35:27Z,,"Camilla Läckberg wird gern als Königin des Nordic Noir bezeichnet. Derzeit bekommt ihr Thron allerdings (neue) Risse: Sie soll heimlich einen Ghostwriter eingesetzt haben, wie eine Datenanalyse ergab… [+2844 chars]",,de,'Königin Camilla'
https://www.dwdl.de/nachrichten/95031/finale_the_crownstaffel_startet_mitte_november/,https://www.dwdl.de/nachrichten/95031/finale_the_crownstaffel_startet_mitte_november/,0,www.dwdl.de,"Finale ""The Crown""-Staffel startet Mitte November","Weil Netflix in der sechsten und letzten Staffel von ""The Crown"" auch den tragischen Tod von Prinzessin Diana thematisieren wird, hat es bereits viele Schlagzeilen gegeben. Nun steht fest, wann die finalen Folgen veröffentlicht werden.",https://www.dwdl.de/images/1696868520_the-crown-staffel-5.png,2023-10-09T16:18:00Z,,"Netflix hat einen Veröffentlichungstermin für die finale Staffel von ""The Crown"" bekanntgegeben. Der sechste Durchlauf der Drama-Serie wird dabei zweigeteilt: Die Folgen eins bis vier werden bereits … [+1900 chars]",,de,'Prinzessin Diana'
https://www.faz.net/aktuell/politik/inland/nach-erfolg-bei-hessen-wahl-boris-rhein-hat-freie-hand-19231602.html,https://www.faz.net/aktuell/politik/inland/nach-erfolg-bei-hessen-wahl-boris-rhein-hat-freie-hand-19231602.html,0,www.faz.net,Nach Erfolg bei Hessen-Wahl: Boris Rhein hat freie Hand,Die hessische CDU will nach ihrem Wahlerfolg mehr Einfluss und mehr Ministerien. Sie kann sich den Koalitionspartner aussuchen. Das Misstrauen gegenüber den Grünen ist stärker als noch vor wenigen Jahren.,https://media0.faz.net/ppmedia/aktuell/2571241220/1.9231598/facebook_teaser_fplus/boris-rhein-auf-einer.jpg,2023-10-09T20:00:57Z,,"Bevor Boris Rhein am frühen Montagmorgen ins Flugzeug nach Berlin stieg, um an der Bundesvorstandssitzung der CDU teilzunehmen, feierte er am Abend noch seinen Wahlsieg im Landtag in Wiesbaden. Zunäc… [+1210 chars]",,de,'Boris Rhein'
https://www.tagesschau.de/ausland/asien/palaestinenser-eu-hilfen-100.html,https://www.tagesschau.de/ausland/asien/palaestinenser-eu-hilfen-100.html,0,www.tagesschau.de,Hamas-Angriff auf Israel: EU streitet über Hilfszahlungen für Palästinenser,"Die EU ist der größte Geldgeber für die Palästinenser. Nach dem Hamas-Angriff auf Israel entbrennt ein Streit, ob die Finanzhilfen eingefroren werden sollen. Auch Deutschlands Ankündigung, die Mittel vorerst auszusetzen, sorgt für Kritik.",https://images.tagesschau.de/image/ef641c31-66db-4260-ad53-8878b5b7ed38/AAABixgwr9E/AAABibBxqrQ/16x9-1280/eu-kommission-248.jpg,2023-10-10T06:05:26Z,,"Stand: 10.10.2023 08:05 Uhr
Die EU ist der größte Geldgeber für die Palästinenser. Nach dem Hamas-Angriff auf Israel entbrennt ein Streit, ob die Finanzhilfen eingefroren werden sollen. Auch Deutsch… [+4544 chars]",,de,'nan nan'
