index,url,valid,domain,title,description,image,published,archive,content,quote,language,keyword
https://www.sueddeutsche.de/medien/journalismus-pulitzer-preis-nahostkrieg-1.6999951,https://www.sueddeutsche.de/medien/journalismus-pulitzer-preis-nahostkrieg-1.6999951,0,www.sueddeutsche.de,Pulitzer-Preise: Vom Schrecken des Krieges bis zum Imperium von Elon Musk,"Pulitzer sind prestigeträchtigsten Journalistenpreise der Welt. 2024 steht der Nahostkrieg im Fokus. Gewonnen haben die ""Washington Post"", ""New York Times"" und die Nachrichtenagentur ""Reuters"".",https://www.sueddeutsche.de/2024/05/07/9bee0a40-d7f6-44a5-ad36-6c74a6e5a7a3.jpeg?width=1200&height=675&fit=crop&fm=webp&q=60,2024-05-07T03:18:13Z,,"Schwere Themen gibt es in diesen unerfreulichen Zeiten dafür reichlich, eines davon versetzt die Columbia University gerade in Ausnahmezustand. Seit Tagen wird auf diesem Campus gegen Israels Krieg i… [+3365 chars]",,de,'Martin Luther King'
https://www.welt.de/politik/ausland/video251401702/New-York-Fuer-Donald-Trump-wird-es-langsam-eng.html,https://www.welt.de/politik/ausland/video251401702/New-York-Fuer-Donald-Trump-wird-es-langsam-eng.html,0,www.welt.de,Für Donald Trump wird es langsam eng,"Der Prozess gegen Donald Trump im Zusammenhang mit Schweigegeldzahlungen an die Pornodarstellerin Stormy Daniels kommt in eine entscheidende Phase: Die Staatsanwaltschaft präsentiert ihre „Joker“, Zeugen also, die die Jury überzeugen sollen, Trump für schuldi…",https://img.welt.de/img/politik/ausland/mobile251401742/7531352967-ci16x9-w1200/461482930-jpg.jpg,2024-05-07T06:04:25Z,,"Die WELT als ePaper: Die vollständige Ausgabe steht Ihnen bereits am Vorabend zur Verfügung so sind Sie immer hochaktuell informiert. Weitere Informationen: http://epaper.welt.de 
 Der Kurz-Link die… [+49 chars]",,de,'Donald Trump'
https://orf.at/stories/3356582/,https://orf.at/stories/3356582/,0,orf.at,Stars in voller Blüte bei Met Gala 2024,"Prominente wie Zendaya, Jennifer Lopez, Ariana Grande und Kim Kardashian haben versucht, einander bei der Met Gala in New York in der Nacht auf Dienstag in einem Potpourri kreativer Stylings zu übertreffen. Das Spektakel stand unter dem Motto „The Garden of T…",https://ibs.orf.at/news?image=https%3A%2F%2Fassets.orf.at%2Fmims%2F2024%2F19%2F96%2Fcrops%2Fw%3D1200%2Ch%3D630%2Cq%3D75%2F2197802_master_833396_met_gala_2024_neu_r.jpg%3Fs%3D90d239db2186d7269a86fd4c78dad0c339f8c089,2024-05-07T06:39:01Z,,"Mit bunten Roben voller Blumen, Perlen, Geweihe und Schmetterlingsmotiven verwandelten die Prominenten das New Yorker Metropolitan Museum in eine Art Märchenwald, der die Ausstellung Sleeping Beautie… [+5553 chars]",,de,'Kim Kardashian'
"https://www.gamestar.de/artikel/furiosa-mad-max-erste-reaktionen,3412936.html","https://www.gamestar.de/artikel/furiosa-mad-max-erste-reaktionen,3412936.html",0,www.gamestar.de,Furiosa - Erste Reaktionen versprechen für das Mad-Max-Prequel ein bombastisches Action-Feuerwerk,"Erste Kritiker konnten bereits den neuen Film von George Miller mit
Anya Taylor-Joy und Chris Hemsworth in den Hauptrollen sehen und sind voll des Lobes.",https://images.cgames.de/images/gamestar/4/furiosa-pressestimmen_6289680.jpg,2024-05-07T09:27:00Z,,"2:38
Furiosa: Der zweite Trailer zum neuen Mad-Max-Film entfesselt ein wahres Action-Feuerwerk
Am 23. Mai 2024 hat das lange Warten ein Ende und Furiosa: A Mad Max Saga startet in den deutschen Kin… [+2889 chars]",,de,'Anya Taylor-Joy'
https://www.telepolis.de/features/Die-Ukraine-gegen-Donald-Trump-9710562.html,https://www.telepolis.de/features/Die-Ukraine-gegen-Donald-Trump-9710562.html,0,www.telepolis.de,Die Ukraine gegen Donald Trump,US-Wahlkampf im Jahr 2016 von Streit um Einflussnahme überschattet. Die Ukraine spielte bei diesen Vorwürfen eine zentrale Rolle. Mitten dabei. Ein späterer Whistleblower. (Teil 3),https://heise.cloudimg.io/bound/1200x1200/q85.png-lossy-85.webp-lossy-85.foil1/_www-heise-de_/imgs/18/4/5/8/6/0/5/0/shutterstock_566768119-6fd83d361a1dd377.jpeg,2024-05-07T10:00:00Z,http://archive.md/20240507144421/https://www.telepolis.de/features/Die-Ukraine-gegen-Donald-Trump-9710562.html,"Bild: Savvapanf Photo, Shutterstock.com
US-Wahlkampf in 2016 von Streit um Einflussnahme überschattet. Ukraine spielte zentrale Rolle. Mitten dabei: ein späterer Whistleblower. (Teil 3)
Während der… [+16600 chars]",,de,'Donald Trump'
https://www.focus.de/politik/ausland/trump-weiterhin-auf-konfrontationskurs-vor-gericht-richter-warnt-und-droht-sogar-mit-gefaengnis_id_259922447.html,https://www.focus.de/politik/ausland/trump-weiterhin-auf-konfrontationskurs-vor-gericht-richter-warnt-und-droht-sogar-mit-gefaengnis_id_259922447.html,0,www.focus.de,Trump weiterhin auf Konfrontationskurs vor Gericht - Richter warnt und droht sogar mit Gefängnis,"In einem beispiellosen Gerichtsverfahren droht ein New Yorker Richter Donald Trump mit Gefängnisstrafe, sollte dieser sich weiterhin über ein Maulkorb-Urteil hinwegsetzen.",https://p6.focus.de/img/politik/ausland/id_259922581/der-ehemalige-us-praesident-donald-trump-verlaesst-das-gerichtsgebaeude-in-manhattan.jpg?im=Crop%3D%280%2C0%2C3464%2C1732%29%3BResize%3D%281200%2C627%29&impolicy=perceptual&quality=mediumHigh&hash=b12d468aca11ab017b0ce7b6b3a6c84cd9ce78e4dd3a309e5e30da42a7c46900,2024-05-07T11:13:50Z,,"In einem beispiellosen Gerichtsverfahren droht ein New Yorker Richter Donald Trump mit Gefängnisstrafe, sollte dieser sich weiterhin über ein Maulkorb-Urteil hinwegsetzen.Richter Juan Merchan, der de… [+1793 chars]",,de,'Donald Trump'
https://www.bild.de/unterhaltung/stars-und-leute/met-gala-und-ihre-highlights-kim-kardashian-mit-mini-taille-zendaya-mit-boesem-blick-6639cbfaeffef52ea5e7d2c6,https://www.bild.de/unterhaltung/stars-und-leute/met-gala-und-ihre-highlights-kim-kardashian-mit-mini-taille-zendaya-mit-boesem-blick-6639cbfaeffef52ea5e7d2c6,0,www.bild.de,Wespentaille bei der Met-Gala - Hier bleibt nicht nur Kim die Luft weg!,Kim Kardashian erschien auf der Met-Gala am Montag mit einem extrem schmalen Taillchen. Zendaya überraschte mit Grimmig-Blick. Und Jennifer Lopez kam ohne Ben Affleck.,"https://images.bild.de/6639cbfaeffef52ea5e7d2c6/cac20cd5c5589783509e67be23b125b8,d53b38fe?w=1280",2024-05-07T13:56:23Z,,"Ist das noch eine Taille oder schon ein Gesundheitsproblem? Als Kim Kardashian (43) am Montag auf der Met-Gala in New York erschien, staunten die Gäste nicht schlecht: Ihre Kurven liefen in einer so … [+6803 chars]",,de,'Kim Kardashian'
https://www.stern.de/digital/technik/krim-bruecke---hoher-propaganda-wert--aber-nicht-entscheidend-34691960.html,https://www.stern.de/digital/technik/krim-bruecke---hoher-propaganda-wert--aber-nicht-entscheidend-34691960.html,0,www.stern.de,"Krieg in der Ukraine: Angriff auf die Krim-Brücke: Hoher Propaganda-Wert, aber nicht mehr kriegsentscheidend","Satelliten Aufnahmen zeigen die leere Krim-Brücke: Putin schickt den militärischen Bedarf seit Wochen nicht mehr über diese Route. Die Russen haben auf dem Festland eine Eisenbahnlinie gebaut, um so ihre Truppen zu versorgen.",https://image.stern.de/34691962/t/Us/v1/w1440/r1.7778/-/pic-krim-bruecke.jpg,2024-05-07T14:35:00Z,,"In der Diskussion um den Taurus wird immer wieder die Krim-Brücke genannt, als würde der Verlust von Putins Bauwerk den Kriegsverlauf entscheidend verändern können. Immer wieder war zu hören, dass di… [+4768 chars]",,de,'Gorbatschow'
https://www.bild.de/sport/mehr-sport/gisele-buendchen-tief-enttaeuscht-nach-brady-sendung-663a3251d52d1e706933aeca,https://www.bild.de/sport/mehr-sport/gisele-buendchen-tief-enttaeuscht-nach-brady-sendung-663a3251d52d1e706933aeca,0,www.bild.de,Was ihr gar nicht gefiel - Gisele „tief enttäuscht“ nach Brady-Sendung!,Tom Brady wurde am Sonntag in einer großen Netflix-Show verspottet. Seine Ex-Frau Gisele Bündchen soll „tief enttäuscht“ sein.,"https://images.bild.de/663a3251d52d1e706933aeca/20c8a5d338d34f25b0dca23be45185c0,121ade97?w=1280",2024-05-07T14:57:07Z,,"Über diese Sendung redet die USA. Tom Brady (46) wurde am Sonntag in einer großen Netflix-Show verspottet. 
Der Streamingdienst hatte dutzende Stars ins Kia Forum in Inglewood, Los Angeles, geladen,… [+2428 chars]",,de,'Tom Brady'
https://www.kino.de/film/megalopolis-2023/news/hollywood-legende-arbeitete-daran-40-jahre-erster-teaser-zum-sci-fi-film-der-kein-studio-findet/,https://www.kino.de/film/megalopolis-2023/news/hollywood-legende-arbeitete-daran-40-jahre-erster-teaser-zum-sci-fi-film-der-kein-studio-findet/,0,www.kino.de,"Hollywood-Legende arbeitete daran 40 Jahre: Erster Teaser zum Sci-Fi-Film, der kein Studio findet",Regie-Legende Francis Ford Coppola hat das erste offizielle Bild und einen ersten Teaser-Clip zu seinem ambitionierten Sci-Fi-Film „Megalopolis“ enthüllt.,https://crops.giga.de/6d/62/7a/649ad343e885d8ea187d8e6608_YyAyMzUzeDEzMjMrMTk2KzExMAJyZSAxOTIwIDEwODADNjI2YTQ4ZGE3ZTA=.jpg,2024-05-07T15:21:42Z,,"Regie-Legende Francis Ford Coppola hat das erste offizielle Bild und einen ersten Teaser-Clip zu seinem ambitionierten Sci-Fi-Film „Megalopolis“ enthüllt.
Zu seinen besten Tagen, am Höhepunkt seiner… [+4370 chars]",,de,'Francis Ford Coppola'
https://www.morgenpost.de/vermischtes/stars-und-promis/article242280090/US-Star-Kim-Kardashian-in-Hamburg.html,https://www.morgenpost.de/vermischtes/stars-und-promis/article242280090/US-Star-Kim-Kardashian-in-Hamburg.html,0,www.morgenpost.de,US-Star Kim Kardashian in Hamburg,Der Reality-TV-Star Kim Kardashian ist auf Stippvisite in Europa. Und ist eigens für einen Kurz-Auftritt auf der Digital- und Marketingmesse OMR nach Hamburg gekommen.,https://img.sparknews.funkemedien.de/242280088/242280088_1715096262_v16_9_1600.jpeg,2024-05-07T15:35:26Z,,"Hamburg. Der Reality-TV-Star Kim Kardashian ist auf Stippvisite in Europa. Und ist eigens für einen Kurz-Auftritt auf der Digital- und Marketingmesse OMR nach Hamburg gekommen.
Der amerikanische Rea… [+1235 chars]",,de,'Kim Kardashian'
https://www.bild.de/unterhaltung/stars-und-leute/kim-kardashian-nach-der-met-gala-in-new-york-mischt-sie-hamburg-auf-6639d674effef52ea5e7d36a,https://www.bild.de/unterhaltung/stars-und-leute/kim-kardashian-nach-der-met-gala-in-new-york-mischt-sie-hamburg-auf-6639d674effef52ea5e7d36a,0,www.bild.de,Nach der Met ist vor dem OMR - Kim Kardashian mischt Hamburg auf,Vom Oscar der Mode in die Messehallen von Hamburg! Reality-Ikone Kim Kardashian ist zu einem Blitzbesuch in Deutschland eingetroffen,"https://images.bild.de/6639d674effef52ea5e7d36a/c6e8cbcf9493a495d11bb356f69a0c05,8d37a46d?w=1280",2024-05-07T15:57:49Z,,"Vom Oscar der Mode ab in die Messehallen von Hamburg! Reality-Ikone 
Kim Kardashian (43) reiste zum Konferenz-Quickie nach Deutschland. 
Die schillernde Milliardärin lief eben noch in maßgeschneide… [+2698 chars]",,de,'Kim Kardashian'
https://www.stern.de/news/ex-pornodarstellerin-stormy-daniels-sagt-in-schweigegeld-prozess-gegen-trump-aus-34693088.html,https://www.stern.de/news/ex-pornodarstellerin-stormy-daniels-sagt-in-schweigegeld-prozess-gegen-trump-aus-34693088.html,0,www.stern.de,Ex-Pornodarstellerin Stormy Daniels sagt in Schweigegeld-Prozess gegen Trump aus,"Im Prozess gegen Ex-Präsident Donald Trump um die Vertuschung einer Schweigegeldzahlung vor der Wahl 2016 hat am Dienstag die frühere Pornodarstellerin Stormy Daniels ausgesagt. Die 45-Jährige, die mit bürgerlichem Namen Stephanie Clifford heißt und das Schwe…",https://image.stern.de/34693090/t/9j/v1/w1440/r1.7778/-/07--donald-trump-und-stormy-daniels---aeb07fa8709c4c47.jpg,2024-05-07T16:31:02Z,,"Im Prozess gegen Ex-Präsident Donald Trump um die Vertuschung einer Schweigegeldzahlung vor der Wahl 2016 hat am Dienstag die frühere Pornodarstellerin Stormy Daniels ausgesagt. Die 45-Jährige, die m… [+1101 chars]",,de,'Stormy Daniels'
https://www.jungewelt.de/artikel/474959.problembär-des-tages-commander.html,https://www.jungewelt.de/artikel/474959.problembär-des-tages-commander.html,0,www.jungewelt.de,Porträt: Problembär des Tages: Commander,"Kristi Noem, mögliche Running Mate für Donald Trump, hat vorgeschlagen, Bidens Hund Commander zu erschießen. Amerika tobt. Commander schweigt.",https://www.jungewelt.de/img/1100/194672.jpg,2024-05-07T17:41:49Z,,"Jill und Joe leben in einem beschaulichen Haus an der Pennsylvania Avenue, inmitten von Washington. Allein nicht, doch einsam. Problemkind Hunter hält die Welt auf Trab, Problemhund Commander musste … [+1584 chars]",,de,'Hunter Biden'
https://www.bild.de/unterhaltung/stars-und-leute/kim-kardashian-bei-der-omr-free-palestine-rufe-stoerten-auftritt-663a752c39624b47db8f0a8b,https://www.bild.de/unterhaltung/stars-und-leute/kim-kardashian-bei-der-omr-free-palestine-rufe-stoerten-auftritt-663a752c39624b47db8f0a8b,0,www.bild.de,Zwischenfall in Hamburg - Israel-Hasserin stört Auftritt von Kim Kardashian,"Israel-Hasserin störte beim glamourösesten und mit Spannung erwarteten Gast auf der Messe!Foto: BrauerPhotos / O.Walterscheid, Christian Charisius/dpa","https://images.bild.de/663a752c39624b47db8f0a8b/620449db745070a60b8113cd6b993f23,d2aefac1?w=1280",2024-05-07T19:44:10Z,,"Zwischenfall beim glamourösesten und mit Spannung erwarteten Gast auf der OMR-Messe: Beim Auftritt von Reality-Star 
Kim Kardashian (43) störte eine Israel-Hasserin die Veranstaltung. Nach der Met G… [+1179 chars]",,de,'Kim Kardashian'
https://t3n.de/news/kim-kardashian-omr-interview-1623240/,https://t3n.de/news/kim-kardashian-omr-interview-1623240/,0,t3n.de,Kim Kardashian war auf der OMR – aber was hat sie eigentlich erzählt?,"Ist die Nachricht der OMR, dass Kim Kardashian da war? Allein ihre Anwesenheit sorgt für Schlagzeilen – der Blick auf ihre Aussagen auf der Bühne geht allerdings verloren. Dabei war ihr Auftritt eine Lehrstunde für das Thema Authentizität.
weiterlesen auf t3n…",https://t3n.de/news/wp-content/uploads/2024/05/461812813.jpg,2024-05-08T08:38:45Z,,"Es war das Thema des ersten Tages der Marketing-Konferenz OMR: US-Star Kim Kardashian war da. Während über zehn Stunden auf vier Bühnen Programm geboten wird, interessiert besonders der knapp 45 Minu… [+3867 chars]",,de,'Kim Kardashian'
https://www.pcgames.de/Dwayne-The-Rock-Johnson-Person-135442/News/Marvel-Apocalypse-Casting-1447035/,https://www.pcgames.de/Dwayne-The-Rock-Johnson-Person-135442/News/Marvel-Apocalypse-Casting-1447035/,0,www.pcgames.de,"Dwayne ""The Rock"" Johnson vor Mega-Comeback als Marvel-Bösewicht? Das wäre der absolute Hammer!","""The Rock"" als Comic-Star? Trotz des Mega-Flops Black Adam scheint man diese Idee in Hollywood wieder durch den Raum zu werfen.",https://www.pcgames.de/screenshots/original/2023/07/040f417ed99d5fe08d59e19ecb_YyAxODE0eDEwMjErNzQxKzcCcmUgMTY4MCA5NDQDYzIwZjc5NTA1MWM--pc-games_artwork1.jpg,2024-05-08T09:38:00Z,,"Auch 2024 ist Dwayne ""The Rock"" Johnson wieder in aller Munde. Der Hollywood-Star stolziert zwar schon seit über zwei Jahrzehnten von Blockbuster zu Blockbuster, doch das hält den 52-Jährigen nicht d… [+2869 chars]",,de,'Dwayne Johnson'
https://www.sueddeutsche.de/panorama/promis-kim-kardashian-omr-hamburg-met-gala-1.7043892,https://www.sueddeutsche.de/panorama/promis-kim-kardashian-omr-hamburg-met-gala-1.7043892,0,www.sueddeutsche.de,Leute: Eine Ausrede namens Hamburg,Kim Kardashian flieht vor einer After-Show-Party nach Deutschland. William Shatner würde auch mit 93 Jahren noch Captain Kirk spielen. Und Courteney Cox wird nostalgisch.,https://www.sueddeutsche.de/2024/05/08/001c06e8-fff4-4426-9174-dcfef90992bf.jpeg?width=1200&height=675&fit=crop&fm=webp&q=60,2024-05-08T09:51:48Z,,"Kim Kardashian, 43, Reality-TV-Star, entflieht der Realität. Für einen Auftritt auf der Digitalmesse OMR kam sie aus den USA nach Hamburg. Dieser Auftritt sei für sie perfekt gewesen, um nicht auf di… [+2177 chars]",,de,'Kim Kardashian'
https://www.telepolis.de/features/Ukraine-und-die-US-Demokraten-Wie-Joe-Biden-einen-Whistleblower-zum-Schweigen-brachte-9712234.html,https://www.telepolis.de/features/Ukraine-und-die-US-Demokraten-Wie-Joe-Biden-einen-Whistleblower-zum-Schweigen-brachte-9712234.html,0,www.telepolis.de,Ukraine und die US-Demokraten: Wie Joe Biden einen Whistleblower zum Schweigen brachte,Welche Rolle spielte die Ukraine beim Amtsenthebungsverfahren gegen Trump. Der Whistleblower Telischenko könnte für Aufklärung sorgen. Doch er geriet selbst ins Visier. (Teil 4 und Schluss),https://heise.cloudimg.io/bound/1200x1200/q85.png-lossy-85.webp-lossy-85.foil1/_www-heise-de_/imgs/18/4/5/8/6/9/3/8/Bildschirmfoto_2024-05-08_um_11-d752e1dc31f7a166.png,2024-05-08T10:00:00Z,,"Kämpft um seine Reputation: Andrii Telischenko. Bild: privat
Die Ukraine und das Impeachment gegen Trump. Ein Whistleblower könnte für Aufklärung sorgen. Doch er geriet selbst ins Visier. (Teil 4 un… [+10247 chars]",,de,'Joe Biden'
https://www.welt.de/iconist/trends/article251411188/Kim-Kardashian-Was-kann-man-von-Kim-Kardashian-ueber-Selbstvermarktung-lernen.html,https://www.welt.de/iconist/trends/article251411188/Kim-Kardashian-Was-kann-man-von-Kim-Kardashian-ueber-Selbstvermarktung-lernen.html,0,www.welt.de,Was man von Kim Kardashian über Selbstvermarktung lernen kann,"Die Königin der Selbstvermarktung trat bei einer Digitalmarketingmesse in Hamburg als Rednerin auf. Tausende wollten hören, wie es Kim Kardashian nach ganz oben geschafft hat. Die verriet: Sie leide unter anderem am Hochstapler-Syndrom.",https://img.welt.de/img/iconist/trends/mobile251424074/6881351767-ci16x9-w1200/OMR-Festival-2024-In-Hamburg.jpg,2024-05-08T10:03:21Z,,"Was für ein Coup für eine Digitalmarketingmesse in Hamburg die Königin der Selbstvermarktung als Rednerin zu gewinnen und eine, die schwer beschäftigt ist. Der Realitystar und die mittlerweile millia… [+4562 chars]",,de,'Kim Kardashian'
https://www.kino.de/film/thor-4-love-and-thunder-2022/news/wurde-zur-parodie-meiner-selbst-marvel-star-nimmt-schuld-fuer-kritisierten-mcu-film-auf-sich/,https://www.kino.de/film/thor-4-love-and-thunder-2022/news/wurde-zur-parodie-meiner-selbst-marvel-star-nimmt-schuld-fuer-kritisierten-mcu-film-auf-sich/,0,www.kino.de,„Wurde zur Parodie meiner selbst“: Marvel-Star nimmt Schuld für kritisierten MCU-Film auf sich,In einem neuen Interview nahm Marvel- und Actionstar Chris Hemsworth die Schuld für den von Fans heftig kritisierten „Thor 4“ auf sich. Er habe es verbockt.,https://crops.giga.de/cf/7c/4e/2acfb4a7f8a3b9a283a169889f_YyAzNDg0eDE5NjArOCs4NQJyZSAxOTIwIDEwODADY2MyZmE4YjJhOTk=.jpg,2024-05-08T14:11:37Z,,"In einem neuen Interview nahm Marvel- und Actionstar Chris Hemsworth die Schuld für den von Fans heftig kritisierten „Thor 4“ auf sich. Er habe es verbockt.
Vor „The Marvels“, dem ersten richtigen F… [+4540 chars]",,de,'Chris Hemsworth'
https://www.kino.de/film/furiosa-a-mad-max-saga-2024/news/werdet-zeugen-des-finalen-trailers-zum-endzeit-action-highlight-furiosa-a-mad-max-saga/,https://www.kino.de/film/furiosa-a-mad-max-saga-2024/news/werdet-zeugen-des-finalen-trailers-zum-endzeit-action-highlight-furiosa-a-mad-max-saga/,0,www.kino.de,Werdet Zeugen des finalen Trailers zum Endzeit-Action-Highlight „Furiosa: A Mad Max Saga“,"Wenn sich Anya Taylor-Joy und Chris Hemsworth bis aufs Blut bekämpfen, dann wird Action neu definiert. Das verspricht der finale Trailer zu „Furiosa“.",https://crops.giga.de/c4/f1/25/d1229ca68cbf54f0a5c1cf38bc_YyAzMTM0eDE3NjMrNCs1MwJyZSAxOTIwIDEwODADYzFkMmFjNTBjZmI=.jpg,2024-05-08T22:53:31Z,,"Wenn sich Anya Taylor-Joy und Chris Hemsworth bis aufs Blut bekämpfen, dann wird Action neu definiert. Das verspricht der finale Trailer zu „Furiosa“.
Der Feind meines Feindes ist mein Feind: Etwas … [+4244 chars]",,de,'Anya Taylor-Joy'
https://www.faz.net/aktuell/politik/ausland/mike-johnson-repraesentantenhaus-blockiert-absetzung-19707311.html,https://www.faz.net/aktuell/politik/ausland/mike-johnson-repraesentantenhaus-blockiert-absetzung-19707311.html,0,www.faz.net,Von Demokraten gerettet: Repräsentantenhaus blockiert Absetzung von Mike Johnson,"Mit überwältigender Mehrheit hat das US-Repräsentantenhaus den Versuch der Republikanerin Marjorie Taylor Greene gestoppt, Sprecher Mike Johnson abzusetzen. Seine Retter waren die Demokraten.",https://media0.faz.net/ppmedia/aktuell/politik/1907268145/1.9707330/facebook_teaser/mike-johnson-spricht-nach-der.jpg,2024-05-08T23:58:40Z,,"Taylor Greene hatte Johnson nach dessen Unterstützung für ein neues Hilfspaket für die Ukraine Verrat am amerikanischen Volk vorgeworfen.
Die parteiübergreifende Unterstützung des Republikaners war … [+2179 chars]",,de,'Marjorie Taylor Greene'
https://www.nzz.ch/international/aufstand-gescheitert-speaker-johnson-behaelt-sein-amt-im-repraesentantenhaus-auch-dank-der-hilfe-der-demokraten-ld.1829794,https://www.nzz.ch/international/aufstand-gescheitert-speaker-johnson-behaelt-sein-amt-im-repraesentantenhaus-auch-dank-der-hilfe-der-demokraten-ld.1829794,0,www.nzz.ch,Aufstand gescheitert: Speaker Johnson behält sein Amt im US-Repräsentantenhaus – auch dank der Hilfe der Demokraten,"Die rechte Republikanerin Marjorie Taylor Greene scheitert im amerikanischen Repräsentantenhaus mit ihrem Versuch, Speaker Mike Johnson abzusetzen. Der hofft nun auf ein Ende der stetigen Sticheleien aus seiner Fraktion. Das ist wohl illusorisch.","https://img.nzz.ch/2024/05/09/b8b4b54e-9a85-402d-a3bb-75f0f4cf1c40.jpeg?width=1200&height=675&fit=bound&quality=75&auto=webp&crop=6524,3670,x0,y341&wmark=nzz",2024-05-09T01:29:35Z,,"Mike Johnson konnte sich als Speaker behaupten.
Mike Johnson bleibt Speaker des Repräsentantenhauses. Am Mittwoch überlebte der Republikaner, der seit vorigem Oktober an der Spitze der grossen Kamme… [+4533 chars]",,de,'Mike Johnson'
https://www.freitag.de/autoren/nora-beyer/metaverse-wie-paris-hilton-und-andere-stars-in-der-virtuellen-welt-reich-werden,https://www.freitag.de/autoren/nora-beyer/metaverse-wie-paris-hilton-und-andere-stars-in-der-virtuellen-welt-reich-werden,0,www.freitag.de,Sprung ins Virtuelle | Willkommen in Gucci Town: Wie Paris Hilton und andere Stars das Metaverse zu Geld machen,"Paris Hilton, Lady Gaga und Snoop Dogg: Sie alle tummeln sich im Metaverse. Dort veranstalten sie digitale Konzerte und verkaufen Kindern ihre Fanartikel. Tiktok und andere Plattformen wirken winzig neben dem gigantischen fiktiven Universum Pink. Glitzer. Ein…",https://www.freitag.de/autoren/nora-beyer/metaverse-wie-paris-hilton-und-andere-stars-in-der-virtuellen-welt-reich-werden/@@images/social_image,2024-05-09T02:00:00Z,,Pink. Glitzer. Einhörner. Klingt nach Zuckerwatten-Traum geschlechterstereotyper Prinzessinnen-Kindheiten. Ist aber die Welt von dem It-Girl der 2000er-Jahre: Paris Hilton. Die mittlerweile 43-jährig… [+7522 chars],,de,'Paris Hilton'
https://www.n-tv.de/politik/Repraesentantenhaus-laesst-Marjorie-Taylor-Greene-auflaufen-article24930299.html,https://www.n-tv.de/politik/Repraesentantenhaus-laesst-Marjorie-Taylor-Greene-auflaufen-article24930299.html,0,www.n-tv.de,Misstrauensvotum scheitert: Repräsentantenhaus lässt Marjorie Taylor Greene auflaufen,"Der Republikaner Mike Johnson ist gerade mal ein halbes Jahr als Sprecher des Repräsentantenhauses im Amt, da wollen ihn einige Parteikollegen schon wieder loswerden. Die glühende Trump-Anhängerin Marjorie Taylor Greene zettelt ein Misstrauensvotum an. Doch J…",https://bilder2.n-tv.de/img/incoming/crop24930301/4401324692-cImg_16_9-w1200/df3eb447bc7fd6f4f4815af4770493df.jpg,2024-05-09T02:35:19Z,,"Der Republikaner Mike Johnson ist gerade mal ein halbes Jahr als Sprecher des Repräsentantenhauses im Amt, da wollen ihn einige Parteikollegen schon wieder loswerden. Die glühende Trump-Anhängerin Ma… [+2560 chars]",,de,'Mike Johnson'
https://www.welt.de/politik/ausland/article251438556/Mike-Johnson-US-Parlament-schmettert-Misstrauensvotum-gegen-Top-Republikaner-ab.html,https://www.welt.de/politik/ausland/article251438556/Mike-Johnson-US-Parlament-schmettert-Misstrauensvotum-gegen-Top-Republikaner-ab.html,0,www.welt.de,US-Parlament schmettert Misstrauensvotum gegen Top-Republikaner ab,"Taylor Green ist glühende Trump-Anhängerin und mit einem Vorhaben krachend gescheitert. Sie wollte den Vorsitzenden des Repräsentantenhauses, ihren republikanischen Parteikollegen Mike Johnson, stürzen – bekam aber nur 43 Fürstimmen.",https://img.welt.de/img/bildergalerien/mobile251438554/5621352467-ci16x9-w1200/Rep-Bush-And-Rep-Tlaib-Join-GWU-Student-Protesters-For-A-News-C.jpg,2024-05-09T03:38:19Z,,"In den USA ist die glühende Trump-Anhängerin Marjorie Taylor Greene mit einem Versuch gescheitert, den Vorsitzenden des Repräsentantenhauses, Mike Johnson, zu stürzen. Mit Unterstützung der Demokrate… [+2347 chars]",,de,'Marjorie Taylor Greene'
https://www.dw.com/de/news-kompakt-druck-auf-israelische-regierung-w%C3%A4chst-wegen-rafah-offensive/a-69034305,https://www.dw.com/de/news-kompakt-druck-auf-israelische-regierung-w%C3%A4chst-wegen-rafah-offensive/a-69034305,0,www.dw.com,News kompakt: Druck auf israelische Regierung wächst wegen Rafah-Offensive,Die USA drohen mit Einschränkungen der Waffenlieferungen an Israel. In Nordmazedonien gewinnt die rechte Opposition die Wahlen. Die Zahl der Flutopfer in Kenia steigt. Das Wichtigste in Kürze. US-Präsident Joe Biden droht Israel für den Fall einer Offensive i…,https://static.dw.com/image/69034487_6.jpg,2024-05-09T07:31:00Z,,US-Präsident Joe Biden droht Israel für den Fall einer Offensive in Rafah im Süden des Gazastreifens mit einer weiteren Einschränkung von Munitionslieferungen. Für eine umfassende Invasion in der mit… [+4601 chars],,de,'Marjorie Taylor Greene'
