index,url,valid,domain,title,description,image,published,archive,content,quote,language,keyword
https://www.handelsblatt.com/politik/international/ukraine-die-lage-am-morgen-probleme-mit-bunkern-erzuernen-selenski-wagner-chef-truppen-zu-99-prozent-aus-bachmut-abgezogen/28144208.html,https://www.handelsblatt.com/politik/international/ukraine-die-lage-am-morgen-probleme-mit-bunkern-erzuernen-selenski-wagner-chef-truppen-zu-99-prozent-aus-bachmut-abgezogen/28144208.html,0,www.handelsblatt.com,Ukraine – Die Lage am Morgen: Probleme mit Bunkern erzürnen Selenski – Wagner-Chef: Truppen zu 99 Prozent aus Bachmut abgezogen,Vor den russischen Luftangriffen in der Ukraine suchen viele Menschen wegen fehlender Bunker vergeblich Schutz. Aber auch Russland wird von neuen Attacken erschüttert.,https://www.handelsblatt.com/images/wolodimir-selenski/29185772/2-format2003.jpg,2023-06-03T06:50:27Z,https://web.archive.org/web/20230603075215/https://www.handelsblatt.com/politik/international/ukraine-die-lage-am-morgen-probleme-mit-bunkern-erzuernen-selenski-wagner-chef-truppen-zu-99-prozent-aus-bachmut-abgezogen/28144208.html,"Wolodimir SelenskiDer Präsident der Ukraine fordert, dass eine ausreichende Zahl an Bunkern überall zugänglich sein müsse. 
(Foto: dpa)
Kiew, Odessa, Moskau Der ukrainische Präsident Wolodimir Sele… [+6257 chars]",,de,'Sergej Schoigu'
https://www.stern.de/gesellschaft/regional/hamburg-schleswig-holstein/politik--olaf-scholz-bei-spd-landesparteitag-in-hamburg-33525828.html,https://www.stern.de/gesellschaft/regional/hamburg-schleswig-holstein/politik--olaf-scholz-bei-spd-landesparteitag-in-hamburg-33525828.html,0,www.stern.de,Politik: Olaf Scholz bei SPD-Landesparteitag in Hamburg,"Olaf Scholz wird heute Abend auf dem Landesparteitag der Hamburger SPD erwartet. Der Bundeskanzler werde bei dem Delegiertentreffen seines alten Landesverbands ein Grußwort sprechen, teilte die Hamburger SPD mit. Scholz, der in Hamburg aufwuchs und von 2011 b…",https://image.stern.de/33525830/t/mD/v1/w1440/r1.7778/-/03--urnnewsmldpacom2009010123060399925596v3w800h600l584t231r1866b1611jpeg---b3e8c1a499af1b9a.jpg,2023-06-03T07:17:01Z,https://web.archive.org/web/20230603075216/https://www.stern.de/gesellschaft/regional/hamburg-schleswig-holstein/politik--olaf-scholz-bei-spd-landesparteitag-in-hamburg-33525828.html,"Olaf Scholz wird heute Abend auf dem Landesparteitag der Hamburger SPD erwartet. Der Bundeskanzler werde bei dem Delegiertentreffen seines alten Landesverbands ein Grußwort sprechen, teilte die Hambu… [+1084 chars]",,de,'Olaf Scholz'
https://www.stern.de/politik/ausland/ukraine--probleme-mit-bunkern-erzuernen-selenskyj---die-nacht-im-ueberblick-33525806.html,https://www.stern.de/politik/ausland/ukraine--probleme-mit-bunkern-erzuernen-selenskyj---die-nacht-im-ueberblick-33525806.html,0,www.stern.de,"""Untragbarer Zustand"" in Kiew : Verschlossene Bunker während Beschuss: Selenskyj fordert die Regierung zum Handeln auf",Vor den russischen Luftangriffen in der Ukraine suchen viele Menschen wegen fehlender Bunker vergeblich Schutz. Das soll sich ändern. Aber auch Russland wird von neuen Attacken erschüttert.,https://image.stern.de/33525976/t/pf/v3/w1440/r1.7778/-/selenskyj-kiew-ukraine.jpg,2023-06-03T08:19:00Z,https://web.archive.org/web/20230603085103/https://www.stern.de/politik/ausland/ukraine--probleme-mit-bunkern-erzuernen-selenskyj---die-nacht-im-ueberblick-33525806.html,"Vor den russischen Luftangriffen in der Ukraine suchen viele Menschen wegen fehlender Bunker vergeblich Schutz. Das soll sich ändern. Aber auch Russland wird von neuen Attacken erschüttert. 
Der ukr… [+5927 chars]",,de,'Selenskyj'
https://www.stern.de/politik/ausland/wo-wladimir-putin-sich-ein-zaren-dorf-eingerichtet-hat-33520398.html,https://www.stern.de/politik/ausland/wo-wladimir-putin-sich-ein-zaren-dorf-eingerichtet-hat-33520398.html,0,www.stern.de,Villen für Töchter und Ex-Frau : Wie einst die russischen Kaiser – wo Putin ein Zaren-Dorf für seine Familie errichtet hat,Nirgendwo verbringt Wladimir Putin mehr Zeit als in seiner offiziellen Residenz in Nowo-Ogarjowo. Hier will er bis zu seinem Tod bleiben und hat sich entsprechend eingerichtet – ganz so wie es die russischen Zaren Jahrhunderte vor ihm getan haben.,https://image.stern.de/33525692/t/Qt/v3/w1440/r1.7778/-/wladimir-putin-zaren-dorf-nowo-ogarjowo.jpg,2023-06-03T08:48:00Z,https://web.archive.org/web/20230603090455/https://www.stern.de/politik/ausland/wo-wladimir-putin-sich-ein-zaren-dorf-eingerichtet-hat-33520398.html,"Zarskoje Selo heißt eine der schönsten Zaren-Residenzen Russlands zu Deutsch ""Zaren-Dorf"". Hier residierte einst Katharina die Große, Zar Alexander I. oder der letzte russische Imperator Nikolaus II.… [+10104 chars]",,de,'Dmitri Medwedew'
https://www.bild.de/news/ausland/news-ausland/aufstieg-und-fall-des-georg-gaenswein-vorhang-zu-fuer-vatikan-clooney-84162600.bild.html,https://www.bild.de/news/ausland/news-ausland/aufstieg-und-fall-des-georg-gaenswein-vorhang-zu-fuer-vatikan-clooney-84162600.bild.html,0,www.bild.de,Aufstieg und Fall des Georg Gänswein - Vorhang zu für den George Clooney des Vatikan,"Papst Franziskus verbannt den Privatsekretär seines Vorgängers Benedikt XVI. aus Rom. BILD erklärt, wie es so weit kommen konnte.","https://images.bild.de/6479d2ba0020b90c773c4697/578509efcfb2fb0140c320e9b45635c1,9c0867d3?w=1280",2023-06-03T08:49:57Z,https://web.archive.org/web/20230603113841/https://www.bild.de/news/ausland/news-ausland/aufstieg-und-fall-des-georg-gaenswein-vorhang-zu-fuer-vatikan-clooney-84162600.bild.html,"Rom Wenn der Papst Gottes Stellvertreter auf Erden ist, dann war er das Foto-Model des Herren. Das schönste Gesicht am Heiligen Stuhl, der George Clooney des Vatikan.
Als wir alle Papst waren, damal… [+2172 chars]",,de,'Papst Benedikt XVI'
https://www.stern.de/gesellschaft/regional/hamburg-schleswig-holstein/parteien--tschentscher-setzt-themen-fuer-bevorstehende-wahlen--33526266.html,https://www.stern.de/gesellschaft/regional/hamburg-schleswig-holstein/parteien--tschentscher-setzt-themen-fuer-bevorstehende-wahlen--33526266.html,0,www.stern.de,Parteien: Tschentscher setzt Themen für bevorstehende Wahlen,"Hamburgs Erster Bürgermeister Peter Tschentscher hat seine SPD bei einem Landesparteitag auf die bevorstehenden Wahlen eingestimmt. ""Wir werden uns auf Hamburger Themen wieder stärker konzentrieren, denn es stehen Wahlen an"", sagte er am Sonnabend in Anwesenh…",https://image.stern.de/33526268/t/jY/v1/w1440/r1.7778/-/03--urnnewsmldpacom2009010123060399926673v3w800h600l640t422r1920b1272jpeg---8f6a4c06d661b340.jpg,2023-06-03T10:31:33Z,https://web.archive.org/web/20230603110458/https://www.stern.de/gesellschaft/regional/hamburg-schleswig-holstein/parteien--tschentscher-setzt-themen-fuer-bevorstehende-wahlen--33526266.html,"Hamburgs Erster Bürgermeister Peter Tschentscher hat seine SPD bei einem Landesparteitag auf die bevorstehenden Wahlen eingestimmt. ""Wir werden uns auf Hamburger Themen wieder stärker konzentrieren, … [+2021 chars]",,de,'Peter Tschentscher'
https://www.transfermarkt.de/-bdquo-sport-ldquo-al-hilal-plant-messis-prasentation-fur-dienstag-ndash-endgultiges-bdquo-ja-ldquo-fehlt/view/news/422461,https://www.transfermarkt.de/-bdquo-sport-ldquo-al-hilal-plant-messis-prasentation-fur-dienstag-ndash-endgultiges-bdquo-ja-ldquo-fehlt/view/news/422461,0,www.transfermarkt.de,Al-Hilal plant Lionel Messis Präsentation offenbar für Dienstag,"Die sportliche Zukunft von Lionel Messi scheint in Kürze geregelt. Nachdem der Abschied des 35 Jahre alten Superstars von Paris Saint-Germain feststeht, hat sich mit Al-Hilal...",https://tmssl.akamaized.net/images/foto/big/lionel-messi-fc-paris-saint-germain-2023-1683634453-106781.jpg?lm=1683634462,2023-06-03T10:56:51Z,https://web.archive.org/web/20230605023319/https://www.transfermarkt.de/-bdquo-sport-ldquo-al-hilal-plant-messis-prasentation-fur-dienstag-ndash-endgultiges-bdquo-ja-ldquo-fehlt/view/news/422461,"Heute letztes Spiel für PSG 
Die sportliche Zukunft von Lionel Messi scheint in Kürze geregelt. Nachdem der Abschied des 35 Jahre alten Superstars von Paris Saint-Germain feststeht, hat sich mit Al-… [+3736 chars]",,de,'Lionel Messi'
https://www.focus.de/auto/news/um-faktor-8-verrechnet-e-fuels-experte-widerspricht-ehemaligen-vw-chef_id_195308027.html,https://www.focus.de/auto/news/um-faktor-8-verrechnet-e-fuels-experte-widerspricht-ehemaligen-vw-chef_id_195308027.html,0,www.focus.de,Windenergie - Um Faktor 8 verrechnet? E-Fuels-Experte widerspricht ehemaligem VW-Chef,Der ehemalige VW-Chef Herbert Diess lieferte bei „Markus Lanz“ ein Rechenbeispiel für die Ineffizienz von synthetischen Kraftstoffen. Ein Experte macht nun aber eine ganz andere Rechnung auf. Auch VW-interne Daten kommen zu einem interessanten Ergebnis.,https://p6.focus.de/img/auto/news/id_188121455/mit-porsche-in-patagonien-sind-e-fuels-eine-alternative-.jpg?im=Crop%3D%280%2C58%2C1024%2C512%29%3BResize%3D%281200%2C627%29&impolicy=perceptual&quality=mediumHigh&hash=52c0a444bb7ccea4872532449edbd621825f44059690612bcf284ef39627e30b,2023-06-03T11:32:37Z,https://web.archive.org/web/20230603133649/https://www.focus.de/auto/news/um-faktor-8-verrechnet-e-fuels-experte-widerspricht-ehemaligen-vw-chef_id_195308027.html,"<ul><li>
Kommentare</li><li>
E-Mail</li><li>
Teilen</li><li>
Mehr</li><li>
Twitter</li><li>
Drucken</li><li>
Feedback</li><li>
Fehler meldenSie haben einen Fehler gefunden?
Bitte markieren S… [+6301 chars]",,de,'Markus Lanz'
https://www.stern.de/gesellschaft/regional/niedersachsen-bremen/eschede--wissing-zum-zugunglueck---muessen-missstaende-ansprechen--33526648.html,https://www.stern.de/gesellschaft/regional/niedersachsen-bremen/eschede--wissing-zum-zugunglueck---muessen-missstaende-ansprechen--33526648.html,0,www.stern.de,"Eschede: Wissing zum Zugunglück: ""Müssen Missstände ansprechen""","Zum 25. Jahrestag des verheerenden Zugunglücks von Eschede hat Bundesverkehrsminister Volker Wissing (FDP) gemahnt, alles dafür zu tun, dass sich eine solche Katastrophe niemals wiederholen dürfe. Nach dem schwersten deutschen Bahnunglück mit 101 Toten seien …",https://image.stern.de/33526650/t/fM/v1/w1440/r1.7778/-/03--urnnewsmldpacom2009010123060399927435v3w800h600l919t222r1699b1243jpeg---0ecf6c488c96e999.jpg,2023-06-03T12:30:52Z,https://web.archive.org/web/20230603152002/https://www.stern.de/gesellschaft/regional/niedersachsen-bremen/eschede--wissing-zum-zugunglueck---muessen-missstaende-ansprechen--33526648.html,"Zum 25. Jahrestag des verheerenden Zugunglücks von Eschede hat Bundesverkehrsminister Volker Wissing (FDP) gemahnt, alles dafür zu tun, dass sich eine solche Katastrophe niemals wiederholen dürfe. Na… [+960 chars]",,de,'Volker Wissing'
https://www.focus.de/politik/ausland/psychologische-kriegsfuehrung-warum-die-drohnenangriffe-auf-moskau-verheerend-fuer-putins-politik-sind_id_195144495.html,https://www.focus.de/politik/ausland/psychologische-kriegsfuehrung-warum-die-drohnenangriffe-auf-moskau-verheerend-fuer-putins-politik-sind_id_195144495.html,0,www.focus.de,Psychologische Kriegsführung - Attacken auf Wohnhäuser treffen Putin an einer empfindlichen Stelle,Am Dienstagmorgen gab es mehrere Drohnenangriffe in Moskau. Viele Bürger sind erschüttert – und zum ersten Mal direkt mit den Auswirkungen des von Russland begonnenen Krieges in der Ukraine konfrontiert. Kippt nun die Einstellung der Bevölkerung zu Russlands …,https://p6.focus.de/img/fotos/id_195144496/moskau-drohnenangriff.png?im=Crop%3D%280%2C119%2C1369%2C684%29%3BResize%3D%281200%2C627%29&impolicy=perceptual&quality=mediumHigh&hash=d5aebf0fdd71bf55c56bc302d1eb0134f5dde17e79f82b0732929cdcbf4c6240,2023-06-03T14:45:43Z,https://web.archive.org/web/20230603155025/https://www.focus.de/politik/ausland/psychologische-kriegsfuehrung-warum-die-drohnenangriffe-auf-moskau-verheerend-fuer-putins-politik-sind_id_195144495.html,Am Dienstagmorgen gab es mehrere Drohnenangriffe in Moskau. Viele Bürger sind erschüttert und zum ersten Mal direkt mit den Auswirkungen des von Russland begonnenen Krieges in der Ukraine konfrontier… [+4151 chars],,de,'Putin'
https://www.stern.de/lifestyle/leute/prinz-harry-und-meghan-haben-eheprobleme--scheidungsanwaelte-sollen-eingeschaltet-sein-33526252.html,https://www.stern.de/lifestyle/leute/prinz-harry-und-meghan-haben-eheprobleme--scheidungsanwaelte-sollen-eingeschaltet-sein-33526252.html,0,www.stern.de,Etliche Quellen berichten: Prinz Harry und Meghan sollen Eheprobleme haben – Scheidungsanwälte bereits eingeschaltet?,"Die Gerüchte, dass Prinz Harry und Herzogin Meghan massive Eheprobleme zu haben scheinen, häufen sich. Aus verschiedenen Ecken ihrer Umgebung hört man die Krisengerüchte – Prinz Harry soll bereits Scheidungsanwälte kontaktiert haben.",https://image.stern.de/33526564/t/GJ/v3/w1440/r1.7778/-/prinz-harry-meghan.jpg,2023-06-03T15:53:00Z,https://web.archive.org/web/20230603160625/https://www.stern.de/lifestyle/leute/prinz-harry-und-meghan-haben-eheprobleme--scheidungsanwaelte-sollen-eingeschaltet-sein-33526252.html,"Hat sich das Motto ""Wir gegen den Rest der Welt"" etwa gedreht? Verschiedene royale Quellen und Experten berichten von immer mehr Indizien, dass der Hausfrieden bei den Sussexes gewaltig schief hängen… [+2861 chars]",,de,'Prinz Harry'
https://www.welt.de/politik/deutschland/article245679130/Verengung-des-Meinungsklimas-Merz-macht-Ampel-wegen-Umgang-mit-AfD-Vorwuerfe.html,https://www.welt.de/politik/deutschland/article245679130/Verengung-des-Meinungsklimas-Merz-macht-Ampel-wegen-Umgang-mit-AfD-Vorwuerfe.html,0,www.welt.de,„Verengung des Meinungsklimas“ – Merz macht Ampel wegen Umgang mit AfD Vorwürfe,"CDU-Chef Friedrich Merz sieht bei der Ampel-Regierung eine Mitschuld am Erstarken der AfD in mehreren Umfragen. SPD-Ministerpräsidentin Malu Dreyer widerspricht: „Ich bin fassungslos darüber, wie scheinheilig und unverfroren die Union die Gründe für das Umfra…",https://img.welt.de/img/politik/deutschland/mobile245681966/3691357447-ci16x9-w1200/Fraktionssitzungen-im-Bundestag.jpg,2023-06-03T16:25:00Z,https://web.archive.org/web/20230603165353/https://www.welt.de/politik/deutschland/article245679130/Verengung-des-Meinungsklimas-Merz-macht-Ampel-wegen-Umgang-mit-AfD-Vorwuerfe.html,CDU-Chef Friedrich Merz hat mit einer Kampfansage an die Alternative für Deutschland und scharfer Kritik an der Ampel-Koalition auf die hohen AfD-Umfragewerte reagiert. Bei näherer Betrachtung sind d… [+2872 chars],,de,'Friedrich Merz'
https://www.bild.de/politik/kolumnen/kolumne/kommentar-von-paul-ronzheimer-dieser-ausbruch-hat-gut-getan-herr-bundeskanzler-84171172.bild.html,https://www.bild.de/politik/kolumnen/kolumne/kommentar-von-paul-ronzheimer-dieser-ausbruch-hat-gut-getan-herr-bundeskanzler-84171172.bild.html,0,www.bild.de,"Kommentar von Paul Ronzheimer - Dieser Ausbruch hat gut getan, Herr Bundeskanzler!",Bei einem Auftritt auf einem SPD-Europafest bei Berlin hat Scholz jetzt bewiesen: Er hat sehr wohl Gefühle – und was für welche!,"https://images.bild.de/647b7f1d8a69550bae7b335d/db3f0ea4a3870fa794f2faa39a3c828c,eff2bac1?w=1280",2023-06-03T18:26:32Z,http://archive.md/20230604094739/https://www.bild.de/politik/kolumnen/kolumne/kommentar-von-paul-ronzheimer-dieser-ausbruch-hat-gut-getan-herr-bundeskanzler-84171172.bild.html,"Was haben so viele Journalisten (auch ich) immer wieder über Bundeskanzler Olaf Scholz geschimpft: Kein Herz für die Ukraine, keine Emotionen trotz russischem Angriffskrieg gegen ein geschundenes Lan… [+1553 chars]",,de,'Paul Ronzheimer'
https://www.tagesspiegel.de/berlin/treffen-mit-vitali-klitschko-geplant-kai-wegner-reist-zum-antrittsbesuch-nach-warschau-9923120.html,https://www.tagesspiegel.de/berlin/treffen-mit-vitali-klitschko-geplant-kai-wegner-reist-zum-antrittsbesuch-nach-warschau-9923120.html,0,www.tagesspiegel.de,Treffen mit Vitali Klitschko geplant: Kai Wegner reist zum Antrittsbesuch nach Warschau,"Berlins Regierender Bürgermeister reist am Sonntag nach Warschau zur Konferenz des Pakts freier Städte. Offen ist, ob es zum Treffen mit Kiews Bürgermeister kommt.",https://www.tagesspiegel.de/images/berlins-burgermeister-wegner-in-potsdam/alternates/BASE_16_9_W1400/berlins-buergermeister-wegner-in-potsdam.jpeg,2023-06-03T19:03:31Z,https://web.archive.org/web/20230603201010/https://www.tagesspiegel.de/berlin/treffen-mit-vitali-klitschko-geplant-kai-wegner-reist-zum-antrittsbesuch-nach-warschau-9923120.html,Der Regierende Bürgermeister Kai Wegner (CDU) bricht am Sonntag zu seiner ersten Auslandsreise als Berliner Landesoberhaupt nach Warschau auf. Anlass für Wegners Antrittsbesuch in der Partnerstadt is… [+2115 chars],,de,'Kai Wegner'
https://www.stern.de/news/biden-setzt-muehsam-errungene-kongress-einigung-zum-haushaltsstreit-in-kraft-33524924.html,https://www.stern.de/news/biden-setzt-muehsam-errungene-kongress-einigung-zum-haushaltsstreit-in-kraft-33524924.html,0,www.stern.de,Biden setzt mühsam errungene Kongress-Einigung zum Haushaltsstreit in Kraft,US-Präsident Joe Biden hat den mühsam errungenen Kompromiss im Kongress zur Verhinderung eines Zahlungsausfalls der Regierung in Kraft gesetzt. Biden unterzeichnete am Samstag das entsprechende Gesetz. Zuvor hatte er in einer Rede an die Nation die Bedeutung …,https://image.stern.de/33527414/t/ah/v1/w1440/r1.7778/-/04--uspraesident-joe-biden-bei-seiner-rede-im-oval-office---d19d4372139453ff.jpg,2023-06-04T01:08:40Z,https://web.archive.org/web/20230604012250/https://www.stern.de/news/biden-setzt-muehsam-errungene-kongress-einigung-zum-haushaltsstreit-in-kraft-33524924.html,US-Präsident Joe Biden hat den mühsam errungenen Kompromiss im Kongress zur Verhinderung eines Zahlungsausfalls der Regierung in Kraft gesetzt. Biden unterzeichnete am Samstag das entsprechende Geset… [+3727 chars],,de,'Kevin McCarthy'
https://www.nzz.ch/feuilleton/der-gonzo-journalismus-darf-nicht-sterben-eben-weil-er-subjektiv-aggressiv-und-instruktiv-ist-ld.1740705,https://www.nzz.ch/feuilleton/der-gonzo-journalismus-darf-nicht-sterben-eben-weil-er-subjektiv-aggressiv-und-instruktiv-ist-ld.1740705,0,www.nzz.ch,"Gonzo liebt das Wilde aus der Halb- und Unterwelt – Hunter S. Thompson war der Vorreiter eines journalistischen Genres, das bis heute provoziert","Dealer erklären die Gepflogenheiten des Kokainhandels, der Basketballstar Dennis Rodman trifft den Diktator Kim Jong Un, Mordverdächtige werden bei der Flucht begleitet. Der Gonzo-Journalismus erzielt auf den Märkten der Aufmerksamkeit höchste Erregungswerte.","https://img.nzz.ch/2023/06/02/48c23242-5c55-4a48-95d6-74cfb5c243f0.jpeg?width=1200&height=675&fit=bound&quality=75&auto=webp&crop=3600,2025,x0,y329&wmark=nzz",2023-06-04T05:40:57Z,http://archive.md/20230604150503/https://www.nzz.ch/feuilleton/der-gonzo-journalismus-darf-nicht-sterben-eben-weil-er-subjektiv-aggressiv-und-instruktiv-ist-ld.1740705,"Der Gonzo-Journalist Hunter S. Thompson hatte einen exzentrischen Humor und den Willen, jede Droge aus seinen Geschichten selbst zu nehmen. Auf seiner Ranch in Colorado, 1990.
Vice Media ist zahlung… [+7826 chars]",,de,'Kim Jong Un'
https://www.welt.de/politik/ausland/article245683836/Tuerkei-Erdogan-signalisiert-mit-neuem-Finanzminister-oekonomische-Kehrtwende.html,https://www.welt.de/politik/ausland/article245683836/Tuerkei-Erdogan-signalisiert-mit-neuem-Finanzminister-oekonomische-Kehrtwende.html,0,www.welt.de,Erdogan signalisiert mit neuem Finanzminister ökonomische Kehrtwende,"Am Samstag wurde der seit 20 Jahren regierende türkische Präsident Recep Tayyip Erdogan für eine neue Amtszeit vereidigt. Neuer Finanzminister wird der Ökonom Mehmet Simsek, der für einen anderen Kurs in der Zinspolitik steht.",https://img.welt.de/img/politik/ausland/mobile245683866/9341354047-ci16x9-w1200/Turkish-President-Tayyip-Erdogan-announces-new-cabinet-during-a-p.jpg,2023-06-04T06:45:17Z,https://web.archive.org/web/20230604070808/https://www.welt.de/politik/ausland/article245683836/Tuerkei-Erdogan-signalisiert-mit-neuem-Finanzminister-oekonomische-Kehrtwende.html,Der türkische Präsident Recep Tayyip Erdogan hat sein Kabinett teilweise neu aufgestellt und eine wirtschaftliche Kehrtwende signalisiert. Der Ökonom Mehmet Simsek soll das Finanzressort führen und d… [+2406 chars],,de,'Recep Tayyip Erdogan'
https://www.stern.de/gesellschaft/regional/nordrhein-westfalen/regierung--nrw-regierungschef-wuest-besucht-japan-33528268.html,https://www.stern.de/gesellschaft/regional/nordrhein-westfalen/regierung--nrw-regierungschef-wuest-besucht-japan-33528268.html,0,www.stern.de,Regierung: NRW-Regierungschef Wüst besucht Japan,"Nordrhein-Westfalens Ministerpräsident Hendrik Wüst (CDU) ist am Sonntag zu einem sechstägigen Besuch in Japan eingetroffen. Wüst besucht nach Angaben der Staatskanzlei bis Freitag die Hauptstadt Tokio sowie Osaka und Fukushima, wo es im März 2011 zu einer ve…",https://image.stern.de/33528270/t/ts/v1/w1440/r1.7778/-/04--urnnewsmldpacom2009010123060499935435v3w800h600l640t425r1920b1275jpeg---3887419ccb8beb99.jpg,2023-06-04T09:33:49Z,https://web.archive.org/web/20230604100852/https://www.stern.de/gesellschaft/regional/nordrhein-westfalen/regierung--nrw-regierungschef-wuest-besucht-japan-33528268.html,Nordrhein-Westfalens Ministerpräsident Hendrik Wüst (CDU) ist am Sonntag zu einem sechstägigen Besuch in Japan eingetroffen. Wüst besucht nach Angaben der Staatskanzlei bis Freitag die Hauptstadt Tok… [+1964 chars],,de,'Hendrik Wüst'
https://www.transfermarkt.de/pfiffe-und-niederlage-fur-messi-bei-psg-abschied-ndash-weitere-klubs-bekunden-interesse/view/news/422480,https://www.transfermarkt.de/pfiffe-und-niederlage-fur-messi-bei-psg-abschied-ndash-weitere-klubs-bekunden-interesse/view/news/422480,0,www.transfermarkt.de,PSG: Pfiffe und Pleite bei Abschied von Lionel Messi – Anfragen nehmen zu,Pfiffe und eine Niederlage zum Abschluss für Lionel Messi: Der Starspieler ist auch bei seiner Abschiedsvorstellung in Paris von den PSG-Fans ausgepfiffen worden. Im Prinzenpark gab es nicht...,https://tmssl.akamaized.net/images/foto/big/lionel-messi-paris-saint-germain-2023-1685872213-108539.jpg?lm=1685872230,2023-06-04T09:56:50Z,https://web.archive.org/web/20230604234118/https://www.transfermarkt.de/pfiffe-und-niederlage-fur-messi-bei-psg-abschied-ndash-weitere-klubs-bekunden-interesse/view/news/422480,"Clermont Foot sorgt für Überraschung 
Pfiffe und eine Niederlage zum Abschluss für Lionel Messi: Der Starspieler ist auch bei seiner Abschiedsvorstellung in Paris von den PSG-Fans ausgepfiffen worde… [+3862 chars]",,de,'Lionel Messi'
https://www.bild.de/regional/ruhrgebiet/ruhrgebiet-aktuell/bei-messe-in-bochum-erster-auftritt-von-georg-gaenswein-nach-rausschmiss-aus-rom-84174622.bild.html,https://www.bild.de/regional/ruhrgebiet/ruhrgebiet-aktuell/bei-messe-in-bochum-erster-auftritt-von-georg-gaenswein-nach-rausschmiss-aus-rom-84174622.bild.html,0,www.bild.de,George Clooney des Vatikans in Bochum - Gänswein nach Rauswurf wieder in Deutschland,Gerade wurde Erzbischof Georg Gänswein von Papst Franziskus aus Rom verbannt. Jetzt taucht der George Clooney des Vatikans im Ruhrgbebiet auf.,"https://images.bild.de/647c49a9a311f827ef8338ec/6f987ab0dfe45c45c7a7931ab2e656da,8fc00271?w=1280",2023-06-04T11:05:35Z,https://web.archive.org/web/20230604113539/https://www.bild.de/regional/ruhrgebiet/ruhrgebiet-aktuell/bei-messe-in-bochum-erster-auftritt-von-georg-gaenswein-nach-rausschmiss-aus-rom-84174622.bild.html,"In Rom ist die Messe für ihn gelesen, im Ruhrgebiet aber nicht ... 
Bochum (NRW) / Rom Gerade wurde Erzbischof Georg Gänswein von Papst Franziskus aus Rom verbannt. Jetzt tauchte der George Clooney … [+1809 chars]",,de,'George Clooney'
https://www.stern.de/gesellschaft/regional/berlin-brandenburg/buergermeister--berlins-regierungschef-wegner-in-warschau-eingetroffen--33527550.html,https://www.stern.de/gesellschaft/regional/berlin-brandenburg/buergermeister--berlins-regierungschef-wegner-in-warschau-eingetroffen--33527550.html,0,www.stern.de,Bürgermeister: Berlins Regierungschef Wegner in Warschau eingetroffen,"Berlins Regierender Bürgermeister Kai Wegner (CDU) ist am Sonntag nach Warschau geflogen. Die zweitägige Reise in die polnische Hauptstadt ist die erste des Regierungschefs ins Ausland, er amtiert seit gut fünf Wochen.",https://image.stern.de/33527552/t/jN/v2/w1440/r1.7778/-/04--urnnewsmldpacom2009010123060399929319v2w800h600l1191t378r3781b2089jpeg---8edba2d0808d271e.jpg,2023-06-04T11:38:00Z,https://web.archive.org/web/20230604122240/https://www.stern.de/gesellschaft/regional/berlin-brandenburg/buergermeister--berlins-regierungschef-wegner-in-warschau-eingetroffen--33527550.html,"Berlins Regierender Bürgermeister Kai Wegner (CDU) ist am Sonntag nach Warschau geflogen. Die zweitägige Reise in die polnische Hauptstadt ist die erste des Regierungschefs ins Ausland, er amtiert se… [+763 chars]",,de,'Kai Wegner'
