index,url,valid,domain,title,description,image,published,archive,content,quote,language,keyword
https://www.brigitte.de/aktuell/uebergriff---fotografin-reicht-klage-gegen-kanye-west-ein-13536778.html,https://www.brigitte.de/aktuell/uebergriff---fotografin-reicht-klage-gegen-kanye-west-ein-13536778.html,0,www.brigitte.de,Übergriff?: Fotografin reicht Klage gegen Kanye West ein,Hat er ihr Smartphone genommen und auf die Straße geworfen? Eine US-Fotografin hat Kanye West wegen eines Zusammenstoßes verklagt.,https://image.brigitte.de/13536780/t/Ec/v1/w1440/r1.7778/-/02--fotografin-reicht-klage-gegen-kanye-west-ein---1-1---spoton-article-1046061.jpg,2023-06-02T07:10:00Z,https://web.archive.org/web/20230602080906/https://www.brigitte.de/aktuell/uebergriff---fotografin-reicht-klage-gegen-kanye-west-ein-13536778.html,"Hat er ihr Smartphone genommen und auf die Straße geworfen? Eine US-Fotografin hat Kanye West wegen eines Zusammenstoßes verklagt.
Hat Skandalrapper Kanye West (45), alias Ye, aus Wut das Telefon ei… [+1827 chars]",,de,'Kanye West'
https://www.stern.de/lifestyle/leute/uebergriff---fotografin-verklagt-rapper-kanye-west-33522854.html,https://www.stern.de/lifestyle/leute/uebergriff---fotografin-verklagt-rapper-kanye-west-33522854.html,0,www.stern.de,Übergriff?: Fotografin verklagt Rapper Kanye West,Hat er ihr Smartphone genommen und auf die Straße geworfen? Eine US-Fotografin hat Kanye West wegen eines Zusammenstoßes verklagt.,https://image.stern.de/33522858/t/ta/v1/w1440/r1.7778/-/02--fotografin-verklagt-rapper-kanye-west---16-9---spoton-article-1046061.jpg,2023-06-02T07:15:00Z,https://web.archive.org/web/20230602083922/https://www.stern.de/lifestyle/leute/uebergriff---fotografin-verklagt-rapper-kanye-west-33522854.html,"Hat er ihr Smartphone genommen und auf die Straße geworfen? Eine US-Fotografin hat Kanye West wegen eines Zusammenstoßes verklagt.
Hat Skandalrapper Kanye West (45), alias Ye, aus Wut das Telefon ei… [+1827 chars]",,de,'Kanye West'
https://www.welt.de/vermischtes/prominente/article245655404/Tausende-auf-den-Strassen-Der-Kronprinz-und-die-Architektin-Jordanien-feiert-Prinz-Husseins-Glamour-Hochzeit.html,https://www.welt.de/vermischtes/prominente/article245655404/Tausende-auf-den-Strassen-Der-Kronprinz-und-die-Architektin-Jordanien-feiert-Prinz-Husseins-Glamour-Hochzeit.html,0,www.welt.de,Der Kronprinz und die Architektin – Jordanien feiert Prinz Husseins Glamour-Hochzeit,Nach einer vereitelten Palastfehde sollte die Trauung des Thronfolgers das jordanische Volk wieder für die Monarchie begeistern. Zu der tagelangen Mega-Feier kamen Royals aus Europa – selbst Prinz William und seine Frau Kate feierten mit.,https://img.welt.de/img/vermischtes/prominente/mobile245655394/7021356367-ci16x9-w1200/Hochzeit-des-jordanischen-Kronprinzen.jpg,2023-06-02T07:36:55Z,https://web.archive.org/web/20230602075316/https://www.welt.de/vermischtes/prominente/article245655404/Tausende-auf-den-Strassen-Der-Kronprinz-und-die-Architektin-Jordanien-feiert-Prinz-Husseins-Glamour-Hochzeit.html,"Ein strahlendes Brautpaar und hochkarätige Gäste: Jordaniens Kronprinz Hussein bin Abdullah hat bei einer prunkvollen Zeremonie die Architektin Radschwa Al Saif geheiratet.
Zu der Hochzeit in der Ha… [+4286 chars]",,de,'Mohammed bin Salman'
https://www.teltarif.de/streaming-medien-fernsehen-business/news/92004.html,https://www.teltarif.de/streaming-medien-fernsehen-business/news/92004.html,0,www.teltarif.de,Fox-CEO Murdoch: Kein Live-Sport im Streaming,"Viele Medienmanager sind fest davon überzeugt, dass auch Live-Sport und Nachrichten eine Zukunft im Streaming haben. Von dieser Idee hält Fox-CEO Lachlan Murdoch jedoch überhaupt nichts.",https://www.teltarif.de/img/arch/2023/kw22/streaming-medien-fernsehen-business-1ab.jpg,2023-06-02T08:10:41Z,https://web.archive.org/web/20230603094424/https://www.teltarif.de/streaming-medien-fernsehen-business/news/92004.html,"Filme und Serien sind schon längst ins Strea­ming abge­wan­dert, doch Nach­richten und Sport­über­tra­gungen domi­nieren nach wie vor das lineare Fern­sehen. Das wird zumin­dest für sein Unter­nehmen… [+2733 chars]",,de,'Lachlan Murdoch'
https://www.n-tv.de/leute/Kanye-West-wegen-taetlichen-Ubergriffs-verklagt-article24162913.html,https://www.n-tv.de/leute/Kanye-West-wegen-taetlichen-Ubergriffs-verklagt-article24162913.html,0,www.n-tv.de,Fotografin will Schadenersatz: Kanye West wegen tätlichen Übergriffs verklagt,"Wegen antisemitischer Aussagen liegt die Kooperation von Kanye West und Adidas auf Eis. Doch die Skandale reißen nicht ab. Nach einem Vorfall fordert eine Fotografin nun Schadensersatz von dem Rapper - sie habe Angst, ihrem Beruf weiter nachzugehen.",https://bilder2.n-tv.de/img/incoming/crop24162969/7071329368-cImg_16_9-w1200/403565497.jpg,2023-06-02T09:12:13Z,https://web.archive.org/web/20230602093740/https://www.n-tv.de/leute/Kanye-West-wegen-taetlichen-Ubergriffs-verklagt-article24162913.html,Wegen antisemitischer Aussagen liegt die Kooperation von Kanye West und Adidas auf Eis. Doch die Skandale reißen nicht ab. Nach einem Vorfall fordert eine Fotografin nun Schadensersatz von dem Rapper… [+2111 chars],,de,'Kanye West'
https://www.bild.de/unterhaltung/leute/leute/kim-kardashian-laesst-kanye-west-fallen-so-stressig-war-die-ehe-wirklich-84152674.bild.html,https://www.bild.de/unterhaltung/leute/leute/kim-kardashian-laesst-kanye-west-fallen-so-stressig-war-die-ehe-wirklich-84152674.bild.html,0,www.bild.de,Früher spielte sie seine „Aufräumtruppe“ - Kim lässt Kanye fallen!,"Kim Kardashian und Kanye West liegen seit ihrer Trennung im Clinch. In der neusten Folge ihrer Reality-Show verrät sie jetzt, wie stressig ihre Ehe war.","https://images.bild.de/64798a4dfc1c627d0842efaa/a46d31206b730055f72a042570e514e1,970da11c?w=1280",2023-06-02T09:42:25Z,https://web.archive.org/web/20230602094855/https://www.bild.de/unterhaltung/leute/leute/kim-kardashian-laesst-kanye-west-fallen-so-stressig-war-die-ehe-wirklich-84152674.bild.html,"Sie waren einmal so verliebt: Kim Kardashian (42) und Kanye West (45). Davon ist heute nicht mehr viel übrig. 
Zehn Jahre waren sie ein Paar, haben vier gemeinsame Kinder. In der Reality-Show Keepin… [+3083 chars]",,de,'Kim Kardashian'
https://www.morgenpost.de/web-wissen/web-technik/article238566133/Wissing-Massvolle-KI-Regulierung-muss-schnell-kommen.html,https://www.morgenpost.de/web-wissen/web-technik/article238566133/Wissing-Massvolle-KI-Regulierung-muss-schnell-kommen.html,0,www.morgenpost.de,Künstliche Intelligenz: Wissing: Maßvolle KI-Regulierung muss schnell kommen,Künstliche Intelligenz ist eine Schlüsseltechnologie für die Zukunft. Doch wie soll sie in Europa geregelt werden? Digitalminister Volker Wissing plädiert für einen Mittelweg zwischen Werten und Innovation.,https://img.morgenpost.de/img/web-technik/crop238566131/8272607452-w820-cv16_9-q85/Volker-Wissing.jpg,2023-06-02T09:52:23Z,https://web.archive.org/web/20230602105155/https://www.morgenpost.de/web-wissen/web-technik/article238566133/Wissing-Massvolle-KI-Regulierung-muss-schnell-kommen.html,Luxemburg. Digitalminister Volker Wissing (FDP) spricht sich für eine maßvolle Regulierung von Künstlicher Intelligenz (KI) in der EU aus. Die EU brauche hier eine klare Haltung - und vor allen Dinge… [+1371 chars],,de,'Volker Wissing'
https://de.catholicnewsagency.com/news/13297/papst-franziskus-schickt-erzbischof-ganswein-ohne-neue-aufgabe-nach-deutschland-bericht,https://de.catholicnewsagency.com/news/13297/papst-franziskus-schickt-erzbischof-ganswein-ohne-neue-aufgabe-nach-deutschland-bericht,0,de.catholicnewsagency.com,Papst Franziskus schickt Erzbischof Gänswein „ohne neue Aufgabe“ nach Deutschland: Bericht,"Papst Franziskus hat laut einem Bericht der Zeitung „Welt“ angeordnet, Erzbischof Georg Gänswein müsse bis Ende Juni nach Deutschland zurückkehren.
Der langjährige Privatsekretär von Papst Benedikt XVI. werde „ohne neue Aufgabe fortgeschickt“, so die „Welt“ a…",https://de.catholicnewsagency.com/image/dsc01346_1559761098.JPG?w=1150&jpg,2023-06-02T10:25:00Z,https://web.archive.org/web/20230602173257/https://de.catholicnewsagency.com/news/13297/papst-franziskus-schickt-erzbischof-ganswein-ohne-neue-aufgabe-nach-deutschland-bericht,"Von CNA Deutsch Nachrichtenredaktion
Vatikanstadt - Freitag, 2. Juni 2023, 12:25 Uhr.
Papst Franziskus hat laut einem Bericht der Zeitung Welt angeordnet, Erzbischof Georg Gänswein müsse bis Ende J… [+4423 chars]",,de,'Georg Gänswein'
https://www.stern.de/gesellschaft/regional/baden-wuerttemberg/kirche--bericht--ex-benedikt-vertrauter-gaenswein-soll-nach-freiburg-33523730.html,https://www.stern.de/gesellschaft/regional/baden-wuerttemberg/kirche--bericht--ex-benedikt-vertrauter-gaenswein-soll-nach-freiburg-33523730.html,0,www.stern.de,Kirche: Bericht: Ex-Benedikt-Vertrauter Gänswein soll nach Freiburg,"Der langjährige Privatsekretär von Papst Benedikt XVI., Georg Gänswein, soll nach Informationen der Tageszeitung ""Welt"" in sein Heimatbistum Freiburg zurückkehren - und zwar ohne Amt. Papst Franziskus habe den 66-Jährigen angewiesen, Rom bis spätestens 1. Jul…",https://image.stern.de/6681672/t/31/v5/w1440/r1.7778/-/video-fallback-image.jpg,2023-06-02T10:37:38Z,https://web.archive.org/web/20230602120840/https://www.stern.de/gesellschaft/regional/baden-wuerttemberg/kirche--bericht--ex-benedikt-vertrauter-gaenswein-soll-nach-freiburg-33523730.html,"Der langjährige Privatsekretär von Papst Benedikt XVI., Georg Gänswein, soll nach Informationen der Tageszeitung ""Welt"" in sein Heimatbistum Freiburg zurückkehren - und zwar ohne Amt. Papst Franzisku… [+1607 chars]",,de,'Georg Gänswein'
https://www.bild.de/politik/2023/politik/eilmeldung-84156818.bild.html,https://www.bild.de/politik/2023/politik/eilmeldung-84156818.bild.html,0,www.bild.de,Er war der Privatsekretär von Papst Benedikt (†95) - Papst verbannt Georg Gänswein aus Vatikan,Er muss gehen. Weit weg vom katholischen Epizentrum. Ohne neues Amt.Foto: Philipp von Ditfurth/dpa,"https://images.bild.de/6479c4f90313d83053d81ad7/c2f0f128204ca852be2e4142fc5904b3,37894592?w=1280",2023-06-02T10:39:37Z,https://web.archive.org/web/20230602105633/https://www.bild.de/politik/2023/politik/eilmeldung-84156818.bild.html,"Er muss gehen. Weit weg vom katholischen Epizentrum. Ohne neues Amt.
Georg Gänswein, Privatsekretär des im Januar verstorbenen Papst Benedikts XVI. (95), kehrt nach Deutschland zurück. Papst Franzis… [+1085 chars]",,de,'Georg Gänswein'
https://www.focus.de/panorama/welt/ansage-von-benedikt-xvi-langjaehriger-papst-sekretaer-soll-vatikan-schleunigst-verlassen_id_195316460.html,https://www.focus.de/panorama/welt/ansage-von-benedikt-xvi-langjaehriger-papst-sekretaer-soll-vatikan-schleunigst-verlassen_id_195316460.html,0,www.focus.de,Ansage von Franziskus - Langjähriger Papst-Sekretär soll Vatikan schleunigst verlassen,"Der langjährige Privatsekretär von Papst Benedikt XVI., Georg Gänswein, soll nach Informationen der Tageszeitung „Welt“ in sein Heimatbistum Freiburg zurückkehren - und zwar ohne Amt.",https://p6.focus.de/img/fotos/id_195318081/imago0257069939h.jpg?im=Crop%3D%280%2C260%2C3463%2C1732%29%3BResize%3D%281200%2C627%29&impolicy=perceptual&quality=mediumHigh&hash=8a0b8d3da7f6caadf4fd2e255ba7f47d831c47c2ce7d2bc31220883e8f807261,2023-06-02T11:02:03Z,https://web.archive.org/web/20230602120533/https://www.focus.de/panorama/welt/ansage-von-benedikt-xvi-langjaehriger-papst-sekretaer-soll-vatikan-schleunigst-verlassen_id_195316460.html,"Der langjährige Privatsekretär von Papst Benedikt XVI., Georg Gänswein, soll nach Informationen der Tageszeitung Welt in sein Heimatbistum Freiburg zurückkehren - und zwar ohne Amt.Papst Franziskus h… [+1115 chars]",,de,'Georg Gänswein'
https://www.tagesspiegel.de/gesellschaft/panorama/entscheidung-von-papst-franziskus-ganswein-soll-rom-verlassen-und-nach-freiburg-zuruckkehren-9917378.html,https://www.tagesspiegel.de/gesellschaft/panorama/entscheidung-von-papst-franziskus-ganswein-soll-rom-verlassen-und-nach-freiburg-zuruckkehren-9917378.html,0,www.tagesspiegel.de,Entscheidung von Papst Franziskus: Georg Gänswein soll ohne Amt nach Freiburg zurückkehren,"Gänswein, Privatsekretär von Papst Benedikt XVI., soll ohne Amt nach Freiburg zurückkehren. Papst Franziskus ordnete seine Abreise bis zum 1. Juli an.",https://www.tagesspiegel.de/gesellschaft/panorama/images/georg-ganswein/alternates/BASE_16_9_W1400/georg-gaenswein.jpeg,2023-06-02T11:04:49Z,https://web.archive.org/web/20230602114125/https://www.tagesspiegel.de/gesellschaft/panorama/entscheidung-von-papst-franziskus-ganswein-soll-rom-verlassen-und-nach-freiburg-zuruckkehren-9917378.html,"Der langjährige Privatsekretär von Papst Benedikt XVI., Georg Gänswein, soll nach Informationen der Tageszeitung Welt in sein Heimatbistum Freiburg zurückkehren und zwar ohne Amt. 
Papst Franziskus … [+1522 chars]",,de,'Papst Benedikt XVI'
https://www.welt.de/politik/deutschland/video245660522/Stefan-Aust-zum-AfD-Hoch-Deswegen-schleimt-die-CDU-geradezu-hinter-den-Gruenen-her.html,https://www.welt.de/politik/deutschland/video245660522/Stefan-Aust-zum-AfD-Hoch-Deswegen-schleimt-die-CDU-geradezu-hinter-den-Gruenen-her.html,0,www.welt.de,„Deswegen schleimt die CDU geradezu hinter den Grünen her“,In einer neuen Umfrage zieht die AfD mit der SPD gleich. Der CDU-Generalsekretär sieht den Grund für die jüngsten AfD-Zugewinne in der „Chaos-Politik“ der rot-grün-gelben Regierung. WELT-Herausgeber Stefan Aust hat zur aktuellen Lage in Deutschland eine ander…,https://img.welt.de/img/masters/mobile160492822/7651629427-ci16x9-w1200/welt-fallback-jpg.jpg,2023-06-02T11:06:09Z,http://archive.md/20230602125124/https://www.welt.de/politik/deutschland/video245660522/Stefan-Aust-zum-AfD-Hoch-Deswegen-schleimt-die-CDU-geradezu-hinter-den-Gruenen-her.html,"Die WELT als ePaper: Die vollständige Ausgabe steht Ihnen bereits am Vorabend zur Verfügung so sind Sie immer hochaktuell informiert. Weitere Informationen: http://epaper.welt.de 
 Der Kurz-Link die… [+49 chars]",,de,'Stefan Aust'
https://www.stern.de/gesellschaft/regional/baden-wuerttemberg/bericht--ex-benedikt-vertrauter-gaenswein-soll-nach-freiburg-gehen-33523730.html,https://www.stern.de/gesellschaft/regional/baden-wuerttemberg/bericht--ex-benedikt-vertrauter-gaenswein-soll-nach-freiburg-gehen-33523730.html,0,www.stern.de,Bericht: Ex-Benedikt-Vertrauter Gänswein soll nach Freiburg gehen,In Freiburg studierte Georg Gänswein einst Theologie und wurde zum Priester geweiht. Nun soll der enge Vertraute des verstorbenen Papstes einem Medienbericht zufolge in sein Heimatbistum zurückkehren.,https://image.stern.de/6681672/t/31/v5/w1440/r1.7778/-/video-fallback-image.jpg,2023-06-02T11:22:00Z,https://web.archive.org/web/20230602131849/https://www.stern.de/gesellschaft/regional/baden-wuerttemberg/bericht--ex-benedikt-vertrauter-gaenswein-soll-nach-freiburg-gehen-33523730.html,In Freiburg studierte Georg Gänswein einst Theologie und wurde zum Priester geweiht. Nun soll der enge Vertraute des verstorbenen Papstes einem Medienbericht zufolge in sein Heimatbistum zurückkehren… [+2921 chars],,de,'Georg Gänswein'
https://www.stern.de/politik/ausland/ukraine-krieg--russland-im--kriegschaos----und-putin-tut--als-waere-nichts-33523936.html,https://www.stern.de/politik/ausland/ukraine-krieg--russland-im--kriegschaos----und-putin-tut--als-waere-nichts-33523936.html,0,www.stern.de,"Ukraine-Krieg: Russland im ""Kriegschaos"" – und Putin tut, als wäre nichts","Drohnenangriffe in Moskau, Beschuss russischer Grenzregionen – das Echo von Kremlchef Putins Invasion in die Ukraine spüren immer mehr Menschen im eigenen Land. Auch die Kritik an seiner Kriegsführung ist laut.",https://image.stern.de/33523938/t/gt/v1/w1440/r1.7778/-/02--urnnewsmldpacom2009010123060299917499v2w800h600l1656t424r3224b1360jpeg---274937e181bda2f2.jpg,2023-06-02T11:23:41Z,https://web.archive.org/web/20230602115651/https://www.stern.de/politik/ausland/ukraine-krieg--russland-im--kriegschaos----und-putin-tut--als-waere-nichts-33523936.html,"Drohnenangriffe in Moskau, Beschuss russischer Grenzregionen das Echo von Kremlchef Putins Invasion in die Ukraine spüren immer mehr Menschen im eigenen Land. Auch die Kritik an seiner Kriegsführung … [+6552 chars]",,de,'Sergej Schoigu'
https://www.stern.de/news/-welt---papstsekretaer-gaenswein-kehrt-bald-nach-deutschland-zurueck-33523948.html,https://www.stern.de/news/-welt---papstsekretaer-gaenswein-kehrt-bald-nach-deutschland-zurueck-33523948.html,0,www.stern.de,"""Welt"": Papstsekretär Gänswein kehrt bald nach Deutschland zurück","Der Privatsekretär des verstorbenen Papsts Benedikt XVI., Erzbischof Georg Gänswein, kehrt nach Informationen der ""Welt"" bald nach Deutschland zurück. Papst Franziskus habe Gänswein bereits vor zwei Wochen im Rahmen einer Privataudienz angewiesen, bis spätest…",https://image.stern.de/33523950/t/W0/v1/w1440/r1.7778/-/02--georg-gaenswein-2019-mit-papst-franziskus---636ae9a5f4d44d6b.jpg,2023-06-02T11:28:30Z,https://web.archive.org/web/20230602115604/https://www.stern.de/news/-welt---papstsekretaer-gaenswein-kehrt-bald-nach-deutschland-zurueck-33523948.html,"Der Privatsekretär des verstorbenen Papsts Benedikt XVI., Erzbischof Georg Gänswein, kehrt nach Informationen der ""Welt"" bald nach Deutschland zurück. Papst Franziskus habe Gänswein bereits vor zwei … [+1296 chars]",,de,'Georg Gänswein'
https://www.stern.de/news/cdu-und-csu-machen-politik-der--ampel--fuer-afd-umfragehoch-verantwortlich-33524112.html,https://www.stern.de/news/cdu-und-csu-machen-politik-der--ampel--fuer-afd-umfragehoch-verantwortlich-33524112.html,0,www.stern.de,"CDU und CSU machen Politik der ""Ampel"" für AfD-Umfragehoch verantwortlich","CDU und CSU machen die Politik der Ampel-Koalition für das aktuelle Umfragehoch der AfD verantwortlich, sehen aber auch eigene Versäumnisse. CDU-Generalsekretär Mario Czaja warf der Regierung eine ""führungslose Chaos-Politik"" vor, die die Menschen verunsicher…",https://image.stern.de/33524114/t/BX/v1/w1440/r1.7778/-/02--afdlogo---cc72d674ff576de1.jpg,2023-06-02T12:07:46Z,https://web.archive.org/web/20230602122232/https://www.stern.de/news/cdu-und-csu-machen-politik-der--ampel--fuer-afd-umfragehoch-verantwortlich-33524112.html,"CDU und CSU machen die Politik der Ampel-Koalition für das aktuelle Umfragehoch der AfD verantwortlich, sehen aber auch eigene Versäumnisse. CDU-Generalsekretär Mario Czaja warf der Regierung eine ""f… [+3599 chars]",,de,'Mario Czaja'
https://www.welt.de/politik/deutschland/plus245655362/Katholische-Kirche-Die-Abrechnung-Papst-Franziskus-schickt-Gaenswein-fort.html,https://www.welt.de/politik/deutschland/plus245655362/Katholische-Kirche-Die-Abrechnung-Papst-Franziskus-schickt-Gaenswein-fort.html,0,www.welt.de,Die Abrechnung – Papst Franziskus schickt Georg Gänswein fort,"Seit dem Tod Benedikts XVI. spekulieren Katholiken in aller Welt: Was wird nun aus seinem Vertrauten, dem deutschen Erzbischof Georg Gänswein? Jetzt hat Papst Franziskus entschieden: Gänswein muss innerhalb von vier Wochen Rom verlassen – und zwar ohne Amt. C…",https://img.welt.de/img/politik/deutschland/mobile245655406/2431351297-ci16x9-w1200-fnov-fpotl-fpi157750653/Holy-Mass-And-Opening-Of-The-Holy-Door-Of-St-Peter-s-Basilica.jpg,2023-06-02T12:19:00Z,https://web.archive.org/web/20230602123854/https://www.welt.de/politik/deutschland/plus245655362/Katholische-Kirche-Die-Abrechnung-Papst-Franziskus-schickt-Gaenswein-fort.html,"Noch Jahre nach seinem spektakulären Rücktritt als Papst schwärmte Benedikt XVI. davon, wie freundlich sein Nachfolger Franziskus mit ihm umgehe.
Danke vor allen Ihnen, Heiliger Vater, sagte Benedik… [+374 chars]",,de,'Papst Franziskus'
https://www.focus.de/auto/news/um-faktor-8-verrechnet-e-fuels-experte-zerlegt-ehemaligen-vw-chef_id_195308027.html,https://www.focus.de/auto/news/um-faktor-8-verrechnet-e-fuels-experte-zerlegt-ehemaligen-vw-chef_id_195308027.html,0,www.focus.de,Windenergie - Um Faktor 8 verrechnet? E-Fuels-Experte widerspricht ehemaligem VW-Chef,Der geschasste VW-Chef Herbert Diess lieferte bei „Markus Lanz“ ein Rechnbeispiel für die Ineffizienz von synthetischen Kraftstoffen. Ein Experte macht eine ganz andere Rechnung auf. Auch VW-interne Daten kommen zu einem interessanten Ergebnis.,https://p6.focus.de/img/auto/news/id_188121455/mit-porsche-in-patagonien-sind-e-fuels-eine-alternative-.jpg?im=Crop%3D%280%2C58%2C1024%2C512%29%3BResize%3D%281200%2C627%29&impolicy=perceptual&quality=mediumHigh&hash=52c0a444bb7ccea4872532449edbd621825f44059690612bcf284ef39627e30b,2023-06-02T12:59:09Z,https://web.archive.org/web/20230602133438/https://www.focus.de/auto/news/um-faktor-8-verrechnet-e-fuels-experte-zerlegt-ehemaligen-vw-chef_id_195308027.html,"<ul><li>
Kommentare</li><li>
E-Mail</li><li>
Teilen</li><li>
Mehr</li><li>
Twitter</li><li>
Drucken</li><li>
Feedback</li><li>
Fehler meldenSie haben einen Fehler gefunden?
Bitte markieren S… [+6294 chars]",,de,'Herbert Diess'
https://www.n-tv.de/panorama/Georg-Gaenswein-vor-Rueckkehr-nach-Freiburg-article24164421.html,https://www.n-tv.de/panorama/Georg-Gaenswein-vor-Rueckkehr-nach-Freiburg-article24164421.html,0,www.n-tv.de,Franziskus setzt Deadline: Georg Gänswein vor Rückkehr nach Freiburg,"Georg Gänswein darf einem Bericht zufolge nicht im Vatikan bleiben. Das entscheidet Papst Franziskus kürzlich bei einer Privataudienz. Seine künftige Aufgabe ist derweil noch unklar. Vorstellungen hat Gänswein viele, dem Papst schwebt aber etwas anderes vor.",https://bilder3.n-tv.de/img/incoming/crop24164558/4701328644-cImg_16_9-w1200/404872126.jpg,2023-06-02T13:31:26Z,https://web.archive.org/web/20230602140929/https://www.n-tv.de/panorama/Georg-Gaenswein-vor-Rueckkehr-nach-Freiburg-article24164421.html,Georg Gänswein darf einem Bericht zufolge nicht im Vatikan bleiben. Das entscheidet Papst Franziskus kürzlich bei einer Privataudienz. Seine künftige Aufgabe ist derweil noch unklar. Vorstellungen ha… [+2899 chars],,de,'Georg Gänswein'
https://www.sueddeutsche.de/wirtschaft/cem-oezdemir-agrarwende-tierhaltung-1.5896263,https://www.sueddeutsche.de/wirtschaft/cem-oezdemir-agrarwende-tierhaltung-1.5896263,0,www.sueddeutsche.de,Agrarpolitik: Was macht eigentlich der Landwirtschaftsminister?,"Cem Özdemir ist angetreten, um die Landwirtschaft grüner zu machen. Doch vom Plan, die Tierhaltung zu reformieren, ist wenig geblieben. Auch sonst läuft es nicht rund. Und er selbst wäre wohl lieber woanders.",https://www.sueddeutsche.de/image/sz.1.5896462/1200x675?v=1685717938,2023-06-02T14:45:22Z,https://web.archive.org/web/20230602150905/https://www.sueddeutsche.de/wirtschaft/cem-oezdemir-agrarwende-tierhaltung-1.5896263,"2. Juni 2023, 16:45 UhrLesezeit: 6 min
Grüne Landwirtschaft
(Foto: imago images/Ale059/Bearbeitung:SZ)
Cem Özdemir ist angetreten, um die Landwirtschaft grüner zu machen. Doch vom Plan, die Tierha… [+1095 chars]",,de,'Cem Özdemir'
https://www.freitag.de/autoren/konrad-ege/46-demokraten-stimmen-beim-haushaltsdeal-gegen-den-praesidenten,https://www.freitag.de/autoren/konrad-ege/46-demokraten-stimmen-beim-haushaltsdeal-gegen-den-praesidenten,0,www.freitag.de,Meinung | Joe Biden pflegt beim Haushaltsdeal sein „Reich der Mitte“,"46 Demokraten stimmen beim Haushaltsdeal gegen den Präsidenten. Große Gewinner beim Kompromiss sind das Militär und die Rüstungsindustrie. Der Pentagon-Etat steigt, bei den Sozialausgaben sieht es hingegen ganz anders aus Das Thema Obergrenze für Staatsschuld…",https://www.freitag.de/autoren/konrad-ege/46-demokraten-stimmen-beim-haushaltsdeal-gegen-den-praesidenten/@@images/social_image,2023-06-02T15:00:00Z,https://web.archive.org/web/20230602160529/https://www.freitag.de/autoren/konrad-ege/46-demokraten-stimmen-beim-haushaltsdeal-gegen-den-praesidenten,Das Thema Obergrenze für Staatsschulden verschwindet nun wieder aus US-amerikanischen Talkshows. Ein vom demokratischen Präsidenten Joe Biden und der republikanischen Parteiführung ausgehandelter Kom… [+3397 chars],,de,'Kevin McCarthy'
https://www.n-tv.de/politik/Stoischer-Putin-tut-als-waere-nichts-passiert-article24164742.html,https://www.n-tv.de/politik/Stoischer-Putin-tut-als-waere-nichts-passiert-article24164742.html,0,www.n-tv.de,"""Kriegschaos"" zermürbt Russland: Stoischer Putin tut, als wäre nichts passiert","Russische Grenzregionen werden beschossen, über Moskau fliegen Drohnen - das Echo von Kremlchef Putins Invasion der Ukraine spüren immer mehr Menschen in Russland. Auch die Kritik an seiner Kriegsführung ist laut. Doch der Präsident will das aussitzen. Kann d…",https://bilder1.n-tv.de/img/incoming/crop24164312/5641327486-cImg_16_9-w1200/Putin-und-der-Machtapparat-sehen-sich-langst-im-Krieg-mit-dem-kollektiven-Westen-unter-Fuhrung-der-USA-die-es-auf-eine-Zerstorung-Russlands-abgesehen-hatten-und-dafur-die-Ukraine-nur-als-Schlachtfeld-nutzten.jpg,2023-06-02T15:12:32Z,https://web.archive.org/web/20230602153347/https://www.n-tv.de/politik/Stoischer-Putin-tut-als-waere-nichts-passiert-article24164742.html,"Russische Grenzregionen werden beschossen, über Moskau fliegen Drohnen - das Echo von Kremlchef Putins Invasion der Ukraine spüren immer mehr Menschen in Russland. Auch die Kritik an seiner Kriegsfüh… [+6627 chars]",,de,'Sergej Schoigu'
