index,url,valid,domain,title,description,image,published,archive,content,quote,language,keyword
https://www.brigitte.de/aktuell/mick-jagger-und-melanie-hamrick--rolling-stone-und-seine-freundin-sind-laengst-verlobt-13974514.html,https://www.brigitte.de/aktuell/mick-jagger-und-melanie-hamrick--rolling-stone-und-seine-freundin-sind-laengst-verlobt-13974514.html,0,www.brigitte.de,Mick Jagger und Melanie Hamrick: Rolling Stone und seine Freundin sind längst verlobt,"Sind sie, oder sind sie nicht? Nach Gerüchten um die Verlobung von Rolling Stone Mick Jagger und seiner Freundin ist es nun offiziell.",https://image.brigitte.de/13974516/t/cG/v1/w1440/r1.7778/-/11--rolling-stone-und-seine-freundin-sind-laengst-verlobt---1-1---spoton-article-1092938.jpg,2025-04-11T09:03:00Z,,"Sind sie, oder sind sie nicht? Nach Gerüchten um die Verlobung von Rolling Stone Mick Jagger und seiner Freundin ist es nun offiziell.
2023 hatte Melanie Hamrick (37) noch bestritten, dass sie mit M… [+1394 chars]",,de,'Mick Jagger'
https://www.n-tv.de/leute/Rolling-Stones-Star-Mick-Jagger-hat-sich-heimlich-verlobt-article25697709.html,https://www.n-tv.de/leute/Rolling-Stones-Star-Mick-Jagger-hat-sich-heimlich-verlobt-article25697709.html,0,www.n-tv.de,Hochzeit mit 81? Jein: Rolling-Stones-Star Mick Jagger hat sich heimlich verlobt,"Rolling-Stones-Star Mick Jagger traut sich mit 81 Jahre nochmal. Oder vielleicht auch nicht. Zwar hält er um die Hand von Melanie Hamrick an, doch mit der Hochzeit hat es die 37-Jährige offenbar nicht eilig.",https://www.n-tv.de/img/incoming/crop25697735/9631324097-cImg_16_9-w1200/imago806075959.jpg,2025-04-11T11:32:14Z,,"Rolling-Stones-Star Mick Jagger traut sich mit 81 Jahre nochmal. Oder vielleicht auch nicht. Zwar hält er um die Hand von Melanie Hamrick an, doch mit der Hochzeit hat es die 37-Jährige offenbar nich… [+1538 chars]",,de,'Mick Jagger'
https://www.stern.de/lifestyle/leute/prinz-harry-ueber-prozess-in-london---meine-schlimmsten-befuerchtungen-bestaetigt--35634822.html,https://www.stern.de/lifestyle/leute/prinz-harry-ueber-prozess-in-london---meine-schlimmsten-befuerchtungen-bestaetigt--35634822.html,0,www.stern.de,"Prinz Harry über Prozess in London: ""Meine schlimmsten Befürchtungen bestätigt""","Prinz Harry fühlt sich nach seinem Gerichtstermin ""erschöpft"" und spricht in einem aktuellen Interview über seine großen Enttäuschungen.",https://image.stern.de/35634826/t/pa/v1/w1440/r1.7778/-/11---meine-schlimmsten-befuerchtungen-bestaetigt----16-9---spoton-article-1093068.jpg,2025-04-11T19:19:00Z,,"Kopiere den aktuellen Link
Zur Merkliste hinzufügen
Prinz Harry fühlt sich nach seinem Gerichtstermin ""erschöpft"" und spricht in einem aktuellen Interview über seine großen Enttäuschungen.
""Erschö… [+3138 chars]",,de,'Prinz William'
https://www.n-tv.de/leute/Prinz-Harry-fuehlt-sich-erschoepft-und-ueberfordert-article25699678.html,https://www.n-tv.de/leute/Prinz-Harry-fuehlt-sich-erschoepft-und-ueberfordert-article25699678.html,0,www.n-tv.de,"Wegen Prozess in London: Prinz Harry fühlt sich ""erschöpft und überfordert""","Prinz Harry kämpft vor Gericht um Polizeischutz für seine Familie in Großbritannien. In einem Interview spricht der Sohn von König Charles jetzt über seinen Streit mit der britischen Regierung und offenbart dabei tiefe Enttäuschung: ""Meine schlimmsten Befürch…",https://www.n-tv.de/img/incoming/crop25699680/8001324338-cImg_16_9-w1200/518074076.jpg,2025-04-12T00:22:23Z,,Prinz Harry kämpft vor Gericht um Polizeischutz für seine Familie in Großbritannien. In einem Interview spricht der Sohn von König Charles jetzt über seinen Streit mit der britischen Regierung und of… [+3252 chars],,de,'Prinz William'
