index,url,valid,domain,title,description,image,published,archive,content,quote,language,keyword
https://www.welt.de/iconist/trends/article255337470/Heidi-Klum-Wird-die-20-die-letzte-Staffel-Germanys-Next-Topmodel.html,https://www.welt.de/iconist/trends/article255337470/Heidi-Klum-Wird-die-20-die-letzte-Staffel-Germanys-Next-Topmodel.html,0,www.welt.de,Wird das die letzte Staffel „Germanys Next Topmodel“?,"GNTM ist tot. Es lebe GNTM. Heidi Klum erfindet für ihre Show immer neue Einschaltgründe, in dem sie Kritik an ihr konsequent für sich nutzt. Kann das noch länger gut gehen? Ein Blick auf die Neuheiten der Jubiläumsstaffel.",https://img.welt.de/img/iconist/trends/mobile255347548/0697934917-ci16x9-w1200/Image-67a35ad6962f9c5582b77c4a.jpg,2025-02-06T09:57:13Z,,"GNTM ist tot. Es lebe GNTM. Heidi Klum erfindet für ihre Show immer neue Einschaltgründe, in dem sie Kritik an ihr konsequent für sich nutzt. Kann das noch länger gut gehen? Ein Blick auf die Neuheit… [+7201 chars]",,de,'Heidi Klum'
https://www.hdblog.it/sicurezza/articoli/n607974/bytedance-omnihuman-1-deepfake-ai-come-funziona/,https://www.hdblog.it/sicurezza/articoli/n607974/bytedance-omnihuman-1-deepfake-ai-come-funziona/,0,www.hdblog.it,Il deepfake più realistico è di ByteDance: OmniHuman-1 genera video impressionanti,Albert Einstein vero o falso?,https://hd2.tudocdn.net/1230535?w=1920,2025-02-06T10:10:00Z,,"ByteDance ha sviluppato OmniHuman-1, avanzato framework basato sull'intelligenza artificiale generativa per la creazione di video deepfake partendo da una singola immagine e da segnali di movimento (… [+2471 chars]",,de,'Albert Einstein'
https://www.stern.de/lifestyle/leute/gisele-buendchen-ist-erneut-mutter-geworden--das-ist-ueber-ihren-partner-bekannt-35445048.html,https://www.stern.de/lifestyle/leute/gisele-buendchen-ist-erneut-mutter-geworden--das-ist-ueber-ihren-partner-bekannt-35445048.html,0,www.stern.de,Gisele Bündchen ist erneut Mutter geworden: Das ist über ihren Partner bekannt,Seit 2023 daten Gisele Bündchen und Joaquim Valente sich. Was über den Mann an der Seite des Topmodels bekannt ist.,https://image.stern.de/35445052/t/lm/v1/w1440/r1.7778/-/06--das-ist-ueber-ihren-partner-bekannt---16-9---spoton-article-1086075.jpg,2025-02-06T11:38:00Z,,"Kopiere den aktuellen Link
Seit 2023 daten Gisele Bündchen und Joaquim Valente sich. Was über den Mann an der Seite des Topmodels bekannt ist.
Gisele Bündchen (44) und ihr Freund Joaquim Valente si… [+2591 chars]",,de,'Joaquim Valente'
https://www.brigitte.de/aktuell/gisele-buendchen-ist-erneut-mutter-geworden--das-ist-der-mann-an-der-seite-des-models-13942920.html,https://www.brigitte.de/aktuell/gisele-buendchen-ist-erneut-mutter-geworden--das-ist-der-mann-an-der-seite-des-models-13942920.html,0,www.brigitte.de,Gisele Bündchen ist erneut Mutter geworden: Das ist der Mann an der Seite des Models,Seit 2023 daten Gisele Bündchen und Joaquim Valente sich. Was über den Mann an der Seite des Topmodels bekannt ist.,https://image.brigitte.de/13942922/t/42/v1/w1440/r1.7778/-/06--das-ist-der-mann-an-der-seite-des-models---1-1---spoton-article-1086075.jpg,2025-02-06T11:43:00Z,,"Seit 2023 daten Gisele Bündchen und Joaquim Valente sich. Was über den Mann an der Seite des Topmodels bekannt ist.
Gisele Bündchen (44) und ihr Freund Joaquim Valente sind laut ""TMZ"" Eltern geworde… [+2669 chars]",,de,'Gisele Bündchen'
https://www.stern.de/panorama/heidi-klums-leben-im-luxus--so-wohnt-sie-mit-ihrer-familie-in-bel-air-34415682.html,https://www.stern.de/panorama/heidi-klums-leben-im-luxus--so-wohnt-sie-mit-ihrer-familie-in-bel-air-34415682.html,0,www.stern.de,Villa in Los Angeles: Leben im Luxus – so wohnt Topmodel Heidi Klum mit ihrer Familie in Bel Air,"Auf Instagram und TikTok gewährt das erfolgreiche Topmodel oft Einblicke in ihr privates Leben. Dabei zeigt Heidi Klum gerne ihre luxuriöse Villa, in der sie mit Tom Kaulitz und ihren Kindern lebt. Die Highlights ihres prunkvollen Hauses sehen Sie im Video.",https://image.stern.de/34415680/t/zT/v1/w1440/r1.7778/-/heidi-klum.jpg,2025-02-06T12:58:00Z,https://web.archive.org/web/20250208123440/https://www.stern.de/panorama/heidi-klums-leben-im-luxus--so-wohnt-sie-mit-ihrer-familie-in-bel-air-34415682.html,"Stern plusZugang zu stern+statt 
11,96 
 nur 1 
Jetzt testen
Bereits registriert?Hier anmelden",,de,'Tom Kaulitz'
https://www.n-tv.de/politik/20-55-Selenskyj-Nordkoreanische-Soldaten-wieder-in-Kursk-aktiv--article23143824.html,https://www.n-tv.de/politik/20-55-Selenskyj-Nordkoreanische-Soldaten-wieder-in-Kursk-aktiv--article23143824.html,0,www.n-tv.de,Ukraine-Krieg im Liveticker: +++ 20:55 Selenskyj: Nordkoreanische Soldaten wieder in Kursk aktiv +++,Lesen Sie alle aktuellen Entwicklungen und Nachrichten über den russischen Angriffskrieg auf die Ukraine im Liveticker von ntv.de.,https://www.n-tv.de/img/incoming/crop25117070/4231326595-cImg_16_9-w1200/Ukraine-Liveticker.jpg,2025-02-06T23:20:00Z,,In der russischen Grenzregion Kursk greifen nach Angaben des russischen Präsidenten Wolodymyr Selenskyj nordkoreanische Soldaten wieder in das Kampfgeschehen ein. Es gibt neue Angriffe auf die Einsat… [+25603 chars],,de,'Selenskyj'
https://www.n-tv.de/politik/19-15-Trump-Treffe-wahrscheinlich-naechste-Woche-Praesident-Selenskyj--article23143824.html,https://www.n-tv.de/politik/19-15-Trump-Treffe-wahrscheinlich-naechste-Woche-Praesident-Selenskyj--article23143824.html,0,www.n-tv.de,Ukraine-Krieg im Liveticker: +++ 19:15 Trump: Treffe wahrscheinlich nächste Woche Präsident Selenskyj +++,Lesen Sie alle aktuellen Entwicklungen und Nachrichten über den russischen Angriffskrieg auf die Ukraine im Liveticker von ntv.de.,https://www.n-tv.de/img/incoming/crop25117070/4231326595-cImg_16_9-w1200/Ukraine-Liveticker.jpg,2025-02-06T23:20:00Z,,US-Präsident Donald Trump wird eigenen Angaben zufolge in der kommenden Woche möglicherweise seinen ukrainischen Amtskollegen Wolodymyr Selenskyj treffen - zum ersten Mal seit seiner Rückkehr ins Wei… [+24113 chars],,de,'Rafael Grossi'
https://www.nzz.ch/international/bondi-laesst-hexenjagd-gegen-trump-untersuchen-ld.1869935,https://www.nzz.ch/international/bondi-laesst-hexenjagd-gegen-trump-untersuchen-ld.1869935,0,www.nzz.ch,Bondi lässt «Hexenjagd» gegen Trump untersuchen,"Donald Trumps Justizministerin ist seit Mittwoch im Amt. Nun ist klar: Pam Bondi will gegen jene, die den Präsidenten anklagten und gegen ihn ermittelten, vorgehen. Beim FBI wurden bereits etliche Spitzenbeamte entlassen und Listen mit Verdächtigen angefertig…","https://img.nzz.ch/2025/02/06/809eb230-2826-41e0-98a9-c8c2162cac15.jpeg?width=1200&height=675&fit=bounds&quality=75&auto=webp&crop=4000,2250,x0,y209&wmark=nzz",2025-02-07T04:30:00Z,http://archive.md/20250207072221/https://www.nzz.ch/international/bondi-laesst-hexenjagd-gegen-trump-untersuchen-ld.1869935,"Nach ihrer Vereidigung im Oval Office am Mittwoch lässt Pam Bondi eine mögliche Politisierung der Justiz untersuchen.
Donald Trumps politische Gegner warnten immer wieder vor einem juristischen Rach… [+5678 chars]",,de,'Alvin Bragg'
https://www.nzz.ch/meinung/donald-trump-und-elon-musk-haben-ihre-lust-am-spiel-mit-meme-coins-politisch-harmlos-ist-das-nicht-ld.1869713,https://www.nzz.ch/meinung/donald-trump-und-elon-musk-haben-ihre-lust-am-spiel-mit-meme-coins-politisch-harmlos-ist-das-nicht-ld.1869713,0,www.nzz.ch,GASTKOMMENTAR - Donald Trump und Elon Musk haben ihre Lust am Spiel mit Meme-Coins. Politisch harmlos ist das keineswegs,Kryptowährungen wie der kürzlich lancierte $Trump schlagen Profit aus kurzlebigen Internet-Hypes. Ihr Kursverlauf könnte bald auch Einfluss auf politische Entscheidungen nehmen – und umgekehrt.,"https://img.nzz.ch/2025/02/05/f4ba15f7-0cee-4c44-aa89-495a63a9c32f.jpeg?width=1200&height=675&fit=bounds&quality=75&auto=webp&crop=4000,2250,x0,y209&wmark=nzz",2025-02-07T04:30:00Z,,"Symbolbild der Meme-Kryptowährung Dogecoin, der Elon Musk in der Vergangenheit mehrmals Aufmerksamkeit verschafft hat.
Mit der Einführung einer eigenen Kryptowährung läutet der amerikanische Präside… [+4135 chars]",,de,'Melania Trump'
https://www.brigitte.de/aktuell/leni-klum--glamour-auftritt-in-new-york-city-13943314.html,https://www.brigitte.de/aktuell/leni-klum--glamour-auftritt-in-new-york-city-13943314.html,0,www.brigitte.de,Leni Klum: Glamour-Auftritt in New York City,In New York finden zur Fashion Week auch wieder zahlreiche Partys statt. Auch Leni Klum ließ sich dabei schon sehen.,https://image.brigitte.de/13943316/t/B4/v1/w1440/r1.7778/-/07--glamour-auftritt-in-new-york-city---1-1---spoton-article-1086137.jpg,2025-02-07T08:34:00Z,https://web.archive.org/web/20250207133831/https://www.brigitte.de/aktuell/leni-klum--glamour-auftritt-in-new-york-city-13943314.html,"In New York finden zur Fashion Week auch wieder zahlreiche Partys statt. Auch Leni Klum ließ sich dabei schon sehen.
Nachwuchsmodel Leni Klum (20) sorgt derzeit in ihrer Wahlheimat New York City für… [+1774 chars]",,de,'Heidi Klum'
https://www.stern.de/lifestyle/leute/bill-kaulitz-und-tom-kaulitz--ein-rueckblick-auf-ihr-leben-35027312.html,https://www.stern.de/lifestyle/leute/bill-kaulitz-und-tom-kaulitz--ein-rueckblick-auf-ihr-leben-35027312.html,0,www.stern.de,Tokio Hotel Twins: Bill und Tom Kaulitz: Von der ostdeutschen Einöde zu Heidi Klum und nach Hollywood,Im Sommer wird die zweite Staffel der Netflix-Serie von Bill und Tom Kaulitz anlaufen. Von der ostdeutschen Einöde bis nach L.A. – ein Rückblick auf das Leben der Zwillinge.,https://image.stern.de/35027358/t/j9/v3/w1440/r1.7778/-/2005-talkshow.jpg,2025-02-07T13:16:00Z,https://web.archive.org/web/20250207163512/https://www.stern.de/lifestyle/leute/bill-kaulitz-und-tom-kaulitz--ein-rueckblick-auf-ihr-leben-35027312.html,"Kopiere den aktuellen Link
Im Sommer wird die zweite Staffel der Netflix-Serie von Bill und Tom Kaulitz anlaufen. Von der ostdeutschen Einöde bis nach L.A. ein Rückblick auf das Leben der Zwillinge.… [+1119 chars]",,de,'Tom Kaulitz'
https://fm4.orf.at/stories/3046234/,https://fm4.orf.at/stories/3046234/,0,fm4.orf.at,Filmflimmern,"Dröseln wir mal die Aufregung um Karla Sofia Gascon auf, freuen wir uns auf Rooney Mara in einem Film von Werner Herzog und Isabelle Huppert in einem Film von Ulrike Ottinger. Harrison Ford findet „Shit happens“ und Rihanna ist die Stimme von Schlumpfine. Tie…",https://tubestatic.orf.at/static/images/site/tube/2025026/emilia-perez.6023322.jpeg,2025-02-07T13:46:00Z,,"Dröseln wir mal die Aufregung um Karla Sofia Gascon auf, freuen wir uns auf Rooney Mara in einem Film von Werner Herzog und Isabelle Huppert in einem Film von Ulrike Ottinger. Harrison Ford findet Sh… [+7268 chars]",,de,'Emma Stone'
https://www.bild.de/sport/mehr-sport/super-bowl-spektakulaeres-geruecht-um-us-praesident-donald-trump-67a65282906c2317d175bbc5,https://www.bild.de/sport/mehr-sport/super-bowl-spektakulaeres-geruecht-um-us-praesident-donald-trump-67a65282906c2317d175bbc5,0,www.bild.de,NFL macht ein Geheimnis draus - Spektakuläres Super-Bowl-Gerücht um Trump!,Donald Trump schaut als erster amtierender US-Präsident beim Super Bowl vorbei. Im Vorfeld gibt es ein hartnäckiges Gerücht.,"https://images.bild.de/67a65282906c2317d175bbc5/8df622d584680f8c9094486dd3ed0ec0,20a81af7?w=1280",2025-02-07T20:59:43Z,,"Bleibt es nicht nur beim Besuch?
Donald Trump schaut als erster amtierender US-Präsident beim Super Bowl zwischen den Philadelphia Eagles und Kansas City Chiefs am Sonntag in New Orleans vorbei. Er … [+1328 chars]",,de,'George Bush'
https://www.stern.de/politik/deutschland/tv-duell-im-liveblog--olaf-scholz-und-friedrich-merz-im-schlagabtausch-35452424.html,https://www.stern.de/politik/deutschland/tv-duell-im-liveblog--olaf-scholz-und-friedrich-merz-im-schlagabtausch-35452424.html,0,www.stern.de,Bundestagswahl: Scholz und Merz im Schlagabtausch – das TV-Duell im Liveblog,"Politik statt ""Tatort"": Bei ARD und ZDF treffen sich Olaf Scholz und Friedrich Merz zum TV-Duell. Der stern ist beim Showdown zwei Wochen vor der Bundestagswahl live dabei.",https://image.stern.de/35452460/t/Dc/v1/w1440/r1.7778/-/olaf-scholz-friedrich-merz-tv-duell-bundestagswahl.jpg,2025-02-09T18:15:00Z,,"Kopiere den aktuellen Link
Politik statt ""Tatort"": Bei ARD und ZDF treffen sich Olaf Scholz und Friedrich Merz zum TV-Duell. Der stern ist beim Showdown zwei Wochen vor der Bundestagswahl live dabei… [+1018 chars]",,de,'Caren Miosga'
https://www.morgenpost.de/panorama/article408268666/soeder-nach-dem-tv-duell-scholz-lebt-in-einer-anderen-welt.html,https://www.morgenpost.de/panorama/article408268666/soeder-nach-dem-tv-duell-scholz-lebt-in-einer-anderen-welt.html,0,www.morgenpost.de,Söder nach dem TV-Duell: „Scholz lebt in einer anderen Welt“,Olaf Scholz oder Friedrich Merz – wer hat das TV-Duell gewonnen? Bei „Caren Miosga“ lieferte eine Journalistin die präziseste Analyse.,https://img.sparknews.funkemedien.de/408268684/408268684_1739144748_v16_9_1600.jpeg,2025-02-09T23:45:48Z,,"Berlin. Olaf Scholz oder Friedrich Merz wer hat das TV-Duell gewonnen? Bei Caren Miosga lieferte eine Journalistin die präziseste Analyse.
Der Kanzler in Rage, sein Herausforderer auf Dauerattacke: … [+3841 chars]",,de,'Olaf Scholz'
https://www.welt.de/sport/article255383548/Super-Bowl-2025-Donald-Trump-erst-nicht-bemerkt-dann-frenetisch-gefeiert.html,https://www.welt.de/sport/article255383548/Super-Bowl-2025-Donald-Trump-erst-nicht-bemerkt-dann-frenetisch-gefeiert.html,0,www.welt.de,"Präsident Trump beim Super Bowl erst nicht bemerkt, dann frenetisch gefeiert",Als erster amtierender US-Präsident besucht Donald Trump den Super Bowl. Auf dem Weg zum NFL-Finale verkündet er in der Air Force One einen neuen Feiertag. In der Arena wird der 78-jährige Republikaner erst nicht bemerkt und dann gefeiert.,https://img.welt.de/img/sport/mobile255384804/6717930427-ci16x9-w1200/President-Donald-Trump-center-tal.jpg,2025-02-09T23:46:16Z,,Als erster amtierender US-Präsident besucht Donald Trump den Super Bowl. Auf dem Weg zum NFL-Finale verkündet er in der Air Force One einen neuen Feiertag. In der Arena wird der 78-jährige Republikan… [+3220 chars],,de,'George Bush'
https://www.dwdl.de/zahlenzentrale/101391/tvduell_deutlich_gefragter_als_das_triell_2021/,https://www.dwdl.de/zahlenzentrale/101391/tvduell_deutlich_gefragter_als_das_triell_2021/,0,www.dwdl.de,"""TV-Duell"" deutlich gefragter als das ""Triell"" 2021","Mit deutlich mehr als zwölf Millionen Zuschauern war das ""TV-Duell"" zwischen Olaf Scholz und Friedrich Merz deutlich erfolgreicher als das ""Triell"" im Jahr 2021. Die meisten waren im Ersten dabei, wo der Rückenwind ""Caren Miosga"" zu einem Rekord verhalf.",https://www.dwdl.de/images/1739171115_tv-duell-2025.jpg,2025-02-10T07:40:00Z,,"Anstelle von ""Tatort"" und Pilcher setzten ARD und ZDF am Sonntagabend auf Olaf Scholz und Friedrich Merz. Aus Quotensicht fuhren die öffentlich-rechtlichen Sender mit ihrem ""TV-Duell"" dabei sehr gut:… [+2530 chars]",,de,'Olaf Scholz'
https://www.telepolis.de/features/Bruessels-neue-Sorge-Trumps-Energie-Erpressung-10275530.html,https://www.telepolis.de/features/Bruessels-neue-Sorge-Trumps-Energie-Erpressung-10275530.html,0,www.telepolis.de,Brüssels neue Sorge: Trumps Energie-Erpressung,"Donald Trump erhöht den Druck auf die EU. Er fordert mehr Öl- und Gas-Käufe aus den USA, sonst drohen Strafzölle. Brüssel steht vor einem Dilemma.",https://heise.cloudimg.io/bound/1200x1200/q85.png-lossy-85.webp-lossy-85.foil1/_www-heise-de_/imgs/18/4/7/9/7/8/0/1/shutterstock_2108022380-03379a9b80fd895b.jpeg,2025-02-10T08:00:00Z,,"Energie eine Waffe in Trumps Händen. Bild: Tomasz Makowski/ Shutterstock.com
Donald Trump erhöht den Druck auf die EU. Er fordert mehr Öl- und Gas-Käufe aus den USA, sonst drohen Strafzölle. Brüssel… [+6250 chars]",,de,'Thierry Breton'
https://www.nzz.ch/video/bundestagswahl-in-deutschland/olaf-scholz-oder-friedrich-merz-beobachter-streiten-wer-als-sieger-aus-dem-tv-duell-hervorgegangen-ist-ld.1870327,https://www.nzz.ch/video/bundestagswahl-in-deutschland/olaf-scholz-oder-friedrich-merz-beobachter-streiten-wer-als-sieger-aus-dem-tv-duell-hervorgegangen-ist-ld.1870327,0,www.nzz.ch,"Olaf Scholz oder Friedrich Merz? Beobachter streiten darüber, wer als Sieger aus dem TV-Duell hervorgegangen ist","Politiker und Journalisten sind sich nicht einig, wer im Schlagabtausch der deutschen Kanzlerkandidaten besser abgeschnitten hat. Die Zuschauer hingegen sehen einen der Kontrahenten knapp vorn.","https://img.nzz.ch/2025/02/10/b51af6d5-ca08-43d4-9de1-c2718f39f6d2.jpeg?width=1200&height=675&fit=bounds&quality=75&auto=webp&crop=6000,3375,x0,y0&wmark=nzz",2025-02-10T08:21:31Z,http://archive.md/20250210092855/https://www.nzz.ch/video/bundestagswahl-in-deutschland/olaf-scholz-oder-friedrich-merz-beobachter-streiten-wer-als-sieger-aus-dem-tv-duell-hervorgegangen-ist-ld.1870327,"Der deutsche Bundeskanzler Olaf Scholz (links) und sein Herausforderer Friedrich Merz.
Nach der TV-Debatte des deutschen Bundeskanzlers Olaf Scholz und seines christlichdemokratischen Herausforderer… [+3640 chars]",,de,'Friedrich Merz'
https://www.horizont.net/marketing/talkingheads/kultur-schlaegt-unterhaltung-kendrick-lamar-mischt-die-halbzeitshow-des-super-bowls-auf-225747,https://www.horizont.net/marketing/talkingheads/kultur-schlaegt-unterhaltung-kendrick-lamar-mischt-die-halbzeitshow-des-super-bowls-auf-225747,0,www.horizont.net,Kultur schlägt Unterhaltung: Kendrick Lamar mischt die Halbzeitshow des Super Bowls auf,"Die Halbzeitshow des Super Bowls zeigt, was man gewinnt, wenn man auf Kultur statt auf Unterhaltung setzt. Die NFL mag mit Kendrick Lamars politischem Statement polarisieren, gewinnt aber an Relevanz. RTL wünscht sich derweil Katy Perry zurück - zu Unrecht, w…",https://www.horizont.net/news/media/47/Kendrick-Lamar-Super-Bowl-461895.jpeg,2025-02-10T16:17:00Z,,"Die Halbzeitshow des Super Bowls zeigt, was man gewinnt, wenn man auf Kultur statt auf Unterhaltung setzt. Die NFL mag mit Kendrick Lamars politischem Statement polarisieren, gewinnt aber an Relevanz… [+397 chars]",,de,'Katy Perry'
https://www.n-tv.de/leute/So-wurde-Heidi-Klum-zum-Fernsehstar-article25552552.html,https://www.n-tv.de/leute/So-wurde-Heidi-Klum-zum-Fernsehstar-article25552552.html,0,www.n-tv.de,Gestartet als Model: So wurde Heidi Klum zum Fernsehstar,"""Project Runway"", ""America's Got Talent"" und natürlich ""GNTM"". Heidi Klum hat sich als Moderatorin und Jurorin in Deutschland und den USA einen festen Platz in der Fernsehbranche erarbeitet. Ihren Durchbruch feierte sie 1992 bei Thomas Gottschalk bei einem Mo…",https://www.n-tv.de/img/incoming/crop25552555/7881329592-cImg_16_9-w1200/500712014.jpg,2025-02-10T21:17:33Z,https://web.archive.org/web/20250211102757/https://www.n-tv.de/leute/So-wurde-Heidi-Klum-zum-Fernsehstar-article25552552.html,"""Project Runway"", ""America's Got Talent"" und natürlich ""GNTM"". Heidi Klum hat sich als Moderatorin und Jurorin in Deutschland und den USA einen festen Platz in der Fernsehbranche erarbeitet. Ihren Du… [+5437 chars]",,de,'Tom Kaulitz'
https://www.faz.net/aktuell/feuilleton/debatten/kennedy-center-kultur-trump-konform-110288665.html,https://www.faz.net/aktuell/feuilleton/debatten/kennedy-center-kultur-trump-konform-110288665.html,0,www.faz.net,"Kennedy Center: Kultur, Trump-konform","Donald Trump macht mit seinem Plan Ernst, das Kennedy Center linientreu umzubauen. Neuer Exekutivdirektor soll Richard Grenell werden, ein enthusiastischer Anhänger Trumps. Zuvor war schon die Website „gesäubert“ worden.",https://media1.faz.net/ppmedia/aktuell/feuilleton/3821768568/1.10288667/facebook_teaser/blick-vom-stadtteil-georgetown.jpg,2025-02-11T06:44:55Z,http://archive.md/20250211140531/https://www.faz.net/aktuell/feuilleton/debatten/kennedy-center-kultur-trump-konform-110288665.html,"Donald Trump setzt seinen Angriff auf das Kennedy Center und dessen überparteilichen Charakter fort. Am Montag verkündete er, dass Richard Grenell übergangsweise Hauptgeschäftsführer (Executive Direc… [+3760 chars]",,de,'Donald Trump'
https://www.n-tv.de/sport/Aufarbeitung-des-deutschen-Turn-Skandals-wirft-Fragen-auf-article25554120.html,https://www.n-tv.de/sport/Aufarbeitung-des-deutschen-Turn-Skandals-wirft-Fragen-auf-article25554120.html,0,www.n-tv.de,Betroffene melden Zweifel an: Aufarbeitung des deutschen Turn-Skandals wirft Fragen auf,"Eine unabhängige Untersuchung soll die Vorwürfe innerhalb des Deutschen Turner-Bunds aufklären. Verpflichtet wird jedoch eine Kanzlei mit augenscheinlich engen Verbindungen zum Spitzensport. Das beunruhigt die, die eine ernst zu nehmende Auseinandersetzung mi…",https://www.n-tv.de/img/incoming/crop25554255/3861328900-cImg_16_9-w1200/imago45123025.jpg,2025-02-11T12:06:59Z,,Eine unabhängige Untersuchung soll die Vorwürfe innerhalb des Deutschen Turner-Bunds aufklären. Verpflichtet wird jedoch eine Kanzlei mit augenscheinlich engen Verbindungen zum Spitzensport. Das beun… [+2693 chars],,de,'nan nan'
https://www.horizont.net/medien/nachrichten/dienstags-maenner-donnerstags-frauen-heidi-klum-und-pro-sieben-verdoppeln-sendetermine-von-germanys-next-topmodel-225789,https://www.horizont.net/medien/nachrichten/dienstags-maenner-donnerstags-frauen-heidi-klum-und-pro-sieben-verdoppeln-sendetermine-von-germanys-next-topmodel-225789,0,www.horizont.net,"Dienstags Männer, donnerstags Frauen: Heidi Klum und Pro Sieben verdoppeln Sendetermine von ""Germany's Next Topmodel""","Dienstags Männer, donnerstags Frauen: Heidi Klum verdoppelt ihr Castingformat über Wochen hinweg. Die neue Staffel von ""Germany's Next Topmodel"" startet Donnerstag. Auch die Deneuve ist diesmal dabei.",https://www.horizont.net/news/media/47/Germanys-Next-Topmodel-Mnner-2025-462065.png,2025-02-11T15:40:00Z,,"Erst in Folge 13 am 27. März treffen alle Models zum ersten Mal aufeinander. Von da an läuft ""GNTM"" dann wie gewohnt nur noch donnerstags. Nach mehr als 300 Folgen und mehr als 3.000 Kandidatinnen un… [+535 chars]",,de,'Heidi Klum'
https://www.n-tv.de/politik/13-17-Trump-Gesandter-soll-sich-in-Moskau-mit-Putin-getroffen-haben--article23143824.html,https://www.n-tv.de/politik/13-17-Trump-Gesandter-soll-sich-in-Moskau-mit-Putin-getroffen-haben--article23143824.html,0,www.n-tv.de,Ukraine-Krieg im Liveticker: +++ 13:17 Trump-Gesandter soll sich in Moskau mit Putin getroffen haben +++,Lesen Sie alle aktuellen Entwicklungen und Nachrichten über den russischen Angriffskrieg auf die Ukraine im Liveticker von ntv.de.,https://www.n-tv.de/img/incoming/crop25117070/4231326595-cImg_16_9-w1200/Ukraine-Liveticker.jpg,2025-02-11T23:10:00Z,,"Trumps Gesandter für den Nahen Osten, Steve Witkoff, hat sich laut einem Bericht der ""Washington Post"" unter Berufung auf Angaben von Fox-News-Moderator Sean Hannity wahrscheinlich mit Wladimir Putin… [+17655 chars]",,de,'Putin'
https://www.diepresse.com/19355697/germanys-next-topmodel-bei-heidi-klum-wird-heuer-so-viel-gemodelt-wie-nie,https://www.diepresse.com/19355697/germanys-next-topmodel-bei-heidi-klum-wird-heuer-so-viel-gemodelt-wie-nie,0,www.diepresse.com,„Germany‘s Next Topmodel“: Bei Heidi Klum wird heuer so viel gemodelt wie nie,"Am 13. Februar startet die 20. Staffel. Anfangs wird es zwei Fernsehabende pro Woche geben, ab 27. März läuft „GNTM“ dann wie gewohnt nur noch donnerstags.",https://img.diepresse.com/public/incoming/vo37q1-2024-11-06T182517Z_168464441_RC2SZAA0DMYY_RTRMADP_3_BRITAIN-ROYALS-SAFRICA.JPG/alternates/DPR_SOCIAL_NACHRICHTEN/2024-11-06T182517Z_168464441_RC2SZAA0DMYY_RTRMADP_3_BRITAIN-ROYALS-SAFRICA.JPG,2025-02-12T08:47:16Z,,"Am 13. Februar startet die 20. Staffel. Anfangs wird es zwei Fernsehabende pro Woche geben, ab 27. März läuft GNTM dann wie gewohnt nur noch donnerstags. 
Fans der ProSieben-Show Germanys Next Topmo… [+2615 chars]",,de,'Heidi Klum'
https://www.bild.de/unterhaltung/tv-fernsehformate/heidi-klum-ab-morgen-wieder-germanys-next-topmodel-67aafafeee834d1ff67631a9,https://www.bild.de/unterhaltung/tv-fernsehformate/heidi-klum-ab-morgen-wieder-germanys-next-topmodel-67aafafeee834d1ff67631a9,0,www.bild.de,Morgen startet die neue GNTM-Staffel - Heidi stiefelt wieder los,"Heidi Klum blickt auf 20 Jahre „Germany’s Next Topmodel“ zurück und spricht über Veränderungen, Diversität und die Zusammenarbeit mit ihrer Mutter Erna.","https://images.bild.de/67aafafeee834d1ff67631a9/add05e6b626b68d4da8f5b96dc4ccc4a,a4ea2af?w=1280",2025-02-12T09:05:25Z,,Aufmarsch der neuen Mega-Models! Ab Donnerstag (13.2.) sucht Heidi Klum mit Germanys Next Topmodel wieder nach Deutschlands Schönsten. Bereits zum 20. Mal! 2006 lief die Show erstmals im deutschen TV… [+2844 chars],,de,'Heidi Klum'
https://www.dwdl.de/nachrichten/101426/kurzfristige_flucht_tv_total_weicht_dem_duell_mit_raab_aus/,https://www.dwdl.de/nachrichten/101426/kurzfristige_flucht_tv_total_weicht_dem_duell_mit_raab_aus/,0,www.dwdl.de,"Kurzfristige Flucht: ""TV total"" weicht dem Duell mit Raab aus","In Reaktion auf die Free-TV-Premiere von Raabs ""DGHNDM"" bei RTL schmeißt ProSieben extrem kurzfristig sein Programm um, heute und in Zukunft. Ab kommender Woche läuft ""TV total"" dienstags, mittwochs schickt ProSieben Heidi Klum gegen Stefan Raab ins Rennen.",https://www.dwdl.de/images/1718102233_tv-total.jpg,2025-02-12T14:28:00Z,http://archive.md/20250212144603/https://www.dwdl.de/nachrichten/101426/kurzfristige_flucht_tv_total_weicht_dem_duell_mit_raab_aus/,Das hat das deutsche Fernsehen schon länger nicht mehr erlebt: Nur wenige Stunden vor einem in der Branche mit viel Neugier erwarteten TV-Fernduell zwischen Sebastian Pufpaffs „TV total“ bei ProSiebe… [+2889 chars],,de,'Heidi Klum'
