index,url,valid,domain,title,description,image,published,archive,content,quote,language,keyword
https://www.faz.net/aktuell/gesellschaft/smalltalk/ellen-pompeo-taylor-swift-stellte-mir-den-groessten-scheck-aus-110399934.html,https://www.faz.net/aktuell/gesellschaft/smalltalk/ellen-pompeo-taylor-swift-stellte-mir-den-groessten-scheck-aus-110399934.html,0,www.faz.net,Ellen Pompeo: „Taylor Swift stellte mir den größten Scheck aus“,Vor zehn Jahren bat Taylor Swift die Schauspielerin Ellen Pompeo um einen Gastauftritt in ihrem Musikvideo. Die nutzte die Gelegenheit – und fragte die Sängerin ihrerseits um Unterstützung. Mit Erfolg.,https://media0.faz.net/ppmedia/aktuell/gesellschaft/1362980433/1.10400096/facebook_teaser/ellen-pompeo-im-mai-2024.jpg,2025-04-04T12:14:27Z,,Taylor Swift ist schon seit Jahren großer Fan der Arzt-Serie Greys Anatomy. Sie hat sogar eine ihrer Katzen nach der Hauptfigur Meredith Grey benannt. Davon profitierte in der Vergangenheit auch Elle… [+1077 chars],,de,'Taylor Swift'
https://www.tagesspiegel.de/berlin/der-prominente-wochenruckblick-wilder-ritt-durch-die-musikindustrie-13488058.html,https://www.tagesspiegel.de/berlin/der-prominente-wochenruckblick-wilder-ritt-durch-die-musikindustrie-13488058.html,0,www.tagesspiegel.de,Der prominente Wochenrückblick : Wilder Ritt durch die Musikindustrie,"In der vergangenen Woche ging es um allerlei popmusikalische Abgründe. Hier durften natürlich Bill und Tom Kaulitz, Till Lindemann, Kanye West und Fler nicht fehlen.",https://www.tagesspiegel.de/images/13490371/alternates/BASE_16_9_W1400/1743774780000/bill-kaulitz-und-tom-kaulitz-im-finale-der-13-staffel-der-castingshow-the-voice-of-germany-2023-im-studio-h-berlin-adle.jpeg,2025-04-04T14:05:04Z,https://web.archive.org/web/20250404180646/https://www.tagesspiegel.de/berlin/der-prominente-wochenruckblick-wilder-ritt-durch-die-musikindustrie-13488058.html,"Die Musikindustrie ist am Arsch. Das zumindest behauptet der Tokio-Hotel-Sänger Bill Kaulitz in der vergangenen Woche, nachdem er, gemeinsam mit seinem Zwillingsbruder Tom, mal wieder um Deutungshohe… [+6591 chars]",,de,'Tom Kaulitz'
https://www.dw.com/de/s%C3%BCdkorea-was-kommt-nach-der-amtsenthebung-von-yoon/a-72139633,https://www.dw.com/de/s%C3%BCdkorea-was-kommt-nach-der-amtsenthebung-von-yoon/a-72139633,0,www.dw.com,Südkorea: Was kommt nach der Amtsenthebung von Yoon?,Nach dem endgültigen politischen Aus für den bisherigen Staatspräsident Yoon Suk Yeol sieht sich Südkorea enormen innen- und außenpolitischen Herausforderungen gegenüber. Das politische Schicksal von Yoon Suk Yeol ist vorerst besiegelt: Das südkoreanische Ver…,https://static.dw.com/image/72134637_6.jpg,2025-04-04T14:37:00Z,https://web.archive.org/web/20250405000314/https://www.dw.com/de/s%25C3%25BCdkorea-was-kommt-nach-der-amtsenthebung-von-yoon/a-72139633,Das politische Schicksal von Yoon Suk Yeol ist besiegelt: Das südkoreanische Verfassungsgericht bestätigte am Freitag das Amtsenthebungsverfahren gegen den bisherigen Staatspräsidenten - genau 111 Ta… [+5287 chars],,de,'Yoon Suk Yeol'
https://www.focus.de/politik/meinung/analyse-von-ulrich-reitz-baerbocks-juengste-aussagen-zeigen-die-gruenen-haben-aussenpolitisch-ausgedient_812fbe86-4328-4a96-b498-f35bd7e01ea9.html,https://www.focus.de/politik/meinung/analyse-von-ulrich-reitz-baerbocks-juengste-aussagen-zeigen-die-gruenen-haben-aussenpolitisch-ausgedient_812fbe86-4328-4a96-b498-f35bd7e01ea9.html,0,www.focus.de,Analyse von Ulrich Reitz: Baerbocks jüngste Aussagen zeigen: Die Grünen haben außenpolitisch ausgedient,Die noch amtierende Außenministerin Annalena Baerbock würde Benjamin Netanjahu in Deutschland verhaften lassen. Grünen-Chefin Brantner gibt ihr Recht. Die Grünen sind außenpolitisch nicht mehr regierungsfähig.,https://quadro.burda-forward.de/ctf/a96e4816-b213-4072-8941-9521f7ac2674.b8b80e9b-231e-496f-a32c-3365440251ef.png?im=RegionOfInterestCrop%3D%281200%2C630%29%2CregionOfInterest%3D%28840%2C357%29&hash=a04b39cdcdd805055e17727badfee122aef2ed0fc87fae22ffc3e268f8b627b6,2025-04-04T15:21:43Z,https://web.archive.org/web/20250404155944/https://www.focus.de/politik/meinung/analyse-von-ulrich-reitz-baerbocks-juengste-aussagen-zeigen-die-gruenen-haben-aussenpolitisch-ausgedient_812fbe86-4328-4a96-b498-f35bd7e01ea9.html,Der amtierende Bundeskanzler Olaf Scholz würde Benjamin Netanjahu empfangen. Und nicht verhaften. Ebenso wie der wohl kommende Bundeskanzler Friedrich Merz. Anders sieht es die amtierende Bundesaußen… [+8559 chars],,de,'Ulrich Reitz'
https://www.stern.de/news/tausende-protestieren-in-suedkorea-gegen-absetzung-von-praesident-yoon-35615592.html,https://www.stern.de/news/tausende-protestieren-in-suedkorea-gegen-absetzung-von-praesident-yoon-35615592.html,0,www.stern.de,Tausende protestieren in Südkorea gegen Absetzung von Präsident Yoon,"In Südkorea sind tausende Menschen gegen die Amtsenthebung von Präsident Yoon Suk Yeol auf die Straße gegangen. In der Hauptstadt Seoul trotzen die Anhänger Yoons am Samstag dem Regen und skandierten ""Die Amtsenthebung ist ungültig"" oder ""Annulliert die vorge…",https://image.stern.de/35615594/t/kv/v1/w1440/r1.7778/-/05--anhaenger-yoons-protestieren-in-seoul---35aab09eb9302eaa.jpg,2025-04-05T11:17:02Z,,"Kopiere den aktuellen Link
Zur Merkliste hinzufügen
In Südkorea sind tausende Menschen gegen die Amtsenthebung von Präsident Yoon Suk Yeol auf die Straße gegangen. In der Hauptstadt Seoul trotzen d… [+1645 chars]",,de,'Yoon Suk Yeol'
https://www.zeit.de/politik/ausland/2025-04/suedkorea-yoon-praesident-proteste-seoul,https://www.zeit.de/politik/ausland/2025-04/suedkorea-yoon-praesident-proteste-seoul,0,www.zeit.de,Südkorea: Tausende protestieren gegen Amtsenthebung von Yoon Suk Yeol,"Die Amtsenthebung des ehemaligen Präsidenten Yoon sorgt weiter für Proteste in Südkorea. In Seol forderten seine Anhänger, eine geplante Neuwahl abzusagen.",https://img.zeit.de/gesellschaft/2025-04/suedkorea-demonstration-amtsenthebung-yoon-suk-yeol-bild/wide__1300x731,2025-04-05T13:38:57Z,https://web.archive.org/web/20250405134806/https://www.zeit.de/politik/ausland/2025-04/suedkorea-yoon-praesident-proteste-seoul,"Nach der Amtsenthebung von Yoon Suk Yeol sind in Südkorea erneut Tausende Menschen auf die Straße gegangen. In der Hauptstadt Seoul skandierte die Anhänger Yoons ""Die Amtsenthebung ist ungültig"" oder… [+1154 chars]",,de,'Yoon Suk Yeol'
https://www.stern.de/lifestyle/leute/koenig-charles-iii---darum-wurde-der-monarch-netter-35617446.html,https://www.stern.de/lifestyle/leute/koenig-charles-iii---darum-wurde-der-monarch-netter-35617446.html,0,www.stern.de,König Charles III.: Darum wurde der Monarch netter,"König Charles III. soll sich stark verändert haben. Angeblich ist er heute viel netter als früher, verriet sein langjähriger Fotograf.",https://image.stern.de/35617450/t/3S/v1/w1440/r1.7778/-/06--darum-wurde-der-monarch-netter---16-9---spoton-article-1092221.jpg,2025-04-06T13:57:00Z,,"Kopiere den aktuellen Link
Zur Merkliste hinzufügen
König Charles III. soll sich stark verändert haben. Angeblich ist er heute viel netter als früher, verriet sein langjähriger Fotograf.
Vom miese… [+2499 chars]",,de,'König Charles III'
https://www.kino.de/film/avengers-doomsday-2026/news/die-schlimmste-darstellung-von-doom-marvel-fans-ahnen-boeses-fuer-die-mcu-rueckkehr-von-robert-downey-jr/,https://www.kino.de/film/avengers-doomsday-2026/news/die-schlimmste-darstellung-von-doom-marvel-fans-ahnen-boeses-fuer-die-mcu-rueckkehr-von-robert-downey-jr/,0,www.kino.de,„Die schlimmste Darstellung von Doom“: Marvel-Fans ahnen Böses für die MCU-Rückkehr von Robert Downey Jr.,Robert Downey Jr. sorgt für neue Spekulationen über seine MCU-Rolle als Doctor Doom – und leider sind Fans alles andere als begeistert...,https://static.kino.de/wp-content/uploads/2025/04/rdj-rcm1200x627u.jpg,2025-04-07T09:29:43Z,,"Robert Downey Jr. sorgt für neue Spekulationen über seine MCU-Rolle als Doctor Doom – und leider sind Fans alles andere als begeistert.
Die Dreharbeiten zu „Avengers: Doomsday“ haben offiziell begon… [+2827 chars]",,de,'Robert Downey Jr'
"https://www.gamestar.de/artikel/avengers-doomsday-robert-downey-jr-dr-doom-leak,3430902.html","https://www.gamestar.de/artikel/avengers-doomsday-robert-downey-jr-dr-doom-leak,3430902.html",0,www.gamestar.de,Avengers: Doomsday - Hat Robert Downey Jr. uns das Aussehen von Dr. Doom verraten?,Ausgerechnet der Marvel-Star höchstselbst könnte uns den größten Leak seit langer Zeit beschert haben.,https://images.cgames.de/images/gamestar/293/rdj-dr-doom_6347371.jpg,2025-04-07T12:29:00Z,,"Die Infolage zu Avengers Doomsday ist genauso verschwommen wie RDJ auf unserem Teaserbild. Marvel rückt einfach nicht mit der Sprache raus! Bildquelle: Disney / Marvel
Robert Downey Jr. hat am 4. Ap… [+2618 chars]",,de,'Robert Downey Jr'
https://www.telepolis.de/features/Seoul-vor-Kurswechsel-Lee-will-Dialog-mit-Kim-Jong-Un-10342753.html,https://www.telepolis.de/features/Seoul-vor-Kurswechsel-Lee-will-Dialog-mit-Kim-Jong-Un-10342753.html,0,www.telepolis.de,Seoul vor Kurswechsel: Lee will Dialog mit Kim Jong Un,Nach der Amtsenthebung von Präsident Yoon steht Südkorea vor einem Neuanfang. Ein Sieg der Opposition könnte das Verhältnis zu Nordkorea grundlegend verändern. Ein Gastbeitrag.,https://heise.cloudimg.io/bound/1200x1200/q85.png-lossy-85.webp-lossy-85.foil1/_www-heise-de_/imgs/18/4/8/3/2/8/0/0/shutterstock_2119651889-7446934414876eea.jpeg,2025-04-07T22:00:00Z,,"Der wahrscheinliche Wahlsieg der Opposition in Südkorea hätte Folgen für die Region
(Bild: Visuals6x/Shutterstock.com)
Nach der Amtsenthebung von Präsident Yoon steht Südkorea vor einem Neuanfang. … [+6005 chars]",,de,'Yoon Suk Yeol'
https://www.stern.de/news/prinz-harry-streitet-vor-gericht-erneut-um-polizeischutz-waehrend-heimatbesuchen-35622354.html,https://www.stern.de/news/prinz-harry-streitet-vor-gericht-erneut-um-polizeischutz-waehrend-heimatbesuchen-35622354.html,0,www.stern.de,Prinz Harry streitet vor Gericht erneut um Polizeischutz während Heimatbesuchen,Der britische Prinz Harry streitet vor Gericht erneut um Polizeischutz während seiner Heimatbesuche. Der 40 Jahre alte Sohn von König Charles III. erschien am Dienstag zum Auftakt der zweitägigen Anhörungen vor dem Berufungsgericht in London. Die Entscheidung…,https://image.stern.de/35622356/t/QH/v1/w1440/r1.7778/-/08--prinz-harry-mit-sicherheitspersonal-vor-dem-gerichtsgebaeude---a57aaf6be6a74044.jpg,2025-04-08T09:59:50Z,https://web.archive.org/web/20250408145144/https://www.stern.de/news/prinz-harry-streitet-vor-gericht-erneut-um-polizeischutz-waehrend-heimatbesuchen-35622354.html,"Kopiere den aktuellen Link
Zur Merkliste hinzufügen
Der britische Prinz Harry streitet vor Gericht erneut um Polizeischutz während seiner Heimatbesuche. Der 40 Jahre alte Sohn von König Charles III… [+3284 chars]",,de,'König Charles III'
https://www.stern.de/lifestyle/leute/prinzessin-kate--familienauftritt-an-besonderem-tag-geplant-35623422.html,https://www.stern.de/lifestyle/leute/prinzessin-kate--familienauftritt-an-besonderem-tag-geplant-35623422.html,0,www.stern.de,Prinzessin Kate: Familienauftritt an besonderem Tag geplant,"Prinzessin Kate soll mit ihrem Mann, ihren Kindern und König Charles an einer Veranstaltung Anfang Mai teilnehmen. Das ist bisher bekannt.",https://image.stern.de/35623426/t/C5/v1/w1440/r1.7778/-/08--familienauftritt-an-besonderem-tag-geplant---16-9---spoton-article-1092514.jpg,2025-04-08T13:41:00Z,https://web.archive.org/web/20250408153847/https://www.stern.de/lifestyle/leute/prinzessin-kate--familienauftritt-an-besonderem-tag-geplant-35623422.html,"Kopiere den aktuellen Link
Zur Merkliste hinzufügen
Prinzessin Kate soll mit ihrem Mann, ihren Kindern und König Charles an einer Veranstaltung Anfang Mai teilnehmen. Das ist bisher bekannt.
Prinz… [+1754 chars]",,de,'Prinzessin Kate'
https://www.kino.de/film/avengers-doomsday-2026/news/albtraum-szenario-erstes-bild-vom-avengers-5-schurke-laesst-marvel-fans-fassungslos-zurueck/,https://www.kino.de/film/avengers-doomsday-2026/news/albtraum-szenario-erstes-bild-vom-avengers-5-schurke-laesst-marvel-fans-fassungslos-zurueck/,0,www.kino.de,„Albtraum-Szenario“: Erstes Bild vom „Avengers 5“-Schurken lässt Marvel-Fans fassungslos zurück,Robert Downey Jr. sorgt für neue Spekulationen über seine MCU-Rolle als Doctor Doom – und leider sind Fans alles andere als begeistert...,https://static.kino.de/wp-content/uploads/2025/04/imago98677388-rcm1200x627u.jpg,2025-04-08T14:30:43Z,,"Robert Downey Jr. sorgt für neue Spekulationen über seine MCU-Rolle als Doctor Doom – und leider sind Fans alles andere als begeistert.
Die Dreharbeiten zu „Avengers: Doomsday“ haben offiziell begon… [+2667 chars]",,de,'Robert Downey Jr'
https://www.focus.de/politik/meinung/analyse-von-ulrich-reitz-mit-einem-satz-vernichtet-esken-merz-asylwende_5de93415-8c3b-44cb-bb37-e52bc602baa8.html,https://www.focus.de/politik/meinung/analyse-von-ulrich-reitz-mit-einem-satz-vernichtet-esken-merz-asylwende_5de93415-8c3b-44cb-bb37-e52bc602baa8.html,0,www.focus.de,Analyse von Ulrich Reitz: Mit einem Satz vernichtet Esken Merz' Asylwende,Zum Ende der Koalitionsverhandlungen zeichnet sich ab: Eine von Friedrich Merz verfolgte „Asylwende“ dürfte es nicht geben. Verantwortlich dafür ist auch: Saskia Esken.,https://quadro.burda-forward.de/ctf/77c06445-de5a-4334-96bb-b4cefdb50bd7.24bce678-95e9-47d7-80bb-bf74695ffb0f.jpeg?im=RegionOfInterestCrop%3D%281200%2C630%29%2CregionOfInterest%3D%28619%2C307%29&hash=6303ab710d9d0870362b7b180677a4d932ba0fba13b8b45395d81dc4e2af3b55,2025-04-08T14:50:52Z,https://web.archive.org/web/20250408154815/https://www.focus.de/politik/meinung/analyse-von-ulrich-reitz-mit-einem-satz-vernichtet-esken-merz-asylwende_5de93415-8c3b-44cb-bb37-e52bc602baa8.html,"Die SPD will keine Migrationswende a´ la Merz. Sie lehnt allein den Gedanken an eine Asylwende ab. Saskia Esken, die Co-Vorsitzende der SPD, hat auf den letzten Metern im Koalitionspoker noch ein Ass… [+9062 chars]",,de,'Ulrich Reitz'
https://www.nzz.ch/panorama/seit-50-jahren-verliebt-seit-20-jahren-verheiratet-ld.1879210,https://www.nzz.ch/panorama/seit-50-jahren-verliebt-seit-20-jahren-verheiratet-ld.1879210,0,www.nzz.ch,"König Charles III. und Königin Camilla: Seit 50 Jahren verliebt, seit 20 Jahren verheiratet","Das britische Königspaar feiert seinen Hochzeitstag. Rückblick auf eine turbulente Beziehung, die sehr viel früher begann als erlaubt.","https://img.nzz.ch/2025/04/08/e9054076-e784-4e34-9a10-d538ce4f4464.jpeg?width=1200&height=674&fit=bounds&quality=75&auto=webp&crop=3393,1908,x830,y268&wmark=nzz",2025-04-08T17:53:40Z,https://web.archive.org/web/20250408230247/https://www.nzz.ch/panorama/seit-50-jahren-verliebt-seit-20-jahren-verheiratet-ld.1879210,"König Charles III. und Königin Camilla posieren kurz vor ihrem 20. Jahrestag in Rom.
Camilla war die grosse Liebe von Charles. Das war sie immer. Schon 1981, als Charles eine gewisse Diana Spencer h… [+7598 chars]",,de,'König Charles III'
https://www.n-tv.de/politik/Suedkoreas-neuer-Praesident-muss-nicht-nur-den-Handelskrieg-bewaeltigen-article25690326.html,https://www.n-tv.de/politik/Suedkoreas-neuer-Praesident-muss-nicht-nur-den-Handelskrieg-bewaeltigen-article25690326.html,0,www.n-tv.de,Machtwechsel steht an: Südkoreas neuer Präsident muss nicht nur den Handelskrieg bewältigen,Nach der Amtsenthebung des Präsidenten Yoon Suk Yeol steht Südkorea vor einem Machtwechsel. Neben Arbeitsminister Kim Moon-soo wird wahrscheinlich Oppositionsführer Lee Jae-myung seine Kandidatur erklären. Auf den neuen Staatschef warten viele Aufgaben.,https://www.n-tv.de/img/incoming/crop25690591/2171321762-cImg_16_9-w1200/imago809081246.jpg,2025-04-09T10:58:26Z,,Nach der Amtsenthebung des Präsidenten Yoon Suk Yeol steht Südkorea vor einem Machtwechsel. Neben Arbeitsminister Kim Moon-soo wird wahrscheinlich Oppositionsführer Lee Jae-myung seine Kandidatur erk… [+1550 chars],,de,'Yoon Suk Yeol'
https://www.n-tv.de/leute/Als-Charles-und-Camilla-vor-20-Jahren-heirateten-article25690895.html,https://www.n-tv.de/leute/Als-Charles-und-Camilla-vor-20-Jahren-heirateten-article25690895.html,0,www.n-tv.de,Hochzeit voller Katastrophen: Als Charles und Camilla vor 20 Jahren heirateten,"Als der heutige König Charles und Camilla vor genau 20 Jahren heiraten, ist dies kein einfaches Unterfangen. Nicht nur, weil beide bereits geschieden sind und der Tod von Prinzessin Diana auf ihrer Beziehung lastet. Auch sonst gibt es so manche Hindernisse.",https://www.n-tv.de/img/incoming/crop25690902/671132821-cImg_16_9-w1200/315121928.jpg,2025-04-09T11:48:16Z,https://web.archive.org/web/20250409122311/https://www.n-tv.de/leute/Als-Charles-und-Camilla-vor-20-Jahren-heirateten-article25690895.html,"Als der heutige König Charles und Camilla vor genau 20 Jahren heiraten, ist dies kein einfaches Unterfangen. Nicht nur, weil beide bereits geschieden sind und der Tod von Prinzessin Diana auf ihrer B… [+4955 chars]",,de,'Prinzessin Diana'
https://www.n-tv.de/mediathek/videos/wirtschaft/Es-geht-Trump-um-die-wirtschaftliche-Weltherrschaft-article25690829.html,https://www.n-tv.de/mediathek/videos/wirtschaft/Es-geht-Trump-um-die-wirtschaftliche-Weltherrschaft-article25690829.html,0,www.n-tv.de,"Reitz erklärt ""Zollkrieg"" der USA: Es geht Trump ""um die wirtschaftliche Weltherrschaft""","Die von Donald Trump verhängten Zölle haben massive Auswirkungen auf die Weltwirtschaft, auch US-Konzerne wie Apple leiden massiv. Warum der US-Präsident vor allem China gegenüber hart bleibt, erklärt ntv-Wirtschaftskorrespondent Ulrich Reitz.",https://www.n-tv.de/img/incoming/crop25691676/4301321446-cImg_16_9-w1200/ntvt.jpg,2025-04-09T13:15:29Z,https://web.archive.org/web/20250409150935/https://www.n-tv.de/mediathek/videos/wirtschaft/Es-geht-Trump-um-die-wirtschaftliche-Weltherrschaft-article25690829.html,,,de,'Donald Trump'
https://www.zeit.de/politik/ausland/2025-04/urteil-david-bendels-nancy-faeser-meinungsfreiheit-gericht,https://www.zeit.de/politik/ausland/2025-04/urteil-david-bendels-nancy-faeser-meinungsfreiheit-gericht,0,www.zeit.de,Urteil gegen David Bendels: Niemand muss nett zu Nancy Faeser sein,"Der rechte Publizist David Bendels wurde verurteilt, weil er eine Satire auf die Innenministerin gepostet hat. Er sollte im Berufungsverfahren Recht bekommen.",https://img.zeit.de/politik/2025-04/urteil-david-bendels-nancy-faeser-meinungsfreiheit-gericht-bamberg/wide__1300x731,2025-04-09T18:12:27Z,https://web.archive.org/web/20250409184347/https://www.zeit.de/politik/ausland/2025-04/urteil-david-bendels-nancy-faeser-meinungsfreiheit-gericht,"Inhalt
Auf einer Seite lesen
 Inhalt
<ol><li>Seite 1Niemand muss nett zu Nancy Faeser sein
</li><li>Seite 2Eine Karikatur wär kein Problem</li></ol>
David Bendels ist kein Mann, den ich zum Aben… [+4415 chars]",,de,'Adolf Hitler'
https://www.stern.de/news/prozess-um-polizeischutz--anwaeltin-spricht-von-lebensgefahr-fuer-prinz-harry-35626102.html,https://www.stern.de/news/prozess-um-polizeischutz--anwaeltin-spricht-von-lebensgefahr-fuer-prinz-harry-35626102.html,0,www.stern.de,Prozess um Polizeischutz: Anwältin spricht von Lebensgefahr für Prinz Harry,"Im Berufungsprozess um die Forderung des britischen Prinzen Harry nach umfassendem Polizeischutz bei seinen Heimatbesuchen hat dessen Anwältin vor einer Gefahr für das Leben des 40-Jährigen gewarnt. ""Hier sitzt ein Mensch (...), dessen Sicherheit und Leben in…",https://image.stern.de/35627782/t/26/v1/w1440/r1.7778/-/09--harry-beim-verlassen-des-gerichts-in-london---f2d8cf7bcbf31e10.jpg,2025-04-09T18:20:55Z,https://web.archive.org/web/20250409205524/https://www.stern.de/news/prozess-um-polizeischutz--anwaeltin-spricht-von-lebensgefahr-fuer-prinz-harry-35626102.html,"Kopiere den aktuellen Link
Zur Merkliste hinzufügen
Im Berufungsprozess um die Forderung des britischen Prinzen Harry nach umfassendem Polizeischutz bei seinen Heimatbesuchen hat dessen Anwältin vo… [+3342 chars]",,de,'Prinz William'
https://www.stern.de/lifestyle/leute/prinz-william-und-george-jubeln-und-leiden-auf-der-tribuene-35627920.html,https://www.stern.de/lifestyle/leute/prinz-william-und-george-jubeln-und-leiden-auf-der-tribuene-35627920.html,0,www.stern.de,Aston Villa: Prinz William und George jubeln und leiden in der Champions League,Prinz William ist leidenschaftlicher Fan von Aston Villa. Natürlich durfte er sich das historische Spiel in Paris nicht entgehen lassen – und hatte seinen Sohn im Schlepptau.,https://image.stern.de/35627922/t/Wr/v1/w1440/r1.7778/-/prinz-william-und-george.jpg,2025-04-09T21:18:00Z,https://web.archive.org/web/20250409212527/https://www.stern.de/lifestyle/leute/prinz-william-und-george-jubeln-und-leiden-auf-der-tribuene-35627920.html,"Kopiere den aktuellen Link
Zur Merkliste hinzufügen
Prinz William ist leidenschaftlicher Fan von Aston Villa. Natürlich durfte er sich das historische Spiel in Paris nicht entgehen lassen und hatte… [+2200 chars]",,de,'Prinz George'
https://www.diepresse.com/19565443/suedkoreas-oppositionsfuehrer-erklaert-seine-praesidentschaftskandidatur,https://www.diepresse.com/19565443/suedkoreas-oppositionsfuehrer-erklaert-seine-praesidentschaftskandidatur,0,www.diepresse.com,Südkoreas Oppositionsführer erklärt seine Präsidentschaftskandidatur,Nach der Absetzung von Yoon Suk Yeol wählt Südkorea neu. Lee Jae Myung war ihm bei der Wahl 2022 nur knapp unterlegen. Er führte die Demokratische Partei zu einem Erdrutschsieg bei den Parlamentswahlen.,https://img.diepresse.com/public/incoming/s91blx-SOUTHKOREA-ELECTION/alternates/DPR_SOCIAL_NACHRICHTEN/SOUTHKOREA-ELECTION,2025-04-10T05:55:19Z,,Nach der Absetzung von Yoon Suk Yeol wählt Südkorea neu. Lee Jae Myung war ihm bei der Wahl 2022 nur knapp unterlegen. Er führte die Demokratische Partei zu einem Erdrutschsieg bei den Parlamentswahl… [+2104 chars],,de,'Yoon Suk Yeol'
https://www.stern.de/lifestyle/leute/vip-news--prinz-william-aeussert-sich-nach-champions-league-niederlage-von-aston-villa-3205306.html,https://www.stern.de/lifestyle/leute/vip-news--prinz-william-aeussert-sich-nach-champions-league-niederlage-von-aston-villa-3205306.html,0,www.stern.de,"Leute von heute : ""Es ist noch nicht vorbei"": Prinz William äußert sich nach Niederlage von Aston Villa","Aston Villa, Lieblingsverein von Prinz William, droht nach einer Niederlage gegen Paris Saint-Germain das Aus in der Champions League. Doch der Royal hat noch Hoffnung. Diese und weitere Promi-Meldungen lesen Sie in den VIP-News.",https://image.stern.de/35628566/t/lE/v5/w1440/r1.7778/-/prinz-william-prinz-george.jpg,2025-04-10T07:58:00Z,https://web.archive.org/web/20250410101901/https://www.stern.de/lifestyle/leute/vip-news--prinz-william-aeussert-sich-nach-champions-league-niederlage-von-aston-villa-3205306.html,"Kopiere den aktuellen Link
Zur Merkliste hinzufügen
Aston Villa, Lieblingsverein von Prinz William, droht nach einer Niederlage gegen Paris Saint-Germain das Aus in der Champions League. Doch der R… [+779 chars]",,de,'Prinz William'
https://www.stern.de/kultur/tv/germanys-next-topmodel/gntm-2025--was-ist-passiert-und-wer-ist-raus---alle-infos-zu-folge-15-35628634.html,https://www.stern.de/kultur/tv/germanys-next-topmodel/gntm-2025--was-ist-passiert-und-wer-ist-raus---alle-infos-zu-folge-15-35628634.html,0,www.stern.de,"""Germany's Next Topmodel"": GNTM 2025: Heidi Klum wirft Kandidaten nach Motz-Auftritt aus der Show","Der Bergretter trifft GNTM: Für einen Videodreh holt Heidi Klum Schauspieler Sebastian Ströbel zu ""Germany's Next Topmodel"". Lust, mit ihm vor der Kamera zu stehen, haben aber nicht alle Kandidaten.",https://image.stern.de/35628944/t/ZE/v1/w1440/r1.7778/-/gntm-2025-ethan.jpg,2025-04-10T21:15:00Z,,"Kopiere den aktuellen Link
Zur Merkliste hinzufügen
Der Bergretter trifft GNTM: Für einen Videodreh holt Heidi Klum Schauspieler Sebastian Ströbel zu ""Germany's Next Topmodel"". Lust, mit ihm vor de… [+4768 chars]",,de,'Heidi Klum'
https://www.kino.de/artikel/germanys-next-topmodel-2025-wer-ist-raus-nach-folge-15--9qp37ccgrp,https://www.kino.de/artikel/germanys-next-topmodel-2025-wer-ist-raus-nach-folge-15--9qp37ccgrp,0,www.kino.de,„Germany’s Next Topmodel“ 2025: Wer ist raus nach Folge 15?,„Germany’s Next Topmodel“ feiert 2025 ein besonderes Jubiläum. Heidi Klum führt durch die Jubiläumsshow mit exklusiven Gästen. Wir haben alle Updates für euch.,https://static.kino.de/2c/e2/33/9b2621f50b7a96fc63063ad06c_ZmMgN2E5NzcwMGFmZmZmIDEyMDAgMAMyMjk2ZmI5YzBhNg==_p7_gntm_start_3072163.jpg,2025-04-10T21:20:46Z,,"Germanys Next Topmodel feiert 2025 ein besonderes Jubiläum. Heidi Klum führt durch die Jubiläumsshow mit exklusiven Gästen. Wir haben alle Updates für euch.
2025 feiert die erfolgreiche Show Germany… [+4494 chars]",,de,'Heidi Klum'
https://www.stern.de/lifestyle/leute/mick-jagger-und-melanie-hamrick--laengst-verlobt---wann-wird-geheiratet--35632720.html,https://www.stern.de/lifestyle/leute/mick-jagger-und-melanie-hamrick--laengst-verlobt---wann-wird-geheiratet--35632720.html,0,www.stern.de,Mick Jagger und Melanie Hamrick: Längst verlobt - wann wird geheiratet?,"Sind sie, oder sind sie nicht? Nach Gerüchten um die Verlobung von Rolling Stone Mick Jagger und seiner Freundin ist es nun offiziell.",https://image.stern.de/35632724/t/ly/v1/w1440/r1.7778/-/11--laengst-verlobt---wann-wird-geheiratet----16-9---spoton-article-1092938.jpg,2025-04-11T08:59:00Z,,"Kopiere den aktuellen Link
Zur Merkliste hinzufügen
Sind sie, oder sind sie nicht? Nach Gerüchten um die Verlobung von Rolling Stone Mick Jagger und seiner Freundin ist es nun offiziell.
2023 hatt… [+1444 chars]",,de,'Mick Jagger'
