index,url,valid,domain,title,description,image,published,archive,content,quote,language,keyword
https://www.brigitte.de/aktuell/jennifer-lopez--ausgelassener-italien-tripp-13574244.html,https://www.brigitte.de/aktuell/jennifer-lopez--ausgelassener-italien-tripp-13574244.html,0,www.brigitte.de,Jennifer Lopez: Ausgelassener Italien-Tripp,Nicht nur Heidi Klum liebt Capri. Auch Jennifer Lopez machte jetzt die italienische Insel unsicher und gab sogar einen Gig im Nachtclub.,https://image.brigitte.de/13574246/t/wM/v1/w1440/r1.7778/-/14--ausgelassener-italien-tripp---1-1---spoton-article-1050413.jpg,2023-08-14T05:12:00Z,,"Nicht nur Heidi Klum liebt Capri. Auch Jennifer Lopez machte jetzt die italienische Insel unsicher und gab sogar einen Gig im Nachtclub.
Jennifer Lopez (54) genießt derzeit ""la dolce vita"" in Italie… [+1445 chars]",,de,'Jennifer Lopez'
https://www.stern.de/lifestyle/leute/jennifer-lopez--sie-geniesst-sonne-und-spaghetti-in-italien-33734046.html,https://www.stern.de/lifestyle/leute/jennifer-lopez--sie-geniesst-sonne-und-spaghetti-in-italien-33734046.html,0,www.stern.de,Jennifer Lopez: Sie genießt Sonne und Spaghetti in Italien,Nicht nur Heidi Klum liebt Capri. Auch Jennifer Lopez machte jetzt die italienische Insel unsicher und gab sogar einen Gig im Nachtclub.,https://image.stern.de/33734050/t/As/v1/w1440/r1.7778/-/14--sie-geniesst-sonne-und-spaghetti-in-italien---16-9---spoton-article-1050413.jpg,2023-08-14T05:22:00Z,,"Nicht nur Heidi Klum liebt Capri. Auch Jennifer Lopez machte jetzt die italienische Insel unsicher und gab sogar einen Gig im Nachtclub.
Jennifer Lopez (54) genießt derzeit ""la dolce vita"" in Italie… [+1416 chars]",,de,'Jennifer Lopez'
https://www.focus.de/kultur/stars/so-ausgelassen-geniesst-jennifer-lopez-ihren-italien-tripp_id_201780020.html,https://www.focus.de/kultur/stars/so-ausgelassen-geniesst-jennifer-lopez-ihren-italien-tripp_id_201780020.html,0,www.focus.de,- So ausgelassen geniesst Jennifer Lopez ihren Italien-Tripp,"Viele Prominente haben eine große Vorliebe für Italien und Jennifer Lopez gehört offensichtlich auch dazu. Sie nutzte ihre Zeit dort nicht nur, um sich am Strand zu entspannen und Spaghetti zu essen, sondern trat auch in einem Nachtclub auf Capri auf und gab …",https://p6.focus.de/img/kultur/kino_tv/id_201780018/so-ausgelassen-geniesst-jennifer-lopez-ihren-italien-tripp.jpg?im=Crop%3D%280%2C65%2C1000%2C500%29%3BResize%3D%281200%2C627%29&impolicy=perceptual&quality=mediumHigh&hash=89d17ac77c5dabe8a027187a7d40888b5ae8bd3fe1edf90b689ca7d71e8bfb2d,2023-08-14T06:18:31Z,,"Jennifer Lopez (54) genießt derzeit la dolce vita in Italien. Dazu gehörte auch ein spontaner Auftritt im beliebten Nachtclub Taverna Anema e Core auf Capri.
Wie People berichtete, genoss die Sänger… [+1395 chars]",,de,'Jennifer Lopez'
https://www.iphone-ticker.de/e-rezept-26-mio-eingeloest-iphone-app-in-neuer-version-219093/,https://www.iphone-ticker.de/e-rezept-26-mio-eingeloest-iphone-app-in-neuer-version-219093/,0,www.iphone-ticker.de,"E-Rezept: 2,6 Millionen eingelöst, iPhone-App in neuer Version","Eineinhalb Monate nach der offiziellen Einführung des so genannten E-Rezeptes in Deutschland liegen die ersten Zahlen zu einem der großen Digitalisierungs-Projekte des deutschen Gesundheitssystems vor. Bisher wurden über 2,6 Millionen E-Rezepte von Versichert…",https://images.iphone-ticker.de/wp-content/uploads/2023/08/e-rezept.jpg,2023-08-15T12:55:31Z,,Eineinhalb Monate nach der offiziellen Einführung des so genannten E-Rezeptes in Deutschland liegen die ersten Zahlen zu einem der großen Digitalisierungs-Projekte des deutschen Gesundheitssystems vo… [+1985 chars],,de,'Karl Lauterbach'
https://www.stern.de/kultur/hollywood-legende--von--taxi-driver--bis--the-irishman---rober-de-niro-wird-80-33743024.html,https://www.stern.de/kultur/hollywood-legende--von--taxi-driver--bis--the-irishman---rober-de-niro-wird-80-33743024.html,0,www.stern.de,"Hollywood-Legende: Von ""Taxi Driver"" bis ""The Irishman"": Rober De Niro wird 80","Als Leinwand-Mafioso wurde er weltberühmt, als Comedy-Star machte er Kasse. Mit 80 Jahren macht Robert De Niro unermüdlich weiter. Auch als frischgebackener Vater - sein siebtes Kind kam im April zur Welt.",https://image.stern.de/33743026/t/TV/v1/w1440/r1.7778/-/17--urnnewsmldpacom2009010123081699856482v3w800h600l686t153r1906b1254jpeg---7c09907b62b018d0.jpg,2023-08-16T14:57:17Z,,"Als Leinwand-Mafioso wurde er weltberühmt, als Comedy-Star machte er Kasse. Mit 80 Jahren macht Robert De Niro unermüdlich weiter. Auch als frischgebackener Vater - sein siebtes Kind kam im April zur… [+5633 chars]",,de,'Robert De Niro'
https://www.nzz.ch/feuilleton/robert-de-niro-wird-80-ld.1751645,https://www.nzz.ch/feuilleton/robert-de-niro-wird-80-ld.1751645,0,www.nzz.ch,Ein Gigant des amerikanischen Films: Robert De Niro wird 80 Jahre alt,"In «Taxi Driver» führte er ein legendäres Selbstgespräch vor dem Spiegel, in «The Godfather Part II» ging der New Yorker über Leichen: Robert De Niro prägte jahrzehntelang das Hollywoodkino. Heute legt er sich mit Trump an. Und überrascht mit seiner siebten V…","https://img.nzz.ch/2023/08/15/874d5288-9881-43d7-8b98-72b1ba5d3765.jpeg?width=1200&height=675&fit=bound&quality=75&auto=webp&crop=3036,1708,x0,y799&wmark=nzz",2023-08-17T03:30:00Z,,"Seine Mutter erklärte das Erfolgsgeheimnis ihres Sohns einmal so: «Willenskraft. Schiere Willenskraft.» Robert De Niro in «Mean Streets» (1973).
Robert De Niro ist ein Mann mit vielen Gesichtern, un… [+11233 chars]",,de,'Robert de Niro'
https://www.stern.de/kultur/hollywood-legende--von--taxi-driver--bis--the-irishman---robert-de-niro-wird-80-33743024.html,https://www.stern.de/kultur/hollywood-legende--von--taxi-driver--bis--the-irishman---robert-de-niro-wird-80-33743024.html,0,www.stern.de,"Hollywood-Legende: Von ""Taxi Driver"" bis ""The Irishman"": Robert De Niro wird 80","Als Leinwand-Mafioso wurde er weltberühmt, als Comedy-Star machte er Kasse. Mit 80 Jahren macht Robert De Niro unermüdlich weiter. Auch als frischgebackener Vater - sein siebtes Kind kam im April zur Welt.",https://image.stern.de/33743026/t/cx/v2/w1440/r1.7778/-/17--urnnewsmldpacom2009010123081699856482v3w800h600l686t153r1906b1254jpeg---7c09907b62b018d0.jpg,2023-08-17T05:45:51Z,,"Als Leinwand-Mafioso wurde er weltberühmt, als Comedy-Star machte er Kasse. Mit 80 Jahren macht Robert De Niro unermüdlich weiter. Auch als frischgebackener Vater - sein siebtes Kind kam im April zur… [+5633 chars]",,de,'Drena De Niro'
https://www.bild.de/unterhaltung/leute/leute/robert-de-niro-feiert-runden-geburtstag-der-pate-wird-80-85052746.bild.html,https://www.bild.de/unterhaltung/leute/leute/robert-de-niro-feiert-runden-geburtstag-der-pate-wird-80-85052746.bild.html,0,www.bild.de,"„Der Pate“ wird 80 - Herzlichen Glückwunsch, Robert de Niro!",Robert De Niro ist Oscar-Preisträger und einer der größten Charakterdarsteller der Welt. Heute wird er 80 Jahre alt. Herzlichen Glückwunsch!,"https://images.bild.de/64db5481ee043c076c8d32e5/fa30da4d3dec1f3aa4e0409a03645708,3fb85f63?w=1280",2023-08-17T06:59:17Z,https://web.archive.org/web/20230817221135/https://www.bild.de/unterhaltung/leute/leute/robert-de-niro-feiert-runden-geburtstag-der-pate-wird-80-85052746.bild.html,"Den meisten Prominenten sieht man es gar nicht an, aber auch sie werden älter. 
Und dann steht auf der Tagesordnung: Partys, süße Kinderfotos und teure Geschenke! Doch wer feiert heute Geburtstag?
… [+1854 chars]",,de,'Robert De Niro'
https://www.brigitte.de/aktuell/robert-de-niro-wird-80--der-wilde-stier-und-spaete-vater-hat-geburtstag-13576012.html,https://www.brigitte.de/aktuell/robert-de-niro-wird-80--der-wilde-stier-und-spaete-vater-hat-geburtstag-13576012.html,0,www.brigitte.de,Robert De Niro wird 80: Der wilde Stier und späte Vater hat Geburtstag,Robert De Niro mag zwar 80 Jahre alt geworden sein. Gesagt hat ihm das offenbar niemand - weder in beruflicher noch in privater Hinsicht.,https://image.brigitte.de/13576014/t/Yl/v1/w1440/r1.7778/-/17--der-wilde-stier-und-spaete-vater-hat-geburtstag---1-1---spoton-article-1050184.jpg,2023-08-17T07:07:00Z,,"Robert De Niro mag zwar 80 Jahre alt geworden sein. Gesagt hat ihm das offenbar niemand - weder in beruflicher noch in privater Hinsicht.
Der Zusatz ""Legende"" wird recht inflationär benutzt. Regie-L… [+5284 chars]",,de,'Drena De Niro'
https://www.focus.de/kultur/vermischtes/robert-de-niro-feiert-seinen-80-geburtstag_id_202054734.html,https://www.focus.de/kultur/vermischtes/robert-de-niro-feiert-seinen-80-geburtstag_id_202054734.html,0,www.focus.de,Erst im Mai wurde er wieder Vater - Robert De Niro feiert seinen 80. Geburtstag,Weltstar Robert De Niro feiert seinen 80. Von seinen ersten Filmerfolgen in den 1970er Jahren bis zum späten Vaterglück mit 79 Jahren hat der zweifache Oscar-Preisträger schon viele Höhen und Tiefen erlebt.,https://p6.focus.de/img/kultur/vermischtes/id_202054733/robert-de-niro-denkt-auch-mit-80-jahren-nicht-ans-karriereende..jpg?im=Crop%3D%280%2C125%2C1000%2C500%29%3BResize%3D%281200%2C627%29&impolicy=perceptual&quality=mediumHigh&hash=4ef48f2dd68c58dd4b1839f84f4172f736e8cdb88cd7a6a6ed1063f625b93675,2023-08-17T07:10:06Z,,"Der Zusatz Legende wird recht inflationär benutzt. Regie-Legenden hier, Musik-Legenden da, Film-Legenden dort drüben - Legenden soweit das Auge blickt. Ein Mann, der sich diesen Titel mit inzwischen … [+5071 chars]",,de,'Robert De Niro'
https://www.stern.de/lifestyle/leute/robert-de-niro-wird-80--vom-feigen-loewen-zum-wilden-stier-33743702.html,https://www.stern.de/lifestyle/leute/robert-de-niro-wird-80--vom-feigen-loewen-zum-wilden-stier-33743702.html,0,www.stern.de,Robert De Niro wird 80: Vom feigen Löwen zum wilden Stier,Robert De Niro mag zwar 80 Jahre alt geworden sein. Gesagt hat ihm das offenbar niemand - weder in beruflicher noch in privater Hinsicht.,https://image.stern.de/33743706/t/SB/v1/w1440/r1.7778/-/17--vom-feigen-loewen-zum-wilden-stier---16-9---spoton-article-1050184.jpg,2023-08-17T07:15:00Z,https://web.archive.org/web/20230818181737/https://www.stern.de/lifestyle/leute/robert-de-niro-wird-80--vom-feigen-loewen-zum-wilden-stier-33743702.html,"Robert De Niro mag zwar 80 Jahre alt geworden sein. Gesagt hat ihm das offenbar niemand - weder in beruflicher noch in privater Hinsicht.
Der Zusatz ""Legende"" wird recht inflationär benutzt. Regie-L… [+5284 chars]",,de,'Robert de Niro'
