index,url,valid,domain,title,description,image,published,archive,content,quote,language,keyword
https://www.faz.net/aktuell/politik/ausland/kritik-an-israel-labour-und-prinz-william-fordern-waffenruhe-in-gaza-19535197.html,https://www.faz.net/aktuell/politik/ausland/kritik-an-israel-labour-und-prinz-william-fordern-waffenruhe-in-gaza-19535197.html,0,www.faz.net,Kritik an Israel: Labour und Prinz William fordern Ende der Kämpfe in Gaza,Der Appell von Thronfolger William ist mit der konservativen Regierung abgestimmt. Die Forderungen der Labour-Opposition gehen noch weiter. Ihr israelkritischer Kurs wird durch die schottischen Nationalisten angetrieben.,https://media0.faz.net/ppmedia/aktuell/politik/4064242669/1.9535400/facebook_teaser/labour-chef-keir-starmer-links.jpg,2024-02-21T14:31:46Z,https://web.archive.org/web/20240221152520/https://www.faz.net/aktuell/politik/ausland/kritik-an-israel-labour-und-prinz-william-fordern-waffenruhe-in-gaza-19535197.html,In Großbritannien werden die Forderungen nach einer Einstellung der Kampfhandlungen in Gaza schärfer. Thronfolger Prinz William formulierte mit Billigung der britischen Regierung einen deutlichen App… [+3294 chars],,de,'Prinz William'
https://www.faz.net/aktuell/politik/inland/warum-es-zwischen-csu-und-freien-waehlern-knirscht-19535156.html,https://www.faz.net/aktuell/politik/inland/warum-es-zwischen-csu-und-freien-waehlern-knirscht-19535156.html,0,www.faz.net,CSU und Freie Wähler: Nadelstiche in der „Bayernkoalition“,"Die CSU-Landtagsfraktion hat einen „5-Punkte-Plan“ für den wirtschaftlichen Aufschwung verabschiedet. Es richtet sich an den Bund, aber auch an Hubert Aiwanger.",https://media1.faz.net/ppmedia/aktuell/politik/2057986901/1.9535191/facebook_teaser/der-csu-fraktionsvorsitzende.jpg,2024-02-21T15:32:50Z,,"Die CSU-Landtagsfraktion hat am Mittwoch einen 5-Punkte-Plan für den Aufschwung verabschiedet. Dieser Umstand dokumentiert zunächst einmal den Willen des neuen Fraktionsvorsitzenden Klaus Holetschek,… [+2751 chars]",,de,'Hubert Aiwanger'
https://www.stern.de/kultur/-barbie--regisseurin-greta-gerwig--haette-sich-oscar-fuer-margot-robbie-gewuenscht-34481574.html,https://www.stern.de/kultur/-barbie--regisseurin-greta-gerwig--haette-sich-oscar-fuer-margot-robbie-gewuenscht-34481574.html,0,www.stern.de,"""Barbie""-Regisseurin Greta Gerwig: Hätte sich Oscar für Margot Robbie gewünscht",Nun meldet sich auch Greta Gerwig zum Skandal um die Nicht-Nominierung zu Wort: Natürlich habe sie Margot Robbie einen Oscar gewünscht.,https://image.stern.de/34481578/t/Bi/v1/w1440/r1.7778/-/22--haette-sich-oscar-fuer-margot-robbie-gewuenscht---16-9---spoton-article-1061749.jpg,2024-02-22T07:39:00Z,,"Nun meldet sich auch Greta Gerwig zum Skandal um die Nicht-Nominierung zu Wort: Natürlich habe sie Margot Robbie einen Oscar gewünscht.
Noch immer schlägt der Nicht-Nominierungs-Skandal um Greta Ger… [+2036 chars]",,de,'America Ferrera'
https://www.welt.de/politik/deutschland/video250210922/Jens-Spahn-zum-Wachstumschancengesetz-Die-Ampel-hat-eine-dreifache-Chance-vertan.html,https://www.welt.de/politik/deutschland/video250210922/Jens-Spahn-zum-Wachstumschancengesetz-Die-Ampel-hat-eine-dreifache-Chance-vertan.html,0,www.welt.de,„Die Ampel hat eine dreifache Chance vertan“,"Die Zukunft des Wachstumschancengesetzes bleibt weiter ungewiss, trotz eines Vermittlungsausschusses. Der stellvertretende Fraktionsvorsitzende Jens Spahn (CDU) sieht hier eine dreifach vertane Chance: „Vor allem hätten wir Vertrauen in die Demokratie zurückg…",https://img.welt.de/img/politik/deutschland/mobile250210994/8691358477-ci16x9-w1200/jens-spahn-2202-01-jpg.jpg,2024-02-22T08:24:01Z,,"Die WELT als ePaper: Die vollständige Ausgabe steht Ihnen bereits am Vorabend zur Verfügung so sind Sie immer hochaktuell informiert. Weitere Informationen: http://epaper.welt.de 
 Der Kurz-Link die… [+49 chars]",,de,'Jens Spahn'
https://www.focus.de/politik/deutschland/spahn-wird-deutlich-olaf-scholz-will-die-menschen-fuer-dumm-verkaufen_id_259693635.html,https://www.focus.de/politik/deutschland/spahn-wird-deutlich-olaf-scholz-will-die-menschen-fuer-dumm-verkaufen_id_259693635.html,0,www.focus.de,Spahn wird deutlich - „Olaf Scholz will die Menschen für dumm verkaufen“,Die Bundesregierung bekommt die Wirtschaft nicht in den Griff. CDU-Mann Jens Spahn fordert deshalb jetzt einen Wirtschaftsgipfel. Olaf Scholz geht er hart an. Und auch Robert Habeck kriegt sein Fett weg.,https://p6.focus.de/img/politik/deutschland/id_203197726/der-abgeordnete-jens-spahn-cdu-bei-einer-rede-im-bundestag..jpg?im=Crop%3D%280%2C170%2C2048%2C1024%29%3BResize%3D%281200%2C627%29&impolicy=perceptual&quality=mediumHigh&hash=5c6b543a3a53cd64d54772b77d54fe1ada19a0e617f894e4af8784c250b3edf7,2024-02-22T08:45:37Z,,Die Bundesregierung bekommt die Wirtschaft nicht in den Griff. CDU-Mann Jens Spahn fordert deshalb jetzt einen Wirtschaftsgipfel. Olaf Scholz geht er hart an. Und auch Robert Habeck kriegt sein Fett … [+2237 chars],,de,'Jens Spahn'
https://www.n-tv.de/leute/Greta-Gerwig-ist-fuer-Margot-Robbie-enttaeuscht-article24754570.html,https://www.n-tv.de/leute/Greta-Gerwig-ist-fuer-Margot-Robbie-enttaeuscht-article24754570.html,0,www.n-tv.de,Fehlende Oscar-Nominierung: Greta Gerwig ist für Margot Robbie enttäuscht,"Zwar kann der Film ""Barbie"" acht Oscar-Nominierungen einfahren, doch Hauptdarstellerin Margot Robbie und Regisseurin Greta Gerwig sind nicht nominiert. Während Robbie neulich schon öffentlich machte, sich für Gerwig zu ärgern, nimmt diese es für sich selbst l…",https://bilder3.n-tv.de/img/incoming/crop24754574/9651327785-cImg_16_9-w1200/imago0263159734h.jpg,2024-02-22T09:05:02Z,,"Zwar kann der Film ""Barbie"" acht Oscar-Nominierungen einfahren, doch Hauptdarstellerin Margot Robbie und Regisseurin Greta Gerwig sind nicht nominiert. Während Robbie neulich schon öffentlich machte,… [+2039 chars]",,de,'Margot Robbie'
https://feed.laut.de/News/Bestseller-K-Pop-regiert-die-Welt-22-02-2024-20252,https://feed.laut.de/News/Bestseller-K-Pop-regiert-die-Welt-22-02-2024-20252,0,feed.laut.de,Bestseller: K-Pop regiert die Welt,2023 verkauften nach Taylor Swift die K-Pop-Gruppen Seventeen und Stray Kids die meisten Alben. Ausschlaggebend ist das Marketing.,https://www.laut.de/News/Bestseller-K-Pop-regiert-die-Welt-22-02-2024-20252/bestseller-k-pop-regiert-welt-232821.jpg,2024-02-22T10:56:41Z,,"2023 verkauften nach Taylor Swift die K-Pop-Gruppen Seventeen und Stray Kids die meisten Alben. Ausschlaggebend ist das Marketing.
London (elv) - Alljährlich veröffentlicht The International Federat… [+4242 chars]",,de,'Zach Bryan'
https://www.tagesspiegel.de/politik/habeck-wettert-gegen-voodoo-finanzpolitik-der-union-11253133.html,https://www.tagesspiegel.de/politik/habeck-wettert-gegen-voodoo-finanzpolitik-der-union-11253133.html,0,www.tagesspiegel.de,Minister fordert Ende der Blockade beim Wachstumspaket : Habeck wettert gegen „Voodoo-Finanzpolitik“ der Union,"Deutschland steckt tief in der Krise. Für CSU-Landesgruppenchef Dobrindt ist der Wirtschaftsminister dafür verantwortlich. Der wiederum ermahnt die Union, dem Wachstumspaket zuzustimmen.",https://www.tagesspiegel.de/images/deutscher-bundestag-154-plenarsitzung-wirtschafts-und-klimaminister-robert-habeck-gruene-im-portrait-spielt-der-min/alternates/BASE_16_9_W1400/deutscher-bundestag-154-plenarsitzung-wirtschafts--und-klimaminister-robert-habeck-gruene-im-portrait-spielt-der-min.jpeg,2024-02-22T12:16:41Z,,Bundeswirtschaftsminister Robert Habeck hat die Union zu einem Ende der Blockade beim Wachstumspaket aufgefordert. Hören Sie auf die Wirtschaftsverbände und geben Sie dem Wachstumschancengesetz endli… [+4170 chars],,de,'Jens Spahn'
https://fm4.orf.at/stories/3039484/,https://fm4.orf.at/stories/3039484/,0,fm4.orf.at,Filmflimmern,"Vier Beatles-Biopics, eine FCK AFD-Unterhose, Sandra Hüller war bei Jimmy Kimmel, ein Spin Off von „Ferris Bueller’s Day Off“ ist geplant und Cate Blanchett kriegen wir in einer Compuerspiel-Verfilmung zu sehen. Außerdem: Hunde-Content und Vorfreude auf Josef…",https://tubestatic.orf.at/static/images/site/tube/2024028/clipboard10.6009393.jpg,2024-02-22T15:00:00Z,,"Vier Beatles-Biopics, eine FCK AFD-Unterhose, Sandra Hüller war bei Jimmy Kimmel, ein Spin Off von Ferris Buellers Day Off ist geplant und Cate Blanchett kriegen wir in einer Compuerspiel-Verfilmung … [+5124 chars]",,de,'Jimmy Kimmel'
https://www.sueddeutsche.de/bayern/bayern-hubert-aiwanger-austritte-freie-waehler-franken-1.6385926,https://www.sueddeutsche.de/bayern/bayern-hubert-aiwanger-austritte-freie-waehler-franken-1.6385926,0,www.sueddeutsche.de,Hubert Aiwanger: Aiwanger laufen die Franken davon,"Im Norden Bayerns haben die Freien Wähler ein Problem, lokale Partei-Größen treten aus, Ortsverbände gehen von der Stange. Begründung jeweils: Aiwangers Kurs. Sind das lauter Einzelfälle?",https://www.sueddeutsche.de/image/sz.1.6386059/1200x675?v=1708618008,2024-02-22T15:34:26Z,,"Im Norden Bayerns haben die Freien Wähler ein Problem, lokale Partei-Größen treten aus, Ortsverbände gehen von der Stange. Begründung jeweils: Aiwangers Kurs. Sind das lauter Einzelfälle? Fast 28 Jah… [+532 chars]",,de,'Hubert Aiwanger'
https://orf.at/stories/3349505/,https://orf.at/stories/3349505/,0,orf.at,Staatsanwältin will auch Immobilien pfänden,"Die New Yorker Staatsanwältin Letitia James hat Ex-US-Präsident Donald Trump gedroht, wertvolle Immobilien einzuziehen, sollte er nicht seine Hunderte Millionen Dollar schwere Strafe, zu der er in dem Betrugsprozess in New York verurteilt worden war, zahlen. …",https://ibs.orf.at/news?image=https%3A%2F%2Fassets.orf.at%2Fmims%2F2024%2F08%2F66%2Fcrops%2Fw%3D1200%2Ch%3D630%2Cq%3D75%2F2115738_master_799966_trump_urteil_immobilien_pfand_im.jpg%3Fs%3Df39eb8c7f6b6cb888f889e25c082bfcb98c4fdaf,2024-02-22T19:59:36Z,,"Wenn er nicht über die Mittel verfügt, um das Urteil zu begleichen, werden wir gerichtliche Maßnahmen zur Vollstreckung des Urteils ergreifen und den Richter bitten, seine Vermögenswerte zu beschlagn… [+5757 chars]",,de,'Donald Trump'
https://www.stern.de/gesellschaft/regional/thueringen/neue-partei--wagenknecht-stellt-kampagne-fuer-thueringer-landtagswahl-vor-34485352.html,https://www.stern.de/gesellschaft/regional/thueringen/neue-partei--wagenknecht-stellt-kampagne-fuer-thueringer-landtagswahl-vor-34485352.html,0,www.stern.de,Neue Partei: Wagenknecht stellt Kampagne für Thüringer Landtagswahl vor,Das Bündnis Sahra Wagenknecht (BSW) will in Thüringen bei der Landtagswahl antreten. Nun stellt die Co-Bundesvorsitzende eine Kampagne vor - zusammen mit der Eisenacher Oberbürgermeisterin Katja Wolf.,https://image.stern.de/34485354/t/gp/v1/w1440/r1.7778/-/23--urnnewsmldpacom200901012402239992190v2w800h600l997t664r2997b1998jpeg---a99e4ed93710f695.jpg,2024-02-23T05:05:48Z,,Das Bündnis Sahra Wagenknecht (BSW) will in Thüringen bei der Landtagswahl antreten. Nun stellt die Co-Bundesvorsitzende eine Kampagne vor - zusammen mit der Eisenacher Oberbürgermeisterin Katja Wolf… [+1002 chars],,de,'Sahra Wagenknecht'
https://www.stern.de/kultur/prinz-harry-und-herzogin-meghan--planen-sie-ein-royales-comeback--34485938.html,https://www.stern.de/kultur/prinz-harry-und-herzogin-meghan--planen-sie-ein-royales-comeback--34485938.html,0,www.stern.de,Prinz Harry und Herzogin Meghan: Planen sie ein royales Comeback?,Ein virtueller Auftritt von Meghan sorgt erneut für Gerüchte: Könnten die Sussexes zu ihren royalen Aufgaben zurückkehren?,https://image.stern.de/34485942/t/S0/v1/w1440/r1.7778/-/23--planen-sie-ein-royales-comeback----16-9---spoton-article-1061816.jpg,2024-02-23T08:32:00Z,,"Ein virtueller Auftritt von Meghan sorgt erneut für Gerüchte: Könnten die Sussexes zu ihren royalen Aufgaben zurückkehren?
Herzogin Meghan (42) hat bei einer Veranstaltung in London für eine Überras… [+2492 chars]",,de,'Prinz William'
https://www.focus.de/kultur/stars/sie-verliebte-sich-in-ihren-bodyguard-so-lebt-heidi-klums-ex-freund-heute_id_259697300.html,https://www.focus.de/kultur/stars/sie-verliebte-sich-in-ihren-bodyguard-so-lebt-heidi-klums-ex-freund-heute_id_259697300.html,0,www.focus.de,Sie verliebte sich in ihren Bodyguard - So lebt Heidi Klums Ex-Freund heute,Heidi Klum verliebte sich im Jahr 2013 in ihren Personenschützer. Nach eineinhalb Jahren ging die Beziehung in die Brüche. Der Bodyguard des Topmodels hat sein Glück heute in einer anderen Frau gefunden.,https://p6.focus.de/img/kultur/vermischtes/id_195141985/heidi-klum-und-ihre-maenner.jpg?im=Crop%3D%280%2C125%2C1000%2C500%29%3BResize%3D%281200%2C627%29&impolicy=perceptual&quality=mediumHigh&hash=9d1533257b84c0bac954aad0fc0d93585bbbf3a2b8a36f1d27741cfca3485dfe,2024-02-23T08:55:28Z,,Heidi Klum verliebte sich im Jahr 2013 in ihren Personenschützer. Nach eineinhalb Jahren ging die Beziehung in die Brüche. Der Bodyguard des Topmodels hat sein Glück heute in einer anderen Frau gefun… [+1652 chars],,de,'Heidi Klum'
https://www.focus.de/kultur/stars/martin-kirsten-er-war-ihr-bodyguard-das-denkt-heidi-klums-ex-heute-ueber-die-gntm-chefin_id_259697300.html,https://www.focus.de/kultur/stars/martin-kirsten-er-war-ihr-bodyguard-das-denkt-heidi-klums-ex-heute-ueber-die-gntm-chefin_id_259697300.html,0,www.focus.de,Er war ihr Bodyguard: Das denkt Heidi Klums Ex heute über die GNTM-Chefin - Er war ihr Bodyguard: Das denkt Heidi Klums Ex heute über die GNTM-Chefin,Heidi Klum verliebte sich im Jahr 2013 in ihren Personenschützer. Nach eineinhalb Jahren ging die Beziehung in die Brüche. Der Bodyguard des Topmodels hat sein Glück heute in einer anderen Frau gefunden.,https://p6.focus.de/img/fotos/id_259697788/martin-kirsten-heidi-klum.jpg?im=Crop%3D%280%2C0%2C3200%2C1600%29%3BResize%3D%281200%2C627%29&impolicy=perceptual&quality=mediumHigh&hash=85e8b64c4f9166ddf1270978ae5c4824aeaf61f8b6bb17727a56b0960a5bb714,2024-02-23T08:55:28Z,,Heidi Klum verliebte sich im Jahr 2013 in ihren Personenschützer. Nach eineinhalb Jahren ging die Beziehung in die Brüche. Der Bodyguard des Topmodels hat sein Glück heute in einer anderen Frau gefun… [+1652 chars],,de,'Heidi Klum'
https://www.stern.de/gesellschaft/regional/bayern/brauchtum--politiker-derblecken-zwischen-albtraum-und-fastnacht-34486896.html,https://www.stern.de/gesellschaft/regional/bayern/brauchtum--politiker-derblecken-zwischen-albtraum-und-fastnacht-34486896.html,0,www.stern.de,Brauchtum: Politiker-Derblecken zwischen Albtraum und Fastnacht,"Albträume, eine Art Fegefeuer für Hubert Aiwanger, der sich, so darf man erwarten, erneut mit Markus Söder hakelt:  Das traditionelle Politiker-Derblecken zur Starkbierprobe auf dem Münchner Nockherberg am nächsten Mittwoch (28. Februar) verspricht einmal meh…",https://image.stern.de/34486898/t/oG/v1/w1440/r1.7778/-/23--urnnewsmldpacom200901012402239996395v3w800h600l638t426r1916b1279jpeg---89074f1f65358726.jpg,2024-02-23T11:28:51Z,,"Albträume, eine Art Fegefeuer für Hubert Aiwanger, der sich, so darf man erwarten, erneut mit Markus Söder hakelt:  Das traditionelle Politiker-Derblecken zur Starkbierprobe auf dem Münchner Nockherb… [+2990 chars]",,de,'Hubert Aiwanger'
https://www.faz.net/aktuell/politik/fraktur-vergessen-kann-ein-segen-sein-auch-in-der-politik-19541775.html,https://www.faz.net/aktuell/politik/fraktur-vergessen-kann-ein-segen-sein-auch-in-der-politik-19541775.html,0,www.faz.net,"Fraktur: Wie ein Hund, der sich hinlegt, wo er will",Vergessen kann ein Segen sein. Oder sollen die Leute vielleicht sagen: Olaf Scholz? War das der mit den Erinnerungslücken?,https://media1.faz.net/ppmedia/aktuell/968835119/1.9541767/facebook_teaser/unvergessen-erinnerung-ist-wie.jpg,2024-02-23T15:27:09Z,,"In einer Woche, die mit dem Tod von Andi Brehme und Jan Assmann begann und mit der Legalisierung von Cannabis noch immer nicht zu Ende ist, kann das Thema dieser Kolumne kaum anders lauten als: Erinn… [+3778 chars]",,de,'Olaf Scholz'
https://taz.de/Aiwanger-bei-Bauerntreff-in-Brandenburg/!5994203/,https://taz.de/Aiwanger-bei-Bauerntreff-in-Brandenburg/!5994203/,0,taz.de,Aiwanger bei Bauerntreff in Brandenburg: Buhlen um den Mittelstand,Auf der Jahresversammlung der „Freien Bauern“ Brandenburg sind die Freien Wähler und das Bündnis Sahra Wagenknecht zu Besuch. Die Lage? Kompliziert.,https://taz.de/picture/6846010/948/34734048-1.jpeg,2024-02-23T17:38:00Z,,"Auf der Jahresversammlung der Freien Bauern Brandenburg sind die Freien Wähler und das Bündnis Sahra Wagenknecht zu Besuch. Die Lage? Kompliziert.
Hubert Aiwanger fühlt sich wohl unter Bauern, vor a… [+5170 chars]",,de,'Hubert Aiwanger'
https://www.welt.de/politik/ausland/article250252014/Betrugsprozess-Richter-gewaehrt-keinen-Aufschub-Trump-muss-454-Millionen-Dollar-Strafe-zahlen.html,https://www.welt.de/politik/ausland/article250252014/Betrugsprozess-Richter-gewaehrt-keinen-Aufschub-Trump-muss-454-Millionen-Dollar-Strafe-zahlen.html,0,www.welt.de,Richter gewährt keinen Aufschub – Trump muss 454 Millionen Dollar Strafe zahlen,Ex-Präsident Donald Trump bekommt keine Schonfrist – die bereits vor einer Woche veranlasste Strafzahlung in einem Zivilprozess erhöht sich aufgrund zusätzlicher Zinsen auf 454 Millionen Dollar. Auch seine beiden Söhne Donald Trump Jr. und Eric Trump müssen f…,https://img.welt.de/img/politik/ausland/mobile250252024/6561355587-ci16x9-w1200/Election-2024-Trump.jpg,2024-02-23T23:16:55Z,,Ein New Yorker Gericht hat Donald Trump wegen Betrugs zu einer Strafzahlung von 454 Millionen Dollar aufgefordert. Damit konterten die Richter am Freitag einen geplanten einmonatigen Aufschub der Anw… [+2132 chars],,de,'Eric Trump'
https://www.zeit.de/wissen/2024-02/immanuel-kant-koenigsberg-geschichte-podcast,https://www.zeit.de/wissen/2024-02/immanuel-kant-koenigsberg-geschichte-podcast,0,www.zeit.de,"Immanuel Kant: Königsberg, Kaliningrad und der Kampf ums Erbe","Immanuel Kant hat Königsberg nie verlassen. Aber was war das für eine Stadt, an deren Universität der Meisterphilosoph berühmt und neben deren Dom er begraben wurde?",https://img.zeit.de/wissen/2024-01/immanuel-kant-aufklaerung-geschichte/wide__1300x731,2024-02-24T05:05:03Z,https://web.archive.org/web/20240224053603/https://www.zeit.de/wissen/2024-02/immanuel-kant-koenigsberg-geschichte-podcast,"""Habe Mut, dich deines eigenen Verstandes zu bedienen!"" Diesen Wahlspruch der Aufklärung prägte der vor 300 Jahren in Königsberg geborene Philosoph Immanuel Kant.© [M] Hulton Archive/Getty Images
Wi… [+3023 chars]",,de,'Immanuel Kant'
https://www.stern.de/news/ramelow-warnt-vor-rechtsterroristischen-netzwerken-in-thueringen-34489598.html,https://www.stern.de/news/ramelow-warnt-vor-rechtsterroristischen-netzwerken-in-thueringen-34489598.html,0,www.stern.de,Ramelow warnt vor rechtsterroristischen Netzwerken in Thüringen,"Thüringens Ministerpräsident Bodo Ramelow (Linke) hat mit Blick auf Angriffe auf Politikerinnen und Politiker demokratischer Parteien vor rechtsterroristischen Netzwerken in dem Bundesland gewarnt. ""Lassen Sie mich nur daran erinnern, dass die Terror-Gruppe u…",https://image.stern.de/34489600/t/ZD/v1/w1440/r1.7778/-/24--demonstration-in-berlin---375301447683e1ad.jpg,2024-02-24T10:13:43Z,,"Thüringens Ministerpräsident Bodo Ramelow (Linke) hat mit Blick auf Angriffe auf Politikerinnen und Politiker demokratischer Parteien vor rechtsterroristischen Netzwerken in dem Bundesland gewarnt. ""… [+2364 chars]",,de,'Bodo Ramelow'
https://www.diepresse.com/18207912/ex-us-praesident-trump-muss-im-betrugsfall-454-millionen-dollar-strafe-zahlen,https://www.diepresse.com/18207912/ex-us-praesident-trump-muss-im-betrugsfall-454-millionen-dollar-strafe-zahlen,0,www.diepresse.com,Ex-US-Präsident Trump muss im Betrugsfall 454 Millionen Dollar Strafe zahlen,"Der Ex-US-Präsident Donald Trump wurde von einem New Yorker Gericht zu einer Strafzahlung von 454 Millionen aufgefordert. Seine Anwälte hatten geplant, die Strafe aufzuschieben. Trump will die Strafe bei einem Berufungsgericht anfechten.",https://img.diepresse.com/public/incoming/nww7si-imago-images-0416384273/alternates/DPR_SOCIAL_NACHRICHTEN/imago%20images%200416384273,2024-02-24T10:43:25Z,,"Der Ex-US-Präsident Donald Trump wurde von einem New Yorker Gericht zu einer Strafzahlung von 454 Millionen aufgefordert. Seine Anwälte hatten geplant, die Strafe aufzuschieben. Trump will die Strafe… [+1481 chars]",,de,'Eric Trump'
https://www.stern.de/gesellschaft/regional/thueringen/spitzenkandidat--mario-voigt-fuehrt-thueringer-cdu-in-die-landtagswahl-34489672.html,https://www.stern.de/gesellschaft/regional/thueringen/spitzenkandidat--mario-voigt-fuehrt-thueringer-cdu-in-die-landtagswahl-34489672.html,0,www.stern.de,Spitzenkandidat: Mario Voigt führt Thüringer CDU in die Landtagswahl,Die CDU will in Thüringen erstmals seit 2014 wieder regieren. Parteichef Mario Voigt soll sie in die Landtagswahl führen. Sein Vorgänger Mike Mohring mahnt mehr Miteinander in der Partei an.,https://image.stern.de/34489674/t/kN/v1/w1440/r1.7778/-/24--urnnewsmldpacom2009010124022499107468v3w800h600l658t108r1938b1011jpeg---0ec8ddcce609efd6.jpg,2024-02-24T11:12:27Z,,"Die CDU will in Thüringen erstmals seit 2014 wieder regieren. Parteichef Mario Voigt soll sie in die Landtagswahl führen. Sein Vorgänger Mike Mohring mahnt mehr Miteinander in der Partei an.
Partei-… [+1928 chars]",,de,'nan nan'
https://www.zeit.de/news/2024-02/24/wegner-putin-muss-zur-verantwortung-gezogen-werden,https://www.zeit.de/news/2024-02/24/wegner-putin-muss-zur-verantwortung-gezogen-werden,0,www.zeit.de,Demonstrationen: Wegner: Putin muss zur Verantwortung gezogen werden,Hier finden Sie Informationen zu dem Thema „Demonstrationen“. Lesen Sie jetzt „Wegner: Putin muss zur Verantwortung gezogen werden“.,https://img.zeit.de/news/2024-02/24/wegner-putin-muss-zur-verantwortung-gezogen-werden-image-group/wide__1300x731,2024-02-24T14:03:25Z,,Berlins Regierender Bürgermeister Kai Wegner hat sich für schnelle weitere Waffenlieferungen an die Ukraine inklusive des Marschflugkörpers Taurus ausgesprochen. Bei einer Kundgebung anlässlich des z… [+2555 chars],,de,'Kai Wegner'
https://www.stern.de/gesellschaft/regional/berlin-brandenburg/demonstrationen--wegner--putin-muss-zur-verantwortung-gezogen-werden-34490008.html,https://www.stern.de/gesellschaft/regional/berlin-brandenburg/demonstrationen--wegner--putin-muss-zur-verantwortung-gezogen-werden-34490008.html,0,www.stern.de,Demonstrationen: Wegner: Putin muss zur Verantwortung gezogen werden,Berlins Regierender Bürgermeister fordert mehr Waffenlieferungen an die Ukraine. Der CDU-Politiker äußert sich bei einer Kundgebung am Brandenburger Tor aber auch klar in Richtung Wladimir Putin.,https://image.stern.de/34490010/t/O8/v1/w1440/r1.7778/-/24--urnnewsmldpacom2009010124022499108748v2w800h600l1250t830r3750b2491jpeg---681da7f09dd013eb.jpg,2024-02-24T14:03:25Z,,"Berlins Regierender Bürgermeister fordert mehr Waffenlieferungen an die Ukraine. Der CDU-Politiker äußert sich bei einer Kundgebung am Brandenburger Tor aber auch klar in Richtung Wladimir Putin.
Be… [+2049 chars]",,de,'Kai Wegner'
https://www.sueddeutsche.de/bayern/fdp-bayern-parteitag-aiwanger-martin-hagen-gruene-1.6392057,https://www.sueddeutsche.de/bayern/fdp-bayern-parteitag-aiwanger-martin-hagen-gruene-1.6392057,0,www.sueddeutsche.de,"Parteitag der Bayern-FDP: ""So werden wir nicht wieder gewählt""","Lob der Ampel und zugleich harsche Kritik, Seitenhiebe auf die Grünen und auf die CSU. Die bayerische FDP fahndet weiter nach einem klaren Kurs. Nur bei einem sind sich anscheinend alle einig: Attacke gegen Hubert Aiwanger.",https://www.sueddeutsche.de/image/sz.1.6392058/1200x675?v=1708785783,2024-02-24T14:43:07Z,,"Martin Hagen kann das: einheizen, einen Saal rhetorisch aufwecken. Und hier in Ingolstadt, wo die von ihm geführte bayerische FDP ihren zweitägigen Parteitag abhält, ist es bitter nötig. Es trifft si… [+6319 chars]",,de,'Hubert Aiwanger'
https://www.focus.de/politik/ausland/us-wahl/us-wahlen-im-ticker-trump-zeigt-sich-bei-vorwahl-der-us-republikaner-in-south-carolina-siegesgewiss_id_259600688.html,https://www.focus.de/politik/ausland/us-wahl/us-wahlen-im-ticker-trump-zeigt-sich-bei-vorwahl-der-us-republikaner-in-south-carolina-siegesgewiss_id_259600688.html,0,www.focus.de,US-Wahlen im Ticker - Trump zeigt sich bei Vorwahl der US-Republikaner in South Carolina siegesgewiss,Donald Trump zeigt sich siegessicher vor den Vorwahlen im US-Bundesstaat South Carolina. Nikki Haley will auch trotz einer Niederlage weiter antreten. Alle Infos zu den US-Vorwahlen im Newsticker.,https://p6.focus.de/img/fotos/id_259515777/combo-trump-biden.jpg?im=Crop%3D%280%2C247%2C3200%2C1600%29%3BResize%3D%281200%2C627%29&impolicy=perceptual&quality=mediumHigh&hash=5ea15900191127a57102842692953dfe92cbfb88d2d10ad0060dc22ebfbc0e26,2024-02-24T16:45:02Z,,"<ul><li>
Kommentare</li><li>
E-Mail</li><li>
Teilen</li><li>
Mehr</li><li>
Twitter</li><li>
Drucken</li><li>
Feedback</li><li>
Fehler meldenSie haben einen Fehler gefunden?
Bitte markieren S… [+8207 chars]",,de,'Eric Trump'
