index,url,valid,domain,title,description,image,published,archive,content,quote,language,keyword
https://www.focus.de/auto/gastbeitrag-von-ferdinand-dudenhoeffer-warum-donald-trump-den-verkauf-deutscher-autos-in-den-usa-foerdert_5bf66ed7-4810-43b2-8785-0d126f3a0d2b.html,https://www.focus.de/auto/gastbeitrag-von-ferdinand-dudenhoeffer-warum-donald-trump-den-verkauf-deutscher-autos-in-den-usa-foerdert_5bf66ed7-4810-43b2-8785-0d126f3a0d2b.html,0,www.focus.de,Gastbeitrag von Ferdinand Dudenhöffer: Warum Donald Trump den Verkauf deutscher Autos in den USA fördert,"Das Wall Street Journal meldet, dass VW ab dem 2. April eine Importgebühr von 25 Prozent auf alle Fahrzeuge in USA erhebt. Ein sehr cleverer Zug. Autoexperte Ferdinand Dudenhöffer erklärt warum.",https://quadro.burda-forward.de/ctf/6f76153f-f985-4a50-84b1-55cf8823aea7.f2bb2872-8656-46ab-a38a-6c4d9b0f311f.jpg?im=RegionOfInterestCrop%3D%281200%2C630%29%2CregionOfInterest%3D%28445%2C297%29&hash=da8976208e5441f9a783ec18ad9c47d33dca0ecf3d428a1e9e334c073f6b6c23,2025-04-03T12:40:12Z,https://web.archive.org/web/20250403133321/https://www.focus.de/auto/gastbeitrag-von-ferdinand-dudenhoeffer-warum-donald-trump-den-verkauf-deutscher-autos-in-den-usa-foerdert_5bf66ed7-4810-43b2-8785-0d126f3a0d2b.html,"Zunächst gilt, dass VW direkt auf Trumps Zollhammer reagiert und die Preise seiner Auto in den USA um 25 Prozent erhöht. Mit dieser Meldung könnte man meinen, dass  VW für alle Fahrzeuge, die neu in … [+2121 chars]",,de,'Ferdinand Dudenhöffer'
https://www.bild.de/unterhaltung/stars-und-leute/val-kilmer-tot-er-verfuehrte-die-schoensten-frauen-hollywoods-67ee3785d094c21734ed84a8,https://www.bild.de/unterhaltung/stars-und-leute/val-kilmer-tot-er-verfuehrte-die-schoensten-frauen-hollywoods-67ee3785d094c21734ed84a8,0,www.bild.de,"Cindy, Cher und Angelina - Val Kilmer liebte die schönsten Frauen Hollywoods","Cindy Crawford, Cher und Angelina Jolie – Hollywood-Star Val Kilmer (†65) liebte die schönsten Frauen Hollywoods, doch sein Herz blieb bis zum Ende einsam.","https://images.bild.de/67ee3785d094c21734ed84a8/84e8abdcdfce32283bf704eba441f7d7,d56b1f0?w=1280",2025-04-03T14:02:40Z,https://web.archive.org/web/20250403160525/https://www.bild.de/unterhaltung/stars-und-leute/val-kilmer-tot-er-verfuehrte-die-schoensten-frauen-hollywoods-67ee3785d094c21734ed84a8,Er liebte die schönsten Frauen Hollywoods. Doch sein Herz blieb bis zum Ende einsam. Am Dienstag starb Hollywood-Star Val Kilmer (65) an den Folgen einer Lungenentzündung. Er starb im Kreise seiner F… [+4803 chars],,de,'Angelina Jolie'
https://www.focus.de/politik/meinung/boris-becker-haette-seinen-ausflug-in-die-hitler-zeit-besser-gelassen_b6584e2c-bc4c-4902-8749-d1b20e9b3be8.html,https://www.focus.de/politik/meinung/boris-becker-haette-seinen-ausflug-in-die-hitler-zeit-besser-gelassen_b6584e2c-bc4c-4902-8749-d1b20e9b3be8.html,0,www.focus.de,Boris Becker hätte seinen Ausflug in die Hitler-Zeit besser gelassen,"Konnte Adolf Hitler etwa fliehen? Boris Becker, bedeutsamer Teil der deutschen Sport-Leitkultur, wagt sich plötzlich auf historisches Terrain. Er hätte es besser unterlassen.",https://quadro.burda-forward.de/ctf/459da28a-7cf3-489e-8c40-0f017677b7d2.943e76d2-495c-4013-8644-a8860ff92b9a.jpeg?im=RegionOfInterestCrop%3D%281200%2C630%29%2CregionOfInterest%3D%281731.5%2C1154.5%29&hash=21afbc92d17b91679ee1673a5e7fab2279ed39e4394987176329495858baa08b,2025-04-03T15:15:18Z,https://web.archive.org/web/20250404155944/https://www.focus.de/politik/meinung/boris-becker-haette-seinen-ausflug-in-die-hitler-zeit-besser-gelassen_b6584e2c-bc4c-4902-8749-d1b20e9b3be8.html,"Deutschlands Tennislegende Boris Becker hat bei einem privaten Ausflug in die Zeitgeschichte eine bahnbrechende Entdeckung gemacht, nämlich: Dass Adolf Hitler das Kriegsende 1945 überlebte und nach K… [+6222 chars]",,de,'Adolf Hitler'
https://www.faz.net/aktuell/gesellschaft/menschen/adolf-hitler-in-suedamerika-boris-becker-teilt-verschwoerungsmythos-110398548.html,https://www.faz.net/aktuell/gesellschaft/menschen/adolf-hitler-in-suedamerika-boris-becker-teilt-verschwoerungsmythos-110398548.html,0,www.faz.net,Verschwörungstheorie: Boris Becker irritiert mit Post zu Hitler-in-Südamerika-Mythos,"Mit einem Post auf der Plattform X hat der ehemalige Tennisstar für Kritik gesorgt. Becker hatte einen Beitrag geteilt, in dem es um ein Weiterleben Adolf Hitlers nach Kriegsende in Südamerika ging.",https://media0.faz.net/ppmedia/aktuell/gesellschaft/720676225/1.10398614/facebook_teaser/boris-becker.jpg,2025-04-03T15:23:15Z,https://web.archive.org/web/20250403160558/https://www.faz.net/aktuell/gesellschaft/menschen/adolf-hitler-in-suedamerika-boris-becker-teilt-verschwoerungsmythos-110398548.html,Der ehemalige Tennis-Star Boris Becker hat einen Internet-Kommentar zu einem Verschwörungsmythos über Adolf Hitler als Missverständnis bedauert. Er habe sich den von ihm kommentierten Tweet keinesfal… [+1921 chars],,de,'Adolf Hitler'
https://www.bild.de/unterhaltung/tv-fernsehformate/gntm-2025-diese-stars-unterstuetzen-heidi-klum-in-der-jubilaeubsstaffel-67bf09b2651ced275f6736e9,https://www.bild.de/unterhaltung/tv-fernsehformate/gntm-2025-diese-stars-unterstuetzen-heidi-klum-in-der-jubilaeubsstaffel-67bf09b2651ced275f6736e9,0,www.bild.de,Star-Aufgebot bei GNTM - Diese Gäste hat Heidi Klum eingeladen,Diese Promi-Gäste sind in der neuen Staffel „Germany’s Next Topmodel“ dabei – vom Supermodel Naomi Campbell bis zum Moderator Klaas Heufer-Umlauf!,"https://images.bild.de/67bf09b2651ced275f6736e9/c94134cd60837e538a5b913fb946fa92,7ab3c70e?w=1280",2025-04-03T17:50:31Z,https://web.archive.org/web/20250404211617/https://www.bild.de/unterhaltung/tv-fernsehformate/gntm-2025-diese-stars-unterstuetzen-heidi-klum-in-der-jubilaeubsstaffel-67bf09b2651ced275f6736e9,"Schönheit liegt im Auge des Betrachters in diesem Fall im Auge von Heidi Klum (51), die auch in der neuen Staffel wieder darüber entscheidet, wer das Zeug dazu hat, Germanys Next Topmodel zu werden. … [+6935 chars]",,de,'Tom Kaulitz'
https://www.kino.de/artikel/germanys-next-topmodel-2025-wer-ist-raus-nach-folge-14--gvmmrchm5c,https://www.kino.de/artikel/germanys-next-topmodel-2025-wer-ist-raus-nach-folge-14--gvmmrchm5c,0,www.kino.de,„Germany’s Next Topmodel“ 2025: Wer ist raus nach Folge 14?,„Germany’s Next Topmodel“ feiert 2025 ein besonderes Jubiläum. Heidi Klum führt durch die Jubiläumsshow mit exklusiven Gästen. Wir haben alle Updates für euch.,https://static.kino.de/2c/e2/33/9b2621f50b7a96fc63063ad06c_ZmMgN2E5NzcwMGFmZmZmIDEyMDAgMAMyMjk2ZmI5YzBhNg==_p7_gntm_start_3072163.jpg,2025-04-03T20:38:04Z,,"Germanys Next Topmodel feiert 2025 ein besonderes Jubiläum. Heidi Klum führt durch die Jubiläumsshow mit exklusiven Gästen. Wir haben alle Updates für euch.
2025 feiert die erfolgreiche Show Germany… [+4307 chars]",,de,'Heidi Klum'
https://www.zeit.de/politik/ausland/2025-04/suedkorea-yoon-suk-yeol-amtsenthebung,https://www.zeit.de/politik/ausland/2025-04/suedkorea-yoon-suk-yeol-amtsenthebung,0,www.zeit.de,Seoul: Verfassungsgericht in Südkorea bestätigt Absetzung von Präsident Yoon,Der suspendierte südkoreanische Staatschef Yoon Suk Yeol verliert wegen der Ausrufung des Kriegsrechts endgültig sein Amt. Südkorea steht nun vor Neuwahlen.,https://img.zeit.de/administratives/sharing/fallback-image/wide__1300x731,2025-04-04T02:37:54Z,https://web.archive.org/web/20250404071523/https://www.zeit.de/politik/ausland/2025-04/suedkorea-yoon-suk-yeol-amtsenthebung,Der wegen der Verhängung des Kriegsrechts im Dezember suspendierte südkoreanische Präsident Yoon Suk Yeol ist seines Amtes enthoben worden. Das Verfassungsgericht in Seoul bestätigte den zuvor vom Pa… [+189 chars],,de,'Yoon Suk Yeol'
https://www.tagesschau.de/ausland/asien/yoon-amtsenthebung-100.html,https://www.tagesschau.de/ausland/asien/yoon-amtsenthebung-100.html,0,www.tagesschau.de,Staatskrise ausgelöst: Südkoreas Präsident Yoon des Amtes enthoben,Yoon Suk Yeol rief im Dezember überraschend das Kriegsrecht aus - und stürzte Südkorea damit in eine Regierungskrise. Mit seiner offiziellen Amtsenthebung steht das Land jetzt vor Neuwahlen.,https://images.tagesschau.de/image/c8c8b460-60c5-480b-8c5a-dc14afff0da7/AAABlf7A-30/AAABkZLhkrw/16x9-1280/yoon-suk-yeol-122.jpg,2025-04-04T02:52:31Z,https://web.archive.org/web/20250404034527/https://www.tagesschau.de/ausland/asien/yoon-amtsenthebung-100.html,"Stand: 04.04.2025 04:52 Uhr
Yoon Suk Yeol rief im Dezember überraschend das Kriegsrecht aus - und stürzte Südkorea damit in eine Regierungskrise. Mit seiner offiziellen Amtsenthebung steht das Land … [+4271 chars]",,de,'Yoon Suk Yeol'
https://www.n-tv.de/politik/Suedkoreas-Praesident-Yoon-offiziell-des-Amtes-enthoben-article25679599.html,https://www.n-tv.de/politik/Suedkoreas-Praesident-Yoon-offiziell-des-Amtes-enthoben-article25679599.html,0,www.n-tv.de,Nach Verhängung des Kriegsrechts: Südkoreas Präsident Yoon offiziell des Amtes enthoben,Im vergangenen Dezember ruft Yoon Suk Yeol kurzfristig das Kriegsrecht aus. Der südkoreanische Präsident wird daraufhin suspendiert - nun bestätigt das Verfassungsgericht in Seoul die Entscheidung. Damit stehen dem Land mitten in einer Staats- und Wirtschafts…,https://www.n-tv.de/img/incoming/crop25679607/967132576-cImg_16_9-w1200/2025-02-13T013339Z-2008976648-RC2CTCAOOJSN-RTRMADP-3-SOUTHKOREA-POLITICS-COURT.jpg,2025-04-04T02:52:48Z,,Im vergangenen Dezember ruft Yoon Suk Yeol kurzfristig das Kriegsrecht aus. Der südkoreanische Präsident wird daraufhin suspendiert - nun bestätigt das Verfassungsgericht in Seoul die Entscheidung. D… [+4255 chars],,de,'Yoon Suk Yeol'
https://www.stern.de/news/verfassungsgericht-in-suedkorea-bestaetigt-absetzung-von-praesident-yoon-35611848.html,https://www.stern.de/news/verfassungsgericht-in-suedkorea-bestaetigt-absetzung-von-praesident-yoon-35611848.html,0,www.stern.de,Verfassungsgericht in Südkorea bestätigt Absetzung von Präsident Yoon,"Der nach der Ausrufung des Kriegsrechts entmachtete südkoreanische Präsident Yoon Suk Yeol ist endgültig des Amtes enthoben worden. Das Verfassungsgericht des asiatischen Landes bestätigte am Freitag einstimmig die Absetzung Yoons, für die zuvor bereits das P…",https://image.stern.de/35611850/t/F_/v1/w1440/r1.7778/-/04--suedkoreanisches-verfassungsgericht-in-seoul---58b7d47f65c376dd.jpg,2025-04-04T02:53:38Z,https://web.archive.org/web/20250405040510/https://www.stern.de/news/verfassungsgericht-in-suedkorea-bestaetigt-absetzung-von-praesident-yoon-35611848.html,"Kopiere den aktuellen Link
Zur Merkliste hinzufügen
Der nach der Ausrufung des Kriegsrechts entmachtete südkoreanische Präsident Yoon Suk Yeol ist endgültig des Amtes enthoben worden. Das Verfassun… [+766 chars]",,de,'Yoon Suk Yeol'
https://www.sueddeutsche.de/politik/suedkorea-praesident-amtsenthebung-urteil-li.3231294,https://www.sueddeutsche.de/politik/suedkorea-praesident-amtsenthebung-urteil-li.3231294,0,www.sueddeutsche.de,Seoul: Südkoreas Präsident Yoon des Amtes enthoben,Yoon Suk Yeol rief im Dezember überraschend das Kriegsrecht aus - und stürzte Südkorea damit in eine tiefe Krise. Nun steht das Land vor Neuwahlen.,https://www.sueddeutsche.de/2025/04/04/497935d0-4185-4639-8813-86e00cc934ab.jpeg?q=60&fm=webp&width=1200&rect=0%2C253%2C4000%2C2250,2025-04-04T02:54:25Z,https://web.archive.org/web/20250404070357/https://www.sueddeutsche.de/politik/suedkorea-praesident-amtsenthebung-urteil-li.3231294,"Das Gericht begründete sein einstimmig getroffenes Urteil damit, dass Yoon das Kriegsrecht nicht hätte verhängen dürfen, weil es keine nationale Krise gab. Außerdem habe er gegen das Gesetz verstoßen… [+1807 chars]",,de,'Yoon Suk Yeol'
https://www.zeit.de/news/2025-04/04/superheld-mit-schwaechen-robert-downey-jr-wird-60,https://www.zeit.de/news/2025-04/04/superheld-mit-schwaechen-robert-downey-jr-wird-60,0,www.zeit.de,Runder Geburtstag: Superheld mit Schwächen - Robert Downey Jr. wird 60,Hier finden Sie Informationen zu dem Thema „Runder Geburtstag“. Lesen Sie jetzt „Superheld mit Schwächen - Robert Downey Jr. wird 60“.,https://img.zeit.de/news/2025-04/04/superheld-mit-schwaechen-robert-downey-jr-wird-60-image-group/wide__1300x731,2025-04-04T04:00:38Z,,Robert Downey Jr. stand Anfang März bei der Oscar-Verleihung im Rampenlicht. Als einer der prominenten Gala-«Presenter» händigte er die Trophäe an Kieran Culkin («A Real Pain») als frisch gekürter be… [+5556 chars],,de,'Robert Downey Jr'
https://www.tagesspiegel.de/gesellschaft/runder-geburtstag-superheld-mit-schwachen-robert-downey-jr-wird-60-13485841.html,https://www.tagesspiegel.de/gesellschaft/runder-geburtstag-superheld-mit-schwachen-robert-downey-jr-wird-60-13485841.html,0,www.tagesspiegel.de,Runder Geburtstag: Superheld mit Schwächen - Robert Downey Jr. wird 60,"Als „Iron Man“ wurde er zu Hollywoods Superheld, als Nebendarsteller in „Oppenheimer“ holte er einen Oscar. Robert Downey Jr. hat die 60 erreicht, nach einem Hürdenlauf mit vielen Hochs und Tiefs.",https://www.tagesspiegel.de/images/13485838/alternates/BASE_16_9_W1400/1743739340000/robert-downey-jr.jpeg,2025-04-04T04:02:21Z,,Robert Downey Jr. stand Anfang März bei der Oscar-Verleihung im Rampenlicht. Als einer der prominenten Gala-Presenter händigte er die Trophäe an Kieran Culkin (A Real Pain) als frisch gekürter bester… [+8510 chars],,de,'Robert Oppenheimer'
https://www.nzz.ch/international/suedkoreas-praesident-yoon-suk-yeol-wird-des-amtes-enthoben-seine-anhaenger-warnen-vor-einem-buergerkrieg-ld.1878731,https://www.nzz.ch/international/suedkoreas-praesident-yoon-suk-yeol-wird-des-amtes-enthoben-seine-anhaenger-warnen-vor-einem-buergerkrieg-ld.1878731,0,www.nzz.ch,Südkoreas Präsident Yoon Suk Yeol wird des Amtes enthoben – seine Anhänger warnen vor einem Bürgerkrieg,"Yoon Suk Yeol rief im Dezember überraschend das Kriegsrecht aus. Nun steht das Land vor Neuwahlen. Aber die Krise geht weiter, denn für Südkoreas Rechte ist er zum Helden geworden.","https://img.nzz.ch/2025/04/04/a9f28777-721e-4c58-a72d-5a416518b5db.jpeg?width=1200&height=674&fit=bounds&quality=75&auto=webp&crop=2029,1141,x0,y804&wmark=nzz",2025-04-04T04:19:35Z,https://web.archive.org/web/20250404073122/https://www.nzz.ch/international/suedkoreas-praesident-yoon-suk-yeol-wird-des-amtes-enthoben-seine-anhaenger-warnen-vor-einem-buergerkrieg-ld.1878731,"Yoon ist nach Park Geun Hye im Jahr 2017 der zweite konservative Präsident des Landes, der sein Amt vorzeitig verliert.
Um 11 Uhr 22 war es so weit. «Präsident Yoon Suk Yeol ist seines Amtes enthobe… [+9490 chars]",,de,'Yoon Suk Yeol'
https://www.brigitte.de/aktuell/60--geburtstag-robert-downey-jr---vom-drogenopfer-zum-marvel-superstar-und-oscarpreistraeger-13970696.html,https://www.brigitte.de/aktuell/60--geburtstag-robert-downey-jr---vom-drogenopfer-zum-marvel-superstar-und-oscarpreistraeger-13970696.html,0,www.brigitte.de,60. Geburtstag Robert Downey Jr.: Vom Drogenopfer zum Marvel-Superstar und Oscarpreisträger,Robert Downey Jr. ist als Iron Man der Held einer ganzen Generation. Dabei war er zuvor Jahrzehnte lang selbst sein ärgster Gegenspieler.,https://image.brigitte.de/13970698/t/Yk/v1/w1440/r1.7778/-/04--vom-drogenopfer-zum-marvel-superstar-und-oscarpreistraeger---1-1---spoton-article-1090674.jpg,2025-04-04T04:28:00Z,https://web.archive.org/web/20250404060922/https://www.brigitte.de/aktuell/60--geburtstag-robert-downey-jr---vom-drogenopfer-zum-marvel-superstar-und-oscarpreistraeger-13970696.html,"Robert Downey Jr. ist als Iron Man der Held einer ganzen Generation. Dabei war er zuvor Jahrzehnte lang selbst sein ärgster Gegenspieler.
Hätte man um die Jahrtausendwende prognostiziert, dass Rober… [+6695 chars]",,de,'Robert Downey Jr'
https://www.focus.de/politik/ausland/er-rief-kriegsrecht-aus-suedkoreas-praesident-endgueltig-abgesetzt-jetzt-stehen-neuwahlen-an_60399adc-256c-4126-903c-a6cdf108cd66.html,https://www.focus.de/politik/ausland/er-rief-kriegsrecht-aus-suedkoreas-praesident-endgueltig-abgesetzt-jetzt-stehen-neuwahlen-an_60399adc-256c-4126-903c-a6cdf108cd66.html,0,www.focus.de,Er rief Kriegsrecht aus: Südkoreas Präsident endgültig abgesetzt - jetzt stehen Neuwahlen an,Yoon Suk Yeol rief im Dezember überraschend das Kriegsrecht aus - und wurde nun vom Verfassungsgericht endgültig des Präsidentenamtes enthoben. Seine Partei möchte das Urteil nicht anfechten.,https://quadro.burda-forward.de/ctf/7759887a-7aaa-483b-b56f-718c31b22f74.447f3180-2343-47ad-8fab-fa2cd39dbc30.jpeg?im=RegionOfInterestCrop%3D%281200%2C630%29%2CregionOfInterest%3D%28475%2C214%29&hash=bc7cd82eedba2e994eaa02f4b220caf124f015e492a3810d839fbafb2368d372,2025-04-04T04:47:10Z,https://web.archive.org/web/20250404082307/https://www.focus.de/politik/ausland/er-rief-kriegsrecht-aus-suedkoreas-praesident-endgueltig-abgesetzt-jetzt-stehen-neuwahlen-an_60399adc-256c-4126-903c-a6cdf108cd66.html,"Südkoreas konservative Regierungspartei hat die vom Verfassungsgericht bestätigte Amtsenthebung des entmachteten Präsidenten Yoon Suk Yeol akzeptiert. ""Obwohl es bedauerlich ist, akzeptiert die PPP (… [+1519 chars]",,de,'Yoon Suk Yeol'
https://orf.at/stories/3389649/,https://orf.at/stories/3389649/,0,orf.at,Präsident endgültig abgesetzt,Der wegen der Verhängung des Kriegsrechts im Dezember suspendierte südkoreanische Präsident Yoon Suk Yeol ist endgültig seines Amtes enthoben worden. Das Verfassungsgericht in Seoul bestätigte am Freitag den vom Parlament beschlossenen Antrag zur Amtsenthebun…,https://ibs.orf.at/news?image=https%3A%2F%2Fassets.orf.at%2Fmims%2F2025%2F14%2F28%2Fcrops%2Fw%3D1200%2Ch%3D630%2Cq%3D75%2F2577804_master_988928_suedkorea_yoon_verfassungsgericht_r.jpg%3Fs%3D09ea8a1f966ec93b0d3f4048716845a4a7142712,2025-04-04T05:38:24Z,https://web.archive.org/web/20250404074455/https://orf.at/stories/3389649/,"Das Gericht begründete sein einstimmig getroffenes Urteil damit, dass Yoon das Kriegsrecht nicht hätte verhängen dürfen, weil es keine nationale Krise gab. Außerdem habe er gegen das Gesetz verstoßen… [+4304 chars]",,de,'Yoon Suk Yeol'
https://www.zeit.de/politik/ausland/2025-04/usa-zoelle-trump-autos-europaeische-union,https://www.zeit.de/politik/ausland/2025-04/usa-zoelle-trump-autos-europaeische-union,0,www.zeit.de,"US-Zollpolitik: Experten halten viele US-Autos in Europa für ""schlicht unverkäuflich""",Donald Trump begründet seine Zölle auf EU-Autos mit unfairen Handelsbedingungen. Doch Experten sehen die US-Absatzprobleme eher in den Modellen der Hersteller.,https://img.zeit.de/administratives/sharing/fallback-image/wide__1300x731,2025-04-04T06:31:40Z,http://archive.md/20250404063601/https://www.zeit.de/politik/ausland/2025-04/usa-zoelle-trump-autos-europaeische-union,Mit neuen Zöllen auf EU-Importautos will US-Präsident Donald Trump den europäischen Markt für amerikanische Automarken öffnen. Experten sehen den Grund für die schwachen Absatzzahlen der US-Herstelle… [+1323 chars],,de,'Donald Trump'
https://www.n-tv.de/leute/Robert-Downey-Jr-der-Iron-Man-Hollywoods-article25678601.html,https://www.n-tv.de/leute/Robert-Downey-Jr-der-Iron-Man-Hollywoods-article25678601.html,0,www.n-tv.de,"Vom Knasti zum Topverdiener: Robert Downey Jr., der Iron Man Hollywoods","In seiner Karriere hat sich Robert Downey Jr. gern selbst Steine in den Weg gelegt - durch Drogen-Eskapaden und Gefängnisaufenthalte. Doch er hat sich gefangen, als ""Iron Man"" und Oscar-Preisträger. Jetzt wird er 60 und ist einer der Top-Stars in Hollywood.",https://www.n-tv.de/img/incoming/crop25678609/6341326007-cImg_16_9-w1200/11919123.jpg,2025-04-04T06:33:47Z,https://web.archive.org/web/20250404064646/https://www.n-tv.de/leute/Robert-Downey-Jr-der-Iron-Man-Hollywoods-article25678601.html,"In seiner Karriere hat sich Robert Downey Jr. gern selbst Steine in den Weg gelegt - durch Drogen-Eskapaden und Gefängnisaufenthalte. Doch er hat sich gefangen, als ""Iron Man"" und Oscar-Preisträger. … [+5565 chars]",,de,'Robert Downey Jr'
https://www.stern.de/lifestyle/leute/leute--ellen-pompeo--taylor-swift-stellte-mir-groessten-scheck-aus-35612156.html,https://www.stern.de/lifestyle/leute/leute--ellen-pompeo--taylor-swift-stellte-mir-groessten-scheck-aus-35612156.html,0,www.stern.de,Leute: Ellen Pompeo: Taylor Swift stellte mir größten Scheck aus,"Als langjährige Hauptdarstellerin von ""Grey's Anatomy"" hat Ellen Pompeo eine besondere Beziehung zu Krankenhäusern. Für eine Kinderklinik-Spende bat sie Taylor Swift um Hilfe - und wurde überrascht.",https://image.stern.de/35612158/t/Is/v1/w1440/r1.7778/-/04--d7mx775az5v4axs2048jpeg---f3708228173a54f4.jpg,2025-04-04T06:40:16Z,,"Kopiere den aktuellen Link
Zur Merkliste hinzufügen
Als langjährige Hauptdarstellerin von ""Grey's Anatomy"" hat Ellen Pompeo eine besondere Beziehung zu Krankenhäusern. Für eine Kinderklinik-Spende … [+1326 chars]",,de,'Taylor Swift'
https://www.tagesspiegel.de/gesellschaft/leute-ellen-pompeo-taylor-swift-stellte-mir-grossten-scheck-aus-13486198.html,https://www.tagesspiegel.de/gesellschaft/leute-ellen-pompeo-taylor-swift-stellte-mir-grossten-scheck-aus-13486198.html,0,www.tagesspiegel.de,Leute: Ellen Pompeo: Taylor Swift stellte mir größten Scheck aus,Als langjährige Hauptdarstellerin von „Grey's Anatomy“ hat Ellen Pompeo eine besondere Beziehung zu Krankenhäusern. Für eine Kinderklinik-Spende bat sie Taylor Swift um Hilfe - und wurde überrascht.,https://www.tagesspiegel.de/images/13486195/alternates/BASE_16_9_W1400/1743748880000/ellen-pompeo.jpeg,2025-04-04T06:41:21Z,,"US-Schauspielerin Ellen Pompeo (Grey's Anatomy, Good American Family) hat von der Großzügigkeit von Superstar Taylor Swift geschwärmt. Obwohl diese sie erst kurz gekannt habe, habe Swift ihr einen Sc… [+1817 chars]",,de,'Taylor Swift'
https://www.stern.de/lifestyle/leute/prinz-harry-aeussert-sich-zu-charity-skandal---unverschaemte-luegen---35612470.html,https://www.stern.de/lifestyle/leute/prinz-harry-aeussert-sich-zu-charity-skandal---unverschaemte-luegen---35612470.html,0,www.stern.de,"Sentebale : Prinz Harry äußert sich zu Charity Skandal: ""unverschämte Lügen""","Nach seinem Rücktritt als Schirmherr der Wohltätigkeitsorganisation Sentebale hofft Prinz Harry auf eine externe Aufklärung. Die Diskussionen seien für ihn ""herzzerreißend"".",https://image.stern.de/35612676/t/el/v2/w1440/r1.7778/-/prinz-harry--1-.jpg,2025-04-04T09:20:00Z,,"Kopiere den aktuellen Link
Zur Merkliste hinzufügen
Nach seinem Rücktritt als Schirmherr der Wohltätigkeitsorganisation Sentebale hofft Prinz Harry auf eine externe Aufklärung. Die Diskussionen sei… [+1963 chars]",,de,'Prinz Harry'
https://www.n-tv.de/leute/Boris-Becker-bedauert-Adolf-Hitler-Post-article25680396.html,https://www.n-tv.de/leute/Boris-Becker-bedauert-Adolf-Hitler-Post-article25680396.html,0,www.n-tv.de,"""Sofort gelöscht"": Boris Becker bedauert Adolf-Hitler-Post","Dass Boris Becker am Donnerstag für Aufregung sorgt, hat mal nichts mit Tennis, Steuern oder Frauen zu tun. Stattdessen teilt der ehemalige Wimbledon-Sieger auf X einen kruden Verschwörungsmythos zu Adolf Hitler. Nun rudert er zurück.",https://www.n-tv.de/img/incoming/crop25680408/8181324046-cImg_16_9-w1200/imago1047836107.jpg,2025-04-04T09:25:31Z,https://web.archive.org/web/20250404094714/https://www.n-tv.de/leute/Boris-Becker-bedauert-Adolf-Hitler-Post-article25680396.html,"Dass Boris Becker am Donnerstag für Aufregung sorgt, hat mal nichts mit Tennis, Steuern oder Frauen zu tun. Stattdessen teilt der ehemalige Wimbledon-Sieger auf X einen kruden Verschwörungsmythos zu … [+1994 chars]",,de,'Adolf Hitler'
https://www.sueddeutsche.de/panorama/promis-mel-gibson-waffenbesitz-pierce-brosnan-aaron-taylor-johnson-james-bond-ellen-pompeo-taylor-swift-li.3231367,https://www.sueddeutsche.de/panorama/promis-mel-gibson-waffenbesitz-pierce-brosnan-aaron-taylor-johnson-james-bond-ellen-pompeo-taylor-swift-li.3231367,0,www.sueddeutsche.de,Leute: Ran ans Gewehr,"Trotz einer Verurteilung wegen häuslicher Gewalt erhält Trump-Unterstützer Mel Gibson offenbar sein Recht auf Waffenbesitz zurück, Taylor Swift stellt große Schecks aus, und Pierce Brosnan nennt seinen Wunsch-James-Bond.",https://www.sueddeutsche.de/2025/04/04/32fb5f4a-ea36-48ba-92a0-c5b7056dc5b0.jpeg?q=60&fm=webp&width=1200&rect=552%2C468%2C2391%2C1345,2025-04-04T10:38:07Z,,"Mel Gibson, 69, Schauspieler und Trump-Unterstützer, darf sich offenbar wieder bewaffnen. Laut einem Bericht der New York Times, die sich auf anonyme Quellen beruft, gehört Gibson zu einem Kreis von … [+2379 chars]",,de,'nan nan'
https://www.stern.de/lifestyle/leute/bill-kaulitz-und-tom--extrawurst-frage-loest-streit-mit--the-voice--aus-35612674.html,https://www.stern.de/lifestyle/leute/bill-kaulitz-und-tom--extrawurst-frage-loest-streit-mit--the-voice--aus-35612674.html,0,www.stern.de,"Ex-""The Voice""-Coaches: Podcast-Frage von Bill und Tom Kaulitz bringt ""The Voice""-Verantwortliche in Wut","Tom und Bill Kaulitz sprechen Klartext: Eine Nachfrage zu einer künftigen Zusammenarbeit mit ""The Voice"" führte zu einem Email-Drama mit Beschimpfungen.",https://image.stern.de/35612682/t/a0/v2/w1440/r1.7778/-/bill-kaulitz-und-tom-kaulitz.jpg,2025-04-04T11:34:00Z,https://web.archive.org/web/20250404134343/https://www.stern.de/lifestyle/leute/bill-kaulitz-und-tom--extrawurst-frage-loest-streit-mit--the-voice--aus-35612674.html,"Kopiere den aktuellen Link
Zur Merkliste hinzufügen
Tom und Bill Kaulitz sprechen Klartext: Eine Nachfrage zu einer künftigen Zusammenarbeit mit ""The Voice"" führt zu einem großen Eklat.
Die Kaulit… [+3689 chars]",,de,'Tom Kaulitz'
