index,url,valid,domain,title,description,image,published,archive,content,quote,language,keyword
https://www.stern.de/politik/deutschland/donald-trumps-sieg--warum-die-ampel-sich-sofort-zusammenreissen-muss-35203134.html,https://www.stern.de/politik/deutschland/donald-trumps-sieg--warum-die-ampel-sich-sofort-zusammenreissen-muss-35203134.html,0,www.stern.de,Meinung: Gefahr Trump – ein Koalitionsbruch wäre jetzt das Dümmste,In den USA zeichnet sich ein überraschend klarer Sieg von Donald Trump ab. Die Ampel-Regierung muss sofort zur Besinnung kommen. Sie wird plötzlich noch gebraucht.,https://image.stern.de/35203136/t/0x/v5/w1440/r1.7778/-/donald-trump-und-olaf-scholz.jpg,2024-11-06T09:21:00Z,,"Kopiere den aktuellen Link
In den USA zeichnet sich ein überraschend klarer Sieg von Donald Trump ab. Die Ampel-Regierung muss sofort zur Besinnung kommen. Sie wird plötzlich noch gebraucht.
Diese … [+3439 chars]",,de,'George Bush'
https://www.bild.de/unterhaltung/royals-adel/prinz-william-gibt-update-zu-kate-sie-war-das-ganze-jahr-unglaublich-672b6872048fa103a43c2257,https://www.bild.de/unterhaltung/royals-adel/prinz-william-gibt-update-zu-kate-sie-war-das-ganze-jahr-unglaublich-672b6872048fa103a43c2257,0,www.bild.de,Williams stolze Liebeserklärung an seine Kate - „Sie war das ganze Jahr einfach unglaublich“,"Prinz William spricht während seiner Südafrika-Reise zum ersten Mal über den Gesundheitszustand seiner Frau, Prinzessin Kate, nach ihrer Krebserkrankung.","https://images.bild.de/672b6872048fa103a43c2257/5ff2cd477798baf2b962d74d9ecf4bce,f57be946?w=1280",2024-11-06T16:30:46Z,,"Er ist derzeit in Südafrika wegen einer beruflichen Herzensangelegenheit und spricht dabei über seine tapfere Frau. Monatelang hat Prinzessin Kate gegen ihre Krebserkrankung gekämpft, sich einer präv… [+2301 chars]",,de,'Prinzessin Kate'
https://www.businessinsider.de/gruenderszene/perspektive/trump-2-0-was-denken-deutsche-startup-koepfe-ueber-die-us-wahl/,https://www.businessinsider.de/gruenderszene/perspektive/trump-2-0-was-denken-deutsche-startup-koepfe-ueber-die-us-wahl/,0,www.businessinsider.de,Trump 2.0 – Was denken deutsche Startup-Köpfe über die US-Wahl?,"Verena Pausder, Philipp Schröder und Co. beantworten die Frage, was Donald Trumps zweite US-Präsidentschaft für deutsche Startups bedeutet.",https://cdn.businessinsider.de/wp-content/uploads/2024/11/202411_GS_Reaktionen_Wahl_USA_02.jpg?ver=1730912531,2024-11-06T18:27:12Z,,"Trump-Beben? Von wegen. Die deutsche Startup-Szene reagiert erstaunlich ausgeruht auf Donald Trumps Wiederwahl in den USA. Warum? Wir haben nachgefragt. Donald Trump, der 45. Präsident der USA, wird … [+10283 chars]",,de,'Barack Obama'
https://www.bild.de/politik/ausland-und-internationales/medienbericht-scholz-entlaesst-lindner-672bc4edd7f5755b6b3c1920,https://www.bild.de/politik/ausland-und-internationales/medienbericht-scholz-entlaesst-lindner-672bc4edd7f5755b6b3c1920,0,www.bild.de,Medienbericht - Scholz entlässt Lindner,"Sie ist Geschichte! Die Ampel-Regierung von Kanzler Olaf Scholz (66) ist AUS! Am Abend, gegen 20.30 Uhr feuerte Scholz FDP-Chef und Bundesfinanzminister ...","https://images.bild.de/672bc4edd7f5755b6b3c1920/abcb2257d431bbf7a2d1eac3f9001c2d,afea2339?w=1280",2024-11-06T19:36:44Z,http://archive.md/20241106194127/https://www.bild.de/politik/ausland-und-internationales/medienbericht-scholz-entlaesst-lindner-672bc4edd7f5755b6b3c1920,"Sie ist Geschichte! Die Ampel-Regierung von Kanzler Olaf Scholz (66) ist AUS!
Am Abend, gegen 20.30 Uhr feuerte Scholz FDP-Chef und Bundesfinanzminister Christian Lindner (FDP)! Damit ist klar: Die … [+3018 chars]",,de,'Wolfgang Kubicki'
https://www.bild.de/politik/inland/scholz-entlaesst-lindner-aus-aus-die-ampel-ist-aus-672bc4edd7f5755b6b3c1920,https://www.bild.de/politik/inland/scholz-entlaesst-lindner-aus-aus-die-ampel-ist-aus-672bc4edd7f5755b6b3c1920,0,www.bild.de,Scholz entlässt Lindner - Aus! Aus! Die Ampel ist aus!,"Sie ist Geschichte! Die Ampel-Regierung von Kanzler Olaf Scholz (66, SPD) ist AUS! Am Abend, gegen 20.30 Uhr feuerte Scholz FDP-Chef und Bundesfinanzmini...","https://images.bild.de/672bc4edd7f5755b6b3c1920/b799a1e35a9397d9cc97d53d8e8a6bde,4c9c33d6?w=1280",2024-11-06T21:22:59Z,http://archive.md/20241106220044/https://www.bild.de/politik/inland/scholz-entlaesst-lindner-aus-aus-die-ampel-ist-aus-672bc4edd7f5755b6b3c1920,"Sie ist Geschichte! Die Ampel-Regierung von Kanzler Olaf Scholz (66, SPD) ist AUS!
Am Abend, gegen 20.30 Uhr feuerte Scholz FDP-Chef und Bundesfinanzminister Christian Lindner (45)! Damit ist klar: … [+3494 chars]",,de,'Olaf Scholz'
https://www.bild.de/politik/inland/scholz-entlaesst-lindner-die-reaktionen-auf-das-ende-der-ampel-regierung-672bbd7a048fa103a43c2831,https://www.bild.de/politik/inland/scholz-entlaesst-lindner-die-reaktionen-auf-das-ende-der-ampel-regierung-672bbd7a048fa103a43c2831,0,www.bild.de,Union fordert sofortige Neuwahlen - Die ersten Reaktionen aufs Ampel-Aus,"Bundeskanzler Olaf Scholz entlässt Finanzminister Christian Lindner, Unions-Politiker fordern sofortige Neuwahlen und eine neue Regierung.","https://images.bild.de/672bbd7a048fa103a43c2831/ac8708e0a215aa934f101bb6decc8865,1fa523c7?w=1280",2024-11-06T23:12:25Z,,"Die Bombe ist geplatzt: Das Ende der Ampel ist besiegelt. Am Mittwochabend hat Bundeskanzler Olaf Scholz (66, SPD) seinen Finanzminister Christian Lindner (45, FDP) entlassen.
Am 15. Januar will Sch… [+2827 chars]",,de,'nan nan'
https://www.n-tv.de/politik/US-wahl-2024/Obama-und-Biden-brechen-Schweigen-nach-US-Wahlniederlage-article25343581.html,https://www.n-tv.de/politik/US-wahl-2024/Obama-und-Biden-brechen-Schweigen-nach-US-Wahlniederlage-article25343581.html,0,www.n-tv.de,Trump nimmt Einladung an: Obama und Biden brechen Schweigen nach US-Wahlniederlage,Joe Biden und Barack Obama haben sich zur Wahl geäußert. Beide würdigen Kamala Harris und ihrem Wahlkampf und gratulieren dem Wahlsieger Donald Trump. Der aktuelle Präsident spricht dabei auch eine Einladung an seinen Nachfolger aus.,https://bilder2.n-tv.de/img/incoming/crop25099841/1781328535-cImg_16_9-w1200/454860595.jpg,2024-11-07T02:39:20Z,,Joe Biden und Barack Obama haben sich zur Wahl geäußert. Beide würdigen Kamala Harris und ihrem Wahlkampf und gratulieren dem Wahlsieger Donald Trump. Der aktuelle Präsident spricht dabei auch eine E… [+2280 chars],,de,'Barack Obama'
https://www.faz.net/aktuell/rhein-main/boris-rhein-fordert-nach-ampel-aus-schnelle-neuwahlen-110095451.html,https://www.faz.net/aktuell/rhein-main/boris-rhein-fordert-nach-ampel-aus-schnelle-neuwahlen-110095451.html,0,www.faz.net,Rhein: Aus für Ampel war „überfällig“,"Nach dem Aus für die Ampelkoalition auf Bundesebene, trauert Hessens Ministerpräsident Boris Rhein (CDU) dem Bündnis nicht lange nach. Er fordert schnelle Neuwahlen.",https://media1.faz.net/ppmedia/aktuell/rhein-main/2848732220/1.10095469/facebook_teaser/nach-vorne-gucken-hessens.jpg,2024-11-07T07:42:28Z,,"Nach Einschätzung des Ministerpräsidenten steckt Deutschland derzeit in schweren Krisen, auf die der Kanzlerkandidat der Union, Friedrich Merz, die richtige Antworten habe. Friedrich Merz und die Uni… [+2909 chars]",,de,'Boris Rhein'
https://www.faz.net/aktuell/gesellschaft/smalltalk/heidi-klum-trifft-prinz-william-bei-umweltpreis-in-suedafrika-110095617.html,https://www.faz.net/aktuell/gesellschaft/smalltalk/heidi-klum-trifft-prinz-william-bei-umweltpreis-in-suedafrika-110095617.html,0,www.faz.net,Neues von den Promis: Heidi Klum trifft Prinz William,Großbritanniens Thronfolger hat in Kapstadt seinen Umweltpreis verliehen. Eine der Auszeichnungen übergab dabei Heidi Klum.,https://media0.faz.net/ppmedia/aktuell/feuilleton/2117226996/1.10095624/facebook_teaser/selfie-beim-earth-shot-prize.jpg,2024-11-07T09:54:18Z,,"Wir alle müssen über den Klimawandel nachdenken, sagte Klum, die laut eigener Aussage zum ersten Mal in Südafrika war, während der Veranstaltung. Als jemand, der in der Modeindustrie arbeite, sei sie… [+1404 chars]",,de,'Heidi Klum'
https://www.diepresse.com/19043210/prinz-william-laedt-heidi-klum-nach-suedafrika-ein,https://www.diepresse.com/19043210/prinz-william-laedt-heidi-klum-nach-suedafrika-ein,0,www.diepresse.com,Prinz William lädt Heidi Klum nach Südafrika ein,Der britische Prinz William holte sich mit dem Model Heidi Klum eine reichweitenstarke Laudatorin für seine südafrikanische Umweltgala an Bord.,https://img.diepresse.com/public/incoming/q0427d-2024-11-06T224509Z_719084269_RC2VZAA17R23_RTRMADP_3_BRITAIN-ROYALS-SAFRICA.JPG/alternates/DPR_SOCIAL_NACHRICHTEN/2024-11-06T224509Z_719084269_RC2VZAA17R23_RTRMADP_3_BRITAIN-ROYALS-SAFRICA.JPG,2024-11-07T10:24:13Z,,"Der britische Prinz William holte sich mit dem Model Heidi Klum eine reichweitenstarke Laudatorin für seine südafrikanische Umweltgala an Bord. 
Das deutsche Model Heidi Klum hat gemeinsam mit Prinz… [+1907 chars]",,de,'Prinz Louis'
https://www.stern.de/kultur/us-wahl-und-ampel-aus--welche-sondersendungen-gibt-es-heute--35208676.html,https://www.stern.de/kultur/us-wahl-und-ampel-aus--welche-sondersendungen-gibt-es-heute--35208676.html,0,www.stern.de,US-Wahl und Ampel-Aus: Welche Sondersendungen gibt es heute?,Die USA haben Donald Trump erneut zum Präsidenten gewählt und Deutschland steht vor Neuwahlen. Mehrere Sender zeigen heute Sondersendungen.,https://image.stern.de/35208680/t/yN/v1/w1440/r1.7778/-/07--welche-sondersendungen-gibt-es-heute----16-9---spoton-article-1079326.jpg,2024-11-07T13:59:00Z,,"Kopiere den aktuellen Link
Die USA haben Donald Trump erneut zum Präsidenten gewählt und Deutschland steht vor Neuwahlen. Mehrere Sender zeigen heute Sondersendungen.
Die USA haben Donald Trump (78… [+1688 chars]",,de,'Maybrit Illner'
https://www.faz.net/aktuell/politik/us-wahl/ein-europaeisches-treffen-im-zeichen-donald-trumps-110096723.html,https://www.faz.net/aktuell/politik/us-wahl/ein-europaeisches-treffen-im-zeichen-donald-trumps-110096723.html,0,www.faz.net,Zu Besuch bei Orbán: Ein europäisches Treffen im Zeichen Donald Trumps,Europas Staatenlenker beraten beim Treffen der Europäischen Politischen Gemeinschaft über die Ukraine und Sicherheitsfragen. Doch vor allem kommen sie nicht um ein Thema herum: Donald Trumps Wahlsieg.,https://media0.faz.net/ppmedia/aktuell/politik/1309025730/1.10096868/facebook_teaser_fplus/orban-spricht-mit-macron.jpg,2024-11-07T15:09:51Z,http://archive.md/20241107175655/https://www.faz.net/aktuell/politik/us-wahl/ein-europaeisches-treffen-im-zeichen-donald-trumps-110096723.html,"Wahrscheinlich hätte es Donald Trump Freude bereitet, zu hören, was die Staatenlenker Europas am Donnerstag zur Wahl in Amerika zu sagen hatten. Am besten hätte ihm der türkische Präsident gefallen. … [+220 chars]",,de,'Donald Trump'
https://www.welt.de/politik/deutschland/article254412678/FDP-Vize-Wolfgang-Kubicki-Haengepartie-nach-Willen-des-Kanzlers-wird-dem-Land-erheblichen-Schaden-zufuegen.html,https://www.welt.de/politik/deutschland/article254412678/FDP-Vize-Wolfgang-Kubicki-Haengepartie-nach-Willen-des-Kanzlers-wird-dem-Land-erheblichen-Schaden-zufuegen.html,0,www.welt.de,„Hängepartie nach Willen des Kanzlers wird dem Land erheblichen Schaden zufügen“,Als „stillos“ rügt FDP-Vizechef Kubicki den Kanzler nach dem Rauswurf der Liberalen aus der Regierung. Auch der Plan von Olaf Scholz (SPD) für die Neuwahl irritiert ihn. Mit Blick auf die miserablen Umfragewerte seiner Partei zieht er einen Vergleich mit dem …,https://img.welt.de/img/bildergalerien/mobile254413660/4107932147-ci16x9-w1200/DSCF4685-jpg.jpg,2024-11-07T16:09:10Z,http://archive.md/20241107171015/https://www.welt.de/politik/deutschland/article254412678/FDP-Vize-Wolfgang-Kubicki-Haengepartie-nach-Willen-des-Kanzlers-wird-dem-Land-erheblichen-Schaden-zufuegen.html,Als stillos rügt FDP-Vizechef Kubicki den Kanzler nach dem Rauswurf der Liberalen aus der Regierung. Auch der Plan von Olaf Scholz (SPD) für die Neuwahl irritiert ihn. Mit Blick auf die miserablen Um… [+4223 chars],,de,'Olaf Scholz'
https://www.diepresse.com/19045249/europaeer-umgarnen-donald-trump,https://www.diepresse.com/19045249/europaeer-umgarnen-donald-trump,0,www.diepresse.com,Europäer umgarnen Donald Trump [premium],Bei dem Treffen in Budapest stand die Wahl des Republikaners und deren Auswirkungen auf Europa im Mittelpunkt. Orbáns guter Draht nach Washington könnte auch Brüssel nützlich sein.,https://img.diepresse.com/public/incoming/hzuke6-HUNGARY-EU-SUMMIT-EUROPE-DIPLOMACY-CONFLICT/alternates/DPR_SOCIAL_NACHRICHTEN/HUNGARY-EU-SUMMIT-EUROPE-DIPLOMACY-CONFLICT,2024-11-07T16:35:57Z,http://archive.md/20241107235504/https://www.diepresse.com/19045249/europaeer-umgarnen-donald-trump,"Bei dem Treffen in Budapest stand die Wahl des Republikaners und deren Auswirkungen auf Europa im Mittelpunkt. Orbáns guter Draht nach Washington könnte auch Brüssel nützlich sein. 
Besser hätte das… [+1631 chars]",,de,'Recep Tayyip Erdoan'
https://www.stern.de/kultur/prinz-william--2024-ist-das-schwierigste-jahr-seines-lebens-35209982.html,https://www.stern.de/kultur/prinz-william--2024-ist-das-schwierigste-jahr-seines-lebens-35209982.html,0,www.stern.de,Prinz William: 2024 ist das schwierigste Jahr seines Lebens,"Prinz William spricht darüber, wie schrecklich die vergangenen Monate waren. Er habe das wohl ""härteste Jahr"" seines Lebens hinter sich.",https://image.stern.de/35209986/t/ax/v1/w1440/r1.7778/-/08--2024-ist-das-schwierigste-jahr-seines-lebens---16-9---spoton-article-1079358.jpg,2024-11-07T23:15:00Z,,"Kopiere den aktuellen Link
Prinz William spricht darüber, wie schrecklich die vergangenen Monate waren. Er habe das wohl ""härteste Jahr"" seines Lebens hinter sich.
Wie muss man sich wohl als Thronf… [+2823 chars]",,de,'Prinz Louis'
https://www.brigitte.de/aktuell/prinz-william--royal-spricht-offen-ueber-das-schwierigste-jahr-seines-lebens-13902722.html,https://www.brigitte.de/aktuell/prinz-william--royal-spricht-offen-ueber-das-schwierigste-jahr-seines-lebens-13902722.html,0,www.brigitte.de,Prinz William: Royal spricht offen über das schwierigste Jahr seines Lebens,"Prinz William spricht darüber, wie schrecklich die vergangenen Monate waren. Er habe das wohl ""härteste Jahr"" seines Lebens hinter sich.",https://image.brigitte.de/13902724/t/kZ/v1/w1440/r1.7778/-/08--royal-spricht-offen-ueber-das-schwierigste-jahr-seines-lebens---1-1---spoton-article-1079358.jpg,2024-11-07T23:21:00Z,,"Prinz William spricht darüber, wie schrecklich die vergangenen Monate waren. Er habe das wohl ""härteste Jahr"" seines Lebens hinter sich.
Wie muss man sich wohl als Thronfolger fühlen, wenn die ganze… [+2887 chars]",,de,'Prinz William'
https://www.n-tv.de/leute/Prinz-William-hat-schwierigstes-Jahr-seines-Lebens-hinter-sich-article25346689.html,https://www.n-tv.de/leute/Prinz-William-hat-schwierigstes-Jahr-seines-Lebens-hinter-sich-article25346689.html,0,www.n-tv.de,"""Es war furchtbar"": William hat schwierigstes Jahr seines Lebens hinter sich","Der Palast macht Anfang des Jahres öffentlich, dass sowohl bei König Charles III. als auch bei Prinzessin Kate Krebs diagnostiziert wurde. Prinz William spricht jetzt darüber, wie schrecklich die vergangenen Monate für ihn waren.",https://bilder4.n-tv.de/img/incoming/crop25346691/7981328582-cImg_16_9-w1200/imago0773186777h.jpg,2024-11-08T00:50:13Z,,"Der Palast macht Anfang des Jahres öffentlich, dass sowohl bei König Charles III. als auch bei Prinzessin Kate Krebs diagnostiziert wurde. Prinz William spricht jetzt darüber, wie schrecklich die ver… [+2837 chars]",,de,'König Charles III'
https://www.faz.net/aktuell/gesellschaft/menschen/prinz-william-es-war-das-wohl-haerteste-jahr-meines-lebens-110097787.html,https://www.faz.net/aktuell/gesellschaft/menschen/prinz-william-es-war-das-wohl-haerteste-jahr-meines-lebens-110097787.html,0,www.faz.net,Prinz William: Es war das wohl härteste Jahr meines Lebens,Der britische Thronfolger hat während eines Besuchs in Südafrika ungewohnt offen über private Themen gesprochen. Sowohl sein Vater König Charles III. als auch seine Frau Prinzessin Kate mussten in diesem Jahr Krebsdiagnosen verkraften.,https://media1.faz.net/ppmedia/aktuell/gesellschaft/1541558856/1.10097789/facebook_teaser/der-britische-thronfolger.jpg,2024-11-08T01:05:01Z,,"Aber ich bin so stolz auf meine Frau, ich bin stolz auf meinen Vater, dass sie die Dinge gestemmt haben, wurde William zitiert. Aber von einem persönlichen Familienstandpunkt aus gesehen, ja, war es … [+949 chars]",,de,'Prinzessin Kate'
https://www.stern.de/lifestyle/leute/prinz-william-spricht-ueber-das-jahr-2024---es-war-furchtbar--35210040.html,https://www.stern.de/lifestyle/leute/prinz-william-spricht-ueber-das-jahr-2024---es-war-furchtbar--35210040.html,0,www.stern.de,"Britischer Thronfolger: Prinz William spricht über das Jahr 2024: ""Es war furchtbar""",Sein Vater König Charles III. und seine Frau Prinzessin Kate mussten in diesem Jahr Krebsdiagnosen verkraften. Prinz William spricht darüber auf einer Auslandsreise ungewohnt offen.,https://image.stern.de/35210042/t/oK/v1/w1440/r1.7778/-/prinz-william-su-dafrika.jpg,2024-11-08T02:34:00Z,,"Kopiere den aktuellen Link
Sein Vater König Charles III. und seine Frau Prinzessin Kate mussten in diesem Jahr Krebsdiagnosen verkraften. Prinz William spricht darüber auf einer Auslandsreise ungewo… [+1697 chars]",,de,'Prinz William'
https://www.tagesspiegel.de/gesellschaft/britisches-konigshaus-prinz-william-es-war-das-wohl-harteste-jahr-meines-lebens-12670463.html,https://www.tagesspiegel.de/gesellschaft/britisches-konigshaus-prinz-william-es-war-das-wohl-harteste-jahr-meines-lebens-12670463.html,0,www.tagesspiegel.de,Britisches Königshaus: Prinz William: Es war das wohl härteste Jahr meines Lebens,Sowohl sein Vater König Charles III. als auch seine Frau Prinzessin Kate mussten in diesem Jahr Krebsdiagnosen verkraften. Prinz William spricht darüber auf einer Auslandsreise nun ungewohnt offen.,https://www.tagesspiegel.de/images/12670460/alternates/BASE_16_9_W1400/1731056679000/prinz-william-in-kapstadt.jpeg,2024-11-08T09:04:39Z,,Großbritanniens Thronfolger Prinz William (42) hat ungewohnt offen über persönliche Belastungen in den vergangenen Monaten gesprochen. Zum Abschluss einer Auslandsreise nach Südafrika wurde er nach d… [+1593 chars],,de,'Prinzessin Kate'
https://www.tagesspiegel.de/gesellschaft/britisches-konigshaus-prinz-williams-offene-worte-hartestes-jahr-meines-lebens-12670463.html,https://www.tagesspiegel.de/gesellschaft/britisches-konigshaus-prinz-williams-offene-worte-hartestes-jahr-meines-lebens-12670463.html,0,www.tagesspiegel.de,Britisches Königshaus: Prinz Williams offene Worte: „Härtestes Jahr meines Lebens“,"Nach ihrer Chemotherapie nimmt Prinzessin Kate am Wochenende wieder an einem wichtigen Gedenken teil. Ihr Mann Prinz William spricht ungewohnt offen darüber, wie schwer die vergangenen Monate waren.",https://www.tagesspiegel.de/images/12673097/alternates/BASE_16_9_W1400/1731071304000/prinz-william-in-kapstadt.jpeg,2024-11-08T09:04:39Z,,"Für Großbritanniens Thronfolger Prinz William (42) sind es ungewöhnliche Worte. Es war wahrscheinlich das härteste Jahr meines Lebens, sagte William der britischen Nachrichtenagentur PA zufolge. Glei… [+3223 chars]",,de,'Prinzessin Kate'
https://www.focus.de/panorama/welt/bin-so-stolz-auf-meine-frau-es-war-furchtbar-prinz-william-spricht-ueber-das-haerteste-jahr-seines-lebens_id_260463119.html,https://www.focus.de/panorama/welt/bin-so-stolz-auf-meine-frau-es-war-furchtbar-prinz-william-spricht-ueber-das-haerteste-jahr-seines-lebens_id_260463119.html,0,www.focus.de,„Bin so stolz auf meine Frau“ - „Es war furchtbar“: Prinz William spricht über das „härteste Jahr seines Lebens“,Sowohl sein Vater König Charles III. als auch seine Frau Prinzessin Kate mussten in diesem Jahr Krebsdiagnosen verkraften. Prinz William spricht darüber auf einer Auslandsreise nun ungewohnt offen.,https://p6.focus.de/img/kultur/medien/id_260462487/prinz-william-ueber-kates-krebskampf-haertestes-jahr-meines-lebens-.jpg?im=Crop%3D%280%2C15%2C1200%2C600%29%3BResize%3D%281200%2C627%29&impolicy=perceptual&quality=mediumHigh&hash=d93020bfff048e5cb18b2d55c35aa8a5681cc053a17385647896fbc4e88fa6db,2024-11-08T09:19:28Z,,Sowohl sein Vater König Charles III. als auch seine Frau Prinzessin Kate mussten in diesem Jahr Krebsdiagnosen verkraften. Prinz William spricht darüber auf einer Auslandsreise nun ungewohnt offen.Gr… [+1651 chars],,de,'Charles III'
https://www.sueddeutsche.de/panorama/promi-news-prinz-william-kate-krebs-raygun-olympia-rueckzug-breakdance-lux.SRNATKk9ec6Dsqza7fPPLV,https://www.sueddeutsche.de/panorama/promi-news-prinz-william-kate-krebs-raygun-olympia-rueckzug-breakdance-lux.SRNATKk9ec6Dsqza7fPPLV,0,www.sueddeutsche.de,Leute: Prinz William und sein „Annus horribilis“,"Der britische Thronfolger zeigt sich verletzlich, Raygun will ihren Känguru-Breakdance nicht mehr öffentlich zeigen und Sasha kein Rasenmähervater mehr sein.",https://www.sueddeutsche.de/2024/11/08/2673acc4-ae77-41e0-8ee9-52eb6d689e0a.jpeg?q=60&fm=webp&width=1200&rect=0%2C59%2C3000%2C1688,2024-11-08T12:18:15Z,,"William Arthur Philip Louis, 42, Prince of Wales, blickt auf ein hartes Jahr zurück. Zum Abschluss einer Auslandsreise nach Südafrika verriet Englands Thronfolger britischen Medien, wie sehr ihn die … [+3164 chars]",,de,'Prinz Louis'
https://www.nzz.ch/schweiz/trump-gab-den-bundesraeten-weder-spitznamen-noch-klopfte-er-sprueche-ld.1856656,https://www.nzz.ch/schweiz/trump-gab-den-bundesraeten-weder-spitznamen-noch-klopfte-er-sprueche-ld.1856656,0,www.nzz.ch,"INTERVIEW - «Weder gab Trump den Bundesräten Spitznamen, noch klopfte er Sprüche»","Der ehemalige Spitzendiplomat Martin Dahinden war unter Barack Obama und Donald Trump Botschafter in Washington. Im Interview erklärt er, wie Trump in Verhandlungen tickt, wie sein Comeback möglich war – und was es für die Schweiz bedeutet.","https://img.nzz.ch/2024/11/08/4de20684-595a-4e30-bb84-b631a1539873.jpeg?width=1200&height=674&fit=bounds&quality=75&auto=webp&crop=3000,1687,x0,y0&wmark=nzz",2024-11-09T04:30:00Z,http://archive.md/20241109063344/https://www.nzz.ch/schweiz/trump-gab-den-bundesraeten-weder-spitznamen-noch-klopfte-er-sprueche-ld.1856656,"«Ich wachte jeden Morgen mit Trumps Tweets auf»: Martin Dahinden begrüsst Donald Trump im Januar 2018 am WEF in Davos, im Hintergrund die Bundesräte Ignazio Cassis und Johann Schneider-Ammann.
Marti… [+14343 chars]",,de,'Barack Obama'
https://www.stern.de/gesellschaft/regional/hessen/nach-dem-ampel-aus--rhein-fordert-zuegige-neuwahl-statt--tricksereien--35214830.html,https://www.stern.de/gesellschaft/regional/hessen/nach-dem-ampel-aus--rhein-fordert-zuegige-neuwahl-statt--tricksereien--35214830.html,0,www.stern.de,"Nach dem Ampel-Aus: Rhein fordert zügige Neuwahl statt ""Tricksereien""",Hessens Ministerpräsident Boris Rhein dringt auf eine schnelle Neuwahl auf Bundesebene. Bundeskanzler Olaf Scholz macht er einen schweren Vorwurf.,https://image.stern.de/35214832/t/VR/v1/w1440/r1.7778/-/10--ylwa5nhllhv14axw800h600jpeg---a5ce8e481c6bce9d.jpg,2024-11-09T23:05:35Z,,"Kopiere den aktuellen Link
Hessens Ministerpräsident Boris Rhein dringt auf eine schnelle Neuwahl auf Bundesebene. Bundeskanzler Olaf Scholz macht er einen schweren Vorwurf.
Hessens Ministerpräside… [+1428 chars]",,de,'Boris Rhein'
https://www.bild.de/unterhaltung/royals-adel/lady-louise-windsor-koenig-charles-aufstrebender-star-672de6feebdb8724738ec242,https://www.bild.de/unterhaltung/royals-adel/lady-louise-windsor-koenig-charles-aufstrebender-star-672de6feebdb8724738ec242,0,www.bild.de,"Jung, fleißig, aufstrebend - Sie ist König Charles’ neue Windsor-Waffe","Lady Louise Windsor, Enkelin von Prinz Philip, vereint Tradition und Moderne und wird zur wichtigen Stütze für König Charles III.","https://images.bild.de/672de6feebdb8724738ec242/1c81373e3bbd8591a897bc0cfd0c3bb0,c95c2fae?w=1280",2024-11-11T12:21:03Z,,Lady Louise Windsor ist erst 21 Jahre alt im Ansehen von König Charles III. (75) steigt die Tochter von Prinz Edward (60) und Herzogin Sophie von Edinburgh (59) aber immer weiter auf. Und es war ihr … [+4169 chars],,de,'Prinz Louis'
https://www.focus.de/politik/deutschland/scholz-pfui-pistorius-hui-ist-dieses-ranking-die-antwort-auf-die-kanzlerfrage-der-spd_id_260471704.html,https://www.focus.de/politik/deutschland/scholz-pfui-pistorius-hui-ist-dieses-ranking-die-antwort-auf-die-kanzlerfrage-der-spd_id_260471704.html,0,www.focus.de,Nächste Umfrage-Klatsche - Pistorius hängt Scholz schon wieder ab - nur ein AfD-Politiker ist noch unbeliebter,"In einem neuen Politiker-Ranking sackt Olaf Scholz weiter ab. Der Kanzler ist aber nicht der einzige Politiker, der durch das Ampel-Chaos noch unbeliebter wird. Auch weitere Koalitionäre und Mitglieder der ehemaligen Regierungsparteien verlieren an Beliebtheit",https://p6.focus.de/img/regional/mecklenburg-vorpommern/id_260465560/kanzler-olaf-scholz.jpg?im=Crop%3D%280%2C252%2C2048%2C1024%29%3BResize%3D%281200%2C627%29&impolicy=perceptual&quality=mediumHigh&hash=122bee77127c88357bed8cb30a56e52fd757e1f761857eebeaa6d6212884bbe1,2024-11-11T18:35:46Z,,"In einem neuen Politiker-Ranking sackt Olaf Scholz weiter ab. Der Kanzler ist aber nicht der einzige Politiker, der durch das Ampel-Chaos noch unbeliebter wird. Auch weitere Koalitionäre und Mitglied… [+2029 chars]",,de,'Boris Rhein'
