index,url,valid,domain,title,description,image,published,archive,content,quote,language,keyword
https://consent.google.com/ml?continue=https://news.google.com/rss/articles/CBMidGh0dHBzOi8vd3d3LnN0ZXJuLmRlL3Nwb3J0L2Z1c3NiYWxsL21lc3NpLWVudHNjaHVsZGlndC1zaWNoLW5hY2gtc3VzcGVuZGllcnVuZy1iZWktcGFyaXMtc2FpbnQtZ2VybWFpbi0zMzQ0MTA4MC5odG1s0gF4aHR0cHM6Ly93d3cuc3Rlcm4uZGUvYW1wL3Nwb3J0L2Z1c3NiYWxsL21lc3NpLWVudHNjaHVsZGlndC1zaWNoLW5hY2gtc3VzcGVuZGllcnVuZy1iZWktcGFyaXMtc2FpbnQtZ2VybWFpbi0zMzQ0MTA4MC5odG1s?oc%3D5&gl=FR&hl=en-US&cm=2&pc=n&src=1,https://consent.google.com/ml?continue=https://news.google.com/rss/articles/CBMidGh0dHBzOi8vd3d3LnN0ZXJuLmRlL3Nwb3J0L2Z1c3NiYWxsL21lc3NpLWVudHNjaHVsZGlndC1zaWNoLW5hY2gtc3VzcGVuZGllcnVuZy1iZWktcGFyaXMtc2FpbnQtZ2VybWFpbi0zMzQ0MTA4MC5odG1s0gF4aHR0cHM6Ly93d3cuc3Rlcm4uZGUvYW1wL3Nwb3J0L2Z1c3NiYWxsL21lc3NpLWVudHNjaHVsZGlndC1zaWNoLW5hY2gtc3VzcGVuZGllcnVuZy1iZWktcGFyaXMtc2FpbnQtZ2VybWFpbi0zMzQ0MTA4MC5odG1s?oc%3D5&gl=FR&hl=en-US&cm=2&pc=n&src=1,0,consent.google.com,Messi entschuldigt sich nach Suspendierung bei Paris Saint-Germain - STERN.de,"<ol><li>Messi entschuldigt sich nach Suspendierung bei Paris Saint-Germain  STERN.de
</li><li>PARIS-SAINT-GERMAIN: Haut Lionel Messi ab? Darum positionieren sich nun auch Fans gegen den Weltstar  WELT Nachrichtensender
</li><li>Verärgerter Messi nie mehr fü…",,2023-05-05T16:11:24Z,,"We use cookies and data to<ul><li>Deliver and maintain Google services</li><li>Track outages and protect against spam, fraud, and abuse</li><li>Measure audience engagement and site statistics to unde… [+1131 chars]",,de,'Lionel Messi'
https://www.stern.de/sport/fussball/messi-entschuldigt-sich-nach-suspendierung-bei-paris-saint-germain-33441080.html,https://www.stern.de/sport/fussball/messi-entschuldigt-sich-nach-suspendierung-bei-paris-saint-germain-33441080.html,0,www.stern.de,Wegen Saudi-Arabien-Reise: Messi entschuldigt sich nach Suspendierung bei Paris Saint-Germain,"Lionel Messi äußert sich erstmals nach seiner Suspendierung öffentlich. Der Fußball-Superstar bittet um Entschuldigung. Ob er noch mal für Paris Saint-Germain spielen wird, bleibt offen.",https://image.stern.de/33441082/t/Yp/v1/w1440/r1.7778/-/messi.jpg,2023-05-05T16:11:24Z,https://web.archive.org/web/20230506022355/https://www.stern.de/sport/fussball/messi-entschuldigt-sich-nach-suspendierung-bei-paris-saint-germain-33441080.html,"Lionel Messi äußert sich erstmals nach seiner Suspendierung öffentlich. Der Fußball-Superstar bittet um Entschuldigung. Ob er noch mal für Paris Saint-Germain spielen wird, bleibt offen.
Fußball-Wel… [+1947 chars]",,de,'Lionel Messi'
https://www.morgenpost.de/sport/article238319761/Lionel-Messi-entschuldigt-sich-Dachte-haetten-freien-Tag.html,https://www.morgenpost.de/sport/article238319761/Lionel-Messi-entschuldigt-sich-Dachte-haetten-freien-Tag.html,0,www.morgenpost.de,"Fußball: Lionel Messi entschuldigt sich: Dachte, hätten freien Tag",Lionel Messi äußert sich erstmals nach seiner Suspendierung öffentlich. Der Fußball-Superstar bittet Klub um Entschuldigung.,https://img.morgenpost.de/img/sport/crop238319695/2042602323-w820-cv16_9-q85/lionel-messi-saudi-arabien.jpg,2023-05-05T16:29:01Z,,"Paris. Fußball-Weltmeister Lionel Messi hat seine von Paris St. Germain nicht genehmigte Reise nach Saudi-Arabien mit einem Missverständnis begründet. Ich dachte, wir hätten wie immer einen freien Ta… [+2311 chars]",,de,'Lionel Messi'
https://orf.at/stories/3314982/,https://orf.at/stories/3314982/,0,orf.at,Großereignis mit Staraufgebot,"Am Samstag werden König Charles III. und seine Ehefrau Camilla in der Londoner Westminster Abbey gekrönt. Millionen von Menschen im Vereinigten Königreich fiebern dem Tag bereits entgegen – wochenlang wurde das Großevent, das einen Gottesdienst und einen Fest…",https://ibs.orf.at/news?image=https%3A%2F%2Fassets.orf.at%2Fmims%2F2023%2F18%2F10%2Fcrops%2Fw%3D1200%2Ch%3D630%2Cq%3D75%2F1776552_master_660010_grossbritannien_charles_kroenung_vorschau_r.jpg%3Fs%3D82f1614daedce474447532797e2e93a01b6a2fe1,2023-05-05T16:32:54Z,https://web.archive.org/web/20230505200216/https://orf.at/stories/3314982/,"Bereits ab 8.00 Uhr in der Früh treffen am Samstag die ersten Gäste in der Westminster Abbey ein, zwischen 10.30 und 11.45 Uhr ist die Ankunft von Staats- und Regierungschefs, ranghohen britischen Po… [+7001 chars]",,de,'König Charles III'
https://www.transfermarkt.de/messi-entschuldigt-sich-nach-suspendierung-bei-psg-konnte-reise-bdquo-nicht-noch-einmal-absagen-ldquo-/view/news/421238,https://www.transfermarkt.de/messi-entschuldigt-sich-nach-suspendierung-bei-psg-konnte-reise-bdquo-nicht-noch-einmal-absagen-ldquo-/view/news/421238,0,www.transfermarkt.de,Lionel Messi entschuldigt sich nach Suspendierung bei PSG,"Lionel Messi hat sich nach seiner Suspendierung bei Paris Saint-Germain öffentlich entschuldigt. „Nach allem, was passiert ist, wollte ich dieses Video machen. Zunächst...",https://tmssl.akamaized.net/images/foto/big/lionel-messi-psg-22-23-1683200447-106489.jpg?lm=1683200464,2023-05-05T16:39:51Z,https://web.archive.org/web/20230505210811/https://www.transfermarkt.de/messi-entschuldigt-sich-nach-suspendierung-bei-psg-konnte-reise-bdquo-nicht-noch-einmal-absagen-ldquo-/view/news/421238,"Lionel Messi hat sich nach seiner Suspendierung bei Paris Saint-Germain öffentlich entschuldigt. „Nach allem, was passiert ist, wollte ich dieses Video machen. Zunächst einmal entschuldige ich mich b… [+2585 chars]",,de,'Lionel Messi'
https://www.kicker.de/messi-entschuldigt-sich-und-liefert-unerwartete-begruendung-950120/artikel,https://www.kicker.de/messi-entschuldigt-sich-und-liefert-unerwartete-begruendung-950120/artikel,0,www.kicker.de,Messi entschuldigt sich und liefert unerwartete Begründung,Lionel Messi hat sich nach seiner Suspendierung für seine nicht genehmigte Reise nach Saudi-Arabien entschuldigt - und lieferte dabei eine unerwartete Begründung.,"https://derivates.kicker.de/image/upload/c_crop,x_0,y_0,w_4000,h_2250/w_1200,q_auto/v1/2023/05/05/3b9efd40-1db3-4630-88b6-62aff332ca17.jpeg",2023-05-05T16:46:05Z,,"Lionel Messi hat sich nach seiner Suspendierung für seine nicht genehmigte Reise nach Saudi-Arabien entschuldigt - und lieferte dabei eine unerwartete Begründung. 
 Via Instagram meldete sich Weltme… [+2280 chars]",,de,'Lionel Messi'
https://www.welt.de/sport/fussball/article245176518/Lionel-Messi-Trainer-deutet-an-dass-Messi-nie-wieder-fuer-PSG-spielt.html,https://www.welt.de/sport/fussball/article245176518/Lionel-Messi-Trainer-deutet-an-dass-Messi-nie-wieder-fuer-PSG-spielt.html,0,www.welt.de,"Trainer deutet an, dass Messi nie wieder für PSG spielt","Nach einem nicht genehmigten Ausflug nach Saudi-Arabien ist Lionel Messi bei Paris Saint-Germain suspendiert. Sein Trainer deutet nun an, dass der Superstar eventuell gar nicht mehr zurückkehrt. Für die Proteste der PSG-Fans hat er Verständnis.",https://img.welt.de/img/sport/mobile245179016/0821354457-ci16x9-w1200/FILE-PHOTO-Ligue-1-Paris-St-Germain-v-Olympique-de-Marseille.jpg,2023-05-05T17:41:45Z,https://web.archive.org/web/20230505195249/http://www.welt.de/sport/fussball/article245176518/Lionel-Messi-Trainer-deutet-an-dass-Messi-nie-wieder-fuer-PSG-spielt.html,Trainer Christophe Galtier will sich zu der Suspendierung von Weltmeister Lionel Messi bei Paris Saint-Germain nicht äußern. Er sei zu Wochenbeginn von der Club-Führung über die Maßnahme informiert w… [+2397 chars],,de,'Lionel Messi'
https://www.n-tv.de/sport/fussball/Suspendierter-Messi-weiss-nicht-was-PSG-plant-article24102861.html,https://www.n-tv.de/sport/fussball/Suspendierter-Messi-weiss-nicht-was-PSG-plant-article24102861.html,0,www.n-tv.de,"Bosse überrumpeln den Trainer: Suspendierter Messi weiß nicht, was PSG plant","Weltmeister Lionel Messi hat seine von Paris St. Germain nicht genehmigte Reise nach Saudi-Arabien mit einem Missverständnis begründet. ""Ich dachte, wir hätten wie immer einen freien Tag nach dem Spiel"". Wie ist für den 35-Jährigen bei PSG weitergeht? Für ein…",https://bilder1.n-tv.de/img/incoming/crop24098460/4741324647-cImg_16_9-w1200/Lionel-Messis-Tage-bei-Paris-Saint-Germain-scheinen-gezahlt-zu-sein.jpg,2023-05-05T18:00:46Z,https://web.archive.org/web/20230505221647/https://www.n-tv.de/sport/fussball/Suspendierter-Messi-weiss-nicht-was-PSG-plant-article24102861.html,"Weltmeister Lionel Messi hat seine von Paris St. Germain nicht genehmigte Reise nach Saudi-Arabien mit einem Missverständnis begründet. ""Ich dachte, wir hätten wie immer einen freien Tag nach dem Spi… [+2027 chars]",,de,'Lionel Messi'
https://www.kicker.de/im-video-messi-entschuldigt-sich-fuer-saudi-arabien-trip-950133/video,https://www.kicker.de/im-video-messi-entschuldigt-sich-fuer-saudi-arabien-trip-950133/video,0,www.kicker.de,Im Video: Messi entschuldigt sich für Saudi-Arabien-Trip,Video: In einem Social-Media-Statement hat sich Lionel Messi für seinen Trip nach Saudi-Arabien bei PSG und seinen Teamkollegen entschuldigt. Der Weltmeister war wegen der Reise vom Klub suspendiert worden.,"https://derivates.kicker.de/image/upload/w_640,h_360,c_fill,g_auto:subject/w_1200,q_auto/v1/2023/05/05/ed5c4fa8-34d3-468c-b70a-8abd22bfded0.jpeg",2023-05-05T18:51:52Z,,"Werbung und Tracking: Um dir relevante Inhalte und personalisierte Werbung anzubieten, setzen wir Cookies und andere Technologien ein. Damit messen wir, wie und womit du unsere Angebote nutzt. Diese … [+2186 chars]",,de,'Lionel Messi'
https://www.stern.de/gesellschaft/regional/niedersachsen-bremen/medienbericht--vw-chef-blume-will-vorstand-der-it-tochter-cariad-absetzen--33441724.html,https://www.stern.de/gesellschaft/regional/niedersachsen-bremen/medienbericht--vw-chef-blume-will-vorstand-der-it-tochter-cariad-absetzen--33441724.html,0,www.stern.de,Medienbericht: VW-Chef Blume will Vorstand der IT-Tochter Cariad absetzen,"Volkswagen-Konzernchef Oliver Blume will nach einem Bericht von ""Business Insider"" die komplette Führung der mit Problemen kämpfenden Software-Tochter Cariad absetzen. Die Top-Manager seien von Blume bereits über ihren bevorstehenden Rauswurf informiert worde…",https://image.stern.de/33441726/t/d0/v1/w1440/r1.7778/-/05--urnnewsmldpacom2009010123050599579034v2w800h600l1347t769r4131b2625jpeg---1eeb177e975595b4.jpg,2023-05-05T20:34:34Z,https://web.archive.org/web/20230505212335/https://www.stern.de/gesellschaft/regional/niedersachsen-bremen/medienbericht--vw-chef-blume-will-vorstand-der-it-tochter-cariad-absetzen--33441724.html,"Volkswagen-Konzernchef Oliver Blume will nach einem Bericht von ""Business Insider"" die komplette Führung der mit Problemen kämpfenden Software-Tochter Cariad absetzen. Die Top-Manager seien von Blume… [+2461 chars]",,de,'Herbert Diess'
https://www.n-tv.de/politik/11-15-Selenskyj-darf-in-Schweizer-Parlament-sprechen--article23143824.html,https://www.n-tv.de/politik/11-15-Selenskyj-darf-in-Schweizer-Parlament-sprechen--article23143824.html,0,www.n-tv.de,Ukraine-Krieg im Liveticker: +++ 11:15 Selenskyj darf in Schweizer Parlament sprechen +++,"Berlin, Washington, Br\u00fcssel - \u00fcberall. n-tv berichtet von allen wichtigen Schaupl\u00e4tzen der Innen- und Au\u00dfenpolitik.",https://bilder2.n-tv.de/img/incoming/crop23332537/9041326157-cImg_16_9-w1200/Liveticker1-grau-1-Kopie.jpg,2023-05-05T23:00:00Z,https://web.archive.org/web/20230506101004/https://www.n-tv.de/politik/11-15-Selenskyj-darf-in-Schweizer-Parlament-sprechen--article23143824.html,"Das Schweizer Parlament hat einem Antrag der ukrainischen Behörden zugestimmt, wonach der ukrainische Präsident Selenskyj vor dem Parlament sprechen soll. Das berichtet der ""Guardian"". Worüber Selens… [+10502 chars]",,de,'Selenskyj'
https://www.dw.com/de/ukraine-aktuell-spendenaktion-ein-millionen-erfolg/a-65534132,https://www.dw.com/de/ukraine-aktuell-spendenaktion-ein-millionen-erfolg/a-65534132,0,www.dw.com,Ukraine aktuell: Spendenaktion ein Millionen-Erfolg,"Die vor einem Jahr ins Leben gerufene Spendenplattform ""United24"" sammelt fast 300 Millionen Euro ein. Die EU gibt eine Milliarde Euro für Munition. Proteste gegen Anna Netrebko in Wiesbaden. Der Überblick. Das Wichtigste in Kürze


Präsident Selenskyj feiert…",https://static.dw.com/image/65534051_6.jpg,2023-05-06T02:09:00Z,https://web.archive.org/web/20230506075104/https://www.dw.com/de/ukraine-aktuell-spendenaktion-ein-millionen-erfolg/a-65534132,"Das Wichtigste in Kürze
<ul><li>Präsident Selenskyj feiert Erfolg von ""United24""</li><li>EU stellt eine Milliarde Euro für Munition bereit</li><li>Proteste gegen Auftritt der Opernsängerin Anna Netr… [+7364 chars]",,de,'Selenskyj'
https://www.stern.de/lifestyle/monarchie--gold-und-pomp--charles-und-camilla-werden-in-london-gekroent-33442104.html,https://www.stern.de/lifestyle/monarchie--gold-und-pomp--charles-und-camilla-werden-in-london-gekroent-33442104.html,0,www.stern.de,Monarchie: Gold und Pomp: Charles und Camilla werden in London gekrönt,Für Großbritannien ist es schon jetzt der Tag des Jahres: Die Krönung von König Charles III. formalisiert seine Amtsübernahme. Doch die Zeremonie mit jahrhundertealten Traditionen finden nicht alle gut.,https://image.stern.de/33442106/t/iW/v1/w1440/r1.7778/-/06--urnnewsmldpacom2009010123050699579625v3w800h600l583t356r1863b1209jpeg---892e2b5e346a81e1.jpg,2023-05-06T03:08:28Z,https://web.archive.org/web/20230506042505/https://www.stern.de/lifestyle/monarchie--gold-und-pomp--charles-und-camilla-werden-in-london-gekroent-33442104.html,Für Großbritannien ist es schon jetzt der Tag des Jahres: Die Krönung von König Charles III. formalisiert seine Amtsübernahme. Doch die Zeremonie mit jahrhundertealten Traditionen finden nicht alle g… [+4452 chars],,de,'König Charles III'
https://www.stern.de/kultur/vorschau--tv-tipps-am-samstag-33442142.html,https://www.stern.de/kultur/vorschau--tv-tipps-am-samstag-33442142.html,0,www.stern.de,Vorschau: TV-Tipps am Samstag,"20:15 Uhr, ZDF, Theresa Wolff: Der schönste Tag, Krimi
 Ein junger Mann (Rafael Gareisen) wird im Park an der Saale tot aufgefunden. Alles deutet auf einen Mord hin. Bei der Leichenschau fällt Theresa Wolff (Nina Gummich) auf, dass Patrick im Körper einer Fra…",https://image.stern.de/33442146/t/rb/v1/w1440/r1.7778/-/06--tv-tipps-am-samstag---16-9---spoton-article-1043587.jpg,2023-05-06T04:03:00Z,https://web.archive.org/web/20230506085935/https://www.stern.de/kultur/vorschau--tv-tipps-am-samstag-33442142.html,"20:15 Uhr, ZDF, Theresa Wolff: Der schönste Tag, Krimi
Ein junger Mann (Rafael Gareisen) wird im Park an der Saale tot aufgefunden. Alles deutet auf einen Mord hin. Bei der Leichenschau fällt Theres… [+2418 chars]",,de,'Nina Gummich'
https://www.stern.de/news/schaulustige-versammeln-sich-an-der-prozessionsroute-zur-kroenung-charles--iii--33442214.html,https://www.stern.de/news/schaulustige-versammeln-sich-an-der-prozessionsroute-zur-kroenung-charles--iii--33442214.html,0,www.stern.de,Schaulustige versammeln sich an der Prozessionsroute zur Krönung Charles' III.,"Warten auf den neuen König: In London haben sich Stunden vor der Krönung von Charles III. bereits etliche Schaulustige entlang der Straßen zwischen dem Buckingham-Palast und Westminster Abbey versammelt. Fernsehbilder zeigten am Samstagmorgen, dass sich berei…",https://image.stern.de/33442216/t/SN/v1/w1440/r1.7778/-/06--fans-der-britischen-koenigsfamilie-warten-auf-koenig-charles-iii---bde181052d522a1d.jpg,2023-05-06T05:41:41Z,,Warten auf den neuen König: In London haben sich Stunden vor der Krönung von Charles III. bereits etliche Schaulustige entlang der Straßen zwischen dem Buckingham-Palast und Westminster Abbey versamm… [+1702 chars],,de,'König Charles III'
https://www.nzz.ch/panorama/die-kroenung-von-charles-und-camilla-zum-ersten-mal-in-70-jahren-wird-wieder-gekroent-ld.1736038,https://www.nzz.ch/panorama/die-kroenung-von-charles-und-camilla-zum-ersten-mal-in-70-jahren-wird-wieder-gekroent-ld.1736038,0,www.nzz.ch,LIVE - Die Krönung von Charles III.: Die Royal-Fans strömen ins Londoner Stadtzentrum,Zum ersten Mal in 70 Jahren findet in der Westminster Abbey wieder eine Krönung statt. Charles' Zeremonie wird kürzer und schlichter als die der Vorgänger.,"https://img.nzz.ch/2023/05/06/e47f3588-f52c-485e-8fcc-21b214cd44ae.jpeg?width=1200&height=675&fit=bound&quality=75&auto=webp&crop=5500,3094,x0,y283&wmark=nzz",2023-05-06T06:08:12Z,https://web.archive.org/web/20230506173902/https://www.nzz.ch/panorama/die-kroenung-von-charles-und-camilla-zum-ersten-mal-in-70-jahren-wird-wieder-gekroent-ld.1736038,"Das Wichtigste in Kürze
<ul><li>Heute werden Charles und Camilla in der Westminster Abbey zu König und Königin gekrönt. Zum Porträt /Zum Quiz</li><li>Die Zeremonie startet um 12 Uhr, die Krönung von… [+3096 chars]",,de,'Emmanuel Macron'
https://www.dw.com/de/charles-iii-und-camilla-auf-dem-weg-zur-westminster-abbey/a-65534743,https://www.dw.com/de/charles-iii-und-camilla-auf-dem-weg-zur-westminster-abbey/a-65534743,0,www.dw.com,Charles III. und Camilla auf dem Weg zur Westminster Abbey,Am Mittag werden dem britischen Monarchen und seiner Gemahlin Camilla in der Westminster Abbey die Kronen auf die Häupter gesetzt. Dann hat der 74-jährige Charles auch symbolisch das Königsamt übernommen. Die Kutsche mit König Charles III. und Königin Camilla…,https://static.dw.com/image/65536358_6.jpg,2023-05-06T06:44:00Z,,"Die Kutsche mit König Charles III. und Königin Camilla ist vom Buckingham-Palast zur Westminster Abbey aufgebrochen. Dazu wurde eine Kurzfassung der Nationalhymne ""God Save The King"" gespielt. Das Pa… [+9924 chars]",,de,'König Charles III'
https://www.handelsblatt.com/arts_und_style/literatur/rezension-schluss-mit-wunschdenken-gauck-rechnet-mit-merkels-russlandpolitik-ab/29129606.html,https://www.handelsblatt.com/arts_und_style/literatur/rezension-schluss-mit-wunschdenken-gauck-rechnet-mit-merkels-russlandpolitik-ab/29129606.html,0,www.handelsblatt.com,Rezension: Schluss mit Wunschdenken: Gauck rechnet mit Merkels Russlandpolitik ab,Der ehemalige Bundespräsident sieht durch die deutsche Putin-Politik die gesamte Demokratie geschwächt. Er fordert mehr Entschlossenheit und Realismus in der Außenpolitik.,https://www.handelsblatt.com/images/joachim-gauck-und-angela-merkel/29132220/2-format2003.jpg,2023-05-06T07:30:00Z,https://web.archive.org/web/20230506101402/https://www.handelsblatt.com/arts_und_style/literatur/rezension-schluss-mit-wunschdenken-gauck-rechnet-mit-merkels-russlandpolitik-ab/29129606.html,"Hinterher ist man immer schlauer, heißt es leicht spöttisch. Andererseits: Zum Verstehen von Geschichte ist es nie zu spät. Und: Sind Lektionen nicht mit etwas zeitlichem Abstand am besten zu lernen?… [+9505 chars]",,de,'Putin'
https://consent.google.com/ml?continue=https://news.google.com/rss/articles/CBMiiwFodHRwczovL3d3dy5ldXJvc3BvcnQuZGUvZnVzc2JhbGwvbGlndWUtMS8yMDIyLTIwMjMvbGlvbmVsLW1lc3NpLXZvci1hYmdhbmctYXVzLXBhcmlzLXBzZy1iYXJjYS1hbC1oaWxhbC1pbnRlci1taWFtaV9zdG85NTkxMzQwL3N0b3J5LnNodG1s0gGPAWh0dHBzOi8vd3d3LmV1cm9zcG9ydC5kZS9mdXNzYmFsbC9saWd1ZS0xLzIwMjItMjAyMy9saW9uZWwtbWVzc2ktdm9yLWFiZ2FuZy1hdXMtcGFyaXMtcHNnLWJhcmNhLWFsLWhpbGFsLWludGVyLW1pYW1pX3N0bzk1OTEzNDAvc3RvcnktYW1wLnNodG1s?oc%3D5&gl=FR&hl=en-US&cm=2&pc=n&src=1,https://consent.google.com/ml?continue=https://news.google.com/rss/articles/CBMiiwFodHRwczovL3d3dy5ldXJvc3BvcnQuZGUvZnVzc2JhbGwvbGlndWUtMS8yMDIyLTIwMjMvbGlvbmVsLW1lc3NpLXZvci1hYmdhbmctYXVzLXBhcmlzLXBzZy1iYXJjYS1hbC1oaWxhbC1pbnRlci1taWFtaV9zdG85NTkxMzQwL3N0b3J5LnNodG1s0gGPAWh0dHBzOi8vd3d3LmV1cm9zcG9ydC5kZS9mdXNzYmFsbC9saWd1ZS0xLzIwMjItMjAyMy9saW9uZWwtbWVzc2ktdm9yLWFiZ2FuZy1hdXMtcGFyaXMtcHNnLWJhcmNhLWFsLWhpbGFsLWludGVyLW1pYW1pX3N0bzk1OTEzNDAvc3RvcnktYW1wLnNodG1s?oc%3D5&gl=FR&hl=en-US&cm=2&pc=n&src=1,0,consent.google.com,Lionel Messi vor Abgang aus Paris: Diese Optionen bleiben dem argentinischen Superstar - Eurosport DE,"<ol><li>Lionel Messi vor Abgang aus Paris: Diese Optionen bleiben dem argentinischen Superstar  Eurosport DE
</li><li>PARIS-SAINT-GERMAIN: Haut Lionel Messi ab? Darum positionieren sich nun auch Fans gegen den Weltstar  WELT Nachrichtensender
</li><li>Verär…",,2023-05-06T07:35:00Z,,"We use cookies and data to<ul><li>Deliver and maintain Google services</li><li>Track outages and protect against spam, fraud, and abuse</li><li>Measure audience engagement and site statistics to unde… [+1131 chars]",,de,'Lionel Messi'
https://www.wiwo.de/politik/ausland/britische-koenigsfamilie-kroenung-von-koenig-charles-iii-was-kostet-die-monarchie-/28679844.html,https://www.wiwo.de/politik/ausland/britische-koenigsfamilie-kroenung-von-koenig-charles-iii-was-kostet-die-monarchie-/28679844.html,0,www.wiwo.de,Britische Königsfamilie: Krönung von König Charles III. – was kostet die Monarchie?,Am heutigen Samstag wird König Charles III. gekrönt. Die britischen Royals stehen im Fokus der Öffentlichkeit. Die privaten Vermögensverhältnisse werden aber verborgen. Anders ist es bei dem Besitz der Krone.,https://www.wiwo.de/images/230558959-ap/29136184/2-format11240.jpg,2023-05-06T07:37:36Z,http://archive.md/20230506092411/https://www.wiwo.de/politik/ausland/britische-koenigsfamilie-kroenung-von-koenig-charles-iii-was-kostet-die-monarchie-/28679844.html,Die Krönung von König Charles III. und Queen Camilla am Samstag ist eigentlich nur eine Formsache. Mit dem Tod von Königin Elisabeth II. im vergangenen September hat Charles den Thron bereits automat… [+4095 chars],,de,'Charles III'
https://www.welt.de/vermischtes/prominente/article245172522/Charles-Kroenung-Charles-und-Camilla-vor-Kroenung-am-Buckingham-Palast-eingetroffen.html,https://www.welt.de/vermischtes/prominente/article245172522/Charles-Kroenung-Charles-und-Camilla-vor-Kroenung-am-Buckingham-Palast-eingetroffen.html,0,www.welt.de,Charles und Camilla vor Krönung am Buckingham-Palast eingetroffen,Die Krönung von König Charles III. und Queen Camilla folgt einem genauen Zeitplan. Dabei spielen die beiden umstrittenen Prinzen Harry und Andrew nur eine untergeordnete Rolle. Kurz vor Beginn der Prozession kam es zu Festnahmen. Mehr dazu im Liveticker.,https://img.welt.de/img/vermischtes/prominente/mobile245195494/2301351017-ci16x9-w1200/Britain-Coronation.jpg,2023-05-06T07:47:00Z,http://archive.md/20230506090125/https://www.welt.de/vermischtes/prominente/article245172522/Charles-Kroenung-Charles-und-Camilla-vor-Kroenung-am-Buckingham-Palast-eingetroffen.html,"Der britische König Charles III. und seine Frau Camilla sind vor ihrer Krönung mit einer Autokolonne am Buckingham-Palast eingetroffen. Beim Vorbeifahren brach lauter Jubel unter Menschen aus, die ei… [+14682 chars]",,de,'Prinz Andrew'
https://www.welt.de/vermischtes/prominente/article245172522/Charles-Kroenung-Monarchie-Gegner-bei-Protest-gegen-Kroenung-festgenommen.html,https://www.welt.de/vermischtes/prominente/article245172522/Charles-Kroenung-Monarchie-Gegner-bei-Protest-gegen-Kroenung-festgenommen.html,0,www.welt.de,Mehrere Monarchie-Gegner laut Aktivsten bei Protest gegen Krönung festgenommen,Die Krönung von König Charles III. und Queen Camilla folgt einem genauen Zeitplan. Dabei spielen die beiden umstrittenen Prinzen Harry und Andrew nur eine untergeordnete Rolle. Kurz vor Beginn der Prozession kam es zu Festnahemn. Mehr dazu im Liveticker.,https://img.welt.de/img/vermischtes/prominente/mobile245194996/1371351177-ci16x9-w1200/775973295.jpg,2023-05-06T07:47:00Z,https://web.archive.org/web/20230506082024/https://www.welt.de/vermischtes/prominente/article245172522/Charles-Kroenung-Monarchie-Gegner-bei-Protest-gegen-Kroenung-festgenommen.html,"Bei Protesten gegen die Krönung von König Charles III. sind nach Angaben von Aktivisten sechs Menschen festgenommen worden. Darunter sei auch der Chef der Organisation Republic, Graham Smith, sagte d… [+14519 chars]",,de,'Charles III'
https://www.faz.net/aktuell/wirtschaft/unternehmen/vw-will-die-fuehrung-seiner-software-sparte-cariad-abberufen-18873614.html,https://www.faz.net/aktuell/wirtschaft/unternehmen/vw-will-die-fuehrung-seiner-software-sparte-cariad-abberufen-18873614.html,0,www.faz.net,VW will Führung der Software-Sparte rauswerfen,Ein paar Monate lang war es ruhig um die krisengebeutelte Einheit Cariad. Doch jetzt plant Konzernchef Oliver Blume offenbar einen harten Schnitt – und löst damit ein Beben aus.,https://media0.faz.net/ppmedia/aktuell/wirtschaft/3413855216/1.8873616/facebook_teaser/harter-durchgriff-vw-chef.jpg,2023-05-06T08:32:28Z,http://archive.md/20230506093223/https://www.faz.net/aktuell/wirtschaft/unternehmen/vw-will-die-fuehrung-seiner-software-sparte-cariad-abberufen-18873614.html,"Vor zwei Wochen stand er noch in Schanghai auf der Bühne, um vor Besuchern der größten Automesse der Welt über Software-Entwicklung für den chinesischen Markt zu reden. Aber jetzt ist ist klar: Die T… [+5359 chars]",,de,'Oliver Blume'
https://www.handelsblatt.com/politik/international/london-so-laeuft-die-kroenung-von-charles-iii-und-camilla-ab/29136200.html,https://www.handelsblatt.com/politik/international/london-so-laeuft-die-kroenung-von-charles-iii-und-camilla-ab/29136200.html,0,www.handelsblatt.com,London: So läuft die Krönung von Charles III. und Camilla ab,"Die Krönungszeremonie ist das Ereignis des Jahres im Vereinigten Königreich. Zehntausende eilen in die Londoner Innenstadt, um dabei zu sein. Der Überblick.",https://www.handelsblatt.com/images/kroenung-von-koenig-charles-iii-/29136358/2-format2003.jpg,2023-05-06T09:00:00Z,,"Krönung von König Charles III.König Charles III. erhält die Edwardskrone während der Krönungszeremonie in der Westminster Abbey. 
(Foto: dpa)
London Charles III. und Camilla sind zum britischen Kön… [+6319 chars]",,de,'Charles III'
