index,url,valid,domain,title,description,image,published,archive,content,quote,language,keyword
https://www.welt.de/politik/ausland/article246759322/Donald-Trump-Drohung-nach-Gerichtstermin-bringt-neuen-juristischen-Aerger.html,https://www.welt.de/politik/ausland/article246759322/Donald-Trump-Drohung-nach-Gerichtstermin-bringt-neuen-juristischen-Aerger.html,0,www.welt.de,Trump-Drohung nach Gerichtstermin bringt neuen juristischen Ärger,"Vor Gericht steht Ex-US-Präsident Donald Trump wegen des Nachgangs seiner Wahlniederlage. Einen Post im Anschluss an den ersten Gerichtstermin wertet Sonderermittler Jack Smith als Hinweis, der 77-Jährige könne Beweismaterial nutzen, um Zeugen einzuschüchtern…",https://img.welt.de/img/bildergalerien/mobile246759234/5381356327-ci16x9-w1200/TOPSHOT-US-POLITICS-VOTE-TRUMP.jpg,2023-08-05T15:36:46Z,,"Nach seinem Gerichtstermin in Washington hat eine Äußerung in sozialen Medien dem früheren US-Präsidenten Donald Trump neuen juristischen Ärger eingebracht. Wenn ihr mich verfolgt, dann werde ich euc… [+1914 chars]",,de,'Jack Smith'
https://www.focus.de/politik/ausland/ich-werde-euch-verfolgen-trump-drohung-nach-gerichtstermin-sorgt-erneut-fuer-juristischen-aerger_id_201014954.html,https://www.focus.de/politik/ausland/ich-werde-euch-verfolgen-trump-drohung-nach-gerichtstermin-sorgt-erneut-fuer-juristischen-aerger_id_201014954.html,0,www.focus.de,„Ich werde euch verfolgen“ - Trump-Drohung nach Gerichtstermin sorgt erneut für juristischen Ärger,"„Wenn ihr mich verfolgt, werde ich euch verfolgen“, schrieb der ehemalige US-Präsident Donald Trump nach seinem Gerichtstermin in Washington in den sozialen Medien. Das wird nun als Drohung gegen Zeugen, Richter und Anwälte gewertet und führt zu juristischem …",https://p6.focus.de/img/fotos/id_201014953/donald-trump-sorgt-erneut-fuer-juristischen-aerger.jpg?im=Crop%3D%280%2C188%2C3464%2C1732%29%3BResize%3D%281200%2C627%29&impolicy=perceptual&quality=mediumHigh&hash=577677a55e7a43b6ca2fc8a8f6a987ffcb72945b4f3208b84c3f25ab7b9523f6,2023-08-05T16:55:27Z,,"Wenn ihr mich verfolgt, werde ich euch verfolgen, schrieb der ehemalige US-Präsident Donald Trump nach seinem Gerichtstermin in Washington in den sozialen Medien. Das wird nun als Drohung gegen Zeuge… [+2402 chars]",,de,'Donald Trump'
https://www.stern.de/politik/ausland/usa--trump-aeusserung-nach-gerichtstermin-hat-konsequenzen-33712752.html,https://www.stern.de/politik/ausland/usa--trump-aeusserung-nach-gerichtstermin-hat-konsequenzen-33712752.html,0,www.stern.de,USA: Trump-Äußerung nach Gerichtstermin hat Konsequenzen,Donald Trump wertet auch die neue Anklage gegen sich als politische Hexenjagd und stößt Drohungen aus. Das hat ein Nachspiel: Sonderermittler Smith sorgt sich um den Umgang mit vertraulichen Informationen.,https://image.stern.de/33712754/t/O8/v1/w1440/r1.7778/-/05--urnnewsmldpacom2009010123080599721661v3w800h600l629t10r1683b921jpeg---85d5694538e75b52.jpg,2023-08-05T17:09:42Z,,Donald Trump wertet auch die neue Anklage gegen sich als politische Hexenjagd und stößt Drohungen aus. Das hat ein Nachspiel: Sonderermittler Smith sorgt sich um den Umgang mit vertraulichen Informat… [+2288 chars],,de,'Jack Smith'
https://www.morgenpost.de/politik/ausland/article239129857/Trump-Aeusserung-nach-Gerichtstermin-hat-Konsequenzen.html,https://www.morgenpost.de/politik/ausland/article239129857/Trump-Aeusserung-nach-Gerichtstermin-hat-Konsequenzen.html,0,www.morgenpost.de,USA: Trump-Äußerung nach Gerichtstermin hat Konsequenzen,Donald Trump wertet auch die neue Anklage gegen sich als politische Hexenjagd und stößt Drohungen aus. Das hat ein Nachspiel: Sonderermittler Smith sorgt sich um den Umgang mit vertraulichen Informationen.,https://img.morgenpost.de/img/ausland/crop239129855/8752604863-w820-cv16_9-q85/Donald-Trump.jpg,2023-08-05T17:09:42Z,,"Washington. Nach seinem Gerichtstermin in Washington hat eine Äußerung in sozialen Medien dem früheren US-Präsidenten Donald Trump neuen juristischen Ärger eingebracht. Wenn ihr mich verfolgt, dann w… [+2205 chars]",,de,'Jack Smith'
https://www.dw.com/de/aussage-nach-anklage-hat-f%C3%BCr-trump-juristisches-nachspiel/a-66450088,https://www.dw.com/de/aussage-nach-anklage-hat-f%C3%BCr-trump-juristisches-nachspiel/a-66450088,0,www.dw.com,Aussage nach Anklage hat für Trump juristisches Nachspiel,Donald Trump hat erneut Ärger am Hals. Nach seinem Gerichtstermin in Washington droht dem früheren US-Präsidenten wegen einer Äußerung in den sozialen Medien ein juristisches Nachspiel.,https://static.dw.com/image/66447243_6.jpg,2023-08-05T17:58:00Z,,"Nach seinem jüngsten Gerichtstermin in Washington hat sich der frühere US-Präsident Donald Trump mit einer Erklärung in sozialen Medien neuen Ärger mit der Justiz eingehandelt. ""Wenn ihr mich verfolg… [+2532 chars]",,de,'Donald Trump'
https://www.morgenpost.de/politik/article239115449/trump-rechtfertigungsdruck-gericht.html,https://www.morgenpost.de/politik/article239115449/trump-rechtfertigungsdruck-gericht.html,0,www.morgenpost.de,Prozess : Gericht irritiert: Redet sich Trump um Kopf und Kragen?,Will Donald Trump die Zeugen im Prozess gegen ihn unter Druck setzen? Eine Äußerung erweckt diesen Eindruck. Warum ein Nachspiel droht.,https://img.morgenpost.de/img/frontpage/crop239115443/5532605671-w820-cv16_9-q85/5FAE0800EBB2399B.jpg,2023-08-05T18:20:08Z,,Washington. Dem früheren US-Präsidenten Donald Trump droht neuer Ärger. Nach seinem Gerichtstermin in Washington hat er sich um Kopf und Kragen geredet. Eine Äußerung in den sozialen Medien hat ihm p… [+2081 chars],,de,'Donald Trump'
https://www.sueddeutsche.de/politik/usa-trump-aeusserung-mit-juristischem-nachspiel-usa-1.6100195,https://www.sueddeutsche.de/politik/usa-trump-aeusserung-mit-juristischem-nachspiel-usa-1.6100195,0,www.sueddeutsche.de,USA: Trump-Äußerung mit juristischem Nachspiel,"""Wenn ihr mich verfolgt, dann werde ich euch verfolgen."" Nach seinem Gerichtstermin bringt dieser Satz Donald Trump neuen juristischen Ärger.",https://www.sueddeutsche.de/image/sz.1.6100196/1200x675?v=1691262945,2023-08-05T19:15:55Z,,"""Wenn ihr mich verfolgt, dann werde ich euch verfolgen."" Nach seinem Gerichtstermin bringt dieser Satz Donald Trump neuen juristischen Ärger. Nach seinem Gerichtstermin in Washington hat eine Äußerun… [+2195 chars]",,de,'Jack Smith'
https://www.tagesschau.de/inland/innenpolitik/soeder-bayern-114.html,https://www.tagesschau.de/inland/innenpolitik/soeder-bayern-114.html,0,www.tagesschau.de,CSU-Chef Söder: Alles oder nichts,Mehrfach hat sich Bayerns Ministerpräsident schon politisch neu erfunden. In diesem Wahlkampf erlebt man einen bürgerlich-konservativen Markus Söder. Für ihn steht viel auf dem Spiel - in Bayern aber auch in Berlin. Von Petr Jerabek.,https://images.tagesschau.de/image/fab57565-9331-4208-895d-64e55b4de042/AAABicCF2a4/AAABibBxqrQ/16x9-1280/soeder-680.jpg,2023-08-06T03:10:26Z,,"Stand: 06.08.2023 05:10 Uhr
Mehrfach hat sich Bayerns Ministerpräsident schon politisch neu erfunden. In diesem Wahlkampf erlebt man einen bürgerlich-konservativen Markus Söder. Für ihn steht viel a… [+5755 chars]",,de,'Hubert Aiwanger'
https://www.sueddeutsche.de/medien/roberto-saviano-mafia-tv-sendung-insider-italien-meloni-kommentar-1.6102083,https://www.sueddeutsche.de/medien/roberto-saviano-mafia-tv-sendung-insider-italien-meloni-kommentar-1.6102083,0,www.sueddeutsche.de,"Italien: Der Mafia-Erklärer, der aus dem Fernsehen gedrängt wird",Roberto Saviano ist der prominenteste Anti-Mafia-Autor des Landes. Nicht nur die Unterwelt will ihm Böses. Auch die rechte Regierung von Giorgia Meloni bootet ihn aus.,https://www.sueddeutsche.de/image/sz.1.6102084/1200x675?v=1691323719,2023-08-06T12:08:49Z,https://web.archive.org/web/20230806221142/https://www.sueddeutsche.de/medien/roberto-saviano-mafia-tv-sendung-insider-italien-meloni-kommentar-1.6102083,Roberto Saviano ist der prominenteste Anti-Mafia-Autor des Landes. Nicht nur die Unterwelt will ihm Böses. Auch die rechte Regierung von Giorgia Meloni bootet ihn aus. Er hatte mit allen seine Zweikä… [+528 chars],,de,'Matteo Salvini'
https://www.n-tv.de/politik/Soeder-ist-flexibel-sicher-auch-bei-der-Kanzlerkandidatur-article24305843.html,https://www.n-tv.de/politik/Soeder-ist-flexibel-sicher-auch-bei-der-Kanzlerkandidatur-article24305843.html,0,www.n-tv.de,"Bayern vor der Wahl: ""Söder ist flexibel - sicher auch bei der Kanzlerkandidatur""","Zwar wird der neue Landtag in Bayern erst am 8. Oktober gewählt, aber der Wahlkampf im Freistaat hat längst angefangen. Dass die CSU vorn liegen wird, ist klar. Aber warum? Und versucht Markus Söder nach einem Wahlsieg noch einmal, Kanzlerkandidat der Union z…",https://bilder2.n-tv.de/img/incoming/crop24305861/8541327596-cImg_16_9-w1200/418028389.jpg,2023-08-06T12:18:24Z,,"Zwar wird der neue Landtag in Bayern erst am 8. Oktober gewählt, aber der Wahlkampf im Freistaat hat längst angefangen. Dass die CSU vorn liegen wird, ist klar. Aber warum? Und versucht Markus Söder … [+6388 chars]",,de,'Markus Söder'
https://www.stern.de/politik/ausland/donald-trump-prozess--us-staatsanwaltschaft-beantragt-schutzanordnung-33713878.html,https://www.stern.de/politik/ausland/donald-trump-prozess--us-staatsanwaltschaft-beantragt-schutzanordnung-33713878.html,0,www.stern.de,USA: Drohung gegen Zeugen und Anwälte: Staatsanwaltschaft beantragt Schutzanordnung gegen Donald Trump,"Ein Social Media-Post von Donald Trump im Anschluss an seinen Gerichtstermin hat juristische Konsequenzen. Sonderermittler Jack Smith wirft ihm vor, Zeugen, Richter und Anwälte bedroht zu haben.",https://image.stern.de/33713880/t/mG/v1/w1440/r1.7778/-/usa-donald-trump-staatsanwaltschaft.jpg,2023-08-06T12:47:00Z,,"Ein Social Media-Post von Donald Trump im Anschluss an seinen Gerichtstermin hat juristische Konsequenzen. Sonderermittler Jack Smith wirft ihm vor, Zeugen, Richter und Anwälte bedroht zu haben.
Im … [+3913 chars]",,de,'Donald Trump'
https://www.tagesspiegel.de/internationales/der-kleine-mike-pence-so-bringt-donald-trump-sich-selbst-in-bedrangnis-10271260.html,https://www.tagesspiegel.de/internationales/der-kleine-mike-pence-so-bringt-donald-trump-sich-selbst-in-bedrangnis-10271260.html,0,www.tagesspiegel.de,„Der kleine Mike Pence“: So bringt Donald Trump sich selbst in Bedrängnis,Eine Äußerung nach dem Prozessauftakt in der vergangenen Woche könnte dem ehemaligen Präsidenten juristische Probleme bereiten. Auch seinen ehemaligen Vize-Präsidenten attackierte Trump.,https://www.tagesspiegel.de/images/trump-speaks-at-republican-fundraiser-in-columbia/alternates/BASE_16_9_W1400/trump-speaks-at-republican-fundraiser-in-columbia.jpeg,2023-08-06T14:17:59Z,,"Es war der Auftakt zu einem Prozess, der Donald Trump in große Bedrängnis bringen könnte. In der vergangenen Woche musste er in der amerikanischen Hauptstadt Washington D.C. vor Gericht erscheinen, e… [+4311 chars]",,de,'Mike Pence'
https://www.stern.de/kultur/film/neu-im-kino--die-filmstarts-der-woche--33715150.html,https://www.stern.de/kultur/film/neu-im-kino--die-filmstarts-der-woche--33715150.html,0,www.stern.de,Neu im Kino: Die Filmstarts der Woche,"Während Ben Affleck als Polizist seine entführte Tochter sucht, geht auch die Geschichte rund um den Dorfpolizisten Eberhofer weiter. Außerdem kommt die Videospiel-Reihe ""Gran Turismo"" auf die große Leinwand.",https://image.stern.de/33715152/t/Yw/v1/w1440/r1.7778/-/07--urnnewsmldpacom2009010123080499698400v3w800h600l1642t101r3657b2042jpeg---01fc32c434a7e88c.jpg,2023-08-07T07:31:51Z,https://web.archive.org/web/20230807081911/https://www.stern.de/kultur/film/neu-im-kino--die-filmstarts-der-woche--33715150.html,"Während Ben Affleck als Polizist seine entführte Tochter sucht, geht auch die Geschichte rund um den Dorfpolizisten Eberhofer weiter. Außerdem kommt die Videospiel-Reihe ""Gran Turismo"" auf die große … [+1959 chars]",,de,'Ben Affleck'
https://www.bild.de/unterhaltung/leute/leute/jennifer-lopez-war-nicht-dabei-ben-affleck-herzt-kids-und-ex-84942272.bild.html,https://www.bild.de/unterhaltung/leute/leute/jennifer-lopez-war-nicht-dabei-ben-affleck-herzt-kids-und-ex-84942272.bild.html,0,www.bild.de,Affleck herzt Kids und Ex - Dreamteam trotz Trennung,Mit den Jennifers läuft es in seinem Leben einfach rosig ... Ben besucht Jen in Italien.Foto: Ugpix,"https://images.bild.de/64ce4eb632d1920600d33ad6/deaa1a64778fc45ef3041c3f06b43cbf,c4f614b?w=1280",2023-08-07T07:43:55Z,,"Mit den Jennifers läuft es in seinem Leben einfach rosig.
Ben Affleck (50) erlebt einen super Sommer: Erst vor zwei Wochen feierte er seinen ersten Hochzeitstag mit Ehefrau Jennifer Lopez (54). Auch… [+1735 chars]",,de,'Ben Affleck'
https://www.morgenpost.de/kultur/article239127717/kino-neuer-film-ben-affleck-robert-rodriguez-hypnotic-psycho-thriller.html,https://www.morgenpost.de/kultur/article239127717/kino-neuer-film-ben-affleck-robert-rodriguez-hypnotic-psycho-thriller.html,0,www.morgenpost.de,Neu im Kino: „Hypnotic“ mit Ben Affleck: Glauben Sie gar nichts,„Hypnotic“ ist fast so was wie ein Comeback für Regisseur Robert Rodriguez. Darin setzt er seinen Star einem irren Verwirrspiel aus.,https://img.morgenpost.de/img/kultur/crop239127715/4372609896-w820-cv16_9-q85/fcaf6580-34f3-11ee-ab61-bf09e49b3aa9.jpg,2023-08-07T10:59:03Z,,"Berlin.  Glauben Sie nichts. Glauben Sie gar nichts, was Sie hier sehen. Denn Sie werden an der Nase herumgeführt. Wie auch die Hauptfigur im Film Hypnotic, der am 10. August ins Kino kommt. Gleich a… [+6281 chars]",,de,'Ben Affleck'
https://www.kino-zeit.de/news-features/empfehlungen-tv-tipps/die-tv-tipps-fuer-sonntag-den-20-08-2023,https://www.kino-zeit.de/news-features/empfehlungen-tv-tipps/die-tv-tipps-fuer-sonntag-den-20-08-2023,0,www.kino-zeit.de,"Die TV-Tipps für Sonntag, den 20.08.2023","Am goldenen See von Mark Rydell, mit Katharine Hepburn, Henry Fonda und Jane Fonda, 20:15 Uhr auf Arte


	Die Theaterstückverfilmung aus dem Jahre...",,2023-08-07T12:13:36Z,https://web.archive.org/web/20230807153532/https://www.kino-zeit.de/news-features/empfehlungen-tv-tipps/die-tv-tipps-fuer-sonntag-den-20-08-2023,"Am goldenen See von Mark Rydell, mit Katharine Hepburn, Henry Fonda und Jane Fonda, 20:15 Uhr auf Arte
<ul><li>Die Theaterstückverfilmung aus dem Jahre 1981 erhielt drei Oscars: für das Drehbuch von… [+787 chars]",,de,'Jane Fonda'
https://www.sueddeutsche.de/politik/italien-neofaschistischer-terror-bombenanschlag-von-bologna-giorgia-meloni-1.6105780,https://www.sueddeutsche.de/politik/italien-neofaschistischer-terror-bombenanschlag-von-bologna-giorgia-meloni-1.6105780,0,www.sueddeutsche.de,Italien: Und Meloni schweigt,Anlässlich des Gedenkens an den Bombenanschlag von Bologna diskutiert Italien die Frage: Warum distanziert sich die Ministerpräsidentin nicht ganz klar vom neofaschistischen Terror?,https://www.sueddeutsche.de/image/sz.1.6105782/1200x675?v=1691422887,2023-08-07T15:41:34Z,,Anlässlich des Gedenkens an den Bombenanschlag von Bologna diskutiert Italien die Frage: Warum distanziert sich die Ministerpräsidentin nicht ganz klar vom neofaschistischen Terror?Am Montag tagte da… [+5447 chars],,de,'Sergio Mattarella'
https://www.stern.de/kultur/film/neu-im-kino---hypnotic---ben-affleck-zwischen-illusion-und-wirklichkeit-33717922.html,https://www.stern.de/kultur/film/neu-im-kino---hypnotic---ben-affleck-zwischen-illusion-und-wirklichkeit-33717922.html,0,www.stern.de,"Neu im Kino: ""Hypnotic"": Ben Affleck zwischen Illusion und Wirklichkeit","Für seinen neuen Film konnte Regisseur Robert Rodriguez (""Sin City"") Ben Affleck gewinnen. Der Actionthriller steckt voller Überraschungen und Wendungen.",https://image.stern.de/33715152/t/Ie/v3/w1440/r1.7778/-/08--urnnewsmldpacom2009010123080499698400v3w800h600l1642t101r3657b2042jpeg---01fc32c434a7e88c.jpg,2023-08-08T07:34:43Z,,"Für seinen neuen Film konnte Regisseur Robert Rodriguez (""Sin City"") Ben Affleck gewinnen. Der Actionthriller steckt voller Überraschungen und Wendungen.
Der starbesetzte Actionthriller ""Hypnotic"" i… [+3187 chars]",,de,'Ben Affleck'
https://www.nzz.ch/international/italien-und-der-faschismus-der-anschlag-von-bologna-wuehlt-melonis-regierung-auf-ld.1750439,https://www.nzz.ch/international/italien-und-der-faschismus-der-anschlag-von-bologna-wuehlt-melonis-regierung-auf-ld.1750439,0,www.nzz.ch,Italien: Ein Faschismus-Nostalgiker bringt Giorgia Meloni erneut in Verlegenheit,Die Erinnerung an das Attentat von Bologna von 1980 wühlt Italien auf. Eine Debatte über die neofaschistische Urheberschaft zeigt die Probleme der Regierungschefin mit der Vergangenheitsbewältigung.,"https://img.nzz.ch/2023/08/08/5aea55bf-6cfe-46c3-9995-c67851d68d58.jpeg?width=1200&height=674&fit=bound&quality=75&auto=webp&crop=3970,2230,x627,y1265&wmark=nzz",2023-08-08T09:45:00Z,https://web.archive.org/web/20230809202711/https://www.nzz.ch/international/italien-und-der-faschismus-der-anschlag-von-bologna-wuehlt-melonis-regierung-auf-ld.1750439,"Tag des Grauens: das Attentat vom 2. August 1980 im Bahnhof Bologna. 
Er mag schon lange zurückliegen, dieser 2. August 1980. Es war einer der Haupt-Reisetage vor den grossen Ferien, als im Bahnhof … [+5243 chars]",,de,'Giorgia Meloni'
https://www.focus.de/politik/experten/gastbeitrag-von-gabor-steingart-sieben-handfeste-gruende-warum-die-trump-masche-bei-uns-nicht-zieht_id_201329973.html,https://www.focus.de/politik/experten/gastbeitrag-von-gabor-steingart-sieben-handfeste-gruende-warum-die-trump-masche-bei-uns-nicht-zieht_id_201329973.html,0,www.focus.de,"Gastbeitrag von Gabor Steingart - AfD als Begleitmusik - 7 Gründe, warum die Trump-Masche bei uns nicht zieht","Der Rechtspopulismus, der wie Jeans, Coca-Cola und McDonald’s aus den USA nach Deutschland kam, besitzt hierzulande zwar ein Erregungspotenzial, aber keine Machtperspektive. Sieben Gründe, warum das so ist.Von Gastautor Gabor Steingart (Berlin)",https://p6.focus.de/img/fotos/id_201329974/stg9.jpg?im=Crop%3D%280%2C139%2C780%2C389%29%3BResize%3D%281200%2C627%29&impolicy=perceptual&quality=mediumHigh&hash=ee1afe8bbafeeccba889a19de6a6963272f0b61f0cd9317589446c7394cf3712,2023-08-09T05:41:32Z,https://web.archive.org/web/20230810101733/https://www.focus.de/politik/experten/gastbeitrag-von-gabor-steingart-sieben-handfeste-gruende-warum-die-trump-masche-bei-uns-nicht-zieht_id_201329973.html,"Der Rechtspopulismus, der wie Jeans, Coca-Cola und McDonalds aus den USA nach Deutschland kam, besitzt hierzulande zwar ein Erregungspotenzial, aber keine Machtperspektive. Sieben Gründe, warum das s… [+6686 chars]",,de,'Donald Trump'
https://www.focus.de/kultur/stars/todesursache-von-robert-de-niros-enkel-offiziell-bekannt_id_201344926.html,https://www.focus.de/kultur/stars/todesursache-von-robert-de-niros-enkel-offiziell-bekannt_id_201344926.html,0,www.focus.de,Mit 19 Jahren verstorben - Todesursache von Robert De Niros Enkel offiziell bekannt,Leandro De Niro wurde gerade einmal 19 Jahre alt. Nun wurde seine Todesursache offiziell bekannt gegeben.,https://p6.focus.de/img/fotos/id_201346962/robert-de-niro.jpg?im=Crop%3D%280%2C94%2C3463%2C1732%29%3BResize%3D%281200%2C627%29&impolicy=perceptual&quality=mediumHigh&hash=483ad2a3e1bca064ff09fbf25eb90ccd90969868941e188c680c0911a03b5f23,2023-08-09T10:06:56Z,,Erst im Juli ist Leandro De Niro vollkommen überraschend verstorben. Der Enkelsohn von Hollywoodstar Robert De Niro wurde nur 19 Jahre alt. Roberts Tochter und Leandros Mutter Drena De Niro hatte von… [+1893 chars],,de,'Leandro De Niro Rodriguez'
https://www.n-tv.de/politik/Lauterbach-fordert-Aufholjagd-bei-Digitalisierung-article24315223.html,https://www.n-tv.de/politik/Lauterbach-fordert-Aufholjagd-bei-Digitalisierung-article24315223.html,0,www.n-tv.de,"Gesundheitswesen hinkt hinterher: Lauterbach fordert ""Aufholjagd"" bei Digitalisierung","In der Medizin ist Deutschland eigentlich ein Vorreiter. Das gilt jedoch nicht für die Digitalisierung, auch nach dem Start des elektronischen Rezepts hinkt die Bundesrepublik noch immer zurück. Gesundheitsminister Karl Lauterbach macht Druck.",https://bilder3.n-tv.de/img/incoming/crop24315250/6321324949-cImg_16_9-w1200/387362972.jpg,2023-08-09T13:03:10Z,,"In der Medizin ist Deutschland eigentlich ein Vorreiter. Das gilt jedoch nicht für die Digitalisierung, auch nach dem Start des elektronischen Rezepts hinkt die Bundesrepublik noch immer zurück. Gesu… [+2000 chars]",,de,'Karl Lauterbach'
https://www.focus.de/kultur/medien/helene-fischer-netflix-moechte-einen-film-ueber-den-schlager-star_id_201374196.html,https://www.focus.de/kultur/medien/helene-fischer-netflix-moechte-einen-film-ueber-den-schlager-star_id_201374196.html,0,www.focus.de,"Nach Lady Gaga, Taylor Swift & Co. - Helene Fischer bekommt eigene Netflix-Doku",Helene Fischer tritt in die Fußstapfen internationaler Musikstars wie Lady Gaga und Taylor Swift: Netflix dreht einen Dokumentarfilm über die deutsche Sängerin.Von FOCUS-online-Autorin Beatrice Predan-Hallabrin,https://p6.focus.de/img/fotos/id_201376069/helene-fischer.jpg?im=Crop%3D%280%2C229%2C2750%2C1375%29%3BResize%3D%281200%2C627%29&impolicy=perceptual&quality=mediumHigh&hash=6f2a9a7dc3be865700548547c89bf9505ca6d2a214ff06e0d8896bddc639832f,2023-08-09T17:47:52Z,https://web.archive.org/web/20230810103741/https://www.focus.de/kultur/medien/helene-fischer-netflix-moechte-einen-film-ueber-den-schlager-star_id_201374196.html,"Am 25. August startet die Live-Tour von Helene Fischer. Bis dahin genießt die Sängerin, die erst vor kurzem ihren 39. Geburtstag gefeiert hat, ihre Sommerpause. Für ihre Fans gibt es nun auch eine we… [+1959 chars]",,de,'Jennifer Lopez'
https://www.bild.de/politik/ausland/politik-ausland/die-geheime-macht-von-kim-jong-uns-frauen-nordkorea-funktioniert-wie-game-of-thr-84835820.bild.html,https://www.bild.de/politik/ausland/politik-ausland/die-geheime-macht-von-kim-jong-uns-frauen-nordkorea-funktioniert-wie-game-of-thr-84835820.bild.html,0,www.bild.de,Die geheime Macht von Kim Jong-uns Frauen - Nordkorea „funktioniert wie Game of Thrones“,"Wer sind die Menschen in Kims Umfeld? Es sind vor allem Frauen, auf die Kim hört. Foto: REUTERS","https://images.bild.de/64c21af824730b66ae1a80b9/e1fdae0db1f8bcfc4e434a248455d668,2b3e250e?w=1280",2023-08-09T18:34:13Z,https://web.archive.org/web/20230810041350/https://www.bild.de/politik/ausland/politik-ausland/die-geheime-macht-von-kim-jong-uns-frauen-nordkorea-funktioniert-wie-game-of-thr-84835820.bild.html,"So angespannt war die Lage zwischen den USA und Nordkorea zuletzt 2017, als Donald Trump (77) in seiner Feuer und Wut-Rede drohte, die Diktatur mit einem Atomschlag zu vernichten.
Seit der US-Soldat… [+4144 chars]",,de,'Kim Jong-un'
https://de.wordpress.org/2023/08/wordpress-6-3/,https://de.wordpress.org/2023/08/wordpress-6-3/,0,de.wordpress.org,WordPress 6.3 »Lionel«,"Am 8. August wurde WordPress 6.3 »Lionel« veröffentlicht, benannt nach dem amerikanischen Jazz-Künstler Lionel Hampton. Mit der neuen WordPress-Version könnt ihr eure Website noch effizienter erstellen. Egal ob ihr eine Website komplett ohne Programmierung er…",https://de.wordpress.org/files/2023/08/site-editor-2.png,2023-08-09T21:15:07Z,,"Am 8. August wurde WordPress 6.3 »Lionel« veröffentlicht, benannt nach dem amerikanischen Jazz-Künstler Lionel Hampton.
Mit der neuen WordPress-Version könnt ihr eure Website noch effizienter erstel… [+15541 chars]",,de,'George Santos'
https://www.faz.net/aktuell/gesellschaft/smalltalk/kevin-costner-outet-sich-als-fan-von-taylor-swift-19095971.html,https://www.faz.net/aktuell/gesellschaft/smalltalk/kevin-costner-outet-sich-als-fan-von-taylor-swift-19095971.html,0,www.faz.net,Kevin Costner: „Ich bin jetzt offiziell ein Swiftie!“,"Ob Taylor Lautner, Jennifer Garner und Julia Roberts: Der US-amerikanische Superstar Taylor Swift kann zahlreiche prominente Fans vorweisen. Nun kam ein weiterer dazu.",https://media0.faz.net/ppmedia/aktuell/473087596/1.9096008/facebook_teaser/der-us-amerikanische.jpg,2023-08-11T09:35:24Z,https://web.archive.org/web/20230812202430/https://www.faz.net/aktuell/gesellschaft/smalltalk/kevin-costner-outet-sich-als-fan-von-taylor-swift-19095971.html,"Taylor Swift hat einen neuen prominenten Fan. Es hat mich umgehauen, wie sie durch ihre Kunst so viele Menschen zusammenbringt. Ich bin jetzt offiziell ein Swiftie!, schrieb der Oscar-Preisträger Kev… [+906 chars]",,de,'Jennifer Garner'
https://orf.at/stories/3327171/,https://orf.at/stories/3327171/,0,orf.at,Trump ändert seine Sprache,Der frühere US-Präsident Donald Trump ist bekannt für seine exzentrische Art. In sozialen Netzwerken und bei Veranstaltungen lässt er – gelinde gesagt – seinen Emotionen freien Lauf. Nach der neuen Anklageerhebung wegen Wahlverschwörung hatte er einen besonde…,https://ibs.orf.at/news?image=https%3A%2F%2Fassets.orf.at%2Fmims%2F2023%2F32%2F61%2Fcrops%2Fw%3D1200%2Ch%3D630%2Cq%3D75%2F1898927_master_711961_usa_trump_sprache_2_a.jpg%3Fs%3D6aee630579c931c537a9fa9ea3e60c19d3dd20b9,2023-08-12T15:51:06Z,https://web.archive.org/web/20230813020005/https://orf.at/stories/3327171/,"In den vergangenen drei Jahren hatten der frühere Präsident und seine Mitstreiter ohne Beweise behauptet, die US-Wahl 2020 sei gestohlen worden. Gleich nach der Wahl schimpfte er etwa: Nevada stellt … [+4600 chars]",,de,'Donald Trump'
