index,url,valid,domain,title,description,image,published,archive,content,quote,language,keyword
https://www.stern.de/kultur/koenig-charles-iii---militaer-probt-um-mitternacht-fuer-die-kroenung-33432338.html,https://www.stern.de/kultur/koenig-charles-iii---militaer-probt-um-mitternacht-fuer-die-kroenung-33432338.html,0,www.stern.de,König Charles III.: Militär probt um Mitternacht für die Krönung,Vor der Krönung von König Charles III. laufen die Vorbereitungen auf Hochtouren. Das Militär hielt nun mitten in der Nacht eine Probe ab.,https://image.stern.de/33432342/t/1N/v1/w1440/r1.7778/-/03--militaer-probt-um-mitternacht-fuer-die-kroenung---16-9---spoton-article-1044060.jpg,2023-05-03T09:57:00Z,,"Vor der Krönung von König Charles III. laufen die Vorbereitungen auf Hochtouren. Das Militär hielt nun mitten in der Nacht eine Probe ab.
In wenigen Tagen wird Charles III. (74) vor 2.000 geladenen … [+1489 chars]",,de,'König Charles III'
https://www.welt.de/politik/deutschland/plus245125314/Kubicki-droht-Habeck-mit-Blockade-aller-gruenen-Lieblingsprojekte.html,https://www.welt.de/politik/deutschland/plus245125314/Kubicki-droht-Habeck-mit-Blockade-aller-gruenen-Lieblingsprojekte.html,0,www.welt.de,Kubicki droht Habeck mit Blockade aller grünen „Lieblingsprojekte“,Wolfgang Kubicki (FDP) wirft Robert Habeck (Grüne) ein „mieses machtpolitisches Spiel“ vor: Der Wirtschaftsminister blockiere auf „gewissenlose Art und Weise“ den Ausbau der Verkehrsinfrastruktur in Schleswig-Holstein. Dies werde „massive parlamentarische Fol…,https://img.welt.de/img/politik/deutschland/mobile245125880/6871354267-ci16x9-w1200-fnov-fpotl-fpi157750653/Kombo-Kubicki-Habeck.jpg,2023-05-03T10:16:28Z,http://archive.md/20230503170408/https://www.welt.de/politik/deutschland/plus245125314/Kubicki-droht-Habeck-mit-Blockade-aller-gruenen-Lieblingsprojekte.html,"Die WELT als ePaper: Die vollständige Ausgabe steht Ihnen bereits am Vorabend zur Verfügung so sind Sie immer hochaktuell informiert. Weitere Informationen: http://epaper.welt.de 
 Der Kurz-Link die… [+49 chars]",,de,'Robert Habeck'
https://www.welt.de/sport/article245123388/Forbes-Liste-Selbst-als-Rentner-gehoert-Federer-zu-den-bestbezahlten-Sportlern-der-Welt.html,https://www.welt.de/sport/article245123388/Forbes-Liste-Selbst-als-Rentner-gehoert-Federer-zu-den-bestbezahlten-Sportlern-der-Welt.html,0,www.welt.de,Selbst als Rentner gehört Federer zu den bestbezahlten Sportlern der Welt,Lionel Messi sitzt nicht mehr auf dem Thron der bestverdienenden Sportler der Welt. Die Top Drei der Geldrangliste von „Forbes“ sind dennoch Fußballer. Zur Top Ten gehört auch die bereits zurückgetretene Tennis-Legende Roger Federer.,https://img.welt.de/img/bildergalerien/mobile245124122/3781359937-ci16x9-w1200/Met-Gala-2023-Karl-Lagerfeld-Red-Carpet-Looks.jpg,2023-05-03T10:22:01Z,https://web.archive.org/web/20230503121205/https://www.welt.de/sport/article245123388/Forbes-Liste-Selbst-als-Rentner-gehoert-Federer-zu-den-bestbezahlten-Sportlern-der-Welt.html,Superstar Cristiano Ronaldo ist laut der Sportler-Geldrangliste des Wirtschaftsmagazins Forbes der Topverdiener des Jahres. Dem am Mittwoch veröffentlichten Ranking zufolge bekam der 38 Jahre alte Po… [+2730 chars],,de,'Lionel Messi'
https://www.zeit.de/2023/19/papst-franziskus-ungarn-reise,https://www.zeit.de/2023/19/papst-franziskus-ungarn-reise,0,www.zeit.de,Papst Franziskus in Ungarn: Er fliegt noch,"Nach seinem Klinikaufenthalt sah es aus, als könne der Papst nicht mehr reisen. Jetzt war er in Ungarn. Der Autor Andreas Englisch war mit an Bord.",,2023-05-03T10:58:18Z,,"When browsing with ads:
We collect personal data and also transmit it to third-party providers
 that help us improve and finance our digital content. Some of the information stored on your device, … [+732 chars]",,de,'Papst Franziskus'
https://www.der-postillon.com/2023/05/soeder.html,https://www.der-postillon.com/2023/05/soeder.html,0,www.der-postillon.com,"""Stehe nicht zur Verfügung"": Markus Söder kündigt offenbar Kanzlerkandidatur an","M̶ü̶n̶c̶h̶h̶a̶u̶s̶e̶n̶ München (dpo) - Bayerns Ministerpräsident Markus Söder hat gestern in der ZDF-Sendung ""Markus Lanz"" seine Kanzlerkandidatur für die Union angekündigt. ""Ich stehe nicht zur Verfügung"", erklärte Söder seine offensichtlich großen Kanzleram…",https://blogger.googleusercontent.com/img/b/R29vZ2xl/AVvXsEhOSn-a-HBQ_fROrbuXnIn0H49Fv2sok8QaaMTMmpJLJ-WT5Cbsl6aP3k6ibwQPGU9mN-3B_0PjzW0mC6PsI-Gyho9MUKxVEmfiZkP-7o-aNc48Uvb9CF6TWfjqbhdSdutC-ASSG1AtXssdc4UdHIa-p-0FQT8aJKgN9BDxz2mDlBZtf9--qxVD3NLM/w1600/imago0245632048h.jpg,2023-05-03T11:08:27Z,https://web.archive.org/web/20230503121932/https://www.der-postillon.com/2023/05/soeder.html,"M̶ü̶n̶c̶h̶h̶a̶u̶s̶e̶n̶ München (dpo) - Bayerns Ministerpräsident Markus Söder hat gestern in der ZDF-Sendung ""Markus Lanz"" seine Kanzlerkandidatur für die Union angekündigt. ""Ich stehe nicht zur Verf… [+1277 chars]",,de,'Markus Lanz'
https://www.tagesspiegel.de/gesellschaft/panorama/die-gasteliste-zur-kronung-wer-kommt--und-vor-allem-wer-nicht-9747053.html,https://www.tagesspiegel.de/gesellschaft/panorama/die-gasteliste-zur-kronung-wer-kommt--und-vor-allem-wer-nicht-9747053.html,0,www.tagesspiegel.de,Die Gästeliste zur Krönung: Wer kommt – und vor allem: Wer nicht?,Rund 2000 Gäste werden zur Krönung von Charles III. und Camilla kommen. Nicht allen fiel diese Entscheidung leicht. Warum Meghan fehlt und Harry schnell wieder abreist.,https://www.tagesspiegel.de/images/britain-royals-funeral/alternates/BASE_16_9_W1400/britain-royals-funeral.jpeg,2023-05-03T11:14:14Z,https://web.archive.org/web/20230505114235/https://www.tagesspiegel.de/gesellschaft/panorama/die-gasteliste-zur-kronung-wer-kommt--und-vor-allem-wer-nicht-9747053.html,"In jeder Familie gibt es Termine, auf die man nicht mit ungeteilter Vorfreude blickt. Opas 80. zum Beispiel. Oder die Petersilienhochzeit der Schwester. Pflichttermine eben. Doch man möchte meinen, d… [+8924 chars]",,de,'Charles III'
https://www.transfermarkt.de/twitch-stream-messi-suspendiert-ndash-verlasst-ronaldo-al-nassr-schon-wieder-/view/news/421131,https://www.transfermarkt.de/twitch-stream-messi-suspendiert-ndash-verlasst-ronaldo-al-nassr-schon-wieder-/view/news/421131,0,www.transfermarkt.de,Twitch-Stream: Messi suspendiert – Verlässt Ronaldo Al-Nassr schon wieder?,Jetzt live! Auf dem Twitch-Kanal von Transfermarkt werden im heutigen Stream Lionel Messis Suspendierung bei Paris Saint-Germain und die Zukunft von Cristiano Ronaldo diskutiert. Zuletzt kamen...,https://tmssl.akamaized.net/images/foto/big/twitch-transfermarkt-spotlight-1659451593-89467.jpg?lm=1659451595,2023-05-03T11:45:08Z,https://web.archive.org/web/20230503134413/https://www.transfermarkt.de/twitch-stream-messi-suspendiert-ndash-verlasst-ronaldo-al-nassr-schon-wieder-/view/news/421131,Jetzt live! Auf dem Twitch-Kanal von Transfermarkt werden im heutigen Stream Lionel Messis Suspendierung bei Paris Saint-Germain und die Zukunft von Cristiano Ronaldo diskutiert. Zuletzt kamen Gerüch… [+972 chars],,de,'Lionel Messi'
https://www.sueddeutsche.de/panorama/promi-news-ed-sheeran-kevin-costner-cate-blanchett-jan-boehmermann-quentin-tarantino-1.5836559,https://www.sueddeutsche.de/panorama/promi-news-ed-sheeran-kevin-costner-cate-blanchett-jan-boehmermann-quentin-tarantino-1.5836559,0,www.sueddeutsche.de,Leute: Das Ende vom Lied?,"Ed Sheeran droht mit seinem Karriereende, Kevin Costner lässt sich scheiden und Cate Blanchett lobt Angela Merkel.",https://www.sueddeutsche.de/image/sz.1.5836565/1200x675?v=1683115036,2023-05-03T11:57:25Z,https://web.archive.org/web/20230503161047/https://www.sueddeutsche.de/panorama/promi-news-ed-sheeran-kevin-costner-cate-blanchett-jan-boehmermann-quentin-tarantino-1.5836559,"Ed Sheeran droht mit seinem Karriereende, Kevin Costner lässt sich scheiden und Cate Blanchett lobt Angela Merkel.Ed Sheeran, 32, britischer Musiker, droht damit, seine Karriere zu beenden. Vor einem… [+2913 chars]",,de,'Jan Böhmermann'
https://www.welt.de/politik/deutschland/article245119728/Markus-Soeder-steht-fuer-Kanzlerkandidatur-nicht-zur-Verfuegung.html,https://www.welt.de/politik/deutschland/article245119728/Markus-Soeder-steht-fuer-Kanzlerkandidatur-nicht-zur-Verfuegung.html,0,www.welt.de,Söder steht für Kanzlerkandidatur „nicht zur Verfügung“,"Markus Söder hat Spekulationen über eine mögliche Kanzlerkandidatur zurückgewiesen. In der Sendung „Markus Lanz“ erklärte der CSU-Chef in deutlichen Worten, dass das Thema für ihn erledigt sei. Die besten Chancen räumt er dem CDU-Vorsitzenden Friedrich Merz e…",https://img.welt.de/img/bildergalerien/mobile245119742/9001354987-ci16x9-w1200/Gemeinsame-Kabinettssitzung-von-Bayern-und-NRW.jpg,2023-05-03T12:22:00Z,https://web.archive.org/web/20230503131822/https://www.welt.de/politik/deutschland/article245119728/Markus-Soeder-steht-fuer-Kanzlerkandidatur-nicht-zur-Verfuegung.html,"Bayerns Ministerpräsident Markus Söder will nach eigenen Worten definitiv nicht Unions-Kanzlerkandidat zur Bundestagswahl werden. In der ZDF-Sendung Markus Lanz sagte Söder, der auch CSU-Chef ist, am… [+2102 chars]",,de,'Markus Lanz'
https://www.tagesspiegel.de/berlin/steinbutt-und-spinatsalat-zum-dinner-obama-und-merkel-speisen-im-berliner-restaurant-ponte-9756788.html,https://www.tagesspiegel.de/berlin/steinbutt-und-spinatsalat-zum-dinner-obama-und-merkel-speisen-im-berliner-restaurant-ponte-9756788.html,0,www.tagesspiegel.de,Steinbutt und Spinatsalat zum Dinner: Obama und Merkel speisen im Berliner Restaurant „Ponte“,"Angela Merkel traf den Ex-US-Präsidenten Barack Obama an einem sehr berlinischen Ort. Beim Schöneberger Edelitaliener ist die Atmosphäre herzlich, die Küche exzellent.",https://www.tagesspiegel.de/images/100-print-70-online-lt-absprache-obama-auf-eine-pasta-mit-merkel/alternates/BASE_16_9_W1400/100-print-70-online-lt-absprache-obama-auf-eine-pasta-mit-merkel.jpeg,2023-05-03T13:25:52Z,https://web.archive.org/web/20230505042142/https://www.tagesspiegel.de/berlin/steinbutt-und-spinatsalat-zum-dinner-obama-und-merkel-speisen-im-berliner-restaurant-ponte-9756788.html,"Wen genau Angela Merkel am Dienstagabend bei ihm bewirten will, weiß Valter Mazza nicht. Die Ex-Kanzlerin, die immer mal wieder mit ihrem Mann Joachim Sauer in seinem Restaurant Ponte gesehen wird, h… [+5046 chars]",,de,'Barack Obama'
https://www.kicker.de/guardiola-messi-vergleich-hilft-haaland-nicht-949697/video,https://www.kicker.de/guardiola-messi-vergleich-hilft-haaland-nicht-949697/video,0,www.kicker.de,"Guardiola: ""Messi-Vergleich hilft Haaland nicht""","Video: Weil Erling Haaland einen Torrekord nach dem anderen bricht, kommen immer wieder Vergleiche mit Lionel Messi auf. ManCity-Trainer Pep Guardiola hält davon wenig - und sieht doch Gemeinsamkeiten.","https://derivates.kicker.de/image/upload/c_crop,x_0,y_321,w_3573,h_2010/w_1200,q_auto/v1/2023/05/03/634eae3e-f403-4715-8b98-cb4813bd3791.jpeg",2023-05-03T13:54:38Z,https://web.archive.org/web/20230505224011/https://www.kicker.de/guardiola-messi-vergleich-hilft-haaland-nicht-949697/video,"Werbung und Tracking: Um dir relevante Inhalte und personalisierte Werbung anzubieten, setzen wir Cookies und andere Technologien ein. Damit messen wir, wie und womit du unsere Angebote nutzt. Diese … [+2186 chars]",,de,'Lionel Messi'
https://www.handelsblatt.com/politik/deutschland/k-frage-markus-soeder-zur-kanzlerkandidatur-ich-stehe-da-nicht-zur-verfuegung-/29128004.html,https://www.handelsblatt.com/politik/deutschland/k-frage-markus-soeder-zur-kanzlerkandidatur-ich-stehe-da-nicht-zur-verfuegung-/29128004.html,0,www.handelsblatt.com,K-Frage : Markus Söder zur Kanzlerkandidatur: „Ich stehe da nicht zur Verfügung“,Die Lebensaufgabe des bayerischen Ministerpräsidenten sei Bayern. Mit Blick auf eine Kanzler-Kandidatur hat Söder zufolge ein anderer Politiker jedoch gute Chancen.,https://www.handelsblatt.com/images/markus-soeder/29128008/2-format2003.jpg,2023-05-03T14:18:00Z,,"Markus Söder
München/ Berlin Bayerns Ministerpräsident Markus Söder will nach eigenen Worten definitiv nicht Unions-Kanzlerkandidat zur Bundestagswahl werden. In der ZDF-Sendung Markus Lanz sagte Sö… [+1584 chars]",,de,'Markus Lanz'
https://consent.google.com/ml?continue=https://news.google.com/rss/articles/CBMirwFodHRwczovL3d3dy5ldXJvc3BvcnQuZGUvZnVzc2JhbGwvbGlndWUtMS8yMDIyLTIwMjMvbGlvbmVsLW1lc3NpLXN0ZWh0LWluLXBhcmlzLWF1Zi1kZW0tYWJzdGVsbGdsZWlzLXN1c3BlbmRpZXJ1bmctbmFjaC1uaWNodC1nZW5laG1pZ3Rlbi10cmlwLW5hY2gtc2F1ZF9zdG85NTg5MDE4L3N0b3J5LnNodG1s0gGzAWh0dHBzOi8vd3d3LmV1cm9zcG9ydC5kZS9mdXNzYmFsbC9saWd1ZS0xLzIwMjItMjAyMy9saW9uZWwtbWVzc2ktc3RlaHQtaW4tcGFyaXMtYXVmLWRlbS1hYnN0ZWxsZ2xlaXMtc3VzcGVuZGllcnVuZy1uYWNoLW5pY2h0LWdlbmVobWlndGVuLXRyaXAtbmFjaC1zYXVkX3N0bzk1ODkwMTgvc3RvcnktYW1wLnNodG1s?oc%3D5&gl=FR&hl=en-US&cm=2&pc=n&src=1,https://consent.google.com/ml?continue=https://news.google.com/rss/articles/CBMirwFodHRwczovL3d3dy5ldXJvc3BvcnQuZGUvZnVzc2JhbGwvbGlndWUtMS8yMDIyLTIwMjMvbGlvbmVsLW1lc3NpLXN0ZWh0LWluLXBhcmlzLWF1Zi1kZW0tYWJzdGVsbGdsZWlzLXN1c3BlbmRpZXJ1bmctbmFjaC1uaWNodC1nZW5laG1pZ3Rlbi10cmlwLW5hY2gtc2F1ZF9zdG85NTg5MDE4L3N0b3J5LnNodG1s0gGzAWh0dHBzOi8vd3d3LmV1cm9zcG9ydC5kZS9mdXNzYmFsbC9saWd1ZS0xLzIwMjItMjAyMy9saW9uZWwtbWVzc2ktc3RlaHQtaW4tcGFyaXMtYXVmLWRlbS1hYnN0ZWxsZ2xlaXMtc3VzcGVuZGllcnVuZy1uYWNoLW5pY2h0LWdlbmVobWlndGVuLXRyaXAtbmFjaC1zYXVkX3N0bzk1ODkwMTgvc3RvcnktYW1wLnNodG1s?oc%3D5&gl=FR&hl=en-US&cm=2&pc=n&src=1,0,consent.google.com,Lionel Messi steht bei PSG auf dem Abstellgleis - Suspendierung nach nicht genehmigten Trip nach Saudi-Arabien - Eurosport DE,"<ol><li>Lionel Messi steht bei PSG auf dem Abstellgleis - Suspendierung nach nicht genehmigten Trip nach Saudi-Arabien  Eurosport DE
</li><li>Messi-Abschied, Fan-Proteste, Führungs-Chaos: Die Wahrheit über das PSG-Beben! | Sport  BILD
</li><li>Argentiniens …",,2023-05-03T14:26:00Z,,"We use cookies and data to<ul><li>Deliver and maintain Google services</li><li>Track outages and protect against spam, fraud, and abuse</li><li>Measure audience engagement and site statistics to unde… [+1131 chars]",,de,'Lionel Messi'
https://www.handelsblatt.com/politik/international/deutschland-besuch-selenski-kommt-nach-berlin-und-nimmt-in-aachen-den-karlspreis-entgegen/29129500.html,https://www.handelsblatt.com/politik/international/deutschland-besuch-selenski-kommt-nach-berlin-und-nimmt-in-aachen-den-karlspreis-entgegen/29129500.html,0,www.handelsblatt.com,Deutschland-Besuch : Selenski kommt nach Berlin – und nimmt in Aachen den Karlspreis entgegen,Bei Auslandsreisen des Präsidenten gilt die höchste Sicherheitsstufe. Deswegen werden sie üblicherweise bis zuletzt geheim gehalten. Doch nun wurden Pläne für einen Berlin-Besuch bekannt.,https://www.handelsblatt.com/images/ukrainischer-praesident/29129536/3-format2003.jpg,2023-05-03T14:29:47Z,,Berlin Der ukrainische Präsident Wolodimir Selenski wird möglicherweise Mitte Mai zum ersten Mal seit dem russischen Angriff auf die Ukraine nach Berlin kommen. Die Berliner Polizei gab am Mittwoch ü… [+3203 chars],,de,'Selenski'
https://www.faz.net/aktuell/politik/ukraine-liveticker-gegenoffensive-laut-selenskyj-kurz-vor-beginn-faz-18495964.html,https://www.faz.net/aktuell/politik/ukraine-liveticker-gegenoffensive-laut-selenskyj-kurz-vor-beginn-faz-18495964.html,0,www.faz.net,Ukraine-Liveblog: Selenskyj: Gegenoffensive kurz vor Beginn,Mehrere Tote durch russischen Beschuss im Gebiet Cherson +++ Ukrainischer Präsident zu Überraschungs-Besuch in Finnland +++ Russland meldet Feuer in Treibstofflager +++ Weiterer russischer Güterzug nach Explosion entgleist +++ alle Entwicklungen im Liveblog,https://media0.faz.net/ppmedia/aktuell/politik/3402491673/1.8865626/facebook_teaser/ukrainische-soldaten-gehen-in.jpg,2023-05-03T14:44:25Z,https://web.archive.org/web/20230503125422/https://www.faz.net/aktuell/politik/ukraine-liveticker-gegenoffensive-laut-selenskyj-kurz-vor-beginn-faz-18495964.html,"Russland behauptet, die Ukraine habe in der Nacht auf Mittwoch versucht, mit zwei Drohnen die Residenz von Präsident Wladimir Putin im Kreml in Moskau anzugreifen. Die beiden Drohnen seien von Militä… [+1065 chars]",,de,'Selenskyj'
https://www.transfermarkt.de/berichte-messi-verlasst-psg-ndash-angebot-wegen-fehlender-perspektive-des-klubs-abgelehnt/view/news/421141,https://www.transfermarkt.de/berichte-messi-verlasst-psg-ndash-angebot-wegen-fehlender-perspektive-des-klubs-abgelehnt/view/news/421141,0,www.transfermarkt.de,Berichte: Lionel Messi verlässt PSG im Sommer – Angebot abgelehnt,"Eine gemeinsame Zukunft von Lionel Messi und Paris Saint-Germain schien schon länger schwer vorstellbar. Nun soll feststehen, dass sich die Wege im Sommer, wenn der Vertrag des...",https://tmssl.akamaized.net/images/foto/big/lionel-messi-psg-1672228039-99179.jpg?lm=1672228059,2023-05-03T14:53:08Z,https://web.archive.org/web/20230503163731/https://www.transfermarkt.de/berichte-messi-verlasst-psg-ndash-angebot-wegen-fehlender-perspektive-des-klubs-abgelehnt/view/news/421141,"Eine gemeinsame Zukunft von Lionel Messi und Paris Saint-Germain schien schon länger schwer vorstellbar. Nun soll feststehen, dass sich die Wege im Sommer, wenn der Vertrag des Weltfußballers ausläuf… [+2031 chars]",,de,'Lionel Messi'
https://www.focus.de/politik/deutschland/streit-um-autobahn-kubicki-wuetet-gegen-habeck-und-will-gruene-lieblingsprojekte-blockieren_id_192800137.html,https://www.focus.de/politik/deutschland/streit-um-autobahn-kubicki-wuetet-gegen-habeck-und-will-gruene-lieblingsprojekte-blockieren_id_192800137.html,0,www.focus.de,Streit um Autobahn - Kubicki wütet gegen Habeck und will grüne „Lieblingsprojekte“ blockieren,Bundestagsvizepräsident Wolfgang Kubicki (FDP) beschuldigt Vizekanzler Robert Habeck (Grüne) der vorsätzlichen Sabotage eines wichtigen Infrastrukturprojekts in Schleswig-Holstein. Er droht dem Minister offen mit Blockade.,https://p6.focus.de/img/fotos/id_7746352/urn-newsml-dpa-com-20090101-171021-99-543414-large-4-3.jpg?im=Crop%3D%280%2C100%2C800%2C400%29%3BResize%3D%281200%2C627%29&hash=efa6022fbec51a0a6baff2bed9daabbb0ecbc0f9da9e246f81f1ece4a77383cf,2023-05-03T14:55:13Z,https://web.archive.org/web/20230503175203/https://www.focus.de/politik/deutschland/streit-um-autobahn-kubicki-wuetet-gegen-habeck-und-will-gruene-lieblingsprojekte-blockieren_id_192800137.html,Bundestagsvizepräsident Wolfgang Kubicki (FDP) beschuldigt Vizekanzler Robert Habeck (Grüne) der vorsätzlichen Sabotage eines wichtigen Infrastrukturprojekts in Schleswig-Holstein. Er droht dem Minis… [+2856 chars],,de,'Wolfgang Kubicki'
https://www.sueddeutsche.de/sport/messi-sperre-psg-transfer-barca-1.5836854,https://www.sueddeutsche.de/sport/messi-sperre-psg-transfer-barca-1.5836854,0,www.sueddeutsche.de,Fußball: Paris weist Messi die Tür,Wegen einer PR-Tour nach Riad suspendiert der Klub Lionel Messi. Ein geplanter Eklat? Der Abschied des Weltmeisters aus Frankreich gilt als besiegelt - und seine berufliche Zukunft ist offener denn je.,https://www.sueddeutsche.de/image/sz.1.5836855/1200x675?v=1683125963,2023-05-03T15:01:43Z,http://archive.md/20230503154011/https://www.sueddeutsche.de/sport/messi-sperre-psg-transfer-barca-1.5836854,Wegen einer PR-Tour nach Riad suspendiert der Klub Lionel Messi. Ein geplanter Eklat? Der Abschied des Weltmeisters aus Frankreich gilt als besiegelt - und seine berufliche Zukunft ist offener denn j… [+662 chars],,de,'Lionel Messi'
https://www.bild.de/unterhaltung/tv/tv/markus-lanz-heute-gaeste-und-thema-der-folge-vom-3-mai-2023-83786500.bild.html,https://www.bild.de/unterhaltung/tv/tv/markus-lanz-heute-gaeste-und-thema-der-folge-vom-3-mai-2023-83786500.bild.html,0,www.bild.de,Gäste und Thema am 3. Mai - Wer ist heute Abend bei Markus Lanz?,"Dreimal wöchentlich lädt Markus Lanz Experten ein, um über brisante gesellschaftliche Themen zu diskutieren. Hier erfahren Sie, wer heute dabei ist!","https://images.bild.de/645275f0b4f4564cc3f6e44b/bb1d0336e63a4a8c925896c4e54852f0,8dd4b37d?w=1280",2023-05-03T15:09:31Z,https://web.archive.org/web/20230504050802/https://www.bild.de/unterhaltung/tv/tv/markus-lanz-heute-gaeste-und-thema-der-folge-vom-3-mai-2023-83786500.bild.html,"Messerattacke in Berlin-Neukölln: Zwei Kinder in Schule niedergestochen
Messerattacke in Berlin-Neukölln: Zwei Kinder in Schule niedergestochen
Messerattacke in Berlin-Neukölln: Zwei Kinder in Schu… [+528 chars]",,de,'Markus Lanz'
https://www.wiwo.de/erfolg/management/karriereleiter-5-rhetorik-kniffe-lernen-ausgerechnet-von-karl-lauterbach/29127176.html,https://www.wiwo.de/erfolg/management/karriereleiter-5-rhetorik-kniffe-lernen-ausgerechnet-von-karl-lauterbach/29127176.html,0,www.wiwo.de,Karriereleiter: 5 Rhetorik-Kniffe lernen – ausgerechnet von Karl Lauterbach,"Die Analyse der Rhetorik des Bundesgesundheitsministers durch unseren Kolumnisten zeigt: Sie können von Lauterbachs Diskussionsstil lernen. Selbst und gerade, wenn Sie seine inhaltlichen Positionen nicht teilen.",https://www.wiwo.de/images/karl-lauterbach-politiker-05-22-her-karl-lauterbach-am-25-mai-2022-in-markus-lanz-zdf-tv-fernsehen-talkshow-talk-s/29127208/3-format11240.jpg,2023-05-03T15:10:12Z,https://web.archive.org/web/20230503183326/http://www.wiwo.de/erfolg/management/karriereleiter-5-rhetorik-kniffe-lernen-ausgerechnet-von-karl-lauterbach/29127176.html,"Wird Deutschland bald zum Kifferparadies? Um seine Pläne zur Liberalisierung der Cannabis-Politik zu erläutern und zu rechtfertigen, tingelt Bundesgesundheitsminister Karl Lauterbach in diesen Tagen … [+6379 chars]",,de,'Markus Lanz'
https://consent.google.com/ml?continue=https://news.google.com/rss/articles/CBMiggFodHRwczovL3d3dy53ZWx0LmRlL3Nwb3J0L2Z1c3NiYWxsL2FydGljbGUyNDUxMTk2OTYvTGlvbmVsLU1lc3NpLVBhcmlzLVNhaW50LUdlcm1haW4tc3VzcGVuZGllcnQtV2VsdG1laXN0ZXItZnVlci16d2VpLVdvY2hlbi5odG1s0gEA?oc%3D5&gl=FR&hl=en-US&cm=2&pc=n&src=1,https://consent.google.com/ml?continue=https://news.google.com/rss/articles/CBMiggFodHRwczovL3d3dy53ZWx0LmRlL3Nwb3J0L2Z1c3NiYWxsL2FydGljbGUyNDUxMTk2OTYvTGlvbmVsLU1lc3NpLVBhcmlzLVNhaW50LUdlcm1haW4tc3VzcGVuZGllcnQtV2VsdG1laXN0ZXItZnVlci16d2VpLVdvY2hlbi5odG1s0gEA?oc%3D5&gl=FR&hl=en-US&cm=2&pc=n&src=1,0,consent.google.com,Lionel Messi: Paris Saint-Germain suspendiert Weltmeister für zwei Wochen - WELT,"<ol><li>Lionel Messi: Paris Saint-Germain suspendiert Weltmeister für zwei Wochen  WELT
</li><li>Messi-Abschied, Fan-Proteste, Führungs-Chaos: Die Wahrheit über das PSG-Beben! | Sport  BILD
</li><li>Das war's! Der große Knall zwischen Messi und PSG | Transf…",,2023-05-03T15:19:14Z,,"We use cookies and data to<ul><li>Deliver and maintain Google services</li><li>Track outages and protect against spam, fraud, and abuse</li><li>Measure audience engagement and site statistics to unde… [+1131 chars]",,de,'Lionel Messi'
https://www.freitag.de/autoren/ines-schwerdtner/platz-da-ihr-fossilen-hier-kommt-die-gruene-elite,https://www.freitag.de/autoren/ines-schwerdtner/platz-da-ihr-fossilen-hier-kommt-die-gruene-elite,0,www.freitag.de,"Transformation | Platz da, ihr Fossilen: Hier kommt die grüne Elite!","Der Wirtschaftsminister Robert Habeck will die Heizwende, die FDP blockiert. Hinter dem Koalitionsstreit liegt ein tieferer Konflikt. Wer seid ihr: fossiles oder grünes Kapital? Besitzstandswahrer oder E-Radfahrerin? Hören wir da richtig? Die Liberalen warnen…",https://www.freitag.de/autoren/ines-schwerdtner/platz-da-ihr-fossilen-hier-kommt-die-gruene-elite/@@images/social_image,2023-05-03T16:00:00Z,https://web.archive.org/web/20230505032142/https://www.freitag.de/autoren/ines-schwerdtner/platz-da-ihr-fossilen-hier-kommt-die-gruene-elite,"Hören wir da richtig? Die Liberalen warnen vor einem Blindflug des Marktes, während Robert Habeck sich freut, dass die Preise durch eine US-Übernahme der Wärmepumpen-Produktion sinken könnten? Das Ge… [+9824 chars]",,de,'Julian Reichelt'
https://www.morgenpost.de/kultur/tv/article232083657/markus-lanz-gaeste-zdf-talkshow-mittewoch-heute-3-mai.html,https://www.morgenpost.de/kultur/tv/article232083657/markus-lanz-gaeste-zdf-talkshow-mittewoch-heute-3-mai.html,0,www.morgenpost.de,"ZDF-Sendung: ""Markus Lanz"": Diese Gäste sind am Mittwoch in der Sendung","Dreimal wöchentlich spricht Markus Lanz mit seinen Gästen über aktuelle Themen. Lesen Sie hier, wer am 3. Mai in der Sendung dabei ist.",https://img.morgenpost.de/img/frontpage/crop237779893/8152607561-w820-cv16_9-q85/Lanz1.jpg,2023-05-03T16:09:00Z,,"Berlin. <ul><li>Markus Lanz moderiert eine der erfolgreichsten Talkshows im deutschen TV</li><li>Der Moderator begrüßt dreimal wöchentlich Politikerinnen, Prominente, Journalistinnen und Experten im … [+1327 chars]",,de,'Markus Lanz'
https://www.nzz.ch/international/ukraine-krieg-spekulationen-nach-drohnenangriff-auf-den-kreml-ld.1736338,https://www.nzz.ch/international/ukraine-krieg-spekulationen-nach-drohnenangriff-auf-den-kreml-ld.1736338,0,www.nzz.ch,"Drohnenangriff auf den Kreml – Moskau spricht von einem ukrainischen Terroranschlag, Kiew weist den Vorwurf zurück",Russland sieht in dem nächtlichen Drohnenangriff auf den Amtssitz des Präsidenten einen Anschlag auf Wladimir Putin. Die Ukraine will davon nichts wissen. Scharfmacher fordern bereits Vergeltung.,"https://img.nzz.ch/2023/05/03/3b96eb79-2575-42fd-8cec-ea5202a08aec.jpeg?width=1200&height=675&fit=bound&quality=75&auto=webp&crop=1838,1034,x21,y0&wmark=nzz",2023-05-03T16:12:32Z,https://web.archive.org/web/20230504215308/https://www.nzz.ch/international/ukraine-krieg-spekulationen-nach-drohnenangriff-auf-den-kreml-ld.1736338,"Ein Standbild aus einem Video, das am Mittwoch in den sozialen Netzwerken zirkulierte, zeigt den Moment der Explosion einer Drohne über dem Kreml.
In der Nacht auf Mittwoch ist der Kreml in Moskau, … [+4509 chars]",,de,'Wolodimir Selenski'
