index,url,valid,domain,title,description,image,published,archive,content,quote,language,keyword
https://www.zeit.de/politik/ausland/2025-05/ukraine-usa-ressourcen-abkommen-krieg-russland,https://www.zeit.de/politik/ausland/2025-05/ukraine-usa-ressourcen-abkommen-krieg-russland,0,www.zeit.de,Ukraine und USA: Dieser Deal setzt Putin unter Zugzwang,Beim Rohstoffabkommen zwischen der Ukraine und den USA geht es nur vordergründig um Wirtschaft. Die politischen und militärischen Folgen dürften weitaus wichtiger sein.,https://img.zeit.de/politik/ausland/2025-05/ukraine-usa-ressourcen-abkommen-krieg-russland-bild/wide__1300x731,2025-05-01T10:32:45Z,http://archive.md/20250501103401/https://www.zeit.de/politik/ausland/2025-05/ukraine-usa-ressourcen-abkommen-krieg-russland,"Schließen
Artikelzusammenfassung
Nach 100 Tagen im Amt konnte Donald Trump einen symbolischen Sieg verbuchen, als er mit dem ukrainischen Präsidenten Selenskyj ein Ressourcenabkommen unterzeichnete… [+643 chars]",,de,'Putin'
https://www.bild.de/unterhaltung/tv-fernsehformate/gntm-2025-diese-stars-sind-zu-gast-in-der-neuen-staffel-67bf09b2651ced275f6736e9,https://www.bild.de/unterhaltung/tv-fernsehformate/gntm-2025-diese-stars-sind-zu-gast-in-der-neuen-staffel-67bf09b2651ced275f6736e9,0,www.bild.de,Star-Aufgebot bei GNTM - Diese Gäste hat Heidi Klum eingeladen,Diese Promi-Gäste sind in der neuen Staffel „Germany’s Next Topmodel“ 2025 dabei – vom Supermodel Naomi Campbell bis zum Moderator Klaas Heufer-Umlauf!,"https://images.bild.de/67bf09b2651ced275f6736e9/6a76b9719ddaa295d18d1fcf5a8eba73,5c748526?w=1280",2025-05-01T16:06:52Z,,"Schönheit liegt im Auge des Betrachters in diesem Fall im Auge von Heidi Klum (51), die auch in der neuen Staffel wieder darüber entscheidet, wer das Zeug dazu hat, Germanys Next Topmodel zu werden. … [+6911 chars]",,de,'Queen Elizabeth II'
https://www.faz.net/aktuell/politik/ukraine/ukraine-liveblog-selenskyj-ueber-rohstoffabkommen-ein-wirklich-gerechtes-abkommen-faz-110172806.html,https://www.faz.net/aktuell/politik/ukraine/ukraine-liveblog-selenskyj-ueber-rohstoffabkommen-ein-wirklich-gerechtes-abkommen-faz-110172806.html,0,www.faz.net,Ukraine Liveblog: Selenskyj über Rohstoffabkommen: „Ein wirklich gerechtes Abkommen“,Odessa unter Drohnenbeschuss +++ Kiew und Washington unterzeichnen Rohstoffabkommen +++ Russischer Betrieb steht durch ukrainischen Drohnenangriff in Flammen +++ alle Entwicklungen im Liveblog,https://media1.faz.net/ppmedia/aktuell/politik/1964391300/1.10450817/facebook_teaser/wolodymyr-selenskyj-aeussert.jpg,2025-05-01T17:04:17Z,,"Angesichts der Mittelkürzungen für Hilfsleistungen durch Staaten wie die USA hat die UN angekündigt, ihre Unterstützung für die Ukraine einzuschränken. Wegen der starken Einschränkung bei der humanit… [+1098 chars]",,de,'nan nan'
https://www.zeit.de/news/2025-05/02/rubio-russland-und-ukraine-noch-weit-voneinander-entfernt,https://www.zeit.de/news/2025-05/02/rubio-russland-und-ukraine-noch-weit-voneinander-entfernt,0,www.zeit.de,"Friedenslösung nicht in Sicht: Rubio: Russland und Ukraine ""noch weit voneinander entfernt""","Hier finden Sie Informationen zu dem Thema „Friedenslösung nicht in Sicht“. Lesen Sie jetzt „Rubio: Russland und Ukraine ""noch weit voneinander entfernt""“.",https://img.zeit.de/news/2025-05/02/rubio-russland-und-ukraine-noch-weit-voneinander-entfernt-image-group/wide__1300x731,2025-05-02T02:38:50Z,https://web.archive.org/web/20250503054645/https://www.zeit.de/news/2025-05/02/rubio-russland-und-ukraine-noch-weit-voneinander-entfernt,"Die Ukraine und Russland sind nach Auffassung von US-Außenminister Marco Rubio nach wie vor weit von einem Friedensabkommen entfernt. «Sie sind sich näher gekommen, aber sie sind immer noch weit vone… [+1319 chars]",,de,'nan Si'
https://www.stern.de/lifestyle/leute/frueherer-fussballstar--fuer-england--david--beckham-wird-50-35685750.html,https://www.stern.de/lifestyle/leute/frueherer-fussballstar--fuer-england--david--beckham-wird-50-35685750.html,0,www.stern.de,"Früherer Fußballstar: Für England, David: Beckham wird 50","Mit knapp 50 Jahren werden nicht viele Männer noch einmal Unterwäschemodel. David Beckham schon. Über einen Mann, der so viel erreicht hat, auf eine besondere Ehre aber weiter warten muss.",https://image.stern.de/35685752/t/_V/v1/w1440/r1.7778/-/02--fxbo2kbbfuv1axs2048jpeg---7a536f3c3ef1c4e0.jpg,2025-05-02T03:00:37Z,https://web.archive.org/web/20250502041231/https://www.stern.de/lifestyle/leute/frueherer-fussballstar--fuer-england--david--beckham-wird-50-35685750.html,"Kopiere den aktuellen Link
Zur Merkliste hinzufügen
Mit knapp 50 Jahren werden nicht viele Männer noch einmal Unterwäschemodel. David Beckham schon. Über einen Mann, der so viel erreicht hat, auf e… [+5121 chars]",,de,'Queen Elizabeth II'
https://www.tagesspiegel.de/gesellschaft/fruherer-fussballstar-fur-england-david-beckham-wird-50-13625488.html,https://www.tagesspiegel.de/gesellschaft/fruherer-fussballstar-fur-england-david-beckham-wird-50-13625488.html,0,www.tagesspiegel.de,"Früherer Fußballstar: Für England, David: Beckham wird 50","Mit knapp 50 Jahren werden nicht viele Männer noch einmal Unterwäschemodel. David Beckham schon. Über einen Mann, der so viel erreicht hat, auf eine besondere Ehre aber weiter warten muss.",https://www.tagesspiegel.de/images/13625485/alternates/BASE_16_9_W1400/1746154934000/david-beckham.jpeg,2025-05-02T03:02:15Z,https://web.archive.org/web/20250503023933/https://www.tagesspiegel.de/gesellschaft/fruherer-fussballstar-fur-england-david-beckham-wird-50-13625488.html,"David Beckham kommt langsam in ein Alter, in dem immer mehr Fußballfans sagen: Den hab' ich nicht mehr spielen sehen. Heute (2. Mai) feiert der frühere englische Nationalspieler, der einst einen neue… [+5626 chars]",,de,'David Beckham'
https://www.faz.net/aktuell/politik/ukraine/ukraine-liveblog-vance-kein-baldiges-kriegsende-abzusehen-faz-110172806.html,https://www.faz.net/aktuell/politik/ukraine/ukraine-liveblog-vance-kein-baldiges-kriegsende-abzusehen-faz-110172806.html,0,www.faz.net,Ukraine Liveblog: Vance: Kein baldiges Kriegsende abzusehen,Selenskyj: Rohstoffabkommen „wirklich gerecht“ +++ Odessa unter Drohnenbeschuss +++ Kiew und Washington unterzeichnen Rohstoffabkommen +++ Russischer Betrieb steht durch ukrainischen Drohnenangriff in Flammen +++ alle Entwicklungen im Liveblog,https://media0.faz.net/ppmedia/aktuell/politik/2904447743/1.10451112/facebook_teaser/us-vizepraesident-j-d-vance.jpg,2025-05-02T03:45:14Z,http://archive.md/20250502083907/https://www.faz.net/aktuell/politik/ukraine/ukraine-liveblog-vance-kein-baldiges-kriegsende-abzusehen-faz-110172806.html,"Angesichts der Mittelkürzungen für Hilfsleistungen durch Staaten wie die USA hat die UN angekündigt, ihre Unterstützung für die Ukraine einzuschränken. Wegen der starken Einschränkung bei der humanit… [+1098 chars]",,de,'Selenskyj'
https://www.brigitte.de/aktuell/david-beckham--der-ehemalige-fussballstar-wird-50-jahre-alt-13983200.html,https://www.brigitte.de/aktuell/david-beckham--der-ehemalige-fussballstar-wird-50-jahre-alt-13983200.html,0,www.brigitte.de,David Beckham: Der ehemalige Fußballstar wird 50 Jahre alt,David Beckham blickt auf eine glanzvolle Fußball- und Modekarriere zurück. Auch privat läuft es bestens. Am 2. Mai wird er 50 Jahre alt.,https://image.brigitte.de/13983202/t/yo/v1/w1440/r1.7778/-/02--der-ehemalige-fussballstar-wird-50-jahre-alt---1-1---spoton-article-1091012.jpg,2025-05-02T04:35:00Z,https://web.archive.org/web/20250502053403/https://www.brigitte.de/aktuell/david-beckham--der-ehemalige-fussballstar-wird-50-jahre-alt-13983200.html,"David Beckham blickt auf eine glanzvolle Fußball- und Modekarriere zurück. Auch privat läuft es bestens. Am 2. Mai wird er 50 Jahre alt.
Kaum ein anderer ehemaliger Fußballer steht so im Rampenlicht… [+5971 chars]",,de,'David Beckham'
https://www.brigitte.de/aktuell/prinzessin-charlotte-wird-zehn-jahre-alt--so-aehnlich-ist-sie-ihrer-urgrossmutter-queen-elizabeth-ii--13983208.html,https://www.brigitte.de/aktuell/prinzessin-charlotte-wird-zehn-jahre-alt--so-aehnlich-ist-sie-ihrer-urgrossmutter-queen-elizabeth-ii--13983208.html,0,www.brigitte.de,Prinzessin Charlotte wird zehn Jahre alt: So ähnlich ist sie ihrer Urgroßmutter Queen Elizabeth II.,Prinzessin Charlotte wird zehn. Sie soll ihrer verstorbenen Urgroßmutter ähnlich sein. Aber auch zu Diana scheint es Parallelen zu geben.,https://image.brigitte.de/13983210/t/NO/v1/w1440/r1.7778/-/02--so-aehnlich-ist-sie-ihrer-urgrossmutter-queen-elizabeth-ii----1-1---spoton-article-1092495.jpg,2025-05-02T04:41:00Z,,"Prinzessin Charlotte wird zehn. Sie soll ihrer verstorbenen Urgroßmutter ähnlich sein. Aber auch zu Diana scheint es Parallelen zu geben.
Nicht nur eine optische Ähnlichkeit soll da sein, auch ein b… [+3956 chars]",,de,'Prinzessin Diana'
https://www.welt.de/kultur/literarischewelt/article256048784/200-Jahre-Boersenverein-des-Deutschen-Buchhandels-Dieser-Verband-war-immer-politisch.html,https://www.welt.de/kultur/literarischewelt/article256048784/200-Jahre-Boersenverein-des-Deutschen-Buchhandels-Dieser-Verband-war-immer-politisch.html,0,www.welt.de,„Dieser Verband war immer politisch“,"Wenn der Börsenverein des deutschen Buchhandels feiert, gratulieren Promis. Zum 100. Geburtstag sprach Thomas Mann, jetzt zum 200. Maja Göpel. Welche Botschaften haben die beiden platziert – und was erzählt das über die Buchbranche? Ein Vergleich.",https://img.welt.de/img/kultur/literarischewelt/mobile256050982/9687936137-ci16x9-w1200/Image-6814900512ee6b68d1b81794.jpg,2025-05-02T11:14:32Z,https://web.archive.org/web/20250502130823/http://www.welt.de/kultur/literarischewelt/article256048784/200-Jahre-Boersenverein-des-Deutschen-Buchhandels-Dieser-Verband-war-immer-politisch.html,"Wenn der Börsenverein des deutschen Buchhandels feiert, gratulieren Promis. Zum 100. Geburtstag sprach Thomas Mann, jetzt zum 200. Maja Göpel. Welche Botschaften haben die beiden platziert und was er… [+9160 chars]",,de,'Maja Göpel'
https://www.morgenpost.de/politik/article408916142/mit-dieser-brandmauer-debatte-kann-ich-wenig-anfangen.html,https://www.morgenpost.de/politik/article408916142/mit-dieser-brandmauer-debatte-kann-ich-wenig-anfangen.html,0,www.morgenpost.de,„Mit dieser Brandmauer-Debatte kann ich wenig anfangen“,"Christian Dürr will Lindner-Nachfolger in der FDP werden. Hier sagt er, ob er auf ein Verbotsverfahren der AfD hofft – und ob er auf Rat von Elon Musk setzt.",https://img.sparknews.funkemedien.de/408917289/408917289_1746203310_v16_9_1600.jpeg,2025-05-02T17:00:00Z,https://web.archive.org/web/20250502173534/https://www.morgenpost.de/politik/article408916142/mit-dieser-brandmauer-debatte-kann-ich-wenig-anfangen.html,"Berlin. Christian Dürr will FDP-Chef werden. Wie er die Partei verändern will, auf wen er dabei setzt und wie es der Liberale mit der AfD hält.",,de,'Christian Lindner'
https://www.brigitte.de/aktuell/prinzessinnen-mit-aehnlichen--starqualitaeten---das-war-fuer-margaret-der-grund--mit-diana-zu-brechen-13983608.html,https://www.brigitte.de/aktuell/prinzessinnen-mit-aehnlichen--starqualitaeten---das-war-fuer-margaret-der-grund--mit-diana-zu-brechen-13983608.html,0,www.brigitte.de,"Prinzessinnen mit ähnlichen ""Starqualitäten"": Das war für Margaret der Grund, mit Diana zu brechen","Die beiden verband einiges, dennoch hat Prinzessin Margaret am Ende mit Diana gebrochen. Das steckt dahinter.",https://image.brigitte.de/13983610/t/pT/v1/w1440/r1.7778/-/02--das-war-fuer-margaret-der-grund--mit-diana-zu-brechen---1-1---spoton-article-1095221.jpg,2025-05-02T18:27:00Z,https://web.archive.org/web/20250502184755/https://www.brigitte.de/aktuell/prinzessinnen-mit-aehnlichen--starqualitaeten---das-war-fuer-margaret-der-grund--mit-diana-zu-brechen-13983608.html,"Die beiden verband einiges, dennoch hat Prinzessin Margaret am Ende mit Diana gebrochen. Das steckt dahinter.
Um Prinzessin Margaret (1930-2002), die jüngere Schwester von Queen Elizabeth II., ranke… [+8004 chars]",,de,'Prinzessin Diana'
https://www.faz.net/aktuell/politik/ukraine/ukraine-liveblog-us-regierung-will-ukraine-bei-f-16-unterstuetzen-110172806.html,https://www.faz.net/aktuell/politik/ukraine/ukraine-liveblog-us-regierung-will-ukraine-bei-f-16-unterstuetzen-110172806.html,0,www.faz.net,Ukraine Liveblog: US-Regierung will Ukraine bei F-16 unterstützen,Es geht um Ersatzteile und Pilotenausbildung +++ Ramelow will europäische Armee +++ Vance sieht kein baldiges Kriegsende +++ Selenskyj: Rohstoffabkommen „wirklich gerecht“ +++ alle Entwicklungen im Liveblog,https://media0.faz.net/ppmedia/aktuell/politik/3214903802/1.10453600/facebook_teaser/eine-f-16-der-ukrainischen.jpg,2025-05-03T05:43:23Z,https://web.archive.org/web/20250503102743/https://www.faz.net/aktuell/politik/ukraine/ukraine-liveblog-us-regierung-will-ukraine-bei-f-16-unterstuetzen-110172806.html,"US-Vizepräsident JD Vance hat in einem Interview mit Fox News erklärt, der Krieg in der Ukraine werde aus seiner Sicht nicht in absehbarer Zeit enden. Es liege nun an den Russen und Ukrainern, da jed… [+862 chars]",,de,'Selenskyj'
https://www.diepresse.com/19644478/serbiens-praesident-aleksandar-vucic-nach-usa-reise-im-krankenhaus,https://www.diepresse.com/19644478/serbiens-praesident-aleksandar-vucic-nach-usa-reise-im-krankenhaus,0,www.diepresse.com,Serbiens Präsident Aleksandar Vučić nach USA-Reise im Krankenhaus,Ein „Unwohlsein“ des Politikers führte zu einer Verkürzung des Besuchs bei US-Präsident Donald Trump. Vučić wurde in ein Militärkrankenhaus eingeliefert.,https://img.diepresse.com/public/incoming/57pten-FILES-US-SERBIA-POLITICS-DIPLOMACY/alternates/DPR_SOCIAL_NACHRICHTEN/FILES-US-SERBIA-POLITICS-DIPLOMACY,2025-05-03T14:32:45Z,https://web.archive.org/web/20250503171940/https://www.diepresse.com/19644478/serbiens-praesident-aleksandar-vucic-nach-usa-reise-im-krankenhaus,"Ein Unwohlsein des Politikers führte zu einer Verkürzung des Besuchs bei US-Präsident Donald Trump. Vui wurde in ein Militärkrankenhaus eingeliefert.
Unmittelbar nach seiner Rückkehr aus den USA ist… [+559 chars]",,de,'Aleksandar Vučić'
https://www.faz.net/aktuell/politik/ukraine/ukraine-liveblog-xi-zu-viertaegigem-besuch-in-moskau-erwartet-110172806.html,https://www.faz.net/aktuell/politik/ukraine/ukraine-liveblog-xi-zu-viertaegigem-besuch-in-moskau-erwartet-110172806.html,0,www.faz.net,Ukraine Liveblog: Xi zu viertägigem Besuch in Moskau erwartet,Teilnahme an Siegesfeier geplant +++ Abermals russische Drohnenangriffen auf Kiew +++ Bundeswehr übernimmt erste Komponenten von Flugabwehr Arrow +++ alle Entwicklungen im Liveblog,https://media0.faz.net/ppmedia/aktuell/politik/ukraine/41569421/1.10454768/facebook_teaser/xi-jinping-und-wladimir-putin.jpg,2025-05-04T10:06:15Z,https://web.archive.org/web/20250504103530/https://www.faz.net/aktuell/politik/ukraine/ukraine-liveblog-xi-zu-viertaegigem-besuch-in-moskau-erwartet-110172806.html,"Der ukrainische Präsident Wolodymyr Selenskyj wirft Russland vor, keine Waffenruhe im Krieg gegen sein Land anzustreben. Im Moment sieht niemand eine solche Bereitschaft von Russland, sagte Selenskyj… [+984 chars]",,de,'nan nan'
https://www.bild.de/unterhaltung/stars-und-leute/christian-lindner-unfalldrama-er-fuhr-hund-von-star-produzent-tot-68173a1710132913ef60d7ae,https://www.bild.de/unterhaltung/stars-und-leute/christian-lindner-unfalldrama-er-fuhr-hund-von-star-produzent-tot-68173a1710132913ef60d7ae,0,www.bild.de,Unfalldrama in Berlin - Christian Lindner überfährt Hund von Starproduzent,Ex-Finanzminister Christian Lindner in tragischem Unfall verwickelt. Dabei starb der Hund eines bekannten Berliner Filmproduzenten.,"https://images.bild.de/68173a1710132913ef60d7ae/25d67444a2e548e8c5bf57aab56feb4f,930f98a3?w=1280",2025-05-04T18:03:38Z,http://archive.md/20250504180554/https://www.bild.de/unterhaltung/stars-und-leute/christian-lindner-unfalldrama-er-fuhr-hund-von-star-produzent-tot-68173a1710132913ef60d7ae,"FDP-Chef Christian Lindner fährt Hund von Star-Produzent tot
FDP-Chef Christian Lindner fährt Hund von Star-Produzent tot
FDP-Chef Christian Lindner fährt Hund von Star-Produzent tot
FDP-Chef Chri… [+418 chars]",,de,'Christian Lindner'
https://www.faz.net/aktuell/gesellschaft/ungluecke/christian-lindner-ueberfuhr-wohl-kleinen-hund-mit-mini-110456249.html,https://www.faz.net/aktuell/gesellschaft/ungluecke/christian-lindner-ueberfuhr-wohl-kleinen-hund-mit-mini-110456249.html,0,www.faz.net,Christian Lindner überfuhr wohl kleinen Hund mit Mini,Der ehemalige Finanzminister soll beim Einparken an einem Berliner Restaurant versehentlich einen kleinen Hund überfahren haben. Für das Tier kam jede Hilfe zu spät.,https://media1.faz.net/ppmedia/aktuell/politik/1662196897/1.10456261/facebook_teaser/christian-lindner-bei-einer.jpg,2025-05-05T07:08:09Z,http://archive.md/20250505072413/https://www.faz.net/aktuell/gesellschaft/ungluecke/christian-lindner-ueberfuhr-wohl-kleinen-hund-mit-mini-110456249.html,"Der frühere Finanzminister Christian Lindner (FDP) soll in Berlin in einen Unfall verwickelt gewesen sein. Wie Bild berichtet, überfuhr Lindner auf dem Parkplatz einer Gaststätte im Berliner Westen v… [+982 chars]",,de,'Christian Lindner'
https://www.sueddeutsche.de/panorama/promis-news-christian-lindner-hund-unfall-lady-gaga-konzert-anschlag-bohlen-ortsschild-li.3246903,https://www.sueddeutsche.de/panorama/promis-news-christian-lindner-hund-unfall-lady-gaga-konzert-anschlag-bohlen-ortsschild-li.3246903,0,www.sueddeutsche.de,"Leute: „Es tut mir sehr leid, dass der Hund gestorben ist“",Christian Lindner hat wohl aus Versehen den Hund eines Filmproduzenten überfahren. Lady Gaga reagiert auf einen vereitelten Anschlag auf ihr Konzert. Und Dieter Bohlen vermisst sein Ortsschild.,https://www.sueddeutsche.de/2025/02/23/1c63d747-c28e-4e96-9a86-067a8522840e.jpeg?q=60&fm=webp&width=1200&rect=0%2C156%2C3000%2C1687,2025-05-05T11:43:32Z,https://web.archive.org/web/20250505133448/https://www.sueddeutsche.de/panorama/promis-news-christian-lindner-hund-unfall-lady-gaga-konzert-anschlag-bohlen-ortsschild-li.3246903,"Christian Lindner, 46, ehemaliger Finanzminister, hat offenbar einen Hund totgefahren. Lindner habe auf dem Parkplatz eines italienischen Restaurants im Berliner Westen mit seinem Mini einen Hund erw… [+2784 chars]",,de,'Christian Lindner'
https://www.focus.de/politik/deutschland/eliteforscher-michael-hartmann-im-merz-kabinett-setzt-sich-bedenklicher-trend-fort-ueber-den-kaum-jemand-spricht_7fec0408-0aa4-4d11-b9a8-7a38d332cf0e.html,https://www.focus.de/politik/deutschland/eliteforscher-michael-hartmann-im-merz-kabinett-setzt-sich-bedenklicher-trend-fort-ueber-den-kaum-jemand-spricht_7fec0408-0aa4-4d11-b9a8-7a38d332cf0e.html,0,www.focus.de,Eliteforscher Michael Hartmann: Im Merz'-Kabinett setzt sich ein bedenklicher Trend fort,Die neue Bundesregierung unter Friedrich Merz sorgt für Diskussionen: Zwei Topmanager und gleich vier Mitglieder aus Politikerfamilien sind im Kabinett vertreten. Soziologe und Eliteforscher Michael Hartmann beleuchtet die Konsequenzen für die politische Repr…,https://quadro.burda-forward.de/ctf/ab66ca40-002a-47f6-a3bc-c3dc17204ec6.ccfb88ef-9218-48da-80c2-92d4d5f1db61.jpg?im=RegionOfInterestCrop%3D%281200%2C630%29%2CregionOfInterest%3D%28495%2C249%29&hash=81ab62de6f666ffc6682a4da41c32ff990970a8f3cbcbdc441801b533719de3a,2025-05-05T12:01:08Z,https://web.archive.org/web/20250505184516/https://www.focus.de/politik/deutschland/eliteforscher-michael-hartmann-im-merz-kabinett-setzt-sich-bedenklicher-trend-fort-ueber-den-kaum-jemand-spricht_7fec0408-0aa4-4d11-b9a8-7a38d332cf0e.html,"Das neue Bundeskabinett unter Friedrich Merz weist gleich zwei Besonderheiten auf, die es deutlich von allen anderen Regierungskabinetten seit 1949 unterscheiden. Die erste Besonderheit wird in den M… [+12234 chars]",,de,'Daniel Penny'
https://www.tagesspiegel.de/berlin/james-bond-als-keramik-kunstler-berliner-designerin-stefanie-hering-stellt-vasen-mit-pierce-brosnan-her-13604530.html,https://www.tagesspiegel.de/berlin/james-bond-als-keramik-kunstler-berliner-designerin-stefanie-hering-stellt-vasen-mit-pierce-brosnan-her-13604530.html,0,www.tagesspiegel.de,James Bond als Keramik-Künstler : Berliner Designerin Stefanie Hering stellt Vasen mit Pierce Brosnan her,Die Porzellan-Designerin und der Schauspieler fanden in Miami zu einer Kooperation zusammen. Ihre Vasen gibt es in limitierter Auflage in einer Berliner Villa zu kaufen.,https://www.tagesspiegel.de/images/13641025/alternates/BASE_16_9_W1400/1746450479000/stefanie-hering.jpeg,2025-05-05T14:02:12Z,,"Im Alter von 16 Jahren begann Pierce Brosnan als Kunstmaler zu arbeiten. Eine große Schauspielkarriere hielt den späteren James Bond-Darsteller nicht davon ab, die frühe Leidenschaft weiterzuverfolge… [+5306 chars]",,de,'Charles Koch'
https://www.tagesspiegel.de/berlin/christian-lindner-uberfahrt-berliner-hund-das-opfer-ist-nicht-unbekannt-13641559.html,https://www.tagesspiegel.de/berlin/christian-lindner-uberfahrt-berliner-hund-das-opfer-ist-nicht-unbekannt-13641559.html,0,www.tagesspiegel.de,Christian Lindner überfährt Berliner Hund : Das Opfer ist nicht unbekannt,Beim Einparken seines Minis über der ehemalige Finanzminister einen kleinen Vierbeiner. Das Drama ereignete sich vor einem Italiener im Berliner Westen.,https://www.tagesspiegel.de/images/13642195/alternates/BASE_16_9_W1400/1746456267000/potsdam-brandenburg-deutschland-09-02-2025-metropolishalle-au-erordentlicher-fdp-bundesparteitag-2025-christian-li.jpeg,2025-05-05T14:46:42Z,http://archive.md/20250505192807/https://www.tagesspiegel.de/berlin/christian-lindner-uberfahrt-berliner-hund-das-opfer-ist-nicht-unbekannt-13641559.html,"Christian Lindner hat es nicht leicht dieser Tage. Der ehemalige Bundesfinanzminister und immer noch FDP-Chef ist nicht nur formal arbeitslos, sondern jetzt auch noch Verursacher eines tragischen Unf… [+2984 chars]",,de,'nan nan'
https://www.tagesspiegel.de/politik/regierungswechsel-vaterpflichten-lindner-nicht-beim-zapfenstreich-fur-scholz-13643227.html,https://www.tagesspiegel.de/politik/regierungswechsel-vaterpflichten-lindner-nicht-beim-zapfenstreich-fur-scholz-13643227.html,0,www.tagesspiegel.de,Regierungswechsel: Vaterpflichten: Lindner nicht beim Zapfenstreich für Scholz,Der frühere Finanzminister Christian Lindner ist kürzlich Vater geworden. Für ihn gibt es da Wichtigeres als den großen Zapfenstreich für Olaf Scholz.,https://www.tagesspiegel.de/images/13643224/alternates/BASE_16_9_W1400/1746472503000/christian-lindner.jpeg,2025-05-05T19:15:03Z,,Vaterpflichten gehen vor: Der frühere Bundesfinanzminister Christian Lindner (FDP) hat familiäre Gründe für sein Fehlen beim großen Zapfenstreich für den scheidenden Bundeskanzler Olaf Scholz (SPD) a… [+697 chars],,de,'Christian Lindner'
https://www.bild.de/unterhaltung/stars-und-leute/franca-lehfeldt-erster-auftritt-nach-babyglueck-68191feb93978f22600273d9,https://www.bild.de/unterhaltung/stars-und-leute/franca-lehfeldt-erster-auftritt-nach-babyglueck-68191feb93978f22600273d9,0,www.bild.de,Franca Lehfeldt - Erster Auftritt nach Babyglück!,Franca Lehfeldt begeistert beim „9:16-Summit“ im Hamburger Schauspielhaus mit ihrem ersten Auftritt nach der Geburt ihrer Tochter.,"https://images.bild.de/68191feb93978f22600273d9/d934c413af7d0ce2749df3a56105c24f,990fd039?w=1280",2025-05-05T21:30:28Z,https://web.archive.org/web/20250505222735/http://www.bild.de/unterhaltung/stars-und-leute/franca-lehfeldt-erster-auftritt-nach-babyglueck-68191feb93978f22600273d9,"Noch keine vier Wochen ist es her, dass Moderatorin Franca Lehfeldt und der ehemalige Bundesfinanzminister Christian Lindner Eltern eines kleinen Mädchens wurden. Am Montagabend trat die Journalistin… [+2639 chars]",,de,'Christian Lindner'
https://www.stern.de/lifestyle/leute/vier-wochen-nach-der-geburt--franca-lehfeldt-ist-zurueck-aus-der-babypause-35697006.html,https://www.stern.de/lifestyle/leute/vier-wochen-nach-der-geburt--franca-lehfeldt-ist-zurueck-aus-der-babypause-35697006.html,0,www.stern.de,Vier Wochen nach der Geburt: Franca Lehfeldt ist zurück aus der Babypause,Vier Wochen nach der Geburt ist Franca Lehfeldt zurück in der Öffentlichkeit. Christian Lindners Frau nahm in Hamburg an einem Panel teil.,https://image.stern.de/35697010/t/Px/v1/w1440/r1.7778/-/06--franca-lehfeldt-ist-zurueck-aus-der-babypause---16-9---spoton-article-1096241.jpg,2025-05-06T07:10:00Z,https://web.archive.org/web/20250506083519/https://www.stern.de/lifestyle/leute/vier-wochen-nach-der-geburt--franca-lehfeldt-ist-zurueck-aus-der-babypause-35697006.html,"Kopiere den aktuellen Link
Zur Merkliste hinzufügen
Vier Wochen nach der Geburt ist Franca Lehfeldt zurück in der Öffentlichkeit. Christian Lindners Frau nahm in Hamburg an einem Panel teil.
Franc… [+2017 chars]",,de,'Christian Lindner'
