index,url,valid,domain,title,description,image,published,archive,content,quote,language,keyword
https://www.telepolis.de/features/Ukraine-und-die-US-Demokraten-Wie-Joe-Biden-einen-Whistleblower-zum-Schweigen-brachte-9712234.html,https://www.telepolis.de/features/Ukraine-und-die-US-Demokraten-Wie-Joe-Biden-einen-Whistleblower-zum-Schweigen-brachte-9712234.html,0,www.telepolis.de,Ukraine und die US-Demokraten: Wie Joe Biden einen Whistleblower zum Schweigen brachte,Welche Rolle spielte die Ukraine beim Amtsenthebungsverfahren gegen Trump. Der Whistleblower Telischenko könnte für Aufklärung sorgen. Doch er geriet selbst ins Visier. (Teil 4 und Schluss),https://heise.cloudimg.io/bound/1200x1200/q85.png-lossy-85.webp-lossy-85.foil1/_www-heise-de_/imgs/18/4/5/8/6/9/3/8/Bildschirmfoto_2024-05-08_um_11-d752e1dc31f7a166.png,2024-05-08T10:00:00Z,,"Kämpft um seine Reputation: Andrii Telischenko. Bild: privat
Die Ukraine und das Impeachment gegen Trump. Ein Whistleblower könnte für Aufklärung sorgen. Doch er geriet selbst ins Visier. (Teil 4 un… [+10247 chars]",,de,'Joe Biden'
https://www.stern.de/kultur/bafta-tv-awards--preisverleihung-ohne-prinz-william-34698532.html,https://www.stern.de/kultur/bafta-tv-awards--preisverleihung-ohne-prinz-william-34698532.html,0,www.stern.de,BAFTA TV Awards: Preisverleihung ohne Prinz William,Am kommenden Sonntag (12. Mai) werden in London die British Academy Television Awards verliehen. Prinz William wird wohl nicht dabei sein.,https://image.stern.de/34698536/t/3f/v1/w1440/r1.7778/-/09--preisverleihung-ohne-prinz-william---16-9---spoton-article-1066526.jpg,2024-05-09T13:16:00Z,,"Am kommenden Sonntag (12. Mai) werden in London die British Academy Television Awards verliehen. Prinz William wird wohl nicht dabei sein.
Seit 2010 ist Prinz William (41) der Präsident der British … [+1673 chars]",,de,'Prinz William'
… [+5451 chars],,de,'Helmut Kohl',,,,,,,,,
