index,url,valid,domain,title,description,image,published,archive,content,quote,language,keyword
https://www.zeit.de/politik/ausland/2024-07/usa-donald-trump-dokumentenaffaere-immunitaet-urteil-aussetzung-verfahren,https://www.zeit.de/politik/ausland/2024-07/usa-donald-trump-dokumentenaffaere-immunitaet-urteil-aussetzung-verfahren,0,www.zeit.de,Nach Immunitäts-Urteil: Donald Trump fordert Aussetzung von Verfahren um Geheimdokumente,Die Anwälte von Donald Trump fordern eine teilweise Aussetzung des Verfahrens um illegal gelagerte Amtsdokumente. Mit einer ähnlichen Forderung hatten sie bereits Erfolg.,https://img.zeit.de/politik/ausland/2024-07/usa-donald-trump-dokumentenaffaere-immunitaet-urteil-aussetzung-verfahren-bild-2/wide__1300x731,2024-07-06T04:17:05Z,,Die Anwälte des früheren US-Präsidenten Donald Trump haben eine teilweise Aussetzung des Verfahrens gegen den 78-Jährigen wegen der Mitnahme geheimer Regierungsdokumente in sein Privatanwesen beantra… [+2509 chars],,de,'Stormy Daniels'
https://www.morgenpost.de/politik/article406737927/irans-neuer-praesident-mehr-als-nur-liberales-feigenblatt.html,https://www.morgenpost.de/politik/article406737927/irans-neuer-praesident-mehr-als-nur-liberales-feigenblatt.html,0,www.morgenpost.de,Irans neuer Präsident: Mehr als nur liberales Feigenblatt?,Herzchirurg Massud Peseschkian gilt als Reformer. Aber er hat dem Obersten Führer Ali Chamenei Loyalität geschworen. Bringt er Wandel?,https://img.sparknews.funkemedien.de/406737943/406737943_1720250419_v16_9_1600.jpeg,2024-07-06T07:20:20Z,,"Berlin. Herzchirurg Massud Peseschkian gilt als Reformer. Aber er hat dem Obersten Führer Ali Chamenei Loyalität geschworen. Bringt er Wandel?
Massud Peseschkian hatte bis vor Kurzem niemand auf dem… [+6198 chars]",,de,'Ali Chamenei'
https://www.zeit.de/video/2024-07/6356826455112/iran-massud-peseschkian-gewinnt-praesidentschaftswahl-im-iran,https://www.zeit.de/video/2024-07/6356826455112/iran-massud-peseschkian-gewinnt-praesidentschaftswahl-im-iran,0,www.zeit.de,Iran: Massud Peseschkian gewinnt Präsidentschaftswahl im Iran,In der Stichwahl um das Präsidentenamt im Iran hat Massud Peseschkian gesiegt. Auch der neue Präsident ist loyal gegenüber dem geistlichen Oberhaupt Ali Chamenei.,https://img.zeit.de/video/2024-07/6356826455112-still/wide__1300x731,2024-07-06T10:32:26Z,,"Schließen
Hier können Sie interessante Artikel speichern, um sie später zu lesen und wiederzufinden.
Sie haben bereits ein Konto?
 Hier anmelden.",,de,'Ali Chamenei'
https://orf.at/stories/3362780/,https://orf.at/stories/3362780/,0,orf.at,Zweifel an Biden bleiben bestehen,"US-Präsident Joe Biden hat sich in einem TV-Interview darum bemüht, die Zweifel an seiner Eignung als Präsidentschaftskandidat auszuräumen – doch sie bleiben bestehen. Biden sei „gefährlich entfremdet von den Sorgen der Menschen“ und befinde sich „in einer Bl…",https://ibs.orf.at/news?image=https%3A%2F%2Fassets.orf.at%2Fmims%2F2024%2F27%2F80%2Fcrops%2Fw%3D1200%2Ch%3D630%2Cq%3D75%2F2270171_master_863380_us_wahl_biden_interview_reax_afp.jpg%3Fs%3D0173a3c78393dedae6f309af5fe537821597f121,2024-07-06T20:59:39Z,,"Man sieht wirklich einen Präsidenten, der die Augen vor der Wahrheit verschließt und in einer Blase steckt, wird Castro, ehemaliger Wohnungsbauminister, der 2020 gegen Biden um die Nominierung der De… [+6483 chars]",,de,'Joe Biden'
https://www.bild.de/unterhaltung/stars-und-leute/taylor-swift-und-travis-kelce-sein-bruder-macht-baby-druck-668a381024dc253d505a2c24,https://www.bild.de/unterhaltung/stars-und-leute/taylor-swift-und-travis-kelce-sein-bruder-macht-baby-druck-668a381024dc253d505a2c24,0,www.bild.de,Baby Nummer vier in Planung - Kelce-Bruder macht Taylor Baby-Druck,"Der Familienclan könnte größer werden, doch ob Swift die nächste schwangere Kelce-Frau wird? Kylie Kelce deutete jetzt an, dass sie sich ein viertes Kind vorstellen kann.","https://images.bild.de/668a381024dc253d505a2c24/1b8bf6b02ef088ac01471f8ceb3ea297,f27f7ccf?w=1280",2024-07-07T10:17:22Z,,"Wann kommt endlich das Mini-Swiftie? Seit einem Jahr schweben Taylor Swift (34) und Travis Kelce (34) auf Wolke Sieben. Fans warten sehnsüchtig auf eine Verlobung UND ein Baby!
Was das Paar selbst ü… [+1838 chars]",,de,'Taylor Swift'
https://www.faz.net/aktuell/stil/trends-nischen/lily-gladstone-im-interview-spaetestens-in-seattle-wurde-mir-mein-aussenseiter-dasein-bewusst-19833363.html,https://www.faz.net/aktuell/stil/trends-nischen/lily-gladstone-im-interview-spaetestens-in-seattle-wurde-mir-mein-aussenseiter-dasein-bewusst-19833363.html,0,www.faz.net,Lily Gladstone im Interview: „Spätestens in Seattle wurde mir mein Außenseiter-Dasein bewusst“,"Wie hat die Oscarnominierung für „Killers of the Flower Moon“ sich auf die Karriere der indigenen Schauspielerin Lily Gladstone ausgewirkt? Darüber spricht sie im Interview und erzählt, warum Star Wars sie zum Film brachte.",https://media0.faz.net/ppmedia/aktuell/feuilleton/95983100/1.9833378/facebook_teaser/lily-gladstone-bei-der.jpg,2024-07-07T13:34:47Z,,"Frau Gladstone, wir sitzen hier beim Filmfestival in Cannes, genau zwölf Monate nachdem dort Killers of the Flower Moon Weltpremiere feierte. Ein Jahr, in dem sich Ihr Leben oder mindestens Ihre Karr… [+8567 chars]",,de,'Lily Gladstone'
https://www.sueddeutsche.de/muenchen/muenchen-symposium-bavaricum-hubert-aiwanger-wolfgang-pfoerringer-lux.XRepZCFkaj913GZ2cbXQpw,https://www.sueddeutsche.de/muenchen/muenchen-symposium-bavaricum-hubert-aiwanger-wolfgang-pfoerringer-lux.XRepZCFkaj913GZ2cbXQpw,0,www.sueddeutsche.de,Symposium Bavaricum: Smoothie-Verbot im Augustinerkeller,"Beim „Symposium Bavaricum“ versammelt sich die Münchner Gesellschaft zum sommerlichen Derblecken. Die Ampel muss ganz schön einstecken, und Hubert Aiwanger versucht sich als Kabarettist. Ob das gut geht?",https://www.sueddeutsche.de/2024/07/07/8e3aa240-b530-4133-b279-238c7a4075e5.jpeg?q=60&fm=webp&width=1200&rect=0%2C70%2C3791%2C2132,2024-07-07T13:39:01Z,,"Wen die Organisatoren die Medizinerfamilie Pförringer und die Unternehmerfamilie Inselkammer da alles mit formvollendet angetäuschtem Schmatz begrüßen dürfen! Gastronomen, Anwälte, Museumsdirektoren.… [+5765 chars]",,de,'Hubert Aiwanger'
https://www.bild.de/unterhaltung/stars-und-leute/vito-schnabel-seine-neue-sieht-aus-wie-ex-freundin-irina-shayk-668a5dd3935d586554d90268,https://www.bild.de/unterhaltung/stars-und-leute/vito-schnabel-seine-neue-sieht-aus-wie-ex-freundin-irina-shayk-668a5dd3935d586554d90268,0,www.bild.de,DAS neue Glamour-Couple - Vitos Neue sieht aus wie seine Alte!,"Am Dienstag soll die Trauung auf einem New Yorker Standesamt stattfinden. Was sofort auffällt: Vito Schnabels Braut sieht aus wie seine Ex-Flamme, Supermodel Irina Shayk.","https://images.bild.de/668a5dd3935d586554d90268/08cee470c28a5e806db6bf93d6357570,f755e3f3?w=1280",2024-07-07T15:52:52Z,,"Braune lange Haare, sinnliche Lippen, Schlafzimmerblick. Ein Beuteschema wie aus dem Bilderbuch oder Model-Katalog ... Kunsthändler Vito Schnabel (37) scheint seinem Typ Frau inzwischen so sehr treu … [+2560 chars]",,de,'Irina Shayk'
https://www.focus.de/kultur/stars/kunst-und-hochzeitsplaene-vito-schnabel-das-macht-heidi-klums-ex-heute_id_260118239.html,https://www.focus.de/kultur/stars/kunst-und-hochzeitsplaene-vito-schnabel-das-macht-heidi-klums-ex-heute_id_260118239.html,0,www.focus.de,Kunst und Hochzeitspläne - Vito Schnabel: Das macht Heidi Klums Ex heute,Vito Schnabel hat eine berühmte Ex-Freundin: Vor vielen Jahren war er einmal mit Heidi Klum liiert. Heute hat der Kunsthändler ein neues Model an seiner Seite und sogar schon Hochzeitspläne geschmiedet.Von FOCUS-online-Autorin Juliane Neutsch,https://p6.focus.de/img/kultur/id_260118237/vito-schnabel.jpg?im=Crop%3D%280%2C62%2C2000%2C1000%29%3BResize%3D%281200%2C627%29&impolicy=perceptual&quality=mediumHigh&hash=5e7ae83a39664445c3db455c1e9b376254e6acc9ebf8b27ef46a3ebea63ad8ba,2024-07-08T10:47:55Z,,Vito Schnabel hat eine berühmte Ex-Freundin: Vor vielen Jahren war er einmal mit Heidi Klum liiert. Heute hat der Kunsthändler ein neues Model an seiner Seite und sogar schon Hochzeitspläne geschmied… [+1712 chars],,de,'Heidi Klum'
https://www.sueddeutsche.de/bayern/bayern-spessart-biosphaerenreservat-hubert-aiwanger-lux.P8tzqJy7ZhHmmsYhgBmXWF,https://www.sueddeutsche.de/bayern/bayern-spessart-biosphaerenreservat-hubert-aiwanger-lux.P8tzqJy7ZhHmmsYhgBmXWF,0,www.sueddeutsche.de,Politik: Zornige Briefe an Hubert Aiwanger,Nach seinem umstrittenen Auftritt im Spessart bekommt der Vize-Ministerpräsident jetzt erboste Post von Lokalpolitikern – auch seine Parteifreunde verbitten sich „solche Einmischungen von außen“.,https://www.sueddeutsche.de/2024/07/08/448c25f4-21ce-4e25-91f8-06c428bd6bb9.jpeg?q=60&fm=webp&width=1200&rect=0%2C0%2C4000%2C2250,2024-07-08T14:11:44Z,,Nach seinem umstrittenen Auftritt im Spessart bekommt der Vize-Ministerpräsident jetzt erboste Post von Lokalpolitikern auch seine Parteifreunde verbitten sich solche Einmischungen von außen. Neulich… [+681 chars],,de,'Hubert Aiwanger'
https://www.faz.net/aktuell/politik/us-wahl/wahl-in-usa-ranghohe-demokraten-wollen-dass-joe-biden-zurueckzieht-19842626.html,https://www.faz.net/aktuell/politik/us-wahl/wahl-in-usa-ranghohe-demokraten-wollen-dass-joe-biden-zurueckzieht-19842626.html,0,www.faz.net,"Ranghohe Demokraten: Sie wollen, dass Biden zurückzieht",Eineinhalb Wochen nach dem schwachen Fernsehauftritt gegen Donald Trump schwindet die Unterstützung durch die Demokraten im Kongress. Doch Joe Biden stellt sich taub.,https://media1.faz.net/ppmedia/aktuell/politik/2428113758/1.9842897/facebook_teaser/us-praesident-joe-biden-am-07.jpg,2024-07-08T16:57:15Z,,"Es war ein Auftritt nach dem Geschmack von Bidens Wahlkampfteam. Kirchgänger aus einer wichtigen Wählergruppe, die zwischendurch Wir lieben Sie, Präsident Biden skandierten, überschwängliches Lob vom… [+3776 chars]",,de,'John Fetterman'
https://www.stern.de/news/dutzende-tote-bei-russischen-angriffen-auf-die-ukraine---kinderklinik-getroffen-34862094.html,https://www.stern.de/news/dutzende-tote-bei-russischen-angriffen-auf-die-ukraine---kinderklinik-getroffen-34862094.html,0,www.stern.de,Dutzende Tote bei russischen Angriffen auf die Ukraine - Kinderklinik getroffen,"Russland hat in einer massiven Angriffswelle dutzende Raketen auf ukrainische Städte abgefeuert und dabei auch ein Kinderkrankenhaus in der Hauptstadt Kiew getroffen. Landesweit kamen am Montag Behördenangaben zufolge mindestens 36 Menschen ums Leben, weitere…",https://image.stern.de/34864056/t/I7/v1/w1440/r1.7778/-/08--mitglied-der-rettungskraefte-neben-dem--krankenhaus-in-kiew---52bf1a178a9d3a9e.jpg,2024-07-08T17:11:49Z,,Russland hat in einer massiven Angriffswelle dutzende Raketen auf ukrainische Städte abgefeuert und dabei auch ein Kinderkrankenhaus in der Hauptstadt Kiew getroffen. Landesweit kamen am Montag Behör… [+4600 chars],,de,'António Guterres'
https://www.freitag.de/autoren/linkerhand/jean-luc-melenchon-raphael-glucksmann-frankreichs-linke-kaempft-um-die-macht,https://www.freitag.de/autoren/linkerhand/jean-luc-melenchon-raphael-glucksmann-frankreichs-linke-kaempft-um-die-macht,0,www.freitag.de,"Frankreichs Wahl | Wie regieren, und mit wem? So beginnt in Frankreich der linke Kampf um die Macht","Bleibt die neue Volksfront eine Einheit? Jean-Luc Mélenchon ist von den Konservativen als stalinistischer Volkstribun verschrien, der Sozialist Raphaël Glucksmann schielt in die Mitte. Die Grünen wollen einen Moderator Jubel erfüllt den grauen sonntäglichen A…",https://www.freitag.de/autoren/linkerhand/jean-luc-melenchon-raphael-glucksmann-frankreichs-linke-kaempft-um-die-macht/@@images/social_image,2024-07-10T02:00:00Z,,"Jubel erfüllt den grauen sonntäglichen Abendhimmel. Freudenschreie und Applaus ertönen auf den Straßen und von den Café-Terrassen, auf der Pariser Place de la République ebenso wie am Alten Hafen von… [+8213 chars]",,de,'Jean-Luc Mélenchon'
https://de.catholicnewsagency.com/news/16105/peter-seewald-mit-marx-und-engels-im-gefangnis-mit-benedikt-xvi-zuruck-zur-kirche,https://de.catholicnewsagency.com/news/16105/peter-seewald-mit-marx-und-engels-im-gefangnis-mit-benedikt-xvi-zuruck-zur-kirche,0,de.catholicnewsagency.com,"Peter Seewald: Mit Marx und Engels im Gefängnis, mit Benedikt XVI. zurück zur Kirche","Am heutigen Mittwoch feiert Peter Seewald seinen 70. Geburtstag. Einst landete er als kommunistischer Straßenkämpfer im Gefängnis, wurde Journalist bei renommierten Zeitungen und fand auch durch die Gespräche mit Kardinal Joseph Ratzinger, dem späteren Papst …",https://de.catholicnewsagency.com/image/peter-seewald-benedikt-xvi_1720189579.jpg?w=1150&jpg,2024-07-10T05:00:00Z,,"München -
 Mittwoch, 10. Juli 2024, 7:00 Uhr.
Am heutigen Mittwoch feiert Peter Seewald seinen 70. Geburtstag. Einst landete er als kommunistischer Straßenkämpfer im Gefängnis, wurde Journalist bei… [+29861 chars]",,de,'Joseph Ratzinger'
https://www.faz.net/aktuell/politik/inland/kritik-an-hubert-aiwanger-streit-um-biosphaeren-reservat-spessart-19847671.html,https://www.faz.net/aktuell/politik/inland/kritik-an-hubert-aiwanger-streit-um-biosphaeren-reservat-spessart-19847671.html,0,www.faz.net,Streit in Bayern: Kommunen fühlen sich von Hubert Aiwanger bevormundet,"Aiwanger sieht sich als Anwalt der Kommunen. Im Streit über ein Biosphärenreservat im Spessart hat er sie nun aber gegen sich aufgebracht. Er lasse jeglichen Respekt vermissen, heißt es in einem Brief.",https://media0.faz.net/ppmedia/aktuell/politik/441180947/1.9847670/facebook_teaser_fplus/bayerns-wirtschaftsminister.jpg,2024-07-10T16:02:56Z,,"Der bayerische Wirtschaftsminister Hubert Aiwanger war Anfang Juli im Spessart, wo derzeit über die Einrichtung einer Biosphärenregion debattiert wird. Der Minister, zuständig auch für die Bayerische… [+135 chars]",,de,'Hubert Aiwanger'
https://taz.de/Frankreich-nach-der-Wahl/!6019771/,https://taz.de/Frankreich-nach-der-Wahl/!6019771/,0,taz.de,Frankreich nach der Wahl: Ringen um Regierungsbildung,"Staatspräsident Emmanuel Macron wendet sich in einem offenen Brief an die Französ*innen. Er wünscht sich eine breite, gemäßigte Koalition.",https://taz.de/picture/7114583/948/35774981-1.jpeg,2024-07-11T11:48:00Z,,"Staatspräsident Emmanuel Macron wendet sich in einem offenen Brief an die Französ*innen. Er wünscht sich eine breite, gemäßigte Koalition.
Abgeordnete der Nouveau Front Populaire und von La France I… [+3813 chars]",,de,'Fabien Roussel'
https://www.kino.de/film/the-substance-2024/news/body-horror-in-einer-neuen-form-erster-verstoerender-trailer-zu-the-substance-mit-demi-moore/,https://www.kino.de/film/the-substance-2024/news/body-horror-in-einer-neuen-form-erster-verstoerender-trailer-zu-the-substance-mit-demi-moore/,0,www.kino.de,Body-Horror in einer neuen Form: Erster verstörender Trailer zu „The Substance“ mit Demi Moore,Zum kommenden Body-Horror „The Substance“ mit Demi Moore und Margaret Qualley in den Hauptrollen ist ein erster Teaser-Trailer erschienen. Und der rockt!,https://crops.giga.de/ef/aa/f3/68e351f2b8750853fe8dce13f9_YyAxNzg3eDEwMDUrMzg1KzMyAnJlIDE5MjAgMTA4MANlYTYzZjgwMzhlZg==.jpg,2024-07-11T22:31:18Z,,"Zum kommenden Body-Horror „The Substance“ mit Demi Moore und Margaret Qualley in den Hauptrollen ist ein erster Teaser-Trailer erschienen. Und der rockt!
Die Internationalen Filmfestspiele von Canne… [+3732 chars]",,de,'Demi Moore'
https://www.zeit.de/politik/ausland/2024-07/frankreich-gabriel-attal-emmanuel-macron-renaissance-fraktion-parlamentswahl,https://www.zeit.de/politik/ausland/2024-07/frankreich-gabriel-attal-emmanuel-macron-renaissance-fraktion-parlamentswahl,0,www.zeit.de,Frankreich: Französischer Regierungschef Attal tritt zur Wahl als Fraktionschef an,Gabriel Attal will Extremisten aus der Regierung halten – und die Fraktion seiner Partei in der Nationalversammlung anführen. Zudem plant er die Umbenennung der Fraktion.,https://img.zeit.de/politik/ausland/2024-07/frankreich-gabriel-attal-emmanuel-macron-renaissance-fraktion-parlamentswahl-bild/wide__1300x731,2024-07-12T20:32:52Z,,Knapp eine Woche nach der zweiten Runde der Parlamentswahl in Frankreich tritt Premierminister Gabriel Attal bei der Wahl zum Fraktionsvorsitzenden von Renaissance in der Nationalversammlung an. Die … [+4103 chars],,de,'Gabriel Attal'
