index,url,valid,domain,title,description,image,published,archive,content,quote,language,keyword
https://www.stern.de/lifestyle/leute/vip-news--margot-robbie-aeussert-sich-zu-den-oscar-nominierungen-3205306.html,https://www.stern.de/lifestyle/leute/vip-news--margot-robbie-aeussert-sich-zu-den-oscar-nominierungen-3205306.html,0,www.stern.de,"Leute von heute: Margot Robbie äußert sich erstmals zu den verpassten Oscar-Nominierungen für ""Barbie""","Die ""Barbie""-Darstellerin Margot Robbie hat sich erstmals zu dem Wirbel um die ausbleibenden Oscar-Nominierungen für sie und Regisseurin Greta Gerwig geäußert. Diese und weitere Promi-Meldungen in den VIP-News.",https://image.stern.de/34419382/t/on/v2/w1440/r1.7778/-/margot-robbie.jpg,2024-02-01T10:58:00Z,,"Von ""A"" wie Angelina Jolie oder Amal Clooney über ""H"" wie Heidi Klum und Helene Fischer bis ""Z"" wie Zac Efron und Zara Tindall: In der Welt der Promis ist immer etwas los. Ob sich nun neue Paare find… [+1361 chars]",,de,'Greta Gerwig'
https://t3n.de/news/gta-6-auf-sylt-ki-trailer-zeigt-waffen-autos-und-christian-lindner-1605443/,https://t3n.de/news/gta-6-auf-sylt-ki-trailer-zeigt-waffen-autos-und-christian-lindner-1605443/,0,t3n.de,"GTA 6 auf Sylt: KI-Trailer zeigt Waffen, Autos und Christian Lindner","Ach, wie lustig wäre doch ein Grand-Theft-Auto-Teil, der in Deutschland spielen würde. Ein KI-Trailer zeigt nun, wie das Spiel auf Sylt aussehen könnte.
weiterlesen auf t3n.de",https://t3n.de/news/wp-content/uploads/2024/02/gta-6-sylt.jpg,2024-02-01T13:00:32Z,,"Eine Kolonne aus Mercedes-G-Klassen fährt durch den Sand. Eine Frau versteckt sich im Schilf mit einer Waffe. Luxus, schöne Menschen und fette Knarren der Trailer von Grand Theft Auto 6 Sylt Luxury h… [+2804 chars]",,de,'Christian Lindner'
https://www.welt.de/regionales/hamburg/article249860568/Organisierte-Kriminalitaet-Der-Zoll-findet-eine-halbe-Tonne-Kokain-im-Hamburger-Hafen.html,https://www.welt.de/regionales/hamburg/article249860568/Organisierte-Kriminalitaet-Der-Zoll-findet-eine-halbe-Tonne-Kokain-im-Hamburger-Hafen.html,0,www.welt.de,Der Zoll findet eine halbe Tonne Kokain im Hamburger Hafen,"In einem Container findet der Hamburger Zoll 520 Päckchen Kokain zwischen Bananen versteckt. Adressiert war die Ladung an eine Frankfurter Firma. Vier Tatverdächtige sind in Hamburg festgenommen, Wohnungen in mehreren deutschen Städten durchsucht worden.",https://img.welt.de/img/regionales/hamburg/mobile249860566/5071356877-ci16x9-w1200/Sichergestelltes-Kokain.jpg,2024-02-01T15:07:50Z,,"Mehr als eine halbe Tonne Kokain haben Beamte des Zolls am Hamburger Hafen beschlagnahmt. Zudem wurden vier Tatverdächtige festgenommen, wie das Zollfahndungsamt Frankfurt am Main am Donnerstag mitte… [+2063 chars]",,de,'nan nan'
https://www.kino.de/film/deutschland-sucht-den-superstar-2004/news/negativ-rekord-fuer-rtl-show-nach-supertalent-wird-nun-auch-dsds-angepasst/,https://www.kino.de/film/deutschland-sucht-den-superstar-2004/news/negativ-rekord-fuer-rtl-show-nach-supertalent-wird-nun-auch-dsds-angepasst/,0,www.kino.de,Negativ-Rekord für RTL-Show: Nach „Supertalent“ wird nun auch „DSDS“ angepasst,"Nachdem RTL die Sende-Slots von „Das Supertalent“ und „Deutschland sucht den Superstar“ für dieses Jahr getauscht hat, wurden nun ein paar neue Infos zum letztgenannten Format bestätigt.",https://crops.giga.de/a6/a2/67/9e97a2632628d8d1a95c4f1361_YyAxNDU5eDgyMSsxODArOQJyZSAxOTIwIDEwODADYTI5NzY2ZDE1ZjY=.jpg,2024-02-03T15:00:49Z,,"Nachdem RTL die Sende-Slots von „Das Supertalent“ und „Deutschland sucht den Superstar“ für dieses Jahr getauscht hat, wurden nun ein paar neue Infos zum letztgenannten Format bestätigt.
Jüngst hat … [+2954 chars]",,de,'Pietro Lombardi'
https://www.welt.de/kultur/article249910358/Preisverleihung-Taylor-Swift-schreibt-Geschichte-Killer-Mike-wird-abgefuehrt.html,https://www.welt.de/kultur/article249910358/Preisverleihung-Taylor-Swift-schreibt-Geschichte-Killer-Mike-wird-abgefuehrt.html,0,www.welt.de,Taylor Swift schreibt Geschichte – Killer Mike wird nach Grammy-Auszeichnung abgeführt,"Pop-Superstar Taylor Swift gewinnt zum vierten Mal den Grammy für das Album des Jahres und zieht damit an Paul Simon, Frank Sinatra und Stevie Wonder vorbei, die dreimal in der Kategorie ausgezeichnet wurden. Ein anderer Preisträger des Abends wird direkt im …",https://img.welt.de/img/kultur/mobile249910350/6431355907-ci16x9-w1200/66th-Grammy-awards-Show.jpg,2024-02-05T05:03:02Z,,Pop-Superstar Taylor Swift hat den Grammy für das beste Album des Jahres gewonnen und damit Geschichte geschrieben. Mit Midnights gewann die 34-Jährige am Sonntagabend in Los Angeles in der Hauptkate… [+1760 chars],,de,'Taylor Swift'
https://t3n.de/news/witziger-gta-6-trailer-ki-sylt-1605443/,https://t3n.de/news/witziger-gta-6-trailer-ki-sylt-1605443/,0,t3n.de,Witziger KI-Trailer zeigt wie GTA 6 auf Sylt aussehen würde – inklusive Christian Lindner,"Ach, wie lustig wäre doch ein Grand-Theft-Auto-Teil, der in Deutschland spielen würde. Ein KI-Trailer zeigt nun, wie das Spiel auf Sylt aussehen könnte.
weiterlesen auf t3n.de",https://t3n.de/news/wp-content/uploads/2024/02/gta-6-sylt-1.jpg,2024-02-05T13:50:00Z,,"Eine Kolonne aus Mercedes-G-Klassen fährt durch den Sand. Eine Frau versteckt sich im Schilf mit einer Waffe. Luxus, schöne Menschen und fette Knarren der Trailer von Grand Theft Auto 6 Sylt Luxury h… [+2804 chars]",,de,'Franca Lehfeldt'
https://www.welt.de/regionales/hamburg/article249931178/Streit-um-Ruine-Liberale-Juedische-Gemeinde-fordert-neue-Synagoge.html,https://www.welt.de/regionales/hamburg/article249931178/Streit-um-Ruine-Liberale-Juedische-Gemeinde-fordert-neue-Synagoge.html,0,www.welt.de,Liberale Jüdische Gemeinde fordert neue Synagoge,"Die liberale Jüdische Gemeinde in Hamburg vergleicht Senatspläne mit „Unrecht der Nazi-Zeit“, kritisiert Bürgermeister Peter Tschentscher und Finanzsenator Andreas Dressel (beide SPD) scharf und fordert den Wiederaufbau der Synagoge in der Poolstraße.",https://img.welt.de/img/bildergalerien/mobile249932106/6991351027-ci16x9-w1200/Ruine-des-ehemaligen-israelitischen-Tempels-in-der-Poolstrasse.jpg,2024-02-05T16:47:22Z,,Die liberale jüdische Gemeinde in Hamburg kritisiert den Hamburger Senat in scharfen Worten und fordert einen Wiederaufbau des im Zweiten Weltkrieg zerstörten Neuen Israelitischen Tempels in der Neus… [+5289 chars],,de,'nan nan'
