index,url,valid,domain,title,description,image,published,archive,content,quote,language,keyword
https://orf.at/stories/3389792/,https://orf.at/stories/3389792/,0,orf.at,US-Konsumenten zahlen Rechnung für Zölle,US-Präsident Donald Trump hat mit seiner Zollpolitik Abstürze auf den Finanzmärkten und Furcht vor einer weltweiten Handelskrise ausgelöst. In den USA selbst dürften die Konsumentinnen und Konsumenten die neuen Zölle auf importierte Produkte sehr rasch zu spü…,https://ibs.orf.at/news?image=https%3A%2F%2Fassets.orf.at%2Fmims%2F2025%2F14%2F24%2Fcrops%2Fw%3D1200%2Ch%3D630%2Cq%3D75%2F2579921_master_989724_usa_zoelle_teuerung_konsumenten_ap.jpg%3Fs%3D0d7104199655f109404b85ee029d3f7749cfeeba,2025-04-05T22:00:11Z,https://web.archive.org/web/20250406031105/https://orf.at/stories/3389792/,"Insgesamt werde der durchschnittliche US-Haushalt aufgrund der Zölle 2.100 Dollar mehr pro Jahr für Waren ausgeben, schätzt der überparteiliche Thinktank Tax Foundation. Experten warnen davor, dass i… [+4654 chars]",,de,'Donald Trump'
https://www.zeit.de/kultur/2025-03/los-angeles-lakers-usa-basketball-livesport-lebron-james,https://www.zeit.de/kultur/2025-03/los-angeles-lakers-usa-basketball-livesport-lebron-james,0,www.zeit.de,Los Angeles Lakers: Sein letztes Rodeo,"LeBron James ist der beste Basketballer der letzten 25 Jahre. Seine Ära wird bald zu Ende sein, die nächste geht aber auch schon los. Ein Besuch bei den Lakers in L.A.",https://img.zeit.de/kultur/2025-03/los-angeles-california-lakers-lebron-james/wide__1300x731,2025-04-06T08:43:54Z,http://archive.md/20250406084628/https://www.zeit.de/kultur/2025-03/los-angeles-lakers-usa-basketball-livesport-lebron-james,"An Spieltagen wird LeBron James hochgefahren wie ein altes Kohlekraftwerk. Aktivierung nennt sein Fitnesstrainer diesen Prozess, der zehn Stunden vor tip-off in einer Eistonne beginnt. Muskeln, Gelen… [+590 chars]",,de,'LeBron James'
https://www.stern.de/lifestyle/leute/koenig-charles-iii---darum-wurde-der-monarch-netter-35617446.html,https://www.stern.de/lifestyle/leute/koenig-charles-iii---darum-wurde-der-monarch-netter-35617446.html,0,www.stern.de,König Charles III.: Darum wurde der Monarch netter,"König Charles III. soll sich stark verändert haben. Angeblich ist er heute viel netter als früher, verriet sein langjähriger Fotograf.",https://image.stern.de/35617450/t/3S/v1/w1440/r1.7778/-/06--darum-wurde-der-monarch-netter---16-9---spoton-article-1092221.jpg,2025-04-06T13:57:00Z,,"Kopiere den aktuellen Link
Zur Merkliste hinzufügen
König Charles III. soll sich stark verändert haben. Angeblich ist er heute viel netter als früher, verriet sein langjähriger Fotograf.
Vom miese… [+2499 chars]",,de,'König Charles III'
https://www.stern.de/gesellschaft/regional/baden-wuerttemberg/politiker-vom-bodensee--cdu-politiker-repnik-im-alter-von-77-jahren-gestorben-35617476.html,https://www.stern.de/gesellschaft/regional/baden-wuerttemberg/politiker-vom-bodensee--cdu-politiker-repnik-im-alter-von-77-jahren-gestorben-35617476.html,0,www.stern.de,Politiker vom Bodensee: CDU-Politiker Repnik im Alter von 77 Jahren gestorben,"Die CDU im Südwesten trauert um Hans-Peter Repnik, der in der Ära von Helmut Kohl Karriere machte. Landeschef Hagel lobt Repniks Gespür für Zukunftsthemen.",https://image.stern.de/35617478/t/pn/v1/w1440/r1.7778/-/06--xvgebivbwpv6axs2048jpeg---3ea4087ed6513906.jpg,2025-04-06T14:25:07Z,https://web.archive.org/web/20250406150106/https://www.stern.de/gesellschaft/regional/baden-wuerttemberg/politiker-vom-bodensee--cdu-politiker-repnik-im-alter-von-77-jahren-gestorben-35617476.html,"Kopiere den aktuellen Link
Zur Merkliste hinzufügen
Die CDU im Südwesten trauert um Hans-Peter Repnik, der in der Ära von Helmut Kohl Karriere machte. Landeschef Hagel lobt Repniks Gespür für Zukun… [+1181 chars]",,de,'Helmut Kohl'
https://t3n.de/news/trump-politik-billionen-buffett-1681874/,https://t3n.de/news/trump-politik-billionen-buffett-1681874/,0,t3n.de,Wie Trumps Politik Billionen Dollar ausradiert – und Buffett trotzdem immer reicher wird,Trumps neueste Zollankündigung hat die Aktienkurse weltweit abstürzen lassen – und die reichsten Menschen der Welt viele Milliarden US-Dollar gekostet. Nur einer der Top-Multimilliardäre ist in den schwarzen Zahlen: Börsenguru Warren Buffett. Warum? Der Tech-…,https://t3n.de/news/wp-content/uploads/2024/12/aktienmarkt-vorhersage.jpg,2025-04-06T17:17:42Z,https://web.archive.org/web/20250406172212/https://t3n.de/news/trump-politik-billionen-buffett-1681874/,"Der Tech-Konzern Apple, der vor allem in China, Vietnam und Indien produzieren lässt, ist eines der Unternehmen, die am stärksten  negativ  von Donald Trumps Zollpolitik betroffen ist. Entsprechend f… [+3288 chars]",,de,'Warren Buffet'
https://www.stern.de/news/chp-chef-oezel-fordert-neuwahlen-in-der-tuerkei---parteivorsitzender-im-amt-bestaetigt-35617280.html,https://www.stern.de/news/chp-chef-oezel-fordert-neuwahlen-in-der-tuerkei---parteivorsitzender-im-amt-bestaetigt-35617280.html,0,www.stern.de,CHP-Chef Özel fordert Neuwahlen in der Türkei - Parteivorsitzender im Amt bestätigt,"Der Chef der größten türkischen Oppositionspartei CHP, Özgür Özel, hat ""bis spätestens November"" Neuwahlen gefordert. Özel sagte am Sonntag beim CHP-Parteitag in Ankara an Präsident Recep Tayyip Erdogan gerichtet: ""Spätestens im November werden Sie unserem Ka…",https://image.stern.de/35617772/t/jA/v1/w1440/r1.7778/-/06--oezel-beim-parteitag-in-ankara---c75abfa1d0253d2f.jpg,2025-04-06T19:27:56Z,https://web.archive.org/web/20250406211813/https://www.stern.de/news/chp-chef-oezel-fordert-neuwahlen-in-der-tuerkei---parteivorsitzender-im-amt-bestaetigt-35617280.html,"Kopiere den aktuellen Link
Zur Merkliste hinzufügen
Der Chef der größten türkischen Oppositionspartei CHP, Özgür Özel, hat ""bis spätestens November"" Neuwahlen gefordert. Özel sagte am Sonntag beim … [+2463 chars]",,de,'Recep Tayyip Erdogan'
https://www.n-tv.de/sport/Die-NHL-legt-sich-Putins-Vorzeigeprofi-zu-Fuessen-article25684883.html,https://www.n-tv.de/sport/Die-NHL-legt-sich-Putins-Vorzeigeprofi-zu-Fuessen-article25684883.html,0,www.n-tv.de,Owetschkin schafft Unglaubliches: Die NHL legt sich Putins Vorzeigeprofi zu Füßen,"Die Leistung ist historisch, die Marke scheinbar einer für die Ewigkeit. Und deshalb wurde Alexander Owetschkin gefeiert, als er den NHL-Torrekord von Wayne Gretzky brach. Doch nicht alle jubeln. Denn die neue Bestmarke von 895 Treffern ist eine mit Beigeschm…",https://www.n-tv.de/img/incoming/crop25684882/6501322810-cImg_16_9-w1200/068229ad94158624255dafba8a00505c.jpg,2025-04-07T03:14:16Z,https://web.archive.org/web/20250407073239/https://www.n-tv.de/sport/Die-NHL-legt-sich-Putins-Vorzeigeprofi-zu-Fuessen-article25684883.html,"Die Leistung ist historisch, die Marke scheinbar einer für die Ewigkeit. Und deshalb wurde Alexander Owetschkin gefeiert, als er den NHL-Torrekord von Wayne Gretzky brach. Doch nicht alle jubeln. Den… [+7308 chars]",,de,'LeBron James'
https://www.stern.de/sport/eishockey---papa-waere-so-stolz---owetschkin-uebertrifft-ewigen-gretzky-35618084.html,https://www.stern.de/sport/eishockey---papa-waere-so-stolz---owetschkin-uebertrifft-ewigen-gretzky-35618084.html,0,www.stern.de,"Eishockey: ""Papa wäre so stolz"": Owetschkin übertrifft ewigen Gretzky","Snoop Dogg, Michael Jordan und Roger Federer: Die Liste der Gratulanten ist lang. Sie alle huldigen Eishockey-Superstar Alex Owetschkin, der in einem besonderen Spiel eine Legende des Sports überholt.",https://image.stern.de/35618086/t/V8/v1/w1440/r1.7778/-/07--o46odr22ltv3axs2048jpeg---3511ab5efa615e4e.jpg,2025-04-07T03:55:37Z,https://web.archive.org/web/20250407052136/https://www.stern.de/sport/eishockey---papa-waere-so-stolz---owetschkin-uebertrifft-ewigen-gretzky-35618084.html,"Kopiere den aktuellen Link
Zur Merkliste hinzufügen
Snoop Dogg, Michael Jordan und Roger Federer: Die Liste der Gratulanten ist lang. Sie alle huldigen Eishockey-Superstar Alex Owetschkin, der in e… [+5238 chars]",,de,'LeBron James'
https://www.dw.com/de/nhl-ukraine-krieg-eishockey-putin-freund-alexander-owetschkin-torrekord/a-72056492,https://www.dw.com/de/nhl-ukraine-krieg-eishockey-putin-freund-alexander-owetschkin-torrekord/a-72056492,0,www.dw.com,NHL: Nicht nur Jubel für Putin-Freund Alexander Owetschkin,"In der nordamerikanischen Eishockey-Liga NHL bricht Alexander Owetschkin aus Russland die Tor-Bestmarke von Wayne Gretzky. Eine Leistung zum Bejubeln, seine Unterstützung für Wladimir Putin sorgt aber für Kritik. Der russische Eishockey-Superstar Alexander Ow…",https://static.dw.com/image/72158380_6.jpg,2025-04-07T06:25:00Z,https://web.archive.org/web/20250407124333/https://www.dw.com/de/nhl-ukraine-krieg-eishockey-putin-freund-alexander-owetschkin-torrekord/a-72056492,"Der russische Eishockey-Superstar Alexander Owetschkin
hat es geschafft, einen Rekord zu brechen, den viele Experten lange für unerreichbar hielten: Wayne Gretzkys Bestmarke von 894 Toren in der reg… [+6719 chars]",,de,'Wladimir Putin'
https://www.focus.de/finanzen/boerse/asiatische-boersen-klettern-nikkei-legt-um-2700-punkte-zu_284a1920-f02d-4c87-9a56-669d96cee2ab.html,https://www.focus.de/finanzen/boerse/asiatische-boersen-klettern-nikkei-legt-um-2700-punkte-zu_284a1920-f02d-4c87-9a56-669d96cee2ab.html,0,www.focus.de,"Asiatische Börsen klettern, Nikkei legt um 2700 Punkte zu",Am Mittwochabend hat US-Präsident Donald Trump eine 90-tägige Zollpause angekündigt. Die US-Aktienmärkte schießen daraufhin nach oben. In der Nacht folgen die asiatischen Marktplätze mit hohen Gewinnen. Alle Börsen-News im Ticker.,https://quadro.burda-forward.de/ctf/1ad63a66-2748-45e7-8efb-762e51a66bcb.193094ae-2654-409b-af15-ff565eac40e4.jpg?im=RegionOfInterestCrop%3D%281200%2C630%29%2CregionOfInterest%3D%28985%2C185%29&hash=04a513eb88f8f70cfea452e4e84e435589956898f3e2b1a00ba52e42f3cb297d,2025-04-07T07:40:43Z,https://web.archive.org/web/20250410051540/https://www.focus.de/finanzen/boerse/asiatische-boersen-klettern-nikkei-legt-um-2700-punkte-zu_284a1920-f02d-4c87-9a56-669d96cee2ab.html,"Asiatische Börsen klettern, Nikkei legt um 2700 Punkte zu
Donnerstag, 10.04.2025, 07.03 Uhr: Die asiatischen Börsen folgen den US-Märkten mit teils hohen Gewinnen. Der japanische Nikkei 225 notiert … [+49873 chars]",,de,'Jamie Dimon'
https://www.stern.de/news/zweites-kind-in-den-usa-stirbt-an-masern---gesundheitsminister-wirbt-fuer-impfung-35617688.html,https://www.stern.de/news/zweites-kind-in-den-usa-stirbt-an-masern---gesundheitsminister-wirbt-fuer-impfung-35617688.html,0,www.stern.de,Zweites Kind in den USA stirbt an Masern - Gesundheitsminister wirbt für Impfung,"In den USA ist ein zweites Kind an Masern gestorben. Ein Krankenhaus in der texanischen Stadt Lubbock gab am Sonntag den Tod eines ungeimpften Kindes bekannt, das keine bekannten Vorerkrankungen hatte. US-Gesundheitsminister Robert F. Kennedy Jr., der in der …",https://image.stern.de/35618698/t/2j/v1/w1440/r1.7778/-/07--impfung-in-den-usa---1585724c22c29603.jpg,2025-04-07T09:20:57Z,https://web.archive.org/web/20250407124725/https://www.stern.de/news/zweites-kind-in-den-usa-stirbt-an-masern---gesundheitsminister-wirbt-fuer-impfung-35617688.html,"Kopiere den aktuellen Link
Zur Merkliste hinzufügen
In den USA ist ein zweites Kind an Masern gestorben. Ein Krankenhaus in der texanischen Stadt Lubbock gab am Sonntag den Tod eines ungeimpften Ki… [+2772 chars]",,de,'Robert Kennedy'
https://www.kino.de/film/avengers-doomsday-2026/news/die-schlimmste-darstellung-von-doom-marvel-fans-ahnen-boeses-fuer-die-mcu-rueckkehr-von-robert-downey-jr/,https://www.kino.de/film/avengers-doomsday-2026/news/die-schlimmste-darstellung-von-doom-marvel-fans-ahnen-boeses-fuer-die-mcu-rueckkehr-von-robert-downey-jr/,0,www.kino.de,„Die schlimmste Darstellung von Doom“: Marvel-Fans ahnen Böses für die MCU-Rückkehr von Robert Downey Jr.,Robert Downey Jr. sorgt für neue Spekulationen über seine MCU-Rolle als Doctor Doom – und leider sind Fans alles andere als begeistert...,https://static.kino.de/wp-content/uploads/2025/04/rdj-rcm1200x627u.jpg,2025-04-07T09:29:43Z,,"Robert Downey Jr. sorgt für neue Spekulationen über seine MCU-Rolle als Doctor Doom – und leider sind Fans alles andere als begeistert.
Die Dreharbeiten zu „Avengers: Doomsday“ haben offiziell begon… [+2827 chars]",,de,'Robert Downey Jr'
https://www.zeit.de/sport/2025-04/alex-owetschkin-nhl-rekord-wayne-gretzky-wladimir-putin,https://www.zeit.de/sport/2025-04/alex-owetschkin-nhl-rekord-wayne-gretzky-wladimir-putin,0,www.zeit.de,Alex Owetschkin: Putins Mann auf dem Eis,Alex Owetschkin übernimmt den NHL-Torrekord von Wayne Gretzky. Oder: Der Putin-Freund überholt den Trump-Buddy. Wie feiert das politisierte Eishockey diesen Augenblick?,https://img.zeit.de/sport/2025-04/alex-owetschkin/wide__1300x731,2025-04-07T10:29:33Z,http://archive.md/20250407103718/https://www.zeit.de/sport/2025-04/alex-owetschkin-nhl-rekord-wayne-gretzky-wladimir-putin,"Und dann stand alles still und sie gratulierten Alex Owetschkin per Videobotschaft: Tennisikone Roger Federer. Die Basketballlegenden Michael Jordan und LeBron James. Die beste Turnerin der Welt, Sim… [+697 chars]",,de,'LeBron James'
https://www.stern.de/gesellschaft/regional/berlin-brandenburg/koalitionsverhandlungen--wegner-plaediert-fuer-verhandlungen-ohne-zeitdruck-35619206.html,https://www.stern.de/gesellschaft/regional/berlin-brandenburg/koalitionsverhandlungen--wegner-plaediert-fuer-verhandlungen-ohne-zeitdruck-35619206.html,0,www.stern.de,Koalitionsverhandlungen: Wegner plädiert für Verhandlungen ohne Zeitdruck,"Berlin (bb) - Berlins Regierender Bürgermeisters Kai Wegner (CDU) mahnt, sich bei den Koalitionsverhandlungen auf Bundesebene nicht unter Zeitdruck setzen",https://image.stern.de/35619208/t/MP/v1/w1440/r1.7778/-/07--o4xb5eqvwsv6axs2048jpeg---9a032dc8364d538c.jpg,2025-04-07T11:24:39Z,https://web.archive.org/web/20250407131739/https://www.stern.de/gesellschaft/regional/berlin-brandenburg/koalitionsverhandlungen--wegner-plaediert-fuer-verhandlungen-ohne-zeitdruck-35619206.html,"Kopiere den aktuellen Link
Zur Merkliste hinzufügen
Berlins Regierender Bürgermeister blickt optimistisch auf die Koalitionsverhandlungen im Bund. Der CDU-Landeschef empfiehlt Beratungen ohne Hekti… [+1069 chars]",,de,'Kai Wegner'
https://www.diepresse.com/19556071/das-sagt-einer-der-maechtigsten-wall-street-banker-zu-den-us-zoellen,https://www.diepresse.com/19556071/das-sagt-einer-der-maechtigsten-wall-street-banker-zu-den-us-zoellen,0,www.diepresse.com,Das sagt einer der mächtigsten Wall Street-Banker zu den US-Zöllen,"Jamie Dimons Wort hat Gewicht. Und das, was der Top-Banker zu sagen hat, ist nicht gerade erfreulich.",https://img.diepresse.com/public/incoming/7mf59d-JPMORGAN-CEO/alternates/DPR_SOCIAL_NACHRICHTEN/JPMORGAN-CEO,2025-04-07T11:51:07Z,https://web.archive.org/web/20250407212926/https://www.diepresse.com/19556071/das-sagt-einer-der-maechtigsten-wall-street-banker-zu-den-us-zoellen,"Jamie Dimons Wort hat Gewicht. Und das, was der Top-Banker zu sagen hat, ist nicht gerade erfreulich. 
Jamie Dimon ist seit über 19 Jahren Chef der amerikanischen Großbank JPMorgan. Und damit einer … [+2568 chars]",,de,'Jamie Dimon'
"https://www.gamestar.de/artikel/avengers-doomsday-robert-downey-jr-dr-doom-leak,3430902.html","https://www.gamestar.de/artikel/avengers-doomsday-robert-downey-jr-dr-doom-leak,3430902.html",0,www.gamestar.de,Avengers: Doomsday - Hat Robert Downey Jr. uns das Aussehen von Dr. Doom verraten?,Ausgerechnet der Marvel-Star höchstselbst könnte uns den größten Leak seit langer Zeit beschert haben.,https://images.cgames.de/images/gamestar/293/rdj-dr-doom_6347371.jpg,2025-04-07T12:29:00Z,,"Die Infolage zu Avengers Doomsday ist genauso verschwommen wie RDJ auf unserem Teaserbild. Marvel rückt einfach nicht mit der Sprache raus! Bildquelle: Disney / Marvel
Robert Downey Jr. hat am 4. Ap… [+2618 chars]",,de,'Robert Downey Jr'
https://www.tagesspiegel.de/wirtschaft/ein-selbst-verschuldeter-wirtschaftlicher-atomwinter-titanen-der-wall-street-gehen-gegen-trumps-zollpolitik-auf-die-barrikaden-13501840.html,https://www.tagesspiegel.de/wirtschaft/ein-selbst-verschuldeter-wirtschaftlicher-atomwinter-titanen-der-wall-street-gehen-gegen-trumps-zollpolitik-auf-die-barrikaden-13501840.html,0,www.tagesspiegel.de,„Selbst verschuldeter wirtschaftlicher Atomwinter“: Titanen der Wall Street gehen gegen Trumps Zollpolitik auf die Barrikaden,Nach Amtsantritt von Donald Trump hielten sich viele Superreiche mit ihrer Kritik auffällig zurück. Mit seinem Zollpaket bringt er nun aber mehr und mehr Investoren und Fondsmanager gegen sich auf.,https://www.tagesspiegel.de/images/13354498/alternates/BASE_16_9_W1400/1741779389000/a-man-walks-past-a-wall-street-marking-outside-the-new-york-stock-exchange-nyse-building-on-tuesday-following-monday-s-broad-sell-off-in-new-york-city.jpeg,2025-04-07T13:52:22Z,https://web.archive.org/web/20250407164137/https://www.tagesspiegel.de/wirtschaft/ein-selbst-verschuldeter-wirtschaftlicher-atomwinter-titanen-der-wall-street-gehen-gegen-trumps-zollpolitik-auf-die-barrikaden-13501840.html,Donald Trumps Zollpaket hat ein weltweites Börsenbeben ausgelöst. Während sich die Wirtschaftsbosse bisher mit Kritik an der neuen Regierung zurückgehalten haben und viele wie etwa Mark Zuckerberg na… [+4202 chars],,de,'Donald Trump'
https://www.n-tv.de/wirtschaft/Darum-ist-Warren-Buffetts-Vermoegen-trotz-Krise-gewachsen-article25686272.html,https://www.n-tv.de/wirtschaft/Darum-ist-Warren-Buffetts-Vermoegen-trotz-Krise-gewachsen-article25686272.html,0,www.n-tv.de,Andere Superreiche verlieren: Darum ist Warren Buffetts Vermögen trotz Krise gewachsen,"Donald Trump verbreitet die Falschnachricht, Investorenlegende Warren Buffett habe seine Zollpolitik gelobt. Tatsächlich ist Buffett einer der wenigen unter Amerikas Superreichen, die Trump kritisiert haben – und der einzige, der auf den Börsen-Crash vorberei…",https://www.n-tv.de/img/incoming/crop25686317/9401328513-cImg_16_9-w1200/2025-04-04T191539Z-1725890332-RC26J7A71MPT-RTRMADP-3-BERKSHIRE-BUFFETT-TRUMP-MISINFORMATION.jpg,2025-04-07T14:44:05Z,https://web.archive.org/web/20250407152236/https://www.n-tv.de/wirtschaft/Darum-ist-Warren-Buffetts-Vermoegen-trotz-Krise-gewachsen-article25686272.html,"Donald Trump verbreitet die Falschnachricht, Investorenlegende Warren Buffett habe seine Zollpolitik gelobt. Tatsächlich ist Buffett einer der wenigen unter Amerikas Superreichen, die Trump kritisier… [+3933 chars]",,de,'Berkshire Hathaway'
https://www.dw.com/de/rezessions%C3%A4ngste-und-trumps-z%C3%B6lle-lassen-weltweit-die-kurse-abst%C3%BCrzen/a-72165854,https://www.dw.com/de/rezessions%C3%A4ngste-und-trumps-z%C3%B6lle-lassen-weltweit-die-kurse-abst%C3%BCrzen/a-72165854,0,www.dw.com,Rezessionsängste und Trumps Zölle lassen weltweit die Kurse abstürzen,"Weil die Aktienmärkte weiter einbrechen, wächst die Angst der Anleger vor einem globalen Wirtschaftseinbruch. Welche Auswirkungen haben Trumps Zölle auf das Wachstum in den USA, China und der Welt? Die Talfahrt an den globalen Finanzmärkten dauerte am Montag …",https://static.dw.com/image/72132264_6.jpg,2025-04-07T15:21:00Z,https://web.archive.org/web/20250407185550/https://www.dw.com/de/rezessions%25C3%25A4ngste-und-trumps-z%25C3%25B6lle-lassen-weltweit-die-kurse-abst%25C3%25BCrzen/a-72165854,"Die Talfahrt an den globalen Finanzmärkten dauerte am Montag (7. April) als Reaktion auf die beispiellosen Zölle von Präsident Donald Trump gegen die meisten US-Handelspartner den dritten Tag an.
Di… [+9032 chars]",,de,'Jamie Dimon'
https://www.stern.de/lifestyle/leute/britisches-koenigshaus--royals-in-rom--charles-und-camilla-besuchen-italien-35620374.html,https://www.stern.de/lifestyle/leute/britisches-koenigshaus--royals-in-rom--charles-und-camilla-besuchen-italien-35620374.html,0,www.stern.de,Britisches Königshaus: Royals in Rom: Charles und Camilla besuchen Italien,König Charles III. und seine Frau Königin Camilla beginnen ihren mehrtägigen Staatsbesuch in Italien. Das Paar feiert während der Reise auch ein besonderes Datum: Stichwort Amore.,https://image.stern.de/35620376/t/mv/v1/w1440/r1.7778/-/07--ko2t3eap6bv3axs2048jpeg---7be99dfb6b8a3882.jpg,2025-04-07T16:10:00Z,https://web.archive.org/web/20250407164559/https://www.stern.de/lifestyle/leute/britisches-koenigshaus--royals-in-rom--charles-und-camilla-besuchen-italien-35620374.html,"Kopiere den aktuellen Link
Zur Merkliste hinzufügen
König Charles III. und seine Frau Königin Camilla beginnen ihren mehrtägigen Staatsbesuch in Italien. Das Paar feiert während der Reise auch ein … [+1733 chars]",,de,'Königin Camilla'
https://www.tagesspiegel.de/gesellschaft/britisches-konigshaus-royals-in-rom-charles-und-camilla-besuchen-italien-13503370.html,https://www.tagesspiegel.de/gesellschaft/britisches-konigshaus-royals-in-rom-charles-und-camilla-besuchen-italien-13503370.html,0,www.tagesspiegel.de,Britisches Königshaus: Royals in Rom: Charles und Camilla besuchen Italien,König Charles III. und seine Frau Königin Camilla beginnen ihren mehrtägigen Staatsbesuch in Italien. Das Paar feiert während der Reise auch ein besonderes Datum: Stichwort Amore.,https://www.tagesspiegel.de/images/13503367/alternates/BASE_16_9_W1400/1744042263000/konig-charles-iii-und-konigin-camilla-besuchen-italien.jpeg,2025-04-07T16:11:03Z,https://web.archive.org/web/20250409030757/https://www.tagesspiegel.de/gesellschaft/britisches-konigshaus-royals-in-rom-charles-und-camilla-besuchen-italien-13503370.html,"Großbritanniens König Charles III. und seine Frau Königin Camilla sind zu einem Staatsbesuch in Italien eingetroffen. Das Paar verließ am frühen Abend das Flugzeug in Rom, wie der britische Fernsehse… [+2263 chars]",,de,'Königin Camilla'
https://www.stern.de/news/trump-zoelle--kritik-von-us-wirtschaftsbossen-waechst-35620406.html,https://www.stern.de/news/trump-zoelle--kritik-von-us-wirtschaftsbossen-waechst-35620406.html,0,www.stern.de,Trump-Zölle: Kritik von US-Wirtschaftsbossen wächst,"Die Zollpolitik von US-Präsident Donald Trump stößt unter führenden Wirtschaftsvertretern in den Vereinigten Staaten zunehmend auf Kritik. Der Chef der größten US-Bank JPMorgan Chase, Jamie Dimon, warnte am Montag in seinem Jahresschreiben an die Aktionäre vo…",https://image.stern.de/35620408/t/eM/v1/w1440/r1.7778/-/07--trump-mit-seiner-zolltabelle---d291facf1aa6c6bb.jpg,2025-04-07T16:27:22Z,,"Kopiere den aktuellen Link
Zur Merkliste hinzufügen
Die Zollpolitik von US-Präsident Donald Trump stößt unter führenden Wirtschaftsvertretern in den Vereinigten Staaten zunehmend auf Kritik. Der Ch… [+1834 chars]",,de,'Jamie Dimon'
https://www.bild.de/unterhaltung/royals-adel/prinz-william-engagiert-scheidungsanwaelte-seiner-mutter-diana-67f37b2534eeb05559be8eea,https://www.bild.de/unterhaltung/royals-adel/prinz-william-engagiert-scheidungsanwaelte-seiner-mutter-diana-67f37b2534eeb05559be8eea,0,www.bild.de,Thronfolger „geht eigenen Weg“ - William engagiert Anwälte seiner Mutter,"Dass Prinz William seinen eigenen Kopf hat, ist bekannt. Jetzt hat der Thronfolger die Weichen eine traditionsreiche Zusammenarbeit beendet – alle Details.","https://images.bild.de/67f37b2534eeb05559be8eea/8620bae5522e6a8175a7207de98930f9,3bf0bc96?w=1280",2025-04-07T16:59:25Z,https://web.archive.org/web/20250407172255/https://www.bild.de/unterhaltung/royals-adel/prinz-william-engagiert-scheidungsanwaelte-seiner-mutter-diana-67f37b2534eeb05559be8eea,"Dass Prinz William seinen eigenen Kopf hat, ist seit Jahren bekannt. Jetzt aber hat der Thronfolger eine Entscheidung getroffen, die nicht nur von Entschlossenheit zeugt, sondern auch eine neue Ära d… [+2676 chars]",,de,'Prinz William'
https://www.zeit.de/2025/14/europa-usa-selbstkritik-aufbruch-wirtschaft-ki,https://www.zeit.de/2025/14/europa-usa-selbstkritik-aufbruch-wirtschaft-ki,0,www.zeit.de,Europa: Höchste Zeit für Selbstkritik,"Die USA unter Donald Trump und JD Vance demütigen Europa ununterbrochen. Stolz beiseite: Hier sind Vorschläge, wie der Kontinent in Bewegung kommen kann.",https://img.zeit.de/kultur/2025-04/europa-usa-selbstkritik-aufbruch-wirtschaft-ki-bild/wide__1300x731,2025-04-07T17:20:14Z,https://web.archive.org/web/20250405074502/https://www.zeit.de/2025/14/europa-usa-selbstkritik-aufbruch-wirtschaft-ki,"Staaten sind immer auch Stolz-Gemeinschaften, und so sehr gedemütigt wurden die Europäer schon lange nicht mehr wie durch J.D. Vance Bemerkung, er sei es leid, die Europäer immer herauspauken zu müss… [+592 chars]",,de,'Donald Trump'
https://www.n-tv.de/wirtschaft/US-Manager-ruegen-Donald-Trumps-Zollpolitik-Schlechte-Mathematik-article25687007.html,https://www.n-tv.de/wirtschaft/US-Manager-ruegen-Donald-Trumps-Zollpolitik-Schlechte-Mathematik-article25687007.html,0,www.n-tv.de,"Selbst Elon Musk mischt mit: ""Schlechte Mathematik"" - US-Manager rügen Trumps Zollpolitik","In den USA wächst der Ärger über Trumps Zollpolitik. Fondsmanager Ackman fürchtet einen ""Atomkrieg gegen jedes Land"", Tesla-Chef Musk wirbt für ""Harmonie und Frieden"". Derweil rauschen die Kurse an der Wall Street in den Keller.",https://www.n-tv.de/img/incoming/crop25686988/2331325368-cImg_16_9-w1200/AP25097534151650.jpg,2025-04-07T18:33:47Z,https://web.archive.org/web/20250407192338/https://www.n-tv.de/wirtschaft/US-Manager-ruegen-Donald-Trumps-Zollpolitik-Schlechte-Mathematik-article25687007.html,"In den USA wächst der Ärger über Trumps Zollpolitik. Fondsmanager Ackman fürchtet einen ""Atomkrieg gegen jedes Land"", Tesla-Chef Musk wirbt für ""Harmonie und Frieden"". Derweil rauschen die Kurse an d… [+4018 chars]",,de,'Jamie Dimon'
