index,url,valid,domain,title,description,image,published,archive,content,quote,language,keyword
https://www.tagesspiegel.de/gesellschaft/geplanter-staatsbesuch-donald-trump-und-der-konig-13561510.html,https://www.tagesspiegel.de/gesellschaft/geplanter-staatsbesuch-donald-trump-und-der-konig-13561510.html,0,www.tagesspiegel.de,Geplanter Staatsbesuch: Donald Trump und der König,Die Reise von Donald Trump nach Großbritannien scheint für September geplant zu werden. Der US-Präsident ist Fan der britischen Monarchie.,https://www.tagesspiegel.de/images/13561507/alternates/BASE_16_9_W1400/1744962498000/us-prasident-trump.jpeg,2025-04-18T07:48:18Z,https://web.archive.org/web/20250419015501/https://www.tagesspiegel.de/gesellschaft/geplanter-staatsbesuch-donald-trump-und-der-konig-13561510.html,US-Präsident Donald Trump hat sich selbst als Freund des britischen Königs Charles III. bezeichnet. Trump (78) deutete im Weißen Haus den kommenden September als Zeitpunkt seines geplanten zweiten St… [+1662 chars],,de,'Prinz William'
https://www.diepresse.com/19595687/prinz-william-und-seine-frau-catherine-lassen-ostern-aus,https://www.diepresse.com/19595687/prinz-william-und-seine-frau-catherine-lassen-ostern-aus,0,www.diepresse.com,Prinz William und seine Frau Catherine lassen Ostern aus,Der Prinz und die Prinzessin von Wales werden das traditionelle Osterfest auf Schloss Windsor dieses Jahr auslassen.,https://img.diepresse.com/public/incoming/fxuuhh-2019-04-21T103200Z_2082752947_RC1C2B575A50_RTRMADP_3_BRITAIN-ROYALS-EASTER.JPG/alternates/DPR_SOCIAL_NACHRICHTEN/2019-04-21T103200Z_2082752947_RC1C2B575A50_RTRMADP_3_BRITAIN-ROYALS-EASTER.JPG,2025-04-18T10:57:35Z,https://web.archive.org/web/20250419010906/https://www.diepresse.com/19595687/prinz-william-und-seine-frau-catherine-lassen-ostern-aus,"Der Prinz und die Prinzessin von Wales werden das traditionelle Osterfest auf Schloss Windsor dieses Jahr auslassen.
Über die Teilnahme des Papstes an den Osterfeierlichkeiten am Wochenende herrscht… [+1197 chars]",,de,'Prinz William'
https://www.stern.de/lifestyle/leute/prinz-william--thronfolger-gibt-meghan-kritiker-top-position-35651996.html,https://www.stern.de/lifestyle/leute/prinz-william--thronfolger-gibt-meghan-kritiker-top-position-35651996.html,0,www.stern.de,Prinz William: Thronfolger gibt Meghan-Kritiker Top-Position,"Prinz William ernennt Jason Knauf, der Mobbing-Vorwürfe gegen Herzogin Meghan erhob, zum CEO seiner Umweltorganisation Earthshot Prize.",https://image.stern.de/35652000/t/Yt/v1/w1440/r1.7778/-/18--thronfolger-gibt-meghan-kritiker-top-position---16-9---spoton-article-1093954.jpg,2025-04-18T11:13:00Z,https://web.archive.org/web/20250418140923/https://www.stern.de/lifestyle/leute/prinz-william--thronfolger-gibt-meghan-kritiker-top-position-35651996.html,"Kopiere den aktuellen Link
Zur Merkliste hinzufügen
Prinz William ernennt Jason Knauf, der Mobbing-Vorwürfe gegen Herzogin Meghan erhob, zum CEO seiner Umweltorganisation Earthshot Prize.
Der brit… [+3031 chars]",,de,'Prinz William'
https://www.n-tv.de/politik/Putin-hat-mehr-Angst-vor-der-Demokratie-als-vor-der-Nato-article25711669.html,https://www.n-tv.de/politik/Putin-hat-mehr-Angst-vor-der-Demokratie-als-vor-der-Nato-article25711669.html,0,www.n-tv.de,"Der letzte Sommer in Frieden?: ""Putin hat mehr Angst vor der Demokratie als vor der Nato""","Wladimir Putin wird Europa zeitnah testen, davon sind Sönke Neitzel und Carlo Masala überzeugt. Auch für das Wo und Wie haben die Militärexperten ein Szenario vor Augen: Im ""ntv Salon"" erklären die Militärexperten, warum eine estnische Grenzstadt über das Sch…",https://www.n-tv.de/img/incoming/crop25711727/0931325633-cImg_16_9-w1200/ntv-Podcast-B19-Krieg-und-Frieden-36.jpg,2025-04-18T11:34:53Z,https://web.archive.org/web/20250418161247/https://www.n-tv.de/politik/Putin-hat-mehr-Angst-vor-der-Demokratie-als-vor-der-Nato-article25711669.html,"Wladimir Putin wird Europa und die Nato zeitnah testen, davon sind Historiker Sönke Neitzel und Politologe Carlo Masala überzeugt. Auch für das Wo und Wie haben die beiden Militärexperten ein Szenari… [+10869 chars]",,de,'Wladimir Putin'
https://www.sueddeutsche.de/wirtschaft/handelsstreit-china-usa-auswirkungen-hollywood-li.3237186,https://www.sueddeutsche.de/wirtschaft/handelsstreit-china-usa-auswirkungen-hollywood-li.3237186,0,www.sueddeutsche.de,Hollywood-Filme: Wie aus dem Handelsstreit zwischen China und den USA ein Kulturkampf wird,"US-Präsident Donald Trump glaubt, mit seiner Zollpolitik Druck auf andere Nationen aufbauen zu können. Für die Regierung in Peking ist der Zollstreit aber auch die unverhoffte Chance, Hollywoodfilme aus chinesischen Kinos zu verbannen – und damit ein Symbol a…",https://www.sueddeutsche.de/2025/04/18/7600b312-78cf-486a-9146-1f4b14f9d168.jpeg?q=60&fm=webp&width=1200&rect=0%2C0%2C3356%2C1888,2025-04-18T14:55:39Z,https://web.archive.org/web/20250418211316/https://www.sueddeutsche.de/wirtschaft/handelsstreit-china-usa-auswirkungen-hollywood-li.3237186,"Doch unter den zahlreichen Gegenmaßnahmen, die die chinesische Regierung verkündet hat, ist auch eine, die besondere Aufmerksamkeit verdient: Peking verschärft die Regeln für den Import von US-Entert… [+9293 chars]",,de,'Lara Trump'
https://www.tagesschau.de/ausland/amerika/akten-robert-f-kennedy-attentat-100.html,https://www.tagesschau.de/ausland/amerika/akten-robert-f-kennedy-attentat-100.html,0,www.tagesschau.de,Akten zum Mord an Robert F. Kennedy ab sofort einsehbar,In den USA sind jetzt viele Akten zum Attentat auf Robert F. Kennedy einsehbar. Der demokratische Senator und Bruder des ebenfalls ermordeten Präsidenten John F. Kennedy war 1968 erschossen worden.,https://images.tagesschau.de/image/7a64ba5f-b58f-4fe4-a37b-43cd7620baad/AAABldj73fA/AAABkZLhkrw/16x9-1280/robert-kennedy-attentat-100.jpg,2025-04-18T16:16:28Z,https://web.archive.org/web/20250419040259/https://www.tagesschau.de/ausland/amerika/akten-robert-f-kennedy-attentat-100.html,"Stand: 18.04.2025 18:16 Uhr
In den USA sind jetzt viele Akten zum Attentat auf Robert F. Kennedy einsehbar. Der demokratische Senator und Bruder des ebenfalls ermordeten Präsidenten John F. Kennedy … [+1937 chars]",,de,'Robert Kennedy'
https://www.telepolis.de/features/Kommt-die-ausserparlamentarische-Opposition-gegen-die-Merz-Regierung-10356758.html,https://www.telepolis.de/features/Kommt-die-ausserparlamentarische-Opposition-gegen-die-Merz-Regierung-10356758.html,0,www.telepolis.de,Kommt die außerparlamentarische Opposition gegen die Merz-Regierung?,Die Regierungsbildung unter Friedrich Merz läuft erstaunlich ruhig ab. Die SPD murrt nur leise. Aber könnte sich neuer außerparlamentarischer Protest entwickeln?,https://heise.cloudimg.io/bound/1200x1200/q85.png-lossy-85.webp-lossy-85.foil1/_www-heise-de_/imgs/18/4/8/4/0/1/1/2/Faeuste_Shutter-2a44cae3da16cbd8.jpeg,2025-04-19T14:00:00Z,,"Bildet sich Widerstand in Deutschland? Bild: PeopleImages.com - Yuri A/ Shutterstock.com
Die Regierungsbildung unter Friedrich Merz läuft erstaunlich ruhig ab. Die SPD murrt nur leise. Aber könnte s… [+10871 chars]",,de,'Marine Le Pen'
https://www.faz.net/aktuell/sport/mehr-sport/luka-don-i-und-lebron-james-harmonieren-bei-la-lakers-vor-nba-play-offs-110425037.html,https://www.faz.net/aktuell/sport/mehr-sport/luka-don-i-und-lebron-james-harmonieren-bei-la-lakers-vor-nba-play-offs-110425037.html,0,www.faz.net,"Luka Dončić in der NBA: Das Genie, das die Lakers vereint","Luka Dončić und LeBron James harmonieren nicht, hieß es? Vor den Play-offs zeigt sich: Sie harmonieren sogar sehr gut – und Dončić beweist den Mavericks, warum es ein Fehler war, ihn ziehen zu lassen.",https://media1.faz.net/ppmedia/aktuell/2349594412/1.10425035/facebook_teaser_fplus/luka-don-i-rechts-und-lebron.jpg,2025-04-19T14:02:24Z,http://archive.md/20250419141344/https://www.faz.net/aktuell/sport/mehr-sport/luka-don-i-und-lebron-james-harmonieren-bei-la-lakers-vor-nba-play-offs-110425037.html,"Zugang zu allen FAZ+ Beiträgen12,80 
 jetzt nur 0,99 
Zugang zu allen FAZ+ Beiträgen12,80 
 jetzt nur 0,99 
<ul><li>Mit einem Klick online kündbar</li></ul>",,de,'LeBron James'
https://www.n-tv.de/politik/Tochter-von-Robert-F-Kennedy-geschockt-von-Autopsie-Fotos-article25715495.html,https://www.n-tv.de/politik/Tochter-von-Robert-F-Kennedy-geschockt-von-Autopsie-Fotos-article25715495.html,0,www.n-tv.de,Trump ließ sie veröffentlichen: Tochter von Robert F. Kennedy geschockt von Autopsie-Fotos,"Im Gegensatz zu ihrem Bruder spricht sich die Tochter von Robert F. Kennedy gegen die Veröffentlichung von Autopsie-Fotos ihres Vaters aus. Doch es hilft nichts. Der Anblick der Bilder ist für die 65-Jährige schlimm, wie sie erzählt.",https://www.n-tv.de/img/incoming/crop25715497/3751324586-cImg_16_9-w1200/102239220.jpg,2025-04-20T03:04:29Z,https://web.archive.org/web/20250420041308/https://www.n-tv.de/politik/Tochter-von-Robert-F-Kennedy-geschockt-von-Autopsie-Fotos-article25715495.html,Im Gegensatz zu ihrem Bruder spricht sich die Tochter von Robert F. Kennedy gegen die Veröffentlichung von Autopsie-Fotos ihres Vaters aus. Doch es hilft nichts. Der Anblick der Bilder ist für die 65… [+3407 chars],,de,'Robert Kennedy'
https://sport.orf.at/stories/3140419/,https://sport.orf.at/stories/3140419/,0,sport.orf.at,Lakers legen Fehlstart in Play-off hin,"Die Los Angeles Lakers um das Superstarduo Luka Doncic und LeBron James haben zum Play-off-Auftakt in der nordamerikanischen Basketballprofiliga (NBA) einen Fehlstart hingelegt. Der 17-malige Meister verlor daheim gegen die Minnesota Timberwolves mit 95:117, …",https://ibs.orf.at/sport?image=https%3A%2F%2Fassets.orf.at%2Fmims%2F2025%2F17%2F14%2Fcrops%2Fw%3D1200%2Ch%3D630%2Cq%3D75%2F2596819_master_996814_basketball_nba_playoff_lakers_auftakt_afp.jpg%3Fs%3D53616334b9f440abea59f55bebb076a0f351f6bd,2025-04-20T06:49:00Z,https://web.archive.org/web/20250420123543/https://sport.orf.at/stories/3140419/,"Superstar Doncic, der Anfang Februar überraschend von Dallas zu den Lakers wechselte, legte allein 16 Zähler im ersten Viertel auf. Der zweite Durchgang ging dann aber mit 38:20 deutlich an die Gäste… [+2112 chars]",,de,'LeBron James'
https://www.stern.de/lifestyle/leute/royals-beim-oster-gottesdienst--prinz-andrew-und-fergie-sind-dabei-35654702.html,https://www.stern.de/lifestyle/leute/royals-beim-oster-gottesdienst--prinz-andrew-und-fergie-sind-dabei-35654702.html,0,www.stern.de,Britisches Königshaus: Oster-Gottesdienst der Royals: Sogar Prinz Andrew und Fergie dürfen dabei sein,"Das Schaulaufen Royals zum Oster-Gottesdienst hat begonnen. Auch wenn Prinz William und Familie fehlt, erscheint die britische Königsfamilie mit voller Power.",https://image.stern.de/35654840/t/oi/v2/w1440/r1.7778/-/koenig-und-koenigin.jpg,2025-04-20T10:56:00Z,https://web.archive.org/web/20250420115514/https://www.stern.de/lifestyle/leute/royals-beim-oster-gottesdienst--prinz-andrew-und-fergie-sind-dabei-35654702.html,"Kopiere den aktuellen Link
Zur Merkliste hinzufügen
Das Schaulaufen Royals zum Oster-Gottesdienst hat begonnen. Auch wenn Prinz William und Familie fehlt, erscheint die britische Königsfamilie mit … [+1903 chars]",,de,'Prinz William'
https://www.brigitte.de/aktuell/koenig-charles-und-koenigin-camilla--britische-royals-begehen-ostergottesdienst-in-windsor-13977794.html,https://www.brigitte.de/aktuell/koenig-charles-und-koenigin-camilla--britische-royals-begehen-ostergottesdienst-in-windsor-13977794.html,0,www.brigitte.de,König Charles und Königin Camilla: Britische Royals begehen Ostergottesdienst in Windsor,König Charles und Königin Camilla zeigten sich bester Laune beim Ostergottesdienst in Windsor. Überraschend war auch Prinz Andrew dabei.,https://image.brigitte.de/13977796/t/he/v1/w1440/r1.7778/-/20--britische-royals-begehen-ostergottesdienst-in-windsor---1-1---spoton-article-1094116.jpg,2025-04-20T11:52:00Z,https://web.archive.org/web/20250420131951/https://www.brigitte.de/aktuell/koenig-charles-und-koenigin-camilla--britische-royals-begehen-ostergottesdienst-in-windsor-13977794.html,"König Charles und Königin Camilla zeigten sich bester Laune beim Ostergottesdienst in Windsor. Überraschend war auch Prinz Andrew dabei.
König Charles III. (76) und Königin Camilla (77) haben zusamm… [+3325 chars]",,de,'Prinz William'
https://www.bild.de/unterhaltung/royals-adel/charles-camilla-in-royaler-oster-laune-william-kate-machen-blau-68049e1aba5a92148b31e87d,https://www.bild.de/unterhaltung/royals-adel/charles-camilla-in-royaler-oster-laune-william-kate-machen-blau-68049e1aba5a92148b31e87d,0,www.bild.de,Warum Kate und William blaumachen - Charles und Camilla in royaler Oster-Laune,Auch in diesem Jahr war die Königsfamilie rund um Charles III. nicht komplett. Warum die Thronfolger beim Ostergottesdienst fehlten.,"https://images.bild.de/68049e1aba5a92148b31e87d/0a8b0786a1e4070f5574ab25bece98f4,1830e2df?w=1280",2025-04-20T12:22:28Z,http://archive.md/20250422080254/https://www.bild.de/unterhaltung/royals-adel/charles-camilla-in-royaler-oster-laune-william-kate-machen-blau-68049e1aba5a92148b31e87d,"Es ist ein besonderes Osterfest für König Charles III.  sein drittes als Regent und das erste nach seinem persönlichen Horrorjahr. Dieses Jahr, so scheint es bisher, geht es nach zahlreichen Tiefen s… [+2682 chars]",,de,'Charles III'
https://www.dw.com/de/usa-demokratie-unter-druck/a-72267320,https://www.dw.com/de/usa-demokratie-unter-druck/a-72267320,0,www.dw.com,USA: Demokratie unter Druck,Seit seinem Amtsantritt im Januar fordert US-Präsident Donald Trump auf mehreren Ebenen den amerikanischen Rechtsstaat heraus und testet unaufhörlich dessen Grenzen. Wie sehr ist die US-Demokratie in Gefahr? Gerade einmal drei Monate ist US-Präsident Donald T…,https://static.dw.com/image/71836385_6.jpg,2025-04-20T18:07:00Z,,"Gerade einmal drei Monate ist US-Präsident Donald Trump wieder im Amt. Drei Monate, in denen die USA nicht nur innenpolitisch umgewälzt und erschüttert, sondern in denen auch an den Grundfesten der D… [+7012 chars]",,de,'James Biden'
https://www.bild.de/unterhaltung/stars-und-leute/geruechte-um-obama-trennung-michelle-glaenzt-mit-ehering-68053448152a8d782372a8e8,https://www.bild.de/unterhaltung/stars-und-leute/geruechte-um-obama-trennung-michelle-glaenzt-mit-ehering-68053448152a8d782372a8e8,0,www.bild.de,Gerüchte um Obama-Trennung - Hier strahlt nur Michelles Ehering,Die Ex-First-Lady Michelle Obama setzt ein klares Zeichen gegen Trennungsgerüchte und zeigt sich demonstrativ mit ihrem Ehering.,"https://images.bild.de/68053448152a8d782372a8e8/5d55bd62408795defd08f5c72592da1d,c20acfc2?w=1280",2025-04-21T06:39:34Z,https://web.archive.org/web/20250421083406/http://www.bild.de/unterhaltung/stars-und-leute/geruechte-um-obama-trennung-michelle-glaenzt-mit-ehering-68053448152a8d782372a8e8,"Im Trennungs-Wirbel setzt sie auf ein funkelndes Statement. Michelle Obama, Ehefrau des 44. US-Präsidenten Barack Obama, zeigte sich jetzt bei einem Termin in Los Angeles an der Hand der Ehering. 
I… [+2495 chars]",,de,'Kamala Harris'
https://www.faz.net/aktuell/gesellschaft/menschen/prinz-andrew-zieht-alle-blicke-auf-sich-110430211.html,https://www.faz.net/aktuell/gesellschaft/menschen/prinz-andrew-zieht-alle-blicke-auf-sich-110430211.html,0,www.faz.net,Prinz Andrew zieht alle Blicke auf sich,"In diesem Jahr war es Prinz Andrew, der nach dem Ostergottestdienst der britischen Königsfamilie die größte mediale Aufmerksamkeit bekam. Dabei fiel kaum auf, dass ein viel wichtigeres Mitglied fehlte.",https://media1.faz.net/ppmedia/aktuell/politik/384190980/1.10430215/facebook_teaser/in-windsor-am-sonntag-der.jpg,2025-04-21T09:12:22Z,http://archive.md/20250421094736/https://www.faz.net/aktuell/gesellschaft/menschen/prinz-andrew-zieht-alle-blicke-auf-sich-110430211.html,"Der Ostergottesdienst ist für die britische Königsfamilie nicht bloß eine Würdigung der christlichen Auferstehung, sondern auch eine Gelegenheit, zu demonstrieren, wie es um den Zustand ihres eigenen… [+2317 chars]",,de,'Prinz Andrew'
https://www.zeit.de/news/2025-04/21/der-andere-papst-franziskus-ist-tot,https://www.zeit.de/news/2025-04/21/der-andere-papst-franziskus-ist-tot,0,www.zeit.de,Katholische Kirche: Der andere Papst - Franziskus ist tot,Hier finden Sie Informationen zu dem Thema „Katholische Kirche“. Lesen Sie jetzt „Der andere Papst - Franziskus ist tot“.,https://img.zeit.de/news/2025-04/21/der-andere-papst-franziskus-ist-tot-image-group/wide__1300x731,2025-04-21T09:21:27Z,https://web.archive.org/web/20250421084434/https://www.zeit.de/news/2025-04/21/der-andere-papst-franziskus-ist-tot,"Der Tag, der im Leben von Jorge Mario Bergoglio alles veränderte und in der römisch-katholischen Kirche so manches auch, war der 13. März 2013. Morgens war er noch Erzbischof von Buenos Aires. Am Abe… [+10955 chars]",,de,'Javier Milei'
https://orf.at/stories/3391204/,https://orf.at/stories/3391204/,0,orf.at,Weltweite Trauer um den Papst,"Staats- und Regierungschefs aus aller Welt haben nach dem Tod von Papst Franziskus ihre Trauer bekundet. Gewürdigt wurde vor allem sein Einsatz „an der Seite der Verletzlichsten und Schwächsten“, wie es der französische Präsident Emmanuel Macron ausdrückte.",https://ibs.orf.at/news?image=https%3A%2F%2Fassets.orf.at%2Fmims%2F2025%2F17%2F73%2Fcrops%2Fw%3D1200%2Ch%3D630%2Cq%3D75%2F2597560_master_997073_papst_reax_international_r.jpg%3Fs%3Da5b89bbcb8a52b1078d529223cdc16eb0e5f363a,2025-04-21T09:31:31Z,https://web.archive.org/web/20250421102855/https://orf.at/stories/3391204/,"Franziskus habe sein ganzes Leben lang für mehr Gerechtigkeit und für eine bestimmte Idee von Menschlichkeit, für eine brüderliche Menschlichkeit gekämpft, sagte Macron am Montag bei einem Besuch im … [+3296 chars]",,de,'Papst Franziskus'
https://www.welt.de/politik/ausland/article255981446/Attentat-auf-Robert-F-Kennedy-Tochter-kritisiert-Veroeffentlichung-von-Autopsiefotos.html,https://www.welt.de/politik/ausland/article255981446/Attentat-auf-Robert-F-Kennedy-Tochter-kritisiert-Veroeffentlichung-von-Autopsiefotos.html,0,www.welt.de,Attentat auf Robert F. Kennedy – Tochter kritisiert Veröffentlichung von Autopsiefotos,10.000 Seiten wurden freigegeben: Die Veröffentlichung von neuen Unterlagen zum Mord an Robert F. Kennedy ist bei den Hinterbliebenen auf scharfe Kritik gestoßen. Eine der Töchter des verstorbenen Politikers meldete sich zu Wort.,https://img.welt.de/img/politik/mobile255981442/4567939967-ci16x9-w1200/RFK-Assassination-Files-Released.jpg,2025-04-21T10:52:34Z,https://web.archive.org/web/20250421111347/https://www.welt.de/politik/ausland/article255981446/Attentat-auf-Robert-F-Kennedy-Tochter-kritisiert-Veroeffentlichung-von-Autopsiefotos.html,Nach der Freigabe von Dokumenten zum Attentat auf den ehemaligen US-Präsidenten Robert F. Kennedy im Jahr 1968 hat dessen Tochter Kerry die Veröffentlichung von Fotos seiner Autopsie scharf kritisier… [+3212 chars],,de,'Robert Kennedy'
https://www.stern.de/panorama/robert-f--kennedys-autopsiefoto-veroeffentlicht---tochter-entsetzt-35656390.html,https://www.stern.de/panorama/robert-f--kennedys-autopsiefoto-veroeffentlicht---tochter-entsetzt-35656390.html,0,www.stern.de,Attentat: Autopsiefoto von Robert F. Kennedy veröffentlicht – Tochter übt Kritik an Trump,Gemeinsam mit den geheimen Dokumenten zu dem Attentat auf Robert F. Kennedy sind auch Autopsiebilder an die Öffentlichkeit gelangt. Tochter Kerry Kennedy zeigt sich entsetzt.,https://image.stern.de/35656464/t/zJ/v1/w1440/r1.7778/-/kerry-kennedy--tochter-von-robert-f--kennedy.jpg,2025-04-21T11:31:00Z,https://web.archive.org/web/20250421124453/https://www.stern.de/panorama/robert-f--kennedys-autopsiefoto-veroeffentlicht---tochter-entsetzt-35656390.html,"Kopiere den aktuellen Link
Zur Merkliste hinzufügen
Gemeinsam mit den geheimen Dokumenten zu dem Attentat auf Robert F. Kennedy sind auch Autopsiebilder an die Öffentlichkeit gelangt. Tochter Kerry… [+3390 chars]",,de,'Robert Kennedy'
https://www.diepresse.com/19600993/papst-franziskus-gestorben-hirnblutung-als-todesursache,https://www.diepresse.com/19600993/papst-franziskus-gestorben-hirnblutung-als-todesursache,0,www.diepresse.com,Papst Franziskus gestorben: Hirnblutung als Todesursache?,Papst Franziskus ist am Ostermontag um 7.35 Uhr „ins Haus des Vaters zurückgekehrt“. Das Ableben dürfte nicht direkt mit seiner jüngsten Atemwegserkrankung zusammenhängen. Weltweit herrscht Trauer und Bestürzung.,https://img.diepresse.com/public/incoming/xmn9bc-POPE-FRANCIS/alternates/DPR_SOCIAL_NACHRICHTEN/POPE-FRANCIS,2025-04-21T12:53:45Z,https://web.archive.org/web/20250421130629/https://www.diepresse.com/19600993/papst-franziskus-gestorben-hirnblutung-als-todesursache,Papst Franziskus ist am Ostermontag um 7.35 Uhr ins Haus des Vaters zurückgekehrt. Das Ableben dürfte nicht direkt mit seiner jüngsten Atemwegserkrankung zusammenhängen. Weltweit herrscht Trauer und … [+10953 chars],,de,'Roberta Metsola'
https://www.welt.de/vermischtes/article255982098/Papst-gestorben-Leichnam-wahrscheinlich-ab-Mittwoch-im-Petersdom-Liveticker.html,https://www.welt.de/vermischtes/article255982098/Papst-gestorben-Leichnam-wahrscheinlich-ab-Mittwoch-im-Petersdom-Liveticker.html,0,www.welt.de,Leichnam wird wahrscheinlich am Mittwoch in den Petersdom gebracht,Nach dem Tod von Papst Franziskus würdigen Politiker und Kirchenvertreter auf der ganzen Welt seine Leistungen. Im Vatikan laufen derweil die Vorbereitungen für seine Beerdigung. Alle News im Liveticker.,https://img.welt.de/img/vermischtes/mobile255982088/2777934107-ci16x9-w1200/Papst-zum-Dreikoenigstag.jpg,2025-04-21T13:36:29Z,http://archive.md/20250421134209/https://www.welt.de/vermischtes/article255982098/Papst-gestorben-Leichnam-wahrscheinlich-ab-Mittwoch-im-Petersdom-Liveticker.html,Nach dem Tod von Papst Franziskus würdigen Politiker und Kirchenvertreter auf der ganzen Welt seine Leistungen. Im Vatikan laufen derweil die Vorbereitungen für seine Beerdigung. Alle News im Livetic… [+6818 chars],,de,'Javier Milei'
https://www.nzz.ch/panorama/chainsaw-jubelt-elon-musk-und-schwingt-die-motorsaege-des-kuenstlers-tute-di-tella-dieser-baut-jetzt-auch-eine-fuer-donald-trump-ld.1877383,https://www.nzz.ch/panorama/chainsaw-jubelt-elon-musk-und-schwingt-die-motorsaege-des-kuenstlers-tute-di-tella-dieser-baut-jetzt-auch-eine-fuer-donald-trump-ld.1877383,0,www.nzz.ch,"«Chainsaw!», jubelt Elon Musk und schwingt die Motorsäge des Künstlers Tute Di Tella. Dieser baut jetzt auch eine für Donald Trump","Die Motorsäge ist zum weltweiten Symbol für den Abbau von Bürokratie geworden. Der argentinische Künstler baut die prächtigsten Exemplare – für Milei, Musk und Trump.","https://img.nzz.ch/2025/03/21/2b688b83-aff4-413e-a634-c83d269e3ebf.jpeg?width=1200&height=675&fit=bounds&quality=75&auto=webp&crop=5649,3178,x0,y294&wmark=nzz",2025-04-21T14:58:28Z,https://web.archive.org/web/20250421161629/https://www.nzz.ch/panorama/chainsaw-jubelt-elon-musk-und-schwingt-die-motorsaege-des-kuenstlers-tute-di-tella-dieser-baut-jetzt-auch-eine-fuer-donald-trump-ld.1877383,"Der argentinische Präsident Javier Milei hat Elon Musk an der Conservative Political Action Conference im Februar in Maryland eine Kettensäge überreicht.
«Das ist die Kettensäge gegen die Bürokratie… [+6182 chars]",,de,'Donald Trump'
https://www.diepresse.com/19600993/todesursache-bekannt-papst-franziskus-starb-in-folge-eines-schlaganfalls,https://www.diepresse.com/19600993/todesursache-bekannt-papst-franziskus-starb-in-folge-eines-schlaganfalls,0,www.diepresse.com,Todesursache bekannt: Papst Franziskus starb in Folge eines Schlaganfalls,Papst Franziskus ist am Ostermontag gestorben. Am Abend wurden Details zur Todesursache bekannt gegeben. Weltweit herrscht Trauer und Bestürzung.,https://img.diepresse.com/public/incoming/xmn9bc-POPE-FRANCIS/alternates/DPR_SOCIAL_NACHRICHTEN/POPE-FRANCIS,2025-04-21T18:17:34Z,https://web.archive.org/web/20250421193545/https://www.diepresse.com/19600993/todesursache-bekannt-papst-franziskus-starb-in-folge-eines-schlaganfalls,"Papst Franziskus ist am Ostermontag gestorben. Am Abend wurden Details zur Todesursache bekannt gegeben. Weltweit herrscht Trauer und Bestürzung.
Papst Franziskus ist an einem Schlaganfall gestorben… [+11133 chars]",,de,'Roberta Metsola'
https://www.nzz.ch/international/buenos-aires-nimmt-abschied-wie-der-papst-den-menschen-in-erinnerung-bleibt-ld.1881012,https://www.nzz.ch/international/buenos-aires-nimmt-abschied-wie-der-papst-den-menschen-in-erinnerung-bleibt-ld.1881012,0,www.nzz.ch,Buenos Aires nimmt Abschied: Wie der Papst den Menschen in Erinnerung bleibt,In seiner Heimatstadt Buenos Aires ist Papst Franziskus den Menschen wegen seiner Bescheidenheit und seines Einsatzes für die Ärmsten in guter Erinnerung. Auch ein ehemaliger Kritiker trauert: Präsident Javier Milei.,"https://img.nzz.ch/2025/04/21/bf478fb6-7dc4-4538-903e-518fe0d91021.jpeg?width=1200&height=675&fit=bounds&quality=75&auto=webp&crop=3024,1701,x607,y350&wmark=nzz",2025-04-22T03:30:00Z,http://archive.md/20250422060552/https://www.nzz.ch/international/buenos-aires-nimmt-abschied-wie-der-papst-den-menschen-in-erinnerung-bleibt-ld.1881012,"In der Kathedrale von Buenos Aires gedenken Gläubige am Montag Papst Franziskus. Bevor er 2013 zum Papst gewählt wurde, war er Erzbischof von Buenos Aires.
Ein herbstliches Buenos Aires erwachte am … [+4497 chars]",,de,'Javier Milei'
