index,url,valid,domain,title,description,image,published,archive,content,quote,language,keyword
https://www.stern.de/lifestyle/leute/heidi-klum-gibt-strassen-interview-mit-juengster-tochter-lou-35633164.html,https://www.stern.de/lifestyle/leute/heidi-klum-gibt-strassen-interview-mit-juengster-tochter-lou-35633164.html,0,www.stern.de,Mode-Fragen: Heidi Klum und ihre Tochter Lou überraschen beim gemeinsamen Interview,Nach Leni und Sohn Henry zeigt sich jetzt auch Heidi Klums Tochter Lou der Öffentlichkeit. Gemeinsam mit ihrer Mutter hat sie in New York ein kurzes Interview gegeben.,https://image.stern.de/35633150/t/62/v2/w1440/r1.7778/-/heidi-klum.jpg,2025-04-11T11:20:00Z,https://web.archive.org/web/20250411120630/https://www.stern.de/lifestyle/leute/heidi-klum-gibt-strassen-interview-mit-juengster-tochter-lou-35633164.html,"Kopiere den aktuellen Link
Zur Merkliste hinzufügen
Nach Leni und Sohn Henry zeigt sich jetzt auch Heidi Klums Tochter Lou der Öffentlichkeit. Gemeinsam mit ihrer Mutter hat sie in New York ein kur… [+3532 chars]",,de,'Heidi Klum'
https://www.n-tv.de/leute/Rolling-Stones-Star-Mick-Jagger-hat-sich-heimlich-verlobt-article25697709.html,https://www.n-tv.de/leute/Rolling-Stones-Star-Mick-Jagger-hat-sich-heimlich-verlobt-article25697709.html,0,www.n-tv.de,Hochzeit mit 81? Jein: Rolling-Stones-Star Mick Jagger hat sich heimlich verlobt,"Rolling-Stones-Star Mick Jagger traut sich mit 81 Jahre nochmal. Oder vielleicht auch nicht. Zwar hält er um die Hand von Melanie Hamrick an, doch mit der Hochzeit hat es die 37-Jährige offenbar nicht eilig.",https://www.n-tv.de/img/incoming/crop25697735/9631324097-cImg_16_9-w1200/imago806075959.jpg,2025-04-11T11:32:14Z,,"Rolling-Stones-Star Mick Jagger traut sich mit 81 Jahre nochmal. Oder vielleicht auch nicht. Zwar hält er um die Hand von Melanie Hamrick an, doch mit der Hochzeit hat es die 37-Jährige offenbar nich… [+1538 chars]",,de,'Mick Jagger'
https://www.stern.de/news/us-gesundheitsminister-kennedy-kuendigt-studie-zu-ursache-von-autismus--epidemie--an-35633636.html,https://www.stern.de/news/us-gesundheitsminister-kennedy-kuendigt-studie-zu-ursache-von-autismus--epidemie--an-35633636.html,0,www.stern.de,"US-Gesundheitsminister Kennedy kündigt Studie zu Ursache von Autismus-""Epidemie"" an","Die Verbreitung von Autismus in den USA hat nach Ansicht von Gesundheitsminister Robert F. Kennedy Jr. das Ausmaß einer ""Epidemie"" erreicht. Deswegen will er die Ursachen jetzt mit einem ""gewaltigen Untersuchungs- und Forschungsaufwand"" untersuchen lassen, wi…",https://image.stern.de/35633638/t/fo/v1/w1440/r1.7778/-/11--kennedy-l-bei-kabinettssitzung-mit-trump-r---fc9167302e05bf39.jpg,2025-04-11T12:12:00Z,https://web.archive.org/web/20250411130347/https://www.stern.de/news/us-gesundheitsminister-kennedy-kuendigt-studie-zu-ursache-von-autismus--epidemie--an-35633636.html,"Kopiere den aktuellen Link
Zur Merkliste hinzufügen
Die Verbreitung von Autismus in den USA hat nach Ansicht von Gesundheitsminister Robert F. Kennedy Jr. das Ausmaß einer ""Epidemie"" erreicht. Desw… [+3352 chars]",,de,'Robert Kennedy'
https://www.zeit.de/gesundheit/2025-04/masern-ausbruch-usa-peter-hotez-robert-f-kennedy-jr,https://www.zeit.de/gesundheit/2025-04/masern-ausbruch-usa-peter-hotez-robert-f-kennedy-jr,0,www.zeit.de,"Masern-Ausbruch: ""Meine Sorge ist, dass wir unsere Impfgegner-Bewegung exportieren""",Peter Hotez ist Kinderarzt und Impfstoffforscher in Texas. Er erklärt das Comeback der Masern und wieso er Robert F. Kennedy Jr. nicht von der Wahrheit überzeugen konnte.,https://img.zeit.de/gesundheit/2025-04/masern-ausbruch-usa-peter-hotez-robert-f-kennedy-jr-bild/wide__1300x731,2025-04-11T12:34:26Z,http://archive.md/20250411123719/https://www.zeit.de/gesundheit/2025-04/masern-ausbruch-usa-peter-hotez-robert-f-kennedy-jr,"Peter Jay Hotez erforscht Impfstoffe und kämpft seit Jahren gegen Desinformation. Weil ihn die US-Gesundheitsbehörde bat, ""Bobby"" ins Gewissen zu reden, sprach er schon vor Jahren mit dem heutigen Ge… [+678 chars]",,de,'Robert Kennedy'
https://www.sueddeutsche.de/politik/bruessel-handelsstreit-usa-strategie-zurueckhaltung-li.3235177,https://www.sueddeutsche.de/politik/bruessel-handelsstreit-usa-strategie-zurueckhaltung-li.3235177,0,www.sueddeutsche.de,Handelskonflikt: Brüssel sieht sich in seinem Kurs bestätigt und wartet weiter ab,"Mit einiger Genugtuung hat die EU-Kommission beobachtet, wie Donald Trump seinen Zoll-Rundumschlag nach einer Woche wieder abschwächte. Weshalb sie bei ihrem Ansatz bleibt: aussitzen und Angebote machen – aber trotzdem weiter drohen.",https://www.sueddeutsche.de/2025/04/11/13621746-121c-4477-b688-6cffe2250e98.jpeg?q=60&fm=webp&width=1200&rect=0%2C80%2C1536%2C864,2025-04-11T14:10:51Z,,"Am Ende einer Woche, die im Zeichen des Trumpschen Zollkriegs stand, fühlt man sich in Brüssel in zweierlei Hinsicht bestätigt. Zuerst gilt das für die abwartende Haltung der Kommission. Sie hatte si… [+4037 chars]",,de,'Donald Trump'
https://www.stern.de/news/le-pen-urteil-wegen-veruntreuung--zwoelf-verurteilte-gehen-in-berufung-35634344.html,https://www.stern.de/news/le-pen-urteil-wegen-veruntreuung--zwoelf-verurteilte-gehen-in-berufung-35634344.html,0,www.stern.de,Le-Pen-Urteil wegen Veruntreuung: Zwölf Verurteilte gehen in Berufung,"Knapp zwei Wochen nach der Verurteilung der französischen Rechtspopulistin Marine Le Pen und weiterer Parteigenossen wegen Veruntreuung von EU-Geldern haben die Hälfte der Verurteilten Berufung eingelegt. Die Partei als Ganze und zwölf Verurteilte, unter ihne…",https://image.stern.de/35634346/t/eA/v1/w1440/r1.7778/-/11--marine-le-pen---1ce5259ed17f125d.jpg,2025-04-11T14:22:23Z,https://web.archive.org/web/20250411143649/https://www.stern.de/news/le-pen-urteil-wegen-veruntreuung--zwoelf-verurteilte-gehen-in-berufung-35634344.html,"Kopiere den aktuellen Link
Zur Merkliste hinzufügen
Knapp zwei Wochen nach der Verurteilung der französischen Rechtspopulistin Marine Le Pen und weiterer Parteigenossen wegen Veruntreuung von EU-Ge… [+1764 chars]",,de,'Le Pen'
https://orf.at/stories/3390372/,https://orf.at/stories/3390372/,0,orf.at,Le-Pen-Urteil: Zwölf Verurteilte legen Berufung ein,,https://orf.at/mojo/1_4_1/storyserver//news/common/images/og-fallback-news.png,2025-04-11T14:29:06Z,https://web.archive.org/web/20250412015648/https://orf.at/stories/3390372/,Knapp zwei Wochen nach der Verurteilung der französischen Rechtspopulistin Marine Le Pen und weiterer Parteigenossen wegen Veruntreuung von EU-Geldern haben die Hälfte der Verurteilten Berufung einge… [+1716 chars],,de,'Marine Le Pen'
https://www.welt.de/debatte/article255889750/Politik-und-Justiz-Das-Unbehagen-ueber-den-Fall-Le-Pen.html,https://www.welt.de/debatte/article255889750/Politik-und-Justiz-Das-Unbehagen-ueber-den-Fall-Le-Pen.html,0,www.welt.de,Das Unbehagen über den Fall Le Pen,"In Frankreich verliert eine aussichtsreiche Kandidatin fürs Präsidentenamt das passive Wahlrecht, in Rumänien zieht das Verfassungsgericht einen Wahlsieger aus dem Verkehr: WELT-Gastautor Martin Sonneborn findet es bedenklich, wie europäische Gerichte in die …",https://img.welt.de/img/debatte/mobile255921168/4197937167-ci16x9-w1200/Image-67f900d644d14358dd22fd22.jpg,2025-04-11T14:36:05Z,https://web.archive.org/web/20250411144245/https://www.welt.de/debatte/article255889750/Politik-und-Justiz-Das-Unbehagen-ueber-den-Fall-Le-Pen.html,"In Frankreich verliert eine aussichtsreiche Kandidatin fürs Präsidentenamt das passive Wahlrecht, in Rumänien zieht das Verfassungsgericht einen Wahlsieger aus dem Verkehr: WELT-Gastautor Martin Sonn… [+9461 chars]",,de,'Marine Le Pen'
https://www.faz.net/aktuell/gesellschaft/menschen/prinz-harry-besucht-verwundete-veteranen-in-lemberg-110414982.html,https://www.faz.net/aktuell/gesellschaft/menschen/prinz-harry-besucht-verwundete-veteranen-in-lemberg-110414982.html,0,www.faz.net,Prinz Harry besucht verwundete Veteranen in Lemberg,"Als zweites Mitglied der britischen Königsfamilie ist Prinz Harry während des Krieges in die Ukraine gereist: In einer ukrainischen Rehabilitationsklinik sprach der Herzog von Sussex mit verwundeten Soldaten, Zivilisten und Mitarbeitern.",https://media1.faz.net/ppmedia/aktuell/gesellschaft/2947822225/1.10415217/facebook_teaser/der-britische-prinz-harry-2-v.jpg,2025-04-11T14:44:36Z,https://web.archive.org/web/20250411144627/http://www.faz.net/aktuell/gesellschaft/menschen/prinz-harry-besucht-verwundete-veteranen-in-lemberg-110414982.html,"Der Herzog von Sussex ist immer für eine Überraschung gut, wobei sie diesmal keinen privaten, sondern einen in jeder Hinsicht ernsthaften Hintergrund hatte. Schon am Donnerstag besuchte Prinz Harry i… [+2502 chars]",,de,'Prinz William'
https://www.brigitte.de/aktuell/prinz-william-und-prinzessin-kate--royals-teilen-seltenes-foto-zum--national-pet-day--13974870.html,https://www.brigitte.de/aktuell/prinz-william-und-prinzessin-kate--royals-teilen-seltenes-foto-zum--national-pet-day--13974870.html,0,www.brigitte.de,"Prinz William und Prinzessin Kate: Royals teilen seltenes Foto zum ""National Pet Day""","Sie ist ein fester Bestandteil der Familie, zu sehen ist sie aber nur selten. William und Kate teilen ein Bild ihrer Hündin Orla.",https://image.brigitte.de/13974872/t/9Q/v1/w1440/r1.7778/-/11--royals-teilen-seltenes-foto-zum--national-pet-day----1-1---spoton-article-1093031.jpg,2025-04-11T14:49:00Z,https://web.archive.org/web/20250412060528/https://www.brigitte.de/aktuell/prinz-william-und-prinzessin-kate--royals-teilen-seltenes-foto-zum--national-pet-day--13974870.html,"Sie ist ein fester Bestandteil der Familie, zu sehen ist sie aber nur selten. William und Kate teilen ein Bild ihrer Hündin Orla.
Seit Jahren ist Familienhündin Orla ein wichtiger Bestandteil des Le… [+1483 chars]",,de,'Prinz William'
https://www.zeit.de/politik/ausland/2025-04/frankreich-marine-le-pen-prozess-berufung,https://www.zeit.de/politik/ausland/2025-04/frankreich-marine-le-pen-prozess-berufung,0,www.zeit.de,Frankreich: Zwölf im Le-Pen-Prozess Verurteilte gehen in Berufung,Marine Le Pen selbst und elf weitere Parteimitglieder gehen in Berufung gegen ihre Verteilung wegen Veruntreuung. Ihre Haft- und Geldstrafe sind damit vorerst ausgesetzt.,https://img.zeit.de/politik/ausland/2025-04/verurteilung-le-pen-parteimitglieder-berufung-bild/wide__1300x731,2025-04-11T15:21:02Z,http://archive.md/20250411154915/https://www.zeit.de/politik/ausland/2025-04/frankreich-marine-le-pen-prozess-berufung,Knapp zwei Wochen nach der Verurteilung der französischen Rechtspopulistin Marine Le Pen und weiterer Parteimitglieder wegen Veruntreuung von EU-Geldern haben die Hälfte der Verurteilten Berufung ein… [+1784 chars],,de,'Le Pen'
https://www.stern.de/news/erdogan-wirft-israel-torpedierung-der--revolution--in-syrien-vor-35634758.html,https://www.stern.de/news/erdogan-wirft-israel-torpedierung-der--revolution--in-syrien-vor-35634758.html,0,www.stern.de,"Erdogan wirft Israel Torpedierung der ""Revolution"" in Syrien vor","Der türkische Präsident Recep Tayyip Erdogan hat Israel eine gezielte Spaltung Syriens vorgeworfen, um die ""Revolution"", die zum Sturz des Machthabers Baschar al-Assad geführt hat, zunichte zu machen. ""Israel versucht, die Revolution vom 8. Dezember zu torped…",https://image.stern.de/35634760/t/wq/v1/w1440/r1.7778/-/11--ahmed-alscharaa-in-antalya---5573715852660794.jpg,2025-04-11T17:46:39Z,https://web.archive.org/web/20250411175834/https://www.stern.de/news/erdogan-wirft-israel-torpedierung-der--revolution--in-syrien-vor-35634758.html,"Kopiere den aktuellen Link
Zur Merkliste hinzufügen
Der türkische Präsident Recep Tayyip Erdogan hat Israel eine gezielte Spaltung Syriens vorgeworfen, um die ""Revolution"", die zum Sturz des Machth… [+2048 chars]",,de,'Recep Tayyip Erdogan'
https://www.stern.de/lifestyle/leute/prinz-harry-ueber-prozess-in-london---meine-schlimmsten-befuerchtungen-bestaetigt--35634822.html,https://www.stern.de/lifestyle/leute/prinz-harry-ueber-prozess-in-london---meine-schlimmsten-befuerchtungen-bestaetigt--35634822.html,0,www.stern.de,"Prinz Harry über Prozess in London: ""Meine schlimmsten Befürchtungen bestätigt""","Prinz Harry fühlt sich nach seinem Gerichtstermin ""erschöpft"" und spricht in einem aktuellen Interview über seine großen Enttäuschungen.",https://image.stern.de/35634826/t/pa/v1/w1440/r1.7778/-/11---meine-schlimmsten-befuerchtungen-bestaetigt----16-9---spoton-article-1093068.jpg,2025-04-11T19:19:00Z,,"Kopiere den aktuellen Link
Zur Merkliste hinzufügen
Prinz Harry fühlt sich nach seinem Gerichtstermin ""erschöpft"" und spricht in einem aktuellen Interview über seine großen Enttäuschungen.
""Erschö… [+3138 chars]",,de,'Prinz William'
https://www.brigitte.de/aktuell/prinz-harry-ueber-prozess-in-london---ich-fuehle-mich-erschoepft-und-ueberfordert--13974920.html,https://www.brigitte.de/aktuell/prinz-harry-ueber-prozess-in-london---ich-fuehle-mich-erschoepft-und-ueberfordert--13974920.html,0,www.brigitte.de,"Prinz Harry über Prozess in London: ""Ich fühle mich erschöpft und überfordert""","Prinz Harry fühlt sich nach seinem Gerichtstermin ""erschöpft"" und spricht in einem aktuellen Interview über seine großen Enttäuschungen.",https://image.brigitte.de/13974922/t/Wo/v1/w1440/r1.7778/-/11---ich-fuehle-mich-erschoepft-und-ueberfordert----1-1---spoton-article-1093068.jpg,2025-04-11T19:19:00Z,https://web.archive.org/web/20250411193642/https://www.brigitte.de/aktuell/prinz-harry-ueber-prozess-in-london---ich-fuehle-mich-erschoepft-und-ueberfordert--13974920.html,"Prinz Harry fühlt sich nach seinem Gerichtstermin ""erschöpft"" und spricht in einem aktuellen Interview über seine großen Enttäuschungen.
""Erschöpft und überfordert"" zeigte sich Prinz Harry (40), als… [+3194 chars]",,de,'Prinz William'
https://www.zeit.de/politik/deutschland/2025-04/jens-spahn-cdu-umgang-mit-afd,https://www.zeit.de/politik/deutschland/2025-04/jens-spahn-cdu-umgang-mit-afd,0,www.zeit.de,Bundestag: Jens Spahn empfiehlt anderen Umgang mit der AfD,"Die Politik müsse anerkennen, dass Millionen Menschen AfD gewählt hätten, sagt Unionsfraktionsvize Spahn. Zugleich empfiehlt er, nicht ""über jedes Stöckchen"" zu springen.",https://img.zeit.de/politik/deutschland/2025-04/jens-spahn-cdu-umgang-mit-afd-bild/wide__1300x731,2025-04-11T23:33:40Z,http://archive.md/20250411234605/https://www.zeit.de/politik/deutschland/2025-04/jens-spahn-cdu-umgang-mit-afd,"Der stellvertretende Vorsitzende der Unions-Bundestagsfraktion, Jens Spahn (CDU), plädiert angesichts des starken Wahlergebnisses der AfD für einen veränderten Umgang mit der Partei im Bundestag. ""Ic… [+1674 chars]",,de,'Jens Spahn'
https://www.stern.de/news/kanada-und-usa-wollen-gespraeche-ueber-neues-handelsabkommen-im-mai-beginnen-35634982.html,https://www.stern.de/news/kanada-und-usa-wollen-gespraeche-ueber-neues-handelsabkommen-im-mai-beginnen-35634982.html,0,www.stern.de,Kanada und USA wollen Gespräche über neues Handelsabkommen im Mai beginnen,"Kanada und die USA wollen Gespräche über ein neues Handelsabkommen nach Angaben des kanadischen Premierministers Mark Carney in wenigen Wochen führen. Er habe sich mit US-Präsident Donald Trump darauf geeinigt, dass ""die Gespräche Anfang Mai beginnen werden"",…",https://image.stern.de/35634984/t/EW/v1/w1440/r1.7778/-/12--kanadas-premierminister-mark-carney---12a7e9214b2c0c31.jpg,2025-04-11T23:53:30Z,,"Kopiere den aktuellen Link
Zur Merkliste hinzufügen
Kanada und die USA wollen Gespräche über ein neues Handelsabkommen nach Angaben des kanadischen Premierministers Mark Carney in wenigen Wochen fü… [+823 chars]",,de,'Donald Trump'
https://www.n-tv.de/leute/Prinz-Harry-fuehlt-sich-erschoepft-und-ueberfordert-article25699678.html,https://www.n-tv.de/leute/Prinz-Harry-fuehlt-sich-erschoepft-und-ueberfordert-article25699678.html,0,www.n-tv.de,"Wegen Prozess in London: Prinz Harry fühlt sich ""erschöpft und überfordert""","Prinz Harry kämpft vor Gericht um Polizeischutz für seine Familie in Großbritannien. In einem Interview spricht der Sohn von König Charles jetzt über seinen Streit mit der britischen Regierung und offenbart dabei tiefe Enttäuschung: ""Meine schlimmsten Befürch…",https://www.n-tv.de/img/incoming/crop25699680/8001324338-cImg_16_9-w1200/518074076.jpg,2025-04-12T00:22:23Z,,Prinz Harry kämpft vor Gericht um Polizeischutz für seine Familie in Großbritannien. In einem Interview spricht der Sohn von König Charles jetzt über seinen Streit mit der britischen Regierung und of… [+3252 chars],,de,'Prinz William'
https://www.nzz.ch/feuilleton/seth-rogen-traeumt-als-studioboss-vom-naechsten-rosemarys-baby-oder-von-einem-neuen-annie-hall-oder-einem-grossartigen-film-der-nicht-von-einem-perversling-inszeniert-ist-ld.1877193,https://www.nzz.ch/feuilleton/seth-rogen-traeumt-als-studioboss-vom-naechsten-rosemarys-baby-oder-von-einem-neuen-annie-hall-oder-einem-grossartigen-film-der-nicht-von-einem-perversling-inszeniert-ist-ld.1877193,0,www.nzz.ch,"Seth Rogen träumt als Studioboss vom nächsten «Rosemary’s Baby» oder von einem neuen «Annie Hall» – «oder einem grossartigen Film, der nicht von einem Perversling inszeniert ist»",In der Hollywood-Satire «The Studio» stichelt Rogen gegen die eigene Branche. Nicht nur wegen des Gastauftritts von Martin Scorsese ist die Serie grandios.,"https://img.nzz.ch/2025/04/11/e4f6afbc-a4e8-4da1-a069-0dfdb48b7abc.jpeg?width=1200&height=674&fit=bounds&quality=75&auto=webp&crop=2875,1617,x104,y0&wmark=nzz",2025-04-12T03:30:00Z,http://archive.md/20250412044054/https://www.nzz.ch/feuilleton/seth-rogen-traeumt-als-studioboss-vom-naechsten-rosemarys-baby-oder-von-einem-neuen-annie-hall-oder-einem-grossartigen-film-der-nicht-von-einem-perversling-inszeniert-ist-ld.1877193,"Hollywood-Stars noch und noch treten in «The Studio» auf: Mit Olivia Wilde bekommt es der Studioboss (Seth Rogen) auch zu tun.
In der zweiten und allerbesten Episode von «The Studio» besucht Matt Re… [+7256 chars]",,de,'Ron Howard'
https://www.faz.net/aktuell/politik/inland/kann-friedrich-merz-kanzler-sein-weg-an-die-spitze-110414479.html,https://www.faz.net/aktuell/politik/inland/kann-friedrich-merz-kanzler-sein-weg-an-die-spitze-110414479.html,0,www.faz.net,"Überflieger, Underperformer: Merz' Weg zur Kanzlerschaft","Ob über- oder unterschätzt: Friedrich Merz wird bald Kanzler. Sein Weg an die Spitze ist von der Frage begleitet, ob er es kann.",https://media0.faz.net/ppmedia/aktuell/politik/2260424917/1.10415604/facebook_teaser/belesen-und-impulsiv-friedrich.jpg,2025-04-12T06:10:08Z,https://web.archive.org/web/20250412063859/https://www.faz.net/aktuell/politik/inland/kann-friedrich-merz-kanzler-sein-weg-an-die-spitze-110414479.html,"Ist Friedrich Merz überschätzt oder unterschätzt? Die Frage wird gestellt, seit er vor sieben Jahren auf die bundespolitische Bühne zurückgekehrt ist, und stets hing die Antwort vom Zeitpunkt ab. Der… [+11279 chars]",,de,'Helmut Kohl'
https://www.welt.de/politik/deutschland/video255925964/Kanzlerwahl-Friedrich-Merz-auf-Bewaehrungsprobe-Wird-er-Kanzler-koennen.html,https://www.welt.de/politik/deutschland/video255925964/Kanzlerwahl-Friedrich-Merz-auf-Bewaehrungsprobe-Wird-er-Kanzler-koennen.html,0,www.welt.de,Friedrich Merz auf Bewährungsprobe – Wird er Kanzler können?,Am 6. Mai soll Friedrich Merz zum neuen Bundeskanzler gewählt werden. Kann er Kanzler? Darüber spricht Reporter Marco Reinke. Merz sei auf „Bewährungsprobe“ – die Frage tatsächlich beantworten kann man erst nach Amtsantritt.,https://img.welt.de/img/politik/deutschland/mobile255925958/9257938287-ci16x9-w1200/Friedrich-Merz.jpg,2025-04-12T07:51:05Z,https://web.archive.org/web/20250412080005/https://www.welt.de/politik/deutschland/video255925964/Kanzlerwahl-Friedrich-Merz-auf-Bewaehrungsprobe-Wird-er-Kanzler-koennen.html,Am 6. Mai soll Friedrich Merz zum neuen Bundeskanzler gewählt werden. Kann er Kanzler? Darüber spricht Reporter Marco Reinke. Merz sei auf Bewährungsprobe die Frage tatsächlich beantworten kann man e… [+80 chars],,de,'Friedrich Merz'
https://www.bild.de/politik/ausland-und-internationales/betrug-im-studium-eu-parlaments-chefin-metsola-schrieb-ab-67f944259a7033012b6d1350,https://www.bild.de/politik/ausland-und-internationales/betrug-im-studium-eu-parlaments-chefin-metsola-schrieb-ab-67f944259a7033012b6d1350,0,www.bild.de,„Schwere Mängel“ in Uni-Arbeit - Schummelei im Studium bei der EU-Parlaments-Chefin,EU-Parlaments-Präsidentin Roberta Metsola gilt als ranghöchste EU-Politikerin – soll aber in ihrer Abschlussarbeit an der Uni Malta abgeschrieben haben.,"https://images.bild.de/67f944259a7033012b6d1350/c3cb33322c43c7c2e9727cab6ddbf401,eb318192?w=1280",2025-04-12T10:24:59Z,http://archive.md/20250412103632/https://www.bild.de/politik/ausland-und-internationales/betrug-im-studium-eu-parlaments-chefin-metsola-schrieb-ab-67f944259a7033012b6d1350,"Brüssel/Straßburg Die formell ranghöchste EU-Politikerin hat bei ihrer Abschlussarbeit an der Uni seinerzeit offensichtlich fünfe gerade sein lassen! 
EU-Parlaments-Präsidentin Roberta Metsola (46) … [+1955 chars]",,de,'Roberta Metsola'
https://www.n-tv.de/politik/Weltbank-und-IWF-unterstuetzen-Milei-mit-Milliarden-article25700322.html,https://www.n-tv.de/politik/Weltbank-und-IWF-unterstuetzen-Milei-mit-Milliarden-article25700322.html,0,www.n-tv.de,"Der ""Anarcho-Kapitalist"" jubelt: Weltbank und IWF unterstützen Milei mit Milliarden",Frisches Geld für Argentinien: Mehrere internationale Organisationen gewähren dem südamerikanischen Land eine kräftige Finanzspritze - und adeln den radikalen Sparkurs von Präsident Milei. Dieser verspricht seinem Volk daraufhin Jahrzehnte voller Wachstum.,https://www.n-tv.de/img/incoming/crop25700326/1941325036-cImg_16_9-w1200/509164094.jpg,2025-04-12T13:25:06Z,https://web.archive.org/web/20250413020035/https://www.n-tv.de/politik/Weltbank-und-IWF-unterstuetzen-Milei-mit-Milliarden-article25700322.html,Frisches Geld für Argentinien: Mehrere internationale Organisationen gewähren dem südamerikanischen Land eine kräftige Finanzspritze - und adeln den radikalen Sparkurs von Präsident Milei. Dieser ver… [+4521 chars],,de,'nan nan'
https://www.welt.de/politik/ausland/article255928330/Javier-Milei-Lob-von-IWF-und-Weltbank-Argentinien-erhaelt-42-Milliarden-Dollar.html,https://www.welt.de/politik/ausland/article255928330/Javier-Milei-Lob-von-IWF-und-Weltbank-Argentinien-erhaelt-42-Milliarden-Dollar.html,0,www.welt.de,IWF und Weltbank loben Milei – Argentinien erhält 42 Milliarden Dollar,"Internationale Institutionen helfen Argentinien finanziell. Sie loben dabei den beeindruckenden Fortschritt bei der Stabilisierung der Wirtschaft durch Präsident Milei. Das Geld fließe auch, weil man der Regierung vertraue, die Reformen voranzutreiben.",https://img.welt.de/img/politik/ausland/mobile255928328/0197939997-ci16x9-w1200/FILE-PHOTO-Argentina-and-the-IMF-a-troubled-history.jpg,2025-04-12T14:26:50Z,https://web.archive.org/web/20250412143732/https://www.welt.de/politik/ausland/article255928330/Javier-Milei-Lob-von-IWF-und-Weltbank-Argentinien-erhaelt-42-Milliarden-Dollar.html,"Internationale Institutionen helfen Argentinien finanziell. Sie loben dabei den beeindruckenden Fortschritt bei der Stabilisierung der Wirtschaft durch Präsident Milei. Das Geld fließe auch, weil man… [+4485 chars]",,de,'nan Si'
https://www.welt.de/wirtschaft/article255906864/Trumps-Zoelle-USA-nehmen-20-Warengruppen-von-Zoellen-aus-Apple-und-Nvidia-profitieren-Liveticker.html,https://www.welt.de/wirtschaft/article255906864/Trumps-Zoelle-USA-nehmen-20-Warengruppen-von-Zoellen-aus-Apple-und-Nvidia-profitieren-Liveticker.html,0,www.welt.de,USA nehmen 20 Warengruppen von Zöllen aus – Apple und Nvidia profitieren,Die nächste Überraschung im Zollstreit: Die USA nehmen Smartphones und Computer von den Zollerhöhungen von Präsident Donald Trump aus. Eine Begründung liefert das Weiße Haus dafür nicht. Alle Entwicklungen im Liveticker.,https://img.welt.de/img/wirtschaft/mobile255929268/5527937677-ci16x9-w1200/FILE-PHOTO-Smartphones-in-London.jpg,2025-04-12T19:38:00Z,http://archive.md/20250412195243/https://www.welt.de/wirtschaft/article255906864/Trumps-Zoelle-USA-nehmen-20-Warengruppen-von-Zoellen-aus-Apple-und-Nvidia-profitieren-Liveticker.html,Die nächste Überraschung im Zollstreit: Die USA nehmen Smartphones und Computer von den Zollerhöhungen von Präsident Donald Trump aus. Eine Begründung liefert das Weiße Haus dafür nicht. Alle Entwick… [+26951 chars],,de,'Mark Carney'
https://www.tagesschau.de/inland/merz-mindestlohnt-einkommenssteuer-100.html,https://www.tagesschau.de/inland/merz-mindestlohnt-einkommenssteuer-100.html,0,www.tagesschau.de,"Merz: Einkommensteuer-Senkung ""ist nicht fix""","Keine beschlossene Sache: Mindestlohnanstieg auf 15 Euro im kommenden Jahr und Senkung der Einkommensteuer. Eine Steuersenkung müsse der öffentliche Haushalt hergeben, so der designierte Bundeskanzler Merz.",https://images.tagesschau.de/image/ec9842f4-a1a2-457a-8d6b-d14b5b22a6e3/AAABliWrGLs/AAABkZLhkrw/16x9-1280/friedrich-merz-238.jpg,2025-04-13T00:56:11Z,https://web.archive.org/web/20250413010749/https://www.tagesschau.de/inland/merz-mindestlohnt-einkommenssteuer-100.html,"Stand: 13.04.2025 02:56 Uhr
Keine beschlossene Sache: Mindestlohnanstieg auf 15 Euro im kommenden Jahr und Senkung der Einkommensteuer. Eine Steuersenkung müsse der öffentliche Haushalt hergeben, so… [+2749 chars]",,de,'nan nan'
