index,url,valid,domain,title,description,image,published,archive,content,quote,language,keyword
https://www.welt.de/kultur/stuetzen-der-gesellschaft/plus247842900/Freie-Waehler-Deutsche-Erde-Vaterland-Mit-Aiwanger-auf-dem-Gallimarkt.html,https://www.welt.de/kultur/stuetzen-der-gesellschaft/plus247842900/Freie-Waehler-Deutsche-Erde-Vaterland-Mit-Aiwanger-auf-dem-Gallimarkt.html,0,www.welt.de,"Deutsche Erde, Vaterland – Mit Aiwanger auf dem Gallimarkt","Zum Wahlkampfende in die tiefste Provinz: Nach denkwürdigen Wochen voller Wendungen bringt Hubert Aiwanger von den Freien Wählern zum letzten Mal ein Bierzelt zum Toben. Kein Wunder, dass Journalisten ihn fürchten.",https://img.welt.de/img/kultur/stuetzen-der-gesellschaft/mobile247843440/2581356237-ci16x9-w1200-fnov-fpotl-fpi157750653/Kombo-Don-Alphonso-Mai.jpg,2023-10-06T06:56:58Z,,"Die WELT als ePaper: Die vollständige Ausgabe steht Ihnen bereits am Vorabend zur Verfügung so sind Sie immer hochaktuell informiert. Weitere Informationen: http://epaper.welt.de 
 Der Kurz-Link die… [+49 chars]",,de,'Hubert Aiwanger'
https://www.faz.net/aktuell/politik/ausland/meloni-nimmt-die-eu-in-den-blick-fuehrende-gestalt-der-neuen-rechten-19222462.html,https://www.faz.net/aktuell/politik/ausland/meloni-nimmt-die-eu-in-den-blick-fuehrende-gestalt-der-neuen-rechten-19222462.html,0,www.faz.net,Kommentar zu Giorgia Meloni: Europas Brandmauerspecht,"Nach einem Jahr sitzt Giorgia Meloni in Rom fest im Sattel, sie weiß große Teile der Bürger hinter sich. Als führende Gestalt der „neuen Rechten“ nimmt sie nun die EU in den Blick.",https://media0.faz.net/ppmedia/aktuell/politik/2815299335/1.9222760/facebook_teaser/eu-kommissionspraesidentin-von.jpg,2023-10-06T07:42:04Z,,Ministerpräsidentin Giorgia Meloni und ihre Mitte-rechts-Koalition sind seit knapp einem Jahr im Amt. Die linke Opposition in Rom und die politischen Sittenwächter in Deutschland stellen ihr ein schl… [+4481 chars],,de,'Giorgia Meloni'
https://www.tagesschau.de/ausland/europa/ukraine-nach-angriff-hrosa-100.html,https://www.tagesschau.de/ausland/europa/ukraine-nach-angriff-hrosa-100.html,0,www.tagesschau.de,"Raketenangriff auf Hrosa: ""Das war keine blinde Attacke""",Mehr als 50 Menschen sind bei dem russischen Angriff auf ein Café und ein Geschäft in der Ostukraine getötet worden - laut Präsident Selenskyj ein Sechstel der Dorfbevölkerung. UN und EU verurteilten den Angriff scharf.,https://images.tagesschau.de/image/5196cd72-b399-4825-8187-98d27b78e6e0/AAABiwQo5hk/AAABibBxqrQ/16x9-1280/hrosa-100.jpg,2023-10-06T08:44:31Z,,"Stand: 06.10.2023 10:44 Uhr
Mehr als 50 Menschen sind bei dem russischen Angriff auf ein Café und ein Geschäft in der Ostukraine getötet worden - laut Präsident Selenskyj ein Sechstel der Dorfbevölk… [+3441 chars]",,de,'nan nan'
https://www.morgenpost.de/berlin/article239747279/Heidi-und-Leni-Klum-in-Berlin.html,https://www.morgenpost.de/berlin/article239747279/Heidi-und-Leni-Klum-in-Berlin.html,0,www.morgenpost.de,Leute: Heidi und Leni Klum in Berlin,"Das Mutter-Tochter-Model-Duo Heidi (50) und Leni Klum (19) ist am Freitagabend im Rahmen einer Veranstaltung der Unterwäschemarke Intimissimi in Berlin gewesen. Nach dem roten Teppich war ein Abendessen im Bode-Museum geplant, wie es in einer Ankündigung der …",https://img.morgenpost.de/img/berlin/crop239747277/6492605396-w820-cv16_9-q85/Roter-Teppich-beim-Intimissimi-Dinner.jpg,2023-10-06T17:54:22Z,,"Heidi Klum (r) kommt mit ihrer Tochter Leni zu einer Veranstaltung des Lingerie-Labels Intimissimi im Bode Museum.
Foto: Monika Skolimowska/dpa
Das Mutter-Tochter-Model-Duo Heidi (50) und Leni Klum… [+491 chars]",,de,'Heidi Klum'
https://www.stern.de/gesellschaft/regional/berlin-brandenburg/leute--heidi-und-leni-klum-in-berlin-33890230.html,https://www.stern.de/gesellschaft/regional/berlin-brandenburg/leute--heidi-und-leni-klum-in-berlin-33890230.html,0,www.stern.de,Leute: Heidi und Leni Klum in Berlin,"Das Mutter-Tochter-Model-Duo Heidi (50) und Leni Klum (19) ist am Freitagabend im Rahmen einer Veranstaltung der Unterwäschemarke Intimissimi in Berlin gewesen. Nach dem roten Teppich war ein Abendessen im Bode-Museum geplant, wie es in einer Ankündigung der …",https://image.stern.de/33890232/t/eE/v1/w1440/r1.7778/-/06--urnnewsmldpacom2009010123100699470143v3w800h600l638t509r1918b1527jpeg---1f7e29568fee6a8d.jpg,2023-10-06T17:54:22Z,,Das Mutter-Tochter-Model-Duo Heidi (50) und Leni Klum (19) ist am Freitagabend im Rahmen einer Veranstaltung der Unterwäschemarke Intimissimi in Berlin gewesen. Nach dem roten Teppich war ein Abendes… [+901 chars],,de,'Leni Klum'
https://www.zeit.de/news/2023-10/06/heidi-und-leni-klum-in-berlin,https://www.zeit.de/news/2023-10/06/heidi-und-leni-klum-in-berlin,0,www.zeit.de,Leute: Heidi und Leni Klum in Berlin,,,2023-10-06T17:54:22Z,,"When browsing with ads:
We collect personal data and also transmit it to third-party providers
 that help us improve and finance our digital content. Some of the information stored on your device, … [+821 chars]",,de,'Leni Klum'
https://www.morgenpost.de/vermischtes/stars-und-promis/article239747273/Heidi-und-Leni-Klum-in-Berlin.html,https://www.morgenpost.de/vermischtes/stars-und-promis/article239747273/Heidi-und-Leni-Klum-in-Berlin.html,0,www.morgenpost.de,Leute: Heidi und Leni Klum in Berlin,Heidi Klum ist mit Tochter Leni zurück in Berlin. Die beiden sind zu Gast bei einer Intimissimi-Veranstaltung im Bode-Museum.,https://img.morgenpost.de/img/stars-und-promis/crop239747271/9952609065-w820-cv16_9-q85/Heidi-und-Leni-Klum.jpg,2023-10-06T18:02:37Z,,Berlin. Das Mutter-Tochter-Model-Duo Heidi (50) und Leni Klum (19) ist im Rahmen einer Veranstaltung der Unterwäschemarke Intimissimi in Berlin zu Gast. Nach dem roten Teppich war ein Abendessen im B… [+339 chars],,de,'Leni Klum'
https://www.kino.de/film/in-time-deine-zeit-laeuft-ab-2011/news/heute-im-free-tv-beklemmender-sci-fi-thriller-schockt-mit-brutaler-zukunftsvorhersage/,https://www.kino.de/film/in-time-deine-zeit-laeuft-ab-2011/news/heute-im-free-tv-beklemmender-sci-fi-thriller-schockt-mit-brutaler-zukunftsvorhersage/,0,www.kino.de,Heute im Free-TV: Beklemmender Sci-Fi-Thriller schockt mit brutaler Zukunftsvorhersage,Sci-Fi-Fans dürfen sich über mitreißende Unterhaltung am Samstagabend mit Justin Timberlake in der Hauptrolle im Free-TV freuen...,https://crops.giga.de/44/20/dc/efabcfbe096d9f78e63fa54e0b_YyAzNDU4eDE5NDUrMjMrMTMyAnJlIDE5MjAgMTA4MAM0MGViYjk5ODM1MA==.jpg,2023-10-07T05:01:52Z,,"Sci-Fi-Fans dürfen sich über mitreißende Unterhaltung am Samstagabend mit Justin Timberlake in der Hauptrolle im Free-TV freuen.
In Time - Deine Zeit läuft ab
Streaming bei:
<ul><li> Flatrate
</l… [+2378 chars]",,de,'Cillian Murphy'
https://www.faz.net/aktuell/politik/wahl-in-hessen/boris-rhein-vor-der-landtagswahl-in-hessen-der-schattenboxer-19219719.html,https://www.faz.net/aktuell/politik/wahl-in-hessen/boris-rhein-vor-der-landtagswahl-in-hessen-der-schattenboxer-19219719.html,0,www.faz.net,"Boris Rhein, der Schattenboxer","Boris Rhein ist es gelungen, die CDU in Hessen zu erneuern und seinen frühen Vorsprung in den Umfragen zu sichern. Das verdankt er auch der unbeliebten Ampelkoalition im Bund.",https://media0.faz.net/ppmedia/aktuell/146816800/1.9219718/facebook_teaser_fplus/wahlkampf-in-der.jpg,2023-10-07T10:17:10Z,,"Boris Rhein zögert. Ein Mann hält ihm ein Megafon hin, durch das er seine Ansprache halten soll. Er könne auch einfach laut sprechen, erwidert Rhein. Vor ihm stehen knapp 30 Leute von der Jungen Unio… [+884 chars]",,de,'Boris Rhein'
https://www.stern.de/lifestyle/mode/heidi-klum-und-leni-klum--mutter-und-tochter-zeigen-wieder-neue-dessous-33891550.html,https://www.stern.de/lifestyle/mode/heidi-klum-und-leni-klum--mutter-und-tochter-zeigen-wieder-neue-dessous-33891550.html,0,www.stern.de,Heidi Klum und Leni Klum: Mutter und Tochter zeigen wieder neue Dessous,Heidi Klum und Leni Klum werden zu Wiederholungstäterinnen: In Berlin haben Mutter und Tochter wieder neue Dessous vorgestellt.,https://image.stern.de/33891554/t/OF/v1/w1440/r1.7778/-/07--mutter-und-tochter-zeigen-wieder-neue-dessous---16-9---spoton-article-1053751.jpg,2023-10-07T11:23:00Z,,"Heidi Klum und Leni Klum werden zu Wiederholungstäterinnen: In Berlin haben Mutter und Tochter wieder neue Dessous vorgestellt.
Heidi Klum (50) und Tochter Leni Klum (19) haben einmal mehr ihre krea… [+1872 chars]",,de,'Heidi Klum'
https://www.n-tv.de/leute/Heidi-und-Leni-Klum-posieren-wieder-in-Dessous-article24447191.html,https://www.n-tv.de/leute/Heidi-und-Leni-Klum-posieren-wieder-in-Dessous-article24447191.html,0,www.n-tv.de,Neue Intimissimi-Kollektion: Heidi und Leni Klum posieren wieder in Dessous,Bereits mehrfach sorgen Heidi und Leni Klum in Dessous für Aufsehen. In Berlin präsentiert das Mutter-Tochter-Duo nun seine neue gemeinsame Kollektion mit dem Bekleidungslabel Intimissimi. Auch weitere bekannte Gesichter sind bei dem Event zu Gast.,https://bilder3.n-tv.de/img/incoming/crop24447218/8951325428-cImg_16_9-w1200/429133225.jpg,2023-10-07T11:58:55Z,,Bereits mehrfach sorgen Heidi und Leni Klum in Dessous für Aufsehen. In Berlin präsentiert das Mutter-Tochter-Duo nun seine neue gemeinsame Kollektion mit dem Bekleidungslabel Intimissimi. Auch weite… [+1891 chars],,de,'Heidi Klum'
https://www.tagesspiegel.de/berlin/klum-und-klummer-heidi-und-tochter-prasentieren-unterwasche-im-berliner-bode-museum-10587265.html,https://www.tagesspiegel.de/berlin/klum-und-klummer-heidi-und-tochter-prasentieren-unterwasche-im-berliner-bode-museum-10587265.html,0,www.tagesspiegel.de,Klum und Klümmer: Heidi und Tochter präsentieren Unterwäsche im Berliner Bode-Museum,"Bei einem Werbeevent in Berlin stellt Heidi Klum wie immer ihre Professionalität unter Beweis, Tochter Leni dagegen bleibt unsichtbar. Ein Abend voller Missverständnisse.",https://www.tagesspiegel.de/images/heidi-klum-mit-tochter-leni-klum-bei-der-ankunft-zum-exklusiven-intimissimi-dinner-event-im-bode-museum-berlin-06102/alternates/BASE_16_9_W1400/heidi-klum-mit-tochter-leni-klum-bei-der-ankunft-zum-exklusiven-intimissimi-dinner-event-im-bode-museum-berlin-06102.jpeg,2023-10-07T13:13:05Z,,"Vielleicht hat Heidi Klum den Ratschlag von Johann Wolfgang von Goethe, Wenn Kinder klein sind, gib ihnen Wurzeln. Wenn sie groß sind, gib ihnen Flügel, einfach falsch verstanden. Galt die Aufnahme i… [+3354 chars]",,de,'Heidi Klum'
https://www.focus.de/kultur/royals/einbruch-an-weihnachten-2021-nach-mord-plaenen-muss-windsor-eindringling-ins-gefaengnis_id_220277773.html,https://www.focus.de/kultur/royals/einbruch-an-weihnachten-2021-nach-mord-plaenen-muss-windsor-eindringling-ins-gefaengnis_id_220277773.html,0,www.focus.de,Einbruch an Weihnachten 2021 - Nach Mord-Plänen muss Windsor-Eindringling ins Gefängnis,"Im Jahr 2021 brach ein Eindringling in das Gelände von Schloss Windsor ein. Nachdem er gefasst wurde, teilte er mit, dass er geplant hatte, Queen Elizabeth II. zu töten. Nun wurde er zu einer Haftstrafe verurteilt.",https://p6.focus.de/img/panorama/welt/id_203993129/koenigin-elizabeth-ii.-ist-vor-einem-jahr-im-alter-von-96-jahren-auf-schloss-balmoral-in-schottland-gestorben..jpg?im=Crop%3D%280%2C51%2C2048%2C1024%29%3BResize%3D%281200%2C627%29&impolicy=perceptual&quality=mediumHigh&hash=72b74d009d0b270b95ce9879834d71801d43c8d5ed5bbf71b3012d60f47b1648,2023-10-07T13:35:04Z,,"Im Jahr 2021 brach ein Eindringling in das Gelände von Schloss Windsor ein. Nachdem er gefasst wurde, teilte er mit, dass er geplant hatte, Queen Elizabeth II. zu töten. Nun wurde er zu einer Haftstr… [+4155 chars]",,de,'Königin Camilla'
https://www.stern.de/lifestyle/leute/heidi-und-leni-klum-praesentieren-neue-dessous-kampagne-fuer-intimissimi-33891678.html,https://www.stern.de/lifestyle/leute/heidi-und-leni-klum-praesentieren-neue-dessous-kampagne-fuer-intimissimi-33891678.html,0,www.stern.de,Trotz anhaltender Kritik: Sie haben es erneut getan: Leni und Heidi Klum präsentieren gemeinsame Dessous-Kampagne,Heidi und Leni Klum haben in Berlin ihre neue Intimissimi-Kollektion vorgestellt. Es war auch ein Statement hinsichtlich der vergangenen Kritik an den gemeinsamen Dessous-Aufnahmen von Mutter und Tochter.,https://image.stern.de/33891714/t/eQ/v4/w1440/r1.7778/-/intimissimi-heidi-leni-06-10-23-06632.jpg,2023-10-07T14:25:00Z,,Es ist ihre vierte gemeinsame Kollektion und sie zelebrieren sie wie keine zuvor: Heidi und Leni Klum haben in Berlin ihre neue Linie in Zusammenarbeit mit dem Dessous-Label Intimissimi vorgestellt. … [+2642 chars],,de,'Heidi Klum'
https://www.bild.de/bild-plus/unterhaltung/leute/leute/heidi-klum-ueber-den-wow-auftritt-ihrer-tochter-das-macht-leni-schon-wie-ein-mod-85661132.bild.html,https://www.bild.de/bild-plus/unterhaltung/leute/leute/heidi-klum-ueber-den-wow-auftritt-ihrer-tochter-das-macht-leni-schon-wie-ein-mod-85661132.bild.html,0,www.bild.de,Heidi Klum - DAS macht Leni schon wie ein Model-Profi,Am Freitagabend waren Supermodel Heidi Klum und ihre Tochter Leni Stargäste in Berlin. Lenis Auftritt übertraf wohl alles …,"https://images.bild.de/6520e7247a8e20361ddb315a/5a36ff0fba999e33385a9ebe62495715,8f077077?w=1280",2023-10-07T14:34:50Z,,"Dieser Auftritt war einfach spitze! 
Am Freitagabend waren Supermodel Heidi Klum (50) und ihre Tochter Leni (19) die Stargäste bei einem exklusiven Dinner des italienischen Wäsche-Labels Intimissimi… [+421 chars]",,de,'Heidi Klum'
https://extratv.com/photos/image_jpeg_20231006_dcfcd66cea5f45d09afe6cc470c58b3e/,https://extratv.com/photos/image_jpeg_20231006_dcfcd66cea5f45d09afe6cc470c58b3e/,0,extratv.com,SPL9954212_049.jpeg,Heidi Klum and her daughter Leni attended an Intimissimi dinner at Bode Museum in Berlin.,https://extra-images.akamaized.net/image/dc/16by9/2023/10/06/dcfcd66cea5f45d09afe6cc470c58b3e_xl.jpeg,2023-10-07T15:52:48Z,,"Celebrity NewsTaylor Swift Attends Chiefs vs. Jets Game with Celeb Squad
Taylor Swift brought out her celeb squad to cheer on rumored flame Travis Kelce and the Chiefs vs. the Je ...",,de,'Heidi Klum'
https://www.macerkopf.de/2023/10/08/apple-shot-iphone15-pro-video/,https://www.macerkopf.de/2023/10/08/apple-shot-iphone15-pro-video/,0,www.macerkopf.de,Apple veröffentlicht „Shot on iPhone 15 Pro“-Video mit Olivia Rodrigo,"Apple hat ein neues „Shot on iPhone 15 Pro“-Video veröffentlicht, bei dem die Künstlerin Olivia Rodrigo im Mittelpunkt steht. Das Video gibt uns einen Einblick in die Dreharbeiten zum Video „get him back!“, welches komplett mit dem iPhone 15 Pro gedreht wurde…",https://www.macerkopf.de/wp-content/uploads/2023/10/iphone_15_pro_max_test_24.jpeg,2023-10-08T06:11:31Z,,"Apple hat ein neues Shot on iPhone 15 Pro-Video veröffentlicht, bei dem die Künstlerin Olivia Rodrigo im Mittelpunkt steht. Das Video gibt uns einen Einblick in die Dreharbeiten zum Video get him bac… [+1366 chars]",,de,'Olivia Rodrigo'
https://www.faz.net/aktuell/politik/wahl-in-bayern/wahlen-in-hessen-und-bayern-gute-chancen-fuer-markus-soeder-und-boris-rhein-19227787.html,https://www.faz.net/aktuell/politik/wahl-in-bayern/wahlen-in-hessen-und-bayern-gute-chancen-fuer-markus-soeder-und-boris-rhein-19227787.html,0,www.faz.net,Hessen und Bayern wählen neue Landtage,"In Bayern und Hessen haben die Wahllokale geöffnet. Laut Umfragen haben sowohl Markus Söder als auch Boris Rhein gute Chancen, im Amt zu bleiben.",https://media1.faz.net/ppmedia/aktuell/politik/wahl-in-bayern/3296559403/1.9227867/facebook_teaser/letzte-vorbereitungen-in-einem.jpg,2023-10-08T06:51:20Z,,"In Hessen und Bayern haben am Sonntagmorgen die Landtagswahlen begonnen. In Hessen sind rund 4,3 Millionen Wahlberechtigte aufgerufen, ihre Stimme abzugeben. Ministerpräsident Boris Rhein (CDU) hat l… [+1370 chars]",,de,'Boris Rhein'
https://www.stern.de/lifestyle/leute/vip-news--heidi-klum-vermisst-ihr-gepaeck-nach-einem-flug-mit-lufthansa-3205306.html,https://www.stern.de/lifestyle/leute/vip-news--heidi-klum-vermisst-ihr-gepaeck-nach-einem-flug-mit-lufthansa-3205306.html,0,www.stern.de,Leute von heute: Schon wieder: Heidi Klum vermisst ihr Gepäck nach einem Flug mit Lufthansa,"Sie hat einfach kein Glück: Zum dritten Mal innerhalb weniger Monate ist das Gepäck von Heidi Klum verschwunden, nachdem sie mit Lufthansa geflogen ist. Diese und weitere Promi-Meldungen in den VIP-News.",https://image.stern.de/33893212/t/1t/v4/w1440/r1.7778/-/heidi-klum-lufthansa.jpg,2023-10-08T10:17:00Z,,"Von ""A"" wie Angelina Jolie oder Amal Clooney über ""H"" wie Heidi Klum und Helene Fischer bis ""Z"" wie Zac Efron und Zara Tindall: In der Welt der Promis ist immer etwas los. Ob sich nun neue Paare find… [+494 chars]",,de,'Heidi Klum'
https://www.stern.de/lifestyle/leute/heidi-und-leni-klum--so-praesentieren-sie-ihre-neue-dessous-kollektion-33891852.html,https://www.stern.de/lifestyle/leute/heidi-und-leni-klum--so-praesentieren-sie-ihre-neue-dessous-kollektion-33891852.html,0,www.stern.de,"Intimissimi: Seide, Spitze, knallige Farben: So präsentieren sich Heidi und Leni Klum in ihrer neuen Dessous-Kollektion","Heidi und Leni Klum haben in Berlin ihre neue Intimissimi-Kollektion vorgestellt. In Spitze, Seide und angesagten Trendfarben präsentiert sich das Mutter-Tochter-Duo in den neuen Dessous.",https://image.stern.de/33891856/t/cw/v3/w1440/r1.7778/-/230611-intimissimi-m03-couple-outfit-02-0503-f6-2.jpg,2023-10-08T12:14:00Z,,"Es ist bereits das vierte Mal, dass Topmodel Heidi Klum zusammen mit ihrer älteren Tochter Leni eine Dessous-Kollektion herausbringt und erneut sorgen die beiden Frauen mit den sinnlichen Kampagnenbi… [+1226 chars]",,de,'Heidi Klum'
https://www.brigitte.de/aktuell/heidi-klum--tochter-lou-feiert-geburtstag---mit-trampolin-und-eisstand-13599470.html,https://www.brigitte.de/aktuell/heidi-klum--tochter-lou-feiert-geburtstag---mit-trampolin-und-eisstand-13599470.html,0,www.brigitte.de,Heidi Klum: Tochter Lou feiert Geburtstag - mit Trampolin und Eisstand,Heidi Klums Tochter Lou wird 14 - und feiert eine Gartenparty. Details vom ausgelassenen Treiben zeigt die Entertainerin in kurzen Videos.,https://image.brigitte.de/13599472/t/h7/v1/w1440/r1.7778/-/08--tochter-lou-feiert-geburtstag---mit-trampolin-und-eisstand---1-1---spoton-article-1053791.jpg,2023-10-08T13:53:00Z,,"Heidi Klums Tochter Lou wird 14 - und feiert eine Gartenparty. Details vom ausgelassenen Treiben zeigt die Entertainerin in kurzen Videos.
Nach den ""GNTM""-Castings Anfang der Woche und der Präsentat… [+1161 chars]",,de,'Heidi Klum'
https://www.stern.de/lifestyle/leute/heidi-klum--gartenparty-zum-geburtstag-von-tochter-lou-33893666.html,https://www.stern.de/lifestyle/leute/heidi-klum--gartenparty-zum-geburtstag-von-tochter-lou-33893666.html,0,www.stern.de,Heidi Klum: Gartenparty zum Geburtstag von Tochter Lou,Heidi Klums Tochter Lou wird 14 - und feiert eine Gartenparty. Details vom ausgelassenen Treiben zeigt die Entertainerin in kurzen Videos.,https://image.stern.de/33893670/t/pe/v1/w1440/r1.7778/-/08--gartenparty-zum-geburtstag-von-tochter-lou---16-9---spoton-article-1053791.jpg,2023-10-08T14:01:00Z,,"Heidi Klums Tochter Lou wird 14 - und feiert eine Gartenparty. Details vom ausgelassenen Treiben zeigt die Entertainerin in kurzen Videos.
Nach den ""GNTM""-Castings Anfang der Woche und der Präsentat… [+1127 chars]",,de,'Heidi Klum'
https://www.welt.de/politik/deutschland/plus247890710/Freie-Waehler-in-Bayern-Aiwangers-Rekordsieg-soll-nur-eine-Etappe-Richtung-Berlin-sein.html,https://www.welt.de/politik/deutschland/plus247890710/Freie-Waehler-in-Bayern-Aiwangers-Rekordsieg-soll-nur-eine-Etappe-Richtung-Berlin-sein.html,0,www.welt.de,Aiwangers Rekordergebnis soll nur eine Etappe Richtung Berlin sein,Die Freien Wähler von Hubert Aiwanger erreichen in Bayern ihr stärkstes Ergebnis. Die Flugblattaffäre um den Parteichef hat ihnen eher einen Schub verschafft. Nun geht es um Aiwangers nächstes Ziel – er hat sich dafür eine Frist von zwei Jahren gesetzt. Und b…,https://img.welt.de/img/politik/deutschland/mobile247891808/3301358297-ci16x9-w1200-fnov-fpotl-fpi157750653/Wahlkampfabschluss-Freie-Waehler.jpg,2023-10-08T17:13:10Z,,"Die WELT als ePaper: Die vollständige Ausgabe steht Ihnen bereits am Vorabend zur Verfügung so sind Sie immer hochaktuell informiert. Weitere Informationen: http://epaper.welt.de 
 Der Kurz-Link die… [+49 chars]",,de,'Hubert Aiwanger'
https://www.zeit.de/news/2023-10/08/boris-rhein-haben-besondere-verantwortung-fuer-israel,https://www.zeit.de/news/2023-10/08/boris-rhein-haben-besondere-verantwortung-fuer-israel,0,www.zeit.de,Internationales: Boris Rhein: «Haben besondere Verantwortung für Israel»,,,2023-10-08T17:20:49Z,,"When browsing with ads:
We collect personal data and also transmit it to third-party providers
 that help us improve and finance our digital content. Some of the information stored on your device, … [+821 chars]",,de,'Boris Rhein'
https://www.welt.de/politik/deutschland/video247892450/Aiwanger-Freie-Waehler-zu-Bayern-Wahl-Wir-verhindern-dass-Leute-aus-Frust-radikale-Parteien-waehlen.html,https://www.welt.de/politik/deutschland/video247892450/Aiwanger-Freie-Waehler-zu-Bayern-Wahl-Wir-verhindern-dass-Leute-aus-Frust-radikale-Parteien-waehlen.html,0,www.welt.de,"„Wir verhindern, dass Leute aus Frust radikale Parteien wählen“","Die Freien Wähler legen laut Hochrechnungen zu und kommen auf über 14 Prozent der Stimmen. Bayerns Wirtschaftsminister Hubert Aiwanger kommentiert „das Super-Ergebnis“ seiner Partei im WELT-Interview. Er gehe davon aus, „dass die Bayern-Koalition aus CSU und …",https://img.welt.de/img/politik/deutschland/mobile247892550/7461357647-ci16x9-w1200/Aiwanger-Interview-Doro-jpg.jpg,2023-10-08T17:57:29Z,,"Die WELT als ePaper: Die vollständige Ausgabe steht Ihnen bereits am Vorabend zur Verfügung so sind Sie immer hochaktuell informiert. Weitere Informationen: http://epaper.welt.de 
 Der Kurz-Link die… [+49 chars]",,de,'Hubert Aiwanger'
https://www.welt.de/politik/deutschland/article247882078/Landtagswahl-Liveticker-Aiwanger-verfehlt-Direktmandat-in-Bayern.html,https://www.welt.de/politik/deutschland/article247882078/Landtagswahl-Liveticker-Aiwanger-verfehlt-Direktmandat-in-Bayern.html,0,www.welt.de,Hubert Aiwanger verfehlt Direktmandat in Bayern,"Die Freien Wähler zeigen sich zufrieden mit ihrem Ergebnis in Bayern, doch für ein Direktmandat hat es bei Parteichef Hubert Aiwanger nicht gereicht. Sein Wahlkreis ging an den Kandidaten der CSU. Alles zu den Landtagswahlen in Bayern und Hessen im Liveticker.",https://img.welt.de/img/politik/deutschland/mobile247893940/5271353557-ci16x9-w1200/Landtagswahl-Bayern-Wahlparty-Freie-Waehler.jpg,2023-10-08T19:26:00Z,,"Freie-Wähler-Chef Hubert Aiwanger hat bei der Landtagswahl in Bayern ein Direktmandat verfehlt. Im Stimmkreis Landshut unterlag Aiwanger dem CSU-Kandidaten Helmut Radlmeier, der mit 29,7 Prozent die … [+24891 chars]",,de,'Hubert Aiwanger'
https://www.tagesschau.de/inland/innenpolitik/landtagswahlen-bayern-hessen-union-100.html,https://www.tagesschau.de/inland/innenpolitik/landtagswahlen-bayern-hessen-union-100.html,0,www.tagesschau.de,Markus Söder und Boris Rhein: Zwei ungleiche Sieger,"Verluste in Bayern, Zugewinne in Hessen: Die Ergebnisse der Wahlsieger Söder und Rhein könnten unterschiedlicher nicht sein. Doch die Union sieht sich insgesamt gestärkt. CDU-Chef Merz kann trotzdem nur bedingt zufrieden sein. Mit Von O. Sallet.",https://images.tagesschau.de/image/44e09d81-5020-4fd6-8893-3d190f081e9a/AAABitaBOcs/AAABibBxqrQ/16x9-1280/rhein-soeder-100.jpg,2023-10-08T20:04:43Z,,"Stand: 08.10.2023 22:04 Uhr
Verluste in Bayern, Zugewinne in Hessen: Die Ergebnisse der Wahlsieger Söder und Rhein könnten unterschiedlicher nicht sein. Doch die Union sieht sich insgesamt gestärkt.… [+3385 chars]",,de,'Boris Rhein'
https://www.welt.de/politik/deutschland/article247882078/Landtagswahl-Liveticker-Freie-Waehler-holen-erstmals-Direktmandate-in-Bayern.html,https://www.welt.de/politik/deutschland/article247882078/Landtagswahl-Liveticker-Freie-Waehler-holen-erstmals-Direktmandate-in-Bayern.html,0,www.welt.de,Freie Wähler holen erstmals Direktmandate in Bayern,Freie-Wähler-Chef Hubert Aiwanger hat bei der Landtagswahl für seine Partei das erste Direktmandat in Bayern gewonnen. Auch sein Staatssekretär Roland Weigert war erfolgreich. Alles zu den Landtagswahlen in Bayern und Hessen im Liveticker.,https://img.welt.de/img/politik/deutschland/mobile247893940/5271353557-ci16x9-w1200/Landtagswahl-Bayern-Wahlparty-Freie-Waehler.jpg,2023-10-08T20:35:00Z,,Die Freie-Wähler-Politiker Hubert Aiwanger und Roland Weigert haben die ersten Direktmandate für ihre Partei in Bayern geholt. Nach vorläufigem amtlichen Ergebnis kam Aiwanger bei der Landtagswahl am… [+25931 chars],,de,'Hubert Aiwanger'
https://www.welt.de/politik/deutschland/article247882078/Landtagswahl-Liveticker-Gruene-verlieren-Direktmandat-in-Muenchen.html,https://www.welt.de/politik/deutschland/article247882078/Landtagswahl-Liveticker-Gruene-verlieren-Direktmandat-in-Muenchen.html,0,www.welt.de,"Grüne verlieren Direktmandat in München, Aiwanger gewinnt in Landshut",Dämpfer für die Grünen: Die Partei verliert in ihrer Hochburg München eines von fünf Direktmandaten an die CSU. Hubert Aiwanger sicherte sich erstmals ein Direktmandat für die Freien Wähler. Alles Entwicklungen nach den Wahlen im Liveticker.,https://img.welt.de/img/politik/deutschland/mobile247894428/8541354487-ci16x9-w1200/Landtagswahl-Bayern-Wahlparty-Buendnis-90-Die-Gruenen.jpg,2023-10-09T02:06:00Z,,"Die Grünen haben in München eines ihrer zuletzt fünf Direktmandate verloren. Im Stimmbezirk Moosach holte diesmal der CSU-Bewerber Alexander Dietrich mit 32,0 Prozent die meisten Stimmen vor dem wied… [+28777 chars]",,de,'Hubert Aiwanger'
