index,url,valid,domain,title,description,image,published,archive,content,quote,language,keyword
https://www.nzz.ch/international/its-the-end-of-the-world-as-we-know-it-mit-trumps-zweiter-praesidentschaft-beginnt-ein-neues-zeitalter-ld.1866349,https://www.nzz.ch/international/its-the-end-of-the-world-as-we-know-it-mit-trumps-zweiter-praesidentschaft-beginnt-ein-neues-zeitalter-ld.1866349,0,www.nzz.ch,It’s the end of the world as we know it: Mit Trumps zweiter Präsidentschaft beginnt ein neues Zeitalter,"Am Montag beginnt die zweite Amtszeit von Donald Trump. Für die Welt, und insbesondere für Europa, wird dies einschneidende Folgen haben. Denn die Zeit der liberalen Wertegemeinschaft ist vorbei. Ab jetzt zählt die Macht des Stärkeren.","https://img.nzz.ch/2025/01/17/a2ed9d4f-248c-42b3-8e57-3b0cfb0da29d.jpeg?width=1200&height=674&fit=bounds&quality=75&auto=webp&crop=3000,1687,x0,y388&wmark=nzz",2025-01-18T21:37:22Z,http://archive.md/20250119021758/https://www.nzz.ch/international/its-the-end-of-the-world-as-we-know-it-mit-trumps-zweiter-praesidentschaft-beginnt-ein-neues-zeitalter-ld.1866349,"«Rauchendes Schwein» hiess die Grillbude in Vilnius, an dessen Aussenwand ein litauischer Künstler im Auftrag des Restaurantbesitzers ein Bild mit Donald Trump zeichnen sollte. Es war Mai 2016, Trump… [+13472 chars]",,de,'Justin Trudeau'
https://www.bild.de/sport/mehr-sport/nfl-chiefs-gewinnen-taylor-swift-soo-stolz-auf-travis-kelce-678c26517b1f76390a62578e,https://www.bild.de/sport/mehr-sport/nfl-chiefs-gewinnen-taylor-swift-soo-stolz-auf-travis-kelce-678c26517b1f76390a62578e,0,www.bild.de,Chiefs stehen im NFL-Halbfinale - Taylor Swift soo stolz auf ihren Travis!,Die Kansas City Chiefs gewinnen in den NFL-Playoffs gegen die Houston Texans. Auf der Tribüne jubelt Taylor Swift ihrem Freund Travis Kelce zu.,"https://images.bild.de/678c26517b1f76390a62578e/d97d7e1ada33de12312e032d46d3fe12,60537d0c?w=1280",2025-01-19T00:33:46Z,,"Sie sind einfach nicht zu stoppen.
Die Kansas City Chiefs gewinnen in den NFL-Playoffs gegen die Houston Texans mit 23:14. Damit steht der amtierende Super-Bowl-Champion schon wieder im NFL-Halbfina… [+4817 chars]",,de,'Travis Kelce'
https://www.sueddeutsche.de/muenchen/muenchen-dld-chairmans-dinner-bayerischer-hof-lux.7eyHaZ1QWQ363zo6wwr89J,https://www.sueddeutsche.de/muenchen/muenchen-dld-chairmans-dinner-bayerischer-hof-lux.7eyHaZ1QWQ363zo6wwr89J,0,www.sueddeutsche.de,Digitalwirtschaft : Wenn München der Nabel der Zukunftswelt ist,"Globalgeniale Wissenschaft, Technik und Hochfinanz trifft Stadtgesellschaft: Das Chairman’s Dinner der Digitalkonferenz DLD vereint Glamour, Geist und gute Laune.",https://www.sueddeutsche.de/2025/01/19/9a130b63-9ced-4327-9e83-651c5367f631.jpeg?q=60&fm=webp&width=1200&rect=0%2C0%2C4000%2C2250,2025-01-19T07:36:51Z,http://archive.md/20250119095137/https://www.sueddeutsche.de/muenchen/muenchen-dld-chairmans-dinner-bayerischer-hof-lux.7eyHaZ1QWQ363zo6wwr89J,"Inzwischen hat sich viel getan in der Welt, der DLD ist sehr viel mehr. Man kann den Mahlstrom der drei Tage als Gradmesser eines Zeitgeistes verstehen, der die nächsten zehn Jahre schon mal vorausni… [+4526 chars]",,de,'nan nan'
https://www.focus.de/earth/maja-goepel-im-interview-zukunftsforscherin-beim-klimaschutz-gehen-fast-alle-von-falscher-annahme-aus_a8b3ac30-4baf-430b-a8be-09e8929f0fdd.html,https://www.focus.de/earth/maja-goepel-im-interview-zukunftsforscherin-beim-klimaschutz-gehen-fast-alle-von-falscher-annahme-aus_a8b3ac30-4baf-430b-a8be-09e8929f0fdd.html,0,www.focus.de,Maja Göpel im Interview - Zukunftsforscherin: Beim Klimaschutz gehen fast alle von falscher Annahme aus,"Veränderte Vorzeichen in den USA, streitende deutsche Parteien, wirtschaftlicher Druck – im Interview spricht Transformationsforscherin Maja Göpel darüber, was das für den Schutz des Klimas, aber auch für unsere Demokratie bedeutet.",https://quadro.burda-forward.de/ctf/1b1bef42-b530-4aed-a600-b7ec129aee2a.85cd5942-1506-4edb-9510-e1fa0e701be9.jpg?im=RegionOfInterestCrop%3D%281200%2C630%29%2CregionOfInterest%3D%281488%2C527%29&hash=008f957807cf86fa1762d84ea9d3946e51b66f4914df301e49fe305a7c029964,2025-01-19T09:44:00Z,http://archive.md/20250119114115/https://www.focus.de/earth/maja-goepel-im-interview-zukunftsforscherin-beim-klimaschutz-gehen-fast-alle-von-falscher-annahme-aus_a8b3ac30-4baf-430b-a8be-09e8929f0fdd.html,Die Politökonomin Maja Göpel ist Expertin für Nachhaltigkeitspolitik und Transformationsforschung. Sie lehrt als Honorarprofessorin an der Leuphana Universität Lüneburg. Im Interview am Rande der DLD… [+12873 chars],,de,'Maja Göpel'
https://www.bild.de/regional/nordrhein-westfalen/einbruch-in-kamen-parfuemerie-am-willy-brandt-platz-ausgeraubt-678cc47d8d0a0177964ddaab,https://www.bild.de/regional/nordrhein-westfalen/einbruch-in-kamen-parfuemerie-am-willy-brandt-platz-ausgeraubt-678cc47d8d0a0177964ddaab,0,www.bild.de,Kamen - Einbruch in Parfümerie: Parfüm gestohlen,Kamen – In den frühen Morgenstunden des 19.01.2025 ereignete sich in Kamen ein Einbruch in eine Parfümerie am Willy-Brandt-Platz. Di...,"https://images.bild.de/678cc47d8d0a0177964ddaab/e77aa1fe028ec4f2f8595ecc09633152-landscape,2c8d2e4f?w=1280",2025-01-19T10:03:37Z,https://web.archive.org/web/20250119111140/http://www.bild.de/regional/nordrhein-westfalen/einbruch-in-kamen-parfuemerie-am-willy-brandt-platz-ausgeraubt-678cc47d8d0a0177964ddaab,"Kamen In den frühen Morgenstunden des 19.01.2025 ereignete sich in Kamen ein Einbruch in eine Parfümerie am Willy-Brandt-Platz.
Die Täter schlugen die Glasscheibe der Eingangstür ein und drangen in … [+458 chars]",,de,'Willy Brandt'
https://www.welt.de/sport/article255172796/NFL-Playoff-Unter-den-Augen-von-Taylor-Swift-kommt-Meister-Kansas-City-dem-Super-Bowl-naeher.html,https://www.welt.de/sport/article255172796/NFL-Playoff-Unter-den-Augen-von-Taylor-Swift-kommt-Meister-Kansas-City-dem-Super-Bowl-naeher.html,0,www.welt.de,Unter den Augen von Taylor Swift kommt Meister Kansas City dem Super Bowl näher,Der Traum vom dritten Sieg im Super Bowl lebt. Die Kansas City Chiefs ziehen ins Halbfinale der NFL-Play-offs ein. In Washington sehen Tom Brady und die Zuschauer ein Spektakel mit überraschendem Ende.,https://img.welt.de/img/sport/mobile255172790/7257938597-ci16x9-w1200/BESTPIX-AFC-Divisional-Playoffs-Houston-Texans-v-Kansas-City-Chiefs.jpg,2025-01-19T10:24:12Z,,Der Traum vom dritten Sieg im Super Bowl lebt. Die Kansas City Chiefs ziehen ins Halbfinale der NFL-Play-offs ein. In Washington sehen Tom Brady und die Zuschauer ein Spektakel mit überraschendem End… [+5124 chars],,de,'Travis Kelce'
https://www.nzz.ch/der-andere-blick/donald-trump-feiert-den-beginn-seiner-zweiten-praesidentschaft-und-der-ranghoechste-deutsche-gast-ist-ein-polternder-gruener-botschafter-ld.1866726,https://www.nzz.ch/der-andere-blick/donald-trump-feiert-den-beginn-seiner-zweiten-praesidentschaft-und-der-ranghoechste-deutsche-gast-ist-ein-polternder-gruener-botschafter-ld.1866726,0,www.nzz.ch,DER ANDERE BLICK - Donald Trump feiert den Beginn seiner zweiten Präsidentschaft – und der ranghöchste deutsche Gast ist ein polternder grüner Botschafter,"An diesem Montag übernimmt der 47. Präsident der USA die Amtsgeschäfte. Deutschland wird dabei von einem Diplomaten vertreten, der vor Trump warnt. Und der ranghöchste anwesende Oppositionspolitiker kommt von der AfD. Was für ein Debakel.","https://img.nzz.ch/2025/01/19/0cf8c62d-6b12-497a-845c-85c3a9fdd20f.jpeg?width=1200&height=675&fit=bounds&quality=75&auto=webp&crop=5500,3094,x0,y230&wmark=nzz",2025-01-20T04:30:00Z,http://archive.md/20250120050134/https://www.nzz.ch/der-andere-blick/donald-trump-feiert-den-beginn-seiner-zweiten-praesidentschaft-und-der-ranghoechste-deutsche-gast-ist-ein-polternder-gruener-botschafter-ld.1866726,"Ein Anhänger Donald Trumps trägt eine Kette, die auf den «Inauguration Day» hinweist, den Tag von dessen Einführung ins Amt des Präsidenten. Die Zahlen «45» und 47» verweisen auf die Chronologie der … [+4274 chars]",,de,'Olaf Scholz'
https://www.zeit.de/politik/deutschland/2025-01/verteidigungshaushalt-boris-pistorius-ausgaben-niedrig-gaedechens,https://www.zeit.de/politik/deutschland/2025-01/verteidigungshaushalt-boris-pistorius-ausgaben-niedrig-gaedechens,0,www.zeit.de,Verteidigungshaushalt: Ausgaben für die Bundeswehr 2024 deutlich niedriger als geplant,"Verteidigungsminister Boris Pistorius hätte einem Bericht zufolge im vergangenen Jahr 4,6 Milliarden Euro mehr investieren können. Kritik kommt von der CDU.",https://img.zeit.de/politik/deutschland/2025-01/verteidigungshaushalt-boris-pistorius-ausgaben-niedrig-gaedechens-bild/wide__1300x731,2025-01-20T05:47:53Z,http://archive.md/20250120110102/https://www.zeit.de/politik/deutschland/2025-01/verteidigungshaushalt-boris-pistorius-ausgaben-niedrig-gaedechens,"Verteidigungsminister Boris Pistorius 
(SPD) hat einem Medienbericht zufolge im vergangenen Jahr für die 
Bundeswehr rund 4,6 Milliarden Euro weniger ausgegeben als möglich und 
geplant. Das beric… [+1753 chars]",,de,'Boris Pistorius'
https://www.welt.de/politik/ausland/article255177936/Trump-Inauguration-Liveticker-Welcome-home-Biden-begruesst-Trump-am-Weissen-Haus.html,https://www.welt.de/politik/ausland/article255177936/Trump-Inauguration-Liveticker-Welcome-home-Biden-begruesst-Trump-am-Weissen-Haus.html,0,www.welt.de,„Welcome home“ – Biden begrüßt Trump im Weißen Haus,Donald J. Trump wird an diesem Montag als Präsident der USA vereidigt. Nach einer Messe trifft Trump im Weißen Haus Joe Biden. Die Vereidigung wurde angesichts der Kälte in das Kapitol verlegt. Alle Neuigkeiten im WELT-Liveticker.,https://img.welt.de/img/politik/ausland/mobile255186568/2227936397-ci16x9-w1200/Donald-Trump-Joe-Biden-Melania-Trump-Jill-Biden.jpg,2025-01-20T06:45:24Z,http://archive.md/20250120162948/https://www.welt.de/politik/ausland/article255177936/Trump-Inauguration-Liveticker-Welcome-home-Biden-begruesst-Trump-am-Weissen-Haus.html,Donald J. Trump wird an diesem Montag als Präsident der USA vereidigt. Nach einer Messe trifft Trump im Weißen Haus Joe Biden. Die Vereidigung wurde angesichts der Kälte in das Kapitol verlegt. Alle … [+18130 chars],,de,'Olaf Scholz'
https://www.welt.de/politik/ausland/article255177936/Trump-Inauguration-Liveticker-Das-goldene-Zeitalter-Amerikas-beginnt-jetzt.html,https://www.welt.de/politik/ausland/article255177936/Trump-Inauguration-Liveticker-Das-goldene-Zeitalter-Amerikas-beginnt-jetzt.html,0,www.welt.de,„Das goldene Zeitalter Amerikas beginnt jetzt“,"Donald Trump hält seine Rede zum Amtsantritt. Er sieht die USA vor einem goldenen Zeitalter. Zu den Gästen seiner Amtseinführung gehören alle lebenden Ex-Präsidenten, Tech-Unternehmer und ausländische Staats- und Regierungschefs wie Javier Milei und Giorgia M…",https://img.welt.de/img/politik/ausland/mobile255188666/7087930127-ci16x9-w1200/President-Donald-Trump-speaks-after.jpg,2025-01-20T06:45:24Z,http://archive.md/20250120172436/https://www.welt.de/politik/ausland/article255177936/Trump-Inauguration-Liveticker-Das-goldene-Zeitalter-Amerikas-beginnt-jetzt.html,"Donald Trump hält seine Rede zum Amtsantritt. Er sieht die USA vor einem goldenen Zeitalter. Zu den Gästen seiner Amtseinführung gehören alle lebenden Ex-Präsidenten, Tech-Unternehmer und ausländisch… [+21433 chars]",,de,'Donald Trump'
https://www.welt.de/politik/ausland/article255177936/Trump-Inauguration-Liveticker-Trump-will-in-Antrittsrede-zu-Revolution-des-gesunden-Menschenverstands-aufrufen.html,https://www.welt.de/politik/ausland/article255177936/Trump-Inauguration-Liveticker-Trump-will-in-Antrittsrede-zu-Revolution-des-gesunden-Menschenverstands-aufrufen.html,0,www.welt.de,Trump will zu „Revolution des gesunden Menschenverstands“ aufrufen – So läuft der Tag,Donald J. Trump wird an diesem Montag als US-Präsident der USA vereidigt. Tausende MAGA-Anhänger wollen den Republikaner bei der Amtseinführung in Washington bejubeln. Erste Details und Zitate seiner Antrittsrede wurden bereits jetzt publik. Alle Neuigkeiten …,https://img.welt.de/img/politik/ausland/mobile255178084/0427936317-ci16x9-w1200/FILE-PHOTO-Scenes-from-Washington-ahead-presidential-inauguration-of-U-S-President-elect-Donald.jpg,2025-01-20T06:45:24Z,http://archive.md/20250120123455/https://www.welt.de/politik/ausland/article255177936/Trump-Inauguration-Liveticker-Trump-will-in-Antrittsrede-zu-Revolution-des-gesunden-Menschenverstands-aufrufen.html,Donald J. Trump wird an diesem Montag als US-Präsident der USA vereidigt. Tausende MAGA-Anhänger wollen den Republikaner bei der Amtseinführung in Washington bejubeln. Erste Details und Zitate seiner… [+12632 chars],,de,'Olaf Scholz'
https://www.welt.de/politik/ausland/article255177936/Trump-Inauguration-Liveticker-Meine-Botschaft-an-die-Amerikaner-heute-ist-erste-Details-zu-Trumps-Antrittsrede-geleakt.html,https://www.welt.de/politik/ausland/article255177936/Trump-Inauguration-Liveticker-Meine-Botschaft-an-die-Amerikaner-heute-ist-erste-Details-zu-Trumps-Antrittsrede-geleakt.html,0,www.welt.de,„Meine Botschaft an die Amerikaner heute ist...“ – erste Details zu Trumps Antrittsrede geleakt,Donald J. Trump wird an diesem Montag als US-Präsident der USA vereidigt. Tausende MAGA-Anhänger wollen den Republikaner bei der Amtseinführung in Washington bejubeln. Erste Details und Zitate seiner Antrittsrede wurden bereits jetzt publik. Alle Neuigkeiten …,https://img.welt.de/img/politik/ausland/mobile255178084/6277932017-ci16x9-w1200/FILE-PHOTO-Scenes-from-Washington-ahead-presidential-inauguration-of-U-S-President-elect-Donald.jpg,2025-01-20T06:45:24Z,http://archive.md/20250120133316/https://www.welt.de/politik/ausland/article255177936/Trump-Inauguration-Liveticker-Meine-Botschaft-an-die-Amerikaner-heute-ist-erste-Details-zu-Trumps-Antrittsrede-geleakt.html,Donald J. Trump wird an diesem Montag als US-Präsident der USA vereidigt. Tausende MAGA-Anhänger wollen den Republikaner bei der Amtseinführung in Washington bejubeln. Erste Details und Zitate seiner… [+14215 chars],,de,'Donald Trump'
https://www.faz.net/aktuell/rhein-main/frankfurt/tag-des-gedenkens-in-frankfurt-michel-friedman-und-olaf-scholz-im-schlagabtausch-110242434.html,https://www.faz.net/aktuell/rhein-main/frankfurt/tag-des-gedenkens-in-frankfurt-michel-friedman-und-olaf-scholz-im-schlagabtausch-110242434.html,0,www.faz.net,Jüdisches Leben in Deutschland: Michel Friedman und Olaf Scholz im Schlagabtausch,Der Bundeskanzler spricht in der Jüdischen Gemeinde in Frankfurt über Auschwitz. In der anschließenden Gesprächsrunde wird klar: Juden erwarten von Politik und Gesellschaft heute mehr als gut gemeinte Worte.,https://media1.faz.net/ppmedia/aktuell/1757321743/1.10242437/facebook_teaser/fordert-vom-kanzler.jpg,2025-01-20T06:50:52Z,http://archive.md/20250120071551/https://www.faz.net/aktuell/rhein-main/frankfurt/tag-des-gedenkens-in-frankfurt-michel-friedman-und-olaf-scholz-im-schlagabtausch-110242434.html,"Warum folgt auf all die gut gemeinten Worte nur so wenig? Diese Frage steht hinter Friedmans betrüblichen Schilderungen. Den ständig wiederholten Bekundungen, in Deutschland sei kein Platz für Antise… [+5018 chars]",,de,'Olaf Scholz'
https://www.n-tv.de/politik/16-15-Putin-gratuliert-Trump-zur-Amtseinfuehrung--article25500553.html,https://www.n-tv.de/politik/16-15-Putin-gratuliert-Trump-zur-Amtseinfuehrung--article25500553.html,0,www.n-tv.de,Trumps Vereidigung im Liveticker: +++ 16:15 Putin gratuliert Trump zur Amtseinführung +++,"Berlin, Washington, Brüssel - überall. ntv berichtet von allen wichtigen Schauplätzen der Innen- und Außenpolitik.",https://bilder2.n-tv.de/img/incoming/crop25500561/1591328148-cImg_16_9-w1200/502803449.jpg,2025-01-20T07:38:21Z,,"Kremlchef Wladimir Putin hat Donald Trump zu dessen unmittelbar bevorstehender Amtseinführung als US-Präsident gratuliert. Er habe die Forderungen Trumps gehört, die direkten Kontakte zwischen Moskau… [+15454 chars]",,de,'Olaf Scholz'
https://www.diepresse.com/19270035/am-ende-koennte-sich-trump-deutschland-vorknoepfen,https://www.diepresse.com/19270035/am-ende-koennte-sich-trump-deutschland-vorknoepfen,0,www.diepresse.com,Am Ende könnte sich Trump Deutschland vorknöpfen,Donald Trump wird erneut als US-Präsident angelobt. Welche Auswirkungen hat das auf China und Europa?,https://www.diepresse.com/assets_v2/images/diepresse_meinung.png,2025-01-20T09:04:38Z,,"Donald Trump wird erneut als US-Präsident angelobt. Welche Auswirkungen hat das auf China und Europa? 
Für seine Verhältnisse hat sich Donald Trump im Wahlkampf mit seinen üblichen Drohungen gegen C… [+5241 chars]",,de,'Donald Trump'
https://www.welt.de/politik/ausland/article255177460/Donald-Trump-Vor-der-Amtseinfuehrung-begruesst-er-Milliardaere-beim-Candle-Light-Dinner.html,https://www.welt.de/politik/ausland/article255177460/Donald-Trump-Vor-der-Amtseinfuehrung-begruesst-er-Milliardaere-beim-Candle-Light-Dinner.html,0,www.welt.de,Vor der Amtseinführung begrüßt Trump Milliardäre beim Candle-Light-Dinner,"Donald Trump verspricht vor 20.000 Anhängern in Washington eine neue Ära von „Stärke, Wohlstand, Würde und Stolz“ – schon mit dem ersten Tag seiner zweiten Präsidentschaft. Die Gästeliste eines anschließenden Dinners befeuern Warnungen vor einer „Oligarchie“.",https://img.welt.de/img/politik/ausland/mobile255179656/6757936287-ci16x9-w1200/Donald-Trump-Attends-Candlelight-Dinner-At-Building-Museum-On-Eve-Of-Inauguration.jpg,2025-01-20T09:58:00Z,https://web.archive.org/web/20250120124732/https://www.welt.de/politik/ausland/article255177460/Donald-Trump-Vor-der-Amtseinfuehrung-begruesst-er-Milliardaere-beim-Candle-Light-Dinner.html,"Donald Trump verspricht vor 20.000 Anhängern in Washington eine neue Ära von Stärke, Wohlstand, Würde und Stolz schon mit dem ersten Tag seiner zweiten Präsidentschaft. Die Gästeliste eines anschließ… [+6715 chars]",,de,'Donald Trump'
https://www.faz.net/aktuell/gesellschaft/menschen/trump-lud-seine-reichsten-anhaenger-zum-galadinner-ein-essen-mit-musk-und-bezos-110242646.html,https://www.faz.net/aktuell/gesellschaft/menschen/trump-lud-seine-reichsten-anhaenger-zum-galadinner-ein-essen-mit-musk-und-bezos-110242646.html,0,www.faz.net,"Black-Tie-Dinner in Washington: Gala-Essen mit Musk, Bezos und den Trumps",Küsschen von Jeff Bezos: Am Abend vor Trumps Vereidigung lud der designierte Präsident seine reichsten Anhänger zum Galadinner ins Architekturmuseum von Washington.,https://media1.faz.net/ppmedia/aktuell/politik/2532739620/1.10242601/facebook_teaser/elon-musk-ivanka-trump-lauren.jpg,2025-01-20T10:28:08Z,https://web.archive.org/web/20250120132701/https://www.faz.net/aktuell/gesellschaft/menschen/trump-lud-seine-reichsten-anhaenger-zum-galadinner-ein-essen-mit-musk-und-bezos-110242646.html,"Tesla-Chef und Inhaber der Plattform X, Elon Musk, sprach mit Amazon-Gründer Jeff Bezos, der wiederum verteilte zur Begrüßung Wangenküsschen an Ivanka Trump. Der designierte Vizepräsident J. D. Vance… [+781 chars]",,de,'Laura Ingraham'
https://www.morgenpost.de/politik/article408126365/mit-einer-aggressiven-rede-beginnt-trump-den-zweiten-akt.html,https://www.morgenpost.de/politik/article408126365/mit-einer-aggressiven-rede-beginnt-trump-den-zweiten-akt.html,0,www.morgenpost.de,Mit einer aggressiven Rede beginnt Trump den zweiten Akt,"Direkt nach der Vereidigung will Trump einen ersten Schwall von Dekreten unterzeichnen, um die Politik seines Vorgängers Joe Biden zu beenden.",https://img.sparknews.funkemedien.de/408126403/408126403_1737399743_v16_9_1600.jpeg,2025-01-20T19:02:23Z,,"Washington. Direkt nach der Vereidigung will Trump einen ersten Schwall von Dekreten unterzeichnen, um die Politik seines Vorgängers Joe Biden zu beenden.
Die neue Justizministerin hatte es besonder… [+5738 chars]",,de,'Joe Biden'
https://www.faz.net/aktuell/stil/melania-trump-bei-amtseinfuehrung-dieser-hut-haelt-auf-abstand-110244206.html,https://www.faz.net/aktuell/stil/melania-trump-bei-amtseinfuehrung-dieser-hut-haelt-auf-abstand-110244206.html,0,www.faz.net,Melania Trump bei Amtseinführung: Dieser Hut hält auf Abstand,Niemand sieht in ihre Seele: First Lady Melania Trump setzt bei der Amtseinführung ihres Mannes auf konservativen Stil.,https://media0.faz.net/ppmedia/aktuell/3370493529/1.10244208/facebook_teaser/first-lady-melania-trump.jpg,2025-01-20T19:34:01Z,http://archive.md/20250126070005/https://www.faz.net/aktuell/stil/melania-trump-bei-amtseinfuehrung-dieser-hut-haelt-auf-abstand-110244206.html,"Melania Trump versteckt sich nicht nur mit ihrer Mode, sie offenbart sich auch. Während sie an öffentlichen Worten spart, prägt sie mit ihren Kleidern ihr Erscheinungsbild. Und das ist in ihrem Fall … [+5329 chars]",,de,'Lady Di'
https://www.n-tv.de/politik/Glueckwuensche-aus-der-ganzen-Welt-article25502464.html,https://www.n-tv.de/politik/Glueckwuensche-aus-der-ganzen-Welt-article25502464.html,0,www.n-tv.de,Glückwünsche an Donald Trump: Lula will keinen Streit - Selenskyj sieht Chance auf Frieden,"Nach dem Amtsantritt von Trump trudeln aus aller Welt Glückwünsche ein. Während der ukrainische Präsident Selenskyj auf einen ""gerechten Frieden"" hofft, erwartet Israels Premier Netanjahu die ""besten Tage unseres Bündnisses"". Brasiliens Präsident Lula betont,…",https://bilder4.n-tv.de/img/incoming/crop25502547/8591329887-cImg_16_9-w1200/501827399.jpg,2025-01-20T20:16:04Z,,"Nach dem Amtsantritt von Trump trudeln aus aller Welt Glückwünsche ein. Während der ukrainische Präsident Selenskyj auf einen ""gerechten Frieden"" hofft, erwartet Israels Premier Netanjahu die ""besten… [+3305 chars]",,de,'Donald Trump'
https://www.diepresse.com/19275987/praesident-trump-ruft-revolution-mit-hausverstand-aus,https://www.diepresse.com/19275987/praesident-trump-ruft-revolution-mit-hausverstand-aus,0,www.diepresse.com,Präsident Trump ruft „Revolution mit Hausverstand“ aus [premium],Seine zweite Amtszeit begann Donald Trump mit einer ungewöhnlichen Amtseinführung im Kapitol – und einer düsteren Ansprache. Seine Anhänger sind voll der Hoffnung. Und freuen sich auf „Veränderung“. Erste Schritte gibt es bereits: gegen Asylwerber in Mexiko.,https://img.diepresse.com/public/incoming/ilq7j2-US-POLITICS-TRUMP-INAUGURATION/alternates/DPR_SOCIAL_NACHRICHTEN/US-POLITICS-TRUMP-INAUGURATION,2025-01-20T20:30:44Z,,Seine zweite Amtszeit begann Donald Trump mit einer ungewöhnlichen Amtseinführung im Kapitol und einer düsteren Ansprache. Seine Anhänger sind voll der Hoffnung. Und freuen sich auf Veränderung. Erst… [+1327 chars],,de,'Bernard Arnault'
https://www.welt.de/politik/ausland/article255189596/Trump-Vereidigung-Weidel-setzt-auf-Trump-Trudeau-freut-sich-auf-Zusammenarbeit.html,https://www.welt.de/politik/ausland/article255189596/Trump-Vereidigung-Weidel-setzt-auf-Trump-Trudeau-freut-sich-auf-Zusammenarbeit.html,0,www.welt.de,Weidel setzt auf Trump – Trudeau freut sich auf „Zusammenarbeit“,"Nach der Amtseinführung von Donald Trump reagieren internationale Regierungschefs und Politiker auf den Beginn der neuen Präsidentschaft. Wolodymyr Selenskyj hofft auf einen „gerechten Frieden“, Robert Habeck warnt vor einem Handelskonflikt und Emmanuel Macro…",https://img.welt.de/img/politik/ausland/mobile255189586/7387933947-ci16x9-w1200/Amtseinfuehrung-Trump.jpg,2025-01-20T20:53:33Z,https://web.archive.org/web/20250120210312/https://www.welt.de/politik/ausland/article255189596/Trump-Vereidigung-Weidel-setzt-auf-Trump-Trudeau-freut-sich-auf-Zusammenarbeit.html,"Nach der Amtseinführung von Donald Trump reagieren internationale Regierungschefs und Politiker auf den Beginn der neuen Präsidentschaft. Wolodymyr Selenskyj hofft auf einen gerechten Frieden, Robert… [+6573 chars]",,de,'Selenskyj'
https://www.diepresse.com/19276127/prinz-harry-gegen-die-sun-mehrwoechiger-prozess-startet,https://www.diepresse.com/19276127/prinz-harry-gegen-die-sun-mehrwoechiger-prozess-startet,0,www.diepresse.com,Prinz Harry gegen die „Sun“: Mehrwöchiger Prozess startet,"Harry und der Ex-Labour-Politiker Tom Watson werfen den Journalisten der „Sun“ vor, sie bespitzelt zu haben. Der Prinz geht mit dem Prozess ein finanzielles Risiko ein.",https://img.diepresse.com/public/incoming/b217tj-NETFLIX-HARRY-AND-MEGHAN/alternates/DPR_SOCIAL_NACHRICHTEN/NETFLIX-HARRY%20AND%20MEGHAN,2025-01-21T05:29:06Z,,"Harry und der Ex-Labour-Politiker Tom Watson werfen den Journalisten der Sun vor, sie bespitzelt zu haben. Der Prinz geht mit dem Prozess ein finanzielles Risiko ein.
In Prinz Harrys Zivilklage gege… [+3196 chars]",,de,'Prinzessin Diana'
https://www.stern.de/lifestyle/leute/prinz-harry--prozess-in-london-gegen-die-sun-startet---darum-geht-es-35398706.html,https://www.stern.de/lifestyle/leute/prinz-harry--prozess-in-london-gegen-die-sun-startet---darum-geht-es-35398706.html,0,www.stern.de,"Prozess in London: Prinz Harry gegen die ""Sun"": Es könnte für ihn teuer werden",In einem Londoner Gerichtssaal kommt es zum Showdown zwischen Prinz Harry und der Boulevardpresse. Was treibt den Royal an?,https://image.stern.de/35398724/t/pd/v1/w1440/r1.7778/-/prinz-harry.jpg,2025-01-21T08:55:41Z,,"Kopiere den aktuellen Link
In einem Londoner Gerichtssaal kommt es zum Showdown zwischen Prinz Harry und der Boulevardpresse. Was treibt den Royal an?
In Prinz Harrys Zivilklage gegen den Verlag de… [+2996 chars]",,de,'Prinzessin Diana'
