index,url,valid,domain,title,description,image,published,archive,content,quote,language,keyword
https://www.stern.de/gesellschaft/regional/berlin-brandenburg/demonstration--blockade-von-axel-springer-druckerei--lieferungen-verzoegert-34446828.html,https://www.stern.de/gesellschaft/regional/berlin-brandenburg/demonstration--blockade-von-axel-springer-druckerei--lieferungen-verzoegert-34446828.html,0,www.stern.de,Demonstration: Blockade von Axel-Springer-Druckerei: Lieferungen verzögert,Demonstranten blockieren eine Druckerei. Einige Zeitungen können in der Folge nur verzögert geliefert werden - darunter die Bild. Der Axel-Springer-Verlag sieht demokratische Grundrechte verletzt.,https://image.stern.de/34446830/t/Xf/v2/w1440/r1.7778/-/10--urnnewsmldpacom2009010124021099938918v2w800h600l246t1533r2982b3357jpeg---dd4f0d9dff352037.jpg,2024-02-10T11:59:20Z,,"Demonstranten blockieren eine Druckerei. Einige Zeitungen können in der Folge nur verzögert geliefert werden - darunter die Bild. Der Axel-Springer-Verlag sieht demokratische Grundrechte verletzt.
N… [+1750 chars]",,de,'Axel Springer'
https://www.zeit.de/politik/ausland/2024-02/rafah-gaza-krieg-israel-annalena-baerbock,https://www.zeit.de/politik/ausland/2024-02/rafah-gaza-krieg-israel-annalena-baerbock,0,www.zeit.de,"Gaza-Krieg: Annalena Baerbock spricht von ""humanitärer Katastrophe mit Ansage""",Ungewöhnlich deutlich hat die Außenministerin vor einer israelischen Offensive in Rafah gewarnt. Auch aus anderen Ländern kommen Warnungen.,https://img.zeit.de/politik/ausland/2024-02/annalena-baerbock-militaereinsatz-rafah-bild/wide__1300x731,2024-02-10T14:16:58Z,,"International mehren sich die Forderungen an Israel, auf eine Offensive in der Stadt Rafah im südlichen Gazastreifen zu verzichten. Auch Außenministerin Annalena Baerbock warnte eindringlich vor dem … [+3630 chars]",,de,'Annalena Baerbock'
https://www.kicker.de/eine-riesenchance-fuer-die-chiefs-ihre-legacy-zu-zementieren-995484/artikel,https://www.kicker.de/eine-riesenchance-fuer-die-chiefs-ihre-legacy-zu-zementieren-995484/artikel,0,www.kicker.de,"""Eine Riesenchance für die Chiefs, ihre Legacy zu zementieren""","Sechsmal holten die New England Patriots mit Tom Brady den Super Bowl. Auf diesem Level sind die Kansas City Chiefs mit Mahomes noch nicht unterwegs, aber Vergleiche hält Jakob Johnson für nachvollziehbar.","https://derivates.kicker.de/image/upload/c_crop,x_0,y_283,w_4000,h_2250/w_1200,q_auto/v1/2024/02/10/e4240694-cbd2-48d4-b1d3-b0f1997bb531.jpeg",2024-02-10T14:20:00Z,,"Sechsmal holten die New England Patriots mit Tom Brady den Super Bowl. Auf diesem Level sind die Kansas City Chiefs mit Mahomes noch nicht unterwegs, aber Vergleiche hält Jakob Johnson für nachvollzi… [+2844 chars]",,de,'Tom Brady'
https://www.tagesschau.de/ausland/super-bowl-taylor-swift-verschwoerungstheorien-100.html,https://www.tagesschau.de/ausland/super-bowl-taylor-swift-verschwoerungstheorien-100.html,0,www.tagesschau.de,Was Fans zu den Verschwörungsmythen rund um den Super Bowl sagen,"Taylor Swift, Travis Kelce - dazu der Super Bowl und Joe Biden: Aus diesen Zutaten stricken Konservative in den USA gerne Verschwörungsmythen. Die Fans machen mehr oder weniger mit - je nachdem, welche Seite man fragt. Von Katrin Brand.",https://images.tagesschau.de/image/80836106-eae4-46fb-8709-90ded15673d4/AAABjWm2vsU/AAABibBxqrQ/16x9-1280/kelce-swift-100.jpg,2024-02-11T02:28:17Z,,"Stand: 11.02.2024 03:28 Uhr
Taylor Swift, Travis Kelce - dazu der Super Bowl und Joe Biden: Aus diesen Zutaten stricken Konservative in den USA gerne Verschwörungsmythen. Die Fans machen mehr oder w… [+2940 chars]",,de,'Joe Biden'
https://www.focus.de/sport/nfl/nfl-finale-in-las-vegas-super-bowl-im-liveticker-kansas-city-chiefs-gegen-san-francisco-49ers_id_259658852.html,https://www.focus.de/sport/nfl/nfl-finale-in-las-vegas-super-bowl-im-liveticker-kansas-city-chiefs-gegen-san-francisco-49ers_id_259658852.html,0,www.focus.de,NFL-Finale in Las Vegas - Super Bowl im Liveticker: Kansas City Chiefs gegen San Francisco 49ers,Super Bowl. Das Endspiel der NFL verspricht Spektakel pur. Die Kansas City Chiefs treffen als Titelverteidiger auf die San Francisco 49ers. Patrick Mahomes ist auf der Jagd der Rekorde von Tom Brady. Aber alles spricht in Las Vegas von Popstar Taylor Swift. D…,https://p6.focus.de/img/fotos/id_259659126/quarterback-legende-peyton-manning.jpg?im=Crop%3D%280%2C329%2C3000%2C1500%29%3BResize%3D%281200%2C627%29&impolicy=perceptual&quality=mediumHigh&hash=ed12000ffda985a49a8c71f4f22f9f2e93a40486002c66d53b9a58bb3da7027e,2024-02-11T04:33:59Z,,"<ul><li>
Kommentare</li><li>
E-Mail</li><li>
Teilen</li><li>
Mehr</li><li>
Twitter</li><li>
Drucken</li><li>
Feedback</li><li>
Fehler meldenSie haben einen Fehler gefunden?
Bitte markieren S… [+8849 chars]",,de,'Patrick Mahomes'
https://www.stern.de/gesellschaft/regional/sachsen-anhalt/hochschulen--internationale-tagung-zu--kant-und-die-moderne--in-halle-34448184.html,https://www.stern.de/gesellschaft/regional/sachsen-anhalt/hochschulen--internationale-tagung-zu--kant-und-die-moderne--in-halle-34448184.html,0,www.stern.de,"Hochschulen: Internationale Tagung zu ""Kant und die Moderne"" in Halle","Immanuel Kant und Halle sind eng miteinander verbunden. Vier Tage lang widmen sich nun Experten dem Philosophen, der vor 300 Jahren zur Welt gekommen ist.",https://image.stern.de/34448186/t/1x/v1/w1440/r1.7778/-/11--urnnewsmldpacom2009010124021199947850v2w800h600l1082t751r3251b2254jpeg---92af300473e5087a.jpg,2024-02-11T07:28:44Z,https://web.archive.org/web/20240212060214/https://www.stern.de/gesellschaft/regional/sachsen-anhalt/hochschulen--internationale-tagung-zu--kant-und-die-moderne--in-halle-34448184.html,"Immanuel Kant und Halle sind eng miteinander verbunden. Vier Tage lang widmen sich nun Experten dem Philosophen, der vor 300 Jahren zur Welt gekommen ist.
Der Philosoph Immanuel Kant (1724-1804) ste… [+1633 chars]",,de,'Immanuel Kant'
https://www.faz.net/aktuell/sport/fussball/lionel-messi-in-hongkong-chinas-wut-auf-argentinien-star-eskaliert-19511645.html,https://www.faz.net/aktuell/sport/fussball/lionel-messi-in-hongkong-chinas-wut-auf-argentinien-star-eskaliert-19511645.html,0,www.faz.net,Spiele im März abgesagt: Chinas Wut auf Lionel Messi eskaliert,"In Hongkong verletzt und lustlos, in Japan fit und guter Laune. Die Chinesen sind wütend auf Argentiniens Fußball-Superstar. Peking schaltet sich nun ein.",https://media0.faz.net/ppmedia/aktuell/sport/3300681960/1.9511654/facebook_teaser/beim-spiel-gegen-hongkong-sass.jpg,2024-02-11T08:04:21Z,,Chinas Wut auf Argentiniens Superstar Lionel Messi ist am Wochenende weiter eskaliert. Das Thema dominiert seit Tagen die Sozialen Medien in der Volksrepublik. Viele Chinesen werfen dem Fußballer res… [+4933 chars],,de,'Al Nassr'
https://www.kicker.de/traumzerstoerer-oder-gelungene-revance-chiefs-und-49ers-duellieren-sich-im-super-bowl-995127/artikel,https://www.kicker.de/traumzerstoerer-oder-gelungene-revance-chiefs-und-49ers-duellieren-sich-im-super-bowl-995127/artikel,0,www.kicker.de,Traumzerstörer oder gelungene Revance? Chiefs und 49ers duellieren sich im Super Bowl,"Quarterback Brock Purdy will mit den San Francisco 49ers im Super Bowl den Titelverteidiger aus Kansas City stürzen. Es wäre die sechste Vince-Lombardi-Trophy für seine 49ers - kein Team hat bislang öfter gewonnen. Doch kann das gelingen? Patrick Mahomes, Tra…","https://derivates.kicker.de/image/upload/c_crop,x_0,y_0,w_4000,h_2250/w_1200,q_auto/v1/2024/02/08/caec4941-4622-4713-a7e7-1a5639b7fd36.jpeg",2024-02-11T10:55:59Z,,Quarterback Brock Purdy will mit den San Francisco 49ers im Super Bowl den Titelverteidiger aus Kansas City stürzen. Es wäre die sechste Vince-Lombardi-Trophy für seine 49ers - kein Team hat bislang … [+10318 chars],,de,'Patrick Mahomes'
https://www.tagesschau.de/ausland/europa/koenig-charles-134.html,https://www.tagesschau.de/ausland/europa/koenig-charles-134.html,0,www.tagesschau.de,König Charles dankt für Genesungswünsche nach Krebsdiagnose,"König Charles III. hat sich nach seiner Krebsdiagnose erstmals selbst öffentlich geäußert und sich für die Genesungswünsche aus aller Welt bedankt. Er lobte, dass die Nachricht seiner Diagnose das Bewusstsein für das Thema Krebs gefördert habe.",https://images.tagesschau.de/image/41a6e7e4-46f8-47df-80c1-9a0ea7619edc/AAABjZe64QA/AAABibBxqrQ/16x9-1280/charles-194.jpg,2024-02-11T11:05:46Z,,"Stand: 11.02.2024 12:05 Uhr
König Charles III. hat sich nach seiner Krebsdiagnose erstmals selbst öffentlich geäußert und sich für die Genesungswünsche aus aller Welt bedankt. Er lobte, dass die Nac… [+2454 chars]",,de,'König Charles III'
https://www.focus.de/kultur/medien/fast-gestorben-gina-lisa-lohfink-erlitt-komplikationen-nach-gefaehrlicher-gesaess-op_id_259659972.html,https://www.focus.de/kultur/medien/fast-gestorben-gina-lisa-lohfink-erlitt-komplikationen-nach-gefaehrlicher-gesaess-op_id_259659972.html,0,www.focus.de,„Fast gestorben“ - Gina-Lisa Lohfink erlitt Komplikationen nach gefährlicher Gesäß-OP,"Immer wieder warnen Experten vor dem sogenannten „Brazilian Butt Lift“, bei dem Körperfett zunächst abgesaugt und ins Gesäß injiziert wird. Reality-TV-Sternchen Gina-Lisa Lohfink ließ sich davon nicht abschrecken – mit fatalen Folgen.",https://p6.focus.de/img/fotos/id_259660120/gettyimages-484023582.jpg?im=Crop%3D%280%2C0%2C3000%2C1500%29%3BResize%3D%281200%2C627%29&impolicy=perceptual&quality=mediumHigh&hash=dedfbd94935d9de12e8827a435ce4c6b9d8a2367eea665a35b54874c7157c270,2024-02-11T12:57:15Z,,"Immer wieder warnen Experten vor dem sogenannten Brazilian Butt Lift, bei dem Körperfett zunächst abgesaugt und ins Gesäß injiziert wird. Reality-TV-Sternchen Gina-Lisa Lohfink ließ sich davon nicht … [+1764 chars]",,de,'nan nan'
https://www.tagesschau.de/ausland/europa/papst-milei-102.html,https://www.tagesschau.de/ausland/europa/papst-milei-102.html,0,www.tagesschau.de,Zwei Argentinier im Petersdom: Präsident Milei beim Papst,"Argentinisches Gipfeltreffen im Petersdom: Papst Franziskus hat erstmals seinen Landsmann, den argentinischen Präsidenten Milei, im Vatikan getroffen. Die Begrüßung war herzlich - was nicht unbedingt zu erwarten war.",https://images.tagesschau.de/image/0ca7688e-3964-406c-ac7e-c6a24221a818/AAABjZhpmcw/AAABibBxqrQ/16x9-1280/papst-milei-100.jpg,2024-02-11T14:04:06Z,,"Stand: 11.02.2024 15:04 Uhr
Argentinisches Gipfeltreffen im Petersdom: Papst Franziskus hat erstmals seinen Landsmann, den argentinischen Präsidenten Milei, im Vatikan getroffen. Die Begrüßung war h… [+1868 chars]",,de,'Giorgia Meloni'
https://www.zeit.de/news/2024-02/11/christopher-nolan-mit-us-regiepreis-ausgezeichnet,https://www.zeit.de/news/2024-02/11/christopher-nolan-mit-us-regiepreis-ausgezeichnet,0,www.zeit.de,Film: Christopher Nolan mit US-Regiepreis ausgezeichnet,Hier finden Sie Informationen zu dem Thema „Film“. Lesen Sie jetzt „Christopher Nolan mit US-Regiepreis ausgezeichnet“.,https://img.zeit.de/news/2024-02/11/christopher-nolan-mit-us-regiepreis-ausgezeichnet-image-group/wide__1300x731,2024-02-11T14:26:15Z,,Nach seinem Sieg bei den Golden Globes ist der Regisseur Christopher Nolan für «Oppenheimer» auch mit dem US-Regiepreis ausgezeichnet worden. Nolan bekam bei der Gala der Directors Guild of America (… [+520 chars],,de,'Greta Gerwig'
https://www.bild.de/unterhaltung/leute/leute/clooneys-sind-auf-den-hund-gekommen-ein-baby-fuer-george-und-amal-87110486.bild.html,https://www.bild.de/unterhaltung/leute/leute/clooneys-sind-auf-den-hund-gekommen-ein-baby-fuer-george-und-amal-87110486.bild.html,0,www.bild.de,Auf den Hund gekommen - Ein Baby für Clooneys,Amal und George Clooney können sich mal wieder über Nachwuchs freuen – nämlich vierbeinigen! Der Baby-Bernhardiner Nelson ist seit Kurzem Teil der Familie.,"https://images.bild.de/65c7897172b5e36a4605462e/4d95545565d37b034ea90c5e7e20f469,695ad414?w=1280",2024-02-11T17:00:23Z,,"Perfekte Frau, perfekter Mann, perfekte Kinder und die perfekten Jobs. Was fehlt? Richtig! Der perfekte Hund.
Wir sehen Amal (46) und 
George Clooney (62) dieser Tage beim Spaziergengehen im südfra… [+1921 chars]",,de,'George Clooney'
https://www.zeit.de/sport/2024-02/super-bowl-2024-nfl-live,https://www.zeit.de/sport/2024-02/super-bowl-2024-nfl-live,0,www.zeit.de,Super Bowl 2024: Declaration of Swelce,Taylor Swift hat es zu ihrem Lover Travis Kelce geschafft. Gibt es dafür einen passenden Ort als Las Vegas? Die US-Gründerväter wären auf all das stolz. Unser Liveblog,https://img.zeit.de/sport/2024-02/travis-kelce-kansas-city-chiefs-super-bowl/wide__1300x731,2024-02-11T22:19:20Z,,"Einen wunderschönen guten Abend. Die Bayern sind besiegt, die Bundestagswahl in Berlin wiederholt, da treibt uns eigentlich nur noch eine Frage um: Hat es Taylor Swift nach Las Vegas geschafft? Hat s… [+3215 chars]",,de,'Taylor Swift'
https://www.n-tv.de/politik/18-11-Russischer-Gouverneur-gibt-Immanuel-Kant-Mitschuld-am-Ukraine-Krieg--article23143824.html,https://www.n-tv.de/politik/18-11-Russischer-Gouverneur-gibt-Immanuel-Kant-Mitschuld-am-Ukraine-Krieg--article23143824.html,0,www.n-tv.de,Ukraine-Krieg im Liveticker: +++ 18:11 Russischer Gouverneur gibt Immanuel Kant Mitschuld am Ukraine-Krieg +++,Lesen Sie alle aktuellen Entwicklungen und Nachrichten über den russischen Angriffskrieg auf die Ukraine im Liveticker von ntv.de.,https://bilder2.n-tv.de/img/incoming/crop23332537/9041326157-cImg_16_9-w1200/Liveticker1-grau-1-Kopie.jpg,2024-02-11T23:30:00Z,https://web.archive.org/web/20240212172053/https://www.n-tv.de/politik/18-11-Russischer-Gouverneur-gibt-Immanuel-Kant-Mitschuld-am-Ukraine-Krieg--article23143824.html,"Der Gouverneur der russischen Ostsee-Exklave Kaliningrad, Anton Alichanow, gibt dem bedeutenden deutschen Philosophen Immanuel Kant eine Mitschuld am Ukraine-Krieg. Alichanow äußerte sich bei einer K… [+26720 chars]",,de,'Immanuel Kant'
https://www.n-tv.de/politik/20-36-Tucker-Carlson-verteidigt-Putin-Fuehrung-erfordert-das-Toeten-von-Menschen--article23143824.html,https://www.n-tv.de/politik/20-36-Tucker-Carlson-verteidigt-Putin-Fuehrung-erfordert-das-Toeten-von-Menschen--article23143824.html,0,www.n-tv.de,"Ukraine-Krieg im Liveticker: +++ 20:36 Tucker Carlson verteidigt Putin: ""Führung erfordert das Töten von Menschen"" +++",Lesen Sie alle aktuellen Entwicklungen und Nachrichten über den russischen Angriffskrieg auf die Ukraine im Liveticker von ntv.de.,https://bilder2.n-tv.de/img/incoming/crop23332537/9041326157-cImg_16_9-w1200/Liveticker1-grau-1-Kopie.jpg,2024-02-11T23:30:00Z,,"Nach seinem Interview mit Wladimir Putin verteidigt der US-Moderator Tucker Carlson auf dem World Government Summit in Dubai den Kreml-Diktator. Der Moderator eines Talks, an dem Carlson teilnahm, fr… [+29704 chars]",,de,'Tucker Carlson'
https://www.nzz.ch/sport/mahomes-magie-kansas-city-triumphiert-in-einem-dramatischen-super-bowl-abermals-und-joe-biden-trollt-die-verschwoerungsideologen-ld.1807204,https://www.nzz.ch/sport/mahomes-magie-kansas-city-triumphiert-in-einem-dramatischen-super-bowl-abermals-und-joe-biden-trollt-die-verschwoerungsideologen-ld.1807204,0,www.nzz.ch,Mahomes-Magie: Kansas City triumphiert in einem dramatischen Super Bowl abermals – und Joe Biden trollt die Verschwörungsideologen,"Zum erst zweiten Mal in der Geschichte wird ein Super Bowl in der Verlängerung entschieden. Wieder rächt es sich für den Gegner, dem Superstar Patrick Mahomes zu viele Chancen zur Bewährung gewährt zu haben.","https://img.nzz.ch/2024/02/12/1a46ab29-13c7-4234-8944-f88880214fe1.jpeg?width=1200&height=675&fit=bound&quality=75&auto=webp&crop=4124,2320,x516,y728&wmark=nzz",2024-02-12T05:20:42Z,,"Patrick Mahomes geht mit den Kansas City Chiefs in die NFL-Geschichte ein. 
Der 11. Februar wird länger in den Köpfen der favorisierten San Francisco 49ers herumspuken als ein Roman von Stephen King… [+5192 chars]",,de,'Joe Biden'
https://www.stern.de/sport/nfl--nur-brady-hat-mehr--mahomes-zum-dritten-mal-super-bowl-mvp-34449966.html,https://www.stern.de/sport/nfl--nur-brady-hat-mehr--mahomes-zum-dritten-mal-super-bowl-mvp-34449966.html,0,www.stern.de,NFL: Nur Brady hat mehr: Mahomes zum dritten Mal Super-Bowl-MVP,Zum dritten Mal in fünf Jahren holen die Kansas City Chiefs den Super Bowl - zum dritten Mal ist Patrick Mahomes der wertvollste Spieler der Partie. Nur Tom Brady hat die Auszeichnung öfter bekommen.,https://image.stern.de/34449968/t/Wb/v1/w1440/r1.7778/-/12--urnnewsmldpacom2009010124021299956754v3w800h600l529t43r1809b896jpeg---0df45b1cf378a6a7.jpg,2024-02-12T06:15:04Z,,Zum dritten Mal in fünf Jahren holen die Kansas City Chiefs den Super Bowl - zum dritten Mal ist Patrick Mahomes der wertvollste Spieler der Partie. Nur Tom Brady hat die Auszeichnung öfter bekommen.… [+465 chars],,de,'Patrick Mahomes'
https://www.bild.de/sport/american-football/nfl/taylor-swift-travis-kelce-der-liebeskuss-brauchte-12-ordner-polizei-das-fbi-87126478.bild.html,https://www.bild.de/sport/american-football/nfl/taylor-swift-travis-kelce-der-liebeskuss-brauchte-12-ordner-polizei-das-fbi-87126478.bild.html,0,www.bild.de,"Taylor Swift & Travis Kelce - Der Liebeskuss brauchte 12 Ordner, Polizei & das FBI",Das Traumpaar des Sports hat ihren ersten gemeinsamen Super Bowl gewonnen: Travis Kelce (34) und Taylor Swift (34).Foto: picture alliance / newscom,"https://images.bild.de/65c9b47197d99b5bd8631fa6/12295131584dfe518bb70c7e1e09f508,75953ac6?w=1280",2024-02-12T06:50:02Z,,"Das Traumpaar des Sports hat ihren ersten gemeinsamen Super Bowl gewonnen: Travis Kelce (34) und Taylor Swift (34).
Für Kelce ist es zwar bereits der dritte Erfolg auf der XXL-Bühne der NFL, aber no… [+3310 chars]",,de,'Lana Del Rey'
https://www.faz.net/aktuell/politik/inland/bayern-wie-gefaehrlich-ist-hubert-aiwanger-und-fuer-wen-19508957.html,https://www.faz.net/aktuell/politik/inland/bayern-wie-gefaehrlich-ist-hubert-aiwanger-und-fuer-wen-19508957.html,0,www.faz.net,Bayern: Wie gefährlich ist Hubert Aiwanger – und vor allem für wen?,Knapp zwei Jahre vor der Bundestagswahl ist das Klima in der „Bayern-Koalition“ zusehends vergiftet. Im Zentrum steht der bayerische Wirtschaftsminister.,https://media1.faz.net/ppmedia/aktuell/244888445/1.9508955/facebook_teaser/der-mann-mit-eigenschaften.jpg,2024-02-12T07:27:06Z,,"Vor gut einer Woche fand die Fernsehsitzung Fastnacht in Franken statt ein Gradmesser für die Lage in der bayerischen Politik. Hubert Aiwanger, Chef der Freien Wähler und stellvertretender Ministerpr… [+3601 chars]",,de,'Hubert Aiwanger'
https://www.stern.de/lifestyle/leute/nicht-nur-taylor-swift--diese-stars-wohnten-dem-super-bowl-bei-34450096.html,https://www.stern.de/lifestyle/leute/nicht-nur-taylor-swift--diese-stars-wohnten-dem-super-bowl-bei-34450096.html,0,www.stern.de,Nicht nur Taylor Swift: Diese Stars wohnten dem Super Bowl bei,Die 58. Ausgabe des Super Bowl ging in der Nacht auf Montag über die Bühne. Nicht nur Taylor Swift sorgte im Stadion für hohe Promi-Dichte.,https://image.stern.de/34450100/t/Mn/v1/w1440/r1.7778/-/12--diese-stars-wohnten-dem-super-bowl-bei---16-9---spoton-article-1061105.jpg,2024-02-12T07:31:00Z,,"Die 58. Ausgabe des Super Bowl ging in der Nacht auf Montag über die Bühne. Nicht nur Taylor Swift sorgte im Stadion für hohe Promi-Dichte.
Der alljährliche Super Bowl ist nicht nur das Treffen der … [+2358 chars]",,de,'Taylor Swift'
https://www.stern.de/news/super-bowl-in-las-vegas--taylor-swift-als-heimlicher-star-des-abends-34449788.html,https://www.stern.de/news/super-bowl-in-las-vegas--taylor-swift-als-heimlicher-star-des-abends-34449788.html,0,www.stern.de,Super Bowl in Las Vegas: Taylor Swift als heimlicher Star des Abends,Ein Sieg für die Kansas City Chiefs nach Verlängerung und ein bombastischer Auftritt des R&B-Sängers Usher in der Halbzeitshow - mit viel Pomp und Glitzer ist in Las Vegas der 58. Super Bowl über die Bühne gegangen. Heimlicher Star des Sonntagabends war aller…,https://image.stern.de/34450878/t/jy/v1/w1440/r1.7778/-/12--taylor-swift-kuesst-travis-kelce-nach-dem-super-bowlsieg---582a61a41c23d744.jpg,2024-02-12T11:06:31Z,,Ein Sieg für die Kansas City Chiefs nach Verlängerung und ein bombastischer Auftritt des R&amp;B-Sängers Usher in der Halbzeitshow - mit viel Pomp und Glitzer ist in Las Vegas der 58. Super Bowl über… [+2098 chars],,de,'Taylor Swift'
https://www.der-postillon.com/2024/02/swift-rowdys.html,https://www.der-postillon.com/2024/02/swift-rowdys.html,0,www.der-postillon.com,USA: Ballspielende Rowdys stören Taylor-Swift-Show,"Las Vegas (dpo) - Es sollte ihre große Show werden: Popsängerin Taylor Swift war extra von Japan nach Las Vegas gereist, um sich dort im Allegiant Stadium vor 65.000 Zuschauern bewundern zu lassen. Doch dann begann plötzlich auf einem Rasenstück unterhalb ihr…",https://blogger.googleusercontent.com/img/b/R29vZ2xl/AVvXsEgcOvTc2pyLFRdDdBU196kwln9YKqQ-GyJDyyi4IDVDGH4V7XtBe8c-6cO2IQdmrQTP4TNnnvypgRuzG5HIIS05XliUc1MwhlVunCOPbpSuHJzcegjrPNmBjrvKa3MijpTj6Os7cW-o5KnMVl60Rv1aNGab46A6zOEChiKkcTnDbzGA-QIcim_gQl_kRrQ/w1600/Taylow-Swift-Superbowl.jpg,2024-02-12T11:36:41Z,,"Las Vegas (dpo) - Es sollte ihre große Show werden: Popsängerin Taylor Swift war extra von Japan nach Las Vegas gereist, um sich dort im Allegiant Stadium vor 65.000 Zuschauern bewundern zu lassen. D… [+1040 chars]",,de,'Taylor Swift'
https://www.tagesspiegel.de/kultur/die-superbowl-halftimeshow-hauptsache-bunt-durcheinander-und-druber-11198839.html,https://www.tagesspiegel.de/kultur/die-superbowl-halftimeshow-hauptsache-bunt-durcheinander-und-druber-11198839.html,0,www.tagesspiegel.de,"Die Superbowl-Halftimeshow: Hauptsache bunt, durcheinander und drüber",Pop will eat itself: Der R&amp;B-Musiker Usher und sein Las-Vegas-Varieté-Auftritt bei der Halbzeitpause des Superbowl-Endspiels.,https://www.tagesspiegel.de/images/nfl-american-football-herren-usa-super-bowl-lviii-san-francisco-49ers-at-kansas-city-chiefs-feb-11-2024-paradise-ne1/alternates/BASE_16_9_W1400/nfl-american-football-herren-usa-super-bowl-lviii-san-francisco-49ers-at-kansas-city-chiefs-feb-11-2024-paradise-ne.jpeg,2024-02-12T13:44:53Z,,"Es gab dann bei dieser Superbowl-Halbzeitshow von Usher tatsächlich auch einmal eine Verschnaufpause, einen Moment des Innehaltens. Als nämlich Alicia Keys ganz in rot und von einer virtuellen roten … [+2932 chars]",,de,'Missy Elliott'
https://www.nzz.ch/feuilleton/die-serie-mr-mrs-smith-schickt-die-spione-in-die-paartherapie-ld.1777893,https://www.nzz.ch/feuilleton/die-serie-mr-mrs-smith-schickt-die-spione-in-die-paartherapie-ld.1777893,0,www.nzz.ch,«Mr. & Mrs. Smith» machte Angelina Jolie und Brad Pitt zum Hollywood-Traumpaar. In der Serienadaption sind die Spione schwarz und asiatisch und müssen in die Paartherapie,Vom «Brangelina»-Original bleibt am Ende wenig ausser dem Titel. Aber das ist gut so.,"https://img.nzz.ch/2024/02/07/66a1edc3-1e09-4354-8712-821bcc9f07f6.jpeg?width=1200&height=675&fit=bound&quality=75&auto=webp&crop=3900,2194,x0,y0&wmark=nzz",2024-02-12T13:54:28Z,,"Platonische Kollegen täuschen ein verheiratetes Paar vor: Das muss natürlich schief-/gutgehen: Donald Glover und Maya Erskine spielen die Spione in «Mr. &amp; Mrs. Smith».
Ein Job-Interview in Zeite… [+4111 chars]",,de,'Angelina Jolie'
https://www.stern.de/kultur/sylvester-stallone--ryan-gosling-als-rambo-nachfolger--34451700.html,https://www.stern.de/kultur/sylvester-stallone--ryan-gosling-als-rambo-nachfolger--34451700.html,0,www.stern.de,Sylvester Stallone: Ryan Gosling als Rambo-Nachfolger?,Ken-Darsteller Ryan Gosling als neuer Rambo? Sylvester Stallone hat einen nur auf den ersten Blick überraschenden Vorschlag.,https://image.stern.de/34451704/t/qo/v1/w1440/r1.7778/-/12--ryan-gosling-als-rambo-nachfolger----16-9---spoton-article-1061153.jpg,2024-02-12T15:33:00Z,,"Ken-Darsteller Ryan Gosling als neuer Rambo? Sylvester Stallone hat einen nur auf den ersten Blick überraschenden Vorschlag.
Sylvester Stallone (77) hat eine überraschende Wahl, wenn es um einen mög… [+1960 chars]",,de,'Greta Gerwig'
https://www.focus.de/kultur/medien/wegen-hohen-investitionen-richard-lugner-offenbart-40-millionen-euro-schulden-zu-haben_id_259663383.html,https://www.focus.de/kultur/medien/wegen-hohen-investitionen-richard-lugner-offenbart-40-millionen-euro-schulden-zu-haben_id_259663383.html,0,www.focus.de,"Wegen hohen Investitionen - Richard Lugner offenbart, 40 Millionen Euro Schulden zu haben","Richard Lugner spricht offen über seine finanziellen Herausforderungen: Im Gespräch bestätigt er, dass er mit einem beträchtlichen Schuldenberg zu kämpfen hat, der auf seine umfangreichen Investitionen zurückzuführen ist.",https://p6.focus.de/img/kultur/kino_tv/id_259646451/richard-moertel-lugner-.jpg?im=Crop%3D%280%2C84%2C1360%2C680%29%3BResize%3D%281200%2C627%29&impolicy=perceptual&quality=mediumHigh&hash=1ff0d617644f7914f21d58638c62cd0d3f87c49a6bc8605a9906635812a02b95,2024-02-12T16:01:41Z,,"Richard Lugner spricht offen über seine finanziellen Herausforderungen: Im Gespräch bestätigt er, dass er mit einem beträchtlichen Schuldenberg zu kämpfen hat, der auf seine umfangreichen Investition… [+2880 chars]",,de,'nan nan'
