index,url,valid,domain,title,description,image,published,archive,content,quote,language,keyword
https://www.nzz.ch/wissenschaft/viele-tiernamen-seien-rassistisch-sagen-einige-wissenschafter-und-fordern-arten-gar-nicht-mehr-nach-menschen-zu-benennen-ld.1759331,https://www.nzz.ch/wissenschaft/viele-tiernamen-seien-rassistisch-sagen-einige-wissenschafter-und-fordern-arten-gar-nicht-mehr-nach-menschen-zu-benennen-ld.1759331,0,www.nzz.ch,"Viele Tiernamen seien rassistisch, sagen einige Wissenschafter und fordern, Arten gar nicht mehr nach Menschen zu benennen","Neu beschriebene Arten werden häufig nach ihren Entdeckern oder anderen Persönlichkeiten benannt. Nun tobt unter Biologen ein Streit: Manche Forscher fordern, zeitgenössische Moral in die Benennungspraxis einfliessen zu lassen. Fachleute widersprechen vehemen…","https://img.nzz.ch/2023/10/05/32676478-b2fc-40a7-922f-63b8348063df.jpeg?width=1200&height=675&fit=bound&quality=75&auto=webp&crop=1440,810,x0,y154&wmark=nzz",2023-10-09T03:30:00Z,,"Die Motte Neopalpa donaldtrumpi ist Trägerin einer blonden Kopfbedeckung und besonders kleiner Genitalien.
Was haben Jackie Chan, Taylor Swift, Adolf Hitler und Donald Trump gemeinsam? Ihnen zu Ehre… [+7529 chars]",,de,'nan nan'
https://www.faz.net/podcasts/f-a-z-podcast-fruehdenker/faz-fruehdenker-krieg-in-israel-und-wahlen-in-bayern-und-hessen-19229937.html,https://www.faz.net/podcasts/f-a-z-podcast-fruehdenker/faz-fruehdenker-krieg-in-israel-und-wahlen-in-bayern-und-hessen-19229937.html,0,www.faz.net,F.A.Z. Frühdenker: Wie schwer wiegt Faesers Wahl-Debakel für die Ampel?,Israel befindet sich im Kriegszustand. In Bayern kann Markus Söder Ministerpräsident bleiben – und in Hessen Boris Rhein. Der F.A.Z.-Newsletter.,https://media1.faz.net/ppmedia/aktuell/2892365062/1.9229805/facebook_teaser_fplus/schwerer-gang-guter-stand.jpg,2023-10-09T04:12:00Z,,"Das Wichtigste für Sie an diesem Montag:
1. Israel erwartet langen und schweren Krieg2. Deutsche Palästinenser-Hilfe gestoppt3. Rhein kann sich in Hessen Partner aussuchen4. Söder will weiter mit Fr… [+790 chars]",,de,'Boris Rhein'
https://www.appgefahren.de/shot-on-iphone-15-pro-apple-wirbt-mit-olivia-rodrigo-345143.html,https://www.appgefahren.de/shot-on-iphone-15-pro-apple-wirbt-mit-olivia-rodrigo-345143.html,0,www.appgefahren.de,Shot on iPhone 15 Pro: Apple wirbt mit Olivia Rodrigo,In Kanada hat Apple einen neuen Werbespot zum iPhone 15 Pro veröffentlicht – zusammen mit der bekannten Sängerin und Schauspielerin Olivia Rodrigo. Die Musikerin hat ihr neustes Musikvideo nur mit dem iPhone 15 Pro gedreht und der von Apple veröffentlichte Sp…,https://www.appgefahren.de/wp-content/uploads/2023/03/Kamera-Icon.jpeg,2023-10-09T05:07:50Z,,In Kanada hat Apple einen neuen Werbespot zum iPhone 15 Pro veröffentlicht – zusammen mit der bekannten Sängerin und Schauspielerin Olivia Rodrigo. Die Musikerin hat ihr neustes Musikvideo nur mit de… [+531 chars],,de,'Olivia Rodrigo'
https://www.zeit.de/video/2023-10/6338692889112/landtagswahl-in-hessen-cdu-ist-deutlicher-sieger-afd-zweitstaerkste-kraft,https://www.zeit.de/video/2023-10/6338692889112/landtagswahl-in-hessen-cdu-ist-deutlicher-sieger-afd-zweitstaerkste-kraft,0,www.zeit.de,"Landtagswahl in Hessen: CDU ist deutlicher Sieger, AfD zweitstärkste Kraft","Laut dem vorläufigen Endergebnis ist die CDU von Boris Rhein mit 34,6 Prozent der deutliche Sieger in Hessen. Zweitstärkste Kraft im Landtag ist die AfD mit 18,4 Prozent.",,2023-10-09T07:59:02Z,,"When browsing with ads:
We collect personal data and also transmit it to third-party providers
 that help us improve and finance our digital content. Some of the information stored on your device, … [+821 chars]",,de,'Boris Rhein'
https://www.stern.de/lifestyle/leute/vip-news--mit-kindheitsbildern-gratuliert-heidi-klum-ihrer-tochter-zum-geburtstag-3205306.html,https://www.stern.de/lifestyle/leute/vip-news--mit-kindheitsbildern-gratuliert-heidi-klum-ihrer-tochter-zum-geburtstag-3205306.html,0,www.stern.de,Leute von heute: Heidi Klum: Mit süßen Kindheitsbildern gratuliert sie Tochter Lou zum Geburtstag,Zum 14. Geburtstag ihrer Tochter Lou hat Heidi Klum gleich mehrere gemeinsame Kindheitsbilder veröffentlicht. Diese und weitere Promi-Meldungen in den VIP-News.,https://image.stern.de/33895742/t/BP/v2/w1440/r1.7778/-/heidi-klum-teaser.jpg,2023-10-09T09:10:00Z,,"Von ""A"" wie Angelina Jolie oder Amal Clooney über ""H"" wie Heidi Klum und Helene Fischer bis ""Z"" wie Zac Efron und Zara Tindall: In der Welt der Promis ist immer etwas los. Ob sich nun neue Paare find… [+494 chars]",,de,'Heidi Klum'
https://www.diepresse.com/17728173/schrieb-ein-ghostwriter-fuer-krimiautorin-camilla-laeckberg,https://www.diepresse.com/17728173/schrieb-ein-ghostwriter-fuer-krimiautorin-camilla-laeckberg,0,www.diepresse.com,Schrieb ein Ghostwriter für Krimiautorin Camilla Läckberg?,"Camilla Läckberg wird gern als Königin des Nordic Noir bezeichnet. Derzeit bekommt ihr Thron allerdings (neue) Risse: Sie soll heimlich einen Ghostwriter eingesetzt haben, wie eine Datenanalyse ergab. Ihren Lektor.",https://img.diepresse.com/public/incoming/owvjwh-STOCKHOLM-20230220-Camilla-L%C3%A4ckberg-vid-pressdag-f%C3%B6r-nya-tv-serien-Strandhotellet-.-STOCKHOLM-SVERIGE-x10090x-STOCKH/alternates/DPR_SOCIAL_MAGAZIN/STOCKHOLM%2020230220%20Camilla%20L%C3%A4ckberg%20vid%20pressdag%20f%C3%B6r%20nya%20tv-serien%20Strandhotellet%20.%20STOCKHOLM%20SVERIGE%20x10090x%20%2a%2a%2a%20STOCKH,2023-10-09T11:35:27Z,,"Camilla Läckberg wird gern als Königin des Nordic Noir bezeichnet. Derzeit bekommt ihr Thron allerdings (neue) Risse: Sie soll heimlich einen Ghostwriter eingesetzt haben, wie eine Datenanalyse ergab… [+2844 chars]",,de,'Königin Camilla'
https://feed.laut.de/News/Schuh-Plattler-Farin-Urlaub-kommentiert-AfD-Erfolg-09-10-2023-19968,https://feed.laut.de/News/Schuh-Plattler-Farin-Urlaub-kommentiert-AfD-Erfolg-09-10-2023-19968,0,feed.laut.de,Schuh-Plattler: Farin Urlaub kommentiert AfD-Erfolg,Pet Shop Boys tadeln Drake. The Go-Betweens-Comic. Olivia Rodrigo toppt Vinylcharts. Neues von All Diese Gewalt. 5 Fragen an Bernd Begemann.,https://www.laut.de/News/Schuh-Plattler-Farin-Urlaub-kommentiert-AfD-Erfolg-09-10-2023-19968/schuh-plattler-farin-urlaub-kommentiert-afd-erfolg-230566.jpg,2023-10-09T13:11:14Z,,"Pet Shop Boys tadeln Drake. The Go-Betweens-Comic. Olivia Rodrigo toppt Vinylcharts. Neues von All Diese Gewalt. 5 Fragen an Bernd Begemann.
Inside The Shit (mis) - Was für ein beschissenes Wochenen… [+880 chars]",,de,'Olivia Rodrigo'
https://www.kino.de/film/james-bond-007-keine-zeit-zu-sterben-2021/news/james-bond-sensation-im-gespraech-christopher-nolan-soll-007-trilogie-angeboten-werden/,https://www.kino.de/film/james-bond-007-keine-zeit-zu-sterben-2021/news/james-bond-sensation-im-gespraech-christopher-nolan-soll-007-trilogie-angeboten-werden/,0,www.kino.de,James-Bond-Sensation im Gespräch: Christopher Nolan soll 007-Trilogie angeboten werden,Christopher Nolan und James Bond: Das wäre eine himmlische Verheißung! Und genau das streben angeblich Amazon und 007-Produzentin Barbara Broccoli an.,https://crops.giga.de/ae/2a/70/41f095fd1a9282d10701360a1a_YyAyOTgzeDE2NzgrNys4MQJyZSAxOTIwIDEwODADYWE0MGZhODEwNjE=.jpg,2023-10-09T15:21:53Z,,"Christopher Nolan und James Bond: Das wäre eine himmlische Verheißung! Und genau das streben angeblich Amazon und 007-Produzentin Barbara Broccoli an.
Keine Zeit zu sterben
Streaming bei:
<ul><li>… [+4776 chars]",,de,'Christopher Nolan'
https://www.dwdl.de/nachrichten/95031/finale_the_crownstaffel_startet_mitte_november/,https://www.dwdl.de/nachrichten/95031/finale_the_crownstaffel_startet_mitte_november/,0,www.dwdl.de,"Finale ""The Crown""-Staffel startet Mitte November","Weil Netflix in der sechsten und letzten Staffel von ""The Crown"" auch den tragischen Tod von Prinzessin Diana thematisieren wird, hat es bereits viele Schlagzeilen gegeben. Nun steht fest, wann die finalen Folgen veröffentlicht werden.",https://www.dwdl.de/images/1696868520_the-crown-staffel-5.png,2023-10-09T16:18:00Z,,"Netflix hat einen Veröffentlichungstermin für die finale Staffel von ""The Crown"" bekanntgegeben. Der sechste Durchlauf der Drama-Serie wird dabei zweigeteilt: Die Folgen eins bis vier werden bereits … [+1900 chars]",,de,'Prinzessin Diana'
https://www.dw.com/de/mccarthy-schlie%C3%9Ft-erneute-kandidatur-nicht-aus/a-67046226,https://www.dw.com/de/mccarthy-schlie%C3%9Ft-erneute-kandidatur-nicht-aus/a-67046226,0,www.dw.com,McCarthy schließt erneute Kandidatur nicht aus,"Der Republikaner Kevin MCCarthy gibt nicht auf. Noch vergangene Woche wurde er als Sprecher des US-Repräsentantenhauses abgesetzt. Jetzt schließt der 58-Jährige eine erneute Kandidatur nicht mehr aus. ""Ich werde tun, was immer die Abgeordneten wollen"", sagte …",https://static.dw.com/image/66990684_6.jpg,2023-10-09T18:16:00Z,,"""Ich werde tun, was immer die Abgeordneten wollen"", sagte der Republikaner Kevin McCarthy in der Radio-Talkshow von Moderator Hugh Hewitt. ""Ich denke, wir müssen stark sein. Ich denke, wir werden ver… [+1563 chars]",,de,'Steve Scalise'
https://www.faz.net/aktuell/politik/inland/nach-erfolg-bei-hessen-wahl-boris-rhein-hat-freie-hand-19231602.html,https://www.faz.net/aktuell/politik/inland/nach-erfolg-bei-hessen-wahl-boris-rhein-hat-freie-hand-19231602.html,0,www.faz.net,Nach Erfolg bei Hessen-Wahl: Boris Rhein hat freie Hand,Die hessische CDU will nach ihrem Wahlerfolg mehr Einfluss und mehr Ministerien. Sie kann sich den Koalitionspartner aussuchen. Das Misstrauen gegenüber den Grünen ist stärker als noch vor wenigen Jahren.,https://media0.faz.net/ppmedia/aktuell/2571241220/1.9231598/facebook_teaser_fplus/boris-rhein-auf-einer.jpg,2023-10-09T20:00:57Z,,"Bevor Boris Rhein am frühen Montagmorgen ins Flugzeug nach Berlin stieg, um an der Bundesvorstandssitzung der CDU teilzunehmen, feierte er am Abend noch seinen Wahlsieg im Landtag in Wiesbaden. Zunäc… [+1210 chars]",,de,'Boris Rhein'
https://www.tagesschau.de/ausland/asien/palaestinenser-eu-hilfen-100.html,https://www.tagesschau.de/ausland/asien/palaestinenser-eu-hilfen-100.html,0,www.tagesschau.de,Hamas-Angriff auf Israel: EU streitet über Hilfszahlungen für Palästinenser,"Die EU ist der größte Geldgeber für die Palästinenser. Nach dem Hamas-Angriff auf Israel entbrennt ein Streit, ob die Finanzhilfen eingefroren werden sollen. Auch Deutschlands Ankündigung, die Mittel vorerst auszusetzen, sorgt für Kritik.",https://images.tagesschau.de/image/ef641c31-66db-4260-ad53-8878b5b7ed38/AAABixgwr9E/AAABibBxqrQ/16x9-1280/eu-kommission-248.jpg,2023-10-10T06:05:26Z,,"Stand: 10.10.2023 08:05 Uhr
Die EU ist der größte Geldgeber für die Palästinenser. Nach dem Hamas-Angriff auf Israel entbrennt ein Streit, ob die Finanzhilfen eingefroren werden sollen. Auch Deutsch… [+4544 chars]",,de,'nan nan'
https://www.welt.de/politik/ausland/article247914754/Machtvakuum-US-Repraesentantenhauses-fuehrerlos-McCarthy-liebaeugelt-mit-Comeback.html,https://www.welt.de/politik/ausland/article247914754/Machtvakuum-US-Repraesentantenhauses-fuehrerlos-McCarthy-liebaeugelt-mit-Comeback.html,0,www.welt.de,US-Repräsentantenhauses führerlos – McCarthy liebäugelt mit Comeback,"Das US-Repräsentantenhaus ist ohne Führungsfigur – und das inmitten heftiger internationaler Krisen. Kevin McCarthy kokettiert angesichts des Machtvakuums mit einem Comeback. Einige Republikaner befürchten offenbar, die Welt könne in den USA eine „dysfunktion…",https://img.welt.de/img/bildergalerien/mobile247914660/0561355137-ci16x9-w1200/Kevin-McCarthy.jpg,2023-10-10T09:06:33Z,,"Auch eine Woche nach der historischen Absetzung des US-Republikaners Kevin McCarthy herrscht unter seinen Parteikollegen Uneinigkeit, wer als Vorsitzender des Repräsentantenhauses nachrücken soll. We… [+2555 chars]",,de,'Steve Scalise'
https://taz.de/-Nachrichten-im-Ukraine-Krieg-/!5965902/,https://taz.de/-Nachrichten-im-Ukraine-Krieg-/!5965902/,0,taz.de,+++ Nachrichten im Ukraine-Krieg +++: Kooperation am Schwarzen Meer,"Zum ersten Mal seit Kriegsbeginn reist Selenski nach Rumänien, um über Zusammenarbeit zu sprechen. Moskau attackiert den Süden und Osten der Ukraine.",https://taz.de/picture/6577185/948/33799755-1.jpeg,2023-10-10T16:11:00Z,,"Zum ersten Mal seit Kriegsbeginn reist Selenski nach Rumänien, um über Zusammenarbeit zu sprechen. Moskau attackiert den Süden und Osten der Ukraine.
Präsident Selenski und Premierminister Ciolacu a… [+11307 chars]",,de,'Selenski'
https://www.brigitte.de/aktuell/carey-mulligan--schauspielerin-bestaetigt-geburt-ihres-dritten-kindes-13600894.html,https://www.brigitte.de/aktuell/carey-mulligan--schauspielerin-bestaetigt-geburt-ihres-dritten-kindes-13600894.html,0,www.brigitte.de,Carey Mulligan: Schauspielerin bestätigt Geburt ihres dritten Kindes,"Carey Mulligan hat in einem Interview bestätigt, dass sie erneut Mutter geworden ist. Es ist das dritte Kind mit ihrem Mann Marcus Mumford.",https://image.brigitte.de/13600896/t/yZ/v1/w1440/r1.7778/-/10--schauspielerin-bestaetigt-geburt-ihres-dritten-kindes---1-1---spoton-article-1053937.jpg,2023-10-10T17:28:00Z,,"Carey Mulligan hat in einem Interview bestätigt, dass sie erneut Mutter geworden ist. Es ist das dritte Kind mit ihrem Mann Marcus Mumford.
Schauspielerin Carey Mulligan (38) und Musiker Marcus Mumf… [+1332 chars]",,de,'Carey Mulligan'
https://www.stern.de/lifestyle/leute/carey-mulligan--sie-bestaetigt-geburt-des-dritten-kindes-33901354.html,https://www.stern.de/lifestyle/leute/carey-mulligan--sie-bestaetigt-geburt-des-dritten-kindes-33901354.html,0,www.stern.de,Carey Mulligan: Sie bestätigt Geburt des dritten Kindes,"Carey Mulligan hat in einem Interview bestätigt, dass sie erneut Mutter geworden ist. Es ist das dritte Kind mit ihrem Mann Marcus Mumford.",https://image.stern.de/33901358/t/R-/v1/w1440/r1.7778/-/10--sie-bestaetigt-geburt-des-dritten-kindes---16-9---spoton-article-1053937.jpg,2023-10-10T17:34:00Z,,"Carey Mulligan hat in einem Interview bestätigt, dass sie erneut Mutter geworden ist. Es ist das dritte Kind mit ihrem Mann Marcus Mumford.
Schauspielerin Carey Mulligan (38) und Musiker Marcus Mumf… [+1332 chars]",,de,'Carey Mulligan'
https://www.focus.de/politik/ausland/abgesetzte-sprecher-des-us-repraesentantenhauses-mccarthy-will-keine-erneute-nominierung-fuer-chefposten-im-kongress_id_222459069.html,https://www.focus.de/politik/ausland/abgesetzte-sprecher-des-us-repraesentantenhauses-mccarthy-will-keine-erneute-nominierung-fuer-chefposten-im-kongress_id_222459069.html,0,www.focus.de,Abgesetzte Sprecher des US-Repräsentantenhauses - McCarthy will keine erneute Nominierung für Chefposten im Kongress,Der in der vergangenen Woche abgesetzte Sprecher des US-Repräsentantenhauses Kevin McCarthy will nun Medienberichten zufolge doch nicht erneut für den Posten kandidieren.,https://p6.focus.de/img/panorama/id_218473262/nach-mccarthys-absetzung-trump-getreuer-jordan-will-neuer-chef-im-repraesentantenhaus-werden.jpg?im=Crop%3D%280%2C102%2C1000%2C500%29%3BResize%3D%281200%2C627%29&impolicy=perceptual&quality=mediumHigh&hash=341acf2f223781cdcc6e29f78f84b8eba533731c966f5392c436a721ebb63d0b,2023-10-11T00:36:13Z,,Der in der vergangenen Woche abgesetzte Sprecher des US-Repräsentantenhauses Kevin McCarthy will nun Medienberichten zufolge doch nicht erneut für den Posten kandidieren. Der Republikaner habe seine … [+1607 chars],,de,'Steve Scalise'
https://www.stern.de/politik/ausland/russischer-angriffskrieg--selenskyj-ueberraschend-zu-gespraechen-in-bruessel-33902612.html,https://www.stern.de/politik/ausland/russischer-angriffskrieg--selenskyj-ueberraschend-zu-gespraechen-in-bruessel-33902612.html,0,www.stern.de,Russischer Angriffskrieg: Selenskyj überraschend zu Gesprächen in Brüssel,"Der ukrainische Präsident Wolodymyr Selenskyj besuchte im Februar zum ersten Mal seit Ausbruch des Krieges Brüssel. Nun ist er zurück und wird an einem Ort erwartet, den er damals nicht besuchte.",https://image.stern.de/33902614/t/Ds/v1/w1440/r1.7778/-/11--urnnewsmldpacom2009010123101199522050v3w800h600l640t425r1920b1278jpeg---b922ea62ec689781.jpg,2023-10-11T06:43:02Z,,"Der ukrainische Präsident Wolodymyr Selenskyj besuchte im Februar zum ersten Mal seit Ausbruch des Krieges Brüssel. Nun ist er zurück und wird an einem Ort erwartet, den er damals nicht besuchte.
De… [+2083 chars]",,de,'Alexander De Croo'
https://www.welt.de/politik/ausland/article247930872/Russischer-Angriffskrieg-Selenskyj-bei-Nato-Treffen-in-Bruessel-Ukraine-meldet-heftige-Kaempfe.html,https://www.welt.de/politik/ausland/article247930872/Russischer-Angriffskrieg-Selenskyj-bei-Nato-Treffen-in-Bruessel-Ukraine-meldet-heftige-Kaempfe.html,0,www.welt.de,Selenskyj bei Nato-Treffen in Brüssel – Ukraine meldet heftige Kämpfe,Die von der Ukraine dringend erbetenen Taurus-Marschflugkörper wird Deutschland zwar vorerst nicht liefern. Doch für die kommenden Monate soll es zumindest neue Luftabwehrsysteme und Panzer geben. Aus dem ostukrainischen Gebiet Donezk werden unterdessen hefti…,https://img.welt.de/img/politik/ausland/mobile247932116/5391351027-ci16x9-w1200/Selenskyj-wirft-Hamas-Stolz-auf-Graeueltaten-vor.jpg,2023-10-11T06:48:00Z,,Der ukrainische Präsident Wolodymyr Selenskyj ist überraschend für politische Gespräche in Brüssel. Das bestätigte ein belgischer Regierungssprecher am Mittwoch. Selenskyj wird zu Gast bei der Nato s… [+4721 chars],,de,'Selenskyj'
https://www.stern.de/politik/ausland/ukraines-praesident-selenskyj-ueberraschend-zu-gespraechen-in-bruessel-33902578.html,https://www.stern.de/politik/ausland/ukraines-praesident-selenskyj-ueberraschend-zu-gespraechen-in-bruessel-33902578.html,0,www.stern.de,Nato-Treffen: Selenskyj überraschend zu Gesprächen in Brüssel eingetroffen,"Im Februar besuchte der ukrainische Präsident Wolodymyr Selenskyj zum ersten Mal seit Beginn des Krieges Brüssel. Nun ist er zurück und wird an einem Ort erwartet, den er damals nicht besuchte.",https://image.stern.de/33902580/t/US/v1/w1440/r1.7778/-/ukraine-selenskyj-bruessel-eu.jpg,2023-10-11T08:01:00Z,,"Im Februar besuchte der ukrainische Präsident Wolodymyr Selenskyj zum ersten Mal seit Beginn des Krieges Brüssel. Nun ist er zurück und wird an einem Ort erwartet, den er damals nicht besuchte.
Der … [+2022 chars]",,de,'Alexander De Croo'
https://www.sueddeutsche.de/panorama/heidi-klum-leni-klum-playboy-taylor-swift-soekeland-huber-1.6284580,https://www.sueddeutsche.de/panorama/heidi-klum-leni-klum-playboy-taylor-swift-soekeland-huber-1.6284580,0,www.sueddeutsche.de,"Leute: ""Könnten da nicht gegensätzlicher sein""","Leni Klum emanzipiert sich stiltechnisch von ihrer Mutter, Taylor Swift ist ein gutes Vorbild für Kinder, und zwei Nackte revolutionieren den ""Playboy"".",https://www.sueddeutsche.de/image/sz.1.6284583/1200x675?v=1697019883,2023-10-11T10:27:08Z,,"Leni Klum emanzipiert sich stiltechnisch von ihrer Mutter, Taylor Swift ist ein gutes Vorbild für Kinder, und zwei Nackte revolutionieren den ""Playboy"".Leni Klum, 19, Model-Tochter, kann mit dem Mode… [+1925 chars]",,de,'Leni Klum'
https://www.stern.de/lifestyle/leute/heidi-und-leni-klum--in-vielen-dingen-voellig-gegensaetzlich-33903850.html,https://www.stern.de/lifestyle/leute/heidi-und-leni-klum--in-vielen-dingen-voellig-gegensaetzlich-33903850.html,0,www.stern.de,Heidi und Leni Klum: In vielen Dingen völlig gegensätzlich,"Beide sind erfolgreich in der Modebranche und doch unterscheiden sie sich sehr voneinander, wie Heidi und Leni im Interview erzählen.",https://image.stern.de/33903854/t/BA/v1/w1440/r1.7778/-/11--in-vielen-dingen-voellig-gegensaetzlich---16-9---spoton-article-1053988.jpg,2023-10-11T12:18:00Z,,"Beide sind erfolgreich in der Modebranche und doch unterscheiden sie sich sehr voneinander, wie Heidi und Leni im Interview erzählen.
Ihren Alltag verbringen Mutter und Tochter seit einem Jahr 4.000… [+3013 chars]",,de,'Heidi Klum'
https://orf.at/stories/3334853/,https://orf.at/stories/3334853/,0,orf.at,Selenskyj warnt vor nachlassender westlicher Hilfe,,https://orf.at/mojo/1_4_1/storyserver//news/common/images/og-fallback-news.png,2023-10-11T13:55:44Z,,Der ukrainische Präsident Wolodymyr Selenskyj hat vor einem möglichen Nachlassen der internationalen Unterstützung für Kiew wegen des Konflikts im Nahen Osten gewarnt. Das ist ein Risiko nicht nur fü… [+1031 chars],,de,'Selenskyj'
https://taz.de/Nato-Verteidigungsministertreffen/!5965987/,https://taz.de/Nato-Verteidigungsministertreffen/!5965987/,0,taz.de,Nato-Verteidigungsministertreffen: Russisches Vermögen für Kyjiw,"Die Verteidigungsminister tagen in Brüssel, Selenski ist erstmals dabei. Belgien verspricht 1,7 Milliarden für Kyjiw aus eingefrorenem Vermögen.",https://taz.de/picture/6579528/948/33804266-1.jpeg,2023-10-11T14:08:00Z,,"Die Verteidigungsminister tagen in Brüssel, Selenski ist erstmals dabei. Belgien verspricht 1,7 Milliarden für Kyjiw aus eingefrorenem Vermögen.
Ukraines Präsident Selenski und der belgische Ministe… [+3148 chars]",,de,'Selenski'
https://www.n-tv.de/leute/Heidi-und-Leni-Klum-modeln-wieder-in-Dessous-article24457517.html,https://www.n-tv.de/leute/Heidi-und-Leni-Klum-modeln-wieder-in-Dessous-article24457517.html,0,www.n-tv.de,Einig (fast) nur bei Unterwäsche: Heidi und Leni Klum modeln wieder in Dessous,"Die eine ist die Mutter, die andere die Tochter. Die eine ist 50, die andere 19. Die eine mag es bunt und durcheinander, die andere monoton und aufgeräumt. Trotzdem verstehen sich Heidi und Leni Klum blendend - auch und gerade, wenn sie nun wieder gemeinsam D…",https://bilder2.n-tv.de/img/incoming/crop24457525/226132156-cImg_16_9-w1200/429072157.jpg,2023-10-11T15:58:20Z,,"Die eine ist die Mutter, die andere die Tochter. Die eine ist 50, die andere 19. Die eine mag es bunt und durcheinander, die andere monoton und aufgeräumt. Trotzdem verstehen sich Heidi und Leni Klum… [+3096 chars]",,de,'Leni Klum'
https://www.welt.de/politik/ausland/article247949624/Republikaner-nominieren-Steve-Scalise-fuer-Chefposten-im-US-Kongress.html,https://www.welt.de/politik/ausland/article247949624/Republikaner-nominieren-Steve-Scalise-fuer-Chefposten-im-US-Kongress.html,0,www.welt.de,Republikaner nominieren Steve Scalise für Chefposten im US-Kongress,"Nachdem die Republikaner vergangene Woche Kevin McCarthy als Vorsitzenden des Repräsentantenhauses abgewählt hatten, muss der Posten neu besetzt werden. Nominiert wurde nun Steve Scalise, die bisherige republikanische Nummer zwei. Entschieden ist jedoch noch …",https://img.welt.de/img/politik/ausland/mobile247949650/6441357947-ci16x9-w1200/US-POLITICS-CONGRESS-SPEAKER.jpg,2023-10-11T17:46:44Z,,Bei der Suche nach einem Kandidaten für den Vorsitz des US-Repräsentantenhauses haben die Republikaner Medien zufolge den Abgeordneten Steve Scalise nominiert. Scalise ist die bisherige republikanisc… [+1460 chars],,de,'Steve Scalise'
https://www.faz.net/aktuell/politik/ausland/republikaner-nominieren-steve-scalise-als-sprecher-im-kongress-19237239.html,https://www.faz.net/aktuell/politik/ausland/republikaner-nominieren-steve-scalise-als-sprecher-im-kongress-19237239.html,0,www.faz.net,Nach parteiinterner Abstimmung: Republikaner nominieren Steve Scalise für Chefposten im US-Kongress,"Die Nominierung bedeutet nicht automatisch, dass Steve Scalise auch bei der offiziellen Wahl eine Mehrheit haben wird. Eine Handvoll Abweichler würde genügen, um die Kandidatur zu blockieren.",https://media1.faz.net/ppmedia/aktuell/politik/340076845/1.9237255/facebook_teaser/steve-scalise-spricht-am.jpg,2023-10-11T17:53:55Z,,Bei der Suche nach einem Kandidaten für den Sprecher des US-Repräsentantenhauses haben die Republikaner Medien zufolge den Abgeordneten Steve Scalise nominiert. Scalise ist die bisherige republikanis… [+1456 chars],,de,'Steve Scalise'
https://www.zeit.de/politik/ausland/2023-10/usa-republikaner-steven-scalise-nominierung-repraesentantenhaus,https://www.zeit.de/politik/ausland/2023-10/usa-republikaner-steven-scalise-nominierung-repraesentantenhaus,0,www.zeit.de,USA: US-Republikaner nominieren Steve Scalise für Repräsentantenhausvorsitz,Steve Scalise hat sich bei den Republikanern intern gegen Jim Jordan durchgesetzt. Nun könnte er im Repräsentantenhaus die Nachfolge von Kevin McCarthy antreten.,,2023-10-11T17:57:25Z,,"When browsing with ads:
We collect personal data and also transmit it to third-party providers
 that help us improve and finance our digital content. Some of the information stored on your device, … [+821 chars]",,de,'Kevin McCarthy'
https://www.morgenpost.de/politik/ausland/article239781451/Republikaner-nominieren-Scalise-fuer-Chefposten-im-Kongress.html,https://www.morgenpost.de/politik/ausland/article239781451/Republikaner-nominieren-Scalise-fuer-Chefposten-im-Kongress.html,0,www.morgenpost.de,USA: Republikaner nominieren Scalise für Chefposten im Kongress,Er gilt als Gegner von Abtreibungen und könnte  demnächst in das drittwichtigste Amt im Staat gewählt werden: Der 58-jährige Republikaner Steve Scalise aus Louisiana.,https://img.morgenpost.de/img/ausland/crop239781449/2342603045-w820-cv16_9-q85/Steve-Scalise.jpg,2023-10-11T18:21:52Z,,Washington. Bei der Suche nach einem Kandidaten für den Vorsitz des US-Repräsentantenhauses haben die Republikaner Medien zufolge den Abgeordneten Steve Scalise nominiert. Scalise ist die bisherige r… [+1598 chars],,de,'Steve Scalise'
