index,url,valid,domain,title,description,image,published,archive,content,quote,language,keyword
https://www.golem.de/sonstiges/zustimmung/auswahl.html?from=https://www.golem.de/news/coppolas-science-ficition-epos-der-erste-trailer-zu-megalopolis-ist-da-2405-185078.html&referer=https://t.co/0b225890e8,https://www.golem.de/sonstiges/zustimmung/auswahl.html?from=https://www.golem.de/news/coppolas-science-ficition-epos-der-erste-trailer-zu-megalopolis-ist-da-2405-185078.html&referer=https://t.co/0b225890e8,0,www.golem.de,Coppolas Science-Ficition-Epos: Der erste Trailer zu Megalopolis ist da,"Der Trailer gibt einen Eindruck von der Größe und der visuellen Wucht des Science-Fiction-Films von Francis Ford Coppola. (Science-Fiction, Film)",,2024-05-14T07:30:02Z,,"Besuchen Sie Golem.de wie gewohnt mit Werbung und Tracking,
 indem Sie der Nutzung aller Cookies zustimmen.
 Details zum Tracking finden Sie im Privacy Center.
Skript wurde nicht geladen. Informat… [+607 chars]",,de,'Francis Ford Coppola'
https://www.stern.de/lifestyle/leute/david-beckham-spricht-ueber-seine-ehe-mit-victoria-beckham-34708944.html,https://www.stern.de/lifestyle/leute/david-beckham-spricht-ueber-seine-ehe-mit-victoria-beckham-34708944.html,0,www.stern.de,"Beziehungsleben: David Beckham über seine Zeit mit Victoria: ""Ich weiß nicht, wie wir die letzten 27 Jahre überstanden haben""","In ihrer viel diskutierten Netflix-Doku haben David und Victoria Beckham jüngst Einblick in ihre Ehe gegeben – schwere Zeiten inklusive. Rückblickend wissen die beiden nicht, wie sie so viel Drama als Paar überstehen konnten.",https://image.stern.de/34709184/t/JO/v1/w1440/r1.7778/-/david-beckham-victoria-beckham.jpg,2024-05-14T08:20:17Z,,"In ihrer viel diskutierten Netflix-Doku haben David und Victoria Beckham jüngst Einblick in ihre Ehe gegeben schwere Zeiten inklusive. Rückblickend wissen die beiden nicht, wie sie so viel Drama als … [+2615 chars]",,de,'David Beckham'
https://www.kino.de/film/thor-4-love-and-thunder-2022/news/ihre-filme-haben-auch-nicht-immer-funktioniert-thor-star-verteidigt-mcu-nach-kritik-von-regie-legenden/,https://www.kino.de/film/thor-4-love-and-thunder-2022/news/ihre-filme-haben-auch-nicht-immer-funktioniert-thor-star-verteidigt-mcu-nach-kritik-von-regie-legenden/,0,www.kino.de,„Ihre Filme haben auch nicht immer funktioniert”: „Thor”-Star verteidigt MCU nach Kritik von Regie-Legenden,"„Thor""-Star Chris Hemsworth hat in einem Interview ausführlich auf die Marvel-Kritik von Martin Scorsese und Co. geantwortet...",https://crops.giga.de/b4/36/0a/c003983bf07e5cd3972d8b853c_YyAzNDU4eDE5NDYrMjUrNTYCcmUgMTkyMCAxMDgwA2I2YzMzMDUzMmIz.jpg,2024-05-14T09:00:04Z,,"„Thor“-Star Chris Hemsworth hat in einem Interview ausführlich auf die Marvel-Kritik von Martin Scorsese und Co. geantwortet.
Als das Marvel Cinematic Universe(MCU) noch am Höhepunkt seiner Populari… [+2990 chars]",,de,'Martin Scorsese'
https://www.telepolis.de/features/Verheerende-Umfrage-Joe-Biden-ist-Donald-Trumps-bester-Wahlhelfer-9716982.html,https://www.telepolis.de/features/Verheerende-Umfrage-Joe-Biden-ist-Donald-Trumps-bester-Wahlhelfer-9716982.html,0,www.telepolis.de,Verheerende Umfrage: Joe Biden ist Donald Trumps bester Wahlhelfer,"Trump in vielen Staaten vorne. Trump sieht ""Gestapo-Regierung"", ""Faschisten"" und ""Dschihadisten"". Die Demokraten diskutieren schon einen Exit-Plan.",https://heise.cloudimg.io/bound/1200x1200/q85.png-lossy-85.webp-lossy-85.foil1/_www-heise-de_/imgs/18/4/5/8/9/4/4/2/shutterstock_2424736065-80a38bcc618dca48.jpeg,2024-05-14T10:00:00Z,,"Nicht gerade auf Siegerkurs: Joe Biden. Bild: Andrew Leyden, Shutterstock.com
Trump in vielen Staaten vorne. Trump sieht ""Gestapo-Regierung"", ""Faschisten"" und ""Dschihadisten"". Die Demokraten diskuti… [+5979 chars]",,de,'Joe Biden'
https://www.brigitte.de/aktuell/neues-meisterwerk-von-francis-ford-coppola---die-ersten-bewegten-bilder-zu--megalopolis--sind-da-13814500.html,https://www.brigitte.de/aktuell/neues-meisterwerk-von-francis-ford-coppola---die-ersten-bewegten-bilder-zu--megalopolis--sind-da-13814500.html,0,www.brigitte.de,"Neues Meisterwerk von Francis Ford Coppola?: Die ersten bewegten Bilder zu ""Megalopolis"" sind da","Regie-Altmeister Francis Ford Coppola hat die ersten bewegten Bilder zu seinem mit Spannung erwarteten Cannes-Beitrag ""Megalopolis"" gezeigt.",https://image.brigitte.de/13814502/t/4j/v1/w1440/r1.7778/-/14--die-ersten-bewegten-bilder-zu--megalopolis--sind-da---1-1---spoton-article-1066783.jpg,2024-05-14T10:22:00Z,,"Regie-Altmeister Francis Ford Coppola hat die ersten bewegten Bilder zu seinem mit Spannung erwarteten Cannes-Beitrag ""Megalopolis"" gezeigt.
Regie-Legende Francis Ford Coppola (85) stellt am 16. Mai… [+2831 chars]",,de,'Francis Ford Coppola'
https://www.stern.de/kultur/neues-meisterwerk-von-francis-ford-coppola---erster-trailer-zu--megalopolis--erschienen-34709628.html,https://www.stern.de/kultur/neues-meisterwerk-von-francis-ford-coppola---erster-trailer-zu--megalopolis--erschienen-34709628.html,0,www.stern.de,"Neues Meisterwerk von Francis Ford Coppola?: Erster Trailer zu ""Megalopolis"" erschienen","Regie-Altmeister Francis Ford Coppola hat die ersten bewegten Bilder zu seinem mit Spannung erwarteten Cannes-Beitrag ""Megalopolis"" gezeigt.",https://image.stern.de/34709632/t/Ya/v1/w1440/r1.7778/-/14--erster-trailer-zu--megalopolis--erschienen---16-9---spoton-article-1066783.jpg,2024-05-14T10:25:00Z,,"Regie-Altmeister Francis Ford Coppola hat die ersten bewegten Bilder zu seinem mit Spannung erwarteten Cannes-Beitrag ""Megalopolis"" gezeigt.
Regie-Legende Francis Ford Coppola (85) stellt am 16. Mai… [+2828 chars]",,de,'Francis Ford Coppola'
https://www.morgenpost.de/politik/article242332316/Wie-Donald-Trump-den-Maulkorb-des-Richters-umgeht.html,https://www.morgenpost.de/politik/article242332316/Wie-Donald-Trump-den-Maulkorb-des-Richters-umgeht.html,0,www.morgenpost.de,Wie Donald Trump den „Maulkorb” des Richters umgeht,Loyale Republikaner erledigen für Ex-Präsidenten die Denunzierung von Michael Cohen & Co. Trump konzentriert sich auf Richter Merchan.,https://img.sparknews.funkemedien.de/242332312/242332312_1715683986_v16_9_1600.jpeg,2024-05-14T10:46:39Z,,"Washington/New York. Loyale Republikaner erledigen für Ex-Präsidenten die Denunzierung von Michael Cohen &amp; Co. Trump konzentriert sich auf Richter Merchan.
Wenn ihn eines fuchst im Schweigegeld-… [+3772 chars]",,de,'Michael Cohen'
https://www.n-tv.de/wirtschaft/ZEW-Index-steigt-auf-Niveau-vor-Ukraine-Krieg-article24940312.html,https://www.n-tv.de/wirtschaft/ZEW-Index-steigt-auf-Niveau-vor-Ukraine-Krieg-article24940312.html,0,www.n-tv.de,"""Die Zuversicht steigt"": ZEW-Index steigt auf Niveau vor Ukraine-Krieg",Finanzmarktexperten blicken immer optimistischer auf die Wirtschaft in den kommenden sechs Monaten. Der entsprechende Index des ZEW legt das zehnte Mal in Folge zu. Die Zuversicht speist sich aus immer mehr Anzeichen für eine anspringende Konjunktur.,https://bilder3.n-tv.de/img/incoming/crop24940302/9381329310-cImg_16_9-w1200/459417532.jpg,2024-05-14T11:31:59Z,,Finanzmarktexperten blicken immer optimistischer auf die Wirtschaft in den kommenden sechs Monaten. Der entsprechende Index des ZEW legt das zehnte Mal in Folge zu. Die Zuversicht speist sich aus imm… [+2717 chars],,de,'Robert Kraft'
https://www.bild.de/unterhaltung/stars-und-leute/cannes-filmfestspiele-wer-kommt-welche-stars-schon-da-sind-664316ea8dd67436519552c0,https://www.bild.de/unterhaltung/stars-und-leute/cannes-filmfestspiele-wer-kommt-welche-stars-schon-da-sind-664316ea8dd67436519552c0,0,www.bild.de,Ab heute wieder Filmfestspiele - Jane Fonda CANNES auch im Bademantel,"Jetzt beginnt das große Schaulaufen beim 77. Cannes Filmfestivals. BILD verrät, welche Stars dabei sind und wie sie sich am besten inszenieren.","https://images.bild.de/664316ea8dd67436519552c0/3bef423706b1f539add45c9224e24870,82f4c64a?w=1280",2024-05-14T12:39:01Z,,Nach diesem Schönheitsschlaf CANNES losgehen! An der Côte dAzur hat das große Schaulaufen begonnen Auftakt zu den 77. Filmfestspielen von Cannes. Über all den Trubel (noch) erhaben: Hollywood-Legende… [+4513 chars],,de,'Francis Ford Coppola'
https://www.sueddeutsche.de/sport/basketball-nba-lebron-james-bronny-1.7083821,https://www.sueddeutsche.de/sport/basketball-nba-lebron-james-bronny-1.7083821,0,www.sueddeutsche.de,Basketball in der NBA: Spielen Bronny und LeBron James bald zusammen?,"Ab sofort spielen beim Basketball-Event ""NBA-Combine"" Talente vor, um beim Draft im Juni gewählt zu werden. Der Prominenteste: Der Sohn von LeBron James - und das könnte die US-Liga in ihren Grundfesten erschüttern.",https://www.sueddeutsche.de/2024/05/09/7d47f2c7-7269-4fc9-affd-e565de7cbb72.jpeg?width=1200&height=675&fit=crop&fm=webp&q=60,2024-05-14T12:49:05Z,,"Der Senior hatte immer wieder erklärt, dass er diesen Traum habe, ""im letzten Jahr gemeinsam mit meinem Sohn in der NBA zu spielen"". Mit dem eigenen Sohn auf dem Spielfeld, das hat es in den vier gro… [+4822 chars]",,de,'LeBron James'
https://www.brigitte.de/aktuell/angelina-jolie--tochter-vivienne-unterstuetzt-sie-bei-tv-auftritt-13814858.html,https://www.brigitte.de/aktuell/angelina-jolie--tochter-vivienne-unterstuetzt-sie-bei-tv-auftritt-13814858.html,0,www.brigitte.de,Angelina Jolie: Tochter Vivienne unterstützt sie bei TV-Auftritt,Angelina Jolie kann auf die Unterstützung ihrer jüngsten Tochter zählen: Der Hollywood-Star nahm Vivienne zu einem seltenen TV-Auftritt mit.,https://image.brigitte.de/13814860/t/TM/v1/w1440/r1.7778/-/14--tochter-vivienne-unterstuetzt-sie-bei-tv-auftritt---1-1---spoton-article-1066808.jpg,2024-05-14T14:20:00Z,,"Angelina Jolie kann auf die Unterstützung ihrer jüngsten Tochter zählen: Der Hollywood-Star nahm Vivienne zu einem seltenen TV-Auftritt mit.
Angelina Jolie (48) bekommt familiäre Unterstützung bei e… [+1712 chars]",,de,'Angelina Jolie'
https://www.stern.de/lifestyle/leute/angelina-jolie--tochter-vivienne-unterstuetzt-sie-im-tv-34710534.html,https://www.stern.de/lifestyle/leute/angelina-jolie--tochter-vivienne-unterstuetzt-sie-im-tv-34710534.html,0,www.stern.de,Angelina Jolie: Tochter Vivienne unterstützt sie im TV,Angelina Jolie kann auf die Unterstützung ihrer jüngsten Tochter zählen: Der Hollywood-Star nahm Vivienne zu einem seltenen TV-Auftritt mit.,https://image.stern.de/34710538/t/4x/v1/w1440/r1.7778/-/14--tochter-vivienne-unterstuetzt-sie-im-tv---16-9---spoton-article-1066808.jpg,2024-05-14T14:26:00Z,,"Angelina Jolie kann auf die Unterstützung ihrer jüngsten Tochter zählen: Der Hollywood-Star nahm Vivienne zu einem seltenen TV-Auftritt mit.
Angelina Jolie (48) bekommt familiäre Unterstützung bei e… [+1709 chars]",,de,'Angelina Jolie'
https://www.kino.de/film/megalopolis-2023/news/nach-40-jahren-arbeit-120-millionen-dollar-teurer-sci-fi-film-kommt-auch-in-deutsche-kinos/,https://www.kino.de/film/megalopolis-2023/news/nach-40-jahren-arbeit-120-millionen-dollar-teurer-sci-fi-film-kommt-auch-in-deutsche-kinos/,0,www.kino.de,Nach 40 Jahren Arbeit: 120 Millionen Dollar teurer Sci-Fi-Film kommt auch in deutsche Kinos,"Der Film „Megalopolis"" von Francis Ford Coppola sucht in den USA weiterhin nach einem Verleih. In Deutschland ist man zum Glück einen Schritt weiter.",https://crops.giga.de/f4/b0/d4/9b44be3ed584f7b1f43b732934_YyAxNjcweDkzOSs4NCs0MAJyZSAxOTIwIDEwODADZjA5NDM1ZjEzMzM=.jpg,2024-05-14T15:17:55Z,,"Der Film „Megalopolis“ von Francis Ford Coppola sucht in den USA weiterhin nach einem Verleih. In Deutschland ist man zum Glück einen Schritt weiter.
Regie-Legende Francis Ford Coppolas neuestes Pro… [+2971 chars]",,de,'Francis Ford Coppola'
https://www.brigitte.de/aktuell/bradley-cooper--seine-tochter-begleitet-ihn-zu-premiere-seines-films-13814922.html,https://www.brigitte.de/aktuell/bradley-cooper--seine-tochter-begleitet-ihn-zu-premiere-seines-films-13814922.html,0,www.brigitte.de,Bradley Cooper: Seine Tochter begleitet ihn zu Premiere seines Films,"Bradley Cooper kam mit der süßesten Begleitung zur Premiere seines Films ""IF"": Er hatte seine siebenjährige Tochter Lea dabei.",https://image.brigitte.de/13814924/t/ec/v1/w1440/r1.7778/-/14--seine-tochter-begleitet-ihn-zu-premiere-seines-films---1-1---spoton-article-1066817.jpg,2024-05-14T15:29:00Z,,"Bradley Cooper kam mit der süßesten Begleitung zur Premiere seines Films ""IF"": Er hatte seine siebenjährige Tochter Lea dabei.
Bradley Coopers (49) Date bei der Premiere seines neuen Films ""IF"" zog … [+1534 chars]",,de,'Emily Blunt'
https://www.stern.de/lifestyle/leute/bradley-cooper--seine-tochter-begleitet-ihn-zu-filmpremiere-34710944.html,https://www.stern.de/lifestyle/leute/bradley-cooper--seine-tochter-begleitet-ihn-zu-filmpremiere-34710944.html,0,www.stern.de,Bradley Cooper: Seine Tochter begleitet ihn zu Filmpremiere,"Bradley Cooper kam mit der süßesten Begleitung zur Premiere seines Films ""IF"": Er hatte seine siebenjährige Tochter Lea dabei.",https://image.stern.de/34710948/t/FG/v1/w1440/r1.7778/-/14--seine-tochter-begleitet-ihn-zu-filmpremiere---16-9---spoton-article-1066817.jpg,2024-05-14T15:30:00Z,,"Bradley Cooper kam mit der süßesten Begleitung zur Premiere seines Films ""IF"": Er hatte seine siebenjährige Tochter Lea dabei.
Bradley Coopers (49) Date bei der Premiere seines neuen Films ""IF"" zog … [+1530 chars]",,de,'Bradley Cooper'
https://www.bild.de/sport/mehr-sport/boxen-viktor-jurk-machte-oleksandr-usyk-fit-fuer-tyson-fury-66435dc1dedd0b0a2984f88c,https://www.bild.de/sport/mehr-sport/boxen-viktor-jurk-machte-oleksandr-usyk-fit-fuer-tyson-fury-66435dc1dedd0b0a2984f88c,0,www.bild.de,Vor Mega-Kampf - Dieser Deutsche machte Usyk fit für Fury,Box-Profi Viktor Jurk war sechs Wochen Sparringspartner von Oleksandr Usyk. Was er dabei erlebte und wer für ihn der Favorit im Kampf des Jahres ist.,"https://images.bild.de/66435dc1dedd0b0a2984f88c/aa5d76f6002f8dcf79d3148d08b908d3,ce8ee5b4?w=1280",2024-05-14T15:46:14Z,,"Es ist der Box-Kampf des Jahrzehnts!
Tyson Fury (35) gegen Oleksandr Usyk (37) am Samstag in Saudi-Arabiens Hauptstadt Riad (live DAZN, Pay-Per-View 24,99 Euro).
Beim Ring of Fire geht's um ALLE Sc… [+2494 chars]",,de,'Oleksandr Usyk'
https://www.welt.de/politik/ausland/article251519680/Schweigegeld-Prozess-Cohen-belastet-Trump-vor-Gericht-schwer.html,https://www.welt.de/politik/ausland/article251519680/Schweigegeld-Prozess-Cohen-belastet-Trump-vor-Gericht-schwer.html,0,www.welt.de,„Mach es einfach“ – Cohen belastet Trump schwer,Im Schweigegeld-Prozess gegen den Ex-US-Präsidenten Donald Trump ist dieser von seinem früheren „Ausputzer“ Michel Cohen schwer belastet worden. Cohen wiederum muss sich nun dem Kreuzverhör durch Trumps Verteidigung stellen.,https://img.welt.de/img/bildergalerien/mobile251519494/1021357867-ci16x9-w1200/Former-U-S-President-Donald-Trump-appears-at-court-in-New-York.jpg,2024-05-14T16:54:14Z,,Kronzeuge Michael Cohen hat im Schweigegeld-Prozess gegen Donald Trump eine direkte Verbindung zwischen dem ehemaligen Präsidenten und Zahlungen an Pornostar Stormy Daniels hergestellt. Um seine Chan… [+4316 chars],,de,'Stormy Daniels'
https://www.welt.de/politik/ausland/article251519680/Schweigegeld-Prozess-Wollen-Sie-dass-Praesident-Trump-verurteilt-wird-Sicher-sagt-Cohen.html,https://www.welt.de/politik/ausland/article251519680/Schweigegeld-Prozess-Wollen-Sie-dass-Praesident-Trump-verurteilt-wird-Sicher-sagt-Cohen.html,0,www.welt.de,"„Wollen Sie, dass Präsident Trump verurteilt wird?“ – „Sicher“, sagt der Kronzeuge","Im Schweigegeld-Prozess gegen Donald Trump hat sein früherer „Ausputzer“ Michael Cohen ihn schwer belastet. Die Verteidigung des Ex-Präsidenten versucht, die Glaubwürdigkeit des Zeugen zu zerstören. Einige Antworten sorgen für Heiterkeit.",https://img.welt.de/img/politik/ausland/mobile251519494/6181357667-ci16x9-w1200/Former-U-S-President-Donald-Trump-appears-at-court-in-New-York.jpg,2024-05-14T16:54:14Z,,"Im Schweigegeld-Prozess gegen den ehemaligen US-Präsidenten Donald Trump versucht die Verteidigung, den Kronzeugen Michael Cohen als unglaubwürdigen und rachsüchtigen Lügner darzustellen. Das Kreuzve… [+5190 chars]",,de,'Michael Cohen'
https://www.stern.de/news/us-schauspielerin-meryl-streep-in-cannes-mit-jubel-begruesst-34711212.html,https://www.stern.de/news/us-schauspielerin-meryl-streep-in-cannes-mit-jubel-begruesst-34711212.html,0,www.stern.de,US-Schauspielerin Meryl Streep in Cannes mit Jubel begrüßt,"Mit einem ersten Schaulaufen auf dem roten Teppich hat in Cannes am Dienstagabend das Internationale Filmfestival begonnen. Die US-Schauspielerin Meryl Streep, Grande Dame von Hollywood, wurde bei ihrer Ankunft vor dem Festivalpalast mit großem Jubel begrüßt.…",https://image.stern.de/34711214/t/B3/v1/w1440/r1.7778/-/14--thierry-fr%C3%A9maux-meryl-streep-iris-knobloch---f13d2e868d87c9f6.jpg,2024-05-14T17:26:45Z,,"Mit einem ersten Schaulaufen auf dem roten Teppich hat in Cannes am Dienstagabend das Internationale Filmfestival begonnen. Die US-Schauspielerin Meryl Streep, Grande Dame von Hollywood, wurde bei ih… [+1322 chars]",,de,'Meryl Streep'
https://www.zeit.de/politik/ausland/2024-05/donald-trump-schweigegeldprozess-kommentarverbot,https://www.zeit.de/politik/ausland/2024-05/donald-trump-schweigegeldprozess-kommentarverbot,0,www.zeit.de,Früherer US-Präsident: Berufungsgericht bestätigt Kommentarverbot gegen Donald Trump,Im Schweigegeldprozess darf Donald Trump sich nicht zu bestimmten Prozessbeteiligten äußern. Mit seiner Berufung gegen diesen Beschluss ist der Ex-Präsident gescheitert.,https://img.zeit.de/politik/ausland/2024-05/donald-trump-schweigegeldprozess-kommentarverbot-bild/wide__1300x731,2024-05-14T17:45:12Z,,"Ein Berufungsgericht in New York hat bestätigt, dass Ex-US-Präsident Donald Trump keine öffentlichen Aussagen über bestimmte Personen machen darf. Das Gericht urteilte, dass Richter Juan M. Merchan ""… [+1902 chars]",,de,'Donald Trump'
https://www.faz.net/aktuell/wirtschaft/unternehmen/so-will-google-kuenstliche-intelligenz-in-seiner-suchmaschine-nutzen-19719640.html,https://www.faz.net/aktuell/wirtschaft/unternehmen/so-will-google-kuenstliche-intelligenz-in-seiner-suchmaschine-nutzen-19719640.html,0,www.faz.net,So will Google Künstliche Intelligenz in seiner Suchmaschine nutzen,Mit Künstlicher Intelligenz den Familienurlaub buchen? Google skizziert auf seiner Entwicklerkonferenz erstmals seine Pläne für sogenannte KI-Agenten – und kündigt mehr KI für seine Suchmaschine an.,https://media0.faz.net/ppmedia/aktuell/wirtschaft/2572554280/1.9719868/facebook_teaser/google-chef-sundar-pichai.jpg,2024-05-14T17:56:12Z,,"Die neue KI-Funktion basiere auf einer angepassten Version des KI-Modells Gemini und hätte bei Testpersonen zu einer höheren Nutzung und mehr Zufriedenheit mit der Suchmaschine geführt, sagte Liz Rei… [+5299 chars]",,de,'nan nan'
https://www.morgenpost.de/politik/article242337318/Ich-habe-wegen-Trump-meinen-moralischen-Kompass-verletzt.html,https://www.morgenpost.de/politik/article242337318/Ich-habe-wegen-Trump-meinen-moralischen-Kompass-verletzt.html,0,www.morgenpost.de,„Ich habe wegen Trump meinen moralischen Kompass verletzt“,"Kronzeuge Michael Cohen beschreibt, wie er mit dem Ex-Präsidenten – auf betrügerische Weise – den Fall Stormy Daniels abgewickelt hat",https://img.sparknews.funkemedien.de/242330194/242330194_1715671022_v16_9_1600.jpeg,2024-05-14T18:08:28Z,,"Washington/New York. Kronzeuge Michael Cohen beschreibt, wie er mit dem Ex-Präsidenten auf betrügerische Weise den Fall Stormy Daniels abgewickelt hat
Weltpolitik. Staatsgeschäfte. Kabinett auf Kurs… [+5618 chars]",,de,'Stormy Daniels'
https://www.diepresse.com/18465338/meryl-streep-erhaelt-ehrenpalme-bei-filmfestspielen-in-cannes,https://www.diepresse.com/18465338/meryl-streep-erhaelt-ehrenpalme-bei-filmfestspielen-in-cannes,0,www.diepresse.com,Meryl Streep erhält „Ehrenpalme“ bei Filmfestspielen in Cannes,Mit der Übergabe der „goldenen Ehrenpalme“ an die 74-jährige Schauspielerin wurden die 77. Filmfestspiele eröffnet. Die diesjährige Jury wird von der Regisseurin Greta Gerwig angeführt.,https://img.diepresse.com/public/incoming/6f6guv-FILMFESTIVAL-CANNESOPENING-CEREMONY/alternates/DPR_SOCIAL_NACHRICHTEN/FILMFESTIVAL-CANNESOPENING%20CEREMONY,2024-05-14T18:37:58Z,,"Mit der Übergabe der goldenen Ehrenpalme an die 74-jährige Schauspielerin wurden die 77. Filmfestspiele eröffnet. Die diesjährige Jury wird von der Regisseurin Greta Gerwig angeführt.
Mit der Vergab… [+2309 chars]",,de,'Meryl Streep'
https://www.n-tv.de/politik/Mike-Johnson-sorgt-fuer-denkwuerdigen-Moment-bei-Trump-Prozess-article24941525.html,https://www.n-tv.de/politik/Mike-Johnson-sorgt-fuer-denkwuerdigen-Moment-bei-Trump-Prozess-article24941525.html,0,www.n-tv.de,Attacke von Top-Republikaner: Mike Johnson sorgt für denkwürdigen Moment bei Trump-Prozess,"In Deutschland ist der Repräsentantenhaus-Vorsitzende Mike Johnson als der Mann bekannt, der lange die Ukraine-Hilfen blockiert hat. Nun sorgt er als einer der einflussreichsten Politiker der USA mit einer bemerkenswerten Aktion beim Trump-Prozess für Aufsehe…",https://bilder3.n-tv.de/img/incoming/crop24941542/2861324799-cImg_16_9-w1200/8b9c4a5218955c48e280be6ce1ce8fa4.jpg,2024-05-14T18:38:00Z,,"In Deutschland ist der Repräsentantenhaus-Vorsitzende Mike Johnson als der Mann bekannt, der lange die Ukraine-Hilfen blockiert hat. Nun sorgt er als einer der einflussreichsten Politiker der USA mit… [+2725 chars]",,de,'Mike Johnson'
https://www.tagesspiegel.de/internationales/trump-verteidiger-nimmt-kronzeuge-cohen-ins-kreuzverhor-11661959.html,https://www.tagesspiegel.de/internationales/trump-verteidiger-nimmt-kronzeuge-cohen-ins-kreuzverhor-11661959.html,0,www.tagesspiegel.de,„Sie haben mich einen weinenden Mistkerl genannt?“: Trump-Verteidiger nimmt Kronzeuge Cohen ins Kreuzverhör,Nach seiner Anhörung am Montag musste sich der ehemalige Trump-Anwalt Cohen einem Kreuzverhör stellen. Zuvor schaltete sich der Chef des US-Repräsentantenhauses auf ungewöhnliche Weise ein.,https://www.tagesspiegel.de/images/former-us-president-donald-trump-appears-at-court-in-new-york3/alternates/BASE_16_9_W1400/former-us-president-donald-trump-appears-at-court-in-new-york.jpeg,2024-05-14T19:36:49Z,,"Im Schweigegeld-Prozess gegen den ehemaligen US-Präsidenten Donald Trump versucht die Verteidigung, den Kronzeugen Michael Cohen als unglaubwürdigen und rachsüchtigen Lügner darzustellen. Das Kreuzve… [+6906 chars]",,de,'Vivek Ramaswamy'
https://www.tagesschau.de/ausland/europa/cannes-filmfestspiele-104.html,https://www.tagesschau.de/ausland/europa/cannes-filmfestspiele-104.html,0,www.tagesschau.de,Filmfestival in Cannes eröffnet: Ehrenpalme für Meryl Streep,Die US-Schauspielerin Meryl Streep ist zum Auftakt der Filmfestspiele von Cannes mit einer Ehrenpalme für ihr Lebenswerk geehrt worden. Überschattet wird das Festival von einer neu entfachten Debatte um sexuelle Übergriffe in der Filmbranche.,https://images.tagesschau.de/image/75c57170-45ab-4cef-92e1-d66dc42695f0/AAABj3iFWRs/AAABjwnlFvA/16x9-1280/meryl-streep-100.jpg,2024-05-14T19:40:06Z,,"Stand: 14.05.2024 21:40 Uhr
Die US-Schauspielerin Meryl Streep ist zum Auftakt der Filmfestspiele von Cannes mit einer Ehrenpalme für ihr Lebenswerk geehrt worden. Überschattet wird die Gala von ein… [+2563 chars]",,de,'Meryl Streep'
https://www.stern.de/kultur/lily-gladstone--cannes-jury-posiert-im-glitzer-partnerlook-34711472.html,https://www.stern.de/kultur/lily-gladstone--cannes-jury-posiert-im-glitzer-partnerlook-34711472.html,0,www.stern.de,Lily Gladstone: Cannes-Jury posiert im Glitzer-Partnerlook,Die 77. Filmfestspiele in Cannes sind in vollem Gange. Auch die Jury der diesjährigen Preisverleihung posierte auf dem roten Teppich.,https://image.stern.de/34711476/t/ng/v1/w1440/r1.7778/-/14--cannes-jury-posiert-im-glitzer-partnerlook---16-9---spoton-article-1066833.jpg,2024-05-14T21:11:00Z,,"Die 77. Filmfestspiele in Cannes sind in vollem Gange. Auch die Jury der diesjährigen Preisverleihung posierte auf dem roten Teppich.
Greta Gerwig (40) ist bei den 77. Filmfestspielen in Cannes die … [+1365 chars]",,de,'Lily Gladstone'
https://www.brigitte.de/aktuell/lily-gladstone--cannes-jury-im-pailletten-partnerlook-auf-dem-roten-teppich-13814984.html,https://www.brigitte.de/aktuell/lily-gladstone--cannes-jury-im-pailletten-partnerlook-auf-dem-roten-teppich-13814984.html,0,www.brigitte.de,Lily Gladstone: Cannes-Jury im Pailletten-Partnerlook auf dem roten Teppich,Die 77. Filmfestspiele in Cannes sind in vollem Gange. Auch die Jury der diesjährigen Preisverleihung posierte auf dem roten Teppich.,https://image.brigitte.de/13814986/t/cH/v1/w1440/r1.7778/-/14--cannes-jury-im-pailletten-partnerlook-auf-dem-roten-teppich---1-1---spoton-article-1066833.jpg,2024-05-14T21:13:00Z,,"Die 77. Filmfestspiele in Cannes sind in vollem Gange. Auch die Jury der diesjährigen Preisverleihung posierte auf dem roten Teppich.
Greta Gerwig (40) ist bei den 77. Filmfestspielen in Cannes die … [+1368 chars]",,de,'Lily Gladstone'
