index,url,valid,domain,title,description,image,published,archive,content,quote,language,keyword
https://www.n-tv.de/politik/Selenskyj-warnt-vor-Putins-Angriff-auf-Polen-und-Litauen-article25557893.html,https://www.n-tv.de/politik/Selenskyj-warnt-vor-Putins-Angriff-auf-Polen-und-Litauen-article25557893.html,0,www.n-tv.de,Von belarussischem Territorium: Selenskyj warnt vor Putins Angriff auf Polen und Litauen,"Moskau soll seine Streitkräfte laut Geheimdienstinformationen Kiews derzeit massiv aufstocken, um einen Angriff auf Polen und Litauen vorzubereiten. Der ukrainische Präsident Selenskyj nennt eine Zahl von 150.000 Mann. Einen Friedenswillen spricht er Putin ab.",https://www.n-tv.de/img/incoming/crop25557850/383132334-cImg_16_9-w1200/506455769.jpg,2025-02-12T16:49:10Z,,"Moskau soll seine Streitkräfte laut Geheimdienstinformationen Kiews derzeit massiv aufstocken, um einen Angriff auf Polen und Litauen vorzubereiten. Der ukrainische Präsident Selenskyj nennt eine Zah… [+2539 chars]",,de,'Selenskyj'
https://www.n-tv.de/politik/14-51-Experte-Europa-steht-bei-Ukraine-Gespraechen-am-Spielfeldrand--article23143824.html,https://www.n-tv.de/politik/14-51-Experte-Europa-steht-bei-Ukraine-Gespraechen-am-Spielfeldrand--article23143824.html,0,www.n-tv.de,Ukraine-Krieg im Liveticker: +++ 14:26 Selenskyj: Akzeptieren keine Vereinbarung ohne Beteiligung der Ukraine +++,Lesen Sie alle aktuellen Entwicklungen und Nachrichten über den russischen Angriffskrieg auf die Ukraine im Liveticker von ntv.de.,https://www.n-tv.de/img/incoming/crop25117070/4231326595-cImg_16_9-w1200/Ukraine-Liveticker.jpg,2025-02-12T23:10:00Z,,Das Telefonat zwischen Trump und Putin hat auch in der Ukraine gemischte Reaktionen ausgelöst. Beobachter sehen die Ukraine nach diesem Gespräch schon vor Vereinbarungen zu einer möglichen Waffenruhe… [+22673 chars],,de,'Dmitri Medwedew'
https://www.n-tv.de/politik/15-32-Selenskyj-verhaengt-Sanktionen-gegen-Ex-Praesident-Poroschenko--article23143824.html,https://www.n-tv.de/politik/15-32-Selenskyj-verhaengt-Sanktionen-gegen-Ex-Praesident-Poroschenko--article23143824.html,0,www.n-tv.de,Ukraine-Krieg im Liveticker: +++ 15:32 Selenskyj verhängt Sanktionen gegen Ex-Präsident Poroschenko +++,Lesen Sie alle aktuellen Entwicklungen und Nachrichten über den russischen Angriffskrieg auf die Ukraine im Liveticker von ntv.de.,https://www.n-tv.de/img/incoming/crop25117070/4231326595-cImg_16_9-w1200/Ukraine-Liveticker.jpg,2025-02-12T23:10:00Z,,Der ukrainische Präsident Wolodymyr Selenskyj verhängt Sanktionen gegen seinen Vorgänger und politischen Widersacher Petro Poroschenko. Dem Ex-Präsidenten und Abgeordneten des Parlaments werden auf u… [+23676 chars],,de,'Dmitri Medwedew'
https://www.n-tv.de/politik/09-23-Pistorius-Trumps-oeffentliche-Zugestaendnisse-an-Putin-bedauerlich--article23143824.html,https://www.n-tv.de/politik/09-23-Pistorius-Trumps-oeffentliche-Zugestaendnisse-an-Putin-bedauerlich--article23143824.html,0,www.n-tv.de,Ukraine-Krieg im Liveticker: +++ 09:07 Medwedew: Putin-Gespräch mit Trump zeigt Unbesiegbarkeit Russlands +++,Lesen Sie alle aktuellen Entwicklungen und Nachrichten über den russischen Angriffskrieg auf die Ukraine im Liveticker von ntv.de.,https://www.n-tv.de/img/incoming/crop25117070/4231326595-cImg_16_9-w1200/Ukraine-Liveticker.jpg,2025-02-12T23:10:00Z,,"Bundesverteidigungsminister Boris Pistorius nennt Trumps öffentliche Zugeständnisse an Putin ""bedauerlich"" und mahnt, Europa müsse an Verhandlungen über ein Ende des russischen Angriffskriegs gegen d… [+13838 chars]",,de,'Dmitri Medwedew'
https://www.n-tv.de/politik/13-26-Seltene-Erden-gegen-US-Hilfen-Selenskyj-erhaelt-Abkommen-unterschreibt-aber-noch-nicht--article23143824.html,https://www.n-tv.de/politik/13-26-Seltene-Erden-gegen-US-Hilfen-Selenskyj-erhaelt-Abkommen-unterschreibt-aber-noch-nicht--article23143824.html,0,www.n-tv.de,Ukraine-Krieg im Liveticker: +++ 13:26 Seltene Erden gegen US-Hilfen: Selenskyj erhält Abkommen - unterschreibt aber noch nicht +++,Lesen Sie alle aktuellen Entwicklungen und Nachrichten über den russischen Angriffskrieg auf die Ukraine im Liveticker von ntv.de.,https://www.n-tv.de/img/incoming/crop25117070/4231326595-cImg_16_9-w1200/Ukraine-Liveticker.jpg,2025-02-12T23:10:00Z,,"Der ukrainische Präsident Selenskyj hat das von US-Finanzminister Scott Bessent überreichte Abkommen über den Zugang zu Seltenen Erden bislang nicht unterzeichnet, berichten ukrainische Medien unter … [+20739 chars]",,de,'Selenskyj'
https://www.n-tv.de/politik/09-23-Pistorius-bedauert-Trumps-oeffentliche-Zugestaendnisse-an-Putin--article23143824.html,https://www.n-tv.de/politik/09-23-Pistorius-bedauert-Trumps-oeffentliche-Zugestaendnisse-an-Putin--article23143824.html,0,www.n-tv.de,Ukraine-Krieg im Liveticker: +++ 09:23 Pistorius bedauert Trumps öffentliche Zugeständnisse an Putin +++,Lesen Sie alle aktuellen Entwicklungen und Nachrichten über den russischen Angriffskrieg auf die Ukraine im Liveticker von ntv.de.,https://www.n-tv.de/img/incoming/crop25117070/4231326595-cImg_16_9-w1200/Ukraine-Liveticker.jpg,2025-02-12T23:10:00Z,,"Bundesverteidigungsminister Boris Pistorius nennt Trumps öffentliche Zugeständnisse an Putin ""bedauerlich"". ""Aus meiner Sicht wäre es besser gewesen, über eine mögliche Nato-Mitgliedschaft der Ukrain… [+14034 chars]",,de,'Putin'
https://www.welt.de/politik/ausland/article255419536/Krieg-in-der-Ukraine-Putin-wird-diesen-Krieg-gewonnen-haben-sagt-ein-Militaerexperte.html,https://www.welt.de/politik/ausland/article255419536/Krieg-in-der-Ukraine-Putin-wird-diesen-Krieg-gewonnen-haben-sagt-ein-Militaerexperte.html,0,www.welt.de,"„Putin wird diesen Krieg gewonnen haben“, sagt ein Militärexperte nach Trumps Vorstoß",Das Telefonat zwischen US-Präsident Trump und Kremlchef Putin hat Europa alarmiert. Außenministerin Baerbock pocht auf eine Beteiligung der Europäer bei Ukraine-Verhandlungen. Militärexperte Carlo Masala sieht ein „apokalyptisches Szenario“. Die Reaktionen im…,https://img.welt.de/img/politik/ausland/mobile255419692/4597937807-ci16x9-w1200/Militaerexperte-Carlo-Masala.jpg,2025-02-13T08:00:29Z,http://archive.md/20250213081257/https://www.welt.de/politik/ausland/article255419536/Krieg-in-der-Ukraine-Putin-wird-diesen-Krieg-gewonnen-haben-sagt-ein-Militaerexperte.html,Das Telefonat zwischen US-Präsident Trump und Kremlchef Putin hat Europa alarmiert. Außenministerin Baerbock pocht auf eine Beteiligung der Europäer bei Ukraine-Verhandlungen. Militärexperte Carlo Ma… [+4013 chars],,de,'Dmitri Medwedew'
https://www.stern.de/kultur/-gntm--muss-gegen-stefan-raab-ran--fuer-heidi-klum-ist-das--dumm-gelaufen--35462760.html,https://www.stern.de/kultur/-gntm--muss-gegen-stefan-raab-ran--fuer-heidi-klum-ist-das--dumm-gelaufen--35462760.html,0,www.stern.de,"""GNTM"" muss gegen Stefan Raab ran: Für Heidi Klum ist das ""dumm gelaufen""","ProSieben schickt statt ""TV total"" die Castingshow ""Germany's next Topmodel"" ins Quoten-Rennen mit RTL. So reagiert Heidi Klum.",https://image.stern.de/35462764/t/S4/v1/w1440/r1.7778/-/13--fuer-heidi-klum-ist-das--dumm-gelaufen----16-9---spoton-article-1086588.jpg,2025-02-13T08:06:00Z,,"Kopiere den aktuellen Link
Zur Merkliste hinzufügen
ProSieben schickt statt ""TV total"" die Castingshow ""Germany's next Topmodel"" ins Quoten-Rennen mit RTL. So reagiert Heidi Klum.
Mit dieser Progr… [+2126 chars]",,de,'Heidi Klum'
https://www.brigitte.de/aktuell/-gntm--muss-gegen-stefan-raab-ran--so-reagiert-heidi-klum-auf-den-neuen-sendeplatz-13946190.html,https://www.brigitte.de/aktuell/-gntm--muss-gegen-stefan-raab-ran--so-reagiert-heidi-klum-auf-den-neuen-sendeplatz-13946190.html,0,www.brigitte.de,"""GNTM"" muss gegen Stefan Raab ran: So reagiert Heidi Klum auf den neuen Sendeplatz","ProSieben schickt statt ""TV total"" die Castingshow ""Germany's next Topmodel"" ins Quoten-Rennen mit RTL. So reagiert Heidi Klum.",https://image.brigitte.de/13946192/t/1I/v1/w1440/r1.7778/-/13--so-reagiert-heidi-klum-auf-den-neuen-sendeplatz---1-1---spoton-article-1086588.jpg,2025-02-13T08:07:00Z,,"ProSieben schickt statt ""TV total"" die Castingshow ""Germany's next Topmodel"" ins Quoten-Rennen mit RTL. So reagiert Heidi Klum.
Mit dieser Programmänderung sorgt ProSieben für mächtig Wirbel: Am Mit… [+2164 chars]",,de,'Heidi Klum'
https://www.focus.de/kultur/kino_tv/aktuelles-fernsehprogramm/dumm-gelaufen-gntm-gegen-stefan-raab-heidi-klum-reagiert-auf-programmaenderung_id_260717842.html,https://www.focus.de/kultur/kino_tv/aktuelles-fernsehprogramm/dumm-gelaufen-gntm-gegen-stefan-raab-heidi-klum-reagiert-auf-programmaenderung_id_260717842.html,0,www.focus.de,"""Dumm gelaufen"" - ""GNTM"" gegen Stefan Raab: Heidi Klum reagiert auf Programmänderung","Überraschende Programmänderung bei ProSieben: Die Männer-Episoden von ""Germany's next Topmodel"" werden auf einen neuen Sendeplatz verlegt. Somit entgeht der Sender dem direkten Duell zwischen Stefan Raabs RTL-Sendung und ""TV total"". So reagiert die Model-Mama.",https://p6.focus.de/img/kultur/kino_tv/aktuelles-fernsehprogramm/id_260717841/gntm-gegen-stefan-raab-heidi-klum-reagiert-auf-programmaenderung.jpg?im=Crop%3D%280%2C125%2C1001%2C500%29%3BResize%3D%281200%2C627%29&impolicy=perceptual&quality=mediumHigh&hash=89c40d4fff9820076b72ccfd551a48f536c7668711ee31de21b904b936b61359,2025-02-13T08:20:03Z,,"Strategische Programmverschiebung sorgt bei ProSieben: Der Sender verkündete am Mittwoch eine überraschende Änderung für ""Germany's next Topmodel"". Die Männer-Episoden werden nicht wie ursprünglich g… [+2009 chars]",,de,'Heidi Klum'
https://netzpolitik.org/2025/bruesseler-arbeitsprogramm-eu-kommission-will-ausfegen/,https://netzpolitik.org/2025/bruesseler-arbeitsprogramm-eu-kommission-will-ausfegen/,0,netzpolitik.org,Brüsseler Arbeitsprogramm: EU-Kommission will ausfegen,"In einem Arbeitsprogramm gibt EU-Kommissionspräsidentin Ursula von der Leyen die Richtung vor, die sie bei der Netz- und Digitalpolitik einschlagen will. – Alle Rechte vorbehalten IMAGO / ABACAPRESS
Der EU-Kommission unter Ursula von der Leyen liegt die Wett…",https://cdn.netzpolitik.org/wp-upload/2025/02/imago801326625-e1739384909227-1200x675.jpg,2025-02-13T09:16:18Z,,In einem gestern vorgestellten Arbeitsprogramm legt die EU-Kommission ihre Schwerpunkte für das laufende Jahr fest. Zugleich gab die im Vorjahr in ihrem Amt bestätigte Kommissionspräsidentin Ursula v… [+5114 chars],,de,'Thierry Breton'
https://www.kino.de/artikel/germany-s-next-topmodel-2025-alle-infos-zum-jubilaeum--xp9mhq57fp,https://www.kino.de/artikel/germany-s-next-topmodel-2025-alle-infos-zum-jubilaeum--xp9mhq57fp,0,www.kino.de,„Germany's Next Topmodel“ 2025: Alle Infos zum Jubiläum,20 Jahre „Germany's Next Topmodel“: 2025 feiert die Show ihr Jubiläum. Natürlich mit Moderatorin Heidi Klum und besonderen Gästen.,https://static.kino.de/e0/18/71/dcb053e9266f630ad7af841370_A2U4ZDBlNjZhYTQ3_mediamedia1d0b8a21-d5ca-4d83-a39c-9c062803079116x9_1024.jpg#fp=77e34a51ffff,2025-02-13T10:07:02Z,,"20 Jahre Germany's Next Topmodel: 2025 feiert die Show ihr Jubiläum. Natürlich mit Moderatorin Heidi Klum und besonderen Gästen.
2006 lief die erste Staffel von Germany's Next Topmodel und seitdem h… [+3351 chars]",,de,'Heidi Klum'
https://www.bild.de/unterhaltung/tv-fernsehformate/gntm-2025-alle-kandidaten-sie-alle-wollen-model-werden-67a9b3182d9fe55e42d84b82,https://www.bild.de/unterhaltung/tv-fernsehformate/gntm-2025-alle-kandidaten-sie-alle-wollen-model-werden-67a9b3182d9fe55e42d84b82,0,www.bild.de,Die Anwärter der neuen Staffel GNTM 2025 - Aus diesen Kandidaten muss Heidi Klum auswählen,Zum 20-jährigen Jubiläum von „Germany's Next Topmodel“ kämpfen wieder Männer und Frauen um den Titel! Lesen Sie hier alle Kandidaten im Überblick!,"https://images.bild.de/67a9b3182d9fe55e42d84b82/575bacb46bc5a8eefe7534ae458d88e1,466f0654?w=1280",2025-02-13T10:14:29Z,,"Die erste Folge von GNTM startet am Donnerstag, den 13. Februar. Knapp 100 männliche und weibliche Models werden alles geben, um sich einen Platz in der Show zu erkämpfen.
In der ersten Folge wird H… [+7397 chars]",,de,'Heidi Klum'
https://www.stern.de/kultur/tv/germanys-next-topmodel/gntm-sendetermin-verschoben--das-sagt-heidi-klum-zum-duell-mit-raab-35462760.html,https://www.stern.de/kultur/tv/germanys-next-topmodel/gntm-sendetermin-verschoben--das-sagt-heidi-klum-zum-duell-mit-raab-35462760.html,0,www.stern.de,"TV-Duell gegen Stefan Raab: ""Dumm gelaufen"": Heidi Klum äußert sich zum neuen GNTM-Sendetermin",Kurz vorm Start der Jubiläumsstaffel von GNTM verkündet ProSieben überraschend einen neuen Ausstrahlungstermin. Das denkt Heidi Klum über die Änderung.,https://image.stern.de/35462764/t/S4/v1/w1440/r1.7778/-/13--fuer-heidi-klum-ist-das--dumm-gelaufen----16-9---spoton-article-1086588.jpg,2025-02-13T11:32:00Z,,"Kopiere den aktuellen Link
Zur Merkliste hinzufügen
Kurz vorm Start der Jubiläumsstaffel von GNTM verkündet ProSieben überraschend einen neuen Ausstrahlungstermin. Das denkt Heidi Klum über die Änd… [+2140 chars]",,de,'Heidi Klum'
https://www.n-tv.de/politik/Medwedew-haelt-Europas-Zeit-fuer-vorbei-article25559939.html,https://www.n-tv.de/politik/Medwedew-haelt-Europas-Zeit-fuer-vorbei-article25559939.html,0,www.n-tv.de,"Russland angeblich ""unbesiegbar"": Medwedew hält ""Europas Zeit"" für vorbei","Europa ist bei den angekündigten Gesprächen zwischen Russland und den USA bislang außen vor. Dmitri Medwedew nutzt die Gunst der Stunde, um gegen seine Feinde zu schießen. Dass Donald Trump mit Wladimir Putin sprechen wolle, sei ein Beweis für Russlands ""Unbe…",https://www.n-tv.de/img/incoming/crop25559964/0141324492-cImg_16_9-w1200/505711709.jpg,2025-02-13T11:36:57Z,,"Europa ist bei den angekündigten Gesprächen zwischen Russland und den USA bislang außen vor. Dmitri Medwedew nutzt die Gunst der Stunde, um gegen seine Feinde zu schießen. Dass Donald Trump mit Wladi… [+2429 chars]",,de,'Donald Trump'
https://www.bild.de/unterhaltung/tv-fernsehformate/gntm-2025-das-sind-die-angepassten-sendetermine-der-20-staffel-677bacb00195b908c189b724,https://www.bild.de/unterhaltung/tv-fernsehformate/gntm-2025-das-sind-die-angepassten-sendetermine-der-20-staffel-677bacb00195b908c189b724,0,www.bild.de,Wann läuft die Show? - Angepasste Sendetermine bei GNTM 2025,Die 20. Staffel von „Germany’s Next Topmodel“ startet im Februar 2025. Heidi Klum sucht gleich zweimal die Woche nach Models. Alle Infos lesen Sie hier.,"https://images.bild.de/677bacb00195b908c189b724/c94134cd60837e538a5b913fb946fa92,339790b9?w=1280",2025-02-13T13:31:22Z,,"Heidi Klum geht wieder auf Modeljagd.
Die neue Staffel von Germanys Next Topmodel steht in den Startlöchern. Zum 20. Jubiläum der Sendung erwartet die Zuschauer eine ganz besondere Überraschung: Mod… [+2651 chars]",,de,'Heidi Klum'
https://www.welt.de/politik/ausland/article255419536/Krieg-in-der-Ukraine-Demuetigung-Europas-mit-Ansage.html,https://www.welt.de/politik/ausland/article255419536/Krieg-in-der-Ukraine-Demuetigung-Europas-mit-Ansage.html,0,www.welt.de,„Demütigung mit Ansage“ – Politiker in Europa über Trump-Telefonat empört,"Das Telefonat zwischen US-Präsident Trump und Kremlchef Putin hat Europa alarmiert. Spitzenpolitiker aus Deutschland und der EU fürchten, bei Gesprächen übergangen zu werden. Militärexperte Carlo Masala hält Wladimir Putin bereits für den Sieger des Kriegs. D…",https://img.welt.de/img/politik/ausland/mobile255427406/4947938297-ci16x9-w1200/FDP-Bundesparteitag.jpg,2025-02-13T15:07:00Z,http://archive.md/20250213152015/https://www.welt.de/politik/ausland/article255419536/Krieg-in-der-Ukraine-Demuetigung-Europas-mit-Ansage.html,"Das Telefonat zwischen US-Präsident Trump und Kremlchef Putin hat Europa alarmiert. Spitzenpolitiker aus Deutschland und der EU fürchten, bei Gesprächen übergangen zu werden. Militärexperte Carlo Mas… [+7192 chars]",,de,'Putin'
https://www.bild.de/unterhaltung/stars-und-leute/leni-klum-im-steckbrief-so-tickt-das-model-mit-superstar-genen-62fcdfbc60a3e73b21ea5549,https://www.bild.de/unterhaltung/stars-und-leute/leni-klum-im-steckbrief-so-tickt-das-model-mit-superstar-genen-62fcdfbc60a3e73b21ea5549,0,www.bild.de,Leni Klum im Steckbrief - So tickt das Model mit Superstar-Genen,Leni Klum tritt in die großen Fußstapfen ihrer Model-Mama Heidi Klum. Erfahren Sie hier alles über den erfolgreichen Aufstieg der Model-Newcomerin.,"https://images.bild.de/62fcdfbc60a3e73b21ea5549/f3b605bb1d1b2409123af7fcf950d6b5,3501dcd?w=1280",2025-02-13T16:05:30Z,,"Als Tochter von Supermodel Heidi tritt Leni Klum in die großen Fußstapfen ihrer Mutter. 
Ihr Debüt 2021 auf dem Vogue-Cover war erst der Anfang jetzt erobert sie die Mode-Welt im Sturm und ein Ende … [+4392 chars]",,de,'Leni Klum'
https://www.bild.de/unterhaltung/stars-und-leute/heidi-klum-im-steckbrief-so-schaffte-sie-es-auf-die-grossen-laufstege-61d867c1cced612cc6cd50bd,https://www.bild.de/unterhaltung/stars-und-leute/heidi-klum-im-steckbrief-so-schaffte-sie-es-auf-die-grossen-laufstege-61d867c1cced612cc6cd50bd,0,www.bild.de,Supermodel Heidi Klum im Steckbrief - So schaffte sie es von Bergisch-Gladbach nach LA,"Die Stimme klingt immer ein wenig piepsig, aber das Strahlen ist unverwechselbar. Lesen Sie hier alles rund um Supermodel und Moderatorin Heidi Klum.","https://images.bild.de/61d867c1cced612cc6cd50bd/f372ef12f67eb625086a898a6ade8444,1c211a07?w=1280",2025-02-13T16:53:21Z,,"Heidi Klum schaffte den unfassbaren Sprung von einer ganz normalen Abiturientin aus Bergisch Gladbach zu einem DER Supermodels weltweit. 
Nach wie vor begeistert sie die Modeszene. Und auch als Juro… [+9888 chars]",,de,'Heidi Klum'
https://www.morgenpost.de/panorama/article408181720/gntm-warum-ich-heidi-klum-fuer-eine-feministin-halte.html,https://www.morgenpost.de/panorama/article408181720/gntm-warum-ich-heidi-klum-fuer-eine-feministin-halte.html,0,www.morgenpost.de,GNTM: Warum ich Heidi Klum für eine Feministin halte,"„Germany's Next Topmodel“ wird 20 Jahre alt. Zeit, mit dem Bashing aufzuhören. Denn die Sendung ist feministischer als viele denken.",https://img.sparknews.funkemedien.de/408053456/408053456_1739466890_v16_9_1600.jpeg,2025-02-13T17:15:00Z,,"Berlin. Germany's Next Topmodel wird 20 Jahre alt. Zeit, mit dem Bashing aufzuhören. Denn die Sendung ist feministischer als viele denken.
Es gehört fast schon zum guten Ton, auf Heidi Klum zu schim… [+2944 chars]",,de,'Heidi Klum'
https://www.focus.de/politik/ausland/newsticker-zur-msc-groesster-feind-ist-putins-russland-baerbock-widerspricht-vance-in-afd-aussage_id_260720478.html,https://www.focus.de/politik/ausland/newsticker-zur-msc-groesster-feind-ist-putins-russland-baerbock-widerspricht-vance-in-afd-aussage_id_260720478.html,0,www.focus.de,+++ Sicherheitskonferenz im Ticker +++ - „Größter Feind ist Putins Russland“ - Baerbock widerspricht Vance in AfD-Aussage,Der neue US-Vizepräsident macht den europäischen Verbündeten auf der Münchner Sicherheitskonferenz schwere Vorwürfe. Verteidigungsminister Pistorius ändert seine Rede - und geht zum Gegenangriff über. Alle News zur Münchner Sicherheitskonferenz im Ticker.,https://p6.focus.de/img/politik/id_260724801/baerbock.jpg?im=Crop%3D%280%2C289%2C3463%2C1731%29%3BResize%3D%281200%2C627%29&impolicy=perceptual&quality=mediumHigh&hash=532ad7b8da19dd6761ef84036d74d201319801b087d723a68ba0a8f99f66c7c8,2025-02-13T21:57:02Z,,"Während die Konferenz heute mit Themen wie der europäischen Sicherheitsarchitektur und der Wettbewerbsfähigkeit Europas endet, sorgt vor allem die umstrittene Rede von US-Vizepräsident J.D. Vance wei… [+7906 chars]",,de,'Lindsey Graham'
https://www.brigitte.de/aktuell/-germany-s-next-topmodel---fuer-heidi-klums--meeedchen--geht-es-in-die-neue-staffel-13946712.html,https://www.brigitte.de/aktuell/-germany-s-next-topmodel---fuer-heidi-klums--meeedchen--geht-es-in-die-neue-staffel-13946712.html,0,www.brigitte.de,"""Germany's next Topmodel"": Für Heidi Klums ""Meeedchen"" geht es in die neue Staffel","""Germany's next Topmodel"" startet in die 20. Staffel! Zum Auftakt des Jubiläums begrüßt Heidi Klum ihre Liebsten.",https://image.brigitte.de/13946714/t/_k/v1/w1440/r1.7778/-/14--fuer-heidi-klums--meeedchen--geht-es-in-die-neue-staffel---1-1---spoton-article-1086667.jpg,2025-02-13T23:25:00Z,,"""Germany's next Topmodel"" startet in die 20. Staffel! Zum Auftakt des Jubiläums begrüßt Heidi Klum ihre Liebsten.
Was wäre ""Germany's next Topmodel"" ohne Heidi Klum (51)? Das Model ist schließlich s… [+4416 chars]",,de,'Heidi Klum'
https://www.welt.de/iconist/trends/article255424460/TV-Kritik-Staffelbeginn-GNTM-Es-zaehlt-nur-der-Charakter.html,https://www.welt.de/iconist/trends/article255424460/TV-Kritik-Staffelbeginn-GNTM-Es-zaehlt-nur-der-Charakter.html,0,www.welt.de,Staffelbeginn GNTM – „Es zählt nur der Charakter!“,"Zum Auftakt der 20. Staffel von „Germanys Next Topmodel“ schwelgt Heidi Klum kurz in Nostalgie, dann beginnt das traditionelle große Aussieben der „Girls“, was diesmal besonders zäh wirkt. Die „Boys“ kommen später dran. Tochter Leni Klum, die erstaunlich schl…",https://img.welt.de/img/iconist/trends/mobile255429956/5537935037-ci16x9-w1200/Germany-s-Next-Topmodel-by-Heidi-Klum.jpg,2025-02-14T03:22:47Z,,"Zum Auftakt der 20. Staffel von Germanys Next Topmodel schwelgt Heidi Klum kurz in Nostalgie, dann beginnt das traditionelle große Aussieben der Girls, was diesmal besonders zäh wirkt. Die Boys komme… [+8190 chars]",,de,'Heidi Klum'
https://www.nzz.ch/international/gefolgschaft-statt-widerstand-republikanische-falken-schweigen-zu-trumps-ukraine-kurs-ld.1871028,https://www.nzz.ch/international/gefolgschaft-statt-widerstand-republikanische-falken-schweigen-zu-trumps-ukraine-kurs-ld.1871028,0,www.nzz.ch,Gefolgschaft statt Widerstand: Republikanische Falken schweigen zu Trumps Ukraine-Kurs,Zu Beginn des Ukraine-Kriegs gehörten die Republikaner zu Kiews grössten Unterstützern. Viele konservative Abgeordnete kritisierten die Biden-Regierung für ihre zaghaften Waffenlieferungen. Doch Trump hat seine Partei auf seine Verständigung mit Putin eingesc…,"https://img.nzz.ch/2024/10/03/b20988af-faed-46be-8b77-08318d555551.jpeg?width=1200&height=674&fit=bounds&quality=75&auto=webp&crop=4418,2485,x0,y232&wmark=nzz",2025-02-14T04:30:00Z,http://archive.md/20250214121822/https://www.nzz.ch/international/gefolgschaft-statt-widerstand-republikanische-falken-schweigen-zu-trumps-ukraine-kurs-ld.1871028,"Donald Trump bei einem Treffen mit Wolodimir Selenski im Trump Tower, am 27. September 2024.
Für einen schnellen Frieden in der Ukraine zeigt sich Donald Trump bereit, zentrale Prinzipien der amerik… [+6354 chars]",,de,'Putin'
https://www.jungewelt.de/artikel/494096.zweite-liga.html,https://www.jungewelt.de/artikel/494096.zweite-liga.html,0,www.jungewelt.de,Der schwarze Kanal: Zweite Liga,Das Telefonat von Trump mit Putin signalisiert deutschen Zeitungen Weltuntergang: Der US-Präsident missachtet die Bedrohung aus dem Osten. Unaufgeregt konstatiert dazu ein Historiker: Deutschland ist eben zweite Liga.,https://www.jungewelt.de/img/1100/205437.jpg,2025-02-14T18:41:02Z,,In der FAZ berichtet Mitherausgeber Berthold Kohler von »Shock and Awe« und »Fassungslosigkeit« unter den europäischen Verbündeten der USA nach dem Telefongespräch zwischen Donald Trump und Wladimir … [+3462 chars],,de,'George Bush'
https://www.welt.de/debatte/kommentare/article255438408/Zoelle-Donald-Trump-leistet-sich-eine-volkswirtschaftliche-Privatlogik.html,https://www.welt.de/debatte/kommentare/article255438408/Zoelle-Donald-Trump-leistet-sich-eine-volkswirtschaftliche-Privatlogik.html,0,www.welt.de,Donald Trump leistet sich eine volkswirtschaftliche Privatlogik,Das krude Verständnis des Präsidenten von Wirtschaft schlägt sich zunehmend in seiner Politik nieder. Die Argumentation von Trump und seinen Beratern ist volkswirtschaftlich grober Unfug. Europa bleibt nur eine vage Hoffnung.,https://img.welt.de/img/debatte/kommentare/mobile255452400/0037936327-ci16x9-w1200/FILE-PHOTO-U-S-President-Donald-Trump-at-the-Oval-Office.jpg,2025-02-17T06:34:03Z,,Das krude Verständnis des Präsidenten von Wirtschaft schlägt sich zunehmend in seiner Politik nieder. Die Argumentation von Trump und seinen Beratern ist volkswirtschaftlich grober Unfug. Europa blei… [+5382 chars],,de,'Recep Tayyip Erdogan'
https://www.diepresse.com/19371773/signal-an-chinas-privatwirtschaft-staatschef-xi-empfaengt-top-firmenchefs,https://www.diepresse.com/19371773/signal-an-chinas-privatwirtschaft-staatschef-xi-empfaengt-top-firmenchefs,0,www.diepresse.com,Signal an Chinas Privatwirtschaft? Staatschef Xi empfängt Top-Firmenchefs,"Auch der in Ungnade gefallener Alibaba-Chef Jack Ma war dabei. Einige Beobachter sahen mit dem Treffen in Peking die Absicht verbunden, ein Signal der Unterstützung an die Privatkonzerne der zweitgrößten Volkswirtschaft der Welt zu senden. Chinas Wirtschaft l…",https://img.diepresse.com/public/incoming/qn9nw-CHINA-TECHXI/alternates/DPR_SOCIAL_NACHRICHTEN/CHINA-TECHXI,2025-02-17T07:09:48Z,,"Auch der in Ungnade gefallener Alibaba-Chef Jack Ma war dabei. Einige Beobachter sahen mit dem Treffen in Peking die Absicht verbunden, ein Signal der Unterstützung an die Privatkonzerne der zweitgrö… [+1427 chars]",,de,'Jack Ma'
