index,url,valid,domain,title,description,image,published,archive,content,quote,language,keyword
https://www.nzz.ch/technologie/worldcoin-sam-altmanns-bizarre-plaene-fuer-eine-krypto-weltwaehrung-ld.1749617,https://www.nzz.ch/technologie/worldcoin-sam-altmanns-bizarre-plaene-fuer-eine-krypto-weltwaehrung-ld.1749617,0,www.nzz.ch,Worldcoin: Sam Altmans bizarre Pläne für eine Krypto-Weltwährung,"Das neue Worldcoin-Projekt von Sam Altman will vieles sein: Identitätsnachweis, Kryptowährung, Grundeinkommen. Im Mittelpunkt: ein Iris-Scanner – und viele offene Fragen zum Datenschutz.","https://img.nzz.ch/2023/07/31/6a0121c7-4d22-42a4-80c5-84089733f5fc.jpeg?width=1200&height=674&fit=bound&quality=75&auto=webp&crop=4889,2746,x368,y1123&wmark=nzz",2023-08-01T03:30:00Z,https://web.archive.org/web/20230801142503/https://www.nzz.ch/technologie/worldcoin-sam-altmanns-bizarre-plaene-fuer-eine-krypto-weltwaehrung-ld.1749617,"Ein junger Mann lässt sich in Indien für das Worldcoin-Projekt die Iris scannen.
Die silberne Kugel sieht aus wie eine Miniversion des Todessterns aus «Star Wars». Genauso verrückt wie die Science-F… [+21116 chars]",,de,'Sam Altman'
https://www.brigitte.de/aktuell/koenig-charles-iii---emotionaler-start-in-balmoral-ferien-steht-bevor-13568738.html,https://www.brigitte.de/aktuell/koenig-charles-iii---emotionaler-start-in-balmoral-ferien-steht-bevor-13568738.html,0,www.brigitte.de,König Charles III.: Emotionaler Start in Balmoral-Ferien steht bevor,Der erste Sommer ohne die Queen: Dieses Jahr gestalten sich die Balmoral-Ferien der Royals etwas anders als in den Jahrzehnten zuvor.,https://image.brigitte.de/13568740/t/hp/v1/w1440/r1.7778/-/01--emotionaler-start-in-balmoral-ferien-steht-bevor---1-1---spoton-article-1049654.jpg,2023-08-01T12:37:00Z,,"Der erste Sommer ohne die Queen: Dieses Jahr gestalten sich die Balmoral-Ferien der Royals etwas anders als in den Jahrzehnten zuvor.
König Charles III. (74) und die britische Königsfamilie blicken … [+3407 chars]",,de,'Charles III'
https://www.sueddeutsche.de/bayern/hubert-aiwanger-klimawandel-hitzesommer-regen-1.6086789,https://www.sueddeutsche.de/bayern/hubert-aiwanger-klimawandel-hitzesommer-regen-1.6086789,0,www.sueddeutsche.de,Wetter: Als Hubert Aiwanger den Klimawandel wegnörgelte,"Es regnet so viel, dass der bayerische Wirtschaftsminister kurzerhand die Klimakrise absagt. Zum Auspumpen von Kellern sollen sich interessierte Bali-Urlauber bitte an die örtliche Freiwillige Feuerwehr wenden.",https://www.sueddeutsche.de/image/sz.1.6086790/1200x675?v=1690897240,2023-08-01T13:40:57Z,,"Es regnet so viel, dass der bayerische Wirtschaftsminister kurzerhand die Klimakrise absagt. Zum Auspumpen von Kellern sollen sich interessierte Bali-Urlauber bitte an die örtliche Freiwillige Feuerw… [+2201 chars]",,de,'Hubert Aiwanger'
https://www.n-tv.de/leute/Fuer-Charles-und-Camilla-wird-es-emotional-article24298700.html,https://www.n-tv.de/leute/Fuer-Charles-und-Camilla-wird-es-emotional-article24298700.html,0,www.n-tv.de,Erster Sommer ohne Queen: Für Charles und Camilla wird es emotional,"Vor einem Jahr war sie noch da, die britische Queen Elizabeth II. Nun jedoch blickt die Königsfamilie den Sommerferien erstmals ohne die verstorbene Monarchin entgegen. Ein Einschnitt, insbesondere für Thronfolger Charles und seine Frau Camilla.",https://bilder2.n-tv.de/img/incoming/crop24298709/1951328034-cImg_16_9-w1200/415745080.jpg,2023-08-01T15:00:04Z,,"Vor einem Jahr war sie noch da, die britische Queen Elizabeth II. Nun jedoch blickt die Königsfamilie den Sommerferien erstmals ohne die verstorbene Monarchin entgegen. Ein Einschnitt, insbesondere f… [+3356 chars]",,de,'Queen Elizabeth II'
https://www.focus.de/politik/experten/gastbeitrag-von-gabor-steingart-vier-faktoren-haben-zur-verformung-der-us-demokratie-gefuehrt_id_200704963.html,https://www.focus.de/politik/experten/gastbeitrag-von-gabor-steingart-vier-faktoren-haben-zur-verformung-der-us-demokratie-gefuehrt_id_200704963.html,0,www.focus.de,"Gastbeitrag von Gabor Steingart - Die amerikanische Demokratie ist nicht tot, aber krank",China setzt zum Überholvorgang an. Ausgerechnet jetzt leidet die Effektivität der US-Demokratie als Problemlöser. Vier Faktoren haben in den USA zur Verformung der Demokratie geführt.Von Gastautor Gabor Steingart (Berlin),https://p6.focus.de/img/fotos/id_200704964/stg145.jpg?im=Crop%3D%280%2C278%2C780%2C389%29%3BResize%3D%281200%2C627%29&impolicy=perceptual&quality=mediumHigh&hash=172c9dc437d7a6853807e091a20ca09a4fd47bff54873659dd2a54bd39682793,2023-08-02T06:10:49Z,,China setzt zum Überholvorgang an. Ausgerechnet jetzt leidet die Effektivität der US-Demokratie als Problemlöser. Vier Faktoren haben in den USA zur Verformung der Demokratie geführt.Die amerikanisch… [+7306 chars],,de,'Jesse Watters'
https://www.focus.de/kultur/royals/prinz-harry-er-soll-seine-familie-mehr-denn-je-vermissen_id_200710335.html,https://www.focus.de/kultur/royals/prinz-harry-er-soll-seine-familie-mehr-denn-je-vermissen_id_200710335.html,0,www.focus.de,Heimweh nach Großbritannien - Prinz Harry sehnt sich stärker als je zuvor nach seiner Familie,"Heimweh trifft auf Herausforderungen: Wie es scheint, vermisst Prinz Harry seine Familie und hat Sehnsucht nach Großbritannien. In seiner Wahlheimat Amerika stehen er und Meghan derzeit vor neuen Herausforderungen.",https://p6.focus.de/img/fotos/id_200711323/gettyimages-1052323750.jpg?im=Crop%3D%280%2C13%2C1024%2C512%29%3BResize%3D%281200%2C627%29&impolicy=perceptual&quality=mediumHigh&hash=af790a2e121b4bc2899e5bdce06072ac6c07219bddfb6206cdfe572d39577ea1,2023-08-02T07:52:31Z,,"In diesem Sommer soll Prinz Harry (38) seine in Großbritannien lebende Familie besonders stark vermissen. Vor drei Jahren hatten er und seine Frau, Herzogin Meghan (41), beschlossen, von Großbritanni… [+2358 chars]",,de,'Prinz Harry'
https://www.tagesschau.de/ausland/europa/russland-prigoschin-wagner-putin-100.html,https://www.tagesschau.de/ausland/europa/russland-prigoschin-wagner-putin-100.html,0,www.tagesschau.de,"Jewgeni Prigoschin - Putins nützlicher ""Verräter""","Vor einem Monat hat der Aufstand von Militärunternehmer Prigoschin die Macht Präsident Putins erschüttert. Doch kam er nicht etwa in Haft, sondern verfolgt neue Projekte. Warum kam der ""Verräter"" davon? Von Silvia Stöber.",https://images.tagesschau.de/image/c172d2c7-6b00-4660-9bf8-fd60aee6bb81/AAABiFMgbCQ/AAABibBxqrQ/16x9-1280/prigoschin-104.jpg,2023-08-02T08:01:56Z,http://archive.md/20230802180645/https://www.tagesschau.de/ausland/europa/russland-prigoschin-wagner-putin-100.html,"Stand: 02.08.2023 10:01 Uhr
Vor einem Monat hat der Aufstand von Militärunternehmer Prigoschin die Macht Präsident Putins erschüttert. Doch kam er nicht etwa in Haft, sondern verfolgt neue Projekte.… [+7465 chars]",,de,'Sergej Surowikin'
https://www.stern.de/gesellschaft/regional/bayern/bundeslandwirtschaftsminister--oezdemir--werde-nicht-an-wolfsentnahme-hindern-33703410.html,https://www.stern.de/gesellschaft/regional/bayern/bundeslandwirtschaftsminister--oezdemir--werde-nicht-an-wolfsentnahme-hindern-33703410.html,0,www.stern.de,Bundeslandwirtschaftsminister: Özdemir: Werde nicht an Wolfsentnahme hindern,"Bundeslandwirtschaftsminister Cem Özdemir (Grüne) stellt sich dem Abschuss von Problemwölfen nicht in den Weg. ""Ich sag nur, machen sie es. Ich werde sie nicht daran hindern"", betonte er bei der traditionellen Hauptalmbegehung im oberbayerischen Arzmoosgebiet…",https://image.stern.de/33703412/t/t4/v1/w1440/r1.7778/-/02--urnnewsmldpacom2009010123080299660444v3w800h600l652t0r2369b1634jpeg---1ecb5bac1ab65601.jpg,2023-08-02T09:22:18Z,,"Bundeslandwirtschaftsminister Cem Özdemir (Grüne) stellt sich dem Abschuss von Problemwölfen nicht in den Weg. ""Ich sag nur, machen sie es. Ich werde sie nicht daran hindern"", betonte er bei der trad… [+2565 chars]",,de,'Hubert Aiwanger'
https://www.faz.net/aktuell/politik/ausland/donald-trump-vor-gericht-ein-ueberblick-19075556.html,https://www.faz.net/aktuell/politik/ausland/donald-trump-vor-gericht-ein-ueberblick-19075556.html,0,www.faz.net,Sechs Verfahren: Trump vor Gericht – ein Überblick,Die Anklage im Zusammenhang mit dem Sturm aufs Kapitol ist nicht die erste gegen Donald Trump nach seiner Amtszeit – und wird möglicherweise auch nicht die letzte sein.,https://media0.faz.net/ppmedia/aktuell/politik/ausland/3491678954/1.9075606/facebook_teaser/trump-angeklagt-immer-und.jpg,2023-08-02T10:12:31Z,https://web.archive.org/web/20230802113800/https://www.faz.net/aktuell/politik/ausland/donald-trump-vor-gericht-ein-ueberblick-19075556.html,"Der frühere amerikanische Präsident Donald Trump ist am Dienstag wegen Wahlbeeinflussung vor einem Bundesgericht angeklagt worden. Das ist schon die dritte strafrechtliche Anklage, der er sich gegenü… [+4378 chars]",,de,'Eric Trump'
https://www.focus.de/kultur/royals/prinzessin-kate-sie-feiert-meilenstein-mit-emotionalem-video_id_200718705.html,https://www.focus.de/kultur/royals/prinzessin-kate-sie-feiert-meilenstein-mit-emotionalem-video_id_200718705.html,0,www.focus.de,Ihr Herzensprojekt - Prinzessin Kate feiert sechs Monate „Shaping Us“,"Im Januar ging Prinzessin Kate mit ihrer Organisation „Shaping Us“ an den Start. Sechs Monate später hat sie Einiges zu feiern, wie sie auf Instagram zeigt.",https://p6.focus.de/img/fotos/id_200721072/prinzessin-kate.jpg?im=Crop%3D%280%2C123%2C2815%2C1406%29%3BResize%3D%281200%2C627%29&impolicy=perceptual&quality=mediumHigh&hash=74e0ba459e3603258eb52e0063d8d7838c3968746bc71d04ab1aec0a62d0b9a8,2023-08-02T10:23:50Z,,"Mit Shaping Us hat sich Prinzessin Kate (41) im Januar 2023 den ganz großen Traum von der eigenen Organisation erfüllt. Dabei geht es um das Thema, das der Frau von Prinz William (41) schon seit Jahr… [+1550 chars]",,de,'Prinzessin Kate'
https://www.bild.de/unterhaltung/royals/leute/meghan-soll-ausser-sich-sein-jetzt-macht-sich-hollywood-an-william-und-kate-ran-84902734.bild.html,https://www.bild.de/unterhaltung/royals/leute/meghan-soll-ausser-sich-sein-jetzt-macht-sich-hollywood-an-william-und-kate-ran-84902734.bild.html,0,www.bild.de,Meghan soll außer sich sein - Jetzt macht sich Hollywood an William & Kate ran!,Hollywood ignoriert Meghan (und ihren Prinzen) und rollt lieber Prinz William und seiner Kate den roten Teppich aus. Warum?,"https://images.bild.de/64ca0f9c97f8bb6b2ff1f8a5/b450a2b449b62d5414d1b6c4f9a85b61,65f564d0?w=1280",2023-08-02T10:28:49Z,https://web.archive.org/web/20230803042913/https://www.bild.de/unterhaltung/royals/leute/meghan-soll-ausser-sich-sein-jetzt-macht-sich-hollywood-an-william-und-kate-ran-84902734.bild.html,"SO hatten sich das die in die USA ausgewanderten Royal-Aussteiger sicher nicht vorgestellt.
Prinz Harry (38) und seine Frau Meghan (41) werden immer unbeliebter. Sie verlieren nicht nur immer mehr E… [+3079 chars]",,de,'Prinz William'
https://www.bild.de/unterhaltung/leute/leute/jennifer-lopez-feiert-ihren-54-so-schoen-kann-aelterwerden-sein-84898984.bild.html,https://www.bild.de/unterhaltung/leute/leute/jennifer-lopez-feiert-ihren-54-so-schoen-kann-aelterwerden-sein-84898984.bild.html,0,www.bild.de,Jennifer Lopez feiert ihren 54.! - So schön ist Älterwerden,Jennifer Lopez begeistert ihre Fans mit ein paar sexy Dessous-Fotos und gibt ihrer Community Eindrücke von ihrer pompösen Geburtstagsparty.,"https://images.bild.de/64c9137197f8bb6b2ff1f7c9/3442d853cbede94a926edbb84f49dfef,c878ecd8?w=1280",2023-08-02T10:49:59Z,https://web.archive.org/web/20230802112030/https://www.bild.de/unterhaltung/leute/leute/jennifer-lopez-feiert-ihren-54-so-schoen-kann-aelterwerden-sein-84898984.bild.html,"Der kuriose Fall von Jennifer Lopez. 
Diese Frau altert einfach nicht. Vergangene Woche feierte der Mega-Star ihren 54. Geburtstag. Für Jennifer Lopez ein Grund zum Strahlen! 
Auf Instagram postete… [+1556 chars]",,de,'Jennifer Lopez'
https://www.bild.de/regional/muenchen/muenchen-aktuell/landwirtschaftsminister-oezdemir-nicht-gegen-abschuss-von-problemwoelfen-84905304.bild.html,https://www.bild.de/regional/muenchen/muenchen-aktuell/landwirtschaftsminister-oezdemir-nicht-gegen-abschuss-von-problemwoelfen-84905304.bild.html,0,www.bild.de,Grüner Bundeslandwirtschaftsminister - Özdemir nicht gegen Abschuss von Problemwölfen,"Bundeslandwirtschaftsminister Cem Özdemir (57, Grüne) stellt sich dem Abschuss von Problemwölfen nicht in den Weg.","https://images.bild.de/64ca2f29f053a0369ebc0613/e7025fc06c526c8bfb87220782ec6290,299a4b50?w=1280",2023-08-02T11:07:14Z,,"Brannenburg Bundeslandwirtschaftsminister Cem Özdemir (57, Grüne) stellt sich dem Abschuss von Problemwölfen nicht in den Weg. 
Ich sag nur, machen sie es. Ich werde sie nicht daran hindern, betonte… [+2193 chars]",,de,'Cem Özdemir'
https://www.faz.net/aktuell/politik/inland/almwanderung-mit-soeder-aiwanger-und-oezdemir-19076452.html,https://www.faz.net/aktuell/politik/inland/almwanderung-mit-soeder-aiwanger-und-oezdemir-19076452.html,0,www.faz.net,"Stichel-Duell am Berg: Mit Söder, Aiwanger und Özdemir unterwegs zur Alm","Die Hauptalmbegehung steht im Zeichen der bayerischen Landtagswahl. Bundeslandwirtschaftsminister Cem Özdemir zeigt, dass er Söder und Co. im Sticheln das Wasser reichen kann.",https://media0.faz.net/ppmedia/aktuell/1456039458/1.9076450/facebook_teaser/illustre-wandertruppe-bayerns.jpg,2023-08-02T16:54:09Z,,"Die traditionelle Hauptalmbegehung hat einen festen Platz im Veranstaltungskalender des politischen Bayerns. Für die mitlaufenden Politiker geht es darum, sich als geländegängig zu erweisen und für d… [+5569 chars]",,de,'Cem Özdemir'
https://www.brigitte.de/aktuell/streep--schauspielstars-spenden-millionen-an-gewerkschaft-13569518.html,https://www.brigitte.de/aktuell/streep--schauspielstars-spenden-millionen-an-gewerkschaft-13569518.html,0,www.brigitte.de,Streep: Schauspielstars spenden Millionen an Gewerkschaft,"George Clooney, Meryl Streep und weitere Hollywoodstars unterstützen die Schauspieler-Gewerkschaft im Streik mit einer Millionen-Spende.",https://image.brigitte.de/13569520/t/Br/v1/w1440/r1.7778/-/03--schauspielstars-spenden-millionen-an-gewerkschaft---1-1---spoton-article-1049771.jpg,2023-08-03T06:26:00Z,https://web.archive.org/web/20230803065015/https://www.brigitte.de/aktuell/streep--schauspielstars-spenden-millionen-an-gewerkschaft-13569518.html,"George Clooney, Meryl Streep und weitere Hollywoodstars unterstützen die Schauspieler-Gewerkschaft im Streik mit einer Millionen-Spende.
Hollywoodstars zeigen ihre Unterstützung für den Streik der S… [+3055 chars]",,de,'Ben Affleck'
https://www.stern.de/lifestyle/leute/streep--millionen-spende-an-streikende-gewerkschaft-33705858.html,https://www.stern.de/lifestyle/leute/streep--millionen-spende-an-streikende-gewerkschaft-33705858.html,0,www.stern.de,Streep: Millionen-Spende an streikende Gewerkschaft,"George Clooney, Meryl Streep und weitere Hollywoodstars unterstützen die Schauspieler-Gewerkschaft im Streik mit einer Millionen-Spende.",https://image.stern.de/33705862/t/xa/v1/w1440/r1.7778/-/03--millionen-spende-an-streikende-gewerkschaft---16-9---spoton-article-1049771.jpg,2023-08-03T06:39:00Z,,"George Clooney, Meryl Streep und weitere Hollywoodstars unterstützen die Schauspieler-Gewerkschaft im Streik mit einer Millionen-Spende.
Hollywoodstars zeigen ihre Unterstützung für den Streik der S… [+2992 chars]",,de,'George Clooney'
https://www.pcgames.de/DC-Extended-Universe-DCEU-Brands-266314/News/batman-solo-film-ben-affleck-jack-snyder-drehbuch-cancel-1425931/,https://www.pcgames.de/DC-Extended-Universe-DCEU-Brands-266314/News/batman-solo-film-ben-affleck-jack-snyder-drehbuch-cancel-1425931/,0,www.pcgames.de,"Ihr werdet ihn niemals sehen, aber dieser Batman-Film wäre ""absolut fantastisch"" geworden ...",Für Ben Afflecks Batman bestanden bereits Pläne für einen Solo-Film in Snyders DCEU. Diese Story werden Fans niemals zu Gesicht bekommen.,https://www.pcgames.de/screenshots/medium/2017/07/Batman-Danny-Miki-Greg-Capullo-pc-games.jpg,2023-08-03T11:07:00Z,,"Vor kurzem erschienen Gerüchte darüber, James Gunn einem weiteren Wonder-Woman-Film mit Gal Gadot nicht allzu abgeneigt ist. Es besteht also die Möglichkeit, dass wir Gadot noch einmal als Amazonen-P… [+4082 chars]",,de,'Ben Affleck'
https://www.bild.de/unterhaltung/leute/leute/harry-und-meghan-hier-telefonieren-sie-die-krisengeruechte-weg-84917002.bild.html,https://www.bild.de/unterhaltung/leute/leute/harry-und-meghan-hier-telefonieren-sie-die-krisengeruechte-weg-84917002.bild.html,0,www.bild.de,Perfekt gestylt und lächelnd - Harry und Meghan telefonieren Krisengerüchte weg,Prinz Harry (38) und Herzogin Meghan (41) betont entspannt und harmonisch: Hier telefonieren sie die Krisengerüchte weg.,"https://images.bild.de/64cb6fa8f053a0369ebc07e9/323f4485ce14137cdb0433ee6bbcce89,129504b7?w=1280",2023-08-03T14:02:16Z,,"Da sitzen sie, perfekt gestylt im Garten ihres Zwölf-Millionen-Dollar-Anwesens in Montecito (USA) und lächeln sich beglückt an. 
Prinz Harry (38) und Meghan (41) strahlen in einem neuen Video zwei M… [+4059 chars]",,de,'Prinz George'
https://www.sueddeutsche.de/bayern/bayern-papierfabrik-plattling-aiwanger-1.6093577,https://www.sueddeutsche.de/bayern/bayern-papierfabrik-plattling-aiwanger-1.6093577,0,www.sueddeutsche.de,"Wirtschaft: ""Trauriger Tag für den Industriestandort Bayern""","Hubert Aiwanger und Verkehrsminister Christian Bernreiter reisen nach Plattling, um noch einmal mit Werksleitung und Betriebsrat zu sprechen. Doch das Aus für die Papierfabrik lässt sich nicht mehr abwenden. Jetzt geht es um die Zukunft der 500 Mitarbeiter - …",https://www.sueddeutsche.de/image/sz.1.6067637/1200x675?v=1691075485,2023-08-03T15:11:28Z,,"Hubert Aiwanger und Verkehrsminister Christian Bernreiter reisen nach Plattling, um noch einmal mit Werksleitung und Betriebsrat zu sprechen. Doch das Aus für die Papierfabrik lässt sich nicht mehr a… [+3020 chars]",,de,'Hubert Aiwanger'
https://www.stern.de/kultur/roger-federer--tennis-legende-schwaermt-von-prinzessin-kate-33708150.html,https://www.stern.de/kultur/roger-federer--tennis-legende-schwaermt-von-prinzessin-kate-33708150.html,0,www.stern.de,Roger Federer: Tennis-Legende schwärmt von Prinzessin Kate,"Roger Federer schwärmt in den höchsten Tönen von Prinzessin Kate. Der Wimbledon-Besuch in der Royal Box habe ""so viel Spaß gemacht"".",https://image.stern.de/33708154/t/Cb/v1/w1440/r1.7778/-/03--tennis-legende-schwaermt-von-prinzessin-kate---16-9---spoton-article-1049839.jpg,2023-08-03T19:47:00Z,,"Roger Federer schwärmt in den höchsten Tönen von Prinzessin Kate. Der Wimbledon-Besuch in der Royal Box habe ""so viel Spaß gemacht"".
Das Tennisturnier in Wimbledon lässt sich getrost als Wohnzimmer … [+1892 chars]",,de,'Roger Federer'
https://www.n-tv.de/leute/Roger-Federer-hat-so-viel-Spass-mit-Kate-article24304635.html,https://www.n-tv.de/leute/Roger-Federer-hat-so-viel-Spass-mit-Kate-article24304635.html,0,www.n-tv.de,"Prinzessin riesiger Tennisfan: Roger Federer hat ""so viel Spaß"" mit Kate","Nach seinem Karriereende kommt Tennis-Ass Roger Federer nur noch als Besucher nach Wimbledon - aber dafür in royaler Begleitung.  In der ""Royal Box"" hat er mit Prinzessin Kate offenbar eine unterhaltsame Sitznachbarin gefunden.",https://bilder3.n-tv.de/img/incoming/crop24304634/68813251-cImg_16_9-w1200/imago0262699221h-1-.jpg,2023-08-04T01:06:35Z,,"Nach seinem Karriereende kommt Tennis-Ass Roger Federer nur noch als Besucher nach Wimbledon - aber dafür in royaler Begleitung. In der ""Royal Box"" hat er mit Prinzessin Kate offenbar eine unterhalts… [+1877 chars]",,de,'Prinzessin Kate'
https://www.n-tv.de/politik/Die-vielen-juristischen-Probleme-von-Donald-Trump-article24304869.html,https://www.n-tv.de/politik/Die-vielen-juristischen-Probleme-von-Donald-Trump-article24304869.html,0,www.n-tv.de,Alles nur eine Hexenjagd?: Die vielen juristischen Probleme von Donald Trump,Der Prozess um seine Rolle beim Angriff auf das Kapitol ist nur einer von vielen: Ex-Präsident Trump muss sich gerade mit einer Menge Verfahren herumschlagen - von Verleumdungsklagen über Betrug bis hin zur Verschwörung. Hier eine Übersicht über Trumps jurist…,https://bilder1.n-tv.de/img/incoming/crop24304876/593132763-cImg_16_9-w1200/419338813.jpg,2023-08-04T05:46:57Z,https://web.archive.org/web/20230804064008/https://www.n-tv.de/politik/Die-vielen-juristischen-Probleme-von-Donald-Trump-article24304869.html,"Der Prozess um seine Rolle beim Angriff auf das Kapitol ist nur einer von vielen: Der ehemalige US-Präsident und führende Präsidentschaftskandidat der Republikaner, Donald Trump, muss sich gerade mit… [+4116 chars]",,de,'Donald Trump'
https://www.focus.de/kultur/royals/prinz-harry-und-herzogin-meghan-keine-einladung-zur-gedenkfeier-fuer-die-queen_id_200896175.html,https://www.focus.de/kultur/royals/prinz-harry-und-herzogin-meghan-keine-einladung-zur-gedenkfeier-fuer-die-queen_id_200896175.html,0,www.focus.de,Prinz Harry und Herzogin Meghan ausgeschlossen - Sussexes bei privater Gedenkfeier für Queen Elizabeth nicht erwünscht,Zum ersten Mal seit dem Tod der Queen reisen Herzogin Meghan und Prinz Harry gemeinsam nach Europa. Allerdings nicht nach England.,https://p6.focus.de/img/fotos/id_200897188/gettyimages-1423638542.jpg?im=Crop%3D%280%2C188%2C3464%2C1732%29%3BResize%3D%281200%2C627%29&impolicy=perceptual&quality=mediumHigh&hash=e51983156380b7b70c3170714d2906bf2c23d919a63e65175d71b20526e6a66b,2023-08-04T09:29:49Z,,"Bald ist es ein Jahr her, dass Queen Elizabeth II. (96) am Abend des 8. September 2022 auf Schloss Balmoral verstorben ist. Anlässlich ihres ersten Todestages kommen die Mitglieder der britischen Kön… [+2522 chars]",,de,'Prinz Harry'
https://www.stern.de/lifestyle/musik--lady-gaga-erinnert-an-verstorbenen-tony-bennett-33710880.html,https://www.stern.de/lifestyle/musik--lady-gaga-erinnert-an-verstorbenen-tony-bennett-33710880.html,0,www.stern.de,Musik: Lady Gaga erinnert an verstorbenen Tony Bennett,Los Angeles - Pop-Star Lady Gaga (37) hat am Donnerstag (Ortszeit) der kürzlich verstorben Jazz-Legende Tony Bennett Tribut gezollt. «Happy Birthday,https://image.stern.de/33710882/t/UI/v1/w1440/r1.7778/-/04--urnnewsmldpacom2009010123080499704510v2w800h600l473t0r1936b871jpeg---a1e701e6c8586c9b.jpg,2023-08-04T13:56:40Z,https://web.archive.org/web/20230804191928/https://www.stern.de/lifestyle/musik--lady-gaga-erinnert-an-verstorbenen-tony-bennett-33710880.html,"""Happy Birthday Tony"": Lady Gaga verneigt sich vor dem kürzlich verstorbenen Jazzsänger Tony Bennett.
Pop-Star Lady Gaga (37) hat am Donnerstag (Ortszeit) der kürzlich verstorben Jazz-Legende Tony B… [+910 chars]",,de,'Lady Gaga'
https://www.faz.net/aktuell/politik/inland/was-hat-markus-soeder-mit-ernst-juenger-zu-tun-19081700.html,https://www.faz.net/aktuell/politik/inland/was-hat-markus-soeder-mit-ernst-juenger-zu-tun-19081700.html,0,www.faz.net,Steht die Brandmauer auch im Literarischen?,Markus Söder hat in einer Rede im Landtag zustimmend den nicht unproblematischen Autor Ernst Jünger zitiert. Durfte er das?,https://media1.faz.net/ppmedia/aktuell/politik/3939114946/1.9082337/facebook_teaser/markus-soeder-auf-einer.jpg,2023-08-04T17:03:00Z,,Kürzlich fand im Bayerischen Landtag die letzte Plenarsitzung der zu Ende gehenden Legislaturperiode statt. In seinem Schlusswort ging Ministerpräsident Markus Söder auf die Bedeutung der Demokratie … [+3895 chars],,de,'Hubert Aiwanger'
https://www.n-tv.de/politik/Trump-will-nicht-selbst-vor-Gericht-erscheinen-article24307217.html,https://www.n-tv.de/politik/Trump-will-nicht-selbst-vor-Gericht-erscheinen-article24307217.html,0,www.n-tv.de,Neue Vorwürfe im Dokumentenfall: Trump will nicht selbst vor Gericht erscheinen,Donald Trump hat derzeit häufiger Gerichtstermine. Dabei möchte er aber nicht immer persönlich auf der Anklagebank platznehmen. Die neuen Anklagepunkte in der Dokumentenaffäre will er sich lieber aus der Ferne vorlesen lassen.,https://bilder4.n-tv.de/img/incoming/crop24307211/3141329994-cImg_16_9-w1200/11649ec31d6cc4404effa7a9ee3a1a35.jpg,2023-08-05T01:07:23Z,,Donald Trump hat derzeit häufiger Gerichtstermine. Dabei möchte er aber nicht immer persönlich auf der Anklagebank platznehmen. Die neuen Anklagepunkte in der Dokumentenaffäre will er sich lieber aus… [+1784 chars],,de,'Donald Trump'
https://www.morgenpost.de/politik/article239105623/italien-meloni-regierung-lgbt-schwul-lesbisch-familien.html,https://www.morgenpost.de/politik/article239105623/italien-meloni-regierung-lgbt-schwul-lesbisch-familien.html,0,www.morgenpost.de,„Echte Verfolgung“: Wie Italiens Regierung gerade Regenbogenfamilien bekämpft,"Giorgia Meloni, Italiens rechtspopulistische Regierungschefin, setzt auf die traditionelle Familie. Zwei lesbische Frauen erzählen, was das für sie bedeutet",https://img.morgenpost.de/img/politik/crop239105619/0202603424-w820-cv16_9-q85/24cf577a-32a4-11ee-8470-5a07cef0dd2a.jpg,2023-08-05T08:50:10Z,https://web.archive.org/web/20230805093838/https://www.morgenpost.de/politik/article239105623/italien-meloni-regierung-lgbt-schwul-lesbisch-familien.html,"Rom. Als Vanessa Finesso und ihre Lebensgefährtin Cristina Zambon das Schreiben aus ihrem Briefkasten holten, brach eine Welt für sie zusammen. Die beiden Frauen haben eine gemeinsame zweijährige Toc… [+6334 chars]",,de,'Matteo Salvini'
