index,url,valid,domain,title,description,image,published,archive,content,quote,language,keyword
https://www.kicker.de/messi-landet-in-florida-vorstellung-am-sonntag-958967/artikel,https://www.kicker.de/messi-landet-in-florida-vorstellung-am-sonntag-958967/artikel,0,www.kicker.de,Messi landet in Florida - Vorstellung am Sonntag?,"Videoaufnahmen zeigen, dass Lionel Messi in seiner neuen Wahlheimat USA eingetroffen ist. Damit naht die sicherlich in einem großen Rahmen zelebrierte Vorstellung des Weltstars bei seinem neuen Klub Inter Miami.","https://derivates.kicker.de/image/upload/c_crop,x_0,y_0,w_3744,h_2106/w_1200,q_auto/v1/2023/07/11/de7e085a-89f1-41f9-9ab4-233b7b24ad3e.jpeg",2023-07-11T20:29:13Z,,"Videoaufnahmen zeigen, dass Lionel Messi in seiner neuen Wahlheimat USA eingetroffen ist. Damit naht die sicherlich in einem großen Rahmen zelebrierte Vorstellung des Weltstars bei seinem neuen Klub … [+1281 chars]",,de,'Lionel Messi'
https://www.stern.de/sport/argentinischer-superstar--messi-fuehlt-sich--bereit--fuer-sein-us-abenteuer-33642630.html,https://www.stern.de/sport/argentinischer-superstar--messi-fuehlt-sich--bereit--fuer-sein-us-abenteuer-33642630.html,0,www.stern.de,"Argentinischer Superstar: Messi fühlt sich ""bereit"" für sein US-Abenteuer",Am Sonntag dürfte Lionel Messi offiziell bei Inter Miami vorgestellt werden. Der Argentinier spricht schon jetzt über das neue Kapitel in seiner Karriere. Er fühlt sich gut mit der Entscheidung.,https://image.stern.de/33642632/t/ek/v1/w1440/r1.7778/-/12--urnnewsmldpacom2009010123071299376348v2w800h600l430t47r1384b687jpeg---c6a170b05474500a.jpg,2023-07-12T11:31:21Z,,"Am Sonntag dürfte Lionel Messi offiziell bei Inter Miami vorgestellt werden. Der Argentinier spricht schon jetzt über das neue Kapitel in seiner Karriere. Er fühlt sich gut mit der Entscheidung.
Sup… [+1785 chars]",,de,'Lionel Messi'
https://www.kicker.de/messi-mania-in-miami-wir-geben-ihm-alles-was-er-uns-gegeben-hat-959154/video,https://www.kicker.de/messi-mania-in-miami-wir-geben-ihm-alles-was-er-uns-gegeben-hat-959154/video,0,www.kicker.de,"Messi-Mania in Miami: ""Wir geben ihm alles, was er uns gegeben hat""",Video: Die Anhänger von Inter Miami warten auf die Ankunft von Lionel Messi. Die Fans des siebenfachen Ballon d'Or-Gewinners können das Eintreffen des argentinischen Weltmeisters kaum erwarten.,"https://derivates.kicker.de/image/upload/c_crop,x_0,y_199,w_3744,h_2106/w_1200,q_auto/v1/2023/07/13/1c42f1af-b622-4f7f-ba66-872949312986.jpeg",2023-07-13T11:03:07Z,,"Werbung und Tracking: Um dir relevante Inhalte und personalisierte Werbung anzubieten, setzen wir Cookies und andere Technologien ein. Damit messen wir, wie und womit du unsere Angebote nutzt. Diese … [+2186 chars]",,de,'Lionel Messi'
https://www.focus.de/politik/regierung-goennt-sch-inflationsbonus-die-meisten-minister-spenden-die-summe_id_198987000.html,https://www.focus.de/politik/regierung-goennt-sch-inflationsbonus-die-meisten-minister-spenden-die-summe_id_198987000.html,0,www.focus.de,„Dreisteste Lohnerhöhung des Jahres“ - Regierung gönnt sich Inflationsbonus - die meisten Minister spenden die Summe,"Das ""Gesetz zur Anpassung der Bundesbesoldung und -versorgung“ wird gerade von der Regierung im Kabinett beschlossen. Damit sichern sich Bundeskanzler Olaf Scholz und seine Minister einen Inflationsbonus von 3000 Euro zu. Die Opposition tobt, dabei will der G…",https://p6.focus.de/img/fotos/id_198990871/die-ampel-regierung.jpg?im=Crop%3D%280%2C289%2C3463%2C1731%29%3BResize%3D%281200%2C627%29&impolicy=perceptual&quality=mediumHigh&hash=d5bf336a2cd54737af0f828daaa06100c3c272ac24c3d8ac10894f3827de81ba,2023-07-13T11:40:53Z,,"Das ""Gesetz zur Anpassung der Bundesbesoldung und -versorgung wird gerade von der Regierung im Kabinett beschlossen. Damit sichern sich Bundeskanzler Olaf Scholz und seine Minister einen Inflationsbo… [+2869 chars]",,de,'Bettina Stark-Watzinger'
https://www.n-tv.de/politik/23-45-Selenskyj-sieht-Ausweitung-des-G7-Sicherheitspakts--article24260796.html,https://www.n-tv.de/politik/23-45-Selenskyj-sieht-Ausweitung-des-G7-Sicherheitspakts--article24260796.html,0,www.n-tv.de,Ukraine-Krieg im Liveticker: +++ 23:45 Selenskyj sieht Ausweitung des G7-Sicherheitspakts +++,"Berlin, Washington, Br\u00fcssel - \u00fcberall. n-tv berichtet von allen wichtigen Schaupl\u00e4tzen der Innen- und Au\u00dfenpolitik.",https://bilder2.n-tv.de/img/incoming/crop23332537/9041326157-cImg_16_9-w1200/Liveticker1-grau-1-Kopie.jpg,2023-07-13T23:33:36Z,,Der ukrainische Präsident Wolodymyr Selenskyj sieht breite internationale Unterstützung für einen Sicherheitspakt zugunsten seines Landes über die G7-Staaten hinaus. Der Gruppe sieben großer westlich… [+35018 chars],,de,'Selenskyj'
https://www.morgenpost.de/politik/article238947861/putin-macht-russland-fehler-general.html,https://www.morgenpost.de/politik/article238947861/putin-macht-russland-fehler-general.html,0,www.morgenpost.de,Operation Machterhalt: Putins nächster Fehler: Rauswurf von General sorgt für Ärger,Nach dem Aufstand wackelt Putins Macht in Russland. Kritik wird im Keim erstickt. Nun trifft es einen beliebten General – mit heftigen Folgen.,https://img.morgenpost.de/img/politik/crop238947855/0882609023-w820-cv16_9-q85/8c724688-2257-11ee-94ca-be8be0d6bdc4.jpg,2023-07-14T16:24:50Z,,"Moskau.  In Russlands Armee brodelt es. Erst die Wagner-Rebellion, jetzt Kritik und Machtkämpfe innerhalb des Militärs und alles mehr oder minder öffentlich ausgetragen auf diversen Telegram-Kanälen.… [+6224 chars]",,de,'Putin'
