index,url,valid,domain,title,description,image,published,archive,content,quote,language,keyword
https://www.nzz.ch/wirtschaft/boni-bonanza-fuer-banker-nach-dem-exodus-hofft-der-finanzplatz-london-auf-ein-comeback-ld.1868878,https://www.nzz.ch/wirtschaft/boni-bonanza-fuer-banker-nach-dem-exodus-hofft-der-finanzplatz-london-auf-ein-comeback-ld.1868878,0,www.nzz.ch,Boni-Bonanza für Banker: Nach dem Exodus hofft der Finanzplatz London auf ein Comeback,Nach dem Brexit fällt in London der EU-Deckel für Banker-Boni: Die Labour-Regierung will auf dem Finanzplatz die Risikobereitschaft befeuern und dadurch die Wirtschaft ankurbeln. Kann die Strategie aufgehen?,"https://img.nzz.ch/2025/01/31/f4496073-47f5-4197-90f5-f6c978d91c88.jpeg?width=1200&height=675&fit=bounds&quality=75&auto=webp&crop=5356,3013,x0,y818&wmark=nzz",2025-02-04T04:30:00Z,http://archive.md/20250204064422/https://www.nzz.ch/wirtschaft/boni-bonanza-fuer-banker-nach-dem-exodus-hofft-der-finanzplatz-london-auf-ein-comeback-ld.1868878,"Investmentbanker in der Londoner City freuen sich über höhere Boni doch hält die Regierung auch für normalsterbliche Briten ein Zückerchen bereit.
Während des «Dry January» hatten in britischen Pubs… [+5821 chars]",,de,'nan nan'
https://www.zeit.de/politik/ausland/2025-02/fossile-energien-us-senat-bestaetigung-chris-wright-energieminister,https://www.zeit.de/politik/ausland/2025-02/fossile-energien-us-senat-bestaetigung-chris-wright-energieminister,0,www.zeit.de,Trumps Kabinett: US-Senat bestätigt Chris Wright als Energieminister,Der US-Senat hat für den CEO eines Öldienstleisters als neuen Energieminister gestimmt. Chris Wright gilt als Gegner der Bemühungen im Kampf gegen den Klimawandel.,https://img.zeit.de/administratives/sharing/fallback-image/wide__1300x731,2025-02-04T05:38:46Z,,"Chris Wright, CEO des US-Öldienstleisters Liberty Energy, ist vom US-Senat als Energieminister der Vereinigten Staaten bestätigt worden. Der Senat stimmte der Nominierung von US-Präsident Donald Trum… [+738 chars]",,de,'Chris Wright'
https://www.zeit.de/2025/05/marine-le-pen-frankreich-rechtspopulismus-elon-musk,https://www.zeit.de/2025/05/marine-le-pen-frankreich-rechtspopulismus-elon-musk,0,www.zeit.de,Marine Le Pen: Nicht mit ihr,Viele europäische Rechtspopulisten suchen die Nähe zu US-Präsident Donald Trump. Marine Le Pen dagegen geht bewusst auf Distanz. Dahinter steckt strategisches Kalkül.,https://img.zeit.de/2025/05/nicht-mit-ihr-bild-1/wide__1300x731,2025-02-04T06:03:18Z,http://archive.md/20250205170907/https://www.zeit.de/2025/05/marine-le-pen-frankreich-rechtspopulismus-elon-musk,"Marine Le Pen hat nicht mit Elon Musk auf X gesprochen. Sie ist auch nicht zur Amtseinführung von Donald Trump nach Washington gereist. Genauso wenig wie Jordan Bardella, der Vorsitzende ihrer Partei… [+721 chars]",,de,'Le Pen'
https://www.stern.de/lifestyle/leute/prinzessin-kate-teilt-kraftvolle-botschaft-zum-weltkrebstag-35436504.html,https://www.stern.de/lifestyle/leute/prinzessin-kate-teilt-kraftvolle-botschaft-zum-weltkrebstag-35436504.html,0,www.stern.de,Eigene Diagnose: Prinzessin Kate teilt kraftvolle Botschaft zum Weltkrebstag,"Prinzessin Kate meldet sich zum Weltkrebstag mit einem beeindruckenden Foto, das von ihrem jüngsten Sohn Prinz Louis gemacht wurde.",https://image.stern.de/35436508/t/oJ/v2/w1440/r1.7778/-/prinzessin-kate-weltkrebstag.jpg,2025-02-04T07:27:00Z,https://web.archive.org/web/20250205141010/https://www.stern.de/lifestyle/leute/prinzessin-kate-teilt-kraftvolle-botschaft-zum-weltkrebstag-35436504.html,"Kopiere den aktuellen Link
Prinzessin Kate meldet sich zum Weltkrebstag mit einem beeindruckenden Foto. Geschossen hat das ihr jüngster Sohn Prinz Louis.
Zum Weltkrebstag am 4. Februar hat sich Pri… [+1742 chars]",,de,'Prinz Louis'
https://www.brigitte.de/aktuell/-america-s-got-talent---heidi-klum-ist-bei-der-20--staffel-nicht-dabei-13941394.html,https://www.brigitte.de/aktuell/-america-s-got-talent---heidi-klum-ist-bei-der-20--staffel-nicht-dabei-13941394.html,0,www.brigitte.de,"""America's Got Talent"": Heidi Klum ist bei der 20. Staffel nicht dabei","Ausgerechnet in der Jubiläumsstaffel von ""America's Got Talent"" wird Heidi Klum nicht am Jurypult sitzen.",https://image.brigitte.de/13941396/t/Hm/v1/w1440/r1.7778/-/04--heidi-klum-ist-bei-der-20--staffel-nicht-dabei---1-1---spoton-article-1085847.jpg,2025-02-04T07:28:00Z,https://web.archive.org/web/20250209104810/https://www.brigitte.de/aktuell/-america-s-got-talent---heidi-klum-ist-bei-der-20--staffel-nicht-dabei-13941394.html,"Ausgerechnet in der Jubiläumsstaffel von ""America's Got Talent"" wird Heidi Klum nicht am Jurypult sitzen.
Heidi Klum (51) ist überraschend nicht mehr Teil der Jury von ""America's Got Talent"". Das ve… [+2383 chars]",,de,'Heidi Klum'
https://www.focus.de/finanzen/banken/entgegen-dem-eigenen-wahlprogramm-koennen-aus-dem-euro-nicht-mehr-austreten-warum-weidel-die-rolle-rueckwaerts-macht_f8a10544-9434-4100-bb3b-f7db04c04bd5.html,https://www.focus.de/finanzen/banken/entgegen-dem-eigenen-wahlprogramm-koennen-aus-dem-euro-nicht-mehr-austreten-warum-weidel-die-rolle-rueckwaerts-macht_f8a10544-9434-4100-bb3b-f7db04c04bd5.html,0,www.focus.de,Entgegen dem eigenen Wahlprogramm - „Können aus dem Euro nicht mehr austreten“: Warum Weidel die Rolle rückwärts macht,Der Austritt aus dem Euro ist seit jeher eine der Kernforderungen der AfD und steht auch noch im aktuellen Wahlprogramm. Doch Parteichefin Alice Weidel macht jetzt in einem Interview einen Rückzieher – warum?,https://quadro.burda-forward.de/ctf/61b45d21-fca9-4a5e-8562-5f6e96e7dbbe.53e02762-7bca-4090-8e35-3a5786e6c117.jpeg?im=Resize%3D%281200%2C630%29&hash=66512fb279be674083fb47487d81f54140494b8955bdf080d941e2bc8790a0d9,2025-02-04T11:44:00Z,,"Es sind neue Töne, die Alice Weidel am vergangenen Freitag anschlägt. An dem Tag, an der Bundestag über das umstrittene Zustrombegrenzungsgesetz abstimmt, spricht sie mit dem Finanz-Influencer Marc F… [+8737 chars]",,de,'Alice Weidel'
https://www.stern.de/news/steinmeier-ordnet-trauerstaatsakt-fuer-verstorbenen-alt-bundespraesidenten-koehler-an-35438312.html,https://www.stern.de/news/steinmeier-ordnet-trauerstaatsakt-fuer-verstorbenen-alt-bundespraesidenten-koehler-an-35438312.html,0,www.stern.de,Steinmeier ordnet Trauerstaatsakt für verstorbenen Alt-Bundespräsidenten Köhler an,"In Gedenken an den verstorbenen Alt-Bundespräsidenten Horst Köhler soll es einen Trauerstaatsakt geben. Diesen ordnete Bundespräsident Frank-Walter Steinmeier an, wie das Präsidialamt am Dienstag mitteilte. Wann und wo der Trauerstaatsakt stattfinden soll, wa…",https://image.stern.de/35438314/t/NC/v1/w1440/r1.7778/-/04--horst-koehler-im-jahr-2019---610d1e0a3b34b96e.jpg,2025-02-04T11:54:17Z,,"Kopiere den aktuellen Link
In Gedenken an den verstorbenen Alt-Bundespräsidenten Horst Köhler soll es einen Trauerstaatsakt geben. Diesen ordnete Bundespräsident Frank-Walter Steinmeier an, wie das … [+1241 chars]",,de,'Wolfgang Schäuble'
https://www.n-tv.de/leute/Prinzessin-Kate-will-am-Weltkrebstag-motivieren-article25537404.html,https://www.n-tv.de/leute/Prinzessin-Kate-will-am-Weltkrebstag-motivieren-article25537404.html,0,www.n-tv.de,Kleiner Prinz Louis als Fotograf: Prinzessin Kate will am Weltkrebstag motivieren,Am 4. Februar ist Weltkrebstag. Prinzessin Kate nutzt dieses Datum für einen emotionalen Appell an alle von der Krankheit Betroffenen. Das berührt ihre Fans. Erstaunen löst aber ein zur Botschaft gehörendes Foto aus.,https://www.n-tv.de/img/incoming/crop25537409/2681328499-cImg_16_9-w1200/imago799459989.jpg,2025-02-04T12:01:18Z,,Am 4. Februar ist Weltkrebstag. Prinzessin Kate nutzt dieses Datum für einen emotionalen Appell an alle von der Krankheit Betroffenen. Das berührt ihre Fans. Erstaunen löst aber ein zur Botschaft geh… [+1919 chars],,de,'Prinzessin Kate'
https://www.bild.de/unterhaltung/royals-adel/prinzessin-kates-neues-mutmacher-foto-starke-botschaft-von-prinz-williams-ehefrau-67a1c9b702343b32663bde02,https://www.bild.de/unterhaltung/royals-adel/prinzessin-kates-neues-mutmacher-foto-starke-botschaft-von-prinz-williams-ehefrau-67a1c9b702343b32663bde02,0,www.bild.de,Ein Jahr nach Krebs-Diagnose - Das Geheimnis hinter Kates neuem Mutmacher-Foto,"Zum Weltkrebstag teilt Prinzessin Kate einen privaten Schnappschuss mit rührender Botschaft, die gleich aus mehreren Gründen mitten ins Herz trifft.","https://images.bild.de/67a1c9b702343b32663bde02/8fa4e8c132a71e8fcbf7eb3fe3015fee,471f328a?w=1280",2025-02-04T12:13:19Z,https://web.archive.org/web/20250207165457/https://www.bild.de/unterhaltung/royals-adel/prinzessin-kates-neues-mutmacher-foto-starke-botschaft-von-prinz-williams-ehefrau-67a1c9b702343b32663bde02,"So sehen Sieger aus! Prinzessin Kate teilt zum Weltkrebstag am 4. Februar ein neues, ganz privates Foto von sich. Der seltene Schnappschuss trifft gleich aus mehreren Gründen mitten ins Herz.
Genau … [+2824 chars]",,de,'Prinz Louis'
https://www.stern.de/lifestyle/leute/britisches-koenigshaus--weltkrebstag--prinzessin-kates-nachricht-an-betroffene-35438628.html,https://www.stern.de/lifestyle/leute/britisches-koenigshaus--weltkrebstag--prinzessin-kates-nachricht-an-betroffene-35438628.html,0,www.stern.de,Britisches Königshaus: Weltkrebstag: Prinzessin Kates Nachricht an Betroffene,Die Diagnose Krebs erschütterte vor einem Jahr auch das Leben der Royals. Prinzessin Kate teilt nach ihrer Therapie eine Nachricht zum Weltkrebstag - und veröffentlicht ein besonderes Foto.,https://image.stern.de/35438630/t/jp/v1/w1440/r1.7778/-/04--h56z7nzdc2v6axs2048jpeg---a9b4fccb7c701525.jpg,2025-02-04T13:20:54Z,,"Kopiere den aktuellen Link
Die Diagnose Krebs erschütterte vor einem Jahr auch das Leben der Royals. Prinzessin Kate teilt nach ihrer Therapie eine Nachricht zum Weltkrebstag - und veröffentlicht ei… [+1078 chars]",,de,'Prinz Louis'
https://www.tagesspiegel.de/gesellschaft/britisches-konigshaus-weltkrebstag-prinzessin-kates-nachricht-an-betroffene-13143325.html,https://www.tagesspiegel.de/gesellschaft/britisches-konigshaus-weltkrebstag-prinzessin-kates-nachricht-an-betroffene-13143325.html,0,www.tagesspiegel.de,Britisches Königshaus: Weltkrebstag: Prinzessin Kates Nachricht an Betroffene,Die Diagnose Krebs erschütterte vor einem Jahr auch das Leben der Royals. Prinzessin Kate teilt nach ihrer Therapie eine Nachricht zum Weltkrebstag - und veröffentlicht ein besonderes Foto.,https://www.tagesspiegel.de/images/13143322/alternates/BASE_16_9_W1400/1738675315000/prinzessin-kate.jpeg,2025-02-04T13:21:55Z,https://web.archive.org/web/20250205012751/https://www.tagesspiegel.de/gesellschaft/britisches-konigshaus-weltkrebstag-prinzessin-kates-nachricht-an-betroffene-13143325.html,"Die britische Königsfamilie macht zum Weltkrebstag anderen Betroffenen Mut. Prinzessin Kate (43) ließ ein Foto veröffentlichen, das nach Angaben des Palasts von ihrem jüngsten Sohn Prinz Louis (6) au… [+2287 chars]",,de,'Prinzessin Kate'
https://orf.at/stories/3383859/,https://orf.at/stories/3383859/,0,orf.at,Prinzessin Kate wendet sich an Betroffene,,https://orf.at/mojo/1_4_1/storyserver//news/common/images/og-fallback-news.png,2025-02-04T13:30:49Z,,"Die britische Königsfamilie macht zum Weltkrebstag anderen Betroffenen Mut. Prinzessin Kate (43) ließ ein Foto veröffentlichen, das nach Angaben des Palasts von ihrem jüngsten Sohn Prinz Louis aufgen… [+851 chars]",,de,'Prinzessin Kate'
https://www.sueddeutsche.de/politik/markus-soeder-bart-de-wever-rechtspopulismus-brandmauer-li.3195499,https://www.sueddeutsche.de/politik/markus-soeder-bart-de-wever-rechtspopulismus-brandmauer-li.3195499,0,www.sueddeutsche.de,"Belgien: Der neue Premier, ein Vorbild für die CSU?",Markus Söder nennt den neuen belgischen Regierungschef einen „Rechtspopulisten“. Doch in dieses Schema passt Bart De Wever schlecht. Er ist ein europäischer Partner für die Union – und seine Brandmauer steht sehr fest.,https://www.sueddeutsche.de/2025/02/04/2539dfb8-633f-4fb3-987e-6c69b8822870.jpeg?q=60&fm=webp&width=1200&rect=0%2C0%2C3000%2C1687,2025-02-04T13:54:13Z,,"Tatsächlich hat Bart De Wever mehrmals zu erkennen gegeben, dass die CSU sein großes Vorbild ist. Und in gewisser Weise taugt De Wever auch als Vorbild für CDU und CSU und nicht zuletzt für Markus Sö… [+4638 chars]",,de,'Le Pen'
https://www.tagesspiegel.de/politik/habeck-fordert-eine-vollstreckungsoffensive-nun-wollen-auch-die-grunen-migrationspolitisch-punkten-13142689.html,https://www.tagesspiegel.de/politik/habeck-fordert-eine-vollstreckungsoffensive-nun-wollen-auch-die-grunen-migrationspolitisch-punkten-13142689.html,0,www.tagesspiegel.de,Habeck fordert eine „Vollstreckungsoffensive“: Nun wollen auch die Grünen migrationspolitisch punkten,"Je grüner eine Position, desto unverfänglicher klingt sie. Diesen Effekt versucht Robert Habeck für sich zu nutzen. Mit seinem Zehn-Punkte-Plan hält er die Themen Asyl und Migration in der Debatte.",https://www.tagesspiegel.de/images/13120222/alternates/BASE_16_9_W1400/1738672516000/robert-habeck.jpeg,2025-02-04T14:12:32Z,http://archive.md/20250204160502/https://www.tagesspiegel.de/politik/habeck-fordert-eine-vollstreckungsoffensive-nun-wollen-auch-die-grunen-migrationspolitisch-punkten-13142689.html,"Wer die Themen der Rechten übernimmt, stärkt die Rechten: Dieser Satz ging Grünen bislang schnell über die Lippen, wenn es gegen Konservative zu wettern galt, die bei Asyl und Migration zu punkten ve… [+3745 chars]",,de,'Robert Habeck'
https://www.tagesspiegel.de/gesellschaft/anlasslich-des-weltkrebstags-prinzessin-kate-sendet-mutmachende-nachricht-an-andere-betroffene-13143838.html,https://www.tagesspiegel.de/gesellschaft/anlasslich-des-weltkrebstags-prinzessin-kate-sendet-mutmachende-nachricht-an-andere-betroffene-13143838.html,0,www.tagesspiegel.de,Anlässlich des Weltkrebstags: Prinzessin Kate sendet mutmachende Nachricht an andere Betroffene,Das britische Königshaus will damit ein Zeichen setzen. Die 43-Jährige machte ihre Krebsdiagnose im März öffentlich und unterzog sich einer Chemotherapie. Auch König Charles ist wegen der Krankheit in Behandlung.,https://www.tagesspiegel.de/images/13143901/alternates/BASE_16_9_W1400/1738677941000/britische-prinzessin-von-wales.jpeg,2025-02-04T14:23:14Z,,"Die britische Königsfamilie macht zum Weltkrebstag anderen Betroffenen Mut. Prinzessin Kate (43) ließ ein Foto veröffentlichen, das nach Angaben des Palasts von ihrem jüngsten Sohn Prinz Louis (6) au… [+1977 chars]",,de,'Prinzessin Kate'
https://www.stern.de/lifestyle/leute/prinzessin-kate--hand-in-hand-per-bus-durch-london-35439420.html,https://www.stern.de/lifestyle/leute/prinzessin-kate--hand-in-hand-per-bus-durch-london-35439420.html,0,www.stern.de,Prinzessin Kate: Hand in Hand per Bus durch London,Prinzessin Kate begleitete Grundschüler bei einem besonderen Ausflug zur National Portrait Gallery - inklusive gemeinsamer Busfahrt.,https://image.stern.de/35439424/t/Bt/v1/w1440/r1.7778/-/04--hand-in-hand-per-bus-durch-london---16-9---spoton-article-1085911.jpg,2025-02-04T15:19:00Z,https://web.archive.org/web/20250207074216/https://www.stern.de/lifestyle/leute/prinzessin-kate--hand-in-hand-per-bus-durch-london-35439420.html,"Kopiere den aktuellen Link
Prinzessin Kate begleitete Grundschüler bei einem besonderen Ausflug zur National Portrait Gallery - inklusive gemeinsamer Busfahrt.
Prinzessin Kate (43) bewies einmal me… [+3604 chars]",,de,'Prinzessin Kate'
https://www.diepresse.com/19328854/der-gigantische-schatz-unter-den-schlachtfeldern-der-ukraine,https://www.diepresse.com/19328854/der-gigantische-schatz-unter-den-schlachtfeldern-der-ukraine,0,www.diepresse.com,Der gigantische Schatz unter den Schlachtfeldern der Ukraine,US-Präsident Donald Trump will die Militärhilfe für die Ukraine gegen seltene Erden eintauschen. Denn die Ukraine verfügt über riesige Vorkommen an wertvollen Mineralien. Putin will sie als Kriegsbeute.,https://img.diepresse.com/public/incoming/n7uwms-E93D0C5E-7BBC-4503-A8C9-D4CBDFE24E45.jpg/alternates/DPR_SOCIAL_NACHRICHTEN/E93D0C5E-7BBC-4503-A8C9-D4CBDFE24E45.jpg,2025-02-04T16:38:34Z,,US-Präsident Donald Trump will die Militärhilfe für die Ukraine gegen seltene Erden eintauschen. Denn die Ukraine verfügt über riesige Vorkommen an wertvollen Mineralien. Putin will sie als Kriegsbeu… [+3982 chars],,de,'Donald Trump'
https://www.welt.de/sport/article255342224/NFL-Als-erster-amtierender-Praesident-Trump-beim-Super-Bowl-im-Stadion.html,https://www.welt.de/sport/article255342224/NFL-Als-erster-amtierender-Praesident-Trump-beim-Super-Bowl-im-Stadion.html,0,www.welt.de,Als erster amtierender Präsident – Trump beim Super Bowl im Stadion,"Diese Bühne lässt er sich nicht nehmen. Donald Trump wird als erster amtierender Präsident beim Super Bowl im Stadion sein. Wem er im NFL-Finale die Daumen drückt, macht er im Vorfeld deutlich.",https://img.welt.de/img/sport/mobile255342222/5107931697-ci16x9-w1200/Donald-Trump-Campaigns-For-President-In-Pennsylvania.jpg,2025-02-04T17:37:52Z,,"Diese Bühne lässt er sich nicht nehmen. Donald Trump wird als erster amtierender Präsident beim Super Bowl im Stadion sein. Wem er im NFL-Finale die Daumen drückt, macht er im Vorfeld deutlich.Donald… [+2983 chars]",,de,'Donald Trump'
https://www.n-tv.de/wirtschaft/War-es-das-jetzt-mit-Tesla-article25539120.html,https://www.n-tv.de/wirtschaft/War-es-das-jetzt-mit-Tesla-article25539120.html,0,www.n-tv.de,Schlechte Zahlen aus Kalifornien: War es das jetzt mit Tesla?,Teslas Neuzulassungen in Kalifornien brechen im vierten Quartal ein. Das dürfte nicht nur an Elon Musks radikalem Auftreten liegen.,https://www.n-tv.de/img/incoming/crop25539166/4551324876-cImg_16_9-w1200/503294861.jpg,2025-02-04T18:21:51Z,http://archive.md/20250206084534/https://www.n-tv.de/wirtschaft/War-es-das-jetzt-mit-Tesla-article25539120.html,"Teslas Neuzulassungen in Kalifornien brechen im vierten Quartal ein. Das dürfte nicht nur an Elon Musks radikalem Auftreten liegen.
In der Debatte über einen möglichen Imageschaden für Tesla durch E… [+4037 chars]",,de,'Gavin Newsom'
https://www.faz.net/aktuell/feuilleton/sandra-bullock-warnt-fans-vor-fakeprofilen-im-netz-110275878.html,https://www.faz.net/aktuell/feuilleton/sandra-bullock-warnt-fans-vor-fakeprofilen-im-netz-110275878.html,0,www.faz.net,Sandra Bullock warnt Fans vor Fakeprofilen von ihr im Internet,"Sandra Bullock warnt ihre Fans vor Fakeprofilen, die sich als sie ausgeben. Kriminelle kapern auch die Identität ihrer Schwester Gesine. Die moniert, dass sie von Facebook keine Unterstützung bekomme. Ob Mark Zuckerberg zuhört?",https://media1.faz.net/ppmedia/aktuell/gesellschaft/793231096/1.10276049/facebook_teaser/sandra-bullock-hier.jpg,2025-02-04T19:04:39Z,,"Neu ist die Betrugsmasche nicht, aber sie läuft und läuft und läuft und fordert Opfer. Je prominenter der Name, der dabei im Spiel ist, je leichter sich mit Künstlicher Intelligenz die Existenz einer… [+3361 chars]",,de,'Mark Zuckerberg'
https://www.n-tv.de/politik/23-31-Selenskyj-45-100-ukrainische-Soldaten-gefallen--article25539755.html,https://www.n-tv.de/politik/23-31-Selenskyj-45-100-ukrainische-Soldaten-gefallen--article25539755.html,0,www.n-tv.de,Ukraine-Krieg im Liveticker: +++ 23:31 Selenskyj: 45.100 ukrainische Soldaten gefallen +++,Lesen Sie alle aktuellen Entwicklungen und Nachrichten über den russischen Angriffskrieg auf die Ukraine im Liveticker von ntv.de.,https://www.n-tv.de/img/incoming/crop25117070/4231326595-cImg_16_9-w1200/Ukraine-Liveticker.jpg,2025-02-04T19:15:00Z,,45.100 ukrainische Soldatinnen haben nach Angaben von Präsident Selenskyj im Krieg mit Russland ihr Leben gelassen. Das sagt Selenskyj in einem Interview mit dem britischen Moderator Piers Morgan. 39… [+35726 chars],,de,'Selenskyj'
https://www.stern.de/news/erdogan-lobt-syriens-uebergangspraesidenten-fuer--starkes-engagement--gegen-terrorismus-35439956.html,https://www.stern.de/news/erdogan-lobt-syriens-uebergangspraesidenten-fuer--starkes-engagement--gegen-terrorismus-35439956.html,0,www.stern.de,"Erdogan lobt Syriens Übergangspräsidenten für ""starkes Engagement"" gegen Terrorismus","Der türkische Präsident Recep Tayyip Erdogan hat den neuen syrischen Übergangspräsidenten Ahmed al-Scharaa bei einem Besuch in Ankara für sein ""starkes Engagement"" im Kampf gegen den Terrorismus gelobt. Die Türkei sei bereit, Syrien im Kampf ""gegen alle Arten…",https://image.stern.de/35439958/t/Xh/v1/w1440/r1.7778/-/04--ahmed-alscharaa-links-und-recep-tayyip-erdogan---32c26863ac1296fb.jpg,2025-02-04T19:46:43Z,,"Kopiere den aktuellen Link
Der türkische Präsident Recep Tayyip Erdogan hat den neuen syrischen Übergangspräsidenten Ahmed al-Scharaa bei einem Besuch in Ankara für sein ""starkes Engagement"" im Kamp… [+1890 chars]",,de,'Recep Tayyip Erdogan'
https://www.diepresse.com/19329478/gesundheitsminister-kandidat-kennedy-nimmt-wichtige-huerde-im-senat,https://www.diepresse.com/19329478/gesundheitsminister-kandidat-kennedy-nimmt-wichtige-huerde-im-senat,0,www.diepresse.com,Gesundheitsminister-Kandidat Kennedy nimmt wichtige Hürde im Senat,Der Finanzausschuss stimmte mit knapper Mehrheit für Robert F. Kennedy Jr.. Demokratische Senatoren kritisierten ihn für seine teils abstrusen Aussagen scharf.,https://img.diepresse.com/public/incoming/ygqawv-US-SENATE-HOLDS-CONFIRMATION-HEARINGS-FOR-HHS-SECRETARY-NOMINEE/alternates/DPR_SOCIAL_NACHRICHTEN/US-SENATE-HOLDS-CONFIRMATION-HEARINGS-FOR-HHS-SECRETARY-NOMINEE,2025-02-04T20:14:45Z,,"Der Finanzausschuss stimmte mit knapper Mehrheit für Robert F. Kennedy Jr.. Demokratische Senatoren kritisierten ihn für seine teils abstrusen Aussagen scharf.
Der hochumstrittene Kandidat von US-Pr… [+4674 chars]",,de,'Robert Kennedy'
https://www.stern.de/news/umstrittene-trump-kandidaten-kennedy-und-gabbard-nehmen-wichtige-huerde-im-senat-35439784.html,https://www.stern.de/news/umstrittene-trump-kandidaten-kennedy-und-gabbard-nehmen-wichtige-huerde-im-senat-35439784.html,0,www.stern.de,Umstrittene Trump-Kandidaten Kennedy und Gabbard nehmen wichtige Hürde im Senat,Zwei hochumstrittene Kandidaten von US-Präsident Donald Trump für das Amt des Gesundheitsministers und der Geheimdienstdirektorin haben am Dienstag eine wichtige parlamentarische Hürde genommen. Der Finanzausschuss des Senats stimmte mit seiner knappen republ…,https://image.stern.de/35440026/t/cv/v1/w1440/r1.7778/-/04--robert-f-kennedy-jr-bei-seiner-anhoerung-durch-den-finanzausschuss---4c55d3cf4545b241.jpg,2025-02-04T20:54:12Z,,"Kopiere den aktuellen Link
Zwei hochumstrittene Kandidaten von US-Präsident Donald Trump für das Amt des Gesundheitsministers und der Geheimdienstdirektorin haben am Dienstag eine wichtige parlament… [+4230 chars]",,de,'nan nan'
https://www.stern.de/news/trump-kuendigt--maximalen-druck--auf-den-iran-an-35440030.html,https://www.stern.de/news/trump-kuendigt--maximalen-druck--auf-den-iran-an-35440030.html,0,www.stern.de,"Trump kündigt ""maximalen Druck"" auf den Iran an","US-Präsident Donald Trump hat vor dem Hintergrund des Atomkonflikts mit dem Iran angekündigt, zur Politik des ""maximalen Drucks"" gegen Teheran zurückzukehren. Er hoffe jedoch, dass es nicht nötig sein werde, diese oft anzuwenden, sagte er am Dienstag vor Jour…",https://image.stern.de/35440032/t/tU/v1/w1440/r1.7778/-/04--donald-trump-im-weissen-haus---9caedb59fb9bf58e.jpg,2025-02-04T21:21:21Z,,"Kopiere den aktuellen Link
US-Präsident Donald Trump hat vor dem Hintergrund des Atomkonflikts mit dem Iran angekündigt, zur Politik des ""maximalen Drucks"" gegen Teheran zurückzukehren. Er hoffe jed… [+2263 chars]",,de,'Donald Trump'
https://www.stern.de/kultur/heidi-klum--die-wichtigsten-menschen-im-klumiversum-35437836.html,https://www.stern.de/kultur/heidi-klum--die-wichtigsten-menschen-im-klumiversum-35437836.html,0,www.stern.de,"Fotostrecke: Das ""Klumiversum"" – die Menschen an Heidis Seite","Eine Frau und ihr Netzwerk: Was Heidi Klum macht, wofür sie steht und wer an ihrer Seite ist (oder war), zeigt die Fotogalerie.",https://image.stern.de/35437796/t/tV/v2/w1440/r1.7778/-/heidi-klum-2.jpg,2025-02-04T23:01:00Z,http://archive.md/20250206165611/https://www.stern.de/kultur/heidi-klum--die-wichtigsten-menschen-im-klumiversum-35437836.html,"Kopiere den aktuellen Link
Eine Frau und ihr Netzwerk: Was Heidi Klum macht, wofür sie steht und wer an ihrer Seite ist (oder war), zeigt die Fotogalerie.
Vor mehr als 30 Jahren wurde sie in einer … [+1793 chars]",,de,'Heidi Klum'
https://www.brigitte.de/aktuell/heidi-klum--traumatische-erlebnisse-bei--gntm----nicht-verwunderlich--13942038.html,https://www.brigitte.de/aktuell/heidi-klum--traumatische-erlebnisse-bei--gntm----nicht-verwunderlich--13942038.html,0,www.brigitte.de,"Heidi Klum: Traumatische Erlebnisse bei ""GNTM""? ""Nicht verwunderlich""","""GNTM""-Chefin Heidi Klum spricht in einem Interview ausführlich über mangelnde Diversität in der Branche, Kritik an der Show und an ihr.",https://image.brigitte.de/13942040/t/Bc/v1/w1440/r1.7778/-/05--traumatische-erlebnisse-bei--gntm----nicht-verwunderlich----1-1---spoton-article-1085927.jpg,2025-02-04T23:06:00Z,,"""GNTM""-Chefin Heidi Klum spricht in einem Interview ausführlich über mangelnde Diversität in der Branche, Kritik an der Show und an ihr.
Am Donnerstag, dem 13. Februar, startet die große Jubiläumsst… [+4922 chars]",,de,'Heidi Klum'
