index,url,valid,domain,title,description,image,published,archive,content,quote,language,keyword
https://www.stern.de/lifestyle/leute/jeffrey-epstein-anklaegerin-virginia-giuffre-offenbar-schwer-verletzt-35601206.html,https://www.stern.de/lifestyle/leute/jeffrey-epstein-anklaegerin-virginia-giuffre-offenbar-schwer-verletzt-35601206.html,0,www.stern.de,"Missbrauchsfall: Epstein-Anklägerin nach schwerem Unfall: ""Nur noch vier Tage zu leben""","Virginia Giuffre sagte gegen Jeffrey Epstein aus und erklärte, als Minderjährige von Prince Andrew sexuell missbraucht worden zu sein. Nun hatte sie offenbar einen schweren Unfall.",https://image.stern.de/35601214/t/Zv/v2/w1440/r1.7778/-/virginia-giuffre--anklaegerin-von-jeffrey-epstein-und-prince-andrew.jpg,2025-04-01T00:22:00Z,http://archive.md/20250401082028/https://www.stern.de/lifestyle/leute/jeffrey-epstein-anklaegerin-virginia-giuffre-offenbar-schwer-verletzt-35601206.html,"Kopiere den aktuellen Link
Zur Merkliste hinzufügen
Virginia Giuffre sagte gegen Jeffrey Epstein aus und erklärte, als Minderjährige von Prince Andrew sexuell missbraucht worden zu sein. Nun hatte … [+9295 chars]",,de,'Jeffrey Epstein'
https://www.stern.de/lifestyle/leute/virginia-giuffre--prinz-andrews-klaegerin-kaempft-um-ihr-leben-35601840.html,https://www.stern.de/lifestyle/leute/virginia-giuffre--prinz-andrews-klaegerin-kaempft-um-ihr-leben-35601840.html,0,www.stern.de,Bekannte Klägerin: Sie warf Andrew Vergewaltigung vor – jetzt kämpft Virginia Giuffre um ihr Leben,Virginia Giuffre leidet offenbar unter aktuem Nierenversagen. Die Anklägerin von Prinz Andrew und Jeffrey Epstein hatte einen schweren Autounfall. Das ist über sie bekannt.,https://image.stern.de/35603082/t/QR/v2/w1440/r1.7778/-/virginiagiuffre.jpg,2025-04-01T07:42:07Z,,"Kopiere den aktuellen Link
Zur Merkliste hinzufügen
Virginia Giuffre leidet offenbar unter aktuem Nierenversagen. Die Anklägerin von Prinz Andrew und Jeffrey Epstein hatte einen schweren Autounfall… [+3804 chars]",,de,'Prinz Andrew'
https://www.n-tv.de/leute/Prinz-Andrew-Klaegerin-Virginia-Giuffre-soll-im-Sterben-liegen-article25670373.html,https://www.n-tv.de/leute/Prinz-Andrew-Klaegerin-Virginia-Giuffre-soll-im-Sterben-liegen-article25670373.html,0,www.n-tv.de,Nierenversagen nach Unfall: Prinz-Andrew-Klägerin Virginia Giuffre soll im Sterben liegen,"Virginia Giuffre wird bekannt durch den Missbrauchsskandal um Prinz Andrew. Nach einem schweren Autounfall meldet sie sich nun aus dem Krankenhaus und gibt an, dass Ärzte ihr ""nur noch vier Tage"" geben. würden.",https://www.n-tv.de/img/incoming/crop25670375/449132459-cImg_16_9-w1200/imago383617222.jpg,2025-04-01T08:56:48Z,https://web.archive.org/web/20250401115208/https://www.n-tv.de/leute/Prinz-Andrew-Klaegerin-Virginia-Giuffre-soll-im-Sterben-liegen-article25670373.html,"Virginia Giuffre wird bekannt durch den Missbrauchsskandal um Prinz Andrew. Nach einem schweren Autounfall meldet sie sich nun aus dem Krankenhaus und gibt an, dass Ärzte ihr ""nur noch vier Tage"" geb… [+2498 chars]",,de,'Jeffrey Epstein'
https://www.morgenpost.de/panorama/article408685138/epstein-opfer-postet-schock-foto-habe-noch-vier-tage-zu-leben.html,https://www.morgenpost.de/panorama/article408685138/epstein-opfer-postet-schock-foto-habe-noch-vier-tage-zu-leben.html,0,www.morgenpost.de,Epstein-Opfer postet Schock-Foto: „Habe noch vier Tage zu leben“,Durch den Prozess um Jeffrey Epstein und Prinz Andrew wurde Virginia Giuffre weltbekannt. Doch nun liegt sie offenbar im Sterben.,https://img.sparknews.funkemedien.de/401600200/401600200_1743500879_v16_9_1600.jpeg,2025-04-01T10:08:25Z,http://archive.md/20250401103102/https://www.morgenpost.de/panorama/article408685138/epstein-opfer-postet-schock-foto-habe-noch-vier-tage-zu-leben.html,"Berlin. Durch den Prozess um Jeffrey Epstein und Prinz Andrew wurde Virginia Giuffre weltbekannt. Doch nun liegt sie offenbar im Sterben.
Virginia Giuffre wurde weltbekannt, als sie im Prozess um de… [+2516 chars]",,de,'Jeffrey Epstein'
https://www.stern.de/lifestyle/leute/kid-rock-und-donald-trump-im-oval-office--was-steckt-hinter-diesem-schraegen-auftritt--35602882.html,https://www.stern.de/lifestyle/leute/kid-rock-und-donald-trump-im-oval-office--was-steckt-hinter-diesem-schraegen-auftritt--35602882.html,0,www.stern.de,Kid Rock und Donald Trump im Oval Office: Was steckt hinter diesem schrägen Auftritt?,Was hat es mit dem Besuch von Kid Rock bei Donald Trump auf sich? Und warum dürften davon vor allem Swifties profitieren?,https://image.stern.de/35602886/t/IR/v1/w1440/r1.7778/-/01--was-steckt-hinter-diesem-schraegen-auftritt----16-9---spoton-article-1091485.jpg,2025-04-01T11:11:00Z,https://web.archive.org/web/20250401143906/https://www.stern.de/lifestyle/leute/kid-rock-und-donald-trump-im-oval-office--was-steckt-hinter-diesem-schraegen-auftritt--35602882.html,"Kopiere den aktuellen Link
Zur Merkliste hinzufügen
Was hat es mit dem Besuch von Kid Rock bei Donald Trump auf sich? Und warum dürften davon vor allem Swifties profitieren?
Der umstrittene Musike… [+1941 chars]",,de,'Taylor Swift'
https://www.stern.de/kultur/tv/synchronsprecher--deutsche-stimmen-von-us-stars-warnen-vor-stimm-robotern-35603146.html,https://www.stern.de/kultur/tv/synchronsprecher--deutsche-stimmen-von-us-stars-warnen-vor-stimm-robotern-35603146.html,0,www.stern.de,Synchronsprecher: Deutsche Stimmen von US-Stars warnen vor Stimm-Robotern,"Wenn Angelina Jolie, Daniel Radcliffe und SpongeBob Schwammkopf gemeinsam die Stimme erheben, droht Gefahr im Verzug. Stars der deutschen Synchronbranche suchen erstmals das Licht der Öffentlichkeit.",https://image.stern.de/35603148/t/Gr/v1/w1440/r1.7778/-/01--3foz4klly3v6axs2048jpeg---b8facd694e7b8ae9.jpg,2025-04-01T11:56:29Z,https://web.archive.org/web/20250401133213/https://www.stern.de/kultur/tv/synchronsprecher--deutsche-stimmen-von-us-stars-warnen-vor-stimm-robotern-35603146.html,"Kopiere den aktuellen Link
Zur Merkliste hinzufügen
Wenn Angelina Jolie, Daniel Radcliffe und SpongeBob Schwammkopf gemeinsam die Stimme erheben, droht Gefahr im Verzug. Stars der deutschen Synchro… [+2474 chars]",,de,'Angelina Jolie'
https://www.tagesspiegel.de/gesellschaft/synchronsprecher-deutsche-stimmen-von-us-stars-warnen-vor-stimm-robotern-13467892.html,https://www.tagesspiegel.de/gesellschaft/synchronsprecher-deutsche-stimmen-von-us-stars-warnen-vor-stimm-robotern-13467892.html,0,www.tagesspiegel.de,Synchronsprecher: Deutsche Stimmen von US-Stars warnen vor Stimm-Robotern,"Wenn Angelina Jolie, Daniel Radcliffe und SpongeBob Schwammkopf gemeinsam die Stimme erheben, droht Gefahr im Verzug. Stars der deutschen Synchronbranche suchen erstmals das Licht der Öffentlichkeit.",https://www.tagesspiegel.de/images/13467889/alternates/BASE_16_9_W1400/1743508666000/arena-synchron.jpeg,2025-04-01T11:57:46Z,https://web.archive.org/web/20250402050327/https://www.tagesspiegel.de/gesellschaft/synchronsprecher-deutsche-stimmen-von-us-stars-warnen-vor-stimm-robotern-13467892.html,"Namhafte deutsche Synchronstimmen von Hollywoodstars zeigen Gesicht, um vor der Bedrohung ihrer Branche durch Künstliche Intelligenz (KI) zu warnen. Du kennst diese Gesichter mit diesen Stimmen. Aber… [+2963 chars]",,de,'Angelina Jolie'
https://www.faz.net/aktuell/gesellschaft/ungluecke/epstein-opfer-virginia-roberts-giuffre-bei-schwerem-unfall-verletzt-110392885.html,https://www.faz.net/aktuell/gesellschaft/ungluecke/epstein-opfer-virginia-roberts-giuffre-bei-schwerem-unfall-verletzt-110392885.html,0,www.faz.net,Epstein-Skandal: Virginia Roberts Giuffre bei schwerem Unfall verletzt,"Virginia Roberts Giuffre, die die Ermittlungen gegen den Sexualstraftäter Jeffrey Epstein mit ins Rollen brachte, ist bei einem Verkehrsunfall schwer verletzt worden. Wie ernst steht es um sie?",https://media0.faz.net/ppmedia/aktuell/3727883138/1.10392888/facebook_teaser/virginia-roberts-giuffre-bei.jpg,2025-04-01T13:33:49Z,https://web.archive.org/web/20250401135214/https://www.faz.net/aktuell/gesellschaft/ungluecke/epstein-opfer-virginia-roberts-giuffre-bei-schwerem-unfall-verletzt-110392885.html,"Die Kalifornierin Virginia Roberts Giuffre, ein mutmaßliches Opfer des Sexual­straf­täters Jeffrey Epstein und seiner Mittäterin Ghislaine Maxwell, liegt angeblich im Sterben. Meine Nieren versagen, … [+1956 chars]",,de,'Jeffrey Epstein'
https://www.sueddeutsche.de/kultur/chat-gpt-ki-cartoons-comics-niedlicher-hitler-ethische-probleme-li.3229251,https://www.sueddeutsche.de/kultur/chat-gpt-ki-cartoons-comics-niedlicher-hitler-ethische-probleme-li.3229251,0,www.sueddeutsche.de,KI-Cartoons: Wie man sich die Welt schön malt,"Kampfpiloten im Stil der „Peanuts“, weinende Geflüchtete in Studio-Ghibli-Optik, ein niedlicher Adolf Hitler: Chat-GPT kann alle  Zeichenstile kopieren - und sogar Krieg, Sterben und menschliche Gräuel weichzeichnen.",https://www.sueddeutsche.de/2025/04/01/a910014f-8f35-45a0-8e45-93bec62e3e1e.jpeg?q=60&fm=webp&width=1200&rect=0%2C145%2C1024%2C576,2025-04-01T15:32:33Z,https://web.archive.org/web/20250401170345/https://www.sueddeutsche.de/kultur/chat-gpt-ki-cartoons-comics-niedlicher-hitler-ethische-probleme-li.3229251,"Kampfpiloten im Stil der Peanuts, weinende Geflüchtete in Studio-Ghibli-Optik, ein niedlicher Adolf Hitler: Chat-GPT kann alle  Zeichenstile kopieren - und sogar Krieg, Sterben und menschliche Gräuel… [+995 chars]",,de,'Adolf Hitler'
https://www.n-tv.de/leute/Kid-Rock-kaempft-mit-Trump-gegen-Ticket-Abzocke-article25671187.html,https://www.n-tv.de/leute/Kid-Rock-kaempft-mit-Trump-gegen-Ticket-Abzocke-article25671187.html,0,www.n-tv.de,Musiker besucht Oval Office: Kid Rock kämpft mit Trump gegen Ticket-Abzocke,Donald Trump holt sich für ein neues Dekret musikalische Unterstützung ins Weiße Haus. Gemeinsam mit seinem glühenden Fan Kid Rock geht der US-Präsident gegen Preiswucher auf dem Konzertticketmarkt vor. Schwarzhändlern soll damit das Handwerk gelegt werden.,https://www.n-tv.de/img/incoming/crop25671244/6511323332-cImg_16_9-w1200/imago808269569.jpg,2025-04-01T15:33:12Z,https://web.archive.org/web/20250401163206/https://www.n-tv.de/leute/Kid-Rock-kaempft-mit-Trump-gegen-Ticket-Abzocke-article25671187.html,Donald Trump holt sich für ein neues Dekret musikalische Unterstützung ins Weiße Haus. Gemeinsam mit seinem glühenden Fan Kid Rock geht der US-Präsident gegen Preiswucher auf dem Konzertticketmarkt v… [+3475 chars],,de,'Taylor Swift'
https://www.bild.de/unterhaltung/stars-und-leute/jeff-bezos-lauren-sanchez-luxus-hochzeits-shopping-in-mailand-67ea69481fbfdc58b2a6140e,https://www.bild.de/unterhaltung/stars-und-leute/jeff-bezos-lauren-sanchez-luxus-hochzeits-shopping-in-mailand-67ea69481fbfdc58b2a6140e,0,www.bild.de,Ihr Hochzeitskleid gibt’s nicht bei Amazon - Sagt Bezos’ Braut Ja zu Dolce & Gabbana?,Amazon-Gründer Jeff Bezos und Lauren Sánchez bereiten sich auf ihre glamouröse Hochzeit vor und shoppen Luxus-Mode bei Dolce & Gabbana in Mailand.,"https://images.bild.de/67ea69481fbfdc58b2a6140e/007a3a0d1a55ef589f0caffe4dc66a9e,3cb42bc7?w=1280",2025-04-01T15:50:39Z,,Die Hochzeitsvorbereitungen laufen auf Hochtouren. Im Juni wollen sich Amazon-Gründer Jeff Bezos (geschätztes Vermögen: rund 200 Milliarden US-Dollar) und Lauren Sánchez das Jawort geben. Dafür wird … [+2107 chars],,de,'Lauren Sánchez'
https://www.bild.de/unterhaltung/stars-und-leute/hitler-so-wurde-marlene-dietrich-zum-albtraum-des-einstigen-fuehrers-67dc2d20fbe9af1751bb32b5,https://www.bild.de/unterhaltung/stars-und-leute/hitler-so-wurde-marlene-dietrich-zum-albtraum-des-einstigen-fuehrers-67dc2d20fbe9af1751bb32b5,0,www.bild.de,Unveröffentlichte Bilder! - So wurde Weltstar Marlene Dietrich zu Hitlers Albtraum,"Lesen Sie, wie der deutsche Weltstar Marlene Dietrich zum schlimmsten Propaganda-Albtraum für Adolf Hitler wurde, weil sie ihn verabscheute.","https://images.bild.de/67dc2d20fbe9af1751bb32b5/d4898497613ab564b77791e842f94108,fc17fd46?w=1280",2025-04-01T19:24:13Z,https://web.archive.org/web/20250401195819/https://www.bild.de/unterhaltung/stars-und-leute/hitler-so-wurde-marlene-dietrich-zum-albtraum-des-einstigen-fuehrers-67dc2d20fbe9af1751bb32b5,"Pokal-Wahnsinn! Bielefeld führt zur Halbzeit gegen Leverkusen
Pokal-Wahnsinn! Bielefeld führt zur Halbzeit gegen Leverkusen
Pokal-Wahnsinn! Bielefeld führt zur Halbzeit gegen Leverkusen
Pokal-Wahn… [+428 chars]",,de,'Adolf Hitler'
https://www.focus.de/kultur/stars/epstein-opfer-kuendigte-eigenen-tod-an-jetzt-nimmt-der-fall-irre-wendung_5f2f2cd5-1266-40cf-ba3a-4273a0207a6f.html,https://www.focus.de/kultur/stars/epstein-opfer-kuendigte-eigenen-tod-an-jetzt-nimmt-der-fall-irre-wendung_5f2f2cd5-1266-40cf-ba3a-4273a0207a6f.html,0,www.focus.de,Virginia Giuffre postete Horror-Foto - Epstein-Opfer kündigte eigenen Tod an – jetzt nimmt der Fall eine irre Wendung,"Nachdem Virginia Giuffre, das bekannteste Opfer von Jeffrey Epstein, kürzlich selbst erklärt hat, dass sie nach einem Autounfall nur noch wenige Tage zu leben hätte, nimmt der Fall eine seltsame Wendung. Plötzlich geht es auch um häusliche Gewalt.Von FOCUS-on…",https://quadro.burda-forward.de/ctf/aba80c3d-3faf-476b-8683-363eb20ba852.be9f254f-3388-46cc-ae6d-5e47a8edd918.jpg?im=RegionOfInterestCrop%3D%281200%2C630%29%2CregionOfInterest%3D%281499%2C968%29&hash=c4e4a8cb7f9b3db6c434df0a38a522950a4ef9cd3dc0820572959d88e92a4359,2025-04-02T10:23:00Z,,"Mit Hämatomen übersät, die Augen nur noch halb geöffnet: Mit diesem Foto schockte Virginia Giuffre (41) jüngst die Öffentlichkeit. Nach einem Autounfall in Australien würden ihre Nieren versagen, sie… [+2462 chars]",,de,'Jeffrey Epstein'
https://www.bild.de/regional/nuernberg/gift-alarm-im-dirndl-in-dieser-kleidung-steckt-arsen-67ed15fbbafced24bfd92dbf,https://www.bild.de/regional/nuernberg/gift-alarm-im-dirndl-in-dieser-kleidung-steckt-arsen-67ed15fbbafced24bfd92dbf,0,www.bild.de,Nur mit Handschuhen anfassen! - Gift-Alarm im Dirndl,Das Tragen könnte tödlich sein! So gefährlich ist diese Sammlung alter Kleider.,"https://images.bild.de/67ed15fbbafced24bfd92dbf/82655c18f609c6ccf7b2ceafdd2287e2,aff5dff?w=1280",2025-04-02T13:29:23Z,,"Nürnberg (Bayern) Die Luft in ihrem Schutzanzug muss gefiltert werden. An den Händen trägt Anne Bergmann gleich zwei Paar Einweghandschuhe. Denn: Das Trachtenkleid, das sie mit einem Pinsel reinigt, … [+2001 chars]",,de,'Sam H'
https://www.focus.de/kultur/kino_tv/bill-kaulitz-offenbart-geheime-ex-beziehung-tom-findet-es-problematisch_3c9dd21b-6c0e-4b23-ac0b-225431ff13ef.html,https://www.focus.de/kultur/kino_tv/bill-kaulitz-offenbart-geheime-ex-beziehung-tom-findet-es-problematisch_3c9dd21b-6c0e-4b23-ac0b-225431ff13ef.html,0,www.focus.de,Zwist in Podcast - Bill Kaulitz offenbart geheime Ex-Beziehung – Bruder Tom findet es „problematisch“,"Bill Kaulitz hat in der neusten Folge des Podcasts „Kaulitz Hills“ mit Tom Kaulitz über eine frühere Beziehung innerhalb seines Teams ausgepackt. Während ein Tokio-Hotel-Mitglied aus allen Wolken fiel, findet Bruder Tom harte Worte.",https://quadro.burda-forward.de/ctf/1904acc4-59a0-4798-ae93-e17e6c74530b.88f2bca0-85c3-4a26-8d57-5fc7551530d5.jpg?im=RegionOfInterestCrop%3D%281200%2C630%29%2CregionOfInterest%3D%281528%2C872%29&hash=97a37d6b877cdf8e605ba525dd9f5535cbdc5edce28396c4c09b8873ef724516,2025-04-02T13:44:00Z,https://web.archive.org/web/20250403050318/https://www.focus.de/kultur/kino_tv/bill-kaulitz-offenbart-geheime-ex-beziehung-tom-findet-es-problematisch_3c9dd21b-6c0e-4b23-ac0b-225431ff13ef.html,Tokio Hotel befinden sich aktuell in den letzten Zügen ihrer Tour durch Europa - von Müdigkeit ist zumindest bei Bill Kaulitz aber offenbar noch keine Spur. Im Podcast Kaulitz Hills verrät der 35-Jäh… [+4032 chars],,de,'Tom Kaulitz'
https://www.faz.net/aktuell/feuilleton/medien-und-film/medienpolitik/trump-gegen-pbs-us-medienkrieg-gegen-oeffentliche-sender-110395150.html,https://www.faz.net/aktuell/feuilleton/medien-und-film/medienpolitik/trump-gegen-pbs-us-medienkrieg-gegen-oeffentliche-sender-110395150.html,0,www.faz.net,Republikanischer Rundfunkkrieg: Trumps Angriff auf die Sender PBS und NPR,"Die Republikaner wollen die öffentlichen Rundfunksender PBS und NPR finanziell austrocknen. Welche Bedeutung die Sender für die amerikanische Öffentlichkeit haben, ist Donald Trumps Leuten egal.",https://media1.faz.net/ppmedia/aktuell/feuilleton/2804511555/1.10395149/facebook_teaser/npr-chefin-katherine-maher.jpg,2025-04-02T14:08:45Z,https://web.archive.org/web/20250402142540/https://www.faz.net/aktuell/feuilleton/medien-und-film/medienpolitik/trump-gegen-pbs-us-medienkrieg-gegen-oeffentliche-sender-110395150.html,"Sollen die Sender PBS und NPR weiter öffentliche Mittel bekommen? Diese Frage treibt zurzeit die amerikanische Medienlandschaft um, nachdem den Sendern, die unter anderem die Sesamstraße, das Wissens… [+5219 chars]",,de,'Hunter Biden'
https://www.stern.de/lifestyle/leute/kleines-maedchen-auf-der-welt--freund-von-taylor-swift-erneut-onkel---bruder-im-vaterglueck-35607128.html,https://www.stern.de/lifestyle/leute/kleines-maedchen-auf-der-welt--freund-von-taylor-swift-erneut-onkel---bruder-im-vaterglueck-35607128.html,0,www.stern.de,Kleines Mädchen auf der Welt: Freund von Taylor Swift erneut Onkel - Bruder im Vaterglück,"Nachwuchs in der Verwandtschaft von Travis Kelce, dem Footballspieler und Freund von US-Popstar Taylor Swift: Sein Bruder Jason postet süße Fotos vom vierten Kind.",https://image.stern.de/35607130/t/35/v1/w1440/r1.7778/-/02--ac5ez6dqgqv9axs2048jpeg---b378031f844f46ac.jpg,2025-04-02T14:14:51Z,,"Kopiere den aktuellen Link
Zur Merkliste hinzufügen
Nachwuchs in der Verwandtschaft von Travis Kelce, dem Footballspieler und Freund von US-Popstar Taylor Swift: Sein Bruder Jason postet süße Fotos… [+1368 chars]",,de,'Jason Kelce'
https://www.tagesspiegel.de/gesellschaft/kleines-madchen-auf-der-welt-freund-von-taylor-swift-erneut-onkel-bruder-im-vatergluck-13476412.html,https://www.tagesspiegel.de/gesellschaft/kleines-madchen-auf-der-welt-freund-von-taylor-swift-erneut-onkel-bruder-im-vatergluck-13476412.html,0,www.tagesspiegel.de,Kleines Mädchen auf der Welt: Freund von Taylor Swift erneut Onkel - Bruder im Vaterglück,"Nachwuchs in der Verwandtschaft von Travis Kelce, dem Footballspieler und Freund von US-Popstar Taylor Swift: Sein Bruder Jason postet süße Fotos vom vierten Kind.",https://www.tagesspiegel.de/images/13476409/alternates/BASE_16_9_W1400/1743603344000/jason-kelce.jpeg,2025-04-02T14:15:44Z,,"Süßes Glück im Arm: Der Bruder von Travis Kelce (35), dem Freund von US-Popstar Taylor Swift (35), ist zum vierten Mal Vater geworden. Jason Kelce (37), selbst ein ehemaliger Footballspieler der Phil… [+1854 chars]",,de,'Taylor Swift'
https://www.focus.de/politik/deutschland/bamf-chef-bricht-4-linke-tabus-spd-aufschrei-ist-bezeichnend-fuer-asyl-debatte_9001dfa7-427f-4f75-abd1-5884b713dc05.html,https://www.focus.de/politik/deutschland/bamf-chef-bricht-4-linke-tabus-spd-aufschrei-ist-bezeichnend-fuer-asyl-debatte_9001dfa7-427f-4f75-abd1-5884b713dc05.html,0,www.focus.de,Analyse von Ulrich Reitz - Bamf-Chef bricht vier linke Tabus – SPD-Aufschrei ist bezeichnend für Asyl-Debatte,"Weil ihnen sein Migrations-Vorstoß nicht passt, wollen SPD und Grüne einen Spitzenbeamten hinauswerfen. Der ist einer der besten deutschen Asylexperten – und liegt richtig. Aber hat seine „Asylwende“ überhaupt eine Chance?Von FOCUS-online-Korrespondent Ulrich…",https://quadro.burda-forward.de/ctf/d2cdc4c7-d3a9-4e90-8367-bfb916b905e5.40e36c96-7592-44cd-a0fe-e676fc9f73ce.jpg?im=RegionOfInterestCrop%3D%281200%2C630%29%2CregionOfInterest%3D%281708%2C553%29&hash=7f7236c399de4baf8f07fc2e5202db53b56f67151cc6a146a40cc4091c08be11,2025-04-02T16:04:00Z,https://web.archive.org/web/20250402162449/https://www.focus.de/politik/deutschland/bamf-chef-bricht-4-linke-tabus-spd-aufschrei-ist-bezeichnend-fuer-asyl-debatte_9001dfa7-427f-4f75-abd1-5884b713dc05.html,"Politiker von SPD, Grünen und Linken fordern seine Entlassung. Sie wollen ihn canceln, seine Einsichten und Ansichten passen ihnen nicht. Sie sagen, so dürfe sich ein Beamter doch nicht äußern. So ma… [+9745 chars]",,de,'Ulrich Reitz'
https://www.welt.de/wirtschaft/article255853736/Donald-Trumps-Zoelle-Goldkurs-auf-Rekordhoch-Experte-warnt-vor-Jobabbau-in-Deutschland.html,https://www.welt.de/wirtschaft/article255853736/Donald-Trumps-Zoelle-Goldkurs-auf-Rekordhoch-Experte-warnt-vor-Jobabbau-in-Deutschland.html,0,www.welt.de,Zollpaket treibt Goldkurs auf Rekordhoch – Experte warnt vor Jobabbau in Deutschland,Donald Trump holt zu einem radikalen Rundumschlag aus. Welche Folgen wird das gewaltige Zollpaket der US-Regierung haben? Der Goldpreis jedenfalls stieg in der Nacht stark an. Alle Entwicklungen im Liveticker.,https://img.welt.de/img/wirtschaft/mobile255853734/5417937327-ci16x9-w1200/New-York-Stock-Exchange-opening.jpg,2025-04-03T06:12:53Z,https://web.archive.org/web/20250403063203/https://www.welt.de/wirtschaft/article255853736/Donald-Trumps-Zoelle-Goldkurs-auf-Rekordhoch-Experte-warnt-vor-Jobabbau-in-Deutschland.html,Donald Trump holt zu einem radikalen Rundumschlag aus. Welche Folgen wird das gewaltige Zollpaket der US-Regierung haben? Der Goldpreis jedenfalls stieg in der Nacht stark an. Alle Entwicklungen im L… [+5663 chars],,de,'Ferdinand Dudenhöffer'
https://www.welt.de/wirtschaft/article255853736/Donald-Trumps-Zoelle-Dax-sackt-ab-Goldpreis-steigt-auf-Rekordhoch.html,https://www.welt.de/wirtschaft/article255853736/Donald-Trumps-Zoelle-Dax-sackt-ab-Goldpreis-steigt-auf-Rekordhoch.html,0,www.welt.de,Dax sackt nach Zollschock ab – Goldpreis steigt auf Rekordhoch,"Donald Trump holt zu einem radikalen Rundumschlag aus. Welche Folgen wird das gewaltige Zollpaket der US-Regierung haben? Während der Dax einknickt, stieg der Goldpreis in der Nacht stark an. Alle Entwicklungen im Liveticker.",https://img.welt.de/img/wirtschaft/mobile255853734/5817930737-ci16x9-w1200/New-York-Stock-Exchange-opening.jpg,2025-04-03T07:42:00Z,https://web.archive.org/web/20250403083823/https://www.welt.de/wirtschaft/article255853736/Donald-Trumps-Zoelle-Dax-sackt-ab-Goldpreis-steigt-auf-Rekordhoch.html,"Donald Trump holt zu einem radikalen Rundumschlag aus. Welche Folgen wird das gewaltige Zollpaket der US-Regierung haben? Während der Dax einknickt, stieg der Goldpreis in der Nacht stark an. Alle En… [+12254 chars]",,de,'Donald Trump'
https://www.bild.de/unterhaltung/happy-birthday-hollywood-star-robert-downey-jr-wird-60-67ed47280ce3487d10d47165,https://www.bild.de/unterhaltung/happy-birthday-hollywood-star-robert-downey-jr-wird-60-67ed47280ce3487d10d47165,0,www.bild.de,Happy Birthday! - Hollywood-Star Robert Downey Jr. wird 60,"Robert Downey Jr., bekannt als Iron Man, feiert seinen 60. Geburtstag. Der Hollywood-Star blickt auf eine beeindruckende Karriere voller Höhen und Tiefen...","https://images.bild.de/67ed47280ce3487d10d47165/96d57b062dd97b335db50bf9642e92d1-landscape,38228eb8?w=1280",2025-04-03T08:46:18Z,https://web.archive.org/web/20250403102658/https://www.bild.de/unterhaltung/happy-birthday-hollywood-star-robert-downey-jr-wird-60-67ed47280ce3487d10d47165,"Scholz zu US-Zöllen: Es wird nur Verlierer geben
Scholz zu US-Zöllen: Es wird nur Verlierer geben
Scholz zu US-Zöllen: Es wird nur Verlierer geben
Scholz zu US-Zöllen: Es wird nur Verlierer geben… [+298 chars]",,de,'Robert Downey Jr'
https://www.n-tv.de/mediathek/videos/wirtschaft/America-alone-am-Ende-sind-alle-blind-und-pleite-article25676970.html,https://www.n-tv.de/mediathek/videos/wirtschaft/America-alone-am-Ende-sind-alle-blind-und-pleite-article25676970.html,0,www.n-tv.de,"Reitz kommentiert Trumps Zölle: ""America alone - am Ende sind alle blind und pleite""","Mit seinem Zoll-Rundumschlag sprengt Donald Trump den Damm, nur um dann eine Brücke zu versprechen. ""Billionen"" will er so in die US-Staatskassen spülen - ""vielleicht fragt er mal jemanden, wie viele Nullen das sind"", kommentiert Ulrich Reitz, Chefkorresponde…",https://www.n-tv.de/img/incoming/crop25677029/7651326009-cImg_16_9-w1200/ReitzZollTrump.jpg,2025-04-03T09:14:10Z,https://web.archive.org/web/20250403100122/https://www.n-tv.de/mediathek/videos/wirtschaft/America-alone-am-Ende-sind-alle-blind-und-pleite-article25676970.html,,,de,'Donald Trump'
https://www.n-tv.de/leute/Boris-Becker-teilt-bizarren-Verschwoerungsmythos-ueber-Hitler-article25677456.html,https://www.n-tv.de/leute/Boris-Becker-teilt-bizarren-Verschwoerungsmythos-ueber-Hitler-article25677456.html,0,www.n-tv.de,Zweifel an Hitlers Selbstmord: Boris Becker taucht in Verschwörungssumpf ab,"Es ist nur eine von unzähligen Verschwörungserzählungen über die Nationalsozialisten: Adolf Hitler sei am Ende des Zweiten Weltkriegs gar nicht gestorben, sondern habe sich nach Südamerika abgesetzt. Nun hat Boris Becker sie für sich entdeckt. ""Wow …""",https://www.n-tv.de/img/incoming/crop25677478/1481323652-cImg_16_9-w1200/443862451.jpg,2025-04-03T10:31:38Z,http://archive.md/20250403174331/https://www.n-tv.de/leute/Boris-Becker-teilt-bizarren-Verschwoerungsmythos-ueber-Hitler-article25677456.html,"Es ist nur eine von unzähligen Verschwörungserzählungen über die Nationalsozialisten: Adolf Hitler sei am Ende des Zweiten Weltkriegs gar nicht gestorben, sondern habe sich nach Südamerika abgesetzt.… [+2992 chars]",,de,'Adolf Hitler'
