index,url,valid,domain,title,description,image,published,archive,content,quote,language,keyword
https://www.stern.de/lifestyle/leute/kroenung-von-charles-iii---das-bedeutet-das-design-der-einladungen-33350730.html,https://www.stern.de/lifestyle/leute/kroenung-von-charles-iii---das-bedeutet-das-design-der-einladungen-33350730.html,0,www.stern.de,"Royals: Blümchen, Tiere und versteckte Botschaften: Das steckt hinter dem Design der Krönungseinladungen","Der Buckingham Palast hat ein erstes Bild der Einladungskarten für die Krönung von Charles III. am 6. Mai veröffentlicht. Darauf ist natürlich kein Design zufällig gewählt, fast alles hat eine Bedeutung.",https://image.stern.de/33350818/t/PN/v2/w1440/r1.7778/-/royal-einladung.jpg,2023-04-05T10:21:00Z,https://web.archive.org/web/20230405152409/https://www.stern.de/lifestyle/leute/kroenung-von-charles-iii---das-bedeutet-das-design-der-einladungen-33350730.html,Die Krönung von König Charles III. am 6. Mai rückt näher und im Buckingham Palast laufen die Vorbereitungen auf Hochtouren. Immer mehr Details über die Feierlichkeiten kommen ans Licht. So wurde kürz… [+1937 chars],,de,'Charles III'
https://www.tagesschau.de/newsticker/liveblog-ukraine-donnerstag-223.html,https://www.tagesschau.de/newsticker/liveblog-ukraine-donnerstag-223.html,0,www.tagesschau.de,Liveblog: ++ Putin: Westen half Ukraine bei Sabotage ++,"Kremlchef Putin hat behauptet, der Westen habe der Ukraine bei Sabotageakten und Terror geholfen. Moskau hat eine vom IStGH gesuchte Kinderkommissarin vor dem UN-Sicherheitsrat reden lassen. Alle Entwicklungen im Liveblog.",https://www.tagesschau.de/multimedia/bilder/putin-russland-127~_v-original.jpg,2023-04-06T01:16:50Z,https://web.archive.org/web/20230406023536/https://www.tagesschau.de/newsticker/liveblog-ukraine-donnerstag-223.html,"Kremlchef Putin hat behauptet, der Westen habe der Ukraine bei Sabotageakten und Terror geholfen. Moskau hat eine vom IStGH gesuchte Kinderkommissarin vor dem UN-Sicherheitsrat reden lassen. Alle Ent… [+2034 chars]",,de,'Wladimir Putin'
https://www.stern.de/lifestyle/leute/kroenung--ehrenpage-ist-der-sohn-von-prinz-williams-angeblicher-affaere-33353768.html,https://www.stern.de/lifestyle/leute/kroenung--ehrenpage-ist-der-sohn-von-prinz-williams-angeblicher-affaere-33353768.html,0,www.stern.de,Gerüchte über Seitensprung: Krönung: Einer von Charles' Ehrenpagen ist der Sohn von Prinz Williams angeblicher Affäre,"Einer der Ehrenpagen, der an der Seite von König Charles III. das Hauptschiff der Westminster Abbey entlang schreiten wird, ist der Sohn von Rose Hanbury. Mit ihr wurde Prinz William vor einigen Jahren eine außereheliche Affäre nachgesagt.",https://image.stern.de/33354242/t/BL/v2/w1440/r1.7778/-/rose-hanbury--prinz-william-und-prinzessin-kate.jpg,2023-04-06T11:17:00Z,,"Zusammen mit dem Design der Einladungskarten veröffentlichte der Buckingham Palast jüngst auch die Namen der Ehrenpagen, die König Charles III. und seine Gemahlin Camilla am 6. Mai während der Krönun… [+2885 chars]",,de,'Charles III'
https://consent.google.com/ml?continue=https://news.google.com/rss/articles/CBMiemh0dHBzOi8vd3d3LnN0ZXJuLmRlL2xpZmVzdHlsZS9sZXV0ZS9rcm9lbnVuZy0tZWhyZW5wYWdlLWlzdC1kZXItc29obi12b24tcHJpbnotd2lsbGlhbXMtYW5nZWJsaWNoZXItYWZmYWVyZS0zMzM1Mzc2OC5odG1s0gF-aHR0cHM6Ly93d3cuc3Rlcm4uZGUvYW1wL2xpZmVzdHlsZS9sZXV0ZS9rcm9lbnVuZy0tZWhyZW5wYWdlLWlzdC1kZXItc29obi12b24tcHJpbnotd2lsbGlhbXMtYW5nZWJsaWNoZXItYWZmYWVyZS0zMzM1Mzc2OC5odG1s?oc%3D5&gl=FR&hl=en-US&cm=2&pc=n&src=1,https://consent.google.com/ml?continue=https://news.google.com/rss/articles/CBMiemh0dHBzOi8vd3d3LnN0ZXJuLmRlL2xpZmVzdHlsZS9sZXV0ZS9rcm9lbnVuZy0tZWhyZW5wYWdlLWlzdC1kZXItc29obi12b24tcHJpbnotd2lsbGlhbXMtYW5nZWJsaWNoZXItYWZmYWVyZS0zMzM1Mzc2OC5odG1s0gF-aHR0cHM6Ly93d3cuc3Rlcm4uZGUvYW1wL2xpZmVzdHlsZS9sZXV0ZS9rcm9lbnVuZy0tZWhyZW5wYWdlLWlzdC1kZXItc29obi12b24tcHJpbnotd2lsbGlhbXMtYW5nZWJsaWNoZXItYWZmYWVyZS0zMzM1Mzc2OC5odG1s?oc%3D5&gl=FR&hl=en-US&cm=2&pc=n&src=1,0,consent.google.com,Krönung: Ehrenpage ist der Sohn von Prinz Williams angeblicher Affäre - STERN.de,"<ol><li>Krönung: Ehrenpage ist der Sohn von Prinz Williams angeblicher Affäre  STERN.de
</li><li>König Charles lädt zur Krönung: Die versteckten Einladungs-Botschaften | Unterhaltung  BILD
</li><li>Das ist die Einladung zur Krönung von King Charles III. und…",,2023-04-06T11:17:00Z,,"We use cookies and data to<ul><li>Deliver and maintain Google services</li><li>Track outages and protect against spam, fraud, and abuse</li><li>Measure audience engagement and site statistics to unde… [+1131 chars]",,de,'König Charles III'
https://www.focus.de/kultur/royals/wer-bei-charles-kroenung-auf-dem-balkon-stehen-darf-und-wer-nicht_id_190372259.html,https://www.focus.de/kultur/royals/wer-bei-charles-kroenung-auf-dem-balkon-stehen-darf-und-wer-nicht_id_190372259.html,0,www.focus.de,Royales Ereignis des Jahres - Wer bei Charles' Krönung auf dem Balkon stehen darf und wer nicht,"Royal-Fans fiebern der Krönung von Charles III. am 6. Mai in London entgegen. Zu diesem Anlass kommt die ganze königliche Familie mal wieder zusammen und winkt vom Balkon des Buckingham Palasts hinunter. Naja, nicht die ganze Familie.",https://p6.focus.de/img/fotos/id_190368188/microsoftteams-image-38-.jpg?im=Crop%3D%280%2C0%2C1973%2C986%29%3BResize%3D%281200%2C627%29&hash=c64a895182354d6621a988394945c55931b0ed8fb86daac882e8af29dde21263,2023-04-06T11:24:59Z,https://web.archive.org/web/20230406152149/https://www.focus.de/kultur/royals/wer-bei-charles-kroenung-auf-dem-balkon-stehen-darf-und-wer-nicht_id_190372259.html,"Der 6. Mai 2023 ist wahrscheinlich der wichtigste Tag im Leben von König Charles' III. (74). Dann wird endlich wahr, worauf er lange warten musste: seine offizielle Krönung zum Monarchen. An diesem h… [+2379 chars]",,de,'König Charles III'
https://www.welt.de/politik/ausland/article244675922/Putin-trifft-Botschafter-der-EU-und-USA-und-nutzte-Termin-zu-einer-Generalabrechnung.html,https://www.welt.de/politik/ausland/article244675922/Putin-trifft-Botschafter-der-EU-und-USA-und-nutzte-Termin-zu-einer-Generalabrechnung.html,0,www.welt.de,Putin bleibt bei Treffen mit Botschaftern auf Abstand – und kritisiert EU und USA,17 neu nach Russland entsandte Diplomaten wurden von Wladimir Putin persönlich begrüßt. Der Kremlchef hielt aber auffällig Distanz zu seinen Besuchern – und nutzte den Termin zu einer Generalabrechnung.,https://img.welt.de/img/politik/ausland/mobile244675918/8701355597-ci16x9-w1200/Russlands-Praesident-Putin.jpg,2023-04-06T11:25:00Z,https://web.archive.org/web/20230406143919/https://www.welt.de/politik/ausland/article244675922/Putin-trifft-Botschafter-der-EU-und-USA-und-nutzte-Termin-zu-einer-Generalabrechnung.html,Kremlchef Wladimir Putin hat in Moskau die neuen Botschafter der EU und der USA getroffen und dem Westen dabei eine geopolitische Konfrontation mit Russland vorgeworfen. Die EU habe diese Konfrontati… [+2575 chars],,de,'Wladimir Putin'
https://www.zeit.de/gesellschaft/zeitgeschehen/2023-04/grossbritannien-koenigshauss-skaverei-untersuchung,https://www.zeit.de/gesellschaft/zeitgeschehen/2023-04/grossbritannien-koenigshauss-skaverei-untersuchung,0,www.zeit.de,Kolonialismus: Charles III. stimmt Forschung zu royalen Verbindungen mit Sklaverei zu,Wie war das britische Königshaus in den Sklavenhandel verwickelt? Eine Doktorandin will die Frage aufarbeiten. König Charles III. ermöglicht ihr den Zugang zu Archiven.,,2023-04-06T11:30:53Z,https://web.archive.org/web/20230406120116/https://www.zeit.de/gesellschaft/zeitgeschehen/2023-04/grossbritannien-koenigshauss-skaverei-untersuchung,"When browsing with ads:
We collect personal data and also transmit it to third-party providers
 that help us improve and finance our digital content. Some of the information stored on your device, … [+732 chars]",,de,'König Charles III'
https://www.n-tv.de/leute/Charles-III-stimmt-Forschung-zu-Sklaverei-zu-article24038105.html,https://www.n-tv.de/leute/Charles-III-stimmt-Forschung-zu-Sklaverei-zu-article24038105.html,0,www.n-tv.de,"""Fehler eingestehen"": Charles III. stimmt Forschung zu Sklaverei zu",Die britische Monarchie hat jahrhundertelang vom Sklavenhandel profitiert. Nun öffnet das Königshaus erstmals seine Archive: Eine wissenschaftliche Untersuchung soll bis 2026 offene Fragen klären. Zu einer Entschuldigung war Charles III. bisher nicht bereit.,https://bilder4.n-tv.de/img/incoming/crop24038131/1411321377-cImg_16_9-w1200/402286297.jpg,2023-04-06T11:46:49Z,https://web.archive.org/web/20230407021948/https://www.n-tv.de/leute/Charles-III-stimmt-Forschung-zu-Sklaverei-zu-article24038105.html,Die britische Monarchie hat jahrhundertelang vom Sklavenhandel profitiert. Nun öffnet das Königshaus erstmals seine Archive: Eine wissenschaftliche Untersuchung soll bis 2026 offene Fragen klären. Zu… [+1927 chars],,de,'König Charles III'
https://www.stern.de/news/stadt-aachen-verschiebt-verleihung-des-karlspreises-an-selenskyj-um-einige-tage-33014816.html,https://www.stern.de/news/stadt-aachen-verschiebt-verleihung-des-karlspreises-an-selenskyj-um-einige-tage-33014816.html,0,www.stern.de,Stadt Aachen verschiebt Verleihung des Karlspreises an Selenskyj um einige Tage,"Der Aachener Karlspreis wird in diesem Jahr nicht wie üblich am Himmelfahrtstag verliehen. Die Stadt Aachen verlegte den Termin für die Vergabe der renommierten Auszeichnung, mit der in diesem Jahr der ukrainische Präsident Wolodymyr Selenskyj und das ukraini…",https://image.stern.de/33355052/t/g0/v1/w1440/r1.7778/-/06--praesident-selenskyj---c9e8200e85313016.jpg,2023-04-06T13:00:18Z,,"Der Aachener Karlspreis wird in diesem Jahr nicht wie üblich am Himmelfahrtstag verliehen. Die Stadt Aachen verlegte den Termin für die Vergabe der renommierten Auszeichnung, mit der in diesem Jahr d… [+1859 chars]",,de,'Maria Kolesnikowa'
https://www.zeit.de/news/2023-04/06/harry-und-meghan-kommen-sie-oder-kommen-sie-nicht,https://www.zeit.de/news/2023-04/06/harry-und-meghan-kommen-sie-oder-kommen-sie-nicht,0,www.zeit.de,Krönung König Charles III.: Harry und Meghan: Kommen sie oder kommen sie nicht?,,,2023-04-06T13:29:28Z,,"When browsing with ads:
We collect personal data and also transmit it to third-party providers
 that help us improve and finance our digital content. Some of the information stored on your device, … [+732 chars]",,de,'König Charles III'
https://www.stern.de/lifestyle/kroenung-koenig-charles-iii---harry-und-meghan--kommen-sie-oder-kommen-sie-nicht---33355426.html,https://www.stern.de/lifestyle/kroenung-koenig-charles-iii---harry-und-meghan--kommen-sie-oder-kommen-sie-nicht---33355426.html,0,www.stern.de,Krönung König Charles III.: Harry und Meghan: Kommen sie oder kommen sie nicht?,"Die Deadline für Zusagen ist seit Tagen abgelaufen - und noch immer ist nicht klar, ob Prinz Harry mit Ehefrau Meghan zur Krönung seines Vaters Charles nach London reist.",https://image.stern.de/33355428/t/lP/v1/w1440/r1.7778/-/06--urnnewsmldpacom2009010123040699235087v3w800h600l570t0r2280b1262jpeg---c858bdecbe015e0e.jpg,2023-04-06T13:29:28Z,https://web.archive.org/web/20230406173332/https://www.stern.de/lifestyle/kroenung-koenig-charles-iii---harry-und-meghan--kommen-sie-oder-kommen-sie-nicht---33355426.html,"Die Deadline für Zusagen ist seit Tagen abgelaufen - und noch immer ist nicht klar, ob Prinz Harry mit Ehefrau Meghan zur Krönung seines Vaters Charles nach London reist.
Genau einen Monat vor der K… [+4088 chars]",,de,'König Charles III'
https://www.morgenpost.de/vermischtes/article238092887/Harry-und-Meghan-Kommen-sie-oder-kommen-sie-nicht.html,https://www.morgenpost.de/vermischtes/article238092887/Harry-und-Meghan-Kommen-sie-oder-kommen-sie-nicht.html,0,www.morgenpost.de,Krönung König Charles III.: Harry und Meghan: Kommen sie oder kommen sie nicht?,"Die Deadline für Zusagen ist seit Tagen abgelaufen - und noch immer ist nicht klar, ob Prinz Harry mit Ehefrau Meghan zur Krönung seines Vaters Charles nach London reist.",https://img.morgenpost.de/img/vermischtes/crop238092881/6952602605-w820-cv16_9-q85/Harry-Meghan.jpg,2023-04-06T13:45:36Z,https://web.archive.org/web/20230407073008/https://www.morgenpost.de/vermischtes/article238092887/Harry-und-Meghan-Kommen-sie-oder-kommen-sie-nicht.html,London/York. Genau einen Monat vor der Krönung von König Charles III. belastet der Streit mit seinem jüngeren Sohn Prinz Harry die Vorbereitungen der historischen Zeremonie. Mit Spannung wird erwarte… [+4172 chars],,de,'Charles III'
https://consent.google.com/ml?continue=https://news.google.com/rss/articles/CBMieGh0dHBzOi8vd3d3LnR6LmRlL3N0YXJzL3BhbGFzdC1iZXN0YWV0aWd0LWRpZXNlLXJvbGxlLXVlYmVybmltbXQtcHJpbnotZ2VvcmdlLWJlaS1kZXIta3JvZW51bmctdm9uLWNoYXJsZXMtOTIxOTc1NDYuaHRtbNIBAA?oc%3D5&gl=FR&hl=en-US&cm=2&pc=n&src=1,https://consent.google.com/ml?continue=https://news.google.com/rss/articles/CBMieGh0dHBzOi8vd3d3LnR6LmRlL3N0YXJzL3BhbGFzdC1iZXN0YWV0aWd0LWRpZXNlLXJvbGxlLXVlYmVybmltbXQtcHJpbnotZ2VvcmdlLWJlaS1kZXIta3JvZW51bmctdm9uLWNoYXJsZXMtOTIxOTc1NDYuaHRtbNIBAA?oc%3D5&gl=FR&hl=en-US&cm=2&pc=n&src=1,0,consent.google.com,Palast bestätigt: Diese Rolle übernimmt Prinz George bei der Krönung von Charles - tz.de,"<ol><li>Palast bestätigt: Diese Rolle übernimmt Prinz George bei der Krönung von Charles  tz.de
</li><li>König Charles III:: Wo werden Harry und Meghan bei der Krönung sitzen? | Unterhaltung  BILD
</li><li>Krönung König Charles III.: Harry und Meghan: Komme…",,2023-04-06T13:59:21Z,,"We use cookies and data to<ul><li>Deliver and maintain Google services</li><li>Track outages and protect against spam, fraud, and abuse</li><li>Measure audience engagement and site statistics to unde… [+1131 chars]",,de,'König Charles III'
https://orf.at/stories/3311726/,https://orf.at/stories/3311726/,0,orf.at,Charles will Königliche Archive öffnen,"Erstmals hat das britische Königshaus, das jahrhundertelang vom Sklavenhandel profitierte, einer Aufarbeitung seiner historischen Verbindungen zur Sklaverei zugestimmt. König Charles III. nehme die Frage sehr ernst, teilte der Buckingham-Palast der Zeitung „G…",https://ibs.orf.at/news?image=https%3A%2F%2Fassets.orf.at%2Fmims%2F2023%2F14%2F64%2Fcrops%2Fw%3D1200%2Ch%3D630%2Cq%3D75%2F1742985_master_645964_windsor_sklaverei_charles_r.jpg%3Fs%3D8f7bd6f42e370eb98556074b7c267a05aa93df1e,2023-04-06T14:25:36Z,https://web.archive.org/web/20230407004307/https://orf.at/stories/3311726/,"Zuvor hatte der Guardian (Donnerstag-Ausgabe) ein Dokument von 1689 veröffentlicht, das die Übertragung von Aktien des Unternehmens Royal African Company, das im Sklavenhandel tätig war, an König Wil… [+2129 chars]",,de,'König Charles III'
https://www.sueddeutsche.de/panorama/koenigshaus-und-sklaverei-charles-iii-stimmt-forschungen-zu-1.5783824,https://www.sueddeutsche.de/panorama/koenigshaus-und-sklaverei-charles-iii-stimmt-forschungen-zu-1.5783824,0,www.sueddeutsche.de,: Königshaus und Sklaverei: Charles III. stimmt Forschungen zu,"Königshaus und Sklaverei: Charles III. stimmt Forschungen zu. CHARLES III. STIMMT FORDERUNGEN ZU Das britische Königshaus will seine historischen Verbindungen zur Sklaverei untersuchen lassen König Charles III. nehme die Frage sehr ernst, teilte der Buckingha…",https://www.sueddeutsche.de/image/sz.1.5783825/1200x675?v=1680793231000,2023-04-06T15:00:31Z,,"6. April 2023, 15:00
 "",""authorTextHtml"":""Direkt aus dem dpa-Videokanal"",""mainTheme"":""Video"",""durationInSeconds"":""00:52"",""tags"":[""Video""],""autoListing"":true,""seoData"":{""seoTitle"":"""",""seoDescription""… [+8103 chars]",,de,'König Charles III'
https://consent.google.com/ml?continue=https://news.google.com/rss/articles/CBMihwFodHRwczovL3d3dy5iaWxkLmRlL3VudGVyaGFsdHVuZy9yb3lhbHMvcm95YWxzL2tvZW5pZy1jaGFybGVzLWlpaS13by13ZXJkZW4taGFycnktdW5kLW1lZ2hhbi1iZWktZGVyLWtyb2VudW5nLXNpdHplbi04MzQ2MjYwNC5iaWxkLmh0bWzSAQA?oc%3D5&gl=FR&hl=en-US&cm=2&pc=n&src=1,https://consent.google.com/ml?continue=https://news.google.com/rss/articles/CBMihwFodHRwczovL3d3dy5iaWxkLmRlL3VudGVyaGFsdHVuZy9yb3lhbHMvcm95YWxzL2tvZW5pZy1jaGFybGVzLWlpaS13by13ZXJkZW4taGFycnktdW5kLW1lZ2hhbi1iZWktZGVyLWtyb2VudW5nLXNpdHplbi04MzQ2MjYwNC5iaWxkLmh0bWzSAQA?oc%3D5&gl=FR&hl=en-US&cm=2&pc=n&src=1,0,consent.google.com,König Charles III:: Wo werden Harry und Meghan bei der Krönung sitzen? - BILD,"<ol><li>König Charles III:: Wo werden Harry und Meghan bei der Krönung sitzen?  BILD
</li><li>Krönung König Charles III.: Harry und Meghan: Kommen sie oder kommen sie nicht?  STERN.de
</li><li>Noch einen Monat bis zur Krönung: Wer kommt, was passiert?  RTL …",,2023-04-06T15:29:04Z,,"We use cookies and data to<ul><li>Deliver and maintain Google services</li><li>Track outages and protect against spam, fraud, and abuse</li><li>Measure audience engagement and site statistics to unde… [+1131 chars]",,de,'König Charles III'
https://consent.google.com/ml?continue=https://news.google.com/rss/articles/CBMilAFodHRwczovL3d3dy5hYmVuZHplaXR1bmctbXVlbmNoZW4uZGUvcHJvbWlzL2lycmVyLXBsYW4tZGVyLXJveWFscy1tZWdoYW5zLWdlc2ljaHQtc29sbC1iZWkta3JvZW51bmctdmVyZGVja3Qtd2VyZGVuLXdhcy1kaWUtZXhwZXJ0aW4tc2FndC1hcnQtODkxNjc40gEA?oc%3D5&gl=FR&hl=en-US&cm=2&pc=n&src=1,https://consent.google.com/ml?continue=https://news.google.com/rss/articles/CBMilAFodHRwczovL3d3dy5hYmVuZHplaXR1bmctbXVlbmNoZW4uZGUvcHJvbWlzL2lycmVyLXBsYW4tZGVyLXJveWFscy1tZWdoYW5zLWdlc2ljaHQtc29sbC1iZWkta3JvZW51bmctdmVyZGVja3Qtd2VyZGVuLXdhcy1kaWUtZXhwZXJ0aW4tc2FndC1hcnQtODkxNjc40gEA?oc%3D5&gl=FR&hl=en-US&cm=2&pc=n&src=1,0,consent.google.com,Irrer Plan der Royals: Meghans Gesicht soll bei Krönung verdeckt werden – was die Expertin sagt - Abendzeitung,"<ol><li>Irrer Plan der Royals: Meghans Gesicht soll bei Krönung verdeckt werden – was die Expertin sagt  Abendzeitung
</li><li>Krönung König Charles III.: Harry und Meghan: Kommen sie oder kommen sie nicht?  STERN.de
</li><li>Noch einen Monat bis zur Krönun…",,2023-04-06T17:17:00Z,,"We use cookies and data to<ul><li>Deliver and maintain Google services</li><li>Track outages and protect against spam, fraud, and abuse</li><li>Measure audience engagement and site statistics to unde… [+1131 chars]",,de,'König Charles III'
https://www.n-tv.de/leute/Zwist-ueberschattet-Vorbereitungen-zur-Kroenung-article24038787.html,https://www.n-tv.de/leute/Zwist-ueberschattet-Vorbereitungen-zur-Kroenung-article24038787.html,0,www.n-tv.de,Kommen Harry und Meghan?: Zwist überschattet Vorbereitungen zur Krönung,"Einen Monat vor der offiziellen Krönungsfeier von Charles III. steigt die Fieberkurve in Großbritannien allmählich an. Auch, weil nach wie vor unklar ist, ob Prinz Harry und Herzogin Meghan denn nun kommen werden oder nicht. Angeblich machen sie ihr Erscheine…",https://bilder2.n-tv.de/img/incoming/crop24038797/1141326856-cImg_16_9-w1200/403156528.jpg,2023-04-06T18:21:55Z,https://web.archive.org/web/20230406183043/https://www.n-tv.de/leute/Zwist-ueberschattet-Vorbereitungen-zur-Kroenung-article24038787.html,"Einen Monat vor der offiziellen Krönungsfeier von Charles III. steigt die Fieberkurve in Großbritannien allmählich an. Auch, weil nach wie vor unklar ist, ob Prinz Harry und Herzogin Meghan denn nun … [+4171 chars]",,de,'Charles III'
https://consent.google.com/ml?continue=https://news.google.com/rss/articles/CBMibWh0dHBzOi8vd3d3LnZpcC5kZS9jbXMvcHJpbnotaGFycnktdW5kLWhlcnpvZ2luLW1lZ2hhbi1iYWxrb24tdmVyYm90LWJlaS1rb2VuaWctY2hhcmxlcy1rcm9lbnVuZy01MDM3Mzc2Lmh0bWzSAW1odHRwczovL2FtcC52aXAuZGUvY21zL3ByaW56LWhhcnJ5LXVuZC1oZXJ6b2dpbi1tZWdoYW4tYmFsa29uLXZlcmJvdC1iZWkta29lbmlnLWNoYXJsZXMta3JvZW51bmctNTAzNzM3Ni5odG1s?oc%3D5&gl=FR&hl=en-US&cm=2&pc=n&src=1,https://consent.google.com/ml?continue=https://news.google.com/rss/articles/CBMibWh0dHBzOi8vd3d3LnZpcC5kZS9jbXMvcHJpbnotaGFycnktdW5kLWhlcnpvZ2luLW1lZ2hhbi1iYWxrb24tdmVyYm90LWJlaS1rb2VuaWctY2hhcmxlcy1rcm9lbnVuZy01MDM3Mzc2Lmh0bWzSAW1odHRwczovL2FtcC52aXAuZGUvY21zL3ByaW56LWhhcnJ5LXVuZC1oZXJ6b2dpbi1tZWdoYW4tYmFsa29uLXZlcmJvdC1iZWkta29lbmlnLWNoYXJsZXMta3JvZW51bmctNTAzNzM3Ni5odG1s?oc%3D5&gl=FR&hl=en-US&cm=2&pc=n&src=1,0,consent.google.com,"Prinz Harry und Herzogin Meghan: Balkon-Verbot bei König Charles' Krönung - VIP.de, Star News","<ol><li>Prinz Harry und Herzogin Meghan: Balkon-Verbot bei König Charles' Krönung  VIP.de, Star News
</li><li>Krönung König Charles III.: Harry und Meghan: Kommen sie oder kommen sie nicht?  STERN.de
</li><li>König Charles lädt zur Krönung: Die versteckten …",,2023-04-06T23:57:41Z,,"We use cookies and data to<ul><li>Deliver and maintain Google services</li><li>Track outages and protect against spam, fraud, and abuse</li><li>Measure audience engagement and site statistics to unde… [+1131 chars]",,de,'Charles III'
https://www.brigitte.de/aktuell/gottesdienst-royal-maundy--koenig-charles-iii--verteilt-traditionell-seine-silbermuenzen-13507472.html,https://www.brigitte.de/aktuell/gottesdienst-royal-maundy--koenig-charles-iii--verteilt-traditionell-seine-silbermuenzen-13507472.html,0,www.brigitte.de,Gottesdienst Royal Maundy: König Charles III. verteilt traditionell seine Silbermünzen,"König Charles III. und seine Frau, Queen Camilla, haben am Gründonnerstag den Royal-Maundy-Gottesdienst in der York Minster besucht.",https://image.brigitte.de/13507474/t/Wx/v1/w1440/r1.7778/-/07--koenig-charles-iii--verteilt-traditionell-seine-silbermuenzen---1-1---spoton-article-1042312.jpg,2023-04-07T09:55:00Z,,"König Charles III. und seine Frau, Queen Camilla, haben am Gründonnerstag den Royal-Maundy-Gottesdienst in der York Minster besucht.
Beim alljährlichen Royal-Maundy-Gottesdienst am Gründonnerstag ha… [+1226 chars]",,de,'Charles III'
https://www.stern.de/kultur/gottesdienst-royal-maundy--koenig-charles-verteilt-seine-silbermuenzen-33356996.html,https://www.stern.de/kultur/gottesdienst-royal-maundy--koenig-charles-verteilt-seine-silbermuenzen-33356996.html,0,www.stern.de,Gottesdienst Royal Maundy: König Charles verteilt seine Silbermünzen,"König Charles III. und seine Frau, Queen Camilla, haben am Gründonnerstag den Royal-Maundy-Gottesdienst in der York Minster besucht.",https://image.stern.de/33357000/t/oi/v1/w1440/r1.7778/-/07--koenig-charles-verteilt-seine-silbermuenzen---16-9---spoton-article-1042312.jpg,2023-04-07T09:55:00Z,https://web.archive.org/web/20230407103449/https://www.stern.de/kultur/gottesdienst-royal-maundy--koenig-charles-verteilt-seine-silbermuenzen-33356996.html,"König Charles III. und seine Frau, Queen Camilla, haben am Gründonnerstag den Royal-Maundy-Gottesdienst in der York Minster besucht.
Beim alljährlichen Royal-Maundy-Gottesdienst am Gründonnerstag ha… [+1226 chars]",,de,'König Charles III'
