index,url,valid,domain,title,description,image,published,archive,content,quote,language,keyword
https://www.zeit.de/politik/2025-01/friedrich-merz-erfurt-thueringen-ablehnung-migrationsgesetz-bundestag,https://www.zeit.de/politik/2025-01/friedrich-merz-erfurt-thueringen-ablehnung-migrationsgesetz-bundestag,0,www.zeit.de,"Friedrich Merz: Merz lacht, er prustet fast",Am Ende einer denkwürdigen Woche schaut Friedrich Merz wie ein Entertainer auf die Geschehnisse im Bundestag zurück. Er glaubt noch immer: Seine Wette kann aufgehen.,https://img.zeit.de/politik/2025-01/friedrich-merz-erfurt-thueringen-ablehnung-migrationsgesetz-bundestag-bild-6/wide__1300x731,2025-02-01T05:19:34Z,http://archive.md/20250201052922/https://www.zeit.de/politik/2025-01/friedrich-merz-erfurt-thueringen-ablehnung-migrationsgesetz-bundestag,"Am späten Freitagabend, nach seiner Niederlage im Bundestag, am Schluss der wohl entscheidenden Woche in seiner politischen Karriere, tritt ein ganz anderer Friedrich Merz auf eine Bühne. Um 18 Uhr h… [+719 chars]",,de,'Friedrich Merz'
https://www.brigitte.de/aktuell/pete-davidson--so-viel-zahlte-er-fuer-seine-tattoo-entfernungen-13940590.html,https://www.brigitte.de/aktuell/pete-davidson--so-viel-zahlte-er-fuer-seine-tattoo-entfernungen-13940590.html,0,www.brigitte.de,Pete Davidson: So viel zahlte er für seine Tattoo-Entfernungen,Ein neues Leben: Pete Davidson investiert 200.000 Dollar in die Entfernung seiner Tattoos. Seit September ist der Comedian zudem clean.,https://image.brigitte.de/13940592/t/M-/v1/w1440/r1.7778/-/01--so-viel-zahlte-er-fuer-seine-tattoo-entfernungen---1-1---spoton-article-1085656.jpg,2025-02-01T09:40:00Z,,"Ein neues Leben: Pete Davidson investiert 200.000 Dollar in die Entfernung seiner Tattoos. Seit September ist der Comedian zudem clean.
Ein kostspieliger Neuanfang: Der ehemalige ""Saturday Night Liv… [+2528 chars]",,de,'Pete Davidson'
https://www.stern.de/lifestyle/leute/pete-davidson--so-viel-zahlte-er-fuer-die-tattoo-entfernung-35431472.html,https://www.stern.de/lifestyle/leute/pete-davidson--so-viel-zahlte-er-fuer-die-tattoo-entfernung-35431472.html,0,www.stern.de,Pete Davidson: So viel zahlte er für die Tattoo-Entfernung,Ein neues Leben: Pete Davidson investiert 200.000 Dollar in die Entfernung seiner Tattoos. Seit September ist der Comedian zudem clean.,https://image.stern.de/35431476/t/gg/v1/w1440/r1.7778/-/01--so-viel-zahlte-er-fuer-die-tattoo-entfernung---16-9---spoton-article-1085656.jpg,2025-02-01T09:43:00Z,,"Kopiere den aktuellen Link
Ein neues Leben: Pete Davidson investiert 200.000 Dollar in die Entfernung seiner Tattoos. Seit September ist der Comedian zudem clean.
Ein kostspieliger Neuanfang: Der e… [+2491 chars]",,de,'Hillary Clinton'
https://www.faz.net/aktuell/stil/trends-nischen/putins-oligarchen-ueber-den-einfluss-superreicher-in-russland-neue-filme-und-serien-im-februar-2025-bei-ard-zdf-und-arte-110213470.html,https://www.faz.net/aktuell/stil/trends-nischen/putins-oligarchen-ueber-den-einfluss-superreicher-in-russland-neue-filme-und-serien-im-februar-2025-bei-ard-zdf-und-arte-110213470.html,0,www.faz.net,Streaming im Februar 2025: „Putins Oligarchen“ über den Einfluss Russlands Superreicher bei Arte,"Die Bundestagswahl, studiVZ und das angeblich wahre Wesen des Schauspielers Lars Eidinger: Im Februar starten in den Mediatheken vielfältige Inhalte. Die Highlights im Überblick.",https://media0.faz.net/ppmedia/aktuell/2475951511/1.10253632/facebook_teaser/putin-gratuliert-der.jpg,2025-02-01T14:34:58Z,,"Im Februar in der ARD-Mediathek zu sehen
Derbies Die größten Fußballspiele der Welt: Diese Reportage-Reihe befasst sich mit der Geschichte drei hitziger Derbies. Das Old Firm zwischen Glasgow Ranger… [+6948 chars]",,de,'Putin'
https://www.n-tv.de/politik/Trauer-um-Horst-Koehler-Mann-mit-Ecken-und-Kanten-article25532568.html,https://www.n-tv.de/politik/Trauer-um-Horst-Koehler-Mann-mit-Ecken-und-Kanten-article25532568.html,0,www.n-tv.de,"Merkel, Scholz, Merz kondolieren: Trauer um Horst Köhler: ""Mann mit Ecken und Kanten""","Parteiübergreifend würdigen Spitzenpolitiker das Vermächtnis des mit 81 Jahren verstorbenen Horst Köhler. Wegbegleiterin Angela Merkel war vom früheren Bundespräsidenten ""immer wieder beeindruckt"". Vielfach herausgestellt wird auch sein Engagement über Deutsc…",https://www.n-tv.de/img/incoming/crop25532572/9661327001-cImg_16_9-w1200/21174461.jpg,2025-02-01T15:50:05Z,,"Parteiübergreifend würdigen Spitzenpolitiker das Vermächtnis des mit 81 Jahren verstorbenen Horst Köhler. Wegbegleiterin Angela Merkel war vom früheren Bundespräsidenten ""immer wieder beeindruckt"". V… [+3834 chars]",,de,'Angela Merkel'
https://www.stern.de/lifestyle/leute/witzige-ehrung--jon-hamm-mit--hasty-pudding--preis-gefeiert-35432092.html,https://www.stern.de/lifestyle/leute/witzige-ehrung--jon-hamm-mit--hasty-pudding--preis-gefeiert-35432092.html,0,www.stern.de,"Witzige Ehrung: Jon Hamm mit ""Hasty Pudding""-Preis gefeiert","Jon Hamm ist durch die Dramaserie ""Mad Men"" bekannt. Bei einer Preisvergabe auf dem Campus der ehrwürdigen Harvard-Universität musste er nun Humor beweisen.",https://image.stern.de/35432094/t/qX/v1/w1440/r1.7778/-/01--ika3wltunxv5axs2048jpeg---36588dd15c3254e5.jpg,2025-02-01T16:20:42Z,,"Kopiere den aktuellen Link
Jon Hamm ist durch die Dramaserie ""Mad Men"" bekannt. Bei einer Preisvergabe auf dem Campus der ehrwürdigen Harvard-Universität musste er nun Humor beweisen.
US-Schauspiel… [+1365 chars]",,de,'Jon Hamm'
https://www.tagesspiegel.de/gesellschaft/witzige-ehrung-jon-hamm-mit-hasty-pudding-preis-gefeiert-13130035.html,https://www.tagesspiegel.de/gesellschaft/witzige-ehrung-jon-hamm-mit-hasty-pudding-preis-gefeiert-13130035.html,0,www.tagesspiegel.de,Witzige Ehrung: Jon Hamm mit „Hasty Pudding“-Preis gefeiert,Jon Hamm ist durch die Dramaserie „Mad Men“ bekannt. Bei einer Preisvergabe auf dem Campus der ehrwürdigen Harvard-Universität musste er nun Humor beweisen.,https://www.tagesspiegel.de/images/13130032/alternates/BASE_16_9_W1400/1738426913000/us-schauspieler-jon-hamm-bekommt-theaterpreis-hasty-pudding.jpeg,2025-02-01T16:21:53Z,,"US-Schauspieler Jon Hamm (53) ist von der Theatergruppe der ehrwürdigen Harvard-Universität als Mann des Jahres gefeiert worden. Hamm, aus der Dramaserie Mad Men bekannt, nahm den ungewöhnlichen Hast… [+1914 chars]",,de,'Jon Hamm'
https://www.stern.de/gesellschaft/regional/nordrhein-westfalen/kundgebungen-in-nrw---fritz-hoer-auf-mutti----zehntausende-bei-demos-gegen-merz-35431614.html,https://www.stern.de/gesellschaft/regional/nordrhein-westfalen/kundgebungen-in-nrw---fritz-hoer-auf-mutti----zehntausende-bei-demos-gegen-merz-35431614.html,0,www.stern.de,"Kundgebungen in NRW: ""Fritz hör auf Mutti"" - Zehntausende bei Demos gegen Merz",Die AfD verhilft einem Unionsantrag zur Migrationspolitik im Bundestag zur Mehrheit. Bei Demos in NRW schlagen Friedrich Merz deshalb heftige Kritik und beißender Spott entgegen.,https://image.stern.de/35432070/t/4G/v2/w1440/r1.7778/-/01--5yakdjwmihv5axs2048jpeg---af7c0190ae4fa57c.jpg,2025-02-01T16:24:15Z,,"Kopiere den aktuellen Link
Die AfD verhilft einem Unionsantrag zur Migrationspolitik im Bundestag zur Mehrheit. Bei Demos in NRW schlagen Friedrich Merz deshalb heftige Kritik und beißender Spott en… [+1513 chars]",,de,'Friedrich Merz'
https://www.stern.de/gesellschaft/regional/hamburg-schleswig-holstein/kundgebungen--tausende-bei-demo-in-hamburg-fuer-demokratie-und-vielfalt-35432096.html,https://www.stern.de/gesellschaft/regional/hamburg-schleswig-holstein/kundgebungen--tausende-bei-demo-in-hamburg-fuer-demokratie-und-vielfalt-35432096.html,0,www.stern.de,Kundgebungen: Tausende bei Demo in Hamburg für Demokratie und Vielfalt,Die AfD verhilft einem Unionsantrag zur Migrationspolitik im Bundestag zur Mehrheit. Bei einer großen Demo in Hamburg schlägt CDU-Chef Friedrich Merz Widerstand entgegen.,https://image.stern.de/35432098/t/l0/v1/w1440/r1.7778/-/01--uxvxgwcycev5axs2048jpeg---c5acc9d302964422.jpg,2025-02-01T16:28:26Z,,"Kopiere den aktuellen Link
Die AfD verhilft einem Unionsantrag zur Migrationspolitik im Bundestag zur Mehrheit. Bei einer großen Demo in Hamburg schlägt CDU-Chef Friedrich Merz Widerstand entgegen.… [+1217 chars]",,de,'Friedrich Merz'
https://orf.at/stories/3383611/,https://orf.at/stories/3383611/,0,orf.at,Jon Hamm mit „Hasty Pudding“-Preis gefeiert,,https://orf.at/mojo/1_4_1/storyserver//news/common/images/og-fallback-news.png,2025-02-01T16:28:56Z,,US-Schauspieler Jon Hamm (53) ist von der Theatergruppe der Harvard-Universität als Mann des Jahres gefeiert worden. Hamm nahm den ungewöhnlichen Hasty Pudding-Preis in Form eines Puddingtopfes in Ca… [+984 chars],,de,'Jon Hamm'
https://www.diepresse.com/19318345/man-kann-die-brandmauer-debatte-auch-uebertreiben,https://www.diepresse.com/19318345/man-kann-die-brandmauer-debatte-auch-uebertreiben,0,www.diepresse.com,Man kann die Brandmauer-Debatte auch übertreiben [premium],"CDU-Chef Friedrich Merz schließt eine Koalition mit der AfD kategorisch und glaubwürdig aus. Er steht in Deutschland schon allein deswegen am Pranger, weil die extrem Rechten im Bundestag für Vorschläge von ihm gestimmt haben. Das ist unfair.",https://img.diepresse.com/public/incoming/k8qq5n-imago799057199/alternates/DPR_SOCIAL_MEINUNG/imago799057199,2025-02-01T16:45:39Z,http://archive.md/20250202184436/https://www.diepresse.com/19318345/man-kann-die-brandmauer-debatte-auch-uebertreiben,"CDU-Chef Friedrich Merz schließt eine Koalition mit der AfD kategorisch und glaubwürdig aus. Er steht in Deutschland schon allein deswegen am Pranger, weil die extrem Rechten im Bundestag für Vorschl… [+729 chars]",,de,'Friedrich Merz'
https://www.tagesspiegel.de/politik/merz-behauptung-im-faktencheck-tagliche-gruppenvergewaltigungen-von-asylbewerbern-13127299.html,https://www.tagesspiegel.de/politik/merz-behauptung-im-faktencheck-tagliche-gruppenvergewaltigungen-von-asylbewerbern-13127299.html,0,www.tagesspiegel.de,Merz’ Behauptung im Faktencheck: „Tägliche Gruppenvergewaltigungen“ von Asylbewerbern?,CDU-Kanzlerkandidat Friedrich Merz irritiert im Bundestag mit einer Aussage zu Asylbewerbern. Die von ihm gewählte Formulierung ist so nicht richtig.,https://www.tagesspiegel.de/images/13127341/alternates/BASE_16_9_W1400/1738342524000/session-of-the-lower-house-of-parliament-bundestag.jpeg,2025-02-01T16:46:11Z,https://web.archive.org/web/20250201183134/https://www.tagesspiegel.de/politik/merz-behauptung-im-faktencheck-tagliche-gruppenvergewaltigungen-von-asylbewerbern-13127299.html,Friedrich Merz (CDU) wollte am Freitag ein Zustrombegrenzungsgesetz durch den Bundestag bringen und scheiterte. Zuvor warb der Kanzlerkandidat der Union im Plenum für sein Vorhaben und erklärte unter… [+4172 chars],,de,'Friedrich Merz'
https://www.welt.de/politik/deutschland/article255316400/Migrationspolitik-Fritz-hoer-auf-Mutti-Zehntausende-bei-bundesweiten-Demos-gegen-Merz-und-AfD.html,https://www.welt.de/politik/deutschland/article255316400/Migrationspolitik-Fritz-hoer-auf-Mutti-Zehntausende-bei-bundesweiten-Demos-gegen-Merz-und-AfD.html,0,www.welt.de,"„Fritz, hör auf Mutti“ – Zehntausende bei bundesweiten Demos gegen Merz und AfD","Die AfD verhalf einem Unionsantrag zur Migrationspolitik im Bundestag zur Mehrheit, ein anderer scheiterte. Bei bundesweiten Demos schlagen Friedrich Merz und der AfD deshalb heftige Kritik und beißender Spott entgegen.",https://img.welt.de/img/politik/deutschland/mobile255316396/3337939707-ci16x9-w1200/Demonstration-zur-Migrationspolitik-Koeln.jpg,2025-02-01T16:47:59Z,https://web.archive.org/web/20250201193228/https://www.welt.de/politik/deutschland/article255316400/Migrationspolitik-Fritz-hoer-auf-Mutti-Zehntausende-bei-bundesweiten-Demos-gegen-Merz-und-AfD.html,"Die AfD verhalf einem Unionsantrag zur Migrationspolitik im Bundestag zur Mehrheit, ein anderer scheiterte. Bei bundesweiten Demos schlagen Friedrich Merz und der AfD deshalb heftige Kritik und beiße… [+3109 chars]",,de,'Friedrich Merz'
https://www.tagesspiegel.de/politik/fur-die-union-ist-das-eine-katastrophe-wer-vom-streit-um-die-migration-profitiert--und-wer-verliert-13129900.html,https://www.tagesspiegel.de/politik/fur-die-union-ist-das-eine-katastrophe-wer-vom-streit-um-die-migration-profitiert--und-wer-verliert-13129900.html,0,www.tagesspiegel.de,„Für die Union ist das eine Katastrophe“: Wer vom Streit um die Migration profitiert – und wer verliert,"Friedrich Merz ist nach einer turbulenten Woche „mit sich im Reinen“, wie er sagt. Aber die Wähler auch? Demoskopen zufolge gibt es aktuell vor allem einen überraschenden Gewinner.",https://www.tagesspiegel.de/images/13129954/alternates/BASE_16_9_W1400/1738425722000/berlin-deutschland-31-01-2025-deutscher-bundestag-pressekonferenz-cdu-csu-bundestagsfraktion-cdu-chef-friedrich-mer.jpeg,2025-02-01T17:12:06Z,http://archive.md/20250201180655/https://www.tagesspiegel.de/politik/fur-die-union-ist-das-eine-katastrophe-wer-vom-streit-um-die-migration-profitiert--und-wer-verliert-13129900.html,"Als Friedrich Merz am Freitag um kurz nach 18 Uhr vor die Kameras tritt, gibt er sich alle Mühe, so etwas wie Entspannung auszustrahlen. Er sei mit sich im Reinen, sagt der Unionskanzlerkandidat leic… [+105 chars]",,de,'Friedrich Merz'
https://hallespektrum.de/aktuelles/wieder-gingen-in-halle-8000-menschen-auf-die-strasse-gegen-cdu-afd-und-merz/469292/,https://hallespektrum.de/aktuelles/wieder-gingen-in-halle-8000-menschen-auf-die-strasse-gegen-cdu-afd-und-merz/469292/,0,hallespektrum.de,"Wieder gingen in Halle 8000 Menschen auf die Straße gegen CDU, AfD und Merz","Rund 8.000 Menschen haben am Samstag in Halle gegen eine Zusammenarbeit zwischen CDU und AfD demonstriert. Die Kundgebung, organisiert vom Bündnis „Halle gegen Rechts“, begann am Landesmuseum für Vorgeschichte und führte über die Ludwig-Wucherer-Straße bis zu…",https://hallespektrum.de/wp-content/uploads/2025/02/ac05f347-7549-44a2-b13d-e6e2005d90ac-1.jpg,2025-02-01T17:20:57Z,,"Rund 8.000 Menschen haben am Samstag in Halle gegen eine Zusammenarbeit zwischen CDU und AfD demonstriert. Die Kundgebung, organisiert vom Bündnis Halle gegen Rechts, begann am Landesmuseum für Vorge… [+2214 chars]",,de,'Friedrich Merz'
https://www.welt.de/politik/deutschland/video255316946/Nach-Asyl-Abstimmungen-Zehntausende-bei-bundesweiten-Demos-gegen-Merz-und-AfD.html,https://www.welt.de/politik/deutschland/video255316946/Nach-Asyl-Abstimmungen-Zehntausende-bei-bundesweiten-Demos-gegen-Merz-und-AfD.html,0,www.welt.de,Zehntausende bei bundesweiten Demos gegen Merz und AfD,Nach den Abstimmungen im Bundestag über Vorschläge der Union zur Verschärfung von Migrationsregeln kommt es in mehreren Städten zu Protesten. Zehntausende Menschen demonstrieren gegen den Kurs von Friedrich Merz und gegen die AfD.,https://img.welt.de/img/politik/deutschland/mobile255316958/8957936037-ci16x9-w1200/Demonstration-zur-Migrationspolitik-Hamburg.jpg,2025-02-01T18:18:35Z,,Nach den Abstimmungen im Bundestag über Vorschläge der Union zur Verschärfung von Migrationsregeln kommt es in mehreren Städten zu Protesten. Zehntausende Menschen demonstrieren gegen den Kurs von Fr… [+90 chars],,de,'Friedrich Merz'
https://www.bild.de/politik/nach-bundestags-asyl-eklat-merz-und-baerbock-feiern-bei-wein-party-679e213dd72ca12c3499c1c1,https://www.bild.de/politik/nach-bundestags-asyl-eklat-merz-und-baerbock-feiern-bei-wein-party-679e213dd72ca12c3499c1c1,0,www.bild.de,Baerbock und Merz gemeinsam auf Party - Trotz Asyl-Eklat: Ein Weinchen geht immer,Erst beschimpfen sich Union und Grüne im Bundestag. Dann trinken sie auf einer privaten Feier Wein miteinander. Um sich später im Parlament wieder anzubrüllen.,"https://images.bild.de/679e213dd72ca12c3499c1c1/bac90ac432aae2a86fd38fea492d05b0,c410f155?w=1280",2025-02-01T18:36:08Z,http://archive.md/20250201190407/https://www.bild.de/politik/nach-bundestags-asyl-eklat-merz-und-baerbock-feiern-bei-wein-party-679e213dd72ca12c3499c1c1,"Erst beschimpfen sich Union und Grüne im Bundestag. Dann trinken sie auf einer privaten Feier Wein miteinander. Um sich am nächsten Morgen im Parlament wieder anzubrüllen.
Seit dem bitterbösen Asyls… [+2350 chars]",,de,'Friedrich Merz'
https://www.bild.de/politik/inland/war-es-kalkuel-oder-ueberzeugung-das-sind-die-lindner-gegner-in-der-fdp-679df844d72ca12c3499c021,https://www.bild.de/politik/inland/war-es-kalkuel-oder-ueberzeugung-das-sind-die-lindner-gegner-in-der-fdp-679df844d72ca12c3499c021,0,www.bild.de,Konkurrenz aus der 2. Reihe - Was planen die Lindner-Gegner in der FDP?,23 FDP-Abgeordnete haben gegen das Asyl-Gesetz von Friedrich Merz gestimmt oder sich bei der Abstimmung enthalten – und den Erfolg des Vorhabens torpediert.,"https://images.bild.de/679df844d72ca12c3499c021/a4bfdf0227219b7e280587dad75d3308,d25b4a1c?w=1280",2025-02-01T18:41:35Z,http://archive.md/20250201190421/https://www.bild.de/politik/inland/war-es-kalkuel-oder-ueberzeugung-das-sind-die-lindner-gegner-in-der-fdp-679df844d72ca12c3499c021,23 FDP-Abgeordnete haben gegen das Asyl-Gesetz von Friedrich Merz (69) gestimmt oder sich bei der Abstimmung enthalten und den Erfolg des Vorhabens des CDU-Chefs so vereitelt. Rund ein Viertel aller … [+3374 chars],,de,'Friedrich Merz'
https://www.faz.net/aktuell/politik/bundestagswahl/merz-und-sein-mut-zum-risiko-110268089.html,https://www.faz.net/aktuell/politik/bundestagswahl/merz-und-sein-mut-zum-risiko-110268089.html,0,www.faz.net,Abstimmung mit der AfD: Merz und sein Mut zum Risiko,"Mit der Entscheidung, seine Asylpolitik mit AfD-Stimmen durchzusetzen, hat Friedrich Merz Mut bewiesen. Die erhoffte Wirkung hängt nun von seiner Partei ab.",https://media1.faz.net/ppmedia/aktuell/politik/4121314559/1.10268077/facebook_teaser/die-afd-mit-der-afd-bekaempfen.jpg,2025-02-01T18:55:15Z,http://archive.md/20250201191211/https://www.faz.net/aktuell/politik/bundestagswahl/merz-und-sein-mut-zum-risiko-110268089.html,"Friedrich Merz ist all-in gegangen, und viele fragen sich, ob es, um in seiner Terminologie zu bleiben, ein one-off war, also ein einmaliges Nutzen von AfD-Stimmen. Der Kanzlerkandidat der Union vers… [+4397 chars]",,de,'Friedrich Merz'
https://www.tagesspiegel.de/politik/wer-berat-friedrich-merz-auf-wen-der-unions-kanzlerkandidat-wirklich-hort-13129174.html,https://www.tagesspiegel.de/politik/wer-berat-friedrich-merz-auf-wen-der-unions-kanzlerkandidat-wirklich-hort-13129174.html,0,www.tagesspiegel.de,Wer berät Friedrich Merz?: Auf wen der Unions-Kanzlerkandidat wirklich hört,"Mit wem beratschlagt sich der CDU-Chef, wenn er einen so umstrittenen Kurs einschlägt wie zuletzt? Sein Netzwerk an Kontakten ist groß, das der wirklich engen Berater eher klein.",https://www.tagesspiegel.de/images/13129213/alternates/BASE_16_9_W1400/1738437654000/24-01-2025-berlin-igw-internationale-grune-woche-friedrich-merz-cdu-beim-presserundgang-im-gesprach-mit-joachim-rukw.jpeg,2025-02-01T19:26:44Z,http://archive.md/20250201193907/https://www.tagesspiegel.de/politik/wer-berat-friedrich-merz-auf-wen-der-unions-kanzlerkandidat-wirklich-hort-13129174.html,"Wäre alles anders gekommen in der zurückliegenden Woche, wenn Wolfgang Schäuble noch da wäre? Der Ende 2023 verstorbene Grandseigneur der CDU war für deren heutigen Parteichef über Jahrzehnte Mentor … [+187 chars]",,de,'Wolfgang Schäuble'
https://www.bild.de/politik/inland/wochen-der-wahrheit-sind-wir-noch-regierbar-679e82a008bc756e749d439b,https://www.bild.de/politik/inland/wochen-der-wahrheit-sind-wir-noch-regierbar-679e82a008bc756e749d439b,0,www.bild.de,Wochen der Wahrheit - Sind wir noch regierbar?,"Als Friedrich Merz am Freitag, um 18.22 Uhr, den Reichstag verlässt, ist Deutschland um eine Erkenntnis reicher: Im Parlament gibt es keine Mehrheit für ...","https://images.bild.de/679e82a008bc756e749d439b/f45db2c49091dd7046013fda82ad7210,93ec9366?w=1280",2025-02-02T07:53:24Z,http://archive.md/20250202081411/https://www.bild.de/politik/inland/wochen-der-wahrheit-sind-wir-noch-regierbar-679e82a008bc756e749d439b,"Als Friedrich Merz am Freitag, um 18.22 Uhr, den Reichstag verlässt, ist Deutschland um eine Erkenntnis reicher: Im Parlament gibt es keine Mehrheit für den Mehrheitswillen der Bürger. Eine Woche lan… [+9667 chars]",,de,'Friedrich Merz'
https://www.focus.de/politik/meinung/nena-und-die-andere-meinung-spd-mann-setzt-sich-fuer-harte-migrationspolitik-ein-warum-schiesst-er-dann-gegen-merz_id_260686870.html,https://www.focus.de/politik/meinung/nena-und-die-andere-meinung-spd-mann-setzt-sich-fuer-harte-migrationspolitik-ein-warum-schiesst-er-dann-gegen-merz_id_260686870.html,0,www.focus.de,Nena und die andere Meinung - SPD-Mann fordert „harte Migrationspolitik“ – warum schießt er dann gegen Merz?,Hat CDU-Chef Friedrich Merz den Bundestag im positiven Sinne zum Beben gebracht? Oder die berühmte „Brandmauer“ durchschritten? Darüber debattiere ich diese Woche mit SPD-Politiker Johannes Arlt. Schenken Sie mir einen Augenblick für beide Meinungen.Von FOCUS…,https://p6.focus.de/img/fotos/id_260686879/nena.png?im=Crop%3D%28324%2C0%2C3688%2C1844%29%3BResize%3D%281200%2C627%29&impolicy=perceptual&quality=mediumHigh&hash=158a1a6ac40094e55f4814ca40add707953b5791502b6a6f64f14f495889ecce,2025-02-02T08:27:27Z,,Hat CDU-Chef Friedrich Merz den Bundestag im positiven Sinne zum Beben gebracht? Oder die berühmte Brandmauer durchschritten? Darüber debattiere ich diese Woche mit SPD-Politiker Johannes Arlt. Schen… [+12358 chars],,de,'Friedrich Merz'
https://www.stern.de/politik/deutschland/habeck-greift-merz-frontal-an---disqualifikation--fuer-amt-des-kanzlers-35432882.html,https://www.stern.de/politik/deutschland/habeck-greift-merz-frontal-an---disqualifikation--fuer-amt-des-kanzlers-35432882.html,0,www.stern.de,"Migrationspolitik: Habeck greift Merz frontal an: ""Disqualifikation"" für Amt des Kanzlers",Die Abstimmungen im Bundestag zur Migrationspolitik lösen Empörung aus. Grünen-Kanzlerkandidat Robert Habeck attackiert nun CDU-Chef Merz – glaubt aber auch an einen Weg zurück.,https://image.stern.de/35432886/t/sb/v1/w1440/r1.7778/-/robert-habeck.jpg,2025-02-02T08:41:00Z,,"Kopiere den aktuellen Link
Die Abstimmungen im Bundestag zur Migrationspolitik lösen Empörung aus. Grünen-Kanzlerkandidat Robert Habeck attackiert nun CDU-Chef Merz glaubt aber auch an einen Weg zur… [+1847 chars]",,de,'Friedrich Merz'
https://www.stern.de/news/merz-gibt-garantie-fuer-politikwechsel---cdu-legt--sofortprogramm--vor-35432914.html,https://www.stern.de/news/merz-gibt-garantie-fuer-politikwechsel---cdu-legt--sofortprogramm--vor-35432914.html,0,www.stern.de,"Merz gibt Garantie für Politikwechsel - CDU legt ""Sofortprogramm"" vor","CDU-Chef Friedrich Merz hat für den Fall seiner Wahl zum Kanzler eine Neuausrichtung des politischen Kurses in Deutschland versprochen. ""Ich gebe den Wählerinnen und Wählern in Deutschland die Garantie, dass es in der Wirtschaftspolitik und in der Asylpolitik…",https://image.stern.de/35432916/t/TG/v1/w1440/r1.7778/-/02--cduchef-merz---06956c771fbe20df.jpg,2025-02-02T08:43:50Z,,"Kopiere den aktuellen Link
CDU-Chef Friedrich Merz hat für den Fall seiner Wahl zum Kanzler eine Neuausrichtung des politischen Kurses in Deutschland versprochen. ""Ich gebe den Wählerinnen und Wähle… [+2506 chars]",,de,'Friedrich Merz'
https://www.bild.de/politik/inland/friedrich-merz-nach-dieser-nacht-fasste-der-cdu-chef-einen-entschluss-679e096408bc756e749d3eb7,https://www.bild.de/politik/inland/friedrich-merz-nach-dieser-nacht-fasste-der-cdu-chef-einen-entschluss-679e096408bc756e749d3eb7,0,www.bild.de,"Aschaffenburg brachte die Wende - Die Nacht, in der Merz alles aufs Spiel setzte","Wie kam es dazu, dass Friedrich Merz im Bundestag die Entscheidung in der Asylfrage suchte? BILD zeichnet die Ereignisse nach.","https://images.bild.de/679e096408bc756e749d3eb7/649caa312e0ad214396ef1ed26c757ac,638a8beb?w=1280",2025-02-02T09:56:43Z,http://archive.md/20250202102649/https://www.bild.de/politik/inland/friedrich-merz-nach-dieser-nacht-fasste-der-cdu-chef-einen-entschluss-679e096408bc756e749d3eb7,"Es ist der 22. Januar 2025. Im bayerischen Aschaffenburg hat ein ausreisepflichtiger, zur Haft ausgeschriebener Afghane den Jungen Yannis (2) und einen 41-Jährigen, der einschreiten will, mit einem M… [+3568 chars]",,de,'Friedrich Merz'
https://www.stern.de/lifestyle/leute/grossbritannien--kate-will-emotionale-kompetenz-der-briten-foerdern-35433048.html,https://www.stern.de/lifestyle/leute/grossbritannien--kate-will-emotionale-kompetenz-der-briten-foerdern-35433048.html,0,www.stern.de,Großbritannien: Kate will emotionale Kompetenz der Briten fördern,"Die moderne Welt kann einen manchmal überrumpeln. Damit die Menschen damit besser klarkommen können, will Prinzessin Kate die sozialen und emotionalen Fähigkeiten gerade von Kindern stärken.",https://image.stern.de/35433050/t/q8/v2/w1440/r1.7778/-/prinzessin-kate.jpg,2025-02-02T09:57:24Z,,"Kopiere den aktuellen Link
Die moderne Welt kann einen manchmal überrumpeln. Damit die Menschen damit besser klarkommen können, will Prinzessin Kate die sozialen und emotionalen Fähigkeiten gerade v… [+1985 chars]",,de,'Prinzessin Kate'
