index,url,valid,domain,title,description,image,published,archive,content,quote,language,keyword
https://orf.at/stories/3380461/,https://orf.at/stories/3380461/,0,orf.at,Russische Drohnenangriffe auf Kiew zu Silvester,,https://orf.at/mojo/1_4_1/storyserver//news/common/images/og-fallback-news.png,2025-01-01T07:27:11Z,https://web.archive.org/web/20250101131648/https://orf.at/stories/3380461/,"Russland hat ukrainischen Angaben zufolge Kiew auch in der Silvesternacht mit Drohnen angegriffen. Dabei seien drei Menschen verletzt worden, teilte die Stadtverwaltung mit. Die Luftabwehr sei im Ein… [+224 chars]",,de,'Vitali Klitschko'
https://www.sueddeutsche.de/muenchen/riem-polizei-grosseinsatz-mann-messer-lux.MtNL2irVhhwLxKrnuTp2nd,https://www.sueddeutsche.de/muenchen/riem-polizei-grosseinsatz-mann-messer-lux.MtNL2irVhhwLxKrnuTp2nd,0,www.sueddeutsche.de,Messestadt Riem: Mann mit Brotmesser löst Großeinsatz aus,"Weil ein 39-Jähriger schreiend mit einem Messer durch die Willy-Brandt-Allee läuft, rückt die Polizei zu einem Großeinsatz aus. Er wurde in ein psychiatrisches Krankenhaus gebracht.",https://www.sueddeutsche.de/2024/04/26/d3c6a607-30a0-4416-9dec-0c547609486f.jpeg?q=60&fm=webp&width=1200&rect=0%2C92%2C1348%2C758,2025-01-01T14:00:15Z,,"Als der Mann die große Zahl von herannahenden Polizeiwagen bemerkte, habe er versucht, sich zu entfernen, konnte aber von Beamten gestellt werden, hieß es im Polizeibericht. Bei der Durchsuchung des … [+277 chars]",,de,'Willy Brandt'
https://www.stern.de/lifestyle/leute/selena-gomez--schauspielerin-wuenscht--frohes-neues-jahr--35348324.html,https://www.stern.de/lifestyle/leute/selena-gomez--schauspielerin-wuenscht--frohes-neues-jahr--35348324.html,0,www.stern.de,"Selena Gomez: Schauspielerin wünscht ""frohes neues Jahr""",Auch Selena Gomez feierte das neue Jahr 2025 - mit einem niedlichen Beitrag im Netz.,https://image.stern.de/35348328/t/Y2/v1/w1440/r1.7778/-/01--schauspielerin-wuenscht--frohes-neues-jahr----16-9---spoton-article-1083344.jpg,2025-01-01T16:13:00Z,https://web.archive.org/web/20250105054140/https://www.stern.de/lifestyle/leute/selena-gomez--schauspielerin-wuenscht--frohes-neues-jahr--35348324.html,"Kopiere den aktuellen Link
Auch Selena Gomez feierte das neue Jahr 2025 - mit einem niedlichen Beitrag im Netz.
Selena Gomez (32) zelebriert das neue Jahr 2025 mit einer niedlichen Bilderreihe im N… [+1577 chars]",,de,'Benny Blanco'
https://www.brigitte.de/aktuell/selena-gomez--schauspielerin-teilt-neujahrsgruesse-auf-social-media-13926840.html,https://www.brigitte.de/aktuell/selena-gomez--schauspielerin-teilt-neujahrsgruesse-auf-social-media-13926840.html,0,www.brigitte.de,Selena Gomez: Schauspielerin teilt Neujahrsgrüße auf Social Media,Auch Selena Gomez feierte das neue Jahr 2025 - mit einem niedlichen Beitrag im Netz.,https://image.brigitte.de/13926842/t/9I/v1/w1440/r1.7778/-/01--schauspielerin-teilt-neujahrsgruesse-auf-social-media---1-1---spoton-article-1083344.jpg,2025-01-01T16:16:00Z,,"Auch Selena Gomez feierte das neue Jahr 2025 - mit einem niedlichen Beitrag im Netz.
Selena Gomez (32) zelebriert das neue Jahr 2025 mit einer niedlichen Bilderreihe im Netz. Am 1. Januar teilte die… [+1552 chars]",,de,'Selena Gomez'
https://www.stern.de/kultur/tv/germanys-next-topmodel/gntm-2025--alle-informationen-zur-20--staffel-mit-heidi-klum-35349110.html,https://www.stern.de/kultur/tv/germanys-next-topmodel/gntm-2025--alle-informationen-zur-20--staffel-mit-heidi-klum-35349110.html,0,www.stern.de,"GNTM 2025: ""Germany's Next Topmodel"": Heidi Klum bekommt zum Jubiläum zwei Folgen pro Woche","Die ProSieben-Show ""Germany's Next Topmodel"", kurz GNTM, feiert 2025 ihr 20-jähriges Jubiläum. Alle Informationen zur 20. Staffel erhalten Sie in unserem Ticker.",https://image.stern.de/35349126/t/or/v1/w1440/r1.7778/-/gntm-heidi-klum.jpg,2025-01-02T09:57:00Z,https://web.archive.org/web/20250102234056/https://www.stern.de/kultur/tv/germanys-next-topmodel/gntm-2025--alle-informationen-zur-20--staffel-mit-heidi-klum-35349110.html,"Kopiere den aktuellen Link
Die ProSieben-Show ""Germany's Next Topmodel"", kurz GNTM, feiert 2025 ihr 20-jähriges Jubiläum. Alle Informationen zur 20. Staffel erhalten Sie in unserem Ticker.
Die Erst… [+9718 chars]",,de,'Heidi Klum'
https://www.zeit.de/politik/deutschland/2025-01/oscar-schneider-ehemaliger-bundesbauminister-csu-gestorben,https://www.zeit.de/politik/deutschland/2025-01/oscar-schneider-ehemaliger-bundesbauminister-csu-gestorben,0,www.zeit.de,CSU-Politiker: Früherer Bundesbauminister Oscar Schneider ist tot,Oscar Schneider war Bauminister in mehreren Kabinetten von Helmut Kohl und setzte sich für den Bau der Reichstagskuppel ein. Er starb im Alter von 97 Jahren.,https://img.zeit.de/politik/deutschland/2025-01/oscar-schneider-ehemaliger-bundesbauminister-csu-gestorben-bild/wide__1300x731,2025-01-02T12:10:51Z,https://web.archive.org/web/20250109113837/https://www.zeit.de/politik/deutschland/2025-01/oscar-schneider-ehemaliger-bundesbauminister-csu-gestorben,"Der frühere Bundesbauminister und CSU-Politiker Oscar Schneider ist tot. Schneider starb am 29. Dezember im Alter von 97 Jahren, teilte die Stadt Nürnberg mit. Die Stadt verliere ""mit Dr. Oscar Schne… [+1914 chars]",,de,'Helmut Kohl'
https://www.bild.de/unterhaltung/royals-adel/prinz-harry-und-sohn-archie-seltenes-foto-zeigt-sie-beim-surfen-67766524d37eab5a7ad63bad,https://www.bild.de/unterhaltung/royals-adel/prinz-harry-und-sohn-archie-seltenes-foto-zeigt-sie-beim-surfen-67766524d37eab5a7ad63bad,0,www.bild.de,Prinz Harry und Archie beim Surfen - Dieses Instagram-Foto verschwand schnell wieder,"Dieser Schnappschuss der Royals in Kalifornien ist so selten, dass er bei Instagram gleich wieder verschwand.","https://images.bild.de/67766524d37eab5a7ad63bad/cd6868f0a8d26b884019be4ae7fb9d1c,dc6e0c38?w=1280",2025-01-02T12:29:22Z,,"Dieser Schnappschuss von Prinz Harry mit Sohn Archie ist so selten, dass er bei Instagram gleich wieder verschwand. Doch Royal-Fans entdeckten ihn und sind völlig außer sich vor Freude und Begeisteru… [+2266 chars]",,de,'Prinz Harry'
https://www.brigitte.de/aktuell/prinz-harry--er-bringt-soehnchen-archie-das-surfen-bei-13927258.html,https://www.brigitte.de/aktuell/prinz-harry--er-bringt-soehnchen-archie-das-surfen-bei-13927258.html,0,www.brigitte.de,Prinz Harry: Er bringt Söhnchen Archie das Surfen bei,Surfen mit Papa: Prinz Harrys Sohn Archie hat offenbar gemeinsam mit seinem Vater ein paar Surfstunden genommen.,https://image.brigitte.de/13927260/t/G3/v1/w1440/r1.7778/-/02--er-bringt-soehnchen-archie-das-surfen-bei---1-1---spoton-article-1083404.jpg,2025-01-02T13:27:00Z,,"Surfen mit Papa: Prinz Harrys Sohn Archie hat offenbar gemeinsam mit seinem Vater ein paar Surfstunden genommen.
Prinz Archie von Sussex wird im Mai 2025 sechs Jahre alt. Doch schon jetzt übt der So… [+1994 chars]",,de,'Prinz Archie'
https://www.stern.de/lifestyle/leute/prinz-harry--suesser-schnappschuss-beim-surfen-mit-archie-35350336.html,https://www.stern.de/lifestyle/leute/prinz-harry--suesser-schnappschuss-beim-surfen-mit-archie-35350336.html,0,www.stern.de,Prinz Harry: Süßer Schnappschuss beim Surfen mit Archie,Surfen mit Papa: Prinz Harrys Sohn Archie hat offenbar gemeinsam mit seinem Vater ein paar Surfstunden genommen.,https://image.stern.de/35350340/t/qN/v1/w1440/r1.7778/-/02--suesser-schnappschuss-beim-surfen-mit-archie---16-9---spoton-article-1083404.jpg,2025-01-02T13:31:00Z,,"Kopiere den aktuellen Link
Surfen mit Papa: Prinz Harrys Sohn Archie hat offenbar gemeinsam mit seinem Vater ein paar Surfstunden genommen.
Prinz Archie von Sussex wird im Mai 2025 sechs Jahre alt.… [+1950 chars]",,de,'Prinz Archie'
https://www.bild.de/sport/mehr-sport/bryce-james-nba-traum-rueckt-naeher-mit-entscheidung-fuer-arizona-677692937dfaed6550989597,https://www.bild.de/sport/mehr-sport/bryce-james-nba-traum-rueckt-naeher-mit-entscheidung-fuer-arizona-677692937dfaed6550989597,0,www.bild.de,Spielt er auch bald in der NBA? - Jüngster LeBron-Sohn trifft Zukunfts-Entscheidung,"Bryce James, Sohn von Basketball-Superstar LeBron James, entscheidet sich für die Universität von Arizona, um seiner NBA-Karriere näher zu kommen.","https://images.bild.de/677692937dfaed6550989597/4fbbb70ff0bf0e5246b7d7e0fd2a45d5,d2549dd3?w=1280",2025-01-02T14:12:37Z,https://web.archive.org/web/20250103045852/https://www.bild.de/sport/mehr-sport/bryce-james-nba-traum-rueckt-naeher-mit-entscheidung-fuer-arizona-677692937dfaed6550989597,"Sein Vater und sein Bruder spielen schon in der NBA! Wird ER einmal der Dritte im Bunde?
Damit dieser Traum eines Tages möglicherweise in Erfüllung geht, hat Bryce James jetzt eine wichtige Entschei… [+1934 chars]",,de,'LeBron James'
https://www.kino.de/artikel/nur-im-januar-kostenlos-streamen-der-fuer-viele-beste-film-aller-zeiten--3595xjjg72,https://www.kino.de/artikel/nur-im-januar-kostenlos-streamen-der-fuer-viele-beste-film-aller-zeiten--3595xjjg72,0,www.kino.de,Nur im Januar kostenlos streamen: Der für viele beste Film aller Zeiten,Dieses Sequel gilt als Meisterwerk unter Filmfans! Zum Jahresbeginn bietet das Epos von Regisseur Francis Ford Coppola einen perfekten Einstieg in den Januar.,https://static.kino.de/85/38/dc/126205dc579478e1bdb59c7fdd_Azg4MTJkNzcxYmNk_der-pate-2-szenenbild.jpg#fp=a7a94ae9ffff,2025-01-02T14:49:26Z,,"Dieses Sequel gilt als Meisterwerk unter Filmfans! Zum Jahresbeginn bietet das Epos von Regisseur Francis Ford Coppola einen perfekten Einstieg in den Januar.
Pünktlich zu den Festtagen und zum Neuj… [+2464 chars]",,de,'Francis Ford Coppola'
https://www.n-tv.de/politik/Ex-Bauminister-und-Kohl-Vertrauter-Oscar-Schneider-ist-tot-article25463492.html,https://www.n-tv.de/politik/Ex-Bauminister-und-Kohl-Vertrauter-Oscar-Schneider-ist-tot-article25463492.html,0,www.n-tv.de,Früherer Kohl-Intimus: Ex-Bauminister Oscar Schneider ist tot,"Unter Bundeskanzler Helmut Kohl leitete er das Bundesbauministerium, vor dem Hauptstadt-Umzug nach Berlin machte er sich für die berühmte Reichstagskuppel stark: Im Alter von 97 Jahren ist der CSU-Politiker Oscar Schneider gestorben.",https://bilder2.n-tv.de/img/incoming/crop25463481/5871321416-cImg_16_9-w1200/cd370eeaab12fa53dee6c12933c91202.jpg,2025-01-02T15:24:40Z,https://web.archive.org/web/20250102165455/https://www.n-tv.de/politik/Ex-Bauminister-und-Kohl-Vertrauter-Oscar-Schneider-ist-tot-article25463492.html,"Unter Bundeskanzler Helmut Kohl leitete er das Bundesbauministerium, vor dem Hauptstadt-Umzug nach Berlin machte er sich für die berühmte Reichstagskuppel stark: Im Alter von 97 Jahren ist der CSU-Po… [+1593 chars]",,de,'Helmut Kohl'
https://www.stern.de/lifestyle/leute/soziale-medien--herzogin-meghan-gibt-comeback-auf-instagram-35350900.html,https://www.stern.de/lifestyle/leute/soziale-medien--herzogin-meghan-gibt-comeback-auf-instagram-35350900.html,0,www.stern.de,Soziale Medien: Herzogin Meghan gibt Comeback auf Instagram,Montecito/London - Herzogin Meghan ist zurück auf Instagram. Die Frau von Prinz Harry (40) hatte sich in den vergangenen Jahren von den sozialen Medien,https://image.stern.de/35350902/t/w9/v1/w1440/r1.7778/-/02--qzsvwlbim3v5axs2048jpeg---55857be6b3378ca8.jpg,2025-01-02T16:35:11Z,,"Kopiere den aktuellen Link
Nach Jahren der Social-Media-Abstinenz ist Meghan wieder zurück. Die Frau von Prinz Harry will dort ihren positiven Einfluss geltend machen.
Herzogin Meghan ist zurück au… [+2026 chars]",,de,'Prinz Harry'
https://www.tagesspiegel.de/gesellschaft/soziale-medien-herzogin-meghan-gibt-comeback-auf-instagram-12953662.html,https://www.tagesspiegel.de/gesellschaft/soziale-medien-herzogin-meghan-gibt-comeback-auf-instagram-12953662.html,0,www.tagesspiegel.de,Soziale Medien: Herzogin Meghan gibt Comeback auf Instagram,Nach Jahren der Social-Media-Abstinenz ist Meghan wieder zurück. Die Frau von Prinz Harry will dort ihren positiven Einfluss geltend machen.,https://www.tagesspiegel.de/images/12953659/alternates/BASE_16_9_W1400/1735835775000/paley-honors-herbstgala-2024.jpeg,2025-01-02T16:36:15Z,,Herzogin Meghan ist zurück auf Instagram. Die Frau von Prinz Harry (40) hatte sich in den vergangenen Jahren von den sozialen Medien zurückgezogen. Nun gibt sie ein fulminantes Comeback: Der Account … [+2616 chars],,de,'Prinz Archie'
https://www.stern.de/lifestyle/medien--herzogin-am-herd--netflix-zeigt-trailer-fuer-meghans-serie-35351058.html,https://www.stern.de/lifestyle/medien--herzogin-am-herd--netflix-zeigt-trailer-fuer-meghans-serie-35351058.html,0,www.stern.de,Medien: Herzogin am Herd: Netflix zeigt Trailer für Meghans Serie,Vor fünf Jahren zogen sich Prinz Harry und seine Frau Meghan aus dem britischen Königshaus zurück. Nun erscheint die Herzogin in einer neuen Netflixserie - und packt in der Küche an.,https://image.stern.de/35351060/t/Aq/v1/w1440/r1.7778/-/02--bzde35fy6vv4axs2048jpeg---e363c9c8ae00382e.jpg,2025-01-02T19:37:36Z,https://web.archive.org/web/20250104030300/https://www.stern.de/lifestyle/medien--herzogin-am-herd--netflix-zeigt-trailer-fuer-meghans-serie-35351058.html,"Kopiere den aktuellen Link
Vor fünf Jahren zogen sich Prinz Harry und seine Frau Meghan aus dem britischen Königshaus zurück. Nun erscheint die Herzogin in einer neuen Netflixserie - und packt in de… [+1411 chars]",,de,'Prinz Harry'
https://www.tagesspiegel.de/gesellschaft/medien-herzogin-am-herd-netflix-zeigt-trailer-fur-meghans-serie-12954004.html,https://www.tagesspiegel.de/gesellschaft/medien-herzogin-am-herd-netflix-zeigt-trailer-fur-meghans-serie-12954004.html,0,www.tagesspiegel.de,Medien: Herzogin am Herd: Netflix zeigt Trailer für Meghans Serie,Vor fünf Jahren zogen sich Prinz Harry und seine Frau Meghan aus dem britischen Königshaus zurück. Nun erscheint die Herzogin in einer neuen Netflixserie - und packt in der Küche an.,https://www.tagesspiegel.de/images/12954001/alternates/BASE_16_9_W1400/1735846765000/lifestyle-serie-with-love-meghan.jpeg,2025-01-02T19:39:25Z,https://web.archive.org/web/20250103070809/https://www.tagesspiegel.de/gesellschaft/medien-herzogin-am-herd-netflix-zeigt-trailer-fur-meghans-serie-12954004.html,"Herzogin Meghan (43) gibt einen ersten Einblick in ihre neue Serie bei Netflix. Die achtteilige Produktion With Love, Meghan erscheint am 15. Januar, wie der Streamingdienst ankündigte. Die Ehefrau v… [+2625 chars]",,de,'Prinz Harry'
https://www.focus.de/finanzen/news/autoindustrie-krise-soeder-kuendigt-massives-foerderprogramm-fuer-elektroautos-an_id_260604536.html,https://www.focus.de/finanzen/news/autoindustrie-krise-soeder-kuendigt-massives-foerderprogramm-fuer-elektroautos-an_id_260604536.html,0,www.focus.de,Autoindustrie-Krise - Söder kündigt massives Förderprogramm für Elektroautos an,CSU-Chef Markus Söder hat angesichts der Krise in der deutschen Automobilindustrie ein massives Förderprogramm für den Absatz von Elektroautos im Falle eines Wahlsiegs der Union bei der Bundestagswahl angekündigt.,https://p6.focus.de/img/regional/koeln/id_260582160/der-bayrische-ministerpraesident-markus-soeder-am-17.-dezember-2024-auf-einer-veranstaltung-der-cdu-csu..jpg?im=Crop%3D%280%2C36%2C3468%2C1735%29%3BResize%3D%281200%2C627%29&impolicy=perceptual&quality=mediumHigh&hash=dcf58ebeb9529e708e28c0cb156d2ada9169381ac48a77da2907c64715702c70,2025-01-02T19:59:41Z,,CSU-Chef Markus Söder hat angesichts der Krise in der deutschen Automobilindustrie ein massives Förderprogramm für den Absatz von Elektroautos im Falle eines Wahlsiegs der Union bei der Bundestagswah… [+3698 chars],,de,'Ferdinand Dudenhöffer'
https://www.zeit.de/news/2025-01/02/dominant-ins-endspiel-van-gerwen-spielt-um-den-wm-titel,https://www.zeit.de/news/2025-01/02/dominant-ins-endspiel-van-gerwen-spielt-um-den-wm-titel,0,www.zeit.de,Halbfinale im Ally Pally: Dominant ins Endspiel: Van Gerwen spielt um den WM-Titel,Hier finden Sie Informationen zu dem Thema „Halbfinale im Ally Pally“. Lesen Sie jetzt „Dominant ins Endspiel: Van Gerwen spielt um den WM-Titel“.,https://img.zeit.de/news/2025-01/02/dominant-ins-endspiel-van-gerwen-spielt-um-den-wm-titel-image-group/wide__1300x731,2025-01-02T21:07:30Z,https://web.archive.org/web/20250105183926/https://www.zeit.de/news/2025-01/02/dominant-ins-endspiel-van-gerwen-spielt-um-den-wm-titel,Darts-Star Michael van Gerwen hat zum siebten Mal in seiner Karriere das WM-Finale erreicht und darf in London auf seine erste Krönung seit sechs Jahren warten. Der 35 Jahre alte Niederländer besiegt… [+1431 chars],,de,'Chris Wright'
https://www.n-tv.de/sport/MvG-stuermt-wie-wild-geworden-ins-Finale-der-Darts-WM-article25464149.html,https://www.n-tv.de/sport/MvG-stuermt-wie-wild-geworden-ins-Finale-der-Darts-WM-article25464149.html,0,www.n-tv.de,"Traum-Finale gegen Wunderkind?: ""MvG"" stürmt wie wild geworden ins Finale der Darts-WM","Pure Dominanz: Darts-Superstar Michael van Gerwen zieht mit einem deutlichen Sieg in sein siebtes WM-Finale ein. Der Niederländer lässt Chris Dobey aus England beim 6:1 nicht den Hauch einer Chance. Kommt es nun zum Finale, von dem alle träumen?",https://bilder4.n-tv.de/img/incoming/crop25464151/8901327294-cImg_16_9-w1200/imago1057018734.jpg,2025-01-02T21:15:42Z,,Pure Dominanz: Darts-Superstar Michael van Gerwen zieht mit einem deutlichen Sieg in sein siebtes WM-Finale ein. Der Niederländer lässt Chris Dobey aus England beim 6:1 nicht den Hauch einer Chance. … [+2075 chars],,de,'nan nan'
https://www.faz.net/aktuell/gesellschaft/herzogin-meghan-gibt-comeback-auf-instagram-110208333.html,https://www.faz.net/aktuell/gesellschaft/herzogin-meghan-gibt-comeback-auf-instagram-110208333.html,0,www.faz.net,Herzogin Meghan gibt Comeback auf Instagram,Nach Jahren der Social-Media-Abstinenz ist Meghan wieder zurück. Die Frau von Prinz Harry will dort ihren positiven Einfluss geltend machen.,https://media1.faz.net/ppmedia/aktuell/feuilleton/1298964824/1.10208335/facebook_teaser/auf-netflix-ist-herzogin.jpg,2025-01-02T21:40:48Z,https://web.archive.org/web/20250104060339/https://www.faz.net/aktuell/gesellschaft/herzogin-meghan-gibt-comeback-auf-instagram-110208333.html,"Der erste Post zeigt die 43-Jährige am Strand in Montecito im US-Bundesstaat Kalifornien. Die Kamera folgt ihr einige Meter, bevor sie mit der Hand die Jahreszahl 2025 in den nassen Sand zeichnet. Au… [+3344 chars]",,de,'Prinz Harry'
https://www.stern.de/sport/darts-halbfinale-von-london--dominant-ins-endspiel--van-gerwen-und-littler-um-wm-titel-35351124.html,https://www.stern.de/sport/darts-halbfinale-von-london--dominant-ins-endspiel--van-gerwen-und-littler-um-wm-titel-35351124.html,0,www.stern.de,Darts-Halbfinale von London: Dominant ins Endspiel: Van Gerwen und Littler um WM-Titel,Der Niederländer Michael van Gerwen und der Engländer Luke Littler duellieren sich im Ally Pally um die Darts-Krone. Es ist für viele das erwartete Traumfinale.,https://image.stern.de/35351174/t/wz/v1/w1440/r1.7778/-/02--tfmviekbrbv3axs2048jpeg---e59c61ea2b78aa14.jpg,2025-01-02T22:52:30Z,,"Kopiere den aktuellen Link
Der Niederländer Michael van Gerwen und der Engländer Luke Littler duellieren sich im Ally Pally um die Darts-Krone. Es ist für viele das erwartete Traumfinale.
Darts-Sta… [+1657 chars]",,de,'nan nan'
https://www.bild.de/sport/mehr-sport/darts-wm-traumfinale-zwischen-luke-littler-und-michael-van-gerwen-perfekt-677716680195b908c18995a4,https://www.bild.de/sport/mehr-sport/darts-wm-traumfinale-zwischen-luke-littler-und-michael-van-gerwen-perfekt-677716680195b908c18995a4,0,www.bild.de,Dominante Vorstellungen - Traumfinale der Darts-WM perfekt!,Luke Littler gegen Michael van Gerwen – das WM-Finale der Darts-WM steht fest.,"https://images.bild.de/677716680195b908c18995a4/29952374bcd47c4b1529bffdb29c2c07,8be5985d?w=1280",2025-01-02T22:53:38Z,https://web.archive.org/web/20250104081547/https://www.bild.de/sport/mehr-sport/darts-wm-traumfinale-zwischen-luke-littler-und-michael-van-gerwen-perfekt-677716680195b908c18995a4,"Er ist einfach nicht zu stoppen!
Luke Littler (17) steht erneut im Finale der Darts-WM. Das englische Wunderkind besiegt im Halbfinale seinen Landsmann Stephen Bunting deutlich mit 6:1.
Im Endspiel… [+1887 chars]",,de,'nan nan'
https://www.n-tv.de/politik/10-30-Selenskyj-Die-Jungs-sind-muede--article23143824.html,https://www.n-tv.de/politik/10-30-Selenskyj-Die-Jungs-sind-muede--article23143824.html,0,www.n-tv.de,"Ukraine-Krieg im Liveticker: +++ 10:30 Selenskyj: ""Die Jungs sind müde"" +++",Lesen Sie alle aktuellen Entwicklungen und Nachrichten über den russischen Angriffskrieg auf die Ukraine im Liveticker von ntv.de.,https://bilder3.n-tv.de/img/incoming/crop25117070/4231326595-cImg_16_9-w1200/Ukraine-Liveticker.jpg,2025-01-02T23:32:00Z,https://web.archive.org/web/20250108210731/https://www.n-tv.de/politik/10-30-Selenskyj-Die-Jungs-sind-muede--article23143824.html,"Der ukrainische Präsident Wolodymyr Selenskyj räumt ein, dass die Armee wegen der anhaltenden russischen Angriffe unter Erschöpfung leidet. ""Sie machen Druck und die Jungs sind müde"", sagte er in ein… [+9221 chars]",,de,'Vitali Klitschko'
https://wien.orf.at/stories/3287486/,https://wien.orf.at/stories/3287486/,0,wien.orf.at,"Eilish, Guns N’Roses: Konzert-Highlights 2025","Das Konzertjahr 2025 hält mehrere besondere Auftritte bereits. US-Superstar Billie Eilish kommt im Juni in die Stadthalle, im Juli rocken dann Guns N’Roses das Ernst-Happel-Stadion. Heimisches Highlight wird wohl ein siebenstündiger Konzertabend von und mit S…",https://ibs.orf.at/wie?image=https%3A%2F%2Foekastatic.orf.at%2Fmims%2F2025%2F01%2F33%2Fcrops%2Fw%3D1200%2Ch%3D627%2Cq%3D75%2F2473516_master_946633_apafrance_-_environment_-_music_-_concert_.jpg%3Fs%3Dbd137d4408c56d6bfba7dc1e88a7199f4d834855,2025-01-03T05:00:00Z,,Eines der ersten großen Konzerte findet am 10. Jänner in der Wiener Stadthalle statt. Der Deutschrapper und seit kurzem Metal-Sänger Alligatoah lädt zu seinem Comeback. Am 28. Jänner ist der deutsche… [+5355 chars],,de,'Billie Eilish'
https://www.morgenpost.de/kultur/article407955241/kim-wilde-das-war-eine-furchteinfloessende-erfahrung.html,https://www.morgenpost.de/kultur/article407955241/kim-wilde-das-war-eine-furchteinfloessende-erfahrung.html,0,www.morgenpost.de,Kim Wilde: „Das war eine furchteinflößende Erfahrung“,"Die Popgöttin der Achtzigerjahre kehrt mit neuem Album zurück. Ein Gespräch über ihren Bandscheibenvorfall, Kinder und Billie Eilish.",https://img.sparknews.funkemedien.de/407955229/407955229_1735744921_v16_9_1600.jpeg,2025-01-03T05:00:00Z,http://archive.md/20250103083155/http://www.morgenpost.de/kultur/article407955241/kim-wilde-das-war-eine-furchteinfloessende-erfahrung.html,"Berlin. Die Popgöttin der Achtzigerjahre kehrt mit neuem Album zurück. Ein Gespräch über ihren Bandscheibenvorfall, Kinder und Billie Eilish.",,de,'Billie Eilish'
https://www.faz.net/aktuell/wirtschaft/auto-verkehr/markus-soeder-will-nach-der-bundestagswahl-neue-e-mobilitaetspraemie-110208679.html,https://www.faz.net/aktuell/wirtschaft/auto-verkehr/markus-soeder-will-nach-der-bundestagswahl-neue-e-mobilitaetspraemie-110208679.html,0,www.faz.net,Söder will nach der Bundestagswahl „neue E-Mobilitätsprämie“,Die Krise der deutschen Schlüsselindustrie wird zum Wahlkampfthema. CSU-Chef Markus Söder schwebt ein Förderprogramm für den Absatz von Elektroautos vor. Und auch der Kanzler hat die Interessen der Branche im Blick.,https://media0.faz.net/ppmedia/aktuell/wirtschaft/4010319089/1.10208698/facebook_teaser/fertige-vollelektrische.jpg,2025-01-03T08:50:11Z,,"Außerdem stellte Söder weitere Verbesserungen für gewerblich genutzte Elektrofahrzeuge in Aussicht. Die Automobilindustrie ist die wirtschaftliche Lebensader unseres Landes, sagte der bayerische Mini… [+2556 chars]",,de,'Markus Söder'
https://www.welt.de/wirtschaft/article255021234/Autorindustrie-in-der-Krise-Soeder-und-Scholz-wollen-E-Autos-foerdern.html,https://www.welt.de/wirtschaft/article255021234/Autorindustrie-in-der-Krise-Soeder-und-Scholz-wollen-E-Autos-foerdern.html,0,www.welt.de,Söder und Scholz wollen E-Autos fördern,"„Das größte Risiko für die Autoindustrie sind unsere Politiker“, hat Automobilbranchenexperte Ferdinand Dudenhöffer über die aktuelle Krise gesagt. Markus Söder (CSU) wahlkämpft mit einem „Auto-Plan“, Olaf Scholz (SPD) schreibt einen Brief an Ursula von der L…",https://img.welt.de/img/wirtschaft/mobile255021034/2887937067-ci16x9-w1200/Markus-Soeder.jpg,2025-01-03T09:21:59Z,,"Das größte Risiko für die Autoindustrie sind unsere Politiker, hat Automobilbranchenexperte Ferdinand Dudenhöffer über die aktuelle Krise gesagt. Markus Söder (CSU) wahlkämpft mit einem Auto-Plan, Ol… [+3734 chars]",,de,'Ferdinand Dudenhöffer'
https://www.diepresse.com/19222603/die-darts-wm-hat-ihr-traumfinale,https://www.diepresse.com/19222603/die-darts-wm-hat-ihr-traumfinale,0,www.diepresse.com,Die Darts-WM hat ihr Traumfinale,Auf dieses Spiel hat die Darts-Welt gewartet. Nach 94 absolvierten Partien wartet zum Abschluss der WM der Höhepunkt: Das Aufeinandertreffen der beiden Pfeile-Schwergewichte Luke Littler und Michael van Gerwen.,https://img.diepresse.com/public/incoming/35z68f-DARTS-BRITAIN/alternates/DPR_SOCIAL_NACHRICHTEN/DARTS-BRITAIN,2025-01-03T09:43:34Z,,Auf dieses Spiel hat die Darts-Welt gewartet. Nach 94 absolvierten Partien wartet zum Abschluss der WM der Höhepunkt: Das Aufeinandertreffen der beiden Pfeile-Schwergewichte Luke Littler und Michael … [+1702 chars],,de,'nan nan'
