index,url,valid,domain,title,description,image,published,archive,content,quote,language,keyword
https://www.sueddeutsche.de/politik/usa-repraesentantenhaus-republikaner-steve-scalise-1.6285504,https://www.sueddeutsche.de/politik/usa-repraesentantenhaus-republikaner-steve-scalise-1.6285504,0,www.sueddeutsche.de,US-Repräsentantenhaus: Republikaner einigen sich auf Nachfolger für Kevin McCarthy,"Steve Scalise soll als ""Speaker"" in Zukunft die Sitzungen in der Kongress-Kammer leiten. Er setzt sich gegen einen Kandidaten durch, den der frühere US-Präsident Trump vorgeschlagen hatte.",https://www.sueddeutsche.de/image/sz.1.6285505/1200x675?v=1697048570,2023-10-11T18:23:07Z,,Die Republikaner im US-Repräsentantenhaus haben sich auf einen Kandidaten für die Präsidentschaft der Kongresskammer geeinigt. In einer Wahl hinter verschlossenen Türen nominierten sie am Mittwoch de… [+2358 chars],,de,'Steve Scalise'
https://www.kino.de/film/oppenheimer-2023/news/hollywood-groesse-kritisiert-christopher-nolans-oppenheimer-fuer-das-auslassen-einer-sache/,https://www.kino.de/film/oppenheimer-2023/news/hollywood-groesse-kritisiert-christopher-nolans-oppenheimer-fuer-das-auslassen-einer-sache/,0,www.kino.de,Hollywood-Größe kritisiert Christopher Nolans „Oppenheimer“ für das Auslassen einer Sache,Mit „Oppenheimer“ feierte Christopher Nolan einen unerwartet großen Kinoerfolg. Aber er hat nach Spike Lee eine wichtige Verantwortung außer Acht gelassen.,https://crops.giga.de/b4/e1/5e/41c85efe230d57e96b08aea966_YyAxNTcxeDg4NCs1KzQyMQJyZSAxOTIwIDEwODADYjE0OGYzNTkwZTY=.jpg,2023-10-11T19:12:06Z,,"Mit „Oppenheimer“ feierte Christopher Nolan einen unerwartet großen Kinoerfolg. Aber er hat nach Spike Lee eine wichtige Verantwortung außer Acht gelassen.
Machen wir uns nichts vor: Nicht allen hat… [+3983 chars]",,de,'Cillian Murphy'
https://orf.at/stories/3334902/,https://orf.at/stories/3334902/,0,orf.at,Hängepartie im Repräsentantenhaus,"Eine Abstimmung über den neuen Vorsitz des US-Repräsentantenhauses verzögert sich auf unbestimmte Zeit. Die Parlamentskammer vertagte am Mittwoch die Sitzung. Ein neuer Zeitpunkt wurde nicht genannt. Dabei sah es zeitweise so aus, als hätten sich die Republik…",https://ibs.orf.at/news?image=https%3A%2F%2Fassets.orf.at%2Fmims%2F2023%2F41%2F03%2Fcrops%2Fw%3D1200%2Ch%3D630%2Cq%3D75%2F1970661_master_741803_usa_repraesentantenhaus_scalise_gy.jpg%3Fs%3Dd6ff65158747d35133f5e137e1e73c8b69508cdb,2023-10-11T21:00:25Z,,"Bei einer Abstimmung der Republikaner hinter verschlossenen Türen setzte sich zunächst der erzkonservative Abgeordnete Steve Scalise als Nachfolger des abgesetzten Kevin McCarthy, des bisherigen Vors… [+2860 chars]",,de,'Steve Scalise'
https://www.n-tv.de/sport/fussball/Liga-Boss-traeumt-von-FCB-Star-Musiala-in-Saudi-Arabien-article24458234.html,https://www.n-tv.de/sport/fussball/Liga-Boss-traeumt-von-FCB-Star-Musiala-in-Saudi-Arabien-article24458234.html,0,www.n-tv.de,Er will weitere Weltstars locken: Liga-Chef träumt von Musiala in Saudi-Arabien,"Cristiano Ronaldo machte den Anfang, weitere Weltstars folgten nach Saudi-Arabien. Geht es nach Liga-Chef Michael Emenalo, soll damit jedoch noch nicht Schluss sein: Er sagt, es gebe weitere Pläne für Weltstars. Und wünscht sich, dass irgendwann auch ein DFB-…",https://bilder2.n-tv.de/img/incoming/crop24458233/7971327619-cImg_16_9-w1200/428700043.jpg,2023-10-11T23:20:40Z,,"Cristiano Ronaldo machte den Anfang, weitere Weltstars folgten nach Saudi-Arabien. Geht es nach Liga-Chef Michael Emenalo, soll damit jedoch noch nicht Schluss sein: Er sagt, es gebe weitere Pläne fü… [+1782 chars]",,de,'Karim Benzema'
https://www.faz.net/aktuell/politik/ausland/republikaner-machtkampf-alte-kaempfe-neue-fronten-19237473.html,https://www.faz.net/aktuell/politik/ausland/republikaner-machtkampf-alte-kaempfe-neue-fronten-19237473.html,0,www.faz.net,"Republikaner-Machtkampf: Alte Kämpfe, neue Fronten",Steve Scalise setzt sich als Kandidat für den Sprecherposten im amerikanischen Repräsentantenhaus durch. Vorerst fehlt ihm aber noch eine Mehrheit für die Wahl im Plenum.,https://media0.faz.net/ppmedia/aktuell/politik/3803259248/1.9237478/facebook_teaser/der-republikaner-steve-scalise.jpg,2023-10-12T02:39:42Z,,"Als das Repräsentantenhaus am Mittwochnachmittag erstmals seit dem Sturz von Sprecher Kevin McCarthy in der vergangenen Woche zusammenkam, war schon klar, dass es sich um eine kurze Sitzung handeln w… [+2884 chars]",,de,'Steve Scalise'
https://www.focus.de/politik/ausland/ukraine-krieg-im-ticker-russischer-angriff-auf-frontstadt-im-donbass_id_57275780.html,https://www.focus.de/politik/ausland/ukraine-krieg-im-ticker-russischer-angriff-auf-frontstadt-im-donbass_id_57275780.html,0,www.focus.de,Ukraine-Krieg - Stimmen und Entwicklungen - Selenskyj überraschend für Gespräche in Brüssel,Der Kreml wird die Lage in Israel laut Experten für seine eigenen Zwecke im Krieg mit der Ukraine nutzen. Selenskyj ist bei der NATO in Brüssel zu Besuch. Die USA will neue Militärhilfen an die Ukraine senden. Alle News zum Krieg in der Ukraine im Ticker.,https://p6.focus.de/img/politik/ausland/id_218844141/der-ukrainische-praesident-wolodymyr-selenskyj..jpg?im=Crop%3D%280%2C170%2C2048%2C1024%29%3BResize%3D%281200%2C627%29&impolicy=perceptual&quality=mediumHigh&hash=5c2f4d5fa7404e9108a9efa9f66595f5031d0f8a075fd696cbb4624b66304166,2023-10-12T06:34:17Z,,Der Kreml wird die Lage in Israel laut Experten für seine eigenen Zwecke im Krieg mit der Ukraine nutzen. Selenskyj ist bei der NATO in Brüssel zu Besuch. Die USA will neue Militärhilfen an die Ukrai… [+11137 chars],,de,'Alexander De Croo'
https://taz.de/McCarthy-Nachfolge-im-US-Kongress/!5966106/,https://taz.de/McCarthy-Nachfolge-im-US-Kongress/!5966106/,0,taz.de,"McCarthy-Nachfolge im US-Kongress: Nominiert, aber ohne Mehrheit",Die republikanische Fraktion im US-Repräsentantenhaus hat Steve Scalise als neuen Speaker nominiert. Genügend Stimmen hat er bislang noch nicht.,https://taz.de/picture/6580338/948/Scalise-1.jpeg,2023-10-12T08:48:00Z,,"Die republikanische Fraktion im US-Repräsentantenhaus hat Steve Scalise als neuen Speaker nominiert. Genügend Stimmen hat er bislang noch nicht.
Steven Scalise, nominiert für den Vorsitz des US-Repr… [+3011 chars]",,de,'Steve Scalise'
https://www.nbcnews.com/politics/congress/sen-bob-menendez-faces-new-charges-accusing-working-foreign-government-rcna120136,https://www.nbcnews.com/politics/congress/sen-bob-menendez-faces-new-charges-accusing-working-foreign-government-rcna120136,0,www.nbcnews.com,Sen. Bob Menendez faces new charges accusing him of working for foreign government,"Sen. Bob Menendez, D-N","https://media-cldnry.s-nbcnews.com/image/upload/t_nbcnews-fp-1200-630,f_auto,q_auto:best/rockcms/2023-09/230925-bob-menendez-ew-220p-73e073.jpg",2023-10-12T16:26:40Z,http://wayback.archive-it.org/all/20231012205443/https://www.nbcnews.com/politics/congress/sen-bob-menendez-faces-new-charges-accusing-working-foreign-government-rcna120136,"Sen. Bob Menendez, D-N.J., was hit with new charges Thursday accusing him of accepting bribes to behalf of a foreign government and acting as foreign agent, according to a superseding indictment.
Th… [+378 chars]",,de,'Bob Menendez'
https://www.kino.de/film/wonka-2023/news/neuer-wonka-trailer-mit-johnny-depp-nachfolger-timothee-chalamet-zeigt-die-schokoladenfabrik/,https://www.kino.de/film/wonka-2023/news/neuer-wonka-trailer-mit-johnny-depp-nachfolger-timothee-chalamet-zeigt-die-schokoladenfabrik/,0,www.kino.de,Neuer „Wonka“-Trailer mit Johnny-Depp-Nachfolger Timothée Chalamet zeigt die Schokoladenfabrik,"Wie sah eigentlich Willy Wonkas Schokoladenfabrik ganz zu Beginn aus? Darauf liefert der neue „Wonka“-Trailer eine kunterbunte Antwort, die allen schmeckt.",https://crops.giga.de/9f/ac/43/7886b776caada064492fd75ee3_YyAxNzg0eDEwMDMrMzg4KzMyAnJlIDE5MjAgMTA4MAM5Yzc2N2FhNDI3ZQ==.jpg,2023-10-12T18:08:53Z,,"Wie sah eigentlich Willy Wonkas Schokoladenfabrik ganz zu Beginn aus? Darauf liefert der neue „Wonka“-Trailer eine kunterbunte Antwort, die allen schmeckt.
Er ist ein begnadeter Schauspieler, der je… [+4611 chars]",,de,'Johnny Depp'
https://www.morgenpost.de/politik/ausland/article239789803/Chefposten-im-US-Kongress-Republikaner-zersplittert.html,https://www.morgenpost.de/politik/ausland/article239789803/Chefposten-im-US-Kongress-Republikaner-zersplittert.html,0,www.morgenpost.de,USA: Chefposten im US-Kongress: Republikaner zersplittert,Die Republikaner haben Steve Scalise als Kandidaten für den Vorsitz im US-Repräsentantenhaus nominiert. Doch für die notwendige Mehrheit reicht der Rückhalt in den eigenen Reihen bislang nicht.,https://img.morgenpost.de/img/ausland/crop239789801/7132609718-w820-cv16_9-q85/Steve-Scalise.jpg,2023-10-12T22:31:43Z,,"Washington. Der republikanische Kandidat für den Vorsitz im US-Repräsentantenhaus hat bislang nicht ausreichend Rückhalt in der eigenen Fraktion, um in der Parlamentskammer auf den Chefposten gewählt… [+1457 chars]",,de,'Steve Scalise'
https://www.dw.com/de/geschacher-um-chefposten-im-us-kongress-dauert-an/a-67083955,https://www.dw.com/de/geschacher-um-chefposten-im-us-kongress-dauert-an/a-67083955,0,www.dw.com,Geschacher um Chefposten im US-Kongress dauert an,Die Republikaner hatten Steve Scalise als Kandidat für das Amt des Vorsitzenden im US-Repräsentantenhaus nominiert. Doch für eine Mehrheit in den eigenen Reihen reicht der Rückhalt bislang nicht.,https://static.dw.com/image/67084014_6.jpg,2023-10-12T23:15:00Z,,"Der republikanische Kandidat für den Vorsitz im US-Repräsentantenhaus hat bislang nicht ausreichend Rückhalt in der eigenen Fraktion, um in der Parlamentskammer auf den Chefposten gewählt zu werden. … [+1525 chars]",,de,'Steve Scalise'
https://www.sueddeutsche.de/politik/us-kongress-republikaner-scalise-verzichtet-auf-speaker-posten-1.6286956,https://www.sueddeutsche.de/politik/us-kongress-republikaner-scalise-verzichtet-auf-speaker-posten-1.6286956,0,www.sueddeutsche.de,US-Kongress: Republikaner Scalise verzichtet auf Speaker-Posten,"Das Chaos rund um die Neubesetzung des Chefpostens im US-Kongress dürfte weitergehen. Nach seiner Nominierung scheitert Steve Scalise daran, sich ausreichend Rückhalt in der Fraktion zu sichern.",https://www.sueddeutsche.de/image/sz.1.6286957/1200x675?v=1697156333,2023-10-13T00:19:01Z,,"Das Chaos rund um die Neubesetzung des Chefpostens im US-Kongress dürfte weitergehen. Nach seiner Nominierung scheitert Steve Scalise daran, sich ausreichend Rückhalt in der Fraktion zu sichern.Der f… [+472 chars]",,de,'Steve Scalise'
https://www.stern.de/politik/ausland/usa--scalise-verzichtet-auf-chefposten-im-us-kongress-33908686.html,https://www.stern.de/politik/ausland/usa--scalise-verzichtet-auf-chefposten-im-us-kongress-33908686.html,0,www.stern.de,USA: Scalise verzichtet auf Chefposten im US-Kongress,Die Republikaner nominieren Steve Scalise als Kandidaten für den Vorsitz im US-Repräsentantenhaus. Doch es fehlt an Unterstützung in den eigenen Reihen. Dann macht er selbst einen Rückzug.,https://image.stern.de/33908688/t/Nx/v2/w1440/r1.7778/-/13--urnnewsmldpacom2009010123101399546107v4w800h600l529t135r1809b988jpeg---70b346fb090f07f9.jpg,2023-10-13T00:23:33Z,,"Die Republikaner nominieren Steve Scalise als Kandidaten für den Vorsitz im US-Repräsentantenhaus. Doch es fehlt an Unterstützung in den eigenen Reihen. Dann macht er selbst einen Rückzug.
Der für d… [+483 chars]",,de,'Steve Scalise'
https://www.n-tv.de/politik/Republikaner-Scalise-zieht-Kandidatur-zurueck-article24461339.html,https://www.n-tv.de/politik/Republikaner-Scalise-zieht-Kandidatur-zurueck-article24461339.html,0,www.n-tv.de,Chefposten im US-Kongress: Republikaner Scalise zieht Kandidatur zurück,Das US-Repräsentantenhaus bleibt noch länger gelähmt. Denn die Suche nach einem neuen Vorsitzenden verzögert sich weiter: Der von den Republikanern ins Rennen geschickte Steve Scalise gibt auf.,https://bilder1.n-tv.de/img/incoming/crop24461340/2561326283-cImg_16_9-w1200/429952915.jpg,2023-10-13T00:36:27Z,,"Das US-Repräsentantenhaus bleibt noch länger gelähmt. Denn die Suche nach einem neuen Vorsitzenden verzögert sich weiter: Der von den Republikanern ins Rennen geschickte Steve Scalise gibt auf. 
Das… [+484 chars]",,de,'Steve Scalise'
https://www.faz.net/aktuell/politik/ausland/us-repraesentantenhaus-scalise-zieht-kandidatur-fuer-chefposten-im-kongress-zurueck-19240217.html,https://www.faz.net/aktuell/politik/ausland/us-repraesentantenhaus-scalise-zieht-kandidatur-fuer-chefposten-im-kongress-zurueck-19240217.html,0,www.faz.net,US-Repräsentantenhaus: Scalise zieht Kandidatur für Chefposten im Kongress zurück,Die Republikaner hatten Steve Scalise für das Amt des Vorsitzenden im US-Repräsentantenhaus nominiert. Doch für die notwendige Mehrheit bei einer Abstimmung fehlte ihm der Rückhalt in den eigenen Reihen.,https://media0.faz.net/ppmedia/aktuell/1803400621/1.9240210/facebook_teaser/der-mehrheitsfuehrer-des.jpg,2023-10-13T00:45:37Z,,"Der für den Vorsitz im US-Repräsentantenhaus nominierte Republikaner Steve Scalise hat seine Kandidatur zurückgezogen. Das sagte Scalise am Donnerstagabend (Ortszeit) im US-Kongress, nachdem er daran… [+3024 chars]",,de,'Steve Scalise'
https://www.zeit.de/politik/ausland/2023-10/usa-steve-scalise-republikaner-kampagne-ende-amt-repraesentantenhaus-sprecher,https://www.zeit.de/politik/ausland/2023-10/usa-steve-scalise-republikaner-kampagne-ende-amt-repraesentantenhaus-sprecher,0,www.zeit.de,Repräsentantenhaus-Vorsitz : US-Republikaner Steve Scalise zieht Kandidatur zurück,Der von den Republikanern für den Vorsitz der Kongresskammer nominierte Steve Scalise hat seine Kandidatur zurückgezogen. Das Chaos im US-Repräsentantenhaus geht weiter.,,2023-10-13T00:47:26Z,,"When browsing with ads:
We collect personal data and also transmit it to third-party providers
 that help us improve and finance our digital content. Some of the information stored on your device, … [+821 chars]",,de,'Steve Scalise'
https://www.stern.de/news/us-republikaner-scalise-zieht-kandidatur-fuer-repraesentantenhaus-vorsitz-zurueck-33908814.html,https://www.stern.de/news/us-republikaner-scalise-zieht-kandidatur-fuer-repraesentantenhaus-vorsitz-zurueck-33908814.html,0,www.stern.de,US-Republikaner Scalise zieht Kandidatur für Repräsentantenhaus-Vorsitz zurück,Das Chaos bei den Republikanern im US-Repräsentantenhaus geht weiter: Der von den Konservativen für den Vorsitz der Kongresskammer nominierte Abgeordnete Steve Scalise hat seine Kandidatur zurückgezogen. Das gab der 58-Jährige am Donnerstagabend (Ortszeit) an…,https://image.stern.de/33908816/t/64/v1/w1440/r1.7778/-/13--steve-scalise---595c248bd55e4c76.jpg,2023-10-13T00:48:19Z,,Das Chaos bei den Republikanern im US-Repräsentantenhaus geht weiter: Der von den Konservativen für den Vorsitz der Kongresskammer nominierte Abgeordnete Steve Scalise hat seine Kandidatur zurückgezo… [+1456 chars],,de,'Steve Scalise'
https://www.welt.de/politik/ausland/article247974274/US-Repraesentantenhaus-Republikaner-Scalise-zieht-Bewerbung-um-das-Amt-des-Speakers-zurueck.html,https://www.welt.de/politik/ausland/article247974274/US-Repraesentantenhaus-Republikaner-Scalise-zieht-Bewerbung-um-das-Amt-des-Speakers-zurueck.html,0,www.welt.de,Scalise zieht Bewerbung um das Amt des „Speakers“ zurück,"Das Chaos bei den Republikanern geht weiter: Der Kongressabgeordnete Steve Scalise zieht seine Kandidatur für den Posten des Sprechers zurück. Ihm gelang es nicht, eine Mehrheit der Abgeordneten hinter sich zu vereinen. Einige seiner Kollegen verfolgten eine …",https://img.welt.de/img/bildergalerien/mobile247974268/7831351407-ci16x9-w1200/Wahl-zum-Chefposten-im-US-Kongress-erneut-verzoegert.jpg,2023-10-13T01:19:42Z,,Der von der republikanischen Partei als nächster Speaker des US-Repräsentantenhauses nominierte Steve Scalise ist aus dem Rennen um das Amt ausgestiegen. Dies gab Scalise am Donnerstagabend (Ortszeit… [+1375 chars],,de,'Steve Scalise'
https://www.nzz.ch/international/noch-immer-ohne-speaker-der-republikaner-steve-scalise-gibt-auf-ld.1760685,https://www.nzz.ch/international/noch-immer-ohne-speaker-der-republikaner-steve-scalise-gibt-auf-ld.1760685,0,www.nzz.ch,Noch immer ohne Speaker: Der Republikaner Steve Scalise gibt auf,"Steve Scalise ist es nicht gelungen, die Fraktion der Republikaner im Repräsentantenhaus zu einigen. Am Donnerstag zog er deshalb seine Kandidatur für das Amt des Speakers zurück. Nun geht die Suche weiter.","https://img.nzz.ch/2023/10/13/d553c9f9-7831-4a41-aca8-75948791a106.jpeg?width=1200&height=675&fit=bound&quality=75&auto=webp&crop=5500,3094,x0,y328&wmark=nzz",2023-10-13T01:20:51Z,,"Der Mehrheitsführer des Repräsentantenhauses Steve Scalise spricht zu den Medien, als er am 12. Oktober bekanntgibt, dass er seine Kandidatur für das Amt des Parlamentspräsidenten zurückzieht.
Die F… [+4284 chars]",,de,'Steve Scalise'
https://www.stern.de/politik/ausland/usa--dauerchaos-im-us-kongress--republikaner-scalise-schmeisst-hin-33908686.html,https://www.stern.de/politik/ausland/usa--dauerchaos-im-us-kongress--republikaner-scalise-schmeisst-hin-33908686.html,0,www.stern.de,USA: Dauerchaos im US-Kongress: Republikaner Scalise schmeißt hin,Die Republikaner hatten Steve Scalise für das Amt des Vorsitzenden im US-Repräsentantenhaus nominiert - doch ihm fehlte der Rückhalt in den eigenen Reihen. Nun steht die Fraktion wieder ohne Kandidaten da.,https://image.stern.de/33908688/t/kx/v4/w1440/r1.7778/-/13--urnnewsmldpacom2009010123101399546107v4w800h600l529t135r1809b988jpeg---70b346fb090f07f9.jpg,2023-10-13T03:24:07Z,,Die Republikaner hatten Steve Scalise für das Amt des Vorsitzenden im US-Repräsentantenhaus nominiert - doch ihm fehlte der Rückhalt in den eigenen Reihen. Nun steht die Fraktion wieder ohne Kandidat… [+6295 chars],,de,'Steve Scalise'
https://www.diepresse.com/17734998/chaos-bei-den-republikanern-nominierter-speaker-steve-scalise-springt-ab,https://www.diepresse.com/17734998/chaos-bei-den-republikanern-nominierter-speaker-steve-scalise-springt-ab,0,www.diepresse.com,Chaos bei den Republikanern: Nominierter „Speaker“ Steve Scalise springt ab [premium],"Steve Scalise sollte Chef des Repräsentantenhauses werden. Doch die Republikaner sind so zerrüttet, dass er dass Amt nicht antreten will. Der Kongress steht still.",https://img.diepresse.com/public/incoming/4kzz8o-file7scmkkroanp10p24nmg5.jpg/alternates/DPR_SOCIAL_NACHRICHTEN_PAID/file7scmkkroanp10p24nmg5.jpg,2023-10-13T03:59:33Z,,"Steve Scalise sollte Chef des Repräsentantenhauses werden. Doch die Republikaner sind so zerrüttet, dass er dass Amt nicht antreten will. Der Kongress steht still.
New York/Washington, D. C. Plötzli… [+1328 chars]",,de,'Steve Scalise'
https://www.diepresse.com/17734209/israel-schiesst-auf-hamas-haeuser-republikaner-steve-scalise-gibt-auf-oesterreichs-grosse-chance-auf-die-fussball-em,https://www.diepresse.com/17734209/israel-schiesst-auf-hamas-haeuser-republikaner-steve-scalise-gibt-auf-oesterreichs-grosse-chance-auf-die-fussball-em,0,www.diepresse.com,Israel schießt auf Hamas-Häuser– Republikaner Steve Scalise gibt auf – Österreichs große Chance auf die Fußball-EM,Wir starten mit Ihnen in den Nachrichtentag und geben Ihnen einen schnellen Überblick über die wichtigsten Themen des Morgens.,https://www.diepresse.com/assets_v2/images/diepresse_nachrichten.png,2023-10-13T04:00:17Z,,"Wir starten mit Ihnen in den Nachrichtentag und geben Ihnen einen schnellen Überblick über die wichtigsten Themen des Morgens.
Israel schießt auf Hamas-Häuser, 1,1 Millionen Menschen in Gaza sollen … [+2454 chars]",,de,'Steve Scalise'
https://orf.at/stories/3335204/,https://orf.at/stories/3335204/,0,orf.at,Republikaner-Kandidat Scalise schmeißt hin,Das Chaos im US-Parlament hält an: Der für den Vorsitz im Repräsentantenhaus nominierte Republikaner Steve Scalise hat am Donnerstag seine Kandidatur aufgrund parteiinterner Widerstände zurückgezogen. Die Kongresskammer bleibt damit vorerst weitgehend handlun…,https://ibs.orf.at/news?image=https%3A%2F%2Fassets.orf.at%2Fmims%2F2023%2F41%2F26%2Fcrops%2Fw%3D1200%2Ch%3D630%2Cq%3D75%2F1972033_master_742326_usa_scalise_kein_vorsitz_afp.jpg%3Fs%3D0605bfc8f5c4cfb8303e63877a769dd32da51d1c,2023-10-13T04:26:49Z,https://web.archive.org/web/20231013064344/https://orf.at/stories/3335204/,"Der erzkonservative Abgeordnete Scalise scheiterte letztlich daran, sich ausreichenden Rückhalt in seiner eigenen Fraktion zu sichern. Die Republikaner hatten den 58-Jährigen aus dem Bundesstaat Loui… [+5744 chars]",,de,'Steve Scalise'
https://www.stern.de/politik/ausland/usa--sprecher-nominierter-steve-scalise-schmeisst-hin-33909046.html,https://www.stern.de/politik/ausland/usa--sprecher-nominierter-steve-scalise-schmeisst-hin-33909046.html,0,www.stern.de,USA: Sprecher-Nominierter Steve Scalise schmeißt hin – Chaos im Repräsentantenhaus geht weiter,Es geht schon wieder los. Der von der Republikanern für das Sprecheramt im Repräsentantenhaus nominierte Steve Scalise hat seine Kandidatur für das drittmächtigste politische Amt der USA zurückgezogen. Ihm fehlte es an Rückhalt in der Partei. Nun geht die Suc…,https://image.stern.de/33909104/t/Mb/v1/w1440/r1.7778/-/steve-scalise.jpg,2023-10-13T04:33:00Z,https://web.archive.org/web/20231018093813/https://www.stern.de/politik/ausland/usa--sprecher-nominierter-steve-scalise-schmeisst-hin-33909046.html,Es geht schon wieder los. Der von der Republikanern für das Sprecheramt im Repräsentantenhaus nominierte Steve Scalise hat seine Kandidatur für das drittmächtigste politische Amt der USA zurückgezoge… [+6395 chars],,de,'Steve Scalise'
https://www.focus.de/politik/ausland/chaos-im-us-parlament-republikaner-demuetigen-ihren-eigenen-kandidaten-scalise-schmeisst-hin_id_223925006.html,https://www.focus.de/politik/ausland/chaos-im-us-parlament-republikaner-demuetigen-ihren-eigenen-kandidaten-scalise-schmeisst-hin_id_223925006.html,0,www.focus.de,Chaos im US-Parlament - Republikaner demütigen ihren eigenen Kandidaten - Scalise schmeißt hin,Der republikanischer Mehrheitsführer Steve Scalise zieht seine Nominierung für das Sprecheramt zurück. Die Führungskrise in der Republikanischen Partei nimmt damit weiter zu.,https://p6.focus.de/img/fotos/id_223920420/wahl-zum-chefposten-79672128.jpg?im=Crop%3D%280%2C288%2C3464%2C1732%29%3BResize%3D%281200%2C627%29&impolicy=perceptual&quality=mediumHigh&hash=2b92f7d17c93ba5d7833001602f4356f34fa92cc5f650fc3b764ada436c0a007,2023-10-13T06:07:04Z,,Der republikanischer Mehrheitsführer Steve Scalise zieht seine Nominierung für das Sprecheramt zurück. Die Führungskrise in der Republikanischen Partei nimmt damit weiter zu.Der erzkonservative repub… [+2439 chars],,de,'Steve Scalise'
https://www.focus.de/politik/ausland/ukraine-krieg-im-ticker-militaerexperte-erklaert-ukrainische-gegenoffensive-als-gescheitert_id_57275780.html,https://www.focus.de/politik/ausland/ukraine-krieg-im-ticker-militaerexperte-erklaert-ukrainische-gegenoffensive-als-gescheitert_id_57275780.html,0,www.focus.de,Ukraine-Krieg - Stimmen und Entwicklungen - Militärstratege erklärt ukrainische Gegenoffensive als „gescheitert“,In der Nacht zum Freitag halten die schweren Kämpfe um die Stadt Awdijwka im Gebiet Donezk an. Der Kreml wird die Lage in Israel laut Experten für seine eigenen Zwecke nutzen. Der russische Präsident Putin hat seinen ersten Staatsbesuch seit dem international…,https://p6.focus.de/img/fotos/id_223995102/ein-zerstoertes-haus-in-der-ukrainischen-stadt-donezk.-.jpg?im=Crop%3D%280%2C288%2C3464%2C1732%29%3BResize%3D%281200%2C627%29&impolicy=perceptual&quality=mediumHigh&hash=135c9f526ee0987c88a675764a6e10558fdd36e972c59bf3a3ff9a76891c4d2c,2023-10-13T07:39:55Z,,In der Nacht zum Freitag halten die schweren Kämpfe um die Stadt Awdijwka im Gebiet Donezk an. Der Kreml wird die Lage in Israel laut Experten für seine eigenen Zwecke nutzen. Der russische Präsident… [+13202 chars],,de,'Alexander De Croo'
https://www.zeit.de/video/2023-10/6338969061112/usa-republikaner-scalise-zieht-kandidatur-fuer-vorsitz-im-us-kongress-zurueck,https://www.zeit.de/video/2023-10/6338969061112/usa-republikaner-scalise-zieht-kandidatur-fuer-vorsitz-im-us-kongress-zurueck,0,www.zeit.de,USA: Republikaner Scalise zieht Kandidatur für Vorsitz im US-Kongress zurück,Der für den Chefposten nominierte Steve Scalise konnte nicht auf den Rückhalt seiner Partei zählen. Das Repräsentantenhaus bleibt damit weiterhin entscheidungsunfähig.,,2023-10-13T07:50:48Z,,"When browsing with ads:
We collect personal data and also transmit it to third-party providers
 that help us improve and finance our digital content. Some of the information stored on your device, … [+821 chars]",,de,'Steve Scalise'
https://www.kino.de/film/oppenheimer-2023/news/grosser-hollywood-regisseur-kritisiert-christopher-nolans-oppenheimer-fuer-das-auslassen-einer-sache/,https://www.kino.de/film/oppenheimer-2023/news/grosser-hollywood-regisseur-kritisiert-christopher-nolans-oppenheimer-fuer-das-auslassen-einer-sache/,0,www.kino.de,Großer Hollywood-Regisseur kritisiert Christopher Nolans „Oppenheimer“ für das Auslassen einer Sache,Mit „Oppenheimer“ feierte Christopher Nolan einen unerwartet großen Kinoerfolg. Aber er hat nach Spike Lee eine wichtige Verantwortung außer Acht gelassen.,https://crops.giga.de/b4/e1/5e/41c85efe230d57e96b08aea966_YyAxNTcxeDg4NCs1KzQyMQJyZSAxOTIwIDEwODADYjE0OGYzNTkwZTY=.jpg,2023-10-13T14:12:06Z,,"Mit „Oppenheimer“ feierte Christopher Nolan einen unerwartet großen Kinoerfolg. Aber er hat nach Spike Lee eine wichtige Verantwortung außer Acht gelassen.
Machen wir uns nichts vor: Nicht allen hat… [+3983 chars]",,de,'Christopher Nolan'
