index,url,valid,domain,title,description,image,published,archive,content,quote,language,keyword
https://www.morgenpost.de/politik/ausland/article239724983/Wer-ist-der-Raedelsfuehrer-Matt-Gaetz.html,https://www.morgenpost.de/politik/ausland/article239724983/Wer-ist-der-Raedelsfuehrer-Matt-Gaetz.html,0,www.morgenpost.de,US-Republikaner: Wer ist der Rädelsführer Matt Gaetz?,"Er verbreitet Verschwörungstheorien, ist Abtreibungsgegner und gegen die gleichgeschlechtliche Ehe: Matt Gaetz. Nun hat er dafür gesorgt, dass der  Vorsitzende des Repräsentantenhauses seinen Job los ist.",https://img.morgenpost.de/img/ausland/crop239724981/3632606127-w820-cv16_9-q85/US-Republikaner.jpg,2023-10-04T08:39:14Z,,"Washington. Das ist beispiellos in der amerikanischen Geschichte: Der mächtige republikanische Vorsitzende des Repräsentantenhauses, Kevin McCarthy, ist wegen eines Streits über den Haushalt aus dem … [+2041 chars]",,de,'Matt Gaetz'
https://taz.de/Abwahl-von-McCarthy-im-US-Kongress/!5964443/,https://taz.de/Abwahl-von-McCarthy-im-US-Kongress/!5964443/,0,taz.de,Abwahl von McCarthy im US-Kongress: Keine Kompromisse,Racheglüste des Trump-Lagers haben zur Abwahl Kevin McCartys geführt. Der rechte Flügel der Republikaner spielt jetzt eine zentrale Rolle im Kongress.,https://taz.de/picture/6564096/948/33740463-1.jpeg,2023-10-04T10:13:00Z,,"Racheglüste des Trump-Lagers haben zur Abwahl Kevin McCartys geführt. Der rechte Flügel der Republikaner spielt jetzt eine zentrale Rolle im Kongress.
Republikaner Matt Gaetz vor der Presse in Washi… [+3371 chars]",,de,'Kevin McCarthy'
https://www.welt.de/politik/ausland/article247798682/Ukraine-News-Ukraine-meldet-Angriff-auf-russische-Region-Belgorod.html,https://www.welt.de/politik/ausland/article247798682/Ukraine-News-Ukraine-meldet-Angriff-auf-russische-Region-Belgorod.html,0,www.welt.de,Ukraine meldet Angriff auf russische Region Belgorod,Nach Informationen des ukrainischen Geheimdienstes SBU ist in der Nacht zu Mittwoch ein Luftabwehrsystem in der westrussischen Region Belgorod getroffen worden. Präsident Selenskyj setzt weiter auf die Unterstützung der USA. Mehr im Liveticker.,https://img.welt.de/img/politik/ausland/mobile247811054/8531359867-ci16x9-w1200/ARMY-2019-International-Military-and-Technical-Forum.jpg,2023-10-04T13:34:00Z,,Die Ukraine hat nach Angaben aus ihrem Sicherheitsdienst SBU in der Nacht die westrussische Region Belgorod mit Drohnen angegriffen. Ein Luftabwehrsystem vom Typ S 400 samt Radaranlage sei getroffen … [+6437 chars],,de,'Selenskyj'
https://www.stern.de/politik/ausland/kevin-mccarthy--wie-geht-es-in-den-usa-weiter-nach-seinem-beispiellosen-aus--33882600.html,https://www.stern.de/politik/ausland/kevin-mccarthy--wie-geht-es-in-den-usa-weiter-nach-seinem-beispiellosen-aus--33882600.html,0,www.stern.de,Sprecher des US-Repräsentantenhaus: Wie geht es weiter nach dem beispiellosen Aus von Kevin McCarthy?,Ohne den Sprecher des Repräsentantenhauses geht politisch nichts in den USA. Deswegen wiegt die Abwahl von Amtsinhaber Kevin McCarthy schwer. Wie geht es weiter? Und warum fällt wieder ein unvermeidlicher Name? Die wichtigsten Fragen.,https://image.stern.de/33882618/t/4B/v1/w1440/r1.7778/-/kevin-mccarthy.jpg,2023-10-04T13:52:00Z,,"15 Mal hatten die Abgeordneten des Repräsentantenhauses Anfang des Jahres abgestimmt, um Kevin McCarthy zu ihrem Sprecher zu wählen. Um das immerhin dritthöchste Amt der USA besetzen zu können, war d… [+3229 chars]",,de,'Kevin McCarthy'
https://www.stern.de/politik/ausland/usa--wer-ist-matt-gaetz--der-mann--der-mccarthy-gestuerzt-hat--33881746.html,https://www.stern.de/politik/ausland/usa--wer-ist-matt-gaetz--der-mann--der-mccarthy-gestuerzt-hat--33881746.html,0,www.stern.de,"Sprecher McCarthy abgesetzt: Für Gott, Vaterland und vor allem für sich selbst: Das ist Revoltenführer Matt Gaetz","Er hat es tatsächlich geschafft. Matt Gaetz hat Kevin McCarthy, den drittmächtigsten Mann der USA gestürzt. Nicht im Alleingang, aber irgendwie doch. Wer ist der ultrarechte Hardliner? Und was verspricht er sich von seiner Meuterei?",https://image.stern.de/33882838/t/CW/v1/w1440/r1.7778/-/matt-gaetz.jpg,2023-10-04T14:33:00Z,,"Dass der rechte Flügelspieler Matt Gaetz zur Meuterei gegen seinen Parteikollegen und Mehrheitsführer Kevin McCarthy aufrufen würde, war klar. Doch, dass die Palastrevolte am Ende tatsächlich gelang,… [+360 chars]",,de,'Kevin McCarthy'
https://www.stern.de/politik/kevin-mccarthy--diese--hateful-eight--republikaner-stimmten-gegen-ihn-33882296.html,https://www.stern.de/politik/kevin-mccarthy--diese--hateful-eight--republikaner-stimmten-gegen-ihn-33882296.html,0,www.stern.de,"US-Repräsentantenhaus: ""The Hateful Eight"": Diese acht Abgeordneten stimmten gegen Kevin McCarthy",Mit Kevin McCarthy wurde zum ersten Mal in der US-Geschichte ein Sprecher des Repräsentantenhauses abgesetzt. Diese Abgeordneten stimmten gegen den Vorsitzenden.,https://image.stern.de/33883692/t/4D/v2/w1440/r1.7778/-/gaetz-burchett.jpg,2023-10-04T16:49:00Z,,"In einem bisher nie vollzogenen Schritt wurde der republikanische Sprecher des US-Repräsentantenhauses, Kevin McCarthy seines Amtes enthoben. Gemeutert hatten Abgeordnete aus den eigenen Reihen. Bis … [+530 chars]",,de,'Matt Gaetz'
https://www.diepresse.com/17718764/wie-die-republikaner-sich-selbst-zerfleischen,https://www.diepresse.com/17718764/wie-die-republikaner-sich-selbst-zerfleischen,0,www.diepresse.com,Wie die Republikaner sich selbst zerfleischen [premium],Nach dem Sturz von Sprecher Kevin McCarthy steckt die Partei in einer tiefen Krise: Ist sie regierungsunfähig? Und was sagt eigentlich Donald Trump dazu?,https://img.diepresse.com/public/incoming/usvqzp-file7s8f0jk9rp5jix28tz8.jpg/alternates/DPR_SOCIAL_NACHRICHTEN_PAID/file7s8f0jk9rp5jix28tz8.jpg,2023-10-04T17:34:46Z,,"Nach dem Sturz von Sprecher Kevin McCarthy steckt die Partei in einer tiefen Krise: Ist sie regierungsunfähig? Und was sagt eigentlich Donald Trump dazu?
Es waren acht Republikaner, die am Dienstag … [+1505 chars]",,de,'Matt Gaetz'
https://www.diepresse.com/17718782/trump-getreuer-jordan-will-neuer-chef-im-us-repraesentantenhaus-werden,https://www.diepresse.com/17718782/trump-getreuer-jordan-will-neuer-chef-im-us-repraesentantenhaus-werden,0,www.diepresse.com,Trump-Getreuer Jordan will neuer Chef im US-Repräsentantenhaus werden,"Der Abgeordnete Jim Jordan ist Medienberichten zufolge der erste Republikaner, der sich öffentlich als McCarthys Nachfolge anbietet.",https://img.diepresse.com/public/incoming/35fy6y-USA-CONGRESS/alternates/DPR_SOCIAL_NACHRICHTEN/USA-CONGRESS,2023-10-04T18:21:26Z,,"Der Abgeordnete Jim Jordan ist Medienberichten zufolge der erste Republikaner, der sich öffentlich als McCarthys Nachfolge anbietet. 
Nach der historischen Absetzung des Vorsitzenden des US-Repräsen… [+1354 chars]",,de,'Jim Jordan'
https://www.welt.de/politik/ausland/article247798682/Ukraine-News-Scholz-rechnet-mit-Fortsetzung-der-US-Hilfe-fuer-Ukraine.html,https://www.welt.de/politik/ausland/article247798682/Ukraine-News-Scholz-rechnet-mit-Fortsetzung-der-US-Hilfe-fuer-Ukraine.html,0,www.welt.de,Scholz rechnet mit Fortsetzung der US-Hilfe für Ukraine,"Trotz der Turbulenzen im US-Repräsentantenhaus ist Bundeskanzler Olaf Scholz überzeugt, dass die USA der Ukraine weiter Waffen liefern werden. Derweil meldet die Ukraine einen Angriff auf russische Region Belgorod. Mehr im Liveticker.",https://img.welt.de/img/newsticker/dpa_nt/infoline_nt/politik_ausland_nt/mobile247817818/3121359867-ci16x9-w1200/Bundeskanzler.jpg,2023-10-04T19:55:00Z,,"Bundeskanzler Olaf Scholz (SPD) geht fest davon aus, dass die USA ihre Hilfe für die von Russland angegriffene Ukraine trotz des Haushaltsstreits im Kongress fortsetzen werden. Ich bin sehr überzeugt… [+9417 chars]",,de,'Olaf Scholz'
https://www.nzz.ch/international/wie-geht-es-weiter-nach-absetzung-von-mccarthy-amerika-sucht-einen-speaker-ld.1759303,https://www.nzz.ch/international/wie-geht-es-weiter-nach-absetzung-von-mccarthy-amerika-sucht-einen-speaker-ld.1759303,0,www.nzz.ch,Wer will überhaupt noch dieses Amt? Amerika sucht den nächsten Speaker,"Zwei Mutige haben sich bereits gemeldet, die Nachfolger des abgesetzten Speakers Kevin McCarthy werden wollen. Hardliner wie Matt Gaetz werden auch sie in die Zange nehmen.","https://img.nzz.ch/2023/10/05/c970a717-35ae-4841-a9c4-4968d9024b7e.jpeg?width=1200&height=674&fit=bound&quality=75&auto=webp&crop=3976,2234,x0,y83&wmark=nzz",2023-10-06T03:30:00Z,,"Matt Gaetz (rechts) nach der erfolgreichen Abwahl des Speakers Kevin McCarthy am 3. Oktober 2023, die er beantragt hat.
Der 3. Oktober 2023 hat jetzt schon seinen festen Platz in der amerikanischen … [+6675 chars]",,de,'Matt Gaetz'
https://www.nzz.ch/international/ld.1759504,https://www.nzz.ch/international/ld.1759504,0,www.nzz.ch,Der Konflikt zwischen Armenien und Aserbaidschan ist auch eine Schlappe für die EU und ihren Ratspräsidenten,Charles Michel wollte sich als Friedensbringer im Kaukasus profilieren. Das war eine grobe Überschätzung seiner Möglichkeiten. In der Region hat Brüssel wenig zu sagen.,"https://img.nzz.ch/2023/10/05/70665efe-fb89-4e9c-983f-baa8091708ee.jpeg?width=1200&height=674&fit=bound&quality=75&auto=webp&crop=5000,2809,x0,y261&wmark=nzz",2023-10-06T03:30:00Z,,Gut gelaunt durchschritt Charles Michel an einem Sonntag im Mai das lichtdurchflutete Europa-Gebäude. Neben dem Präsidenten des EU-Rats spazierten zwei ungleiche Männer auf dem roten Teppich. Der ein… [+198 chars],,de,'Charles Michel'
https://www.nzz.ch/international/wer-will-ueberhaupt-noch-dieses-amt-amerika-sucht-den-naechsten-speaker-ld.1759303,https://www.nzz.ch/international/wer-will-ueberhaupt-noch-dieses-amt-amerika-sucht-den-naechsten-speaker-ld.1759303,0,www.nzz.ch,Amerika sucht den nächsten Speaker: Zwei republikanische Schwergewichte wollen Kevin McCarthy beerben,"Nach der Abwahl des Speakers stellt sich die Frage, wer dieses Amt überhaupt noch übernehmen will. Denn Hardliner wie Matt Gaetz werden auch McCarthys Nachfolger in die Zange nehmen.","https://img.nzz.ch/2023/10/05/c970a717-35ae-4841-a9c4-4968d9024b7e.jpeg?width=1200&height=674&fit=bound&quality=75&auto=webp&crop=3976,2234,x0,y83&wmark=nzz",2023-10-06T03:30:00Z,,"Matt Gaetz (rechts) nach der erfolgreichen Abwahl des Speakers Kevin McCarthy am 3. Oktober 2023, die er beantragt hat.
Der 3. Oktober 2023 hat jetzt schon seinen festen Platz in der amerikanischen … [+6675 chars]",,de,'Kevin McCarthy'
https://www.faz.net/aktuell/politik/ausland/meloni-nimmt-die-eu-in-den-blick-fuehrende-gestalt-der-neuen-rechten-19222462.html,https://www.faz.net/aktuell/politik/ausland/meloni-nimmt-die-eu-in-den-blick-fuehrende-gestalt-der-neuen-rechten-19222462.html,0,www.faz.net,Kommentar zu Giorgia Meloni: Europas Brandmauerspecht,"Nach einem Jahr sitzt Giorgia Meloni in Rom fest im Sattel, sie weiß große Teile der Bürger hinter sich. Als führende Gestalt der „neuen Rechten“ nimmt sie nun die EU in den Blick.",https://media0.faz.net/ppmedia/aktuell/politik/2815299335/1.9222760/facebook_teaser/eu-kommissionspraesidentin-von.jpg,2023-10-06T07:42:04Z,,Ministerpräsidentin Giorgia Meloni und ihre Mitte-rechts-Koalition sind seit knapp einem Jahr im Amt. Die linke Opposition in Rom und die politischen Sittenwächter in Deutschland stellen ihr ein schl… [+4481 chars],,de,'Giorgia Meloni'
https://www.tagesschau.de/ausland/europa/ukraine-nach-angriff-hrosa-100.html,https://www.tagesschau.de/ausland/europa/ukraine-nach-angriff-hrosa-100.html,0,www.tagesschau.de,"Raketenangriff auf Hrosa: ""Das war keine blinde Attacke""",Mehr als 50 Menschen sind bei dem russischen Angriff auf ein Café und ein Geschäft in der Ostukraine getötet worden - laut Präsident Selenskyj ein Sechstel der Dorfbevölkerung. UN und EU verurteilten den Angriff scharf.,https://images.tagesschau.de/image/5196cd72-b399-4825-8187-98d27b78e6e0/AAABiwQo5hk/AAABibBxqrQ/16x9-1280/hrosa-100.jpg,2023-10-06T08:44:31Z,,"Stand: 06.10.2023 10:44 Uhr
Mehr als 50 Menschen sind bei dem russischen Angriff auf ein Café und ein Geschäft in der Ostukraine getötet worden - laut Präsident Selenskyj ein Sechstel der Dorfbevölk… [+3441 chars]",,de,'nan nan'
https://www.faz.net/aktuell/politik/wahl-in-hessen/boris-rhein-vor-der-landtagswahl-in-hessen-der-schattenboxer-19219719.html,https://www.faz.net/aktuell/politik/wahl-in-hessen/boris-rhein-vor-der-landtagswahl-in-hessen-der-schattenboxer-19219719.html,0,www.faz.net,"Boris Rhein, der Schattenboxer","Boris Rhein ist es gelungen, die CDU in Hessen zu erneuern und seinen frühen Vorsprung in den Umfragen zu sichern. Das verdankt er auch der unbeliebten Ampelkoalition im Bund.",https://media0.faz.net/ppmedia/aktuell/146816800/1.9219718/facebook_teaser_fplus/wahlkampf-in-der.jpg,2023-10-07T10:17:10Z,,"Boris Rhein zögert. Ein Mann hält ihm ein Megafon hin, durch das er seine Ansprache halten soll. Er könne auch einfach laut sprechen, erwidert Rhein. Vor ihm stehen knapp 30 Leute von der Jungen Unio… [+884 chars]",,de,'Boris Rhein'
https://www.stern.de/lifestyle/mode/heidi-klum-und-leni-klum--mutter-und-tochter-zeigen-wieder-neue-dessous-33891550.html,https://www.stern.de/lifestyle/mode/heidi-klum-und-leni-klum--mutter-und-tochter-zeigen-wieder-neue-dessous-33891550.html,0,www.stern.de,Heidi Klum und Leni Klum: Mutter und Tochter zeigen wieder neue Dessous,Heidi Klum und Leni Klum werden zu Wiederholungstäterinnen: In Berlin haben Mutter und Tochter wieder neue Dessous vorgestellt.,https://image.stern.de/33891554/t/OF/v1/w1440/r1.7778/-/07--mutter-und-tochter-zeigen-wieder-neue-dessous---16-9---spoton-article-1053751.jpg,2023-10-07T11:23:00Z,,"Heidi Klum und Leni Klum werden zu Wiederholungstäterinnen: In Berlin haben Mutter und Tochter wieder neue Dessous vorgestellt.
Heidi Klum (50) und Tochter Leni Klum (19) haben einmal mehr ihre krea… [+1872 chars]",,de,'Heidi Klum'
https://www.n-tv.de/leute/Heidi-und-Leni-Klum-posieren-wieder-in-Dessous-article24447191.html,https://www.n-tv.de/leute/Heidi-und-Leni-Klum-posieren-wieder-in-Dessous-article24447191.html,0,www.n-tv.de,Neue Intimissimi-Kollektion: Heidi und Leni Klum posieren wieder in Dessous,Bereits mehrfach sorgen Heidi und Leni Klum in Dessous für Aufsehen. In Berlin präsentiert das Mutter-Tochter-Duo nun seine neue gemeinsame Kollektion mit dem Bekleidungslabel Intimissimi. Auch weitere bekannte Gesichter sind bei dem Event zu Gast.,https://bilder3.n-tv.de/img/incoming/crop24447218/8951325428-cImg_16_9-w1200/429133225.jpg,2023-10-07T11:58:55Z,,Bereits mehrfach sorgen Heidi und Leni Klum in Dessous für Aufsehen. In Berlin präsentiert das Mutter-Tochter-Duo nun seine neue gemeinsame Kollektion mit dem Bekleidungslabel Intimissimi. Auch weite… [+1891 chars],,de,'Heidi Klum'
https://www.tagesspiegel.de/berlin/klum-und-klummer-heidi-und-tochter-prasentieren-unterwasche-im-berliner-bode-museum-10587265.html,https://www.tagesspiegel.de/berlin/klum-und-klummer-heidi-und-tochter-prasentieren-unterwasche-im-berliner-bode-museum-10587265.html,0,www.tagesspiegel.de,Klum und Klümmer: Heidi und Tochter präsentieren Unterwäsche im Berliner Bode-Museum,"Bei einem Werbeevent in Berlin stellt Heidi Klum wie immer ihre Professionalität unter Beweis, Tochter Leni dagegen bleibt unsichtbar. Ein Abend voller Missverständnisse.",https://www.tagesspiegel.de/images/heidi-klum-mit-tochter-leni-klum-bei-der-ankunft-zum-exklusiven-intimissimi-dinner-event-im-bode-museum-berlin-06102/alternates/BASE_16_9_W1400/heidi-klum-mit-tochter-leni-klum-bei-der-ankunft-zum-exklusiven-intimissimi-dinner-event-im-bode-museum-berlin-06102.jpeg,2023-10-07T13:13:05Z,,"Vielleicht hat Heidi Klum den Ratschlag von Johann Wolfgang von Goethe, Wenn Kinder klein sind, gib ihnen Wurzeln. Wenn sie groß sind, gib ihnen Flügel, einfach falsch verstanden. Galt die Aufnahme i… [+3354 chars]",,de,'Heidi Klum'
https://www.focus.de/kultur/royals/einbruch-an-weihnachten-2021-nach-mord-plaenen-muss-windsor-eindringling-ins-gefaengnis_id_220277773.html,https://www.focus.de/kultur/royals/einbruch-an-weihnachten-2021-nach-mord-plaenen-muss-windsor-eindringling-ins-gefaengnis_id_220277773.html,0,www.focus.de,Einbruch an Weihnachten 2021 - Nach Mord-Plänen muss Windsor-Eindringling ins Gefängnis,"Im Jahr 2021 brach ein Eindringling in das Gelände von Schloss Windsor ein. Nachdem er gefasst wurde, teilte er mit, dass er geplant hatte, Queen Elizabeth II. zu töten. Nun wurde er zu einer Haftstrafe verurteilt.",https://p6.focus.de/img/panorama/welt/id_203993129/koenigin-elizabeth-ii.-ist-vor-einem-jahr-im-alter-von-96-jahren-auf-schloss-balmoral-in-schottland-gestorben..jpg?im=Crop%3D%280%2C51%2C2048%2C1024%29%3BResize%3D%281200%2C627%29&impolicy=perceptual&quality=mediumHigh&hash=72b74d009d0b270b95ce9879834d71801d43c8d5ed5bbf71b3012d60f47b1648,2023-10-07T13:35:04Z,,"Im Jahr 2021 brach ein Eindringling in das Gelände von Schloss Windsor ein. Nachdem er gefasst wurde, teilte er mit, dass er geplant hatte, Queen Elizabeth II. zu töten. Nun wurde er zu einer Haftstr… [+4155 chars]",,de,'Königin Camilla'
https://www.stern.de/lifestyle/leute/heidi-und-leni-klum-praesentieren-neue-dessous-kampagne-fuer-intimissimi-33891678.html,https://www.stern.de/lifestyle/leute/heidi-und-leni-klum-praesentieren-neue-dessous-kampagne-fuer-intimissimi-33891678.html,0,www.stern.de,Trotz anhaltender Kritik: Sie haben es erneut getan: Leni und Heidi Klum präsentieren gemeinsame Dessous-Kampagne,Heidi und Leni Klum haben in Berlin ihre neue Intimissimi-Kollektion vorgestellt. Es war auch ein Statement hinsichtlich der vergangenen Kritik an den gemeinsamen Dessous-Aufnahmen von Mutter und Tochter.,https://image.stern.de/33891714/t/eQ/v4/w1440/r1.7778/-/intimissimi-heidi-leni-06-10-23-06632.jpg,2023-10-07T14:25:00Z,,Es ist ihre vierte gemeinsame Kollektion und sie zelebrieren sie wie keine zuvor: Heidi und Leni Klum haben in Berlin ihre neue Linie in Zusammenarbeit mit dem Dessous-Label Intimissimi vorgestellt. … [+2642 chars],,de,'Heidi Klum'
https://www.bild.de/bild-plus/unterhaltung/leute/leute/heidi-klum-ueber-den-wow-auftritt-ihrer-tochter-das-macht-leni-schon-wie-ein-mod-85661132.bild.html,https://www.bild.de/bild-plus/unterhaltung/leute/leute/heidi-klum-ueber-den-wow-auftritt-ihrer-tochter-das-macht-leni-schon-wie-ein-mod-85661132.bild.html,0,www.bild.de,Heidi Klum - DAS macht Leni schon wie ein Model-Profi,Am Freitagabend waren Supermodel Heidi Klum und ihre Tochter Leni Stargäste in Berlin. Lenis Auftritt übertraf wohl alles …,"https://images.bild.de/6520e7247a8e20361ddb315a/5a36ff0fba999e33385a9ebe62495715,8f077077?w=1280",2023-10-07T14:34:50Z,,"Dieser Auftritt war einfach spitze! 
Am Freitagabend waren Supermodel Heidi Klum (50) und ihre Tochter Leni (19) die Stargäste bei einem exklusiven Dinner des italienischen Wäsche-Labels Intimissimi… [+421 chars]",,de,'Heidi Klum'
https://extratv.com/photos/image_jpeg_20231006_dcfcd66cea5f45d09afe6cc470c58b3e/,https://extratv.com/photos/image_jpeg_20231006_dcfcd66cea5f45d09afe6cc470c58b3e/,0,extratv.com,SPL9954212_049.jpeg,Heidi Klum and her daughter Leni attended an Intimissimi dinner at Bode Museum in Berlin.,https://extra-images.akamaized.net/image/dc/16by9/2023/10/06/dcfcd66cea5f45d09afe6cc470c58b3e_xl.jpeg,2023-10-07T15:52:48Z,,"Celebrity NewsTaylor Swift Attends Chiefs vs. Jets Game with Celeb Squad
Taylor Swift brought out her celeb squad to cheer on rumored flame Travis Kelce and the Chiefs vs. the Je ...",,de,'Heidi Klum'
https://www.faz.net/aktuell/politik/wahl-in-bayern/wahlen-in-hessen-und-bayern-gute-chancen-fuer-markus-soeder-und-boris-rhein-19227787.html,https://www.faz.net/aktuell/politik/wahl-in-bayern/wahlen-in-hessen-und-bayern-gute-chancen-fuer-markus-soeder-und-boris-rhein-19227787.html,0,www.faz.net,Hessen und Bayern wählen neue Landtage,"In Bayern und Hessen haben die Wahllokale geöffnet. Laut Umfragen haben sowohl Markus Söder als auch Boris Rhein gute Chancen, im Amt zu bleiben.",https://media1.faz.net/ppmedia/aktuell/politik/wahl-in-bayern/3296559403/1.9227867/facebook_teaser/letzte-vorbereitungen-in-einem.jpg,2023-10-08T06:51:20Z,,"In Hessen und Bayern haben am Sonntagmorgen die Landtagswahlen begonnen. In Hessen sind rund 4,3 Millionen Wahlberechtigte aufgerufen, ihre Stimme abzugeben. Ministerpräsident Boris Rhein (CDU) hat l… [+1370 chars]",,de,'Boris Rhein'
https://www.stern.de/lifestyle/leute/vip-news--heidi-klum-vermisst-ihr-gepaeck-nach-einem-flug-mit-lufthansa-3205306.html,https://www.stern.de/lifestyle/leute/vip-news--heidi-klum-vermisst-ihr-gepaeck-nach-einem-flug-mit-lufthansa-3205306.html,0,www.stern.de,Leute von heute: Schon wieder: Heidi Klum vermisst ihr Gepäck nach einem Flug mit Lufthansa,"Sie hat einfach kein Glück: Zum dritten Mal innerhalb weniger Monate ist das Gepäck von Heidi Klum verschwunden, nachdem sie mit Lufthansa geflogen ist. Diese und weitere Promi-Meldungen in den VIP-News.",https://image.stern.de/33893212/t/1t/v4/w1440/r1.7778/-/heidi-klum-lufthansa.jpg,2023-10-08T10:17:00Z,,"Von ""A"" wie Angelina Jolie oder Amal Clooney über ""H"" wie Heidi Klum und Helene Fischer bis ""Z"" wie Zac Efron und Zara Tindall: In der Welt der Promis ist immer etwas los. Ob sich nun neue Paare find… [+494 chars]",,de,'Heidi Klum'
https://www.stern.de/lifestyle/leute/heidi-und-leni-klum--so-praesentieren-sie-ihre-neue-dessous-kollektion-33891852.html,https://www.stern.de/lifestyle/leute/heidi-und-leni-klum--so-praesentieren-sie-ihre-neue-dessous-kollektion-33891852.html,0,www.stern.de,"Intimissimi: Seide, Spitze, knallige Farben: So präsentieren sich Heidi und Leni Klum in ihrer neuen Dessous-Kollektion","Heidi und Leni Klum haben in Berlin ihre neue Intimissimi-Kollektion vorgestellt. In Spitze, Seide und angesagten Trendfarben präsentiert sich das Mutter-Tochter-Duo in den neuen Dessous.",https://image.stern.de/33891856/t/cw/v3/w1440/r1.7778/-/230611-intimissimi-m03-couple-outfit-02-0503-f6-2.jpg,2023-10-08T12:14:00Z,,"Es ist bereits das vierte Mal, dass Topmodel Heidi Klum zusammen mit ihrer älteren Tochter Leni eine Dessous-Kollektion herausbringt und erneut sorgen die beiden Frauen mit den sinnlichen Kampagnenbi… [+1226 chars]",,de,'Heidi Klum'
https://www.brigitte.de/aktuell/heidi-klum--tochter-lou-feiert-geburtstag---mit-trampolin-und-eisstand-13599470.html,https://www.brigitte.de/aktuell/heidi-klum--tochter-lou-feiert-geburtstag---mit-trampolin-und-eisstand-13599470.html,0,www.brigitte.de,Heidi Klum: Tochter Lou feiert Geburtstag - mit Trampolin und Eisstand,Heidi Klums Tochter Lou wird 14 - und feiert eine Gartenparty. Details vom ausgelassenen Treiben zeigt die Entertainerin in kurzen Videos.,https://image.brigitte.de/13599472/t/h7/v1/w1440/r1.7778/-/08--tochter-lou-feiert-geburtstag---mit-trampolin-und-eisstand---1-1---spoton-article-1053791.jpg,2023-10-08T13:53:00Z,,"Heidi Klums Tochter Lou wird 14 - und feiert eine Gartenparty. Details vom ausgelassenen Treiben zeigt die Entertainerin in kurzen Videos.
Nach den ""GNTM""-Castings Anfang der Woche und der Präsentat… [+1161 chars]",,de,'Heidi Klum'
https://www.stern.de/lifestyle/leute/heidi-klum--gartenparty-zum-geburtstag-von-tochter-lou-33893666.html,https://www.stern.de/lifestyle/leute/heidi-klum--gartenparty-zum-geburtstag-von-tochter-lou-33893666.html,0,www.stern.de,Heidi Klum: Gartenparty zum Geburtstag von Tochter Lou,Heidi Klums Tochter Lou wird 14 - und feiert eine Gartenparty. Details vom ausgelassenen Treiben zeigt die Entertainerin in kurzen Videos.,https://image.stern.de/33893670/t/pe/v1/w1440/r1.7778/-/08--gartenparty-zum-geburtstag-von-tochter-lou---16-9---spoton-article-1053791.jpg,2023-10-08T14:01:00Z,,"Heidi Klums Tochter Lou wird 14 - und feiert eine Gartenparty. Details vom ausgelassenen Treiben zeigt die Entertainerin in kurzen Videos.
Nach den ""GNTM""-Castings Anfang der Woche und der Präsentat… [+1127 chars]",,de,'Heidi Klum'
https://www.zeit.de/news/2023-10/08/boris-rhein-haben-besondere-verantwortung-fuer-israel,https://www.zeit.de/news/2023-10/08/boris-rhein-haben-besondere-verantwortung-fuer-israel,0,www.zeit.de,Internationales: Boris Rhein: «Haben besondere Verantwortung für Israel»,,,2023-10-08T17:20:49Z,,"When browsing with ads:
We collect personal data and also transmit it to third-party providers
 that help us improve and finance our digital content. Some of the information stored on your device, … [+821 chars]",,de,'Boris Rhein'
https://www.tagesschau.de/inland/innenpolitik/landtagswahlen-bayern-hessen-union-100.html,https://www.tagesschau.de/inland/innenpolitik/landtagswahlen-bayern-hessen-union-100.html,0,www.tagesschau.de,Markus Söder und Boris Rhein: Zwei ungleiche Sieger,"Verluste in Bayern, Zugewinne in Hessen: Die Ergebnisse der Wahlsieger Söder und Rhein könnten unterschiedlicher nicht sein. Doch die Union sieht sich insgesamt gestärkt. CDU-Chef Merz kann trotzdem nur bedingt zufrieden sein. Mit Von O. Sallet.",https://images.tagesschau.de/image/44e09d81-5020-4fd6-8893-3d190f081e9a/AAABitaBOcs/AAABibBxqrQ/16x9-1280/rhein-soeder-100.jpg,2023-10-08T20:04:43Z,,"Stand: 08.10.2023 22:04 Uhr
Verluste in Bayern, Zugewinne in Hessen: Die Ergebnisse der Wahlsieger Söder und Rhein könnten unterschiedlicher nicht sein. Doch die Union sieht sich insgesamt gestärkt.… [+3385 chars]",,de,'Boris Rhein'
