index,url,valid,domain,title,description,image,published,archive,content,quote,language,keyword
https://www.nzz.ch/international/in-ketten-vor-dem-richter-ein-italiener-wird-in-ungarn-wie-ein-tier-vorgefuehrt-ld.1776837,https://www.nzz.ch/international/in-ketten-vor-dem-richter-ein-italiener-wird-in-ungarn-wie-ein-tier-vorgefuehrt-ld.1776837,0,www.nzz.ch,In Ketten vor dem Richter: Eine Italienerin wird in Ungarn «wie ein Tier» vorgeführt,Bilder einer in Ungarn angeklagten italienischen Antifaschistin lösen in der Heimat eine Welle der Empörung aus. Der Fall ist für Giorgia Meloni höchst unbequem.,"https://img.nzz.ch/2024/01/31/9f037053-e81d-4642-bef9-0ccd2c0c416f.jpeg?width=1200&height=674&fit=bound&quality=75&auto=webp&crop=4484,2519,x0,y234&wmark=nzz",2024-02-01T04:30:00Z,,"Der Italienerin Ilaria S., 39, ist trotz schwierigen Haftbedingungen in Ungarn das Lachen nicht vergangen.
Die Bilder aus einem ungarischen Gerichtssaal wühlen Italien auf. Es sind Fotos, die man in… [+4394 chars]",,de,'Giorgia Meloni'
https://orf.at/stories/3347412/,https://orf.at/stories/3347412/,0,orf.at,Keine Oscar-Nominierung: Margot Robbie nicht traurig,,https://orf.at/mojo/1_4_1/storyserver//news/common/images/og-fallback-news.png,2024-02-01T10:23:48Z,,"Acht Oscar-Nominierungen hat Barbie, mit weltweiten Einspielergebnissen von 1,3 Milliarden Euro umsatzstärkster Film des Jahres 2023, erhalten, darunter für den besten Film, den besten Nebendarstelle… [+994 chars]",,de,'Greta Gerwig'
https://www.stern.de/lifestyle/leute/vip-news--margot-robbie-aeussert-sich-zu-den-oscar-nominierungen-3205306.html,https://www.stern.de/lifestyle/leute/vip-news--margot-robbie-aeussert-sich-zu-den-oscar-nominierungen-3205306.html,0,www.stern.de,"Leute von heute: Margot Robbie äußert sich erstmals zu den verpassten Oscar-Nominierungen für ""Barbie""","Die ""Barbie""-Darstellerin Margot Robbie hat sich erstmals zu dem Wirbel um die ausbleibenden Oscar-Nominierungen für sie und Regisseurin Greta Gerwig geäußert. Diese und weitere Promi-Meldungen in den VIP-News.",https://image.stern.de/34419382/t/on/v2/w1440/r1.7778/-/margot-robbie.jpg,2024-02-01T10:58:00Z,,"Von ""A"" wie Angelina Jolie oder Amal Clooney über ""H"" wie Heidi Klum und Helene Fischer bis ""Z"" wie Zac Efron und Zara Tindall: In der Welt der Promis ist immer etwas los. Ob sich nun neue Paare find… [+1361 chars]",,de,'Greta Gerwig'
https://t3n.de/news/gta-6-auf-sylt-ki-trailer-zeigt-waffen-autos-und-christian-lindner-1605443/,https://t3n.de/news/gta-6-auf-sylt-ki-trailer-zeigt-waffen-autos-und-christian-lindner-1605443/,0,t3n.de,"GTA 6 auf Sylt: KI-Trailer zeigt Waffen, Autos und Christian Lindner","Ach, wie lustig wäre doch ein Grand-Theft-Auto-Teil, der in Deutschland spielen würde. Ein KI-Trailer zeigt nun, wie das Spiel auf Sylt aussehen könnte.
weiterlesen auf t3n.de",https://t3n.de/news/wp-content/uploads/2024/02/gta-6-sylt.jpg,2024-02-01T13:00:32Z,,"Eine Kolonne aus Mercedes-G-Klassen fährt durch den Sand. Eine Frau versteckt sich im Schilf mit einer Waffe. Luxus, schöne Menschen und fette Knarren der Trailer von Grand Theft Auto 6 Sylt Luxury h… [+2804 chars]",,de,'Christian Lindner'
https://www.brigitte.de/aktuell/selma-blair-und-co---jede-menge-promis-bei-paris-hiltons-kindergeburtstag-13765288.html,https://www.brigitte.de/aktuell/selma-blair-und-co---jede-menge-promis-bei-paris-hiltons-kindergeburtstag-13765288.html,0,www.brigitte.de,Selma Blair und Co.: Jede Menge Promis bei Paris Hiltons Kindergeburtstag,Paris Hilton hat den 1. Geburtstag von Sohn Phoenix mit einer Fotoreihe auf Instagram festgehalten. Auch Stars wie Selma Blair waren da.,https://image.brigitte.de/13765290/t/oh/v1/w1440/r1.7778/-/01--jede-menge-promis-bei-paris-hiltons-kindergeburtstag---1-1---spoton-article-1060493.jpg,2024-02-01T13:51:00Z,,"Paris Hilton hat den 1. Geburtstag von Sohn Phoenix mit einer Fotoreihe auf Instagram festgehalten. Auch Stars wie Selma Blair waren da.
Neu-Mama Paris Hilton (42) hat den 1. Geburtstag von Sohn Pho… [+1528 chars]",,de,'Paris Hilton'
https://www.welt.de/regionales/hamburg/article249860568/Organisierte-Kriminalitaet-Der-Zoll-findet-eine-halbe-Tonne-Kokain-im-Hamburger-Hafen.html,https://www.welt.de/regionales/hamburg/article249860568/Organisierte-Kriminalitaet-Der-Zoll-findet-eine-halbe-Tonne-Kokain-im-Hamburger-Hafen.html,0,www.welt.de,Der Zoll findet eine halbe Tonne Kokain im Hamburger Hafen,"In einem Container findet der Hamburger Zoll 520 Päckchen Kokain zwischen Bananen versteckt. Adressiert war die Ladung an eine Frankfurter Firma. Vier Tatverdächtige sind in Hamburg festgenommen, Wohnungen in mehreren deutschen Städten durchsucht worden.",https://img.welt.de/img/regionales/hamburg/mobile249860566/5071356877-ci16x9-w1200/Sichergestelltes-Kokain.jpg,2024-02-01T15:07:50Z,,"Mehr als eine halbe Tonne Kokain haben Beamte des Zolls am Hamburger Hafen beschlagnahmt. Zudem wurden vier Tatverdächtige festgenommen, wie das Zollfahndungsamt Frankfurt am Main am Donnerstag mitte… [+2063 chars]",,de,'nan nan'
https://11freunde.de/artikel/der-kampf-des-jahrtausends/10266495,https://11freunde.de/artikel/der-kampf-des-jahrtausends/10266495,0,11freunde.de,"Der Kampf des Jahrtausends - Über ein Testspiel, das nur noch wütend macht","Heute Abend spielt Lionel Messi gegen Cristiano Ronaldo. Irre! Und vor allem ein Zeichen, wie pervers der Fußball geworden ist.",https://11freunde.de/actions/assets/generate-transform?transformId=1455956,2024-02-01T15:30:00Z,,"Wer Ame­rican Foot­ball schaut, ist am Ende auch selbst schuld. Aber was wissen acht Jungs aus einer Klein­stadt schon, wenn 8.000 Kilo­meter weiter in einer Fan­ta­sie­arena in New Orleans die große… [+4036 chars]",,de,'Lionel Messi'
https://www.diepresse.com/18055641/margot-robbie-nicht-traurig-ueber-ausgebliebene-oscar-chance-barbie,https://www.diepresse.com/18055641/margot-robbie-nicht-traurig-ueber-ausgebliebene-oscar-chance-barbie,0,www.diepresse.com,Margot Robbie nicht traurig über ausgebliebene Oscar-Chance „Barbie“,"Der Blockbuster „Barbie“ wurde zwar mit acht Nominierungen bedacht, aber sowohl Hauptdarstellerin Margot Robbie als auch Regisseurin Greta Gerwig wurden übergangen. Robbie sei jedoch nicht traurig, sondern „mehr als begeistert“ über die acht Nominierungen.",https://img.diepresse.com/public/incoming/p9q6xi-1934505649/alternates/DPR_SOCIAL_NACHRICHTEN/1934505649,2024-02-01T16:53:18Z,,"Der Blockbuster Barbie wurde zwar mit acht Nominierungen bedacht, aber sowohl Hauptdarstellerin Margot Robbie als auch Regisseurin Greta Gerwig wurden übergangen. Robbie sei jedoch nicht traurig, son… [+1467 chars]",,de,'Greta Gerwig'
https://www.tagesschau.de/ausland/europa/eu-gipfel-scholz-112.html,https://www.tagesschau.de/ausland/europa/eu-gipfel-scholz-112.html,0,www.tagesschau.de,Orban gibt Blockade auf: Ein klassisches Stück Gipfel-Diplomatie,Am Ende lenkte der ungarische Regierungschef Orban ein: Die EU-Staaten einigen sich ein großes Finanzierungspaket für die Ukraine. Das war ein hartes Stück Arbeit und klassische Gipfel-Diplomatie. Von Paul Vorreiter.,https://images.tagesschau.de/image/bf60d3bb-9555-48e2-9f5b-f073e08f25f2/AAABjWYYCWo/AAABibBxqrQ/16x9-1280/eu-gipfel-590.jpg,2024-02-01T19:14:28Z,,"Stand: 01.02.2024 20:14 Uhr
Am Ende lenkte der ungarische Regierungschef Orban ein: Die EU-Staaten einigen sich ein großes Finanzierungspaket für die Ukraine. Das war ein hartes Stück Arbeit und kla… [+4146 chars]",,de,'nan nan'
https://www.bild.de/sport/fussball/fussball-international/messi-blamage-gegen-ronaldos-al-nassr-deftige-0-6-klatsche-87003612.bild.html,https://www.bild.de/sport/fussball/fussball-international/messi-blamage-gegen-ronaldos-al-nassr-deftige-0-6-klatsche-87003612.bild.html,0,www.bild.de,Was für eine Klatsche! - Messi-Blamage gegen Ronaldos Al Nassr,Ein halbes Dutzend Gegentore!  Saudi-Klub Al-Nassr hat beim Saison-Vorbereitungsspiel in Riad/Saudi-Arabien 6:0 gegen Inter Miami gewonnen.,"https://images.bild.de/65bc037ef59b980d738aef0a/02dfeafb70d888927c5cf992559c5b07,fbffd0f9?w=1280",2024-02-01T21:07:00Z,,"Ein halbes Dutzend Gegentore! 
Saudi-Klub Al-Nassr hat beim Saison-Vorbereitungsspiel in Riad/Saudi-Arabien 6:0 gegen Inter Miami gewonnen. Eine Blamage für das Team von Lionel Messi (36).
Auch ohn… [+1173 chars]",,de,'Al Nassr'
https://www.n-tv.de/sport/fussball/Al-Nassr-trifft-aus-allen-Lagen-sogar-aus-50-Metern-article24706863.html,https://www.n-tv.de/sport/fussball/Al-Nassr-trifft-aus-allen-Lagen-sogar-aus-50-Metern-article24706863.html,0,www.n-tv.de,Messi und CR7 sehen irres Duell: Al-Nassr trifft aus allen Lagen - sogar aus 50 Metern,"Cristiano Ronaldo sitzt wegen einer Wadenverletzung auf der Tribüne, Lionel Messi wird erst ganz spät eingewechselt. Aber auch ohne die beiden alten Superstars des Fußballs wird das Vorbereitungsspiel zwischen Al-Nassr und Inter Miami zu einem wilden Spektake…",https://bilder2.n-tv.de/img/incoming/crop24706861/6241323978-cImg_16_9-w1200/24452b01c9f59d8a0daa1ed04fa6323b.jpg,2024-02-01T21:12:26Z,,"Cristiano Ronaldo sitzt wegen einer Wadenverletzung auf der Tribüne, Lionel Messi wird erst ganz spät eingewechselt. Aber auch ohne die beiden alten Superstars des Fußballs wird das Vorbereitungsspie… [+1665 chars]",,de,'Cristiano Ronaldo'
https://www.dwdl.de/nachrichten/96658/df1_setzt_auf_frauenbundesliga_und_saudische_pro_league/,https://www.dwdl.de/nachrichten/96658/df1_setzt_auf_frauenbundesliga_und_saudische_pro_league/,0,www.dwdl.de,DF1 setzt auf Frauen-Bundesliga und saudische Pro League,"Zu dem Live-Sport, den DF1 im Rahmen einer Kooperation mit DAZN zeigen wird, gehören unter anderem die Frauen-Bundesliga und die Saudi Pro League, in der Cristiano Ronaldo kickt. In den nächsten Tagen gibt's die ersten Spiele zu sehen.",https://www.dwdl.de/images/1706866713_df1.jpg,2024-02-02T09:42:00Z,,Der zu Jahresbeginn auf den ServusTV-Frequenzen gestartete Free-TV-Sender DF1 wird an diesem Wochenende erstmals Inhalte von DAZN ins Programm nehmen. Beide Unternehmen haben jetzt Details ihrer ange… [+2192 chars],,de,'Al Nassr'
https://www.stern.de/kultur/musik/musikpreise--sza-und-swift--frauen-dominieren-die-grammy-verleihung-34422752.html,https://www.stern.de/kultur/musik/musikpreise--sza-und-swift--frauen-dominieren-die-grammy-verleihung-34422752.html,0,www.stern.de,Musikpreise: SZA und Swift: Frauen dominieren die Grammy-Verleihung,Es dürfte die Stunde junger weiblicher Popstars werden bei der 66. Grammy-Verleihung. Taylor Swift schlägt zwar ohne ihren Freund auf - aber mit Hoffnungen auf eine historische Nacht.,https://image.stern.de/34422780/t/X-/v2/w1440/r1.7778/-/02--urnnewsmldpacom2009010124020299844587v4w800h600l647t73r1925b1010jpeg---4f988c6f82aeba4e.jpg,2024-02-02T09:47:55Z,https://web.archive.org/web/20240202095000/https://www.stern.de/kultur/musik/musikpreise--sza-und-swift--frauen-dominieren-die-grammy-verleihung-34422752.html,"Es dürfte die Stunde junger weiblicher Popstars werden bei der 66. Grammy-Verleihung. Taylor Swift schlägt zwar ohne ihren Freund auf - aber mit Hoffnungen auf eine historische Nacht.
Wer die Liste … [+3357 chars]",,de,'Jon Batiste'
https://www.stern.de/lifestyle/leute/alessandra-meyer-woelden--mit-lady-di-auf-der-damentoilette-34422898.html,https://www.stern.de/lifestyle/leute/alessandra-meyer-woelden--mit-lady-di-auf-der-damentoilette-34422898.html,0,www.stern.de,Alessandra Meyer-Wölden: Mit Lady Di auf der Damentoilette,Alessandra Meyer-Wölden lernte als Teenagerin Prinzessin Diana kennen. Das verrät Oliver Pochers Ex-Frau im gemeinsamen Podcast.,https://image.stern.de/34422902/t/ej/v1/w1440/r1.7778/-/02--mit-lady-di-auf-der-damentoilette---16-9---spoton-article-1060540.jpg,2024-02-02T10:00:00Z,,"Alessandra Meyer-Wölden lernte als Teenagerin Prinzessin Diana kennen. Das verrät Oliver Pochers Ex-Frau im gemeinsamen Podcast.
In der neuesten Folge des Podimo-Podcasts ""Die Pochers! Frisch recyce… [+3446 chars]",,de,'Lady Di'
https://www.bild.de/bild-plus/sport/fussball/vfb-stuttgart/vfb-stuttgart-er-sollte-zu-ronaldo-wuesten-angebot-fuer-diesen-vfb-star-87008650.bild.html,https://www.bild.de/bild-plus/sport/fussball/vfb-stuttgart/vfb-stuttgart-er-sollte-zu-ronaldo-wuesten-angebot-fuer-diesen-vfb-star-87008650.bild.html,0,www.bild.de,*** BILDplus Inhalt *** Er sollte zu Ronaldo! - Wüsten-Angebot für diesen VfB-Star,"Keinen Bock auf Ronaldo! Wie BILD erfuhr, hatte ein VfB-Star in der Winterpause ein konkretes Angebot von Saudi-Klub Al Nassr vorliegen.","https://images.bild.de/65bcc8ead65ec0403fd2ff14/d94203a7c61e11460237699dd49c3d00,f91a399d?w=1280",2024-02-02T11:02:52Z,,"Boris Pistorius: Heimliche Hochzeit mit seiner Julia! 
 Boris Pistorius: Heimliche Hochzeit mit seiner Julia! 
 Boris Pistorius: Heimliche Hochzeit mit seiner Julia! 
 Boris Pistorius: Heimliche H… [+366 chars]",,de,'Al Nassr'
https://www.n-tv.de/leute/Diesjaehrige-Grammys-von-Frauen-dominiert-article24707946.html,https://www.n-tv.de/leute/Diesjaehrige-Grammys-von-Frauen-dominiert-article24707946.html,0,www.n-tv.de,Taylor Swift weit vorne: Diesjährige Grammys von Frauen dominiert,"Am Sonntag werden in Los Angeles die Grammy verliehen. In diesem Jahr sind deutlich mehr Künstlerinnen nominiert als in der Vergangenheit. Neben Lana Del Rey, Billie Eilish und Olivia Rodrigo ist natürlich auch Taylor Swift dabei. Sie könnte mit Frank Sinatra…",https://bilder4.n-tv.de/img/incoming/crop21368119/1731322448-cImg_16_9-w1200/17244441.jpg,2024-02-02T11:40:23Z,,"Am Sonntag werden in Los Angeles die Grammy verliehen. In diesem Jahr sind deutlich mehr Künstlerinnen nominiert als in der Vergangenheit. Neben Lana Del Rey, Billie Eilish und Olivia Rodrigo ist nat… [+3433 chars]",,de,'Olivia Rodrigo'
https://www.stern.de/kultur/quentin-tarantinos--the-movie-critic---brad-pitt-soll-hauptrolle-spielen-34423538.html,https://www.stern.de/kultur/quentin-tarantinos--the-movie-critic---brad-pitt-soll-hauptrolle-spielen-34423538.html,0,www.stern.de,"Quentin Tarantinos ""The Movie Critic"": Brad Pitt soll Hauptrolle spielen","Spannende Kombi: Superstar Brad Pitt soll die Hauptrolle in Quentin Tarantinos nächstem Film ""The Movie Critic"" spielen.",https://image.stern.de/34423542/t/eB/v1/w1440/r1.7778/-/02--brad-pitt-soll-hauptrolle-spielen---16-9---spoton-article-1060558.jpg,2024-02-02T12:14:00Z,,"Spannende Kombi: Superstar Brad Pitt soll die Hauptrolle in Quentin Tarantinos nächstem Film ""The Movie Critic"" spielen.
Beeindruckender Cast-Zugang für Quentin Tarantinos (60) wohl letzten Film ""Th… [+2029 chars]",,de,'Brad Pitt'
https://www.brigitte.de/aktuell/quentin-tarantinos--the-movie-critic---brad-pitt-soll-hauptrolle-uebernehmen-13765734.html,https://www.brigitte.de/aktuell/quentin-tarantinos--the-movie-critic---brad-pitt-soll-hauptrolle-uebernehmen-13765734.html,0,www.brigitte.de,"Quentin Tarantinos ""The Movie Critic"": Brad Pitt soll Hauptrolle übernehmen","Spannende Kombi: Superstar Brad Pitt soll die Hauptrolle in Quentin Tarantinos nächstem Film ""The Movie Critic"" spielen.",https://image.brigitte.de/13765736/t/3n/v1/w1440/r1.7778/-/02--brad-pitt-soll-hauptrolle-uebernehmen---1-1---spoton-article-1060558.jpg,2024-02-02T12:23:00Z,,"Spannende Kombi: Superstar Brad Pitt soll die Hauptrolle in Quentin Tarantinos nächstem Film ""The Movie Critic"" spielen.
Beeindruckender Cast-Zugang für Quentin Tarantinos (60) wohl letzten Film ""Th… [+2029 chars]",,de,'Brad Pitt'
https://www.transfermarkt.de/al-nassr-aktivierte-30-millionen-klausel-von-ito-vfb-profi-lehnte-hochdotierte-offerte-ab/view/news/433407,https://www.transfermarkt.de/al-nassr-aktivierte-30-millionen-klausel-von-ito-vfb-profi-lehnte-hochdotierte-offerte-ab/view/news/433407,0,www.transfermarkt.de,VfB Stuttgart: Al-Nassr aktivierte 30-Millionen-Klausel von Hiroki Ito,Beim VfB Stuttgart war Innenverteidiger Hiroki Ito bis zu seiner Muskelverletzung Ende vergangenen Jahres während der Hinrunde bedingungslos gesetzt und beim Tabellendritten der...,https://tmssl.akamaized.net/images/foto/big/hiroki-ito-vfb-stuttgart-2023-1687422281-109812.jpg?lm=1687422291,2024-02-02T12:59:59Z,,"João Palhinha war bereits in München, hatte den Medizincheck absolviert und Bilder im neuen Dress geschossen, nur um am Deadline Day im Sommer 2023 wenige Stunden später unverrichteter Dinge wieder d… [+16633 chars]",,de,'Al Nassr'
https://fm4.orf.at/stories/3039034/,https://fm4.orf.at/stories/3039034/,0,fm4.orf.at,Filmflimmern,"Lily Gladstone dreht mit Charlie Kaufmann, Brad Pitt mit Quentin Tarantino, Margot Robbie nimmt die Nicht-Oscar-Nominierung gelassen, es wird ein Remake von „Attack of the 50 Foot Woman“ geben und Christopher Nolan ist ein Fan von „The Curse“. Geld hoch, Händ…",https://tubestatic.orf.at/static/images/site/tube/2024025/clipboard.6008564.jpg,2024-02-02T14:15:00Z,,"Lily Gladstone dreht mit Charlie Kaufmann, Brad Pitt mit Quentin Tarantino, Margot Robbie nimmt die Nicht-Oscar-Nominierung gelassen, es wird ein Remake von Attack of the 50 Foot Woman geben und Chri… [+4366 chars]",,de,'Margot Robbie'
https://www.zeit.de/politik/ausland/2024-02/ilaria-salis-ungarn-italien-giorgia-meloni,https://www.zeit.de/politik/ausland/2024-02/ilaria-salis-ungarn-italien-giorgia-meloni,0,www.zeit.de,Ilaria Salis: Vorgeführt wie eine Hexe,Giorgia Meloni gerät wegen einer in Ungarn inhaftierten Antifaschistin in Bedrängnis: Setzt sie sich für die Italienerin ein oder vergrätzt sie ihren Weggefährten Orbán?,https://img.zeit.de/politik/ausland/2024-02/ilaria-salis-ungarn-italien-giorgia-meloni-bild-2/wide__1300x731,2024-02-02T17:42:52Z,,"Giorgia Meloni hat ihre
politischen Wurzeln im italienischen Faschismus, die Grundschullehrerin Ilaria Salis ist eine militante Antifaschistin. Die beiden verbindet so gesehen wenig.
Doch Meloni is… [+801 chars]",,de,'Giorgia Meloni'
https://www.stern.de/kultur/prinzessin-kate--palast-dementiert-koma-spekulationen-34424656.html,https://www.stern.de/kultur/prinzessin-kate--palast-dementiert-koma-spekulationen-34424656.html,0,www.stern.de,Prinzessin Kate: Palast dementiert Koma-Spekulationen,"Musste Prinzessin Kate nach ihrer Operation in ein Koma versetzt werden? Der Palast lässt nun durchsickern: ""vollkommener Unsinn"".",https://image.stern.de/34424660/t/6B/v1/w1440/r1.7778/-/02--palast-dementiert-koma-spekulationen---16-9---spoton-article-1060592.jpg,2024-02-02T17:45:00Z,https://web.archive.org/web/20240202195432/https://www.stern.de/kultur/prinzessin-kate--palast-dementiert-koma-spekulationen-34424656.html,"Musste Prinzessin Kate nach ihrer Operation in ein Koma versetzt werden? Der Palast lässt nun durchsickern: ""vollkommener Unsinn"".
Wie geht es Prinzessin Kate (42) nach ihrer Bauchoperation wirklich… [+1732 chars]",,de,'Prinz William'
https://www.morgenpost.de/politik/article241567210/Jung-wild-beliebt-Macrons-und-Le-Pens-Ziehsoehne-im-Duell.html,https://www.morgenpost.de/politik/article241567210/Jung-wild-beliebt-Macrons-und-Le-Pens-Ziehsoehne-im-Duell.html,0,www.morgenpost.de,"Jung, wild, beliebt: Macrons und Le Pens Ziehsöhne im Duell",Bei den Europawahlen schicken Macron und Le Pen mit Gabriel Attal und Jordan Bardella ihre politischen Ziehsöhne in eine Stellvertreterschlacht.,https://img.sparknews.funkemedien.de/241385846/241385846_1704812839_v4_3_800.jpeg,2024-02-02T20:32:57Z,,"Paris. In Frankreich treten zwei Überflieger mit Blitzkarriere gegeneinander an. Sie haben viel gemeinsam und sind doch totale Gegensätze.
Der eine, Gabriel Attal, wurde soeben im Alter von 34 Jahre… [+6429 chars]",,de,'Jordan Bardella'
https://www.bild.de/bild-plus/regional/leipzig/leipzig-news/katja-krasavice-rapper-finch-packt-aus-das-lief-wirklich-im-bad-87002918.bild.html,https://www.bild.de/bild-plus/regional/leipzig/leipzig-news/katja-krasavice-rapper-finch-packt-aus-das-lief-wirklich-im-bad-87002918.bild.html,0,www.bild.de,*** BILDplus Inhalt *** Rapper Finch packt aus - Das lief wirklich im Bad bei Katja Krasavice,Hat Rapper Finch bei Katja Krasavice etwa das Waschbecken als Toilette benutzt? Sie hatte ihn heimlich gefilmt und einen ekligen Verdacht geweckt.,"https://images.bild.de/65bbe9f2bf762c68ccf739f7/050dab88fe09661b1ec351dec96c4559,70c209b6?w=1280",2024-02-02T21:34:11Z,,"Er wird doch nicht wirklich ? Während eines angeblichen Sex-Dates mit DSDS-Jurorin Katja Krasavice (27) wurde Rapper Finch (33, Abfahrt) im Bad gefilmt, wie er in fragwürdiger Pose bei ihr im Badezim… [+184 chars]",,de,'Katja Krasavice'
https://www.nzz.ch/zmittag/wolfgang-kubicki-ueber-habeck-und-die-naiven-jungen-weltretter-in-der-politik-ld.1770930,https://www.nzz.ch/zmittag/wolfgang-kubicki-ueber-habeck-und-die-naiven-jungen-weltretter-in-der-politik-ld.1770930,0,www.nzz.ch,"«Probleme muss man ansprechen, sonst gehen sie auf wie Hefe», sagt Wolfgang Kubicki, und säbelt mit mittlerem Enthusiasmus an seinem Stück Rindfleisch herum","In «Zmittag», der kulinarischen Interview-Serie der NZZ, spricht der stellvertretende FDP-Vorsitzende über naive junge Abgeordnete, die die Welt retten wollen und einen amourösen Bestechungsversuch.","https://img.nzz.ch/2024/01/30/461d3b8c-375e-409a-a0b5-b4f4789227a9.png?width=1200&height=675&fit=bound&quality=75&auto=webp&crop=1694,953,x53,y0&wmark=nzz",2024-02-03T04:30:00Z,,"Lässt das rot-grüne Begleitgemüse links liegen: Wolfgang Kubicki.
Eigentlich möchte man mit diesem Herrn immer gern Weisswein trinken, sommers wie winters: in seinem Heimatort Strande bei Kiel in Sc… [+11578 chars]",,de,'Wolfgang Kubicki'
https://www.nzz.ch/feuilleton/sie-ist-jung-sie-ist-cool-und-das-vorbild-einer-neuen-generation-in-hollywood-warum-man-ayo-edebiri-kennen-muss-ld.1775353,https://www.nzz.ch/feuilleton/sie-ist-jung-sie-ist-cool-und-das-vorbild-einer-neuen-generation-in-hollywood-warum-man-ayo-edebiri-kennen-muss-ld.1775353,0,www.nzz.ch,"Sie ist jung, sie ist cool und das Vorbild einer neuen Generation in Hollywood: warum man Ayo Edebiri kennen sollte",Für ihre Rolle in der Serie «The Bear» gewinnt sie einen Preis nach dem anderen. Das Internet vergöttert sie. Und jetzt?,"https://img.nzz.ch/2024/01/25/7802e372-80f0-4d40-b4a7-966620d9a532.jpeg?width=1200&height=674&fit=bound&quality=75&auto=webp&crop=4207,2363,x533,y1&wmark=nzz",2024-02-03T04:30:00Z,,"Seit ihrer Rolle in der Fernsehserie «The Bear» interessiert sich ganz Hollywood für Edebiri. Emmy-Preisverleihung 2023.
Wenn Anfang Jahr in Hollywood die wichtigsten Auszeichnungen der Unterhaltung… [+5234 chars]",,de,'Ayo Edebiri'
https://www.morgenpost.de/politik/article241567786/Lahme-Justiz-Wie-Donald-Trump-ungeschoren-davonkommen-kann.html,https://www.morgenpost.de/politik/article241567786/Lahme-Justiz-Wie-Donald-Trump-ungeschoren-davonkommen-kann.html,0,www.morgenpost.de,Lahme Justiz: Wie Donald Trump ungeschoren davonkommen kann,"Die Aussichten auf ein Strafverfahren, das vor der Präsidentschaftswahl im November abgeschlossen werden kann, schwinden zusehends.",https://img.sparknews.funkemedien.de/241567784/241567784_1706937139_v4_3_800.jpeg,2024-02-03T05:12:20Z,,"Washington. Die Aussichten auf ein Strafverfahren, das vor der Präsidentschaftswahl im November abgeschlossen werden kann, schwinden zusehends.
Republikanische wie parteiunabhängige Wähler in Iowa u… [+6694 chars]",,de,'Donald Trump'
https://www.morgenpost.de/politik/article241567786/donald-trump-usa-wahl-justiz-verfahren-prognose.html,https://www.morgenpost.de/politik/article241567786/donald-trump-usa-wahl-justiz-verfahren-prognose.html,0,www.morgenpost.de,Amerikas lahme Justiz ist die größte Chance von Donald Trump,"Wird Donald Trump noch einmal US-Präsident? Die Aussichten auf ein Strafverfahren, das vor der Präsidentschaftswahl im November abgeschlossen werden kann, schwinden zusehends.",https://img.sparknews.funkemedien.de/241567784/241567784_1706937139_v4_3_800.jpeg,2024-02-03T10:04:00Z,,"Washington. Die Aussichten auf ein Strafverfahren, das vor der Präsidentschaftswahl im November abgeschlossen werden kann, schwinden zusehends.
Republikanische wie parteiunabhängige Wähler in Iowa u… [+6870 chars]",,de,'Stormy Daniels'
https://www.n-tv.de/leute/Oliver-Pocher-besucht-zum-zweiten-Mal-Wiener-Opernball-article24710377.html,https://www.n-tv.de/leute/Oliver-Pocher-besucht-zum-zweiten-Mal-Wiener-Opernball-article24710377.html,0,www.n-tv.de,Der nächste Aufreger kann kommen: Pocher besucht zum zweiten Mal Wiener Opernball,2014 legt sich Oliver Pocher bei seinem ersten Besuch des Wiener Opernballs mit Kim Kardashian an. Zehn Jahre später ist der deutsche Komiker zum zweiten Mal zu Gast beim Höhepunkt der Wiener Ballsaison. Und noch ein weiterer deutscher Star kündigt sein Komme…,https://bilder2.n-tv.de/img/incoming/crop24710401/1871323907-cImg_16_9-w1200/428256670.jpg,2024-02-03T13:10:51Z,,2014 legt sich Oliver Pocher bei seinem ersten Besuch des Wiener Opernballs mit Kim Kardashian an. Zehn Jahre später ist der deutsche Komiker zum zweiten Mal zu Gast beim Höhepunkt der Wiener Ballsai… [+2726 chars],,de,'Paris Hilton'
https://www.stern.de/kultur/film/hat-taylor-den-roman-zum-film--argylle--geschrieben-34420488.html,https://www.stern.de/kultur/film/hat-taylor-den-roman-zum-film--argylle--geschrieben-34420488.html,0,www.stern.de,"Elly Conway: Hat Taylor Swift die Vorlage zum Spionage-Thriller ""Argylle"" geschrieben?","Matthew Vaughns neuer Agentenfilm ""Argylle"" basiert auf einer Vorlage von Elly Conway, der Name wiederum ist nur ein Pseudonym. Seither rätseln Filmfans, wer sich dahinter verbirgt. Dem Kinostart dürfte der ganze Wirbel zuträglich sein.",https://image.stern.de/34420590/t/dx/v2/w1440/r1.7778/-/5776-d002-00129r.jpg,2024-02-03T14:47:00Z,,"03.02.2024, 15:47
 3 Min.
Matthew Vaughns neuer Agentenfilm ""Argylle"" basiert auf einer Vorlage von Elly Conway, der Name wiederum ist nur ein Pseudonym. Seither rätseln Filmfans, wer sich dahinter… [+5475 chars]",,de,'Dua Lipa'
