index,url,valid,domain,title,description,image,published,archive,content,quote,language,keyword
https://www.stern.de/panorama/adel--jordanien-im-hochzeitsfieber--kronprinz-hussein-heiratet-33518480.html,https://www.stern.de/panorama/adel--jordanien-im-hochzeitsfieber--kronprinz-hussein-heiratet-33518480.html,0,www.stern.de,Adel: Jordanien im Hochzeitsfieber: Kronprinz Hussein heiratet,"Die First Lady der USA, Royals aus der ganzen Welt: Die Gästeliste der Hochzeit des jordanischen Thronfolgers ist hochkarätig. Mit dem Event will das Königshaus auch Beständigkeit demonstrieren.",https://image.stern.de/33518482/t/H1/v1/w1440/r1.7778/-/01--urnnewsmldpacom2009010123060199897599v3w800h600l491t233r1771b1086jpeg---1b9ad9ab9e937048.jpg,2023-06-01T01:58:42Z,https://web.archive.org/web/20230601023759/https://www.stern.de/panorama/adel--jordanien-im-hochzeitsfieber--kronprinz-hussein-heiratet-33518480.html,"Die First Lady der USA, Royals aus der ganzen Welt: Die Gästeliste der Hochzeit des jordanischen Thronfolgers ist hochkarätig. Mit dem Event will das Königshaus auch Beständigkeit demonstrieren.
Jor… [+2838 chars]",,de,'Lady Di'
https://www.morgenpost.de/vermischtes/article238553725/Jordanien-im-Hochzeitsfieber-Kronprinz-Hussein-heiratet.html,https://www.morgenpost.de/vermischtes/article238553725/Jordanien-im-Hochzeitsfieber-Kronprinz-Hussein-heiratet.html,0,www.morgenpost.de,Adel: Jordanien im Hochzeitsfieber: Kronprinz Hussein heiratet,"Die First Lady der USA, Royals aus der ganzen Welt: Die Gästeliste der Hochzeit des jordanischen Thronfolgers ist hochkarätig. Mit dem Event will das Königshaus auch Beständigkeit demonstrieren.",https://img.morgenpost.de/img/vermischtes/crop238553723/0362602439-w820-cv16_9-q85/Koenigliche-Hochzeit-in-Jordanien.jpg,2023-06-01T01:58:42Z,https://web.archive.org/web/20230601032312/https://www.morgenpost.de/vermischtes/article238553725/Jordanien-im-Hochzeitsfieber-Kronprinz-Hussein-heiratet.html,Amman. Jordaniens Kronprinz Hussein bin Abdullah II. will an diesem Donnerstag seine Verlobte Radschwa Al Saif heiraten. Zu der glamourösen Hochzeit in der Hauptstadt Amman werden auch hochrangige Po… [+2638 chars],,de,'Mohammed bin Salman'
https://www.freitag.de/autoren/wolfgangmichal/haelt-die-ampel-regierung-was-fuer-und-was-gegen-einen-koalitionsbruch-spricht,https://www.freitag.de/autoren/wolfgangmichal/haelt-die-ampel-regierung-was-fuer-und-was-gegen-einen-koalitionsbruch-spricht,0,www.freitag.de,Analyse | Hält die Ampel-Regierung? Was für und was gegen einen Bruch der Koalition spricht,"FDP und Grüne in einer Regierung – das war machtpolitisch plausibel, aber inhaltlich absurd. Die Streits zwischen Christian Lindner und Robert Habeck weisen verblüffende Parallelen zum Ende der sozialliberalen Koalition 1982 auf Am 17. September 1982 traten d…",https://www.freitag.de/autoren/wolfgangmichal/haelt-die-ampel-regierung-was-fuer-und-was-gegen-einen-koalitionsbruch-spricht/@@images/social_image,2023-06-01T02:00:00Z,https://web.archive.org/web/20230531234016/https://www.freitag.de/autoren/wolfgangmichal/haelt-die-ampel-regierung-was-fuer-und-was-gegen-einen-koalitionsbruch-spricht,"Am 17. September 1982 traten die vier Bundesminister der FDP zurück. Damit war die sozialliberale Koalition geplatzt. Einer der vier, Wirtschaftsminister Otto Graf Lambsdorff, hatte auf Bitten des Bu… [+532 chars]",,de,'Margaret Thatcher'
https://www.nzz.ch/panorama/jordanien-im-hochzeitsfieber-kronprinz-hussein-heiratet-in-amman-ld.1740492,https://www.nzz.ch/panorama/jordanien-im-hochzeitsfieber-kronprinz-hussein-heiratet-in-amman-ld.1740492,0,www.nzz.ch,Jordanien im Hochzeitsfieber: Kronprinz Hussein heiratet in Amman,"Amerikas First Lady, Royals aus der ganzen Welt: Die Gästeliste der Hochzeit des jordanischen Thronfolgers ist hochkarätig. Mit dem Event will das vor zwei Jahren von einem Skandal erschütterte Königshaus auch Beständigkeit demonstrieren.","https://img.nzz.ch/2023/06/01/2a8e6350-0314-49df-ad4d-2599636b611a.jpeg?width=1200&height=675&fit=bound&quality=75&auto=webp&crop=6000,3375,x0,y313&wmark=nzz",2023-06-01T02:24:43Z,http://archive.md/20230601054939/https://www.nzz.ch/panorama/jordanien-im-hochzeitsfieber-kronprinz-hussein-heiratet-in-amman-ld.1740492,"Jordaniens Königin Rania, ihre künftige Schwiegertochter Rajwa Al Saif, Kronprinz Hussein und König Abdullah II (v. l.) erwarten eine illustre Gästeschar.
Jordaniens Kronprinz Hussein bin Abdullah I… [+2724 chars]",,de,'Lady Di'
https://www.zeit.de/2023/22/opernhaus-hamburg-bau-klaus-michael-kuehne,https://www.zeit.de/2023/22/opernhaus-hamburg-bau-klaus-michael-kuehne,0,www.zeit.de,Opernhaus in Hamburg: Braucht Hamburg ein neues Opernhaus?,Der Milliardär Klaus-Michael Kühne möchte in der Hamburger HafenCity für 400 Millionen Euro eine Oper bauen. Fragt sich nur: Braucht Hamburg wirklich ein neues Opernhaus?,,2023-06-01T04:15:25Z,https://web.archive.org/web/20230601084600/https://www.zeit.de/2023/22/opernhaus-hamburg-bau-klaus-michael-kuehne,"When browsing with ads:
We collect personal data and also transmit it to third-party providers
 that help us improve and finance our digital content. Some of the information stored on your device, … [+821 chars]",,de,'Klaus-Michael Kühne'
https://www.n-tv.de/politik/Es-ist-putzig-dass-alle-immer-ein-Machtwort-des-Kanzlers-verlangen-article24160161.html,https://www.n-tv.de/politik/Es-ist-putzig-dass-alle-immer-ein-Machtwort-des-Kanzlers-verlangen-article24160161.html,0,www.n-tv.de,"Gabriel nimmt Scholz in Schutz: ""Es ist putzig, dass alle immer ein Machtwort des Kanzlers verlangen""","Der ehemalige SPD-Vorsitzende Sigmar Gabriel nimmt die Politik der Bundesregierung vor Kritikern in Schutz. Angesichts der Krisen, denen sie sich im Moment zu stellen habe, gehe es Deutschland gut, sagt er am Mittwochabend in der ZDF-Talkshow Markus Lanz.",https://bilder3.n-tv.de/img/incoming/crop24160198/1151324724-cImg_16_9-w1200/sigmar-gabriel-lanz.jpg,2023-06-01T04:17:51Z,https://web.archive.org/web/20230601060944/https://www.n-tv.de/politik/Es-ist-putzig-dass-alle-immer-ein-Machtwort-des-Kanzlers-verlangen-article24160161.html,"Der ehemalige SPD-Vorsitzende Sigmar Gabriel nimmt die Politik der Bundesregierung vor Kritikern in Schutz. Angesichts der Krisen, denen sie sich im Moment zu stellen habe, gehe es Deutschland gut, s… [+4159 chars]",,de,'Markus Lanz'
https://www.tagesspiegel.de/internationales/reprasentantenhaus-winkt-kompromiss-durch-das-wochenlange-zittern-im-us-schuldenstreit-hat-wohl-ein-ende-9908528.html,https://www.tagesspiegel.de/internationales/reprasentantenhaus-winkt-kompromiss-durch-das-wochenlange-zittern-im-us-schuldenstreit-hat-wohl-ein-ende-9908528.html,0,www.tagesspiegel.de,Repräsentantenhaus winkt Kompromiss durch: Das wochenlange Zittern im US-Schuldenstreit hat wohl ein Ende,"Die USA haben sich gerade noch einmal selbst davor bewahrt hat, zahlungsunfähig zu werden. Die Kompromisse, die Joe Biden schließen musste, sind nicht schön, aber auch keine Katastrophe.",https://www.tagesspiegel.de/images/files-us-politics-economy-debt2/alternates/BASE_16_9_W1400/files-us-politics-economy-debt.jpeg,2023-06-01T05:20:44Z,https://web.archive.org/web/20230601060047/https://www.tagesspiegel.de/internationales/reprasentantenhaus-winkt-kompromiss-durch-das-wochenlange-zittern-im-us-schuldenstreit-hat-wohl-ein-ende-9908528.html,"Der von US-Präsident Joe Biden und dem republikanischen Vorsitzenden des Repräsentantenhauses, Kevin McCarthy, ausgehandelte Kompromiss zum Schuldenstreit hat es am Mittwochabend durch das Repräsenta… [+6928 chars]",,de,'Kevin McCarthy'
https://www.telepolis.de/features/Wie-Noam-Chomsky-Opfer-eines-Fake-News-Angriffs-wurde-9154375.html,https://www.telepolis.de/features/Wie-Noam-Chomsky-Opfer-eines-Fake-News-Angriffs-wurde-9154375.html,0,www.telepolis.de,Wie Noam Chomsky Opfer eines Fake-News-Angriffs wurde,Hat der 94-Jährige wirklich den russischen Krieg gegen die Ukraine beschönigt? Das berichtete eine britische Zeitung. Hier die wahre Geschichte. Der Telepolis-Leitartikel.,https://heise.cloudimg.io/bound/1200x1200/q85.png-lossy-85.webp-lossy-85.foil1/_www-heise-de_/imgs/18/4/2/3/8/4/4/2/720px-Noam_Chomsky_-_Prospects_for_Survival_-_2017_-_1-da158fec40acf820.png,2023-06-01T06:00:00Z,https://web.archive.org/web/20230601080056/https://www.telepolis.de/features/Wie-Noam-Chomsky-Opfer-eines-Fake-News-Angriffs-wurde-9154375.html,"Noam Chomsky, 2017. Bild: , CC BY-SA 4.0
Hat der 94-Jährige wirklich den russischen Krieg gegen die Ukraine beschönigt? Das berichtete eine britische Zeitung. Hier die wahre Geschichte. Der Telepoli… [+3023 chars]",,de,'Noam Chomsky'
https://www.stern.de/politik/ausland/mike-pence--ex-vizepraesident-soll-praesidentschaftsbewerbung-verkuenden-33518874.html,https://www.stern.de/politik/ausland/mike-pence--ex-vizepraesident-soll-praesidentschaftsbewerbung-verkuenden-33518874.html,0,www.stern.de,USA: Trumps Vizepräsident Mike Pence soll bald Präsidentschaftsbewerbung verkünden,Medienberichten zufolge will Ex-Vizepräsident Mike Pence kommende Woche seine Präsidentschaftsbewerbung offiziell machen. Damit würde nach Floridas Gouverneur Ron DeSantis der nächste ehemalige Trump-Unterstützer in das Rennen einsteigen.,https://image.stern.de/33518876/t/Kg/v1/w1440/r1.7778/-/usa-mike-pence-donald-trump-praesident.jpg,2023-06-01T06:10:00Z,https://web.archive.org/web/20230601063648/https://www.stern.de/politik/ausland/mike-pence--ex-vizepraesident-soll-praesidentschaftsbewerbung-verkuenden-33518874.html,Medienberichten zufolge will Ex-Vizepräsident Mike Pence kommende Woche seine Präsidentschaftsbewerbung offiziell machen. Damit würde nach Floridas Gouverneur Ron DeSantis der nächste ehemalige Trump… [+3343 chars],,de,'Mike Pence'
https://www.zeit.de/politik/ausland/2023-06/schuldenobergrenze-abstimmung-usa-kongress,https://www.zeit.de/politik/ausland/2023-06/schuldenobergrenze-abstimmung-usa-kongress,0,www.zeit.de,"Abstimmung zur Schuldenobergrenze: Den Staat gerettet, die Rechten vorgeführt",Das US-Repräsentantenhaus billigt die Anhebung der Schuldenobergrenze. Dessen Sprecher Kevin McCarthy triumphiert. Aber das Ganze macht seine Zukunft nicht einfacher.,,2023-06-01T06:46:55Z,http://archive.md/20230601072214/https://www.zeit.de/politik/ausland/2023-06/schuldenobergrenze-abstimmung-usa-kongress,"When browsing with ads:
We collect personal data and also transmit it to third-party providers
 that help us improve and finance our digital content. Some of the information stored on your device, … [+821 chars]",,de,'Kevin McCarthy'
https://www.focus.de/panorama/welt/agenten-untergrund-truppe-russische-spione-lauern-noch-immer-in-deutschland_id_195144427.html,https://www.focus.de/panorama/welt/agenten-untergrund-truppe-russische-spione-lauern-noch-immer-in-deutschland_id_195144427.html,0,www.focus.de,„Illegale“ Agenten - Deutsche Behörden fürchten jetzt Putins geheime Untergrund-Truppe,"30 Diplomaten aus der russischen Botschaft in Berlin wurden als Spione enttarnt und von der Bundesregierung ausgewiesen. Ein Grund zum Feiern ist das jedoch nicht. Denn ein Blick in die Vergangenheit zeigt, dass noch viel mehr Spione in Deutschland lauern kön…",https://p6.focus.de/img/fotos/id_195213860/imago0258229454h.jpg?im=Crop%3D%280%2C0%2C3465%2C1731%29%3BResize%3D%281200%2C627%29&impolicy=perceptual&quality=mediumHigh&hash=fe3d19d0fbdf654249cef393d7d95895f5786bd3b6daaca5b2a1f4bf7417b751,2023-06-01T07:52:26Z,https://web.archive.org/web/20230601082151/https://www.focus.de/panorama/welt/agenten-untergrund-truppe-russische-spione-lauern-noch-immer-in-deutschland_id_195144427.html,30 Diplomaten aus der russischen Botschaft in Berlin wurden als Spione enttarnt und von der Bundesregierung ausgewiesen. Ein Grund zum Feiern ist das jedoch nicht. Denn ein Blick in die Vergangenheit… [+8897 chars],,de,'Thomas Haldenwang'
https://www.n-tv.de/leute/Bruce-Springsteen-stuerzt-auf-der-Buehne-article24160897.html,https://www.n-tv.de/leute/Bruce-Springsteen-stuerzt-auf-der-Buehne-article24160897.html,0,www.n-tv.de,"""The Boss"" strauchelt: Bruce Springsteen stürzt auf der Bühne",Für einen kurzen Augenblick dürfte einigen Fans der Schreck in die Glieder gefahren sein. Bei einem Auftritt in Amsterdam verliert Bruce Springsteen das Gleichgewicht und fällt hin. Doch rasch ist klar: Der 73-Jährige ist wohlauf und kann das Konzert zu Ende …,https://bilder4.n-tv.de/img/incoming/crop24160899/4481325902-cImg_16_9-w1200/410325667.jpg,2023-06-01T08:58:40Z,https://web.archive.org/web/20230601094148/https://www.n-tv.de/leute/Bruce-Springsteen-stuerzt-auf-der-Buehne-article24160897.html,Für einen kurzen Augenblick dürfte einigen Fans der Schreck in die Glieder gefahren sein. Bei einem Auftritt in Amsterdam verliert Bruce Springsteen das Gleichgewicht und fällt hin. Doch rasch ist kl… [+1641 chars],,de,'Bruce Springsteen'
https://www.welt.de/sport/fussball/article245638424/Real-Madrid-Fokus-auf-Benzema-Saudi-Arabien-lanciert-unglaubliches-Angebot.html,https://www.welt.de/sport/fussball/article245638424/Real-Madrid-Fokus-auf-Benzema-Saudi-Arabien-lanciert-unglaubliches-Angebot.html,0,www.welt.de,Saudi-Arabien lanciert das nächste unglaubliche Angebot,"Saudi-Arabien ist bemüht, mit weltberühmten Altstars seiner Liga etwas Glanz zu verleihen. Geld spielt dabei keine Rolle. Mit Cristiano Ronaldo gelang den Scheichs ein Coup, doch dabei wird es offenbar nicht bleiben. Real Madrids Torjäger Benzema steht nun au…",https://img.welt.de/img/sport/mobile245640504/6681358957-ci16x9-w1200/Champions-League-Semi-Final-Second-Leg-Manchester-City-v-Re.jpg,2023-06-01T09:34:56Z,,Weltfußballer Karim Benzema könnte als nächster Superstar nach Cristiano Ronaldo nach Saudi-Arabien wechseln. Übereinstimmenden Medienberichten zufolge liegt dem 35-jährigen Franzosen ein millionensc… [+1922 chars],,de,'Cristiano Ronaldo'
https://www.stern.de/lifestyle/leute/adel--prinz-william-und-frau-zur-royalen-hochzeit-in-jordanien-33519620.html,https://www.stern.de/lifestyle/leute/adel--prinz-william-und-frau-zur-royalen-hochzeit-in-jordanien-33519620.html,0,www.stern.de,Adel: Prinz William und Frau zur royalen Hochzeit in Jordanien,London/Amman - Der britische Thronfolger Prinz William (40) und seine Frau Prinzessin Kate (41) nehmen als Gäste an der Hochzeit des jordanischen,https://image.stern.de/33519622/t/rI/v1/w1440/r1.7778/-/01--urnnewsmldpacom2009010123060199902388v2w800h600l816t63r2816b1465jpeg---457123a05a044f41.jpg,2023-06-01T09:35:57Z,https://web.archive.org/web/20230601102743/https://www.stern.de/lifestyle/leute/adel--prinz-william-und-frau-zur-royalen-hochzeit-in-jordanien-33519620.html,"Der jordanische Kronprinz Hussein bin Abdullah II. heiratet im Amman seine Verlobte Radschwa Al Saif teil. Wer unter den Gästen ist.
Der britische Thronfolger Prinz William (40) und seine Frau Prinz… [+1137 chars]",,de,'Prinz George'
https://www.zeit.de/gesellschaft/2023-06/joseph-ratzinger-erbe-cousine,https://www.zeit.de/gesellschaft/2023-06/joseph-ratzinger-erbe-cousine,0,www.zeit.de,Joseph Ratzinger: Cousine von Benedikt XVI. schlägt offenbar wegen Klage Erbe aus,"Über den Nachlass Benedikt XVI. ist nicht viel bekannt – nur, dass eine Zivilklage Teil davon ist. Eine Cousine will das Erbe laut einem Bericht daher nicht antreten.",,2023-06-01T09:55:06Z,http://archive.md/20230601123901/https://www.zeit.de/gesellschaft/2023-06/joseph-ratzinger-erbe-cousine,"When browsing with ads:
We collect personal data and also transmit it to third-party providers
 that help us improve and finance our digital content. Some of the information stored on your device, … [+821 chars]",,de,'Joseph Ratzinger'
https://www.tagesspiegel.de/internationales/europa-gipfel-in-moldau-selenskyj-fordert-weitere-militarhilfe--scholz-stellt-sicherheitsgarantien-in-aussicht-9910412.html,https://www.tagesspiegel.de/internationales/europa-gipfel-in-moldau-selenskyj-fordert-weitere-militarhilfe--scholz-stellt-sicherheitsgarantien-in-aussicht-9910412.html,0,www.tagesspiegel.de,Europa-Gipfel in Moldau: Selenskyj fordert weitere Militärhilfe – Scholz stellt Sicherheitsgarantien in Aussicht,"Der ukrainische Präsident Wolodymyr Selenskyj erklärte in Moldau, sein Land sei bereit für einen Nato-Beitritt. Dies halten andere Gipfel-Teilnehmer derzeit jedoch für „unmöglich“.",https://www.tagesspiegel.de/images/gipfel-der-europaischen-politischen-gemeinschaft-in-moldau/alternates/BASE_16_9_W1400/gipfel-der-europaeischen-politischen-gemeinschaft-in-moldau.jpeg,2023-06-01T10:36:17Z,https://web.archive.org/web/20230601110326/https://www.tagesspiegel.de/internationales/europa-gipfel-in-moldau-selenskyj-fordert-weitere-militarhilfe--scholz-stellt-sicherheitsgarantien-in-aussicht-9910412.html,Der ukrainische Präsident Wolodymyr Selenskyj hat bei einem Gipfel mit 47 europäischen Ländern in Moldau weitere militärische Unterstützung gegen Russland gefordert. Nach einer Serie von Luftangriffe… [+3698 chars],,de,'Wolodymyr Selenskyj'
https://www.stern.de/kultur/koenig-charles-iii---sein-rumaenisches-anwesen-kann-man-mieten-33519972.html,https://www.stern.de/kultur/koenig-charles-iii---sein-rumaenisches-anwesen-kann-man-mieten-33519972.html,0,www.stern.de,König Charles III.: Sein rumänisches Anwesen kann man mieten,"Urlauben wie ein König. Das ist in Siebenbürgen möglich, wo König Charles III. Zimmer auf seinem Krongut inmitten der Natur vermietet.",https://image.stern.de/33519976/t/sR/v1/w1440/r1.7778/-/01--sein-rumaenisches-anwesen-kann-man-mieten---16-9---spoton-article-1046006.jpg,2023-06-01T10:39:00Z,https://web.archive.org/web/20230601121553/https://www.stern.de/kultur/koenig-charles-iii---sein-rumaenisches-anwesen-kann-man-mieten-33519972.html,"Urlauben wie ein König. Das ist in Siebenbürgen möglich, wo König Charles III. Zimmer auf seinem Krongut inmitten der Natur vermietet.
Die erste Auslandsreise nach der Krönung führt König Charles II… [+3311 chars]",,de,'Charles III'
https://www.brigitte.de/aktuell/koenig-charles-iii---in-sein-rumaenisches-anwesen-kann-man-sich-einmieten-13536448.html,https://www.brigitte.de/aktuell/koenig-charles-iii---in-sein-rumaenisches-anwesen-kann-man-sich-einmieten-13536448.html,0,www.brigitte.de,König Charles III.: In sein rumänisches Anwesen kann man sich einmieten,"Urlauben wie ein König. Das ist in Siebenbürgen möglich, wo König Charles III. Zimmer auf seinem Krongut inmitten der Natur vermietet.",https://image.brigitte.de/13536450/t/Px/v1/w1440/r1.7778/-/01--in-sein-rumaenisches-anwesen-kann-man-sich-einmieten---1-1---spoton-article-1046006.jpg,2023-06-01T10:42:00Z,https://web.archive.org/web/20230601111243/https://www.brigitte.de/aktuell/koenig-charles-iii---in-sein-rumaenisches-anwesen-kann-man-sich-einmieten-13536448.html,"Urlauben wie ein König. Das ist in Siebenbürgen möglich, wo König Charles III. Zimmer auf seinem Krongut inmitten der Natur vermietet.
Die erste Auslandsreise nach der Krönung führt König Charles II… [+3311 chars]",,de,'Charles III'
https://www.tagesspiegel.de/gesellschaft/15-jahre-markus-lanz-eine-frage-auf-jede-antwort-9910055.html,https://www.tagesspiegel.de/gesellschaft/15-jahre-markus-lanz-eine-frage-auf-jede-antwort-9910055.html,0,www.tagesspiegel.de,15 Jahre „Markus Lanz“: Eine Frage auf jede Antwort,Wie sich die Talkshow von der Belustigung des Publikums zu dessen Bereicherung wandelte.,https://www.tagesspiegel.de/images/margotjpeg/alternates/BASE_16_9_W1400/margotjpeg.jpeg,2023-06-01T11:26:30Z,https://web.archive.org/web/20230601115234/https://www.tagesspiegel.de/gesellschaft/15-jahre-markus-lanz-eine-frage-auf-jede-antwort-9910055.html,"Das hätte sehr böse enden können. Markus Lanz war 2008 mit Markus Lanz im ZDF gestartet. Ein bunter Abend, mit Prominenz, Trallala und Hopsassa, im Anfangsjahr nur 29 Sendungen. Daraus wurden mehr, e… [+3921 chars]",,de,'Markus Lanz'
https://www.stern.de/gesellschaft/regional/sachsen/zu-lina-e--urteil--kubicki-fordert-klare-positionierung-von-gruenen-spitze--33520286.html,https://www.stern.de/gesellschaft/regional/sachsen/zu-lina-e--urteil--kubicki-fordert-klare-positionierung-von-gruenen-spitze--33520286.html,0,www.stern.de,Zu Lina-E.-Urteil: Kubicki fordert klare Positionierung von Grünen-Spitze,"Bundestagsvizepräsident Wolfgang Kubicki hat sich im Zusammenhang mit dem Schuldspruch für die Studentin Lina E. irritiert von der Grünen-Parteiführung gezeigt. ""Es entsteht der fatale Eindruck, dass Teile der Grünen ihre selektive Distanz gegenüber dem Recht…",https://image.stern.de/33520288/t/ox/v1/w1440/r1.7778/-/01--urnnewsmldpacom2009010123060199904475v2w800h600l1099t730r3297b2191jpeg---7d5623b54fcca500.jpg,2023-06-01T11:38:08Z,https://web.archive.org/web/20230601130200/https://www.stern.de/gesellschaft/regional/sachsen/zu-lina-e--urteil--kubicki-fordert-klare-positionierung-von-gruenen-spitze--33520286.html,"Bundestagsvizepräsident Wolfgang Kubicki hat sich im Zusammenhang mit dem Schuldspruch für die Studentin Lina E. irritiert von der Grünen-Parteiführung gezeigt. ""Es entsteht der fatale Eindruck, dass… [+1627 chars]",,de,'Wolfgang Kubicki'
https://www.transfermarkt.de/bestatigt-messi-verlasst-psg-zum-saisonende-ndash-wechselt-erneut-ablosefrei/view/news/422357,https://www.transfermarkt.de/bestatigt-messi-verlasst-psg-zum-saisonende-ndash-wechselt-erneut-ablosefrei/view/news/422357,0,www.transfermarkt.de,PSG bestätigt: Lionel Messi geht zum Saisonende,Lionel Messi wird Paris Saint-Germain am Saisonende verlassen. Das bestätigte Trainer Christophe Galtier am Donnerstag auf einer Pressekonferenz vor dem letzten Saisonspiel gegen Clermont Foot...,https://tmssl.akamaized.net/images/foto/big/lionel-messi-fc-paris-saint-germain-2023-1683634453-106781.jpg?lm=1683634462,2023-06-01T11:43:47Z,https://web.archive.org/web/20230601141341/https://www.transfermarkt.de/bestatigt-messi-verlasst-psg-zum-saisonende-ndash-wechselt-erneut-ablosefrei/view/news/422357,"Vom FC Liverpool zu Juventus Turin (Stand der Daten: Mai 2023)
1/22
Vom FC Liverpool zu Paris Saint-Germain
2/22
Vom FC Valencia zu Celta Vigo
3/22
Von Real Madrid zum FC Everton
4/22
Von Juv… [+801 chars]",,de,'Lionel Messi'
https://www.handelsblatt.com/politik/konjunktur/nachrichten/europa-gipfel-selenski-bittet-auf-europa-gipfel-um-patriot-raketen-und-kampfjets/29181864.html,https://www.handelsblatt.com/politik/konjunktur/nachrichten/europa-gipfel-selenski-bittet-auf-europa-gipfel-um-patriot-raketen-und-kampfjets/29181864.html,0,www.handelsblatt.com,Europa-Gipfel: Selenski bittet auf Europa-Gipfel um Patriot-Raketen und Kampfjets,Bei der militärischen Unterstützung der Ukraine kommt es Selenski zufolge auf zwei Komponenten an. Auf dem Gipfel ist auch ein möglicher Nato-Beitritt der Ukraine Thema.,https://www.handelsblatt.com/images/gipfel-der-europaeischen-politischen-gemeinschaft-in-moldau/29181880/2-format2003.jpg,2023-06-01T11:58:57Z,https://web.archive.org/web/20230601122628/https://www.handelsblatt.com/politik/konjunktur/nachrichten/europa-gipfel-selenski-bittet-auf-europa-gipfel-um-patriot-raketen-und-kampfjets/29181864.html,Bulboaca Der ukrainische Präsident Wolodimir Selenski hat seine Verbündeten beim Europa-Gipfel in Moldau eindringlich um Unterstützung mit modernen Kampfjets und Patriot-Abwehrraketen gebeten. Bei de… [+3585 chars],,de,'Mark Rutte'
https://www.fitforfun.de/news/faisal-kawusi-hat-50-kilo-abgenommen-556470.html,https://www.fitforfun.de/news/faisal-kawusi-hat-50-kilo-abgenommen-556470.html,0,www.fitforfun.de,Krasse Verwandlung: Faisal Kawusi nimmt 50 Kilo ab,Faisal Kawusi hat die letzten Jahre sportlich so richtig Gas gegeben. Nun teilt der Comedian stolz auf Instagram seinen Abnehmerfolg.,"https://www.fitforfun.de/files/images/202305/1/faisal-kawusi-auf-grosser-abnehmreise,556487_3x2_n.jpg",2023-06-01T13:32:00Z,,"Empfohlener redaktioneller Inhalt
Passend zum Inhalt findest du hier einen externen Inhalt von Instagram.
 Aufgrund deiner Tracking-Einstellung ist die technische Darstellung nicht möglich.
 Mit d… [+480 chars]",,de,'Faisal Kawusi'
https://www.bild.de/unterhaltung/tv/tv/markus-lanz-heute-gaeste-und-thema-der-folge-vom-1-juni-2023-84146230.bild.html,https://www.bild.de/unterhaltung/tv/tv/markus-lanz-heute-gaeste-und-thema-der-folge-vom-1-juni-2023-84146230.bild.html,0,www.bild.de,Gäste und Thema am 1. Juni - Wer ist heute bei Markus Lanz?,"Dreimal in der Woche lädt Markus Lanz Experten ein, um über brisante gesellschaftliche Themen zu diskutieren. Hier erfahren Sie, wer heute dabei ist!","https://images.bild.de/6478980273ed0222d380c920/bb1d0336e63a4a8c925896c4e54852f0,8dd4b37d?w=1280",2023-06-01T13:47:44Z,https://web.archive.org/web/20230601135242/https://www.bild.de/unterhaltung/tv/tv/markus-lanz-heute-gaeste-und-thema-der-folge-vom-1-juni-2023-84146230.bild.html,"Dreimal die Woche lädt Markus Lanz Experten ein, um über aktuelle gesellschaftliche Themen zu diskutieren. Der Talk ist der Quoten-Garant und das schon seit 2008.
Heute Abend läuft 
Markus Lanz um … [+1567 chars]",,de,'Markus Lanz'
