index,url,valid,domain,title,description,image,published,archive,content,quote,language,keyword
https://www.n-tv.de/politik/12-13-Pflicht-zur-Festnahme-Suedafrika-will-Putin-Besuch-ausreden--article23143824.html,https://www.n-tv.de/politik/12-13-Pflicht-zur-Festnahme-Suedafrika-will-Putin-Besuch-ausreden--article23143824.html,0,www.n-tv.de,Ukraine-Krieg im Liveticker: +++ 12:13 Pflicht zur Festnahme: Südafrika will Putin Besuch ausreden +++,"Berlin, Washington, Br\u00fcssel - \u00fcberall. n-tv berichtet von allen wichtigen Schaupl\u00e4tzen der Innen- und Au\u00dfenpolitik.",https://bilder2.n-tv.de/img/incoming/crop23332537/9041326157-cImg_16_9-w1200/Liveticker1-grau-1-Kopie.jpg,2023-05-01T02:00:00Z,https://web.archive.org/web/20230501105834/https://www.n-tv.de/politik/12-13-Pflicht-zur-Festnahme-Suedafrika-will-Putin-Besuch-ausreden--article23143824.html,Nach der Anklageerhebung durch den Internationalen Strafgerichtshof (ICC) gegen Wladimir Putin ist die Regierung Südafrikas in erhebliche Schwierigkeiten geraten: Vor dem Treffen des Schwellenländer-… [+12872 chars],,de,'Papst Franziskus'
https://www.stern.de/politik/ausland/grossbritannien--monarchie-gegner-kritisieren-aufruf-zu-treueschwur--33425092.html,https://www.stern.de/politik/ausland/grossbritannien--monarchie-gegner-kritisieren-aufruf-zu-treueschwur--33425092.html,0,www.stern.de,Großbritannien: Monarchie-Gegner kritisieren Aufruf zu Treueschwur,"Bei der der Krönungszeremonie für Charles III soll erstmals mit einem ""Tribut der Menschen"" dem neuen König gehuldigt werden - und nicht nur ihm. Dafür gibt es scharfe Kritik.",https://image.stern.de/33425094/t/mR/v1/w1440/r1.7778/-/01--urnnewsmldpacom2009010123050199513374v4w800h600l1090t48r2370b885jpeg---887d4c8af9cce52d.jpg,2023-05-01T02:36:38Z,https://web.archive.org/web/20230502013118/https://www.stern.de/politik/ausland/grossbritannien--monarchie-gegner-kritisieren-aufruf-zu-treueschwur--33425092.html,"Bei der der Krönungszeremonie für Charles III soll erstmals mit einem ""Tribut der Menschen"" dem neuen König gehuldigt werden - und nicht nur ihm. Dafür gibt es scharfe Kritik.
Gegner der britischen … [+1783 chars]",,de,'Charles III'
https://www.handelsblatt.com/politik/international/ukraine-die-lage-am-morgen-armeechef-der-ukraine-trifft-nato-kommandeur/28144208.html,https://www.handelsblatt.com/politik/international/ukraine-die-lage-am-morgen-armeechef-der-ukraine-trifft-nato-kommandeur/28144208.html,0,www.handelsblatt.com,Ukraine – Die Lage am Morgen: Armeechef der Ukraine trifft Nato-Kommandeur – Papst deutet eine Friedensmission an,Der ukrainische Armeechef hat den Oberbefehlshaber der Nato-Streitkräfte in Europa umfassend über die Lage entlang der Fronten informiert. Präsident Selenski dankt den Verbündeten.,https://www.handelsblatt.com/images/wolodimir-selenski/29124714/2-format2003.jpg,2023-05-01T06:36:17Z,https://web.archive.org/web/20230501170910/https://www.handelsblatt.com/politik/international/ukraine-die-lage-am-morgen-armeechef-der-ukraine-trifft-nato-kommandeur/28144208.html,"Wolodimir SelenskiDer Präsident der Ukraine während Veranstaltungen zum Tag des Grenzschutzes der Ukraine am Samstag.
(Foto: dpa)
Kiew Der ukrainische Präsident Wolodimir Selenski hat den ausländis… [+5803 chars]",,de,'Selenski'
https://www.faz.net/aktuell/wirtschaft/heizungsstreit-wie-wird-robert-habeck-sein-angeschlagenes-image-los-18856349.html,https://www.faz.net/aktuell/wirtschaft/heizungsstreit-wie-wird-robert-habeck-sein-angeschlagenes-image-los-18856349.html,0,www.faz.net,Robert Habeck und der Heizungsstreit: Zurück in die Vorwärtsverteidigung,Robert Habeck wollte aus den Grünen eine Partei für die ganze Gesellschaft machen. Seit dem Heizungsstreit gilt ausgerechnet der Wirtschaftsminister plötzlich als Klientelpolitiker. Wie konnte das passieren?,https://media0.faz.net/ppmedia/aktuell/wirtschaft/3884687418/1.8860120/facebook_teaser/im-erklaermodus-robert-habeck.jpg,2023-05-01T06:36:20Z,,"Wer einst um den Knickschutz kämpfte, den können auch Gasheizungen nicht mehr schrecken. Knicks, so heißen in Schleswig-Holstein die naturwüchsigen Hecken, die in freier Landschaft die Felder der Bau… [+3563 chars]",,de,'Wolfgang Kubicki'
https://www.zeit.de/gesellschaft/zeitgeschehen/2023-05/kroenung-charles-iii-neuseeland-hipkins,https://www.zeit.de/gesellschaft/zeitgeschehen/2023-05/kroenung-charles-iii-neuseeland-hipkins,0,www.zeit.de,Krönung von Charles III.: Premierminister wünscht sich Neuseeland als Republik,"Kurz vor den Krönungsfeierlichkeiten stellt Chris Hipkins in Frage, ob sein Land der britischen Krone unterstellt sein sollte. Auch in Großbritannien gibt es neue Kritik.",,2023-05-01T07:42:02Z,https://web.archive.org/web/20230502074906/https://www.zeit.de/gesellschaft/zeitgeschehen/2023-05/kroenung-charles-iii-neuseeland-hipkins,"When browsing with ads:
We collect personal data and also transmit it to third-party providers
 that help us improve and finance our digital content. Some of the information stored on your device, … [+732 chars]",,de,'Chris Hipkins'
https://www.zeit.de/politik/deutschland/2023-04/olaf-scholz-erster-mai-spd-arbeitnehmerschaft,https://www.zeit.de/politik/deutschland/2023-04/olaf-scholz-erster-mai-spd-arbeitnehmerschaft,0,www.zeit.de,Olaf Scholz am 1. Mai: Der Genosse der Genossen,"Das Verhältnis von SPD und Gewerkschaften war nie einfach, oft geprägt von Misstrauen und Arroganz. Jetzt loben die Gewerkschaften Kanzler Olaf Scholz. Was ist da los?",,2023-05-01T08:02:57Z,,"When browsing with ads:
We collect personal data and also transmit it to third-party providers
 that help us improve and finance our digital content. Some of the information stored on your device, … [+732 chars]",,de,'Olaf Scholz'
https://www.focus.de/finanzen/kommentar-habecks-staatssekretaerin-nennt-bei-anne-will-wahren-grund-fuer-heizwende_id_192602521.html,https://www.focus.de/finanzen/kommentar-habecks-staatssekretaerin-nennt-bei-anne-will-wahren-grund-fuer-heizwende_id_192602521.html,0,www.focus.de,Kommentar - Habecks Staatssekretärin nennt bei „Anne Will“ wahren Grund für Heizwende,"Die Grünen-Spitzenpolitikerin Franziska Brantner hat bei „Anne Will“ gute Stimmung für Robert Habecks Heizwende gemacht und auch den Viessmann-Deal öffentlich goutiert. Dabei erklärte die 43-Jährige, dass es bei den Plänen des Bundeswirtschaftsministerium um …",https://p6.focus.de/img/fotos/id_192600659/brantner-habeck1.jpg?im=Crop%3D%280%2C80%2C3468%2C1735%29%3BResize%3D%281200%2C627%29&hash=f2303d1b4b60d038a0f15cef7b8a0f5e7cede1bc1f8858796443e95d8e9ebdd2,2023-05-01T10:22:09Z,https://web.archive.org/web/20230501133131/https://www.focus.de/finanzen/kommentar-habecks-staatssekretaerin-nennt-bei-anne-will-wahren-grund-fuer-heizwende_id_192602521.html,"Die Grünen-Spitzenpolitikerin Franziska Brantner hat bei Anne Will gute Stimmung für Robert Habecks Heizwende gemacht und auch den Viessmann-Deal öffentlich goutiert. Dabei erklärte die 43-Jährige, d… [+5328 chars]",,de,'Anne Will'
https://www.morgenpost.de/vermischtes/article238275723/Vor-Kroenung-Neuseelands-Premier-wuenscht-sich-Republik.html,https://www.morgenpost.de/vermischtes/article238275723/Vor-Kroenung-Neuseelands-Premier-wuenscht-sich-Republik.html,0,www.morgenpost.de,Commonwealth-Staat: Vor Krönung: Neuseelands Premier wünscht sich Republik,"Forderungen, Neuseeland zu einer Republik zu machen, gibt es schon lange. Chris Hipkins spricht diesen Weg erneut an - sieht aber keinen Grund zur Eile.",https://img.morgenpost.de/img/vermischtes/crop238275721/590260854-w820-cv16_9-q85/Hipkins.jpg,2023-05-01T10:23:26Z,,Wellington. Nach Meinung des neuseeländischen Premierministers Chris Hipkins sollte der Commonwealth-Staat in absehbarer Zukunft zur Republik werden. Im Idealfall wird Neuseeland mit der Zeit ein völ… [+1130 chars],,de,'Chris Hipkins'
https://www.stern.de/panorama/commonwealth-staat--vor-kroenung--neuseelands-premier-wuenscht-sich-republik-33425912.html,https://www.stern.de/panorama/commonwealth-staat--vor-kroenung--neuseelands-premier-wuenscht-sich-republik-33425912.html,0,www.stern.de,Commonwealth-Staat: Vor Krönung: Neuseelands Premier wünscht sich Republik,"Forderungen, Neuseeland zu einer Republik zu machen, gibt es schon lange. Chris Hipkins spricht diesen Weg erneut an - sieht aber keinen Grund zur Eile.",https://image.stern.de/33425914/t/Sl/v1/w1440/r1.7778/-/01--urnnewsmldpacom2009010123050199516240v3w800h600l723t456r2003b1310jpeg---4c3088ce398877c2.jpg,2023-05-01T10:23:26Z,https://web.archive.org/web/20230502031145/https://www.stern.de/panorama/commonwealth-staat--vor-kroenung--neuseelands-premier-wuenscht-sich-republik-33425912.html,"Forderungen, Neuseeland zu einer Republik zu machen, gibt es schon lange. Chris Hipkins spricht diesen Weg erneut an - sieht aber keinen Grund zur Eile.
Nach Meinung des neuseeländischen Premiermini… [+1283 chars]",,de,'Chris Hipkins'
https://www.dw.com/de/ukraine-aktuell-neue-russische-angriffswelle/a-65477547,https://www.dw.com/de/ukraine-aktuell-neue-russische-angriffswelle/a-65477547,0,www.dw.com,Ukraine aktuell: Neue russische Angriffswelle,"Bei einem zweiten massiven Luftangriff innerhalb von drei Tagen hat Russland Raketen auf Ziele in der gesamten Ukraine abgefeuert. Papst Franziskus deutet Beteiligung an einer Friedensmission an. Ein Überblick. Das Wichtigste in Kürze:


Nächtliche russische …",https://static.dw.com/image/65478663_6.jpg,2023-05-01T13:20:00Z,https://web.archive.org/web/20230502004437/https://www.dw.com/de/ukraine-aktuell-neue-russische-angriffswelle/a-65477547,"Das Wichtigste in Kürze:
<ul><li>Nächtliche russische Angriffswelle</li><li>Selenskyj bedankt sich bei Partnern für Unterstützung </li><li>Russischer Zug nach Sprengung entgleist</li><li>Prigoschin:… [+8755 chars]",,de,'Papst Franziskus'
https://orf.at/stories/3314623/,https://orf.at/stories/3314623/,0,orf.at,Kanye-West-Deal: Investorenklage gegen adidas,,https://orf.at/mojo/1_4_1/storyserver//news/common/images/og-fallback-news.png,2023-05-01T15:38:39Z,,Investoren haben in den USA Klage gegen den deutschen Sportartikelriesen adidas eingereicht und zwar im Zusammenhang mit wiederholten antisemitischen und rassistischen Aussagen des Rappers Kanye West… [+82 chars],,de,'Kanye West'
https://www.sueddeutsche.de/politik/vatikan-papst-appell-fuer-migranten-in-ungarn-1.5832344,https://www.sueddeutsche.de/politik/vatikan-papst-appell-fuer-migranten-in-ungarn-1.5832344,0,www.sueddeutsche.de,Vatikan: Papst-Appell für Migranten in Ungarn,"Bei seinem dreitägigen Ungarn-Besuch fand Papst Franziskus deutliche Worte zu Flüchtlingen, Migration und Europa. Bei einer Messe in Budapest forderte das...",https://www.sueddeutsche.de/assets/png/sz-ecb090256670a577bd629a9718686332.png,2023-05-01T16:55:52Z,,"Bei seinem dreitägigen Ungarn-Besuch fand Papst Franziskus deutliche Worte zu Flüchtlingen, Migration und Europa. Bei einer Messe in Budapest forderte das Oberhaupt der katholischen Kirche mit Blick … [+631 chars]",,de,'Papst Franziskus'
https://www.sueddeutsche.de/politik/privatisierung-tim-engartner-wolfgang-kubicki-rezension-1.5831917,https://www.sueddeutsche.de/politik/privatisierung-tim-engartner-wolfgang-kubicki-rezension-1.5831917,0,www.sueddeutsche.de,Das Politische Buch: Staat oder Markt?,Der Sozialwissenschaftler Tim Engartner und der Politiker Wolfgang Kubicki diskutieren über Vor- und Nachteile von Privatisierungen. Einer kann mehr überzeugen.,https://www.sueddeutsche.de/image/sz.1.5831918/1200x675?v=1682948863,2023-05-01T16:55:54Z,https://web.archive.org/web/20230506211925/https://www.sueddeutsche.de/politik/privatisierung-tim-engartner-wolfgang-kubicki-rezension-1.5831917,"Der Sozialwissenschaftler Tim Engartner und der Politiker Wolfgang Kubicki diskutieren über Vor- und Nachteile von Privatisierungen. Einer kann mehr überzeugen.Gute Idee, die der kleine Westend-Verla… [+3068 chars]",,de,'Wolfgang Kubicki'
https://www.bild.de/sport/fussball/fussball-international/foto-aufgetaucht-psg-superstar-messi-in-saudi-arabien-gesichtet-83760358.bild.html,https://www.bild.de/sport/fussball/fussball-international/foto-aufgetaucht-psg-superstar-messi-in-saudi-arabien-gesichtet-83760358.bild.html,0,www.bild.de,Foto aufgetaucht - Messi in Saudi-Arabien gesichtet,Seit Monaten gibt es fast täglich neue Gerüchte um die Zukunft von Superstar Lionel Messi (35).Foto: FRANCK FIFE/AFP,"https://images.bild.de/644fe4e14d39435073b2cc6a/5aa94b1fcd292196a1de084975c44fe8,a1059f33?w=1280",2023-05-01T17:51:14Z,https://web.archive.org/web/20230502015145/https://www.bild.de/sport/fussball/fussball-international/foto-aufgetaucht-psg-superstar-messi-in-saudi-arabien-gesichtet-83760358.bild.html,"Nanu!? 
Seit Monaten gibt es fast täglich neue Gerüchte um die Zukunft von Superstar 
Lionel Messi (35). Grund: Sein Vertrag beim französischen Top-Klub Paris Saint-Germain läuft Ende Juni aus. 
M… [+3324 chars]",,de,'Lionel Messi'
https://www.zeit.de/news/2023-05/01/olaf-scholz-ueber-regierung-wir-sind-nette-leute,https://www.zeit.de/news/2023-05/01/olaf-scholz-ueber-regierung-wir-sind-nette-leute,0,www.zeit.de,Gesellschaft: Olaf Scholz über Regierung: «Wir sind nette Leute»,,,2023-05-01T18:27:33Z,,"When browsing with ads:
We collect personal data and also transmit it to third-party providers
 that help us improve and finance our digital content. Some of the information stored on your device, … [+732 chars]",,de,'Olaf Scholz'
https://www.faz.net/aktuell/feuilleton/medien/reschke-fernsehen-muss-aussagen-zu-julian-reichelt-unterlassen-18862506.html,https://www.faz.net/aktuell/feuilleton/medien/reschke-fernsehen-muss-aussagen-zu-julian-reichelt-unterlassen-18862506.html,0,www.faz.net,Landgericht Hamburg: „Reschke Fernsehen“ darf Aussagen zu Reichelt nicht verbreiten,Die Sendung „Reschke Fernsehen“ hatte über Machtmissbrauch-Vorwürfe  gegen den früheren „Bild“-Chef Julian Reichelt berichtet. Ein Gericht untersagt nun viele Behauptungen.,https://media1.faz.net/ppmedia/aktuell/gesellschaft/2736173263/1.8648349/facebook_teaser/ihre-sendung-darf-zahlreiche.jpg,2023-05-02T08:25:16Z,https://web.archive.org/web/20230502100842/https://www.faz.net/aktuell/feuilleton/medien/reschke-fernsehen-muss-aussagen-zu-julian-reichelt-unterlassen-18862506.html,"Der frühere Chefredakteur der Bild-Zeitung, Julian Reichelt, hat gegen die Sendung Reschke Fernsehen umfassende einstweilige Verfügungen erwirkt. Das NDR-Magazin darf zahlreiche Äußerungen der Ausgab… [+4868 chars]",,de,'Julian Reichelt'
https://www.titanic-magazin.de/news/fast-richtige-schlagzeile-servus-13526/,https://www.titanic-magazin.de/news/fast-richtige-schlagzeile-servus-13526/,0,www.titanic-magazin.de,Fast richtige Schlagzeile (Servus!),Boris  Palmer  kündigt  Auszeit  am  Obersalzberg  an,https://www.titanic-magazin.de/fileadmin/core/images/social_media_icons/titaniclogo.png,2023-05-02T08:32:31Z,,"»Jetzt erlebt Amerika eine Premiere«, schreiben Sie in die Wochenendausgabe Ihrer Zeitung, denn: »Einen früheren US-Präsidenten unter Anklage gab es ja noch nie. Und erst recht keinen früheren US-Prä… [+766 chars]",,de,'Boris Palmer'
https://www.welt.de/politik/ausland/article245083448/Wagner-Chef-warnt-Gegenoffensive-koennte-zu-einer-Tragoedie-fuer-unser-Land-werden.html,https://www.welt.de/politik/ausland/article245083448/Wagner-Chef-warnt-Gegenoffensive-koennte-zu-einer-Tragoedie-fuer-unser-Land-werden.html,0,www.welt.de,„Diese Gegenoffensive könnte zu einer Tragödie für unser Land werden“,"Einmal mehr beklagt sich Jewgeni Prigoschin, Chef der russischen Wagner-Truppe, über fehlende Munition für seine Söldner in der Ukraine. „Wir haben nur zehn bis 15 Prozent der Granaten, die wir brauchen“, sagt er.",https://img.welt.de/img/politik/ausland/mobile245089378/3901352737-ci16x9-w1200/FILE-PHOTO-Funeral-held-in-Moscow-for-Russian-military-blogger-k.jpg,2023-05-02T09:46:00Z,https://web.archive.org/web/20230502100203/http://www.welt.de/politik/ausland/article245083448/Wagner-Chef-warnt-Gegenoffensive-koennte-zu-einer-Tragoedie-fuer-unser-Land-werden.html,"Die erwartete Gegenoffensive der Ukraine könnte nach den Worten des Chefs der Söldnergruppe Wagner, Jewgeni Prigoschin, für Russland zur Tragödie werden. Prigoschin sagte in einem am Sonntag veröffen… [+15746 chars]",,de,'Jewgeni Prigoschin'
https://www.dw.com/de/kr%C3%B6nungsrituale-charles-iii/a-65418103,https://www.dw.com/de/kr%C3%B6nungsrituale-charles-iii/a-65418103,0,www.dw.com,Königliches Ritual: Wie Charles III. gekrönt wird,Am 6. Mai wird nichts dem Zufall überlassen. Doch warum eigentlich dieses Datum? Wer tritt beim Krönungskonzert auf? Und was genau ist Harrys Rolle dabei? Hier ein paar Antworten. Seit rund 1000 Jahren werden englische Königinnen und Könige in London gekrönt.…,https://static.dw.com/image/65189729_6.jpg,2023-05-02T10:46:00Z,https://web.archive.org/web/20230506202053/https://www.dw.com/de/kr%C3%B6nungsrituale-charles-iii/a-65418103,"Seit rund 1000 Jahren werden englische Königinnen und Könige in London gekrönt. In dieser langen Zeit sind viele Rituale entstanden, die auch die Krönung von Charles III. und seiner Frau Camilla präg… [+8663 chars]",,de,'Prinz Harry'
https://www.stern.de/news/kretschmer-wirft-habeck-bei-energiewende--autokratischen--politikstil-vor-33429040.html,https://www.stern.de/news/kretschmer-wirft-habeck-bei-energiewende--autokratischen--politikstil-vor-33429040.html,0,www.stern.de,"Kretschmer wirft Habeck bei Energiewende ""autokratischen"" Politikstil vor","Sachsens Ministerpräsident Michael Kretschmer (CDU) hat Bundeswirtschaftsminister Robert Habeck (Grüne) für einen ""autokratischen"" Arbeitsstil kritisiert und bei der Energiewende mehr Zusammenarbeit mit den Ländern gefordert. ""Dieser autokratische, selbstherr…",https://image.stern.de/33429042/t/j3/v1/w1440/r1.7778/-/02--michael-kretschmer---818a5b3bb61f51fc.jpg,2023-05-02T11:32:52Z,,"Sachsens Ministerpräsident Michael Kretschmer (CDU) hat Bundeswirtschaftsminister Robert Habeck (Grüne) für einen ""autokratischen"" Arbeitsstil kritisiert und bei der Energiewende mehr Zusammenarbeit … [+2313 chars]",,de,'Michael Kretschmer'
https://www.faz.net/aktuell/politik/ukraine-liveticker-schojgu-fordert-groessere-produktion-von-raketen-faz-18495964.html,https://www.faz.net/aktuell/politik/ukraine-liveticker-schojgu-fordert-groessere-produktion-von-raketen-faz-18495964.html,0,www.faz.net,Ukraine-Liveblog: Schojgu fordert größere Produktion von Raketen,Ukraine droht Enttäuschung bei NATO-Gipfel +++ Putin-treue Motorradfahrer Richtung Berlin aufgebrochen +++ Güterzug in Russland nach Sprengung entgleist +++ „Gegenoffensive könnte Tragödie für Russland werden“ +++ alle Entwicklungen im Liveblog,https://media0.faz.net/ppmedia/aktuell/politik/1302053775/1.8862980/facebook_teaser/russlands.jpg,2023-05-02T11:43:50Z,https://web.archive.org/web/20230502152823/https://www.faz.net/aktuell/politik/ukraine-liveticker-schojgu-fordert-groessere-produktion-von-raketen-faz-18495964.html,Die Hoffnungen der Ukraine auf eine konkretere NATO-Beitrittsperspektive drohen vorerst enttäuscht zu werden. Nach Informationen der Deutschen Presse-Agentur haben zuletzt Bündnismitglieder wie die U… [+1070 chars],,de,'Selenskyj'
https://www.zeit.de/news/2023-05/02/investoren-klage-gegen-adidas-nach-bruch-mit-kanye-west,https://www.zeit.de/news/2023-05/02/investoren-klage-gegen-adidas-nach-bruch-mit-kanye-west,0,www.zeit.de,Gewinnrückgang: Investoren-Klage gegen Adidas nach Bruch mit Kanye West,,,2023-05-02T11:58:45Z,,"When browsing with ads:
We collect personal data and also transmit it to third-party providers
 that help us improve and finance our digital content. Some of the information stored on your device, … [+732 chars]",,de,'Kanye West'
https://www.tagesspiegel.de/berlin/die-sehnsucht-nach-berlin-warum-barack-obama-sich-so-auf-seinen-besuch-freut-9749714.html,https://www.tagesspiegel.de/berlin/die-sehnsucht-nach-berlin-warum-barack-obama-sich-so-auf-seinen-besuch-freut-9749714.html,0,www.tagesspiegel.de,Die Sehnsucht nach Berlin: Warum Barack Obama sich so auf seinen Besuch freut,Als US-Präsident war Barack Obama in ein Hochsicherheitskorsett eingezwängt. Jetzt könnte er sich privat umtun - wenn auch niemals ohne Begleitung.,https://www.tagesspiegel.de/berlin/images/fruherer-us-prasident-barack-obama-in-berlin/alternates/BASE_16_9_W1400/frueherer-us-praesident-barack-obama-in-berlin.jpeg,2023-05-02T13:00:32Z,http://archive.md/20230502160310/https://www.tagesspiegel.de/berlin/die-sehnsucht-nach-berlin-warum-barack-obama-sich-so-auf-seinen-besuch-freut-9749714.html,"Dass er sich in Berlin verliebt hat, verriet Barack Obama ganz am Ende seiner Präsidentschaft bei einem Pressegespräch in der US-Botschaft. Minuten, bevor der offizielle politische Teil begann, erzäh… [+80 chars]",,de,'Barack Obama'
https://www.wiwo.de/unternehmen/handel/skandal-rapper-investoren-klagen-gegen-adidas-nach-bruch-mit-kanye-west/29126816.html,https://www.wiwo.de/unternehmen/handel/skandal-rapper-investoren-klagen-gegen-adidas-nach-bruch-mit-kanye-west/29126816.html,0,www.wiwo.de,Skandal-Rapper: Investoren klagen gegen Adidas nach Bruch mit Kanye West,"Sportartikelhersteller Adidas wird von seiner Vergangenheit eingeholt. Nachdem der Konzern seine Zusammenarbeit mit dem US-Rapper Kanye West aufgegeben hat, folgt nun eine Klage der US-Investoren.",https://www.wiwo.de/images/kanye-west/29126834/2-format11240.jpg,2023-05-02T13:07:24Z,https://web.archive.org/web/20230503143144/http://www.wiwo.de/unternehmen/handel/skandal-rapper-investoren-klagen-gegen-adidas-nach-bruch-mit-kanye-west/29126816.html,Für Nachrichtenseiten wie WirtschaftsWoche Online sind Anzeigen eine wichtige Einnahmequelle. Mit den Werbeerlösen können wir die Arbeit unserer Redaktion bezahlen und Qualitätsartikel kostenfrei ver… [+173 chars],,de,'Kanye West'
https://www.faz.net/aktuell/wirtschaft/klima-nachhaltigkeit/christian-lindner-haelt-nichts-vom-industriestrompreis-18863264.html,https://www.faz.net/aktuell/wirtschaft/klima-nachhaltigkeit/christian-lindner-haelt-nichts-vom-industriestrompreis-18863264.html,0,www.faz.net,Pläne von Habeck-Ministerium: Christian Lindner hält nichts vom Industriestrompreis,Das Bundeswirtschaftsministerium will die energieintensive Industrie unterstützen. Doch Finanzminister Lindner stellt sich quer – und auch Verbände lehnen das Konzept ab.,https://media0.faz.net/ppmedia/aktuell/wirtschaft/3717689879/1.8863256/facebook_teaser/die-chemieindustrie-hier-basf.jpg,2023-05-02T13:43:55Z,https://web.archive.org/web/20230503055633/https://www.faz.net/aktuell/wirtschaft/klima-nachhaltigkeit/christian-lindner-haelt-nichts-vom-industriestrompreis-18863264.html,In Berlin warten Wirtschaft und Politik gespannt auf ein neues Konzept des Wirtschaftsministeriums zu ei­nem Industriestrompreis von 5 oder 6 Cent je Kilowattstunde. Eigentlich wollte es Staatssekret… [+2865 chars],,de,'Christian Lindner'
https://www.sueddeutsche.de/wirtschaft/halbleiter-chipindustrie-infineon-subventionen-energiewende-1.5834726,https://www.sueddeutsche.de/wirtschaft/halbleiter-chipindustrie-infineon-subventionen-energiewende-1.5834726,0,www.sueddeutsche.de,"Chipindustrie: ""Wir brauchen Halbleiter, sehr viele Halbleiter""",Der Chipkonzern Infineon baut für fünf Milliarden Euro sein Werk in Dresden aus. EU-Kommissionspräsidentin Ursula von der Leyen und Kanzler Scholz sehen darin auch einen wichtigen Beitrag zur Energiewende.,https://www.sueddeutsche.de/image/sz.1.5834729/1200x675?v=1683036260,2023-05-02T14:05:59Z,,Der Chipkonzern Infineon baut für fünf Milliarden Euro sein Werk in Dresden aus. EU-Kommissionspräsidentin Ursula von der Leyen und Kanzler Scholz sehen darin auch einen wichtigen Beitrag zur Energie… [+5436 chars],,de,'Michael Kretschmer'
https://netzpolitik.org/2023/zivilgesellschaft-mit-plattformraeten-gegen-die-tech-oligarchie/,https://netzpolitik.org/2023/zivilgesellschaft-mit-plattformraeten-gegen-die-tech-oligarchie/,0,netzpolitik.org,Zivilgesellschaft: Mit Plattformräten gegen die Tech-Oligarchie,"Plattformräte können die Macht der Tech-Konzerne begrenzen – Diffusion Bee (Mark Zuckerberg as a powerful king on a throne, style:“game of thrones“, highly detailed)
Laut Koalitionsvertrag will die Bundesregierung den Aufbau von Plattformräte fördern. Die Gr…",https://cdn.netzpolitik.org/wp-upload/2023/04/zuckerberg_throne-1200x675.jpg,2023-05-02T14:37:32Z,https://web.archive.org/web/20230502153453/https://netzpolitik.org/2023/zivilgesellschaft-mit-plattformraeten-gegen-die-tech-oligarchie/,"Es ist wohl einer der am wenigsten berücksichtigten Sätze im Koalitionsvertrag der Bundesregierung: Den Aufbau von Plattformräten werden wir voranbringen, heißt es dort auf Seite 14. Er stammt vermut… [+7941 chars]",,de,'Mark Zuckerberg'
https://www.bild.de/unterhaltung/tv/tv/markus-lanz-heute-gaeste-und-thema-der-folge-vom-2-mai-2023-83770792.bild.html,https://www.bild.de/unterhaltung/tv/tv/markus-lanz-heute-gaeste-und-thema-der-folge-vom-2-mai-2023-83770792.bild.html,0,www.bild.de,Gäste und Thema am 2. Mai - Wer ist heute Abend bei Markus Lanz?,"Dreimal wöchentlich lädt Markus Lanz Experten ein, um über brisante gesellschaftliche Themen zu diskutieren. Hier erfahren Sie, wer heute dabei ist!","https://images.bild.de/64511f6243f0b8009bf02992/bb1d0336e63a4a8c925896c4e54852f0,8dd4b37d?w=1280",2023-05-02T14:40:14Z,https://web.archive.org/web/20230503023104/https://www.bild.de/unterhaltung/tv/tv/markus-lanz-heute-gaeste-und-thema-der-folge-vom-2-mai-2023-83770792.bild.html,"Dreimal wöchentlich lädt Markus Lanz Experten ein, um über brisante gesellschaftliche Themen zu diskutieren. Der Talk ist ein absoluter Quoten-Garant und das schon seit 2008.
Heute läuft 
Markus La… [+1131 chars]",,de,'Markus Lanz'
