index,url,valid,domain,title,description,image,published,archive,content,quote,language,keyword
https://www.brigitte.de/aktuell/vier-wochen-nach-der-geburt--franca-lehfeldt-ist-zurueck-in-der-oeffentlichkeit-13984440.html,https://www.brigitte.de/aktuell/vier-wochen-nach-der-geburt--franca-lehfeldt-ist-zurueck-in-der-oeffentlichkeit-13984440.html,0,www.brigitte.de,Vier Wochen nach der Geburt: Franca Lehfeldt ist zurück in der Öffentlichkeit,Vier Wochen nach der Geburt ist Franca Lehfeldt zurück in der Öffentlichkeit. Christian Lindners Frau nahm in Hamburg an einem Panel teil.,https://image.brigitte.de/13984442/t/Mt/v1/w1440/r1.7778/-/06--franca-lehfeldt-ist-zurueck-in-der-oeffentlichkeit---1-1---spoton-article-1096241.jpg,2025-05-06T07:15:00Z,https://web.archive.org/web/20250506083535/https://www.brigitte.de/aktuell/vier-wochen-nach-der-geburt--franca-lehfeldt-ist-zurueck-in-der-oeffentlichkeit-13984440.html,"Vier Wochen nach der Geburt ist Franca Lehfeldt zurück in der Öffentlichkeit. Christian Lindners Frau nahm in Hamburg an einem Panel teil.
Franca Lehfeldt (35) ist vier Wochen nach der Geburt zurück… [+2036 chars]",,de,'Christian Lindner'
https://www.morgenpost.de/panorama/article408937385/lindner-ueberfaehrt-hund-hat-er-schuld-das-sagen-juristen.html,https://www.morgenpost.de/panorama/article408937385/lindner-ueberfaehrt-hund-hat-er-schuld-das-sagen-juristen.html,0,www.morgenpost.de,Lindner überfährt Hund – hat er Schuld? Das sagen Juristen,FDP-Politiker Christian Lindner soll einen kleinen Hund überfahren haben. Ist er Schuld am Tod des Tieres? Das sagen Juristen dazu.,https://img.sparknews.funkemedien.de/408941309/408941309_1746524564_v16_9_1600.jpeg,2025-05-06T09:42:44Z,https://web.archive.org/web/20250506152751/https://www.morgenpost.de/panorama/article408937385/lindner-ueberfaehrt-hund-hat-er-schuld-das-sagen-juristen.html,"Berlin. FDP-Politiker Christian Lindner soll einen kleinen Hund überfahren haben. Ist er Schuld am Tod des Tieres? Das sagen Juristen dazu.
Christian Lindner, der Noch-Chef der FDP, soll vor kurzem … [+4082 chars]",,de,'Christian Lindner'
https://www.zeit.de/politik/deutschland/2025-05/friedrich-merz-kanzler-reaktionen-ausland,https://www.zeit.de/politik/deutschland/2025-05/friedrich-merz-kanzler-reaktionen-ausland,0,www.zeit.de,Reaktionen auf Kanzlerwahl: Staats- und Regierungschefs gratulieren Friedrich Merz,"Nach der Wahl von Friedrich Merz zum Bundeskanzler haben Politiker aus aller Welt Glückwünsche übermittelt. Die Ukraine hofft auf ""noch mehr deutsche Führungsstärke"".",https://img.zeit.de/politik/ausland/2025-05/glueckwuensche-merz-bild/wide__1300x731,2025-05-07T02:40:47Z,http://archive.md/20250507032336/https://www.zeit.de/politik/deutschland/2025-05/friedrich-merz-kanzler-reaktionen-ausland,"Staats- und Regierungschefs aus zahlreichen Ländern haben dem neuen Bundeskanzler Friedrich Merz (CDU) zu seiner Ernennung gratuliert. ""Herzlichen Glückwunsch zum Amtsantritt, lieber Herr Bundeskanzl… [+4459 chars]",,de,'Friedrich Merz'
https://www.zeit.de/news/2025-05/07/gedenken-in-kriegszeiten-kiew-stoert-putins-siegesparade,https://www.zeit.de/news/2025-05/07/gedenken-in-kriegszeiten-kiew-stoert-putins-siegesparade,0,www.zeit.de,Weltkriegsgedenken: Gedenken in Kriegszeiten – Kiew stört Putins Siegesparade,Hier finden Sie Informationen zu dem Thema „Weltkriegsgedenken“. Lesen Sie jetzt „Gedenken in Kriegszeiten – Kiew stört Putins Siegesparade“.,https://img.zeit.de/news/2025-05/07/gedenken-in-kriegszeiten-kiew-stoert-putins-siegesparade-image-group/wide__1300x731,2025-05-07T05:00:43Z,,"Mit Sieg und Frieden kann Kremlchef Wladimir Putin an dem in Russland heiligen Feiertag zum 80. Jubiläum der Kapitulation von Nazideutschland nicht dienen. Ein Meer aus blutroten Flaggen, riesige ora… [+7074 chars]",,de,'Putin'
https://www.zeit.de/politik/ausland/2025-05/usa-frueherer-us-praesident-joe-biden-donald-trump-ukraine-groenland-kanada,https://www.zeit.de/politik/ausland/2025-05/usa-frueherer-us-praesident-joe-biden-donald-trump-ukraine-groenland-kanada,0,www.zeit.de,"USA: Biden nennt Trumps Ukraine-Politik ""modernes Appeasement""",In dem ersten Interview nach Ende seiner Präsidentschaft hat Joe Biden deutliche Kritik an seinem Nachfolger Donald Trump geübt – insbesondere an dessen Ukraine-Politik.,https://img.zeit.de/politik/ausland/2025-05/joe-biden-bbc-erstes-interview-nach-ende-praesidentschaft-bild/wide__1300x731,2025-05-07T11:16:31Z,http://archive.md/20250507112924/https://www.zeit.de/politik/ausland/2025-05/usa-frueherer-us-praesident-joe-biden-donald-trump-ukraine-groenland-kanada,"Der frühere US-Präsident Joe Biden
hat die Ukraine-Politik seines Nachfolgers Donald Trump deutlich kritisiert. Der Druck, den der
Republikaner auf die ukrainische Regierung ausübe, damit diese im … [+1903 chars]",,de,'Donald Trump'
https://www.nzz.ch/international/britische-tories-am-abgrund-kann-die-traditionspartei-ueberleben-ld.1882859,https://www.nzz.ch/international/britische-tories-am-abgrund-kann-die-traditionspartei-ueberleben-ld.1882859,0,www.nzz.ch,Die britischen Konservativen werden gern die erfolgreichste Partei der Welt genannt – nun bangen sie um ihre Existenz,Bei den englischen Lokalwahlen haben Rechtsnationale und Liberaldemokraten den Tories das Wasser abgegraben. Ist die Partei von Winston Churchill noch zu retten?,"https://img.nzz.ch/2025/05/07/a5167849-2e01-4f8f-874b-88c56392bbbe.jpeg?width=1200&height=675&fit=bounds&quality=75&auto=webp&crop=7763,4367,x0,y0&wmark=nzz",2025-05-08T03:30:00Z,http://archive.md/20250508044356/https://www.nzz.ch/international/britische-tories-am-abgrund-kann-die-traditionspartei-ueberleben-ld.1882859,"Kemi Badenoch, die Chefin der Konservativen Partei, ist quirlig, aber hat den Draht zum Volk noch nicht gefunden.
Bei Schwanengesängen auf die britischen Konservativen ist Vorsicht geboten. 2005, zu… [+7578 chars]",,de,'nan nan'
https://www.stern.de/politik/deutschland/christian-lindner-postet-schraeges-waldvideo-und-bekommt-jobvorschlaege-35708186.html,https://www.stern.de/politik/deutschland/christian-lindner-postet-schraeges-waldvideo-und-bekommt-jobvorschlaege-35708186.html,0,www.stern.de,Instagram-Comeback: Christian Lindner postet schräges Waldvideo – und bekommt Jobvorschläge,"Wo steckt Christian Lindner? Der Ex-Finanzminister und Jung-Vater geht im Wald spazieren und plaudert über seine ""neue Freiheit"". Ganz locker, ganz ungezwungen. Naja fast.",https://image.stern.de/35708376/t/vS/v2/w1440/r1.7778/-/christian-lindner-wald.jpg,2025-05-09T08:22:00Z,https://web.archive.org/web/20250509095543/https://www.stern.de/politik/deutschland/christian-lindner-postet-schraeges-waldvideo-und-bekommt-jobvorschlaege-35708186.html,"Kopiere den aktuellen Link
Zur Merkliste hinzufügen
Wo steckt Christian Lindner? Der Ex-Finanzminister und Jung-Vater geht im Wald spazieren und plaudert über seine ""neue Freiheit"". Ganz locker, ga… [+10607 chars]",,de,'Christian Lindner'
https://www.tagesspiegel.de/politik/wald-video-lindner-meldet-sich-zuruck-familie-tag-und-nacht-13665070.html,https://www.tagesspiegel.de/politik/wald-video-lindner-meldet-sich-zuruck-familie-tag-und-nacht-13665070.html,0,www.tagesspiegel.de,Wald-Video: Lindner meldet sich zurück: Familie „Tag und Nacht“,Was macht Christian Lindner? Nach den Baby-News war es länger still um den Ex-Finanzminister. Jetzt äußert er sich in einem Wald-Video.,https://www.tagesspiegel.de/images/13665067/alternates/BASE_16_9_W1400/1746790107000/christian-lindner.jpeg,2025-05-09T11:28:27Z,https://web.archive.org/web/20250510145808/https://www.tagesspiegel.de/politik/wald-video-lindner-meldet-sich-zuruck-familie-tag-und-nacht-13665070.html,"Ex-Finanzminister Christian Lindner hat sich nach wochenlanger Sendepause und der Geburt seines Kindes auf Instagram zurückgemeldet. Jetzt geht's wieder los, sagt er in einem Videoclip, in dem er leg… [+699 chars]",,de,'Christian Lindner'
https://www.faz.net/aktuell/politik/ukraine/ukraine-liveticker-selenskyj-treffen-mit-koalition-der-willigen-am-samstag-faz-110172806.html,https://www.faz.net/aktuell/politik/ukraine/ukraine-liveticker-selenskyj-treffen-mit-koalition-der-willigen-am-samstag-faz-110172806.html,0,www.faz.net,Ukraine Liveblog: Selenskyj: Treffen mit „Koalition der Willigen“ am Samstag,Putin rechtfertigt Krieg in der Ukraine +++ Trump und Putin gratulieren einander zum 80. Jahrestags des Kriegsendes 1945 +++ Außenminister Wadephul zu erstem Ukraine-Besuch eingetroffen +++ alle Entwicklungen im Liveblog,https://media1.faz.net/ppmedia/aktuell/politik/2410013317/1.10467489/facebook_teaser/wolodymyr-selenskyj-praesident.jpg,2025-05-09T14:49:12Z,https://web.archive.org/web/20250509161958/https://www.faz.net/aktuell/politik/ukraine/ukraine-liveticker-selenskyj-treffen-mit-koalition-der-willigen-am-samstag-faz-110172806.html,"Präsident Wladimir Putin hat auf dem Roten Platz dem nordkoreanischen General Kim Yong-bok die Hand geschüttelt. Kim Yong-bok führt die nordkoreanischen Truppen, die an der Seite Russlands gegen die … [+1629 chars]",,de,'nan nan'
https://www.n-tv.de/politik/00-38-Von-Putin-erklaerte-dreitaegige-Waffenruhe-beendet--article23143824.html,https://www.n-tv.de/politik/00-38-Von-Putin-erklaerte-dreitaegige-Waffenruhe-beendet--article23143824.html,0,www.n-tv.de,Ukraine-Krieg im Liveticker: +++ 00:38 Von Putin erklärte dreitägige Waffenruhe beendet +++,Lesen Sie alle aktuellen Entwicklungen und Nachrichten über den russischen Angriffskrieg auf die Ukraine im Liveticker von ntv.de.,https://www.n-tv.de/img/incoming/crop25117070/4231326595-cImg_16_9-w1200/Ukraine-Liveticker.jpg,2025-05-09T22:02:00Z,,"Die von Russland erklärte dreitägige Waffenruhe in der Ukraine ist am Sonntag um Mitternacht (Ortszeit, 23.00 Uhr MESZ) zu Ende gegangen. Der russische Präsident Wladimir Putin hatte angesichts der G… [+33339 chars]",,de,'Putin'
https://www.n-tv.de/politik/13-24-Merz-Macron-Starmer-und-Selenskyj-telefonieren-mit-Trump-Waffenruhe-Angebot-an-Kreml--article23143824.html,https://www.n-tv.de/politik/13-24-Merz-Macron-Starmer-und-Selenskyj-telefonieren-mit-Trump-Waffenruhe-Angebot-an-Kreml--article23143824.html,0,www.n-tv.de,"Ukraine-Krieg im Liveticker: +++ 13:24 Merz, Macron, Starmer und Selenskyj telefonieren mit Trump: Waffenruhe-Angebot an Kreml +++",Lesen Sie alle aktuellen Entwicklungen und Nachrichten über den russischen Angriffskrieg auf die Ukraine im Liveticker von ntv.de.,https://www.n-tv.de/img/incoming/crop25117070/4231326595-cImg_16_9-w1200/Ukraine-Liveticker.jpg,2025-05-09T22:02:00Z,,"Der ukrainische Präsident Wolodymyr Selenskyj und die ihn besuchenden Regierungschefs aus Großbritannien, Frankreich, Deutschland und Polen haben ein ""produktives"" Telefongespräch mit US-Präsident Do… [+18411 chars]",,de,'Selenskyj'
https://www.n-tv.de/politik/10-09-Jaeger-Ein-Wort-von-Putin-und-die-Sache-ist-vorbei--article23143824.html,https://www.n-tv.de/politik/10-09-Jaeger-Ein-Wort-von-Putin-und-die-Sache-ist-vorbei--article23143824.html,0,www.n-tv.de,"Ukraine-Krieg im Liveticker: +++ 10:09 Jäger: ""Ein Wort von Putin und die Sache ist vorbei"" +++",Lesen Sie alle aktuellen Entwicklungen und Nachrichten über den russischen Angriffskrieg auf die Ukraine im Liveticker von ntv.de.,https://www.n-tv.de/img/incoming/crop25117070/4231326595-cImg_16_9-w1200/Ukraine-Liveticker.jpg,2025-05-09T22:02:00Z,,"Der neue Bundeskanzler Friedrich Merz reist mit den Staats- und Regierungschefs Frankreichs, Großbritanniens und Polens nach Kiew. Gemeinsam fordern sie eine zumindest vorübergehende Waffenruhe im Uk… [+13082 chars]",,de,'Putin'
https://www.n-tv.de/politik/01-25-Kim-Jong-Un-Kriegsbeteiligung-ist-souveraenes-Recht-unserer-Republik--article23143824.html,https://www.n-tv.de/politik/01-25-Kim-Jong-Un-Kriegsbeteiligung-ist-souveraenes-Recht-unserer-Republik--article23143824.html,0,www.n-tv.de,"Ukraine-Krieg im Liveticker: +++ 01:25 Kim Jong Un: Kriegsbeteiligung ist ""souveränes Recht unserer Republik"" +++",Lesen Sie alle aktuellen Entwicklungen und Nachrichten über den russischen Angriffskrieg auf die Ukraine im Liveticker von ntv.de.,https://www.n-tv.de/img/incoming/crop25117070/4231326595-cImg_16_9-w1200/Ukraine-Liveticker.jpg,2025-05-09T22:02:00Z,https://web.archive.org/web/20250509234840/https://www.n-tv.de/politik/01-25-Kim-Jong-Un-Kriegsbeteiligung-ist-souveraenes-Recht-unserer-Republik--article23143824.html,"Der nordkoreanische Staatschef Kim Jong Un rechtfertigt die Beteiligung Nordkoreas am Krieg zwischen Russland und der Ukraine. ""Unsere Beteiligung an dem Konflikt war gerechtfertigt und fällt unter d… [+6428 chars]",,de,'Kim Jong Un'
https://www.n-tv.de/politik/01-19-Am-15-Mai-in-Istanbul-Putin-schlaegt-direkte-Gespraeche-mit-der-Ukraine-vor--article23143824.html,https://www.n-tv.de/politik/01-19-Am-15-Mai-in-Istanbul-Putin-schlaegt-direkte-Gespraeche-mit-der-Ukraine-vor--article23143824.html,0,www.n-tv.de,Ukraine-Krieg im Liveticker: +++ 01:19 Am 15. Mai in Istanbul: Putin schlägt direkte Gespräche mit der Ukraine vor +++,Lesen Sie alle aktuellen Entwicklungen und Nachrichten über den russischen Angriffskrieg auf die Ukraine im Liveticker von ntv.de.,https://www.n-tv.de/img/incoming/crop25117070/4231326595-cImg_16_9-w1200/Ukraine-Liveticker.jpg,2025-05-09T22:02:00Z,,"Kremlchef Wladimir Putin schlägt direkte Gespräche zwischen Russland und der Ukraine am 15. Mai in Istanbul vor. Russland sei zu ""ernsthaften Verhandlungen ohne Vorbedingungen"" bereit und schlage vor… [+34027 chars]",,de,'Putin'
https://www.n-tv.de/politik/06-57-US-Botschaft-warnt-vor-umfassendem-russischem-Raketenangriff--article23143824.html,https://www.n-tv.de/politik/06-57-US-Botschaft-warnt-vor-umfassendem-russischem-Raketenangriff--article23143824.html,0,www.n-tv.de,Ukraine-Krieg im Liveticker: +++ 06:57 US-Botschaft warnt vor umfassendem russischem Raketenangriff +++,Lesen Sie alle aktuellen Entwicklungen und Nachrichten über den russischen Angriffskrieg auf die Ukraine im Liveticker von ntv.de.,https://www.n-tv.de/img/incoming/crop25117070/4231326595-cImg_16_9-w1200/Ukraine-Liveticker.jpg,2025-05-09T22:02:00Z,https://web.archive.org/web/20250510051715/https://www.n-tv.de/politik/06-57-US-Botschaft-warnt-vor-umfassendem-russischem-Raketenangriff--article23143824.html,"Die US-Botschaft in Kiew hat Informationen über einen potenziell bedeutenden Luftangriff erhalten, der in den nächsten Tagen jederzeit stattfinden könnte. So heißt es in einer Erklärung der Botschaft… [+8900 chars]",,de,'nan nan'
https://www.n-tv.de/politik/15-33-Merz-offen-fuer-Telefongespraech-mit-Putin--article23143824.html,https://www.n-tv.de/politik/15-33-Merz-offen-fuer-Telefongespraech-mit-Putin--article23143824.html,0,www.n-tv.de,Ukraine-Krieg im Liveticker: +++ 15:33 Merz offen für Telefongespräch mit Putin +++,Lesen Sie alle aktuellen Entwicklungen und Nachrichten über den russischen Angriffskrieg auf die Ukraine im Liveticker von ntv.de.,https://www.n-tv.de/img/incoming/crop25117070/4231326595-cImg_16_9-w1200/Ukraine-Liveticker.jpg,2025-05-09T22:02:00Z,,"Merz zeigt sich offen für ein Telefongespräch mit Putin. ""Das ist eine Option, selbstverständlich."" Er würde dies aber nur in Abstimmung mit den europäischen Partnern und den USA tun. ""Dann werden al… [+19660 chars]",,de,'Selenskyj'
https://www.n-tv.de/politik/21-43-Selenskyj-Macron-und-Starmer-ehren-gefallene-ukrainische-Soldaten-an-der-Mauer-der-Erinnerung-in-Kiew--article23143824.html,https://www.n-tv.de/politik/21-43-Selenskyj-Macron-und-Starmer-ehren-gefallene-ukrainische-Soldaten-an-der-Mauer-der-Erinnerung-in-Kiew--article23143824.html,0,www.n-tv.de,"Ukraine-Krieg im Liveticker: +++ 21:43 Selenskyj, Macron und Starmer ehren gefallene ukrainische Soldaten an der ""Mauer der Erinnerung"" in Kiew +++",Lesen Sie alle aktuellen Entwicklungen und Nachrichten über den russischen Angriffskrieg auf die Ukraine im Liveticker von ntv.de.,https://www.n-tv.de/img/incoming/crop25117070/4231326595-cImg_16_9-w1200/Ukraine-Liveticker.jpg,2025-05-09T22:02:00Z,,Bei ihrem Besuch in der ukrainischen Hauptstadt Kiew haben Frankreichs Staatschef Emmanuel Macron und der britische Premierminister Keir Starmer zusammen mit dem ukrainischen Präsidenten Selenskyj Bl… [+30276 chars],,de,'Selenskyj'
https://www.n-tv.de/politik/22-11-Selenskyj-lehnt-Vorschlag-der-USA-einer-entmilitarisierten-Zone-ab-Die-Idee-ist-derzeit-tot--article23143824.html,https://www.n-tv.de/politik/22-11-Selenskyj-lehnt-Vorschlag-der-USA-einer-entmilitarisierten-Zone-ab-Die-Idee-ist-derzeit-tot--article23143824.html,0,www.n-tv.de,"Ukraine-Krieg im Liveticker: +++ 22:11 Selenskyj lehnt Vorschlag der USA einer entmilitarisierten Zone ab: ""Die Idee ist derzeit tot"" +++",Lesen Sie alle aktuellen Entwicklungen und Nachrichten über den russischen Angriffskrieg auf die Ukraine im Liveticker von ntv.de.,https://www.n-tv.de/img/incoming/crop25117070/4231326595-cImg_16_9-w1200/Ukraine-Liveticker.jpg,2025-05-09T22:02:00Z,,"Der ukrainische Staatschef Selenskyj hat bei einer Pressekonferenz mit Macron, Merz, Starmer und Tusk in Kiew die Idee der Einrichtung einer entmilitarisierten Zone im Krieg mit Russland abgelehnt. D… [+32267 chars]",,de,'Selenskyj'
https://www.focus.de/politik/deutschland/ukraine-krieg-merz-mit-macron-und-starmer-auf-dem-weg-nach-kiew_id_260777300.html,https://www.focus.de/politik/deutschland/ukraine-krieg-merz-mit-macron-und-starmer-auf-dem-weg-nach-kiew_id_260777300.html,0,www.focus.de,Merz mit Macron und Starmer auf dem Weg nach Kiew,"Friedrich Merz ist gerade mal drei Tage Kanzler und bricht schon zu einer denkwürdigen, vielleicht historischen Reise auf. Es geht Richtung Osten - und er ist nicht alleine unterwegs.",https://p6.focus.de/img/fotos/id_260776509/merz26.jpg?im=Crop%3D%280%2C188%2C3464%2C1732%29%3BResize%3D%281200%2C627%29&impolicy=perceptual&quality=mediumHigh&hash=387128095a8862830cd082303f49003c838c55e90913625b425e4350ed43f1f5,2025-05-09T22:05:11Z,,"Friedrich Merz ist gerade mal drei Tage Kanzler und bricht schon zu einer denkwürdigen, vielleicht historischen Reise auf. Es geht Richtung Osten - und er ist nicht alleine unterwegs.Bundeskanzler Fr… [+3313 chars]",,de,'Selenskyj'
https://www.zeit.de/news/2025-05/11/putin-schlaegt-kiew-direkte-verhandlungen-am-donnerstag-vor,https://www.zeit.de/news/2025-05/11/putin-schlaegt-kiew-direkte-verhandlungen-am-donnerstag-vor,0,www.zeit.de,Krieg in der Ukraine: Putin schlägt Kiew direkte Verhandlungen am Donnerstag vor,Hier finden Sie Informationen zu dem Thema „Krieg in der Ukraine“. Lesen Sie jetzt „Putin schlägt Kiew direkte Verhandlungen am Donnerstag vor“.,https://img.zeit.de/news/2025-05/11/putin-schlaegt-kiew-direkte-verhandlungen-am-donnerstag-vor-image-group/wide__1300x731,2025-05-10T23:41:17Z,https://web.archive.org/web/20250512050201/https://www.zeit.de/news/2025-05/11/putin-schlaegt-kiew-direkte-verhandlungen-am-donnerstag-vor,Nach dem Ultimatum aus Kiew zu einer Waffenruhe hat der russische Präsident Wladimir Putin der Ukraine die Wiederaufnahme direkter Friedensgespräche im türkischen Istanbul angeboten. Diese sollen ber… [+1225 chars],,de,'Selenskyj'
https://www.faz.net/aktuell/politik/usa-unter-trump/gespraeche-zwischen-putin-und-selenskyj-trump-stellt-teilnahme-in-aussicht-110472683.html,https://www.faz.net/aktuell/politik/usa-unter-trump/gespraeche-zwischen-putin-und-selenskyj-trump-stellt-teilnahme-in-aussicht-110472683.html,0,www.faz.net,Gespräche zwischen Putin und Selenskyj: Trump stellt Teilnahme in Aussicht,"Erst zwang Trump Selenskyj, Gesprächen mit Moskau auch ohne Waffenruhe zuzustimmen. Nun lockt der amerikanische Präsident Putin, indem er in Aussicht stellt, auch nach Istanbul zu kommen.",https://media0.faz.net/ppmedia/aktuell/politik/829655715/1.10472684/facebook_teaser/hinter-seine-genauen-plaene.jpg,2025-05-12T19:48:26Z,http://archive.md/20250512224427/https://www.faz.net/aktuell/politik/usa-unter-trump/gespraeche-zwischen-putin-und-selenskyj-trump-stellt-teilnahme-in-aussicht-110472683.html,"Donald Trump hatte Air Force One Richtung Saudi-Arabien noch nicht bestiegen, da deutete er an, seine Nahostreise in dieser Woche könnte sich womöglich anders gestalten, als ursprünglich geplant. Er … [+4283 chars]",,de,'Selenskyj'
https://www.welt.de/politik/ausland/article256102564/Ukraine-Krieg-Trump-erwaegt-persoenliche-Teilnahme-an-Gespraechen-in-der-Tuerkei-Liveticker.html,https://www.welt.de/politik/ausland/article256102564/Ukraine-Krieg-Trump-erwaegt-persoenliche-Teilnahme-an-Gespraechen-in-der-Tuerkei-Liveticker.html,0,www.welt.de,Trump erwägt persönliche Teilnahme an Gesprächen in der Türkei,"Die europäischen Staaten drängen auf eine Waffenruhe in der Ukraine. „Die Uhr läuft“, heißt es in Berlin. US-Präsident Trump stellt derweil in den Raum, persönlich zu möglichen Gesprächen zwischen Wolodymyr Selenskyj und Wladimir Putin anzureisen. Mehr im Liv…",https://img.welt.de/img/politik/ausland/mobile256106720/1607934167-ci16x9-w1200/U-S-President-Trump-and-U-S-Health-and-Human-Services-HHS-Secretary-Kennedy-attend-a-press-co.jpg,2025-05-12T20:18:00Z,http://archive.md/20250512203040/https://www.welt.de/politik/ausland/article256102564/Ukraine-Krieg-Trump-erwaegt-persoenliche-Teilnahme-an-Gespraechen-in-der-Tuerkei-Liveticker.html,"Die Gespräche für einen Frieden in der Ukraine nehmen wieder Fahrt auf, US-Präsident Donald Trump spricht von einer Woche der Entscheidungen. Selenskyj will zu Gesprächen mit Russland in die Türkei r… [+8090 chars]",,de,'Wladimir Putin'
https://www.n-tv.de/politik/11-41-CDU-Politiker-Hardt-zweifelt-an-Reise-Putins-zu-Verhandlungen-in-Istanbul--article23143824.html,https://www.n-tv.de/politik/11-41-CDU-Politiker-Hardt-zweifelt-an-Reise-Putins-zu-Verhandlungen-in-Istanbul--article23143824.html,0,www.n-tv.de,Ukraine-Krieg im Liveticker: +++ 11:41 CDU-Politiker Hardt zweifelt an Reise Putins zu Verhandlungen in Istanbul +++,Lesen Sie alle aktuellen Entwicklungen und Nachrichten über den russischen Angriffskrieg auf die Ukraine im Liveticker von ntv.de.,https://www.n-tv.de/img/incoming/crop25117070/4231326595-cImg_16_9-w1200/Ukraine-Liveticker.jpg,2025-05-12T22:02:00Z,,"Der CDU-Außenpolitiker Jürgen Hardt geht nicht davon aus, dass es am Donnerstag zu direkten Verhandlungen zwischen den Präsidenten Russlands und der Ukraine, Wladimir Putin und Wolodymyr Selenskyj, i… [+13857 chars]",,de,'Putin'
https://www.n-tv.de/politik/12-47-Kreml-will-sich-nicht-zu-Treffen-mit-Selenskyj-in-Istanbul-aeussern--article23143824.html,https://www.n-tv.de/politik/12-47-Kreml-will-sich-nicht-zu-Treffen-mit-Selenskyj-in-Istanbul-aeussern--article23143824.html,0,www.n-tv.de,Ukraine-Krieg im Liveticker: +++ 12:47 Kreml will sich nicht zu Treffen mit Selenskyj in Istanbul äußern +++,Lesen Sie alle aktuellen Entwicklungen und Nachrichten über den russischen Angriffskrieg auf die Ukraine im Liveticker von ntv.de.,https://www.n-tv.de/img/incoming/crop25117070/4231326595-cImg_16_9-w1200/Ukraine-Liveticker.jpg,2025-05-12T22:02:00Z,,"Der Kreml lehnt es ab, sich zum Vorschlag des ukrainischen Präsidenten Wolodymyr Selenskyj zu einem Treffen mit dem russischen Präsidenten Wladimir Putin bei den anvisierten Gesprächen in Istanbul zu… [+15719 chars]",,de,'Selenskyj'
https://www.n-tv.de/politik/09-28-Ukraine-Russischer-Drohnenangriff-schwaecher-als-zuletzt--article23143824.html,https://www.n-tv.de/politik/09-28-Ukraine-Russischer-Drohnenangriff-schwaecher-als-zuletzt--article23143824.html,0,www.n-tv.de,Ukraine-Krieg im Liveticker: +++ 09:28 Ukraine: Russischer Drohnenangriff schwächer als zuletzt +++,Lesen Sie alle aktuellen Entwicklungen und Nachrichten über den russischen Angriffskrieg auf die Ukraine im Liveticker von ntv.de.,https://www.n-tv.de/img/incoming/crop25117070/4231326595-cImg_16_9-w1200/Ukraine-Liveticker.jpg,2025-05-12T22:02:00Z,,"Russland hat die Ukraine in der Nacht mit deutlich weniger Drohnen als gewöhnlich attackiert. Die russische Armee habe mit zehn Drohnen angegriffen, die alle von der Luftabwehr abgeschossen worden se… [+11720 chars]",,de,'nan Si'
https://www.n-tv.de/politik/17-46-Selenskyj-draengt-auf-Trumps-Teilnahme-an-Istanbul-Gespraechen--article23143824.html,https://www.n-tv.de/politik/17-46-Selenskyj-draengt-auf-Trumps-Teilnahme-an-Istanbul-Gespraechen--article23143824.html,0,www.n-tv.de,Ukraine-Krieg im Liveticker: +++ 17:46 Selenskyj drängt auf Trumps Teilnahme an Istanbul-Gesprächen +++,Lesen Sie alle aktuellen Entwicklungen und Nachrichten über den russischen Angriffskrieg auf die Ukraine im Liveticker von ntv.de.,https://www.n-tv.de/img/incoming/crop25117070/4231326595-cImg_16_9-w1200/Ukraine-Liveticker.jpg,2025-05-12T22:02:00Z,,Der ukrainische Präsident Wolodymyr Selenskyj drängt auf eine Teilnahme von US-Präsident Donald Trump an möglichen Waffenruhe-Gesprächen zwischen Russland und der Ukraine am Donnerstag in der Türkei.… [+23815 chars],,de,'Selenskyj'
https://www.n-tv.de/politik/20-29-Selenskyj-Es-ist-Putins-Krieg-also-muss-er-auch-verhandeln--article23143824.html,https://www.n-tv.de/politik/20-29-Selenskyj-Es-ist-Putins-Krieg-also-muss-er-auch-verhandeln--article23143824.html,0,www.n-tv.de,"Ukraine-Krieg im Liveticker: +++ 20:29 Selenskyj: Es ist Putins Krieg, also muss er auch verhandeln +++",Lesen Sie alle aktuellen Entwicklungen und Nachrichten über den russischen Angriffskrieg auf die Ukraine im Liveticker von ntv.de.,https://www.n-tv.de/img/incoming/crop25117070/4231326595-cImg_16_9-w1200/Ukraine-Liveticker.jpg,2025-05-12T22:02:00Z,,Der ukrainische Präsident Wolodymyr Selenskyj bekräftigt seine Forderung nach einer Teilnahme von Kremlchef Wladimir Putin an den geplanten Verhandlungen über ein Ende des russischen Angriffskriegs. … [+27848 chars],,de,'Selenskyj'
